exp_id	timestamp	specialist	parent_exp	baseline_exp	domain	hypothesis	expected_delta	status	val_bpb	delta_vs_best	artifact_bytes	train_s	eval_s	total_s	job_name	snapshot_path	notes
276	2026-04-22T19:38:38Z	eval	264	267	eval	Add weak L2 anchor (coef 5e-4) on TTT SGD, pulling params back toward pre-TTT snapshot each step: regularizes cross-chunk drift without a hard reset (exp_255: discard) or across-chunk momentum cosine-cool (exp_265: discard).	-0.0003	discard	1.074722	+0.000118	15996871	600.068000	770.932000	1481.000000	apg-eval-0267		Two-site edit in eval_val_ttt (lines ~1312, ~1396). (1) After optimizer creation, snapshot pre-TTT weights into ttt_anchor_states and define ttt_anchor_coef=5e-4. (2) Before clip_grad_norm, add alpha*(p - anchor) to p.grad for each param. Anchor pull magnitude ~5e-4 * drift, so for drift norms ~0.01 (typical early) the added grad is 5e-6 — negligible — rising only when drift grows (late noisy chunks). Clip still upper-bounds combined update. Zero model-byte cost, +1 full param clone in RAM (~72MB bf16, negligible on 80GB GPU). Grad-step math unchanged structurally; compile graph unaffected since anchor math happens outside the compiled forward path.
277	2026-04-22T19:43:05Z	tok	267	267	tok	Add per-vocab input gain (learnable shape=[vocab_size], init=1.0) applied after rms_norm at embedding lookup (NOT at tied head) — breaks tied-embedding symmetry along the vocab axis, orthogonal to exp_267's embed_scale (which breaks it along the feature axis).	-0.0003	size_blocked	1.074768		16008146	600.138000	768.862000	1480.000000	apg-tok-0270		"Three-site edit on exp_267 base: (1) GPT.__init__ declares self.vocab_gain = nn.Parameter(torch.ones(h.vocab_size, dtype=torch.float32)); (2) forward_logits multiplies x by vocab_gain[input_ids].unsqueeze(-1) AFTER rms_norm+embed_scale (pre-norm would be erased since rms_norm normalizes per-token magnitude); (3) Optimizers.__init__ registers vocab_gain in the scalar AdamW group alongside embed_scale. Structurally novel vs prior tok trials: exp_023/249 tried per-vocab additive logit bias (post-softmax input), exp_260 tried per-feature output gain (post-head_proj), exp_190/267 tried per-feature input gain (pre-trunk). No prior trial has applied multiplicative per-vocab gain on the input residual. Mechanism: breaks hard tied-embedding symmetry so decoding uses unmodified tok_emb directions while input absorbs per-token amplitude adjustments — the network learns which tokens should ""speak louder"" in the residual stream without perturbing their output classification directions. Size: 8192 fp32 scalars → numel≤65536 triggers gptq_mixed_quantize passthrough fp16 (16KB raw), mostly-1.0 vector → ~1-2KB brotli-11. Well under 180KB headroom. TTT: vocab_gain auto-included in ttt_params via base_model.parameters(); per-chunk SGD will only gradient rows whose tokens appear in the chunk (sparse updates, natural locality)."
278	2026-04-22T19:46:29Z	arch	267	267	arch	Add per-head attention-OUTPUT gain (o_gain, shape=[num_heads], init=1.0) applied to attention output before proj — symmetric to the existing q_gain input-side scalar that already ships in the 1.0810 SOTA (QK-Gain 5.25). Gives the scalar-AdamW group (low wd, fused Adam) a direct channel to modulate each head's output magnitude, complementing Muon's update on proj's input rows.	-0.0003	size_blocked	1.074949		16000769	600.041000	782.959000	1492.000000	apg-arch-0272		Two-site edit in CausalSelfAttention: (1) __init__ adds self.o_gain = nn.Parameter(torch.ones(num_heads, fp32)); (2) forward multiplies y (shape [B,T,H,D]) by o_gain[None,None,:,None] right after optional XSA, before the [B,T,dim] reshape into proj. Zero-init-preserving (init=1.0 is identity). Routes to scalar AdamW via p.ndim<2 branch (no CONTROL_TENSOR_NAME_PATTERNS edit needed). 88 new fp32 scalars (~352 B raw, scalar-passthrough through compression). exp_074 proposed the same mechanism but harness-aborted without measurement, so this is effectively a first real trial. Distinct from exp_018 (learnable gains on attn_norm/mlp_norm — different site, discarded) and exp_150/235 (V-norm variants — different variable). Mechanism: o_gain operates on the attention output pre-proj, which is a different gradient channel than proj's weights and cannot be exactly absorbed by proj under Muon's specific update dynamics (orthogonal-spectrum, row-normalized, muon_wd=0.095) versus o_gain's scalar-AdamW path (adam_wd=0.005, fused Adam preconditioning).
279	2026-04-22T19:48:09Z	curr	267	267	curr	Replace exp_142's 8-phase latin-square in ShuffledSequenceLoader with a golden-ratio Weyl (Kronecker) low-discrepancy phase sequence: phase_u(j, si) = (j*phi + si*phi^2) mod 1, phi=(sqrt(5)-1)/2. Eliminates the 5-of-13 shard phase collisions per reset-epoch in the 8-phase scheme, gives continuous (not 256-token-grid) phase placement, and fills phase space with O(log j / j) star-discrepancy.	-0.0001	discard	1.077376	+0.002772	15993470	600.123000	759.877000	1471.000000	apg-curr-0272		Single hot-path change in ShuffledSequenceLoader.__init__ + _reset_shard. Removed _base / _phase_order tables; added self._phi, self._phi_sq. Kept the rng.permutation(8) draw to preserve downstream sequence_order RNG parity with exp_142 baseline (so ONLY the phase schedule changes, not the within-shard permutations). Phase_u in [0,1) scaled to [0, max_phase]; for shard si=0 at epoch j=0 still starts at phase 0 (same as 1/8 of the prior scheme). Over ~1 epoch/shard, 13 shards on rank-0 get phases {0*phi_sq, 1*phi_sq, ..., 12*phi_sq} mod 1 — all distinct by irrationality, spread uniformly (Weyl spacing). Per-rank RNG still seeded by h.rank, so cross-rank anti-correlation is maintained. Zero added params/bytes; tiny arithmetic change in the _reset_shard hot path (one float mul+mod vs one int mul+div).
280	2026-04-22T19:49:14Z	quant	267	267	quant	Replace flat additive Hessian damping (0.02·mean(diag)) with signal-proportional multiplicative damping (H_ii *= 1.02): preserves column-conditioning structure and specifically raises Hinv[j,j] on high-activation 'sink' columns, which reduces GPTQ error-propagation magnitude where it matters most.	-0.0003	keep	1.074550	-0.000054	15999837	600.124000	762.876000	1472.000000	apg-quan-0274	snapshots/280_quant	Single 1-line structural change at gptq_quantize_weight line ~1019. OLD: damp=0.02*H.diag().mean(); H.diagonal().add_(damp) (flat ridge, damping >> H_ii on weak columns, << H_ii on strong columns). NEW: H.diagonal().mul_(1.02) (proportional, damping scales with column energy). Keeps the proven 0.02 magnitude from exp_212's sweep. Unexplored direction: damping SHAPE not magnitude. Zero size cost. Mechanism: GPTQ error propagation per column = Err/Hinv[j,j]; strong columns have the smallest Hinv[j,j] (biggest error spread) and benefit most from proportional regularization. Flat damping barely touches them (0.02*mean << H_ii for outliers). Dead-column handling (H[dead,dead]=1 before damping) preserved. Baseline: exp_267 (damp=0.02, block_size=64).
281	2026-04-22T19:51:47Z	loss	267	280	loss	Multi-token-prediction auxiliary CE (DeepSeek-V3 style, α=0.1) reusing the tied output head: at each position t, the same logits are scored against target[t+1] as a 0.1-weighted aux term on top of the main next-token CE. Zero bytes / zero params / train-only (reuses tied tok_emb head, no new projection). Structurally orthogonal to the saturated position-weighted, rare-token, focal, label-smoothing, and entropy-bonus families.	-0.001	size_blocked	1.102908		16002761	600.057000	787.943000	1501.000000	apg-loss-0274		Single-site edit in GPT.forward. Two F.cross_entropy calls: main over [B*T, V] vs target_ids, aux over [B*(T-1), V] = logits[:, :-1, :] vs target_ids[:, 1:]. Return main_ce + 0.1 * aux_ce. Cost: one extra log_softmax on a slightly-smaller tensor ~2.5% extra train FLOPs; well inside 600s budget. Mechanism: the shared hidden state is forced to encode both the immediate next token AND 1-step-ahead info, which should produce richer long-context-calibrated representations at inference time. Prior MTP evidence comes from DeepSeek-V3 (7.2% MMLU bump); at 36M params on FineWeb the effect is uncertain but the signal source is genuinely new for this tree. α=0.1 is conservative (DSv3 uses ~0.3) to avoid deforming the main CE too much — can sweep later if kept. Crash risk low: standard F.cross_entropy ops, no bincount/compile hazards. Size risk zero (no new tensors).
282	2026-04-22T19:52:45Z	opt	267	280	opt	Decouple Muon momentum warmdown-end from warmup-start: add muon_momentum_warmdown_end=0.85 (vs the previous implicit 0.92) so during the 72% warmdown phase, momentum cools 0.99→0.85 instead of 0.99→0.92; extends exp_010's cool-during-warmdown trajectory by another 7 pts, making end-of-run low-LR updates behave more like fine-tune SGD with less stale-direction carryover.	-0.0003	size_blocked	1.076445		16000393	600.124000	751.876000	1457.000000	apg-opt-0274		Two-site edit. (1) Hyperparameters: add muon_momentum_warmdown_end = 0.85 (new env MUON_MOMENTUM_WARMDOWN_END). (2) step_fn's warmdown cool line: lr_scale*mom + (1-lr_scale)*muon_momentum_warmdown_end instead of warmup_start. Zero new parameters, zero bytes, zero extra compute — pure scalar decoupling. Rationale: warmup_start=0.92 was playing two structurally different roles (pre-buffer-trust vs post-buffer-stale). Warmdown-end target can be lower than warmup-start without altering the ramp-up behavior; acts to shed stale peak-LR gradient direction as LR→0. exp_010 proved cooling direction is correct (−0.000109); this pushes it further along the same axis.
283	2026-04-22T19:53:18Z	reg	267	280	reg	Target-decay on scalar AdamW group: replace decoupled WD's pull-toward-0 with pull-toward-init for q_gain (5.25), attn_scale/mlp_scale/resid_mix[0]/skip_weights/embed_scale (1.0), and zero-init resid_mix[1]/skip_gates (0.0) — preserves exp_177's proven stabilizing drag (adam_wd=0.005) while redirecting it to each param's meaningful attractor.	-0.0005	discard	1.074614	+0.000064	15996773	600.107000	757.893000	1467.000000	apg-reg-0275		"Structural split from the saturated muon_wd/attn-dropout/activation-noise knob-tweaking (exp_040/050/129/155/173/187/198/208/228/248/257/271 all discard). Mechanism: AdamW's decoupled ""p *= 1 - lr*wd"" pulls every scalar toward 0 at rate lr*wd=1e-4/step, causing ~10% drift over 5000 steps on ones-init gains. exp_177 keep (wd 0.02→0.005) narrowed the drag; exp_257 discard (wd→0) removed the stabilizer entirely. This keeps magnitude identical but shifts attractor to param's init value. Three-site edit in Optimizers: (1) store _scalar_target_decay_pairs = [(p, p.detach().clone()) for p in scalar_params] before building optimizer_scalar; (2) disable built-in WD (weight_decay=0.0 on scalar AdamW); (3) after all opt.step() calls, pull p → p_init by coef=group_lr*adam_wd, which exactly replicates the WD magnitude schedule through warmdown. Zero new params, zero state_dict bytes (plain Python list of clones). Targets are FP32 copies held by Optimizers instance only."
284	2026-04-22T19:56:23Z	meta	267	280	meta	Widen Muon momentum ramp on its untested side: muon_momentum_warmup_start 0.92→0.90 (symmetric opposite of exp_015's failed 0.92→0.94 narrowing, re-probed under the current post-exp_088 fast-ramp regime).	-0.0002	discard	1.075351	+0.000801	15995412	600.097000	763.903000	1480.000000	apg-meta-0275		"Single-literal edit at train_gpt.py:152 (MUON_MOMENTUM_WARMUP_START default 0.92→0.90). Zero code-byte delta, zero model-bytes delta, zero compile/topology impact — it's an initial-value scalar for the Muon momentum ramp only. Recent meta history has probed most adjacent knobs: matrix_lr ±9% (both fail), grad_clip_norm ±33% (both fail), ema_decay ±narrowing/widening (both fail), tied_embed_lr, beta1 — all failed on current baseline. muon_momentum_warmup_start has only ONE prior probe (exp_015: 0.92→0.94 on an OLD baseline with muon_momentum_warmup_fraction=0.33), which failed by narrowing the ramp. The mirror-image widening (0.90 start) is genuinely untested under today's 0.22 fast-ramp regime: exp_088's tightening of warmup_fraction 0.33→0.22 made each momentum increment coarser (Δ_step ≈ +0.01/step vs +0.007/step prior), so a lower start densifies the traversal by ~14% (9 steps vs 7 steps over a ramp that now takes ~22% of training). Mechanism: early warmup sees gradients that are most informative about loss-landscape structure (pre-minima-basin entry); lower starting momentum = fresher gradient signal = better landscape probe. Risks: (a) 0.90 is slightly further from ""typical Muon"" ~0.95 than 0.92, so if exp_015's failure was directionally agnostic, this could regress symmetrically; (b) 0.92 may already be tuned. Expected delta −0.0002; acceptable outcome is any small signed signal that clarifies the direction of the muon_momentum_warmup_start optimum relative to the current 0.92 setting."
285	2026-04-22T20:05:39Z	ttt	267	280	ttt	Shrink TTT training micro-batch from 32 to 2 in eval_val_ttt, doubling SGD steps per chunk (4 to 8) and making exp_264 alternating fwd/rev actually permute.	-0.00025	eval_budget_overrun	1.076870			600.148000	785.852000	1498.000000	apg-ttt-0277		TTT rank-4 bottleneck: my_chunk_seqs ~32/8=4 per rank, batch_seqs=32 gives range(0,4,32)=[0] so only 1 SGD step per epoch per rank (4 per chunk * 150 chunks = 600 total). micro_bs=2 splits into batch_range=[0,2] giving 2 steps/epoch = 8/chunk = 1200 total. Momentum 0.9 absorbs 2x variance from smaller batches. Forward/backward count unchanged; only optimizer.step and all_reduce double per chunk.
286	2026-04-22T20:08:09Z	arch	267	280	arch	Sandwich normalisation: RMSNorm the attn and MLP branch OUTPUTS (before attn_scale/mlp_scale) on top of the existing pre-norm inputs — direction-preserving output-magnitude discipline for the effective-depth-17 recurrent residual stream.	-0.0008	crash				600.141000	231.859000	943.000000	apg-arch-0281		Parameterless, single-site edit in Block.forward. For the serial path: rms_norm(attn_out) before attn_scale*, and rms_norm(mlp_out) before mlp_scale*. Same pattern for the parallel-residual path. Init-safe via proj._zero_init → 0 → F.rms_norm(0,eps)=0 so step-0 matches baseline exactly. attn_scale/mlp_scale (per-dim learnable, AdamW group) absorb the removed per-token magnitude variance. Distinct from exp_245's ln_scale/sqrt(3) which damps loop-block INPUTS; sandwich-norm damps OUTPUTS and applies to every block uniformly. Zero-byte cost by construction. The stronger-than-usual effective depth (11 layers × 3 loop passes ≈ 17) is exactly the regime sandwich-norm was introduced for (CogView, Primer) — Pre-LN-only transformers in this regime tend to grow residual-stream variance across layers, forcing attn_scale/mlp_scale to compensate magnitude rather than shape. Offloading magnitude control to a free norm frees those learnable scales to address directional structure. | torch.distributed.elastic.multiprocessing.errors.ChildFailedError: ============================================================ (train_gpt.py:1038 in gptq_quantize_weight)
287	2026-04-22T20:11:29Z	eval	exp_267	280	eval	Intra-chunk linear LR warmup across TTT epochs: ep0 at 0.5*cos_lr → ep3 at 1.0*cos_lr (avg 0.75*cos_lr). Lets SGD momentum carried from previous chunk re-align with new chunk's gradient direction before the larger refinement steps.	-0.0002	discard	1.075276	+0.000726	15993841	600.024000	763.976000	1475.000000	apg-eval-0278		"Single-site edit at the top of the `for _ep in range(h.ttt_epochs)` loop in eval_val_ttt (line ~1374). Computes ep_lr = cos_lr * (0.5 + 0.5 * _ep / (h.ttt_epochs - 1)) and rewrites optimizer.param_groups[""lr""]. Orthogonal axis to exp_275 (INTER-chunk LR floor, discard) — this is INTRA-chunk ramp, operating within each chunk's 4 SGD steps. Rationale: SGD momentum state persists across chunks (optimizer is reused); chunk ci starts with residual momentum pointing along chunk-(ci-1)'s grad direction, which may be mis-aligned with the new chunk's content. A soft first epoch (0.5*cos_lr) prevents wasted displacement; later epochs (0.83*, 1.0*) refine with the realigned momentum. Preserves the existing fwd/rev alternation (exp_264) and anchor (exp_276 — still in code, unchanged). Zero artifact-byte impact (pure eval-loop logic). Risk: reduces total effective TTT motion per chunk by 25%; if current adaptation was already under-aggressive, could slightly underfit."
288	2026-04-22T20:12:55Z	tok	267	280	tok	Add learnable per-feature embed_bias (shape=[embedding_dim], init=0.0) as the additive companion to exp_267's embed_scale — completes the post-tok_emb pipeline into full affine-LayerNorm form (rms_norm × scale + bias), letting the residual-skip anchor x0 carry a learned absolute-feature offset that survives the first block's pre-norm.	-0.00015	size_blocked	1.075977		16001498	600.130000	781.870000	1490.000000	apg-tok-0279		Three-site edit on exp_267 base: (1) GPT.__init__ adds self.embed_bias = nn.Parameter(torch.zeros(h.embedding_dim, dtype=torch.float32)) right after embed_scale; (2) forward_logits appends + self.embed_bias.to(x.dtype) to the existing rms_norm * embed_scale line; (3) optimizer registration appends embed_bias to scalar_params (same AdamW group as embed_scale, scalar_lr=0.02, adam_wd=0.005). Rationale: embed_scale already breaks tied-embedding feature-axis symmetry multiplicatively (exp_190/exp_267 proven). A per-feature additive bias is the structurally distinct offset counterpart. Step-0 no-op (init=0) so zero regression risk at the baseline. First block's pre-RMSNorm on the transformer path wipes the bias magnitude, but the decoder mixes the raw embedding x0 via skip_weights/skip_gates — the bias therefore acts as a persistent absolute-feature anchor the decoder can consume. Distinct from exp_260 output_gain (post-head) and exp_277 vocab_gain (per-vocab, 8192 × fp32 → size_blocked). Size impact: 512 fp32 scalars = 2 KB raw, scalar passthrough; well inside the 180 KB headroom. Expected delta smaller than embed_scale's (-0.000463) since bias starts at zero, but cheap novelty in a depleted tok search direction.
289	2026-04-22T20:19:14Z	curr	267	280	curr	Deranged per-shard phase assignment: replace exp_142's 8-phase latin-square (with K=13 shards per rank, has ~99% prob of same-phase collisions) with a K-bucket derangement - each shard gets a UNIQUE phase index in [0..K-1], spacing shard-starting-offsets at 2048/K=158-token granularity and eliminating within-rank phase duplication.	-0.00005	discard	1.075950	+0.001400	15998893	600.033000	752.967000	1463.000000	apg-curr-0284		Single structural edit in ShuffledSequenceLoader (init + _reset_shard). Motivation: exp_142 (8-phase LS) left phase collisions to chance; with K=13 shards/rank vs 8 buckets, ~5 shards share phases per epoch. exp_279 (Weyl, continuous) overshot to infinite phases and lost the discrete structure (hurt +0.002772). This keeps discrete-uniform latin structure but grows buckets from 8 to K (~13), giving finer granularity AND zero within-rank collisions. Since each shard resets at most once in a 600s run, within-shard phase cycling is effectively a no-op; dropping the %8 cyclic index is functionally harmless. Zero size impact.
290	2026-04-22T20:20:40Z	quant	280	280	quant	Progressive tail-damping in GPTQ: apply linear 1.0→1.02 multiplicative ramp on H.diagonal in processing order (after permutation), on top of exp_280's uniform 1.02 pre-perm damping — later columns accumulate GPTQ error and their Cholesky diagonal d=Hinv[j,j] amplifies err=(w-q·s)/d, so extra damping only at the tail tames amplification without over-damping well-conditioned early columns.	-0.00015	discard	1.074835	+0.000285	15995699	600.085000	760.915000	1473.000000	apg-quan-0284		Single-site edit in gptq_quantize_weight right after H = H[perm][:, perm], before Cholesky. Insert: H.diagonal().mul_(torch.linspace(1.0, 1.02, cols, dtype=H.dtype)). Zero byte overhead (no new metadata, same Q dtype, same per-row fp16 scales). Novel axis in-tree: all prior damping experiments (exp_016 0.01→0.003, exp_212 0.01→0.02, exp_270 0.02→0.03, exp_280 additive→multiplicative *=1.02) used uniform damping across all columns. This is the first position-dependent damping — applied in GPTQ processing order so later columns (low H.diag post-descending sort) get additional damping precisely where error accumulation and Hinv[j,j] amplification are largest. Complements exp_280 rather than replacing it. Expected small gain (~-0.00015) since the ramp is conservative; if it keeps, follow-ups can try steeper ramps or nonlinear (e.g., quadratic) profiles.
291	2026-04-22T20:21:19Z	loss	280	280	loss	Replace plain CE with mean-preserving focal CE (γ=0.5): weight each token by (1-p_t)^0.5 / mean((1-p_t)^0.5), detached. Confidence-conditioned per-token reweighting is structurally orthogonal to prior position-weighted / rare-token / z-loss attempts; redirects gradient mass from saturated easy tokens to hard tokens without changing overall loss magnitude at init.	-0.0008	size_blocked	1.077423		16000367	600.091000	770.909000	1485.000000	apg-loss-0284		Single-site edit in GPT.forward. reduction='none' CE → detached focal weight (1-exp(-nll))^0.5, mean-normalized → (nll*w).mean(). Zero bytes, zero new params, train-only. At init (uniform softmax, p_t≈1/V) w≈1 → identical to plain CE, so LR schedule stays valid. As training progresses, easy tokens (high p_t) get weighted ~0.4–0.6× mean while hard tokens (low p_t) get ~1.1–1.4× — spread comparable to exp_186's convex position ramp but confidence-conditioned instead of position-conditioned. γ=0.5 is the canonical focal-loss value; gentle enough that the detached weight stays ~O(1). No graph breaks expected under torch.compile (detach + pow + exp are all supported ops).
