exp_id	timestamp	specialist	parent_exp	baseline_exp	domain	hypothesis	expected_delta	status	val_bpb	delta_vs_best	artifact_bytes	train_s	eval_s	total_s	job_name	snapshot_path	notes
448	2026-04-23T06:19:12Z	eval	377	377	eval	Skip TTT SGD training on the FIRST chunk (in addition to the already-skipped last chunk): chunk 0 runs un-adapted post-GPTQ model so gradients × max cos_lr=1.0 × Nesterov@0.9 × 5 epochs pollute the momentum buffer carried into every subsequent chunk. Symmetric to existing last-chunk skip; untried axis.	-0.0002	eval_budget_overrun	1.076884			600.073000	603.200000	1494.000000	apg-eval-0442		Single logical change at eval_val_ttt chunk-loop gate (~L1402): extended the training-skip from `not is_last_chunk` to `not is_last_chunk and not is_first_chunk`. Scoring pass unchanged (chunk 0 still scored with raw post-GPTQ model; legal). Distinct from exp_255 (per-chunk buffer reset, discard), exp_311 (chunk-0 reorder to end, still trained, discard), and exp_276 (L2 anchor, discard). cos_lr at ci=1 ~ 0.97 ttt_lr so first actually-trained chunk is still near-peak LR, not starved.
449	2026-04-23T06:19:49Z	loss	377	377	loss	Mean-preserving ANTI-FOCAL CE (w_t = p_t^0.25 detached, renormalized to mean=1): direct inverse of exp_439's failed focal sharpening — downweights inherently-unpredictable hard tokens, upweights context-predictable ones, LR-magnitude-neutral	-0.0003	size_blocked	1.178578		16001313	600.074000	587.200000	1497.000000	apg-loss-0444		Single-site edit in GPT.forward replaces exp_439's body. Replaces `w = (1-p_t).pow(0.25)` with `w = p_t.detach().pow(0.25); w = w/w.mean()`. With V=8192 log(V)=9.01 nats, a nontrivial fraction of val tokens are information-theoretically unpredictable at 35.9M params (names, URLs, IDs). Focal upweighted those; anti-focal downweights them. Mean-preserve via /w.mean() keeps sum(w)=N so effective LR matches exp_377 baseline — isolates the redirection effect from any implicit LR change. p_t.detach() avoids second-order gradient path through the weight. Eval path (val_bpb + TTT scoring) is untouched; bpb still uses plain CE.
450	2026-04-23T06:22:57Z	quant	377	377	quant	Hessian-weighted row scale in GPTQ: replace uniform W.std(dim=1) with sqrt(sum_j W_rj^2 * H_jj / sum_j H_jj) so per-row SDClip reference aligns with loss curvature — rows whose weights fall on high-activation columns get a larger scale (less outlier clipping where GPTQ error propagation concentrates).	-0.0003	size_blocked	1.073985		16348394	600.144000	579.200000	1479.000000	apg-quan-0445		Surgical edit in gptq_quantize_weight just after H.diagonal().mul_(1.01) (new lines 1044-1046). Replaces scalar `W_orig.std(dim=1)` with H.diag-weighted row RMS, zero artifact bytes (same 1 scale per row), zero extra eval-time ops of note (one row-weighted sum). Distinct from exp_045 (post-Q closed-form scale refinement, size_blocked): this changes the pre-quantization scale heuristic itself. Distinct from exp_339/exp_434 (token-position-weighted calibration): this reweights by Hessian-diag, not context position. Risk: clip_sigmas=12.85 was tuned vs uniform std; for typical transformers rms_H / rms_uniform ~ 1 so it should transfer, but if the ratio shifts the effective clip level drifts. Single contiguous block, easy rollback.
451	2026-04-23T06:26:01Z	opt	377	377	opt	"Concave (sqrt-shape) Muon momentum warmup ramp: replace linear interpolation (1-frac_mm)*0.92+frac_mm*0.99 with sqrt(frac_mm)-shaped blend — same endpoints, reaches high momentum faster (0.955 at frac_mm=0.25 vs 0.9375 linear; 0.9695 at frac_mm=0.5 vs 0.955 linear); extends exp_088's proven ""reach peak momentum earlier"" via ramp SHAPE (orthogonal axis to duration, never probed)."	-0.00020	size_blocked	1.074712		16004205	600.086000	576.100000	1472.000000	apg-opt-0447		Single-site edit in step_fn (~line 1491-1502): replace `muon_momentum = (1-frac_mm)*h.muon_momentum_warmup_start + frac_mm*h.muon_momentum` with sqrt-shaped interpolation. Zero new hparams, zero bytes, zero params, zero compute overhead. Ramp duration (muon_momentum_warmup_fraction=0.22) and endpoints (0.92, 0.99) untouched. Axis map: exp_088 kept ramp_fraction 0.22 (faster peak); exp_383 discard 0.15 (too fast); exp_029 abort 0.45 (too slow). All priors modified DURATION; ramp SHAPE is genuinely untested. Concave direction aligns with exp_088's proven signal. Size risk negligible — warmup phase (frac<0.22) only, weight-trajectory drift bounded by (peak-warmup_start)=0.07 momentum delta × 22% budget << exp_314's sqrt-warmdown drift which size_blocked at 0.74. Rebased from workdir's stale exp_441 snapshot to exp_377 first.
452	2026-04-23T06:26:20Z	reg	377	377	reg	Lower adam_wd 0.005 → 0.002 (-60%) on scalar AdamW group — probes untested midpoint between exp_177's kept 0.02→0.005 and exp_257's discarded 0.005→0.0. Softens the disproportionate pull on q_gain (init=5.25, ~5.25× the decay magnitude of init=1.0 scalars) while retaining anti-drift pressure that 0.0 loses.	-0.0001	size_blocked	1.074541		16000913	600.005000	571.700000	1472.000000	apg-reg-0447		Single-literal edit at line 165 (ADAM_WD default 0.005→0.002). Zero code-byte inflation, zero param count change, no graph topology change. Not harness-injected -- h.adam_wd flows into the scalar AdamW group at line 934. Targets the untested 0.005→0.002 region (exp_444's q_gain WD=0 split hit size_blocked; this gets the same qualitative relief via global softening with no param-group restructuring).
453	2026-04-23T06:26:23Z	tok	377	377	tok	Raise tied_embed_init_std 0.006 → 0.008 (+33%): untested interpolated value between current 0.006 (keep) and 0.02 (size_blocked exp_011); tests whether larger tied-embedding init magnitude helps vs prior 0.003→discard (+0.000526).	-0.0001	size_blocked	1.076075		16011687	600.131000	572.900000	1475.000000	apg-tok-0447		Single-literal edit at train_gpt.py line 147 (TIED_EMBED_INIT_STD default 0.006→0.008). Zero code-byte / zero parameter / zero structural change; init-magnitude probe only. Prior tied_embed_init_std data: 0.003 (exp_038, discard +0.000526), 0.005 (original baseline), 0.006 (current), 0.02 (exp_011, size_blocked). Going UP to 0.008 is the only untested nearby value and avoids the known size-block boundary at 0.02. Mechanism: larger init gives sharper initial softmax (rows have larger L2 norm ≈ 0.008·sqrt(512)=0.181 vs 0.136), potentially improving early-training rare-token gradient signal through the tied head; may also reduce logit under-saturation during first ~50 steps before weights specialize. Risk: (a) possible compression drift at quant time if post-training magnitudes scale with init (low-risk since thousands of grad steps overwhelm init); (b) sharper init softmax could amplify grad through the tight grad_clip_norm=0.3, very mildly slowing early learning. Size budget: current artifact ~15.82MB, headroom ~180KB; init scale unlikely to shift compressed bytes by more than ~10KB either way. Related discarded init variants: trunc_normal_ at ±2σ (exp_412, discard +0.001385), orthogonal (exp_389, discard +0.001719), semi-orthogonal (exp_350, discard +0.001544), equi-row-norm (exp_019, discard). This probe is structurally distinct — same normal_ distribution family, single scalar scale shift only.
454	2026-04-23T06:26:41Z	ttt	377	377	ttt	Raise TTT_LR 0.005 to 0.0055 (+10%): untested UP direction on TTT peak LR; symmetric probe to exp_416 (0.0045, dBPB=+0.000176). Both downward moves regressed monotonically, suggesting LR minimum may lie above 0.005.	-0.0002	discard	1.074603	+0.000516	15999264	600.028000	582.100000	1481.000000	apg-ttt-0447		Single-literal edit at train_gpt.py:183 (TTT_LR default 0.005 to 0.0055). TTT_LR is NOT injected by run_trial.sh per INIT.md. Linear extrapolation from exp_372 (-20%:+0.000385) and exp_416 (-10%:+0.000176) suggests dBPB approx -0.0002 at LR=0.0055. Grad_clip=1.0 caps Nesterov lookahead overshoot.
455	2026-04-23T06:30:24Z	arch	377	377	arch	All-sequential residuals: parallel_residual_start 7 to 11 so every block uses sequential x->attn->mlp path.	-0.0002	size_blocked	1.076064		16005502	600.103000	578.400000	1476.000000	apg-arch-0447		
456	2026-04-23T06:31:51Z	curr	377	377	curr	Coordinate phase_order across shards: replace per-shard independent rng.permutation(8) with a SINGLE random permutation rotated by shard-index, so the first-epoch phase of the first 8 shards per rank covers all 8 buckets deterministically (fixes coupon-collector shortfall: independent perms leave ~1.6/8 buckets uncovered per rank in 600s where only ~1 phase-epoch/shard happens).	-0.00008	discard	1.075602	+0.001515	15999672	600.018000	576.000000	1476.000000	apg-curr-0447		Single-site edit in ShuffledSequenceLoader.__init__ (~line 367). Changes `[self.rng.permutation(8).tolist() for _ in self.files]` → one rng.permutation(8) shared, then shard si gets rotation [(k+si)%8 for k in 8]. Motivation: with 12 shards/rank and ~1 phase-epoch/shard in 600s budget, independent random perms have E[#buckets covered]≈6.4/8 (~20% gap). Coordinated rotation guarantees 8/8 coverage in the first 8 shards. Distinct from exp_446 which used a FIXED VDC sequence [0,4,2,6,1,5,3,7] (deterministic base, size_blocked); this keeps per-rank randomness via rng.permutation, so compression expectation is neutral. Still keeps 3-bit discrete phase (exp_436's 11-bit continuous was +0.0015). Risk: small trajectory change could swing post-GPTQ bytes either way like exp_446 did.
457	2026-04-23T06:49:42Z	loss	377	377	loss	Steeper position-weighted CE: linspace(0.5,1.5,T) mean-preserving (3× amplitude of exp_156's proven 0.9→1.1). Aligns training grad with eval's late-context regime; prior linear>convex (156>186) so pushing the linear amplitude is the directed next step on this axis. exp_034 proposed this but harness-aborted before running — untested.	-0.0003	size_blocked	1.075735		16000532	600.114000	575.300000	1483.000000	apg-loss-0451		Two-site edit in GPT.forward replacing plain mean CE with per-position weighted CE. linspace(0.5,1.5,T) has mean exactly 1.0 for any T≥2 so mean-preservation is automatic; .mean().clamp_min() kept as float safeguard. No new params, no inference cost, no env var. Risk: steeper amplitude may overshoot and hurt instead of help (exp_156's 0.9→1.1 kept, exp_186's weaker convex kept smaller; trend favors steeper linear but 3× is a big jump).
458	2026-04-23T06:52:19Z	quant	377	377	quant	Magnitude-preserving Hessian-weighted row scale: same H.diag-weighted shape as exp_450 but per-matrix rescaled to match W.std(dim=1).mean(), salvaging exp_450's bpb win (1.073985) while keeping Q-code entropy / brotli artifact size at baseline.	-0.0001	size_blocked	1.074746		16030625	600.038000	574.700000	1471.000000	apg-quan-0454		Follow-up to exp_450 (size_blocked, 16.35 MB, val_bpb 1.073985 < 1.074087). Pure H-weighted rms shrank scales on average (model puts small W on high-H sinks), widening Q-code range → brotli blowup. This edit keeps the per-row H-weighted shape but rescales each matrix so mean(row_std) == mean(uniform row_std). Shape captures the bpb benefit (relative scaling between rows — high-H rows get larger scale, less clipping); magnitude preservation keeps entropy / compressed size at baseline. Single 2-line rescale after H-weighted rms compute. Risk: if the bpb gain came from the *magnitude* not the *shape*, this edit neutralizes the win. But the relative scaling IS the GPTQ-principled piece; the magnitude shift was an accidental clip_sigmas detune.
459	2026-04-23T06:52:43Z	meta	377	377	meta	Raise WARMDOWN_FRAC 0.72 → 0.78 (+8.3%): untested UP direction on a knob where both prior DOWN probes (exp_148 0.60 discard, exp_220 0.65 discard) hurt. Extends the smooth LR-decay tail that EMA integrates over — complements exp_003's kept EMA_DECAY widening and exp_324's kept warmdown-momentum-floor preservation (deepest-training phase proven beneficial).	-0.0003	size_blocked	1.074311		16001678	600.146000	582.300000	1481.000000	apg-meta-0455		"Single-literal default change at train_gpt.py:108 (WARMDOWN_FRAC 0.72 → 0.78). Not harness-injected — verified no `export WARMDOWN_FRAC` in run_trial.sh. Flows through h.warmdown_frac into get_lr() at ~L1466-1469 where lr_scale = (1-frac)/h.warmdown_frac during the warmdown phase. Shrinks peak-LR window 28%→22% of budget; extends warmdown 72%→78%. Rationale: both DOWN directions (0.60, 0.65) already failed; symmetric UP is the only untested side. EMA_DECAY is at 0.9965 (exp_377) — the mechanism of exp_003's kept 0.9965→0.998 ""widen avg window into warmdown tail"" suggests a longer tail is inherently valuable. Zero bytes cost, zero compute cost."
460	2026-04-23T06:53:06Z	eval	377	377	eval	"Raise TTT base learning rate 0.005 → 0.0055 (+10%): UP direction on TTT LR axis never validated — exp_073 (+30%) harness_abort never ran, exp_372 (−20%) discarded +0.000301. Mild +10% probe stays within the proven ""more adaptation"" regime (exp_014/017 epochs kept)."	-0.00015	size_blocked	1.074665		16000404	600.130000	574.500000	1476.000000	apg-eval-0455		Single-literal default change at train_gpt.py:183 (TTT_LR 0.005→0.0055). ttt_lr flows into torch.optim.SGD(lr=h.ttt_lr, momentum=0.9, nesterov=True) and into the per-chunk cos_lr schedule cos_lr = h.ttt_lr * 0.5 * (1 + cos(π*ci/(N-1))), so peak cos_lr scales with this literal, cosine shape unchanged. Step-magnitude axes walked: epochs 3→4 (exp_014/017 keep), momentum 0.9→0.95 UP (exp_039 discard), ttt_lr 0.005→0.004 DOWN (exp_372 discard +0.000301), grad_clip 1.0→0.5 DOWN (exp_180 near-tie), grad_clip 1.0→2.0 UP (exp_101 eval_budget_overrun) — UP on ttt_lr itself is the only untested step-magnitude direction that doesn't already fail. Zero byte growth, zero compute change (same SGD step count). Risk: Nesterov lookahead amplifies effective step; +10% is a gentle probe. If successful points to +5% refinement; if discard points to LR being already-optimal at 0.005.
461	2026-04-23T06:54:46Z	opt	377	377	opt	Linearly tighten grad_clip_norm 0.3 → 0.2 during warmdown (only active when lr_scale<1): rejects outlier gradient directions more aggressively in the low-SNR tail, philosophically aligned with exp_324's momentum-floor keep. Peak/warmup regime unchanged.	-0.0002	size_blocked	1.074795		16002245	600.028000	569.800000	1467.000000	apg-opt-0455		Single-site edit in step_fn (~L1518-1519). Replace fixed `clip_grad_norm_(..., h.grad_clip_norm)` with `active_clip = 0.2 + (h.grad_clip_norm - 0.2) * lr_scale; clip_grad_norm_(..., active_clip)`. At lr_scale=1 (warmup/peak) clip stays 0.3; at lr_scale=0 (end of warmdown) clip=0.2. Linear ramp only during warmdown's 72% window. Rationale: late-training outlier grads are relatively larger (SNR drops), EMA already damps averaged direction, so aggressive clip protects final averaged weights. exp_036 tried cosine-anneal grad_clip but was harness_abort (never landed); this is a simpler linear variant. Orthogonal to exp_324's momentum floor — momentum scheduling controls direction averaging, clip scheduling controls outlier rejection.
462	2026-04-23T06:56:56Z	reg	377	377	reg	Split zero-init output projections (attn.proj + mlp.proj) into a 3rd Muon WD group at muon_wd_proj=0.125 — untested UP direction mirroring exp_406's failed LOWER (0.060 → +0.003). 0.125 matches exp_164's proven MLP value, applied specifically to residual-stream-writing projections.	-0.0003	discard	1.074315	+0.000228	15999547	600.061000	575.000000	1475.000000	apg-reg-0456		Three-site edit. (1) Hyperparameters line 173: new muon_wd_proj=0.125. (2) Optimizers.__init__ classification: `.proj.` catches both attn.proj.weight and mlp.proj.weight before falling through to mlp/attn buckets. (3) Muon optimizer: added 3rd param group with h.muon_wd_proj. Structurally orthogonal to exp_164 (attn-vs-mlp type split, kept) and exp_141 (recurrent-depth split, kept). exp_406 split proj DOWN at 0.060 → discard +0.003, confirming slope is steep and UP direction has never been probed. Proj matrices are zero-init; write into residual stream; higher WD should both regularize residual-stream growth and shrink weight magnitudes (better compression, low size risk). Zero byte inflation (~250 code bytes), zero param count change.
463	2026-04-23T06:58:10Z	ttt	377	377	ttt	Replace per-chunk TTT LR cosine decay with linear decay: identical peak (ttt_lr=0.005) and identical integral (0.5), but shifts LR from first quarter into mid-chunks where both adaptation signal and remaining future-scoring benefit are still high.	-0.0002	discard	1.074770	+0.000683	15999327	600.015000	575.100000	1475.000000	apg-ttt-0457		Single-line edit in eval_val_ttt (~L1392). Replaces `cos_lr = h.ttt_lr * 0.5 * (1.0 + math.cos(math.pi * ci / max(num_chunks - 1, 1)))` with `cos_lr = h.ttt_lr * max(1.0 - ci / max(num_chunks - 1, 1), 0.0)`. Peak LR preserved (keeps exp_416/454 LR-axis findings). Total area under curve preserved (keeps exp_014/017 epoch-budget invariant). Only the SHAPE differs: at ci=N/4 cosine gives 0.854×peak while linear gives 0.75×peak; at ci=N/2 cosine gives 0.5× vs linear 0.5× (same); at ci=3N/4 cosine gives 0.146×peak vs linear 0.25×peak. So linear demotes slight early and promotes mid-to-late chunks, which are where the cumulative training history matters most for remaining future chunks. No size/param/budget change. Orthogonal to every prior kept TTT change (Nesterov, 4 epochs, fwd/rev traversal).
464	2026-04-23T06:59:57Z	curr	377	377	curr	Stratified-random phase within each Latin-square bucket: replace fixed bucket-edge offset `k * (max_phase+1)//8` with uniform sample in `[k*bucket, (k+1)*bucket)`, preserving exp_142's coverage invariant while giving continuous phase diversity vs 8 discrete positions.	-0.0002	size_blocked	1.075484		16001216	600.082000	579.700000	1476.000000	apg-curr-0457		Single-site edit in ShuffledSequenceLoader._reset_shard (~L384-391). With only ~1 phase-epoch/shard in 600s, the current scheme samples just 8 of seq_len=2048 offsets per rank; the new scheme samples all offsets uniformly while keeping stratification (each visit still falls in a distinct 1/8-th bucket). Matches the stride-64 sliding-window eval's offset-agnostic coverage. Zero param count change, no structural graph change, compression-neutral in expectation (same integer ranges in start_inds).
465	2026-04-23T07:00:43Z	arch	377	377	arch	Expand q_gain shape from [num_heads] to [num_heads, head_dim] (all init=5.25) so each (head, dim) pair has its own Q-scaling — lets the model learn independent sharpening for the RoPE (first 16) vs NoPE (last 48) subspaces per head, structurally distinct from all prior q_gain/o_gain tweaks.	-0.0005	size_blocked	1.074286		16010697	600.092000	572.600000	1470.000000	apg-arch-0457		"Two-site edit in CausalSelfAttention: (1) line 526 q_gain shape [num_heads]→[num_heads, head_dim]; (2) line 551 broadcast slice [..., :, None]→[..., :, :]. Zero behavior change at step 0 (uniform 5.25 still scales each head uniformly across dims). +5544 fp32 trainable params; routed to scalar AdamW group via ""q_gain"" pattern in CONTROL_TENSOR_NAME_PATTERNS (ndim-2 OK — the pattern branch catches it before the p.ndim==2 filter). Under GPTQ the per-block q_gain (512 elements) stays under the 65536 quantization threshold → passthrough fp16 = 11KB raw before brotli. Uniform init + byte-shuffle expects packed cost well under 5KB, leaving >170KB of the existing ~180KB headroom. Motivation: partial RoPE treats the first 16 Q-dims (positional-phase matching) structurally differently from the last 48 (content-key matching); a SCALAR per-head gain forces identical sharpening on both. Breaking that tie is cheap and has never been proposed — prior q_gain experiments (exp_271 noise, exp_312/444 WD isolation, exp_278 o_gain symmetric, exp_343 gain-param WD exemption) all held q_gain at [H] shape."
