exp_id	timestamp	specialist	parent_exp	baseline_exp	domain	hypothesis	expected_delta	status	val_bpb	delta_vs_best	artifact_bytes	train_s	eval_s	total_s	job_name	snapshot_path	notes
584	2026-04-24T11:36:13Z	quant	538	538	quant	"Pair exp_575's sink-col asymmetric int6 (top-8 post-perm cols use [-32,+31], rest stay symmetric [-31,+31]) with brotli lgwin=22→24 to recover the 1755B cap overshoot. exp_575 hit val_bpb=1.073162 (Δ=-0.000304 vs best) but size_blocked at 16,001,755B; widening brotli's LZ77 window to 16MB typically saves several KB on the ~30MB quant blob — enough headroom to fit the ~400B asymmetric histogram expansion under cap.</hypothesis> <parameter name=""notes"">Two-site edit: (1) unchanged sink-col asymmetric inner-loop branch from exp_575 in gptq_quantize_weight; (2) brotli.compress gains lgwin=24. Both individual ideas have precedent (exp_556 full-asymmetric, exp_567 damping=1.005+lgwin=24 both size_blocked) but never composed as asymmetric-sink + lgwin=24.</parameter> </invoke>" -0.00025 size_blocked 1.073372  16002016 600.141000 599.800000 1554.000000 apg-quan-0577  
585	2026-04-24T11:36:29Z	opt	538	538	opt	Raise muon_momentum_warmup_start 0.92→0.93: untried UP direction on an axis where both DOWN probes (exp_292@0.88, exp_500@0.90) regressed, while size_blocked floor-literal probes (exp_555 floor=0.30 bpb=1.072581, exp_562 floor=0.28 bpb=1.072734) strongly signal tail wants more momentum — raising warmup_start simultaneously raises initial ramp-from value AND the mm_blend tail floor (tail-mu 0.9375→0.9525) via a different mechanism that may produce differently-compressible weights than the size_blocked floor probes.	-0.0004	size_blocked	1.072774		16004121	600.098000	580.700000	1516.000000	apg-opt-0577		Single-literal default change at train_gpt.py:152 (muon_momentum_warmup_start 0.92→0.93). Code-byte-identical edit. Affects Muon's initial momentum ramp (starts at 0.93 instead of 0.92 for the first 22% of budget) AND the tail warmdown floor (at lr_scale=0, mu=0.25*0.99+0.75*0.93=0.945 instead of 0.9375). Peak untouched at 0.99. Expected delta is conservative: floor-at-0.30 probe showed −0.000885 signal (size_blocked); this probe gets tail-mu=0.945 which is between floor=0.25 (baseline) and floor=0.30, plus an additional initial-ramp bump that wasn't in those probes.
586	2026-04-24T11:43:49Z	arch	538	538	arch	Same as exp_577 but skip mlp_out_gate on looped blocks [3..5]: cuts forward-pass gate ops 17→8 (53% reduction, since looped blocks are called 3× each via depth recurrence) to shave the 3.1s eval overrun that blocked exp_577. Compact 3-line skip logic in GPT.__init__ + one-line None-check in MLP.forward — ~100B vs exp_568's 3370B verbose implementation.	-0.0010	eval_budget_overrun	1.073088			600.042000	603.500000	1554.000000	apg-arch-0578		exp_577 proved size fine (+203B code), and val_bpb=1.072087 projects -0.001379 vs best 1.073466 — real win — but eval_s=603.1 (3.1s over cap). Previous exp_568 had same skip-on-looped idea but used verbose 70-line implementation (+3370B, size_blocked with projected bpb=1.072388). This attempt uses: (1) MLP.forward adds `if self.mlp_out_gate_w is None: return out` (torch.compile resolves None branch statically at trace — no per-step overhead). (2) GPT.__init__ adds 3-line for-loop setting mlp_out_gate_w=None on looped blocks. Total +103B vs exp_577. Expected eval savings: 9 skipped gate ops (out of 17) should reclaim ~5-10s. Expected bpb: near exp_568's projected 1.072388 (Δ=-0.001078 vs best), still a large win even if slightly worse than exp_577's 1.072087.
587	2026-04-24T11:44:06Z	loss	538	538	loss	TTT-only z-loss (lambda=1e-5 * logsumexp(logits)^2) on eval_val_ttt inner-loop CE, distinct from exp_576 logit-L2-on-TTT and exp_564 z-loss-on-main-CE.	-0.0004	size_blocked	1.072431		16002056	600.034000	582.200000	1521.000000	apg-loss-0578		Single-site edit at eval_val_ttt L1467-1469. Replaces loss=base_model(x,y) with forward_logits + CE + 1e-5*logsumexp.pow(2).mean(). Gradient concentrated on argmax via softmax_i weighting, mechanistically distinct from logit-L2 (uniform 2*lambda*logit_i pressure across all 8192 dims). Main-train forward untouched. Code delta +60B. Size risk: exp_576 ran 3255B over cap on similar TTT-only edit due to brotli variance.
588	2026-04-24T11:50:34Z	ttt	538	538	ttt	Halve SGD momentum_buffer at each TTT chunk boundary	-0.0002	keep	1.072739	-0.000727	15999957	600.046000	587.200000	1532.000000	apg-ttt-0580	snapshots/588_ttt	
589	2026-04-24T11:53:20Z	reg	538	588	reg	"L1 sparsity penalty lambda 1e-4 via manual sign-gradient injection before grad_clip on attn_out_gate_w across all 11 blocks. Distinct from L2/WD pull-to-zero (exp_550/560/569 size_blocked). L1 creates exact zeros which brotli-11 compresses for free.</hypothesis> <parameter name=""notes"">Byte cost +333 code bytes. Single-site edit in step_fn before grad_clip_norm. Manual grad.add_ outside autograd graph. sign(0)=0 so no force at init. alpha 1e-4 matches scalar_lr*adam_wd at |w|=1. Targets exp_538 1056-param attn_out_gate_w mass - untested L1 axis, inverts size-inflation pattern via sparsity compressibility.</parameter> </invoke> " -0.0003 size_blocked 1.073438  16003263 600.007000 585.200000 1521.000000 apg-reg-0580  
590	2026-04-24T11:57:57Z	meta	538	588	meta	adam_wd 0.005 to 0.0055 half-step UP after exp_582 missed by 17 bytes at 0.006	-0.00035	size_blocked	1.073440		16001798	600.111000	580.100000	1519.000000	apg-meta-0583		
591	2026-04-24T12:02:43Z	curr	538	588	curr	Offset Latin-square phase lookup by shard index: k = _phase_order[si][(_phase_epoch[si] + si) % 8]. Decouples the cross-shard phase-visit sequence under multi-epoch resets within a rank (ranks 0-4 have 2 shards).	-0.00005	size_blocked	1.073666		16002939	600.009000	584.300000	1518.000000	apg-curr-0584		Untested axis — 11 prior curr phase/perm variants all touched the permutation content or bucket count; none touched the lookup-index offset. Marginal first-epoch distribution is statistically identical (uniform over independent perms), but the SEQUENCE of phases visited across multi-epoch resets differs, and the shared self.rng state driving self.rng.permutation(num_sequences) in _reset_shard gets consumed in a different shard-order pattern when shards exhaust asymmetrically. Expected delta is noise-level given LESSONS.md 'curr saturated after exp_142, exp_196'; submitting as a clean orthogonal probe rather than another phase-perm variant. Size-safe (lzma compresses the new expression slightly better: 26223→26221 B code).
592	2026-04-24T12:05:36Z	eval	538	588	eval	Gradient Centralization on TTT SGD only: zero-mean each output-row gradient across input dims for all 2D+ ttt_params before grad_clip+step.	minus_0.0003	keep	1.072439	-0.000300	15998978	600.144000	590.800000	1531.000000	apg-eval-0586	snapshots/592_eval	TTT has ~4-8 steps per chunk so GC is a stronger per-step regularizer than on main Muon where exp_273 discarded.
593	2026-04-24T12:06:18Z	tok	538	592	tok	"Variance-matched uniform_ init for tied tok_emb (bound=std*sqrt(3)): flat Uniform over [-0.00866,+0.00866], same per-coord variance as N(0,0.005) but zero Gaussian tails. Structurally distinct from all prior init variants in tree.</hypothesis> <parameter name=""notes"">Single-site edit in GPT._init_weights: nn.init.normal_ -> uniform_ with bound=std*sqrt(3). Zero new params. Code 26223->26568 B." -0.0003 size_blocked 1.074356  16001383 600.105000 584.900000 1532.000000 apg-tok-0586  
594	2026-04-24T12:10:31Z	quant	538	592	quant	FreqGPTQ Hessian: top-100 freq tokens get sqrt(2.0) activation boost.	-0.0008	size_blocked	1.072941		16008829	600.135000	592.700000	1533.000000	apg-quan-0586		Single-function edit in collect_hessians. Freq LUT computed from first calibration batch. boost=2.0 per PR1721.
595	2026-04-24T12:13:40Z	opt	538	592	opt	"Raise Muon-momentum warmdown-blend floor 0.25→0.27 with adjacent comment trim (-303 pack bytes): interpolates between kept 0.25 (exp_324) and size_blocked-with-improvement probes exp_562@0.28 (bpb=1.072734) and exp_555@0.30 (bpb=1.072581).</hypothesis> <parameter name=""notes"">Two-part edit: (1) mm_blend floor 0.25→0.27 in step_fn (byte-equal literal); (2) trim 8-line comment block above to 2 lines (pack: 26223→25920). exp_562 and exp_555 both hit below-best bpb but size_blocked; 0.27 is the less-drifted midpoint intended to land a fitting variant that captures part of the floor-raise signal.</parameter> </invoke>" -0.0005 size_blocked 1.072548  16001859 600.127000 588.700000 1530.000000 apg-opt-0588  
596	2026-04-24T12:14:28Z	loss	538	592	loss	Retry exp_587 TTT-only z-loss (lambda=1e-5 * logsumexp^2 on eval_val_ttt inner CE) which measured val_bpb=1.072431 (-0.001035 vs best) but artifact_bytes=16002056 (2056B over cap). Same loss edit; paired with ~2987 bytes of verbose historical-context comment trims to bank headroom.	-0.0008	keep	1.072251	-0.000188	15995930	600.087000	587.200000	1528.000000	apg-loss-0588	snapshots/596_loss	exp_587 established the mechanism's val_bpb at 1.072431 (-0.001035 from best 1.073466); only blocker was artifact 16002056 (2056B over 16MB cap). Code bytes reduced from exp_587's 26283 to 23296 (-2987 bytes) via comment trims in 6 historical-context blocks: q_gain/attn_out_gate rationale, embed_scale history, TTT-freeze rationale, embed_scale gauge-fix, GPTQ H damping rationale, Muon-mom warmdown rationale, shard-quota rationale, MLP WD split rationale. Each kept as one-line stub citing the kept exp_id for traceability. All comment-only changes — zero logic delta beyond the z-loss regularizer. Expected total artifact ~15999069 median, brotli variance ±3-5KB. Loss edit unchanged: forward_logits + CE + 1e-5 * logsumexp.pow(2).mean() on eval_val_ttt L1467-1469.
597	2026-04-24T12:22:29Z	arch	538	596	arch	Zero-init per-KV-head-dim additive V-bias (1D param num_kv_heads*head_dim=256 fp32/block, routes to scalar-AdamW via ndim&lt;2 + TTT-freeze via numel&lt;10000): adds a learnable position-invariant content prior to V after c_v projection, acting as a structural &quot;attention sink&quot; contribution since softmax weights sum to 1. Additive (not scale) — mechanism-distinct from exp_330's failed per-KV-head multiplicative V-gain (size_blocked, 1.075124) and exp_538's multiplicative post-attn per-head gate.	-0.0002	size_blocked	1.073373		16014772	600.139000	595.500000	1535.000000	apg-arch-0590		Single-site addition in CausalSelfAttention. __init__: self.v_bias = nn.Parameter(torch.zeros(num_kv_heads*head_dim)) — 1D so existing optimizer routing (ndim&lt;2 → scalar AdamW, numel&lt;10000 → TTT-frozen) handles it without touching CONTROL_TENSOR_NAME_PATTERNS or the TTT-freeze predicate. forward: `v = v + self.v_bias.view(1,1,num_kv_heads,head_dim)` right after c_v reshape, before rotary/softmax. Zero-init → step-0 identical to exp_538. Total +16 params/head_dim * 4 kv_heads = 256 fp32 per block × 11 = 2816 fp32, fp16 passthrough via numel≤65536 → &lt;300 B packed brotli on mostly-zeros. Code delta +349 B (26215→26564). Structural theory: additive V offset survives attention mixing (sum of weights = 1 → fixed DC contribution ≈ v_bias added to y), effectively giving attention proj a per-layer learnable output-bias absorbed through the column space of proj. No existing mechanism in the stack injects a content-independent additive signal into the attention path (attn_scale is multiplicative, resid_mix[1]*x0 is embedding-dependent).
598	2026-04-24T12:22:46Z	ttt	588	596	ttt	Tighten momentum-buffer damping at TTT chunk boundaries 0.5→0.3: exp_588 won at 0.5 (−0.000727), full reset (0.0) consistently regressed, 0.3 is an untested intermediate point motivated by PR#807 which swept analogous cross-document carryover momentum over {0.0,0.1,0.3,0.5,0.7} and found 0.3 optimal.	-0.0002	size_blocked	1.072828		16000530	600.062000	590.300000	1530.000000	apg-ttt-0590		"Single-literal change at train_gpt.py:1456 (mb.mul_(0.5) → mb.mul_(0.3)). Code-byte-identical (26284 B), zero size risk. Axis rationale: damping multiplier at chunk boundaries was discovered as a large-lever axis (exp_588 Δ=−0.000727) but only tested at {0.0, 0.5, 1.0}. The 0.0 regression (exp_327 Δ=+0.000724, exp_253 +0.000695, exp_213 +0.000951, exp_113 +0.000815) rules out ""stronger is better"" monotonically, but shapes a non-monotonic curve with apparent optimum between 0 and 1. PR#807 (L2, val 1.0116, sequential-momentum-ttt-lora) performed an analogous sweep over cross-document EMA momentum ∈ {0.0, 0.1, 0.3, 0.5, 0.7} and found 0.3 beat 0.5 for their LoRA adapter carryover. Our SGD momentum_buffer at chunk boundary plays the same structural role (velocity carry-over across distributionally-independent chunks), so their 0.3 finding is a directly transferable hint. Risk: ±0.0003 if the optimum is actually at 0.5; no divergence risk since we're between two previously-tested points."
599	2026-04-24T12:27:33Z	reg	588	596	reg	Inline post-optimizer L2 shrink on attn_out_gate_w only: replicate exp_569's adam_wd_gate=0.010 effective WD via 3-line post-step data.mul_(1 - 1e-4*lr_scale) across the 11 gate tensors	-0.0002	size_blocked	1.072881		16003876	600.116000	590.600000	1534.000000	apg-reg-0591		Byte cost +34 bytes only vs exp_589 L1 at +333B and exp_560/569 new-sub-group at hundreds. Factor 1 - 1e-4 * lr_scale matches exp_569's extra shrink beyond baseline adam_wd=0.005. Applied post-optimizers.step() in step_fn (eager). Targets 11*8*12=1056 attn_out_gate_w params from exp_538. Shrink toward zero-init keeps gate=2*sigmoid(0)=1.0 transparent on unused channels. exp_569 got val_bpb=1.072526 (-0.000213 vs best) size_blocked; this cuts the byte cost 10x.
600	2026-04-24T12:30:23Z	meta	588	596	meta	Raise ttt_momentum 0.9 to 0.92 on top of exp_588 chunk-boundary momentum_buffer halving	-0.0003	size_blocked	1.073035		16004308	600.110000	586.500000	1525.000000	apg-meta-0592		Single-literal change at train_gpt.py:185 (TTT_MOMENTUM default 0.9 to 0.92). ttt_momentum is only consumed at line 1400 (eval-time SGD constructor) so this cannot deterministically affect artifact size. exp_572 projected bpb 1.072551 vs exp_538 1.073466 was -0.000915 but was size_blocked; on exp_588 stack some of that effect is absorbed by the new halving-at-boundaries, so expect a smaller delta. Code +18 bytes.
601	2026-04-24T12:36:22Z	eval	592	596	eval	Stack exp_588's TTT momentum_buffer halving at chunk boundaries onto current best exp_592 (Gradient Centralization on TTT SGD): two parallel-sibling TTT-SGD-state edits that have never been combined.	-0.0004	size_blocked	1.073494		16000012	600.041000	580.000000	1521.000000	apg-eval-0594		exp_588 (ttt) and exp_592 (eval) are siblings of exp_538, each kept (Δ=-0.000727 and Δ=-0.000300 vs exp_538). Both modify TTT SGD-Nesterov dynamics: 588 halves momentum_buffer at chunk boundaries (mb.mul_(0.5) when ci>0) to attenuate cross-chunk stale velocity; 592 row-centralizes 2D+ grads before clip+step. They act on different stages (state-reset vs grad-transform) and are independently safe (both keeps), so they should compose. Code-only edit: 45 extra bytes inserted right after pg['lr']=cos_lr in eval_val_ttt. Cap risk minimal since exp_588 already fit with same 5-line block.
602	2026-04-24T12:39:57Z	tok	592	596	tok	Zero-init SP control-token rows (tok_emb[0:3]) after nn.init.normal_: IDs 0/1/2 = unk/BOS/EOS have base_bytes=0 in the BPB LUT so their output predictions contribute zero to val_bpb; zero rows compress near-optimally under GPTQ-int6+brotli-11 if they stay near zero post-training.	-0.0002	discard	1.075750	+0.003499	15989341	600.135000	590.700000	1530.000000	apg-tok-0595		Single-site edit in GPT._init_weights: append self.tok_emb.weight[:3].zero_() under torch.no_grad(). Zero new params; +260 code bytes. Novelty vs tree: all prior tok init variants (sphere, trunc-norm, orth, semi-orth, col-equi-std, uniform, Zipf, row-mean-center) perturbed all 8192 rows; no prior edit targeted only the 3 SP control rows. Mechanism: (a) output-side tied logit for token v is x@tok_emb[v]; rows 0-2 zero means logits for unk/BOS/EOS stay at 0 pre-softcap and since base_bytes=0 for is_control/is_unknown/is_unused tokens, these CE contributions never reach bpb denominator; (b) input-side SP8192 FineWeb packing typically does not insert BOS/EOS between docs; (c) compression — rows near zero map to the symmetric int6 zero bin with low quant error, and byte-shuffle brotli-11 encodes near-zero rows much more compactly than trained rows. Risk: low — init change only, rows retain gradient flow so frequent tokens can train away.
603	2026-04-24T12:40:37Z	curr	588	596	curr	Seed sequence_order with independent PCG64([rank, si, _phase_epoch[si]]) per _reset_shard call, decoupling within-shard permutation from the cross-shard shared-rng state chain (which also services phase_order and shard_plan shuffles).	-0.0001	size_blocked	1.073898		16003783	600.027000	583.900000	1526.000000	apg-curr-0595		Two-site edit inside ShuffledSequenceLoader. Adds self.rank=h.rank in __init__ (+25B) and replaces `sequence_order = self.rng.permutation(num_sequences)` (line 380) with a fresh-generator `np.random.Generator(np.random.PCG64([self.rank, si, self._phase_epoch[si]])).permutation(num_sequences)` (+~70B). Code bytes 26221→26319 (+98B packed). Rationale: current lineage uses a single self.rng(PCG64(h.rank)) for three concerns — (1) per-shard phase_order built in __init__, (2) per-reset sequence_order, (3) per-batch shard_plan shuffle. Order-of-shard-reset timing drifts sequence_order outcomes via shared state; separating (2) into a deterministic (rank, si, epoch)-keyed stream makes each shard-epoch's within-shard visit order pure-function reproducible. Side effect: by removing N_shards * permutation(~24k) draws from self.rng per training cycle, the shard_plan shuffle in next_batch also sees a different state trajectory (~0.000322 lever per exp_571, minor). Untested axis — no prior curr trial has seeded sequence_order separately. Distinct from exp_571 (removed shuffle), exp_131 (random uniform starts), exp_122 (removed rank stripe).
604	2026-04-24T12:43:48Z	quant	592	596	quant	Post-Cholesky GPTQ error-feedback damping β=0.9: scale the propagated residual err by 0.9 after computing it, dampening cross-column compensation magnitude without changing rounding/scale. Soft-OBS interpolation between β=1 (full OBS-GPTQ) and β=0 (RTN).	-0.0005	discard	1.073160	+0.000909	15999475	600.104000	584.400000	1521.000000	apg-quan-0597		Single-literal edit at gptq_quantize_weight: `err = (w_col - q_col*sf)/d` → `... * 0.9`. The dampening is uniform for intra-block and cross-block propagation (Err stores the damped err). Motivated by shrinkage theory — with Hessians computed from 64 batches, H-noise has ~12.5% relative magnitude on diagonals and higher on off-diagonals; MSE-optimal β* ≈ σ²_signal/(σ²_signal+σ²_noise) lies below 1. Distinct from exp_348 Ledoit-Wolf H off-diag shrinkage (pre-Cholesky on H) — this scales Hinv's off-diagonal contribution uniformly post-Cholesky. The diagonal d (used to compute err before damping) is unchanged, so rounding is identical to standard GPTQ — only the downstream compensation magnitude is softer. Zero byte overhead on Q (same codes per column, just different residuals propagated → slight shift in downstream Q codes, brotli entropy should remain comparable). Untried axis: all prior H/Hinv probes touched H directly (damp, off-diag shrink, floor) or perm/scale; never scaled post-Cholesky error-feedback.
605	2026-04-24T12:44:08Z	opt	538	596	opt	"Re-submit exp_595's Muon mm_blend floor 0.25→0.27 (bpb=1.072548 size_blocked by 1,859 B) with ~2,393 B of extra comment trim to clear the 16 MB cap; same weight trajectory as exp_595 should now fit.</hypothesis> <parameter name=""notes"">exp_595 produced val_bpb=1.072548 (-0.000918 vs best) but the 16.00 MB artifact exceeded the cap by 1,859 bytes. This submit keeps the identical optimizer change (mm_blend = max(lr_scale, 0.27)) and only trims additional verbose comment blocks: module docstring (lines 1-14), attention-backend header + SDPA fallback docstring, muon_momentum_warmup_fraction rationale (lines 153-156), muon_wd_mlp rationale (lines 167-171), TTT section header (lines 176-181), smoke-test gate note (lines 225-228), GPTQ signal-proportional damping rationale (lines 1059-1065), and TTT scalar-freeze rationale (lines 1363-1373). Pack went 26223 → 23830 B (-2393), giving ~534 B safety margin over exp_595's 1859 B overrun. Model trajectory should be bitwise identical since only comments changed; only risk is GPTQ seed variance drifting model_bytes upward.</parameter> </invoke>" -0.0009 discard 1.072380 +0.000129 15997990 600.082000 581.400000 1519.000000 apg-opt-0597  
606	2026-04-24T12:47:00Z	loss	596	596	loss	Double TTT inner-CE z-loss coefficient 1e-5 → 2e-5: first principled coefficient tune on the z-loss axis (exp_587/exp_596 established λ=1e-5 kept but λ itself never swept), 1-char artifact-neutral edit on the kept winning form.	-0.00010	eval_budget_overrun	1.072893			600.084000	600.900000	1541.000000	apg-loss-0597		Only prior z-loss coefficient datapoints are (a) exp_009 main-train λ=1e-4 discard +0.003180, (b) exp_564 main-train λ=5e-6 size_blocked at 1.074225, (c) exp_596 TTT-only λ=1e-5 keep 1.072251. No TTT λ sweep yet. 2e-5 probes whether more regularization continues to help on the TTT-inner-CE axis. Same exact edit site as exp_596 — 1-character change, artifact size identical.
