exp_id	timestamp	specialist	parent_exp	baseline_exp	domain	hypothesis	expected_delta	status	val_bpb	delta_vs_best	artifact_bytes	train_s	eval_s	total_s	job_name	snapshot_path	notes
522	2026-04-24T08:14:10Z	quant	491	491	quant	Lower embed_clip_sigmas 20.0 to 14.0 on int8 tied embedding for finer bins.	-0.00005	discard	1.074824	+0.000846	15922189	600.006000	567.300000	1483.000000	apg-quan-0519		Single-literal change at Hyperparameters.embed_clip_sigmas default 20.0 to 14.0 plus commentary. tok_emb is int8 with clip_range=127; at 20 sigma each step is 0.157 sigma, coarser than the 3-4 sigma bulk of post-RMSNorm embedding features needs. 14 sigma still leaves about 6 sigma of outlier headroom while bin resolution improves 43 percent. GPTQ Hessian for tok_emb is collected from the tied head-proj output hook which is pre-logit hidden states, so error propagation compensates for any residual clipping. Untested axis - all prior clip-sigma probes (exp_086, exp_153, exp_165, exp_175, exp_183) targeted matrix_clip_sigmas for int6 attn or mlp_clip_sigmas, never the int8 embed. Size-safe since tighter clip concentrates Q codes near 0 and brotli entropy stays neutral or decreases.
523	2026-04-24T08:16:59Z	tok	491	491	tok	Replace F.rms_norm with F.layer_norm on the post-tok_emb residual (inside same embed_scale product): strips per-token DC (feature-mean) from the initial residual and from x0 skip-anchor before they enter the trunk, so downstream skip paths carry DC-free anchors. exp_058 proposed this but harness_aborted; never measured.	-0.0001	size_blocked	1.076323		16001677	600.083000	588.500000	1504.000000	apg-tok-0519		Single-site edit at train_gpt.py:763 (inside GPT.forward_logits). `F.rms_norm(x * self.embed_scale.to(x.dtype), (x.size(-1),))` → `F.layer_norm(x * self.embed_scale.to(x.dtype), (x.size(-1),))`. Zero params, zero bytes, identical signature. Comment block updated to explain mechanism + gauge-fix breakage. Mechanism: (1) LayerNorm mean-subtracts per-token across the 512 features, RMSNorm does not. (2) At init with tied Gaussian embed (std=0.005), the per-row mean is std/√D ≈ 2.2e-4 — tiny, but non-zero. Post-training, tok_emb rows develop meaningful DC offsets that under the tied setup double as softmax-frequency proxies; LayerNorm at input-path strips those DC bits from the residual stream (block-0 input + x0 skip), while OUTPUT path (F.linear raw) still sees the full row including DC. This asymmetry lets tok_emb.weight[v]'s DC direction specialize for output classification (frequency prior) without polluting input-side features. (3) embed_scale gauge-fix (exp_298) partially breaks under LayerNorm — mean-subtract absorbs uniform scale shifts — but downstream block-0's pre-RMSNorm re-normalizes, so unit-var downstream trunk behavior is preserved. (4) Block-0 attn/MLP receive pre-RMSNorm(x), which for zero-mean x equals pre-LayerNorm(x), so attn/MLP outputs are untouched; only the ADDITIVE residual and x0 anchor change. (5) Risk: skip_weights were calibrated on RMSNorm residual stats — slight residual-stream bias shift, but skips are learnable per-feature and should rapidly recalibrate. History: exp_058 proposed this exact edit, harness_aborted without measurement; no later tok trial revisited LayerNorm-placement on input path. exp_412 (trunc_normal tok_emb init, ±2σ) and exp_466 (column-equi-std init) probed adjacent init-level DC-taming but neither stripped DC from the residual pathway at forward time. Expected delta: mild (-0.0001) — mechanism is plausible but gauge-fix partial-break risk creates uncertainty in sign; the 16MB cap is not threatened (code bytes ≈ 25.7KB, unchanged count-wise).
524	2026-04-24T08:18:19Z	ttt	491	491	ttt	Remove TTT label smoothing (label_smoothing=0.02 → 0.0) inside eval_val_ttt inner CE: restores symmetry with main-train CE (line 801, no smoothing) — untested axis across 50+ ttt trials (many LR/momentum/clip/mask/epoch probes, but never smoothing). Sharpens gradient toward true val tokens for stronger per-chunk adaptation.	-0.0001	discard	1.074303	+0.000325	15999500	600.010000	564.200000	1478.000000	apg-ttt-0519		Single-literal edit at train_gpt.py:1458. The existing label_smoothing=0.02 was applied only in the TTT inner loop (not in main training CE at line 801 which has no smoothing, nor in scoring CE at line 1403). This asymmetry was never probed. Direction priors: (a) val tokens are true targets for adaptation — smoothing weakens grad signal; (b) main training already omits smoothing and that wasn't found to hurt; (c) TTT grad clip=1.0 provides sufficient stability without the extra regularizer. Could go either way — if smoothing was preventing overfit to small chunks, removing it hurts. Size-neutral (packed code bytes unchanged; even saves 1 source byte).
525	2026-04-24T08:18:34Z	meta	491	491	meta	Narrow GRAD_CLIP_NORM bisection 0.3→0.25 (-17% DOWN): prior exp_169 (0.3→0.2, +0.000124) and exp_233 (0.3→0.4, +0.000340) bracketed a 3× UP-side penalty over DOWN-side, suggesting the optimum lies between 0.2 and 0.3; 0.25 is the untested midpoint, re-probed after ~12 kept stack changes since exp_169 shifted the gradient-norm distribution.	-0.0001	size_blocked	1.074731		16001621	600.040000	564.300000	1471.000000	apg-meta-0519		Single-literal edit at train_gpt.py:162. Zero size/compute impact. Meta-scope narrow tweak — the grad-clip-norm axis has never been tested at 0.25 and the old bracket (0.2 hurt +0.000124; 0.4 hurt +0.000340) was collected on an exp_156 baseline predating exp_245's recurrence-aware ln_scale correction, exp_267/298's embed_scale changes, exp_324's Muon-warmdown floor, and exp_475/491's arch/TTT tweaks — all of which alter the gradient-norm distribution that the clip interacts with. DOWN-side previously hurt only 0.37× as much as UP-side, so optimum is likely ∈[0.2,0.3]. 0.25 is the principled midpoint probe.
526	2026-04-24T08:18:40Z	eval	491	491	eval	Raise TTT SGD momentum 0.9 → 0.92 — untouched UP direction (every prior momentum trial went DOWN: exp_103 0.5=+0.000894 regression, exp_388 0.3=+0.000376, exp_147 0.9→0 cosine-cool=+0.000844). Gentle +2% probe parallels exp_336's Muon WD +8% DOWN win and exp_460's +10% LR attempt (size_blocked, not val); asymmetric-hurt-DOWN gradient suggests UP is the unexplored improving direction.	-0.00005	size_blocked	1.074090		16000380	600.111000	575.900000	1482.000000	apg-eval-0519		Single-literal edit at line 185 (TTT_MOMENTUM default 0.9→0.92). Byte-wise +1B code change, safe vs recent size_blocked cluster (501/517/509/505/504/512/516). Mechanically: chunk-boundary carryover of momentum_buffer rises from 0.9^4=0.656 to 0.92^4=0.716 (+9% stale direction persistence); within-chunk 4-step cumulative gradient weight rises from 3.44 to 3.74 (+9% smoothing). Nesterov preserved so look-ahead also gets +2% momentum. Only touches eval_val_ttt optimizer; zero effect on training or model size/compression.
527	2026-04-24T08:18:43Z	loss	491	491	loss	Gradient-winsorize per-token CE at a fixed 11-nat ceiling (~2 nats above uniform log(V=8192)=9.0): clips only the heavy right tail of catastrophic-surprise tokens (random unicode/URL slugs) where grad variance is high but learning signal is near-zero — compile-friendly static-threshold variant of never-run exp_070 (3×mean adaptive, harness_abort), safely above exp_124's collapse-inducing cap=7.	-0.0001	discard	1.083362	+0.009384	15996680	600.131000	564.400000	1475.000000	apg-loss-0519		"Single-site edit in GPT.forward: reduction=""mean"" → reduction=""none"" + torch.clamp(ce, max=11.0).mean(). Clamp is torch.compile-fullgraph-friendly (no Python control flow, no quantile). log(V=8192)=9.0 nats → 11-nat cap (~p_y floor 1.7e-5) catches ~0.3-1% of the right tail at steady state, leaving 99% of tokens with unmodified gradient. Distinct from all prior loss attempts: not focal (no soft reweight), not winsorize-by-quantile (static threshold), not PW (no position bias), not LS (no soft target). Mean-CE is slightly biased down, but gradient direction for non-clipped tokens is identical to plain CE. Size risk: mild weight-distribution drift at convergence (0.5% of tokens influenced)."
528	2026-04-24T08:19:37Z	arch	491	491	arch	Add SmearGate (PR#1667): zero-init data-dependent learnable bigram smear x[t>=1] += lambda * sigmoid(W·x[t-1,:12]) * x[t-1] applied once after post-tok_emb RMSNorm, before x0 capture. 13 total new params (CastedLinear(12→1) + scalar), fp16 passthrough, step-0 transparent. Novel to this tree; orthogonal complement to kept exp_475 attn-out-gate.	-0.0005	size_blocked	1.075259		16000243	600.011000	573.100000	1491.000000	apg-arch-0519		"Four-site edit. (1) GPT.__init__ after embed_scale/embed_proj setup: add self.smear_gate=CastedLinear(12,1,bias=False) with _zero_init, self.smear_lambda=nn.Parameter(torch.zeros(1)), self.smear_gate_width=12. (2) GPT.forward_logits after embed_proj branch and before x0=x: compute smear_g=sigmoid(smear_gate(x[:,:-1,:12])), smear_contrib=lambda*smear_g*x[:,:-1], then x=x+F.pad(smear_contrib,(0,0,1,0)). Position 0 untouched; compile-safe. (3) Optimizers.__init__: add smear_gate.weight and smear_lambda to scalar_params after embed_scale (GPT-level params need manual registration like skip_weights/skip_gates). (4) CONTROL_TENSOR_NAME_PATTERNS default appended with ""smear_gate,smear_lambda"" for scalar-AdamW routing and fp16 passthrough. Expected: small positive (SmearGate contributed to PR#1667's 1.07139 together with attn-out-gate that we already have); zero regression risk at init."
529	2026-04-24T08:33:04Z	curr	491	491	curr	Cap num_sequences at 2000 per shard plus preempt reset	-0.00015	discard	1.088921	+0.014943	15997325	600.103000	567.800000	1487.000000	apg-curr-0520		
530	2026-04-24T08:43:15Z	quant	491	491	quant	GPTQ column ordering by output-energy score H.diag() * W.var(dim=0) instead of H.diag() alone — greedy pass quantizes high-output-contribution columns first while Hinv is cleanest, untouched axis since exp_000.	-0.0002	size_blocked	1.074534		16003374	600.023000	571.600000	1476.000000	apg-quan-0524		"Single-site edit in gptq_quantize_weight (line ~1057). Replaces `argsort(H.diag())` with `argsort(H.diag() * W_orig.var(dim=0))`. Motivation: pure H.diag() ordering treats high-activation columns with near-zero weight mass the same as high-activation columns with large weight mass, but only the latter contributes meaningfully to output variance. Energy-weighted sort prioritizes reconstruction-dominant columns. Zero size impact, ~microsecond extra compute. Load-bearing assumption: the cleaner-Hinv-first heuristic is stronger when ""first"" means highest output-energy rather than highest activation-energy. Risk: if the current H.diag() order happens to interact well with the Cholesky/block_size=32 cascade, changing order could mildly regress — but no prior probe has touched this axis."
531	2026-04-24T08:46:59Z	reg	491	491	reg	"Depth-targeted Muon WD on attention matrices of looped blocks [3..5] only: add 3rd Muon param group with muon_wd_attn_recurrent=0.1235 (1.3× baseline 0.095), porting exp_141's proven mechanism (kept Δ=-0.000274 on sibling tree) onto current type-split (exp_164/336); scoped to attn only since MLP-recurrent variant exp_187 was discard.</hypothesis> <parameter name=""notes"">Three-site edit: (1) Hyperparameters gains muon_wd_attn_recurrent=0.1235 env-backed default. (2) Optimizers.__init__ adds recurrent_prefixes=tuple(f""{i}."" for i in range(h.loop_start, h.loop_end+1))=(""3."",""4."",""5."") and splits matrix_attn_params via name.startswith(recurrent_prefixes). (3) Muon receives a 3rd param group with the elevated WD. Zero new model params; code_bytes 25944. Looped blocks receive 3× more gradient updates per forward so per-step shrinkage (1-lr·wd) is proportionally eroded; equalizing per-gradient-step shrinkage. All three LR/momentum/base_lr loops iterate optimizer_muon.param_groups, so new group composes cleanly." -0.00015 size_blocked 1.074069  16002873 600.122000 569.100000 1479.000000 apg-reg-0529  
532	2026-04-24T08:47:07Z	tok	491	491	tok	Set scale_grad_by_freq=True on nn.Embedding for tok_emb: divides each row's input-path gradient by its in-batch frequency so common tokens no longer 100x-dominate rare-token rows on input lookup, while leaving tied-softmax F.linear output path unchanged — breaks tied-gradient symmetry along a never-before-tried axis at zero bytes / zero params.	-0.0005	size_blocked	1.079825		16005631	600.066000	569.600000	1479.000000	apg-tok-0529		Single-kwarg edit at GPT.__init__ L643: nn.Embedding(vocab, dim) becomes nn.Embedding(vocab, dim, scale_grad_by_freq=True). PyTorch builtin; only the backward of tok_emb(input_ids) changes (divides each unique row grad by its minibatch count). The tied output path F.linear(x, tok_emb.weight) and its grad into tok_emb.weight is UNCHANGED. Zero new params; code_bytes 25743 to 26136 (comment only); model_bytes unchanged so no size risk. Addresses gaps.md Gap 5 (rare-token gradient signal inflating BPB) via a built-in mechanism orthogonal to all prior tok edits: per-feature embed_scale [512] (exp_190/267/298 kept), per-vocab logit/embed biases [8192] all size_blocked, init tweaks (trunc_normal/orthogonal/Zipf) all discard, F.dropout on emb (exp_476 size_blocked), F.layer_norm swap (exp_380 discard). Grep of tree.tsv confirms scale_grad_by_freq was never tried. Risk: effectively averages vs sums common-token grads so their updates shrink -- could want embed_lr bump but measuring stock first. torch.compile safe: flag only gates backward; forward is bytecode-identical.
533	2026-04-24T08:47:16Z	opt	491	491	opt	Raise Muon spectral-scale exponent 0.5 to 0.6 at line 883.	0	size_blocked	1.074165		16001758	600.152000	563.100000	1468.000000	apg-opt-0529		Test
534	2026-04-24T08:48:14Z	loss	491	491	loss	Apply gentle linear position-weighted CE (0.9→1.1, mean-preserving) ONLY to the TTT inner-loop loss — aligns TTT's few adaptation steps with eval's stride-64 tail-scored zone. Never tried in TTT (all prior loss-PW experiments modified main-train CE only; restoration on current lineage fails). Main-train CE unchanged.	-0.00015	discard	1.074148	+0.000170	15999309	600.096000	559.900000	1465.000000	apg-loss-0529		Single-site edit in eval_val_ttt inner training loop: replaces `loss = base_model(x, y)` with manual forward_logits → per-position CE → linear 0.9→1.1 pw (mean-preserving) × ce, then .mean(). Main-train forward path and GPT.forward are untouched — cleanly isolates TTT-inner loss-shape effect from main-train PW saturation (exp_425, 467 failed to re-add PW on current lineage). Shape chosen = exp_156's proven gentlest keep (Δ=-0.000200 at original magnitude on old lineage). Orthogonal to exp_524 (TTT label-smoothing removal, +0.000325), exp_491 (scalar-freeze), exp_526 (TTT momentum).
535	2026-04-24T08:49:07Z	ttt	491	491	ttt	Split TTT SGD into two param groups: tok_emb gets 2× LR (0.010), all other matrices keep 1× LR (0.005); cosine decay preserves the ratio across chunks. Embedding under-adapts at uniform h.ttt_lr relative to its 6× training-time ratio.	-0.0006	size_blocked	1.074097		16001991	600.119000	563.900000	1473.000000	apg-ttt-0529		Main training uses tied_embed_lr=0.03 vs head_lr=0.008 and matrix-group ≈0.005 — a ~6× ratio. TTT is uniform at 0.005 for all ≥10k-param tensors. exp_049 (froze tok_emb → hurt) confirmed embedding-side TTT is net-positive, so this probes the UP direction on its adaptation rate. Two-group SGD, conservative 2× (not 6×) to respect exp_151's Nesterov stability regime. Zero size impact (eval-time only). Orthogonal to exp_491's scalar-freeze (still active).
536	2026-04-24T08:49:11Z	meta	491	491	meta	Advance enable_looping_at 0.35→0.28 so the 1-pass→3-pass recurrence transition happens exactly at warmdown start (lr_scale=1.0 at frac=0.28) rather than 7pp into warmdown (lr_scale~0.90 at frac=0.35): completely untouched axis in 525+ trials, giving the looped architecture more high-LR gradient exposure.	-0.00015	size_blocked	1.074418		16001910	600.117000	564.700000	1476.000000	apg-meta-0529		Single-literal default change at train_gpt.py:139 (ENABLE_LOOPING_AT 0.35→0.28), plus restoration of GRAD_CLIP_NORM 0.25→0.3 to undo exp_525's failed size_blocked residual in the workdir — now exactly aligned with exp_491 baseline. Zero byte code change (-1B on one literal, +1B on the other), so size_blocked risk is purely model-side stochastic. Mechanism: with warmdown_frac=0.72 the warmdown begins at frac=(1-0.72)=0.28; currently looping activates at 0.35, so the 3-pass regime kicks in 7pp after LR has started decreasing (lr_scale≈0.903). Moving activation to 0.28 synchronizes both scheduler events and gives the loop-specific weight updates ~7% more training time at peak LR. Complements exp_088's kept muon_momentum_warmup_fraction 0.33→0.22 (momentum peak now sits at 0.22, so looping at 0.28 still has 6pp of peak-momentum+peak-LR single-pass gradient buildup before the architecture reshuffles). This is the untried SHRINK direction on enable_looping_at — no prior probes on this axis according to tree.tsv grep. Risk: fewer total training steps since 3-pass mode activates earlier (each step takes ~same time but loops add compute inside step_fn after looping_active=True). Fallback: if discarded by small margin, 0.22 (full sync with momentum peak) remains as a more aggressive follow-up; if discarded heavily, the axis prefers LATER activation (0.42+) as the untested UP direction.
537	2026-04-24T08:55:27Z	eval	491	491	eval	Loosen TTT SGD grad_clip_norm 1.0 → 1.5 (+50%): tested-direction asymmetry — tighter 0.5 hurt twice on the current lineage (exp_244 +0.000489, exp_351 +0.000289) but looser ≥1.0 has never been validated post-Nesterov (exp_101's 2.0 probe went eval_budget_overrun on the pre-Nesterov/pre-ttt_epochs=4 stack). A mild +50% loosening lets rare-but-informative large gradients propagate while staying well inside Nesterov@0.9 stability.	-0.00008	discard	1.074435	+0.000457	15998963	600.135000	564.200000	1476.000000	apg-eval-0529		Single-literal edit at train_gpt.py:1449 (`1.0` → `1.5`). Zero byte delta, size-safe. The grad-clip axis has only been probed in the hurt direction on current lineage; looser 2.0 was tested in exp_101 but on an old stack (no Nesterov, ttt_epochs=3) so behavior likely differs. With current ttt_lr=0.005 × Nesterov μ=0.9, looser clip mostly benefits informative first-chunk gradients where the un-adapted model produces occasional large directions. Risk is minor overshoot on early chunks; cos_lr decay should naturally damp later-chunk instability.
538	2026-04-24T08:56:38Z	arch	491	491	arch	PR1667 per-head data-dependent attention-output gate as raw nn.Parameter	-0.0005	keep	1.073466	-0.000512	15998155	600.111000	580.900000	1523.000000	apg-arch-0529	snapshots/538_arch	
539	2026-04-24T09:03:45Z	curr	491	538	curr	Lower per-shard num_sequences cap 2000 to 1500 in _reset_shard for guaranteed full 8-phase coverage	-0.00005	size_blocked	1.097696		16003271	600.075000	563.000000	1480.000000	apg-curr-0530		
540	2026-04-24T09:17:26Z	reg	491	538	reg	Raise muon_wd (attention matrices only) 0.095 to 0.100 (+5.3% UP): first UP probe on the attn sub-group after the exp_164 type-split. DOWN probes (exp_414 -8% +0.000192, exp_489 -7% size_blocked 1.074149) both failed, leaving UP untested. Small step avoids exp_095's +21% blowup; tightens attn weight norms (GPTQ/brotli-favorable).	-0.0001	discard	1.074155	+0.000689	15998020	600.040000	560.200000	1467.000000	apg-reg-0537		Single-literal edit at train_gpt.py:166 (MUON_WD default 0.095 to 0.100). Zero new params, zero net code bytes. muon_wd applies to matrix_attn_params only (c_q/c_k/c_v/attn.proj across 11 blocks, ~1/3 of matrix mass; MLP at 0.115 unchanged). Direction rationale: LESSONS' exp_336 heuristic says probe DOWN before UP; attn DOWN is tested twice (414/489, both lose/size_blocked), so UP is the remaining direction. Magnitude rationale: exp_095's pre-split +21% UP hurt globally by +0.003; a post-split +5% on attn-only is a much smaller effective dose (MLP at 2.7x attn mass stays fixed). Size rationale: recent reg trials trip the 16MB cap on sub-kB margins (exp_493 beat best at 1.073997 but size_blocked by 575B, exp_531 at 1.074069 size_blocked). UP on WD shrinks equilibrium norms, tighter GPTQ int6 grids, marginally better brotli compression. Risk: over-regularizing QK direction diversity; mitigated by tiny magnitude and by q_gain=5.25 still active to compensate softmax sharpness.
541	2026-04-24T09:19:41Z	tok	491	538	tok	Reuse existing embed_scale on the OUTPUT path of the tied softmax: F.linear(x * embed_scale, tok_emb.weight). Zero new params — makes the 512-wide per-feature gain symmetric across the tied tok_emb.weight's two roles (input basis re-weight + output classifier basis re-weight).	-0.0003	discard	1.081574	+0.008108	15988948	600.035000	571.400000	1484.000000	apg-tok-0537		Single-site edit at forward_logits line 809 (tied branch only). At init embed_scale=1.0, behavior is identical to baseline; post-init, CE gradient flows into embed_scale from BOTH paths, joint-optimizing the 512 scalars. Structurally distinct from exp_260 (separate output_gain=+0.002 discard): no new params, pure weight-TYING of the existing input-side embed_scale. Input path retains its gauge-fixing via RMSNorm; output path adds (ungauged) global-magnitude gradient — counterbalanced by scalar-group adam_wd=0.005. Zero model-byte cost; ~+40 code bytes.
