exp_id	timestamp	specialist	parent_exp	baseline_exp	domain	hypothesis	expected_delta	status	val_bpb	delta_vs_best	artifact_bytes	train_s	eval_s	total_s	job_name	snapshot_path	notes
826	2026-04-25T20:01:15Z	reg	750	750	reg	Extend exp_491's selective-freeze policy to also exclude tied tok_emb [8192,512]=4M params during eval-TTT: tok_emb is the single largest tensor and accumulates conflicting gradients per TTT step from its dual role (input embedding + tied LM head), so freezing it removes the dominant TTT-update noise source while leaving 4 MLP/attn matrices to adapt.	-0.0005	size_blocked	1.072387		16000285	600.046000	528.400000	1428.000000	apg-reg-0818		Single 5-line edit in eval_val_ttt (line 1327-1331): adds `_te = base_model.tok_emb.weight` and appends `and p is not _te` to both the param-filter and the requires_grad gate. Mechanism-distinct from prior reg keeps (exp_141 depth WD, exp_164 type WD split, exp_336 mlp WD lower, exp_491 scalar freeze): no WD knob touched; instead freezes the highest-overfit-risk tied tensor at TTT time. Tied tok_emb is updated 2x per backward (input lookup grad + output projection grad) with different role objectives, so the summed gradient is internally noisy. Eval-TTT-only path → no main-train artifact bytes affected. Code bytes 23309→23385 (+76, packed), still 15.97 MB under cap.
827	2026-04-25T20:03:55Z	opt	750	750	opt	Recurrence-aware Muon LR: scale main-train Muon base_lr by 1/sqrt(num_loops+1)=0.577 on looped blocks [3..5] only, equalizing per-step weight-space drift against the sqrt(3)x gradient accumulation those physical blocks see (each invoked 3x per forward).	-0.0003	crash						18.000000	apg-opt-0827		Splits the existing 2-group Muon (attn, mlp) into 4 groups by adding loop vs non-loop subgroups; loop group lr = matrix_lr / sqrt(num_loops+1). Mirrors exp_245's kept FORWARD-side ln_scale damping (output magnitude) on the BACKWARD-side update magnitude — independent variance-balancing axes. Distinct from exp_548/557 (loop-equalized TTT SGD LR — DISCARDED, but TTT regime is per-chunk so different signal), exp_336 (MLP-vs-attn WD type-split), and exp_088 (momentum_warmup_fraction). Per-physical-block main-train Muon LR scaling has not been tried in 800+ trials. Code +283 packed bytes (23300→23583); within tight cap. Risk: stacks with exp_245's ln_scale damping which already partially compensates the residual contribution; may over-suppress looped blocks. Mitigation: 1/sqrt(3) factor matches exp_245's exact factor — variance-balancing principle is consistent. | torch.distributed.elastic.multiprocessing.errors.ChildFailedError: ============================================================ (train_gpt.py:891 in __init__)
828	2026-04-25T20:05:55Z	quant	750	750	quant	Half-amplitude rescue of exp_818's size_blocked H-magnitude-proportional damping (bpb=1.072053, Δ=-0.000157, +642B over cap): center the per-column damping spread around mean (=1.01 exactly) with HALF the amplitude — H.diag.mul_(1.01 + 0.005·(H_ii - mean)/mean) so high-H gets up to ~1.025x ridge, low-H gets down to ~1.005x, mean precisely preserved. Half the spread → roughly half the Q-code entropy distortion → expected to fit under 16MB while keeping ~half the bpb gain (-0.00008 estimate).	-0.00008	size_blocked	1.073554		16002437	600.139000	583.300000	1518.000000	apg-quan-0819		Single-line edit at gptq_quantize_weight L1023 (after L1022 Hd capture). The sign of the centered spread (Hd-mean)/mean is identical to the failed exp_818 spread — high-H more damped, low-H less — but amplitude is exactly 0.5x. Mean preservation: E[(Hd-mean)/mean]=0 by construction, so multiplicative factor mean = 1.01 exactly (no compression-edge drift like exp_809/477/387 1.005). If this fits and keeps the win, the next probe is 0.0075 amplitude (3/4) for diminishing-returns check.
829	2026-04-25T20:07:54Z	ttt	750	750	ttt	Replace global L2-norm gradient clip (1.0) with per-element value clip (0.1) during TTT SGD: caps outlier gradient elements that pollute the Nesterov momentum buffer over 13 chunks while preserving direction information in well-behaved tensors that global L2-norm shrinks uniformly.	-0.0003	size_blocked	1.073632		16001099	600.112000	578.600000	1514.000000	apg-ttt-0818		Single-line swap at line 1407: clip_grad_norm_(ttt_params, 1.0) → clip_grad_value_(ttt_params, 0.1). Code byte-saving (-5B vs 750). Rationale: prior tested directions are (a) tighten/loosen global L2 threshold (exp_180 1.0→0.5 discard, exp_101 1.0→2.0 ebo) and (b) per-parameter trust-ratio AGC (exp_611 ebo). Per-element value clip is structurally distinct: it leaves typical small gradients (~1e-3) untouched and only caps outlier elements (e.g., rare-token gradients that spike to 0.5+). Threshold 0.1 = 100× typical gradient magnitude → fires only on tail of distribution. Cheaper than AGC (no per-param norm computation) so unlikely to trip eval budget.
830	2026-04-25T20:13:25Z	arch	750	750	arch	Per-head sub-LN: F.rms_norm(y, (head_dim,)) on attention output between XSA and attn_out_gate, decoupling gate sigmoid regime + proj's int6 quant input range from V-magnitude × ln_scale_factor variance. Retry of exp_640 mechanism with .contiguous() guard for FA3 non-contig output (suspected prior crash cause).	-0.0006	crash				600.120000	28.900000	976.000000	apg-arch-0825		Mechanism-distinct from prior V-norm attempts (exp_150/235/296 normalized V before attention; this normalizes output AFTER softmax(QK)·V) and from exp_663 gate-input RMS-norm (eval_budget_overrun). Pre-norm RMS(y) ≈ V_magnitude × avg_attn_weight × ln_scale_factor (highly variable across blocks); post-norm y is unit-RMS per-head, giving gate a well-defined sigmoid regime and proj a bounded int6 calibration range. proj has _zero_init=True so no init-time disruption. Composes orthogonally with kept exp_245 (input-side ln_scale damping) and kept exp_538 (gate weights) — this fixes their input scale. | torch.distributed.elastic.multiprocessing.errors.ChildFailedError: ============================================================ (train_gpt.py:1047 in gptq_quantize_weight)
831	2026-04-25T20:14:14Z	meta	750	750	meta	SCALAR_LR 0.02 → 0.019 (gentle -5% DOWN midpoint between current and exp_792's failed -10% size_blocked-at-improvement-bpb-1.071951): retry the strongest recent meta signal at half the step to pass the size gate, on the proven scalar-control-LR DOWN axis (exp_177 ADAM_WD DOWN kept).	-0.00013	size_blocked	1.072416		16000573	600.044000	585.000000	1522.000000	apg-meta-0821		Single-literal change at L149 default 0.02 → 0.019. +1 char, byte-neutral net (size_project 23303 ≤ 16MB cap with massive headroom; size risk lives in post-train GPTQ entropy, not code). Mechanism: lower scalar_lr → less drift on ~30K control scalars (ln_scale, qk_gain, embed_scale, skip_gates) → tighter weight distribution under quant. exp_792 measured bpb=1.071951 (Δ=-0.000259) at SCALAR_LR=0.018 size_blocked; exp_204 at 0.015 (-25%) failed earlier on depth-10 stack. -5% midpoint is untested. Zero compile-graph risk, zero new params.
832	2026-04-25T20:18:04Z	tok	750	750	tok	Reparameterize embed_scale [D] from linear (init=1) to log-exp (init=0, applied as torch.exp(log_s)): bitwise-identical step 0, but Adam-WD on log_s pulls s→1 (the init), not s→0 as the current linear param does. Multiplicative-update geometry on the per-feature scale.	-0.0001	size_blocked	1.073465		16002378	600.104000	590.700000	1532.000000	apg-tok-0822		Two-line edit: L638 init torch.ones→torch.zeros; L736 add torch.exp() wrapper inside the rms_norm call. +26 code bytes vs exp_750 (23,318→23,344). Untried in tok history (closest: exp_267 keep linear init=1.0, exp_190 keep). Mechanistic claim: scalar AdamW group has WD=h.adam_wd=0.005 — under linear param, WD shrinks s toward 0 (decoupling from useful unit-scale init); under log param, WD shrinks log_s toward 0, i.e., s toward 1.0 (the init), which is the natural unit-scale point. Marginal expected delta but zero risk of size_block, zero param count delta, and structurally novel.
833	2026-04-25T20:26:43Z	curr	750	750	curr	Length curriculum: mask y positions seq_len//2.. with -100 for first 25% of train wallclock, forcing CE gradient onto positions 0..1023 (short context) early; full long-context training resumes after.	-0.0005	size_blocked	1.073724		16001980	600.039000	595.400000	1533.000000	apg-curr-0825		Mechanism-distinct from all prior curr masks: exp_217/309/667/668 masked the SHALLOW half (positions 0..N), this inverts to mask the DEEP half early (classic easy-to-hard curriculum). LESSONS.md hint flagged length-bucketing as untried. seq_len=2048 fixed, so masking via ignore_index=-100 in y rather than dynamic shapes. Threshold 25% leaves 75% of run for full-length training. Single 2-line edit (+111B code) inside step_fn closure of train loop, captures max_wallclock_ms from outer scope (already used by muon_momentum_frac). Risk: less long-context exposure could hurt eval (which scores deep positions); upside: cleaner early-step gradients on tractable short-context, faster representation stabilization.
834	2026-04-25T20:27:13Z	eval	750	750	eval	Replace TTT cosine LR decay with linear (1-ci/(N-1)) across chunks — preserves total LR mass but no early plateau and slightly more tail LR.	-0.0003	discard	1.072545	+0.000335	15999767	600.020000	529.900000	1428.000000	apg-eval-0827		Two-line change in eval_val_ttt: revert leftover K/V freeze threshold 200000-to-10000 to match exp_750 baseline (cleans up exp_824 size_blocked leftover, -12 bytes), replace cosine LR formula with linear decay (-4 bytes). Net code -4 bytes vs exp_750. Median chunk LR identical at 0.5*ttt_lr; cosine holds 0.85*ttt_lr through chunk N/4 then plummets, linear has smoother monotonic decline. Hypothesis: cosine early plateau over-adapts to chunk 0-50 post-GPTQ noise; linear smoother early decay plus larger tail mass (0.25 vs 0.146 at frac=0.75) reduces front-loaded over-adaptation and keeps late chunks responsive.
835	2026-04-25T20:30:42Z	opt	750	750	opt	Recurrence-aware Muon LR (bugfix retry of exp_827): scale main-train Muon base_lr by 1/sqrt(num_loops+1)=0.577 on looped blocks [3..5] only. Previous trial crashed on name parsing — base_model.blocks.named_parameters() returns names without 'blocks.' prefix, so block_idx = name.split('.')[0] not [1]. Fix is one-character.	-0.0003	size_blocked	1.075299		16000893	600.043000	580.000000	1513.000000	apg-opt-0828		Same hypothesis as exp_827 with the indexing bug fixed (split('.', 1)[0] now correctly grabs the leading block index from names like '0.attn.c_q.weight'). Splits Muon into 4 groups: {attn-nonloop, attn-loop, mlp-nonloop, mlp-loop} with the loop subgroups at 1/sqrt(3)x base_lr. Per-physical-block main-train Muon LR scaling is unexplored in 800+ trials. Code +288 packed bytes (vs exp_750), within tight cap.
836	2026-04-25T20:33:07Z	loss	750	750	loss	Gentle focal CE (γ=0.25, mean-preserving) on TTT inner CE only — first focal probe on TTT axis (prior focal exp_054/144/439/498 all targeted main CE). Composes with kept exp_596 z-loss orthogonally.	-0.0003	size_blocked	1.073303		16001088	600.035000	583.000000	1516.000000	apg-loss-0829		"L1401: F.cross_entropy(...,reduction=""none""), _w=(1-exp(-_ce.detach()))^0.25, loss=(w*ce).mean()/w.mean()+1e-5*lse².mean(). +57 code bytes. PR #1318 precedent (focal in SLOT closure)."
837	2026-04-25T20:36:57Z	reg	750	750	reg	SGLD-style Gaussian gradient noise injected into TTT inner-loop SGD (alpha=h.ttt_lr*0.01, added pre-AVG so all_reduce synchronizes noise across ranks).	-0.0003	size_blocked	1.073053		16001640	600.083000	589.000000	1525.000000	apg-reg-0830		Mechanism-distinct from all prior reg axes in tree (label smoothing exp_578/631, dropout exp_805, WD on TTT-SGD exp_817, momentum-reset exp_588/769, grad-clip exp_786). Pre-AVG noise scaled by sqrt(world_size) so post-AVG std equals h.ttt_lr*0.01, keeping optimizer.step deterministic across ranks. Hypothesis: per-chunk SGD currently overfits to chunk-local statistics; small Langevin noise prevents convergence to chunk-local optima, generalizing better to next-chunk scoring under score-first. Code: +204 bytes (23309->23513). No params, no model size delta.
838	2026-04-25T20:39:18Z	quant	750	750	quant	Tight 3-point per-row GPTQ scale grid {0.96, 1.0, 1.04} on top of current best — partial rescue of exp_728 (5-point {.8,.9,1,1.1,1.25} won val_bpb 1.069841 but size_blocked); tight 4 percent grid limits per-row Q histogram divergence so brotli stays under 16MB cap while still capturing tail-asymmetry signal that fixed clip_sigmas misses.	-0.0006	size_blocked	1.071830		16262087	600.024000	585.800000	1527.000000	apg-quan-0830		Insert at gptq_quantize_weight just after sf=s.float() (L1040). Per-row search picks alpha in {0.96,1.0,1.04} minimizing sum_j (W_rj - s*alpha*round(W_rj/(s*alpha)))^2 (plain MSE, matching exp_728's objective). Storage shape unchanged (still fp16 per row). Code +330B. Memory peak: 3*rows*cols fp32 (~50MB for embed 8192x512). Mechanism: 4 percent scale variation gives each row the option to either (1) tighten scale to reduce round-MSE on Gaussian bulk, or (2) widen scale to reduce clipping loss on heavier-tail rows — both choices fixed clip_sigmas=12.85 cannot make. Vs exp_728's 5-point {0.80..1.25}: my 3-point grid limits scale variance ~6x tighter (max 4 percent vs 25 percent), expected to limit brotli histogram divergence proportionally. Risk: if even 4 percent spread blows brotli budget, size_blocked. Falls back to current best at alpha=1.0 for any row whose unweighted MSE is minimized at unit scale.
839	2026-04-25T20:42:14Z	ttt	750	750	ttt	Re-add exp_588's chunk-boundary momentum_buffer halving (mb.mul_(0.5) for ci>0) onto the new exp_750 baseline, banked by trimming the eval_val_ttt docstring + cosine comment for byte-negative net (-155 packed code bytes)	-0.0003	size_blocked	1.073632		16000775	600.112000	585.500000	1522.000000	apg-ttt-0832		exp_588 won standalone Δ=-0.000727 on exp_538 baseline but was lost when exp_596 forked from exp_538 instead of exp_588. Subsequent re-add attempts on exp_596-derived baselines were size_blocked (exp_607 fit but +0.000362 vs z-loss; exp_769/751 size_blocked with +120/+8 bytes respectively). Now byte-negative thanks to docstring trim, fitting comfortably under the 1.286KB headroom of exp_750. The exp_750 baseline differs from the exp_596 baseline (Muon momentum decoupling, exp_746 grad centralization) so the dynamics may interact differently with mb.mul_(0.5) than they did at exp_607. Mechanism: stale Nesterov velocity from prior chunk's text distribution gets attenuated 50% at each chunk boundary, freeing per-chunk SGD trajectory of cross-chunk drift while preserving within-chunk acceleration.
840	2026-04-25T22:44:33Z	opt	750	750	opt	Replace fixed Newton-Schulz coefficients (3.4445,-4.775,2.0315) with 5 per-iteration minimax-optimal Polar Express tuples (ported from PR#1792/PR#1344): first step uses aggressive (8.16,-22.48,15.88) to rapidly reduce error, subsequent steps use gentler corrections — produces a higher-quality Muon polar factor per gradient step.	-0.001	discard	1.075173	+0.002963	15997202	600.091000	581.200000	1516.000000	apg-opt-0840		PE coefficients from PR#1792 (all 7 compliance gates pass in our environment, val_bpb=1.07006 stacking multiple techniques). Isolated to just the NS coefficient change — no MIN_LR floor, no gated-attn, no AlphaLoRA. The 5 PE tuples match our backend_steps=5 exactly. torch.compile should constant-fold _PE_COEFFS[min(i,4)] since loop bound is concrete Python int at trace time.
841	2026-04-25T22:44:46Z	tok	750	750	tok	Add learnable per-feature bias [embedding_dim=512, init=0] after the embed-RMSNorm, completing the affine transform (scale already learned via embed_scale); zero-init preserves step-0 equivalence, costs ~1 KB in artifact (float16 passthrough).	-0.0003	eval_budget_overrun	1.076039			600.132000	603.400000	1541.000000	apg-tok-0840		Embed pipeline currently does F.rms_norm(x * embed_scale) with no additive shift. Adding embed_bias gives full affine freedom at negligible parameter cost. Three-point edit: (1) Parameter declaration (zeros init), (2) forward_logits applies + embed_bias.to(dtype) after RMSNorm, (3) optimizer adds embed_bias to scalar_params group (AdamW, frozen during TTT by numel<10000 rule). No prior tok or any specialist experiment has tried this.
842	2026-04-25T22:48:16Z	quant	750	750	quant	FreqGPTQ: weight GPTQ Hessian by sqrt(token_frequency/mean_freq) so high-frequency tokens (which dominate BPB) get proportionally higher error-correction priority during quantization.	-0.0003	size_blocked	1.076450		16009833	600.029000	583.900000	1518.000000	apg-quan-0840		Two-pass collect_hessians: first pass iterates calibration batches to count token frequencies (via bincount, no model forward), saves batches; computes freq_w=sqrt(count/mean). Second pass replays saved batches with hook scaling x *= freq_w[token_id] before addmm_ so H=sum_t freq_w[t]*x_t x_t^T. Technique from PR #1721 (freq-GPTQ, tagged quant/medium-risk), adapted to our baseline's hook-based collect_hessians. tok_emb output hook left unweighted (final-layer hiddens don't map cleanly to input tokens). Code cost +363 bytes (19963 total), well within cap.
843	2026-04-25T22:49:17Z	arch	750	750	arch	In parallel-residual blocks (7-10), MLP branch reads pre-mix x while attn keeps reading x_in: asymmetric input routing concentrates x0-anchor through attn only.	-0.0005	eval_budget_overrun	1.075364			600.138000	603.400000	1556.000000	apg-arch-0840		Single-character edit on Block.forward L614: mlp_norm(x_in) -> mlp_norm(x) inside the parallel branch. Step-0 equivalent (mix[1]=0 init -> x_in==x), divergence only as mix[1] grows. Byte-neutral (-3 chars). Mechanism-distinct from all prior resid_mix trials (exp_143/391/507/711/302) which only altered mix[1] magnitude/init globally; none decoupled per-branch input source. Sequential blocks (incl. looped 3-5) untouched.
844	2026-04-25T22:49:59Z	reg	750	750	reg	Stochastic depth with linear schedule (max_p=0.05 at last layer): randomly replace a block's output with its input during training, using a per-block tensor mask (fullgraph-compile safe), forcing ensemble-like subnetwork diversity across the 11 blocks and 3× recurrent loop calls.	-0.001	discard	1.082079	+0.009869	15998083	600.120000	591.500000	1538.000000	apg-reg-0840		Linear schedule: block i gets sd_p = i/num_layers*0.05 (block 0: 0.0, block 10: 0.0455). Formulation: s=(rand()>=sd_p).to(dtype); x_out = x + s*(x_out-x). When s=0 block is skipped, when s=1 normal output. No scaling correction (max_p=0.05 makes it negligible). Fullgraph-compile safe: self.training specializes the compiled graph, self.sd_p>0.0 is a Python-float guard folded at trace time (block 0 graph never includes the stochastic branch), torch.rand(()) is a stochastic op handled by compile. Looped blocks 3-5 each see independent drop decisions across their 3 calls, providing additional ensemble diversity for those high-gradient blocks. Never tried in 40+ reg experiments.
845	2026-04-25T22:50:38Z	meta	750	750	meta	Per-group ADAM_EPS split: raise scalar-group AdamW eps 1e-8 to 1e-7 only, leave optimizer_tok at h.adam_eps. Inverse of exp_819 (tok-only raise, hurt).	-0.0002	discard	1.074837	+0.002627	15997518	600.027000	587.500000	1522.000000	apg-meta-0840		L926 only. Mechanism: scalar group holds sparse-gradient control tensors where larger eps softens 2nd-moment denominator and equalizes step sizes; tok_emb is dense-gradient so eps barely matters there.
846	2026-04-25T22:51:47Z	ttt	750	750	ttt	Add Gradient Centralization to TTT SGD: zero-mean each 2D+ parameter gradient across input dims after DDP all_reduce and before clip_grad_norm. GC won Δ=−0.000300 on exp_538 (exp_592) and Δ=−0.000005 on exp_592 (exp_746), but was never applied to exp_750's branch (previous attempt exp_627 was size_blocked at ~23K packed bytes; current workdir is 19,856 packed bytes with +52B headroom).	-0.0001	discard	1.074403	+0.002193	15996219	600.106000	590.200000	1526.000000	apg-ttt-0840		GC subtracts per-row mean from each 2D+ gradient tensor, projecting updates onto the row-mean-zero subspace. Mechanism is orthogonal to z-loss (which bounds logit magnitudes) and to momentum/LR schedule changes. Three new lines between all_reduce and clip_grad_norm. +52 packed code bytes (19804→19856). The prior attempt (exp_627) was size_blocked because the codebase was at ~23,296 packed bytes at the time; with the current workdir at 19,856, the size constraint is no longer binding.
847	2026-04-25T22:55:06Z	eval	750	750	eval	Fuse all_reduce loop with per-row Gradient Centralization (g.sub_(g.mean(1,True)) for 2D TTT params) in a single compact loop — equivalent to exp_592's GC that gave Δ=-0.000300 on exp_538, now applied to exp_750 baseline; uses dim==2 shorthand to stay within size budget (+34 packed bytes vs exp_795's larger per-row GC that size_blocked).	-0.000100	discard	1.074369	+0.002159	15994717	600.092000	531.500000	1425.000000	apg-eval-0840		exp_795 tried adding row GC to exp_750 but size_blocked (+74 chars net). exp_811 tried col GC (OK, +39 chars, discard). This approach fuses the all_reduce block with GC in one loop — replace the 4-line if world_size>1 block with a 5-line for-p-in-ttt_params loop that does all_reduce and GC in the same pass. Net code delta: +34 packed bytes. 2D-specific mean(1,True) is identical to general mean(dim=list(range(1,g.dim())),keepdim=True) for all weight matrix shapes. GC applied after all_reduce (averaging then centering == centering then averaging since mean is linear).
