exp_id	timestamp	specialist	parent_exp	baseline_exp	domain	hypothesis	expected_delta	status	val_bpb	delta_vs_best	artifact_bytes	train_s	eval_s	total_s	job_name	snapshot_path	notes
761	2026-04-25T15:55:18Z	reg	750	750	reg	Per-(chunk,epoch) random shuffle of TTT inner-loop batch start indices via seeded torch.Generator: replaces sequential scan with deterministic permutation, creating 4 distinct gradient trajectories per chunk to decorrelate batch order from token-position semantics — canonical SGD regularizer never tried in current best lineage (exp_264's fwd/rev alternation is on a sibling branch, not present in exp_750).	-0.0003	size_blocked	1.072514		16003543	600.005000	581.900000	1527.000000	apg-reg-0759		Two-line insertion + iterator swap at line 1387. _bs_starts precomputed once per chunk; per-epoch torch.Generator seeded with ci*64+_ep for reproducibility (different ranks share seed → identical permutation, no all_reduce ordering risk beyond pre-existing my_chunk_seqs ±1 variance). Zero new model params, ~250 raw code bytes, lzma-compressed delta well under 1KB. Distinct from: exp_264 (sibling branch, fixed fwd/rev not random), exp_756 (intra-chunk param averaging, discard), exp_588 (momentum buffer halving at chunk start, kept — different state). Reg domain because the mechanism is regularization-of-trajectory (data ordering shuffle is the canonical SGD regularizer per Bertsekas/Bottou). Risk: chunk sequences may be small enough that 4 random shuffles offer marginal diversity.
762	2026-04-25T15:55:40Z	eval	750	750	eval	Symmetric (doubly-centered) Gradient Centralization on TTT SGD: subtract BOTH per-row mean AND per-column mean from each 2D+ ttt_param gradient before clip+step. exp_592's per-row GC alone gave −0.000300, and stacking with z-loss (exp_746) was kept at −0.000005 — symmetric form removes the column-mean component still present after row-GC, projecting gradients onto a strictly more constrained mean-zero subspace. Untried structural variant; same compute cost as exp_592's GC.	-0.0003	size_blocked	1.072392		16003513	600.100000	594.500000	1537.000000	apg-eval-0759		Adds 6 lines (~340 code bytes) inside eval_val_ttt's TTT SGD inner loop right after grad all_reduce, before clip_grad_norm_. Structurally distinct from prior eval-domain GC variants: exp_592 only zeroed row-means (dim=1..N), this also zeros column-means (dim=0). Sequential application is not idempotent but standard in DL practice. No model-byte impact, no compile-graph risk (the TTT path is eager). Only the TTT inner SGD is touched — main-train Muon path is untouched.
763	2026-04-25T15:55:40Z	ttt	750	750	ttt	Mean-preserving front-loaded z-loss schedule across 4 TTT epochs.	-0.0002	size_blocked	1.072280		16000073	600.116000	587.000000	1523.000000	apg-ttt-0759		
764	2026-04-25T15:55:57Z	curr	750	750	curr	Replace random self.rng.shuffle(shard_plan) with deterministic Bresenham largest-error interleave: each batch position picks the shard with greatest accumulated quota credit, then debits by batch_size. Provably maximizes within-batch shard spread (zero clustering variance) while preserving exp_196's largest-remainder quota totals. Distinct mechanism from exp_571 (no-shuffle, kept grouped → discard) and from all phase/permutation variants.	-0.0001	size_blocked	1.073102		16000262	600.087000	585.100000	1523.000000	apg-curr-0759		Two-line replace in next_batch: drops np.concatenate(...) + self.rng.shuffle(shard_plan), adds Bresenham loop (6 short lines, ~250 raw bytes; raw code 23410→23401). One untried axis: within-batch ORDER decorrelation via deterministic round-robin instead of shuffle randomness. Random shuffle has stdev~sqrt(B/K) clustering noise; Bresenham eliminates it. Also frees one self.rng draw per batch — downstream rng state shifts forward by one fewer call, no _phase_order/_seq_rng impact (phase_order set in __init__ before this line; sequence_order uses self.rng but per-shard reset cadence is unchanged).
765	2026-04-25T15:57:54Z	loss	750	750	loss	Gate kept exp_596 TTT z-loss to epochs>=1 only.	-0.0003	size_blocked	1.072457		16000694	600.104000	584.300000	1525.000000	apg-loss-0759		
766	2026-04-25T15:58:06Z	tok	750	750	tok	WARP-inspired word-start additive bias [embedding_dim=512, init=0] applied to tok_emb output ONLY on tokens whose SentencePiece begins with leading space (word boundary), gated via a non-persistent has_leading_space LUT registered in GPT.__init__. Structurally orthogonal to the existing multiplicative gauge-fixed embed_scale.	-0.0005	size_blocked	1.075950		16005804	600.139000	590.300000	1533.000000	apg-tok-0759		PR #1252 (WARP) injected word-boundary structural priors via larger learned modules. Parameter-minimal analogue: 512-dim additive bias gated by leading-space LUT, registered in scalar AdamW group, frozen during TTT under existing numel<10000 rule (exp_491 keep). Buffer persistent=False so the LUT isn't packed. Distinct from prior bigram_alpha (exp_655/665, both discarded) which used PREV-token embedding mixing — this is identity-conditional. Init=0 ensures step-0 transparency.
767	2026-04-25T16:01:29Z	quant	750	750	quant	Eval-aligned position weighting on GPTQ Hessian: weight last-64 calibration positions by 10x to align H with sliding-eval scoring concentration (stride=64 means ~99% of scored tokens at positions 1984-2047).	-0.0002	discard	1.072636	+0.000426	15998886	600.149000	597.300000	1536.000000	apg-quan-0759		_evalw helper + 2 callsites in make_hook (attn/mlp) and make_output_hook (tied tok_emb). Code +290 packed bytes. Hessian-only change so Q codes don't change structurally; brotli impact near-neutral. Weight=10 makes last-64 contribute 76% of H mass while preserving 24% from positions 0-1983 to anchor against rank-deficiency on 2048-dim mlp matrices. Distinct mechanism from exp_339's sqrt(linspace 0.9,1.1) ±5% gradient (discard +0.000044).
768	2026-04-25T16:01:29Z	arch	750	750	arch	Block-major depth recurrence: loop order [3,3,3,4,4,4,5,5,5] instead of [3,4,5,3,4,5,3,4,5] — each looped block does 3-step fixed-point iteration on its own input.	-0.0005	size_blocked	1.076752		16000868	600.078000	581.600000	1516.000000	apg-arch-0759		Single-site edit in GPT.__init__ all_indices construction. Same total length=17, same per-block invocation count=3, same encoder/decoder split. Mechanism: each looped block becomes a fixed-point iterator on its own residual input rather than participating in a segment-level cycle. Distinct from exp_352 (left-rotation of segment per iteration, discarded). Zero param/byte cost.
769	2026-04-25T16:26:11Z	ttt	750	750	ttt	Re-introduce exp_588's TTT chunk-boundary momentum_buffer halving (mb.mul_(0.5) for ci>0): proven Δ=-0.000727 at exp_538 baseline but lost from lineage when exp_596 forked from exp_538 instead of exp_588. Golfed to ~120 bytes inside eval_val_ttt cosine-LR block.	-0.0003	size_blocked	1.073654		16001067	600.147000	580.900000	1503.000000	apg-ttt-0767		Mechanism: SGD+Nesterov accumulates momentum across TTT chunks. Topical distribution shift between chunks makes prior-chunk momentum partly misdirected. Halving softly decorrelates without throwing away all carry-over signal. exp_588 measured -0.000727 vs exp_538 (1.073466→1.072739). Stacking onto exp_750 (1.072210) is uncertain — gain may be smaller since exp_596 z-loss + exp_750 muon-warmdown changes may already dampen related divergence. Code bytes +45, no model-byte impact (eval-time TTT runs post-quantization).
770	2026-04-25T16:26:26Z	opt	750	750	opt	Anchor Muon weight_decay shrinkage during warmdown by setting wd_dyn = wd / max(lr_scale, 0.5) per step.	-0.0003	discard	1.076457	+0.004247	15994758	600.149000	585.500000	1520.000000	apg-opt-0767		Decouples WD from lr_scale tail collapse to maintain peak shrinkage rate over upper half of warmdown.
771	2026-04-25T16:29:40Z	loss	750	750	loss	Replace TTT-only z-loss L2 form (1e-5*logsumexp.pow(2).mean) with L1 form (1e-4*logsumexp.mean) on epochs>=1 — same kept gating, structurally different penalty: L1 has uniform per-position gradient magnitude whereas L2 scales with lse value (over-correcting outlier positions); coefficient recalibrated to match average gradient magnitude at typical lse≈9 (2λ_L2·lse ≈ λ_L1).	-0.0001	discard	1.073297	+0.001087	15997421	600.133000	536.400000	1440.000000	apg-loss-0769		Saves ~6 bytes vs kept exp_596 form (helps size pressure: 6 of last 8 trials size_blocked). Untried penalty form on z-loss axis: exp_675 variance form size_blocked at 1.0729; exp_694 anchor-shift size_blocked at 1.0735; exp_576 logit-L2 size_blocked at 1.0726. lse is always positive so abs() is unnecessary. Mechanism: L1 robust to outlier high-lse positions (quantization-noise driven); L2 quadratic over-correction may fight beneficial high-confidence predictions.
772	2026-04-25T16:29:42Z	eval	750	750	eval	Score-phase logit softening (mult 0.99, T=1.0101) on BOTH eval_val_sliding and eval_val_ttt score-phase NLL only. TTT inner-loop loss untouched.	-0.0008	size_blocked	1.072482		16002687	600.009000	594.600000	1529.000000	apg-eval-0769		Two-line replace_all at L1280 (eval_val_sliding) and L1361 (eval_val_ttt score-phase) inserting * 0.99 after .float() before CE. TTT inner-loop loss at L1401 untouched so SGD gradient direction unchanged. Eval-domain scope lists temperature calibration but no prior swarm trial tried it. Direction T greater than 1 for likely over-confidence (Guo 2017) with 1e-5 z-loss too weak to counter. ~12 raw chars added, ~10 lzma bytes; safe vs exp_750 cushion.
773	2026-04-25T16:29:49Z	reg	750	750	reg	Lower muon_wd_mlp 0.115 → 0.108 (-6.1% DOWN extension probe of exp_336's kept -8% DOWN move on this knob): single literal at line 168, the only WD-axis with a recently kept DOWN direction in the current best lineage	-0.00005	size_blocked	1.073251		16001055	600.072000	593.700000	1541.000000	apg-reg-0769		Single literal at line 168 (MUON_WD_MLP default 0.115→0.108). Code bytes barely change (-11B from baseline). Zero new params, zero compile-graph risk. Mechanism: exp_336 (meta) kept 0.125→0.115 (-8%) on this knob; subsequent moves on other Muon WD knobs (attn 0.095±, embed_wd 0.085±, qk-sub) all discarded or size_blocked, but this exact axis hasn't been re-probed below 0.115. -6.1% step is conservative (smaller than exp_336's kept -8% step). MLP zero-init residual writers (mlp.proj) absorb less weight pull at 0.108, leaving slightly more residual signal in the MLP path during warmdown EMA settle. Risk: GPTQ entropy shift may size_block (exp_550 zero-byte ADAM_WD probe size_blocked due to brotli-output drift on shifted weights) — but mlp.proj is zero-init and should not produce dramatic distribution change at -6%. Expected delta: very small (-0.0001 to +0.0001 noise band). Goal: validate the WD-MLP DOWN axis or close it.
774	2026-04-25T16:30:05Z	curr	750	750	curr	Change Latin-square phase bucket count 8 to 11 (prime, coprime with seq_len=2048).	0.0	discard	1.073200	+0.000990	15997790	600.070000	540.000000	1440.000000	apg-curr-0769		
775	2026-04-25T16:31:49Z	tok	750	750	tok	Tied-symmetric gauge — reuse input-side embed_scale [512] at the tied LM head readout via F.linear(x * embed_scale, tok_emb.weight), with NO extra rms_norm wrapper (distinct from exp_677 size_blocked, exp_721 size_blocked) and applied to the working stream x not x0 (distinct from exp_711 eval_budget_overrun).	-0.0001	discard	1.075152	+0.002942	15980963	600.046000	588.300000	1528.000000	apg-tok-0769		Single-site forward edit at the tied-readout call (one line in GPT.forward_logits). Zero new params, +177 packed code bytes (23309->23486). Init=1.0 -> step-0 output bitwise identical to exp_750 baseline, so model_bytes shift after training depends only on how the optimizer drives embed_scale's absolute magnitude under the new dual-endpoint gradient. Mechanism: the input-side application is gauge-fixed (rms_norm(x*s) absorbs global scale of s), so embed_scale only learned RELATIVE per-feature weights up to now. Adding x*s at the readout exposes embed_scale's ABSOLUTE per-feature magnitude as a gradient direction. Distinct from exp_677 (extra rms_norm wrapper regauges it back), exp_711 (x0 only), exp_721 (multi-site stack), exp_260 (separate output_scale param, discarded). Risks: (1) Size — recent same-magnitude code edits hit size_blocked; mitigated by init-equivalence. (2) Gradient: embed_scale gets two-sided gradient — wd=0.005 and small LR keep it near 1.0. (3) Logit magnitude: softcap=30 has margin since s~1.0.
776	2026-04-25T16:32:53Z	meta	750	750	meta	Raise mm_blend floor 0.25→0.27 — untested midpoint between current best floor=0.25 kept and exp_562 floor=0.28 size_blocked at improved bpb 1.072734. Single-char edit at L1484, byte-neutral.	-0.00005	size_blocked	1.073412		16001804	600.078000	583.200000	1515.000000	apg-meta-0769		Line 1484: `max(lr_scale, 0.25)` → `max(lr_scale, 0.27)`. Comment also updated 0.25→0.27. Byte-neutral. No new params, no compile-graph risk. Closest prior probes: exp_555 (0.30, size_blocked at 1.072581 on older baseline), exp_562 (0.28, size_blocked at 1.072734), exp_744 (0.20, discard +0.001013), exp_324 (0.0→0.25 kept). Under exp_750's decoupled cool target=0.93, deepest-warmdown muon_momentum lifts from 0.9450 to 0.9462 — finer probe testing whether the directionally-improving 'less momentum cooling at deep warmdown' axis still has marginal headroom under the post-750 stack.
777	2026-04-25T16:36:08Z	quant	750	750	quant	Fisher-weighted GPTQ Hessian: weight per-token x⊗x by ||∂L/∂y_t||² (output-side gradient norm) on attn/mlp linears, mean-normalized per-batch so total H mass matches baseline.	-0.0005	eval_budget_overrun	1.072454			600.007000	604.800000	1544.000000	apg-quan-0769		Replaces collect_hessians input-second-moment H = E[xx^T] with Fisher-flavored block-Hessian H ≈ E[xx^T · ||∂L/∂y||²]. Theoretical motivation: the OBQ derivation that GPTQ implements approximates ∂²L/∂W² which (for y=xW^T) factors as x⊗x weighted by per-token output curvature; the standard implementation drops the curvature term as a uniform-1 weight (empirical activation covariance). Since the model has been pre-quant-TTT-adapted, gradient magnitudes encode where the post-TTT model still has prediction uncertainty — those tokens deserve more H mass during quantization. Mean-normalization per batch (w/=w.mean) preserves total H mass so the kept exp_377 1.01x multiplicative damping stays at the same proportional ridge. Hooks: attn/mlp register a tensor backward hook on the linear's `out` to capture ∂L/∂y; tok_emb path is unchanged (its input-second-moment Hessian is preserved since the tied LM head's matmul is not a module — output gradient at head_proj is ∂L/∂x ≠ ∂L/∂y_logits, the proxy would be misleading). Drops `with torch.no_grad():` and uses model(x, y).backward() to materialize gradients (zero_grad before/after to avoid param.grad accumulation across batches). Distinct from prior probes: exp_339/767 (position weighting on x), exp_510 (winsorized x), exp_280/377 (multiplicative damping), exp_594 (token-frequency weighting) — none weighted by gradient signal. Code +0 bytes packed (lzma actually shrunk slightly due to repetitive lambda/hook patterns). Backward adds ~2x cost on 64 calibration batches, well within the 600s eval budget. Risk: Q code distribution will shift (act-order perm reorders by Fisher-weighted H.diag instead of raw H.diag), potentially affecting brotli entropy by ±KB; comparable H-modifying probes (exp_767 H pos-weight, exp_280 mul damping) shipped successfully so size impact should be tolerable.
778	2026-04-25T16:40:20Z	arch	750	750	arch	Per-pass loop offset: single learnable [model_dim] vector (zero-init), modulated by hard-coded linear-ramp pass scalar (0, 0.5, 1.0) and added to residual at entry to each call of looped blocks 3-5; breaks translational symmetry of the 3 identical recurrence passes via PR1518-style additive feature-level offset, byte-cheap (one [512] param vs num_loops+1 vectors).	-0.0008	size_blocked	1.072971		16000850	600.084000	593.400000	1534.000000	apg-arch-0769		Adds GPT.loop_pass_offset = nn.Parameter(zeros(model_dim)) when num_loops>0; precomputes encoder/decoder per-position pass-scalar lists (0 for non-loop blocks, k/num_loops for loop pass k) in both active and inactive forms matching the existing range/encoder_indices iter shape switch; forward_logits applies sc * loop_pass_offset at each block call when sc>0; DDP ghost-touch x = x + 0.0 * loop_pass_offset.sum() after embed (mirrors exp_716 fix) keeps param in autograd graph during the pre-looping_active warmup. loop_pass_offset registered into scalar_params (AdamW). Pass-0 scalar is 0 by design — pass 0 IS the reference, passes 1-2 learn how to differ. Mechanism-distinct from exp_716 (multiplicative scale init=1, [3] scalars, 1.073128 size_blocked), exp_507 (per-block resid_mix init bump, crash), exp_352 (rotation permutation, +0.002194 discard). Param: 512 fp32 = 2048 raw -> fp16 passthrough (numel<65536) ~200-500 B packed on near-zero init. Code +947B raw (~250B packed). Step-0 transparent.
779	2026-04-25T16:57:26Z	opt	750	750	opt	Per-group Muon mm_blend SHAPE split: attn (g0) uses sqrt-with-floor (max(lr_scale**0.5, 0.25)), mlp (g1) keeps linear-with-floor (max(lr_scale, 0.25)); shared floor=0.25 and cool target=0.93.	-0.0001	size_blocked	1.073478		16002616	600.120000	533.900000	1433.000000	apg-opt-0776		Schedule SHAPE axis was only ever tested globally: sqrt-with-floor was exp_670 discard +0.000139 atop exp_596 baseline and exp_574 size_blocked at bpb=1.072782. Per-group shape split is genuinely untouched. Group split itself has precedent (exp_164 keep: muon_wd attn=0.095/mlp=0.115). Mechanism: attn projections are tall/skinny (512x512 ~0.5M each) with low-rank head-structured updates; sqrt holds momentum higher in mid-warmdown (at lr_scale=0.5 mom=0.9621 vs 0.96 linear; at lr_scale<=0.0625 mom=0.945 floor-clamped same). MLP matrices are 4x wider (512x2048 ~2M) with broader gradient spectra so can afford fresher per-step gradient via current linear cool. Per-group target split (exp_759 attn=0.93/mlp=0.94, discard +0.000402) is structurally distinct from per-group shape split. Code +52 bytes (23296 -> 23348).
780	2026-04-25T16:58:31Z	ttt	750	750	ttt	Leaky-anchor pull-back at TTT chunk boundary lerp params 0.5pct toward post-quant initial weights after each chunk SGD epochs.	-0.0003	size_blocked	1.073582		16002882	600.114000	588.000000	1522.000000	apg-ttt-0776		Eval-only edit in eval_val_ttt: anchors snapshot then per-chunk lerp anchor 0.005. Quantization unchanged.
781	2026-04-25T17:02:59Z	tok	750	750	tok	Add untied per-feature output head_scale [embedding_dim, init=1.0] applied AFTER final_norm at tied LM head readout — asymmetric/untied analog of discarded exp_775 symmetric gauge, giving model independent DoF to weight features for logit production vs input encoding.	-0.0004	discard	1.074700	+0.002490	15981677	600.115000	584.300000	1520.000000	apg-tok-0778		Three changes: (1) new self.head_scale param [embedding_dim] init=1.0 in GPT.__init__, (2) forward_logits tied path becomes F.linear(x*head_scale, tok_emb.weight), (3) head_scale appended to scalar_params in Optimizers (gets scalar_lr=0.02, adam_wd=0.005). Caveat: GPTQ Hessian for tok_emb is hooked on final_norm so doesn't see head_scale post-multiplier, but head_scale stays near 1.0 (init+small WD bias) so misalignment is negligible. Init=1.0 → bitwise identical at step 0; gain depends on training+pre-quant TTT shifting head_scale away from 1. Frozen during TTT (numel=512 < 10000 by exp_491 logic). exp_775's failure was forced symmetric reuse of input embed_scale; this is the dual untied formulation that gives the model freedom to independently weight features at input vs output. Code +215 packed bytes; head_scale fp16 passthrough ~1KB raw, brotli-11 of constant=1.0 should compress to <100 bytes.
782	2026-04-25T17:04:12Z	eval	750	750	eval	Freeze the 3 looped blocks (loop_start..loop_end = 3..5) during eval-time TTT SGD, so adaptation only updates non-looped blocks (0,1,2,6..10) + tok_emb/heads — equalizes gradient amplification asymmetry (looped blocks see num_loops+1=3× forward passes per step, hence 3× gradient).	-0.0002	size_blocked	1.073617		16001090	600.044000	586.300000	1520.000000	apg-eval-0778		Untouched axis: prior block-level TTT controls only LR-scaled looped blocks (exp_548/557 discarded) or numel-thresholded scalars (exp_491 keep). Hard-freeze of looped blocks parallels exp_245 ln_scale loop correction (kept) and PR #1318's freeze-most-blocks-for-TTT pattern. Adds ~60 bytes via _loop_pids set-comprehension + lambda filter; structurally orthogonal to GC/z-loss/momentum/grad-clip axes.
783	2026-04-25T17:04:25Z	curr	750	750	curr	Mean-preserving token-id-stratified train CE: w=0.9+0.2*(target_id/8191) probes Gap 5 rare-token upweight at 2x magnitude vs exp_518's 0.10 ramp.	-0.0005	size_blocked	1.073100		16001098	600.137000	584.700000	1524.000000	apg-curr-0778		5-line edit at GPT.forward L772-777. Mean-preserving via /w.sum so loss scale unchanged. Code +34 bytes packed. exp_518 (0.95+0.10) was size_blocked at val=1.074774 better than then-best 1.075022. SP8192 frequency-sorted so high IDs are rare. torch.compile safe.
