exp_id	timestamp	specialist	parent_exp	baseline_exp	domain	hypothesis	expected_delta	status	val_bpb	delta_vs_best	artifact_bytes	train_s	eval_s	total_s	job_name	snapshot_path	notes
093	2026-04-22T08:43:22Z	eval	017	088	eval	Apply T=0.97 logit sharpening (divide pre-CE logits by 0.97) in eval_val_ttt scoring — mirror-direction test of exp_044's T=1.05 softening which was +0.002607 worse, indicating the post-GPTQ+TTT distribution is at or below calibration optimum; modest sharpening should pull val_bpb toward it.	-0.0010	eval_budget_overrun	1.079477			600.048000	780.952000	1515.000000	apg-eval-0088		Single-number edit to eval_val_ttt score-first CE only (not sliding-window eval, which is intermediate logging). Prior data: exp_044 T=1.05 softening worsened bpb by +0.002607 — strong asymmetric signal that the model is NOT over-confident. GPTQ int6 typically shrinks logit magnitudes by ~3-5% (weights smoothed/clipped), and TTT-SGD only partially restores magnitude under the low-step-count per chunk regime. T=0.97 is a conservative 3% sharpen: if optimum is T≈1.0, expected damage is ~+0.0004; if optimum is T≈0.95 (GPTQ softening prior), expected gain is ~-0.0015. No runtime, size, or training impact — only post-logits arithmetic during eval scoring.
094	2026-04-22T08:48:26Z	opt	088	088	opt	Lower Muon peak momentum from 0.99 to 0.97.	-0.0005	discard	1.077966	+0.001022	15992028	600.108000	757.892000	1472.000000	apg-opt-0090		Single-literal change at line 150. MUON_MOMENTUM is NOT harness-injected. Peak Muon momentum has never been tuned in the opt tree: exp_015 touched muon_momentum_warmup_start, exp_088 touched the warmup fraction. With exp_010 coupling, warmdown now traverses 0.97 to 0.92 instead of 0.99 to 0.92.
095	2026-04-22T08:53:05Z	reg	017	088	reg	Raise muon_wd 0.095→0.115 (+21%): direct sweep of the never-touched matrix-only weight-decay knob; tighter Linear-weight distributions should aid int6 GPTQ fidelity and add useful regularization pressure where prior forward-path noise (exp_040/050) and scalar-wd (exp_082/087) attempts failed.	-0.0008	discard	1.080472	+0.003528	15994528	600.034000	759.966000	1479.000000	apg-reg-0088		Single-literal default change at line 163 (MUON_WD 0.095→0.115). No new optimizer groups, no forward-path code. Interacts with existing exp_017 baseline muon_wd_scale logic (caps at 2× during warmdown), so effective peak-LR shrinkage rises 0.00209→0.00253/step and warmdown-phase shrinkage rises proportionally (still capped). Targets matrix params only (optimizer_muon); leaves tok_emb (embed_wd=0.085), scalar controls (adam_wd=0.02), and all forward-path code untouched — avoiding every prior reg-domain failure mode. Muon_wd has never been swept directly in this tree: exp_041 touched embed_wd (size_blocked low), exp_048 touched adam_eps (size_blocked), exp_082/087 touched adam_wd (crash/discard). +21% is a moderate step; larger than typical fine-tune perturbations, so the signal should be unambiguous even if noisy.
096	2026-04-22T09:05:19Z	loss	017	088	loss	"Raise logit_softcap default 30.0→100.0 — effectively removes the tanh output squash for realistic logit magnitudes (|x|≲15 → <1% dampening vs ~4-8% at cap=30) while retaining asymptotic safety; loss-domain's one untouched model-side regularizer, in the direction consistent with the observed ""remove regularization, not add"" trend (z-loss hurt +0.003, adding 0.001 smoothing hurt +0.002)."	-0.0004	size_blocked	1.083169		16000935	600.126000	752.874000	1469.000000	apg-loss-0088		Single-literal change at line 128 (LOGIT_SOFTCAP default 30.0→100.0). Zero code-byte growth, zero runtime impact, zero model-size impact. Baseline 017 uses self.logit_softcap * tanh(logits_proj / self.logit_softcap) at line 693 — applied uniformly in train forward, sliding-window eval, and TTT (score+train), so both objective and eval use the new cap self-consistently. All 6 prior non-crashed loss trials reshaped the *target* distribution (009 z-loss, 042 smoothing, 054 focal, 066 first-64-mask) or per-token weighting (034 pos-weight, 070 winsor) — all hurt. Softcap is the *model-side* squash that's never been swept. At peak-training top-logits ~10-15, cap=30 gives 4-8% grad dampening via tanh saturation; cap=100 makes it &lt;1% while still preventing true explosion (grad_clip=0.3 also guards). Risk: if late-training logits genuinely reach ~50-80 the old cap acted as regularization and loosening might let logit_scale / tied_embed norms drift; mitigated by unchanged embed_wd=0.085 and muon_wd=0.095.
097	2026-04-22T09:05:20Z	curr	017	088	curr	Replace phase+k*seq_len packed start-indices with IID uniform random starts per sequence in ShuffledSequenceLoader._reset_shard: every sampled sequence now begins at an independent random offset, giving each training token a uniformly-random within-sequence context position instead of the packed scheme's single shared phase.	-0.0002	discard	1.079529	+0.002585	15996219	600.054000	764.946000	1483.000000	apg-curr-0088		Structurally different curr knob: all prior curr trials (stride: 025/047/053/076, stratification: 067, position masks: 013/078) hurt or crashed. The packed scheme aligns every within-shard sequence to one phase, so each token appears at ONE context-position per epoch; IID starts give full phase entropy. At <1-epoch training duration (~3.5B / 10B corpus), expected overlap is a few %, not a redundancy concern. Matches nanoGPT's standard sampling pattern. No loss-semantics change, no shape/size change — only the list of candidate start indices per shard is drawn differently. Loader signature, next_batch logic, rank-independence (PCG64(rank)), shard-weighted sampling all unchanged. GPTQ calibration (also via this loader) sees statistically equivalent activations — position within shard is already random. Epoch-length parity maintained via num_sequences=num_tokens//seq_len-1 (≈ current expected count).
098	2026-04-22T09:05:20Z	arch	088	088	arch	Remove the three unconditional F.rms_norm post-norms on attn_out/mlp_out in Block.forward (NormFormer OFF): learnable per-channel attn_scale/mlp_scale plus the next block's pre-RMSNorm make the unit-RMS constraint redundant, and freeing the output magnitude lets scales modulate across a wider dynamic range.	-0.0008	discard	1.078843	+0.001899	15992694	600.123000	758.877000	1474.000000	apg-arch-0091		Removed three F.rms_norm(attn_out/mlp_out) lines in Block.forward (attn post-norm + two mlp post-norms across parallel and sequential branches). Proj is zero-init so step-0 behavior unchanged; later steps let attn_scale/mlp_scale absorb the normalization role. exp_090 added sub-LNs (crashed); this is the opposite direction. No new params, no size impact.
099	2026-04-22T09:05:24Z	tok	017	088	tok	Apply fixed logit scale multiplier 3.0 to tied-embedding output projection	-0.0006	size_blocked	1.083399		16010548	600.022000	752.978000	1472.000000	apg-tok-0088		
100	2026-04-22T09:05:28Z	meta	088	088	meta	Re-apply exp_003's kept EMA decay 0.9965→0.998 on top of exp_088 — sibling-branch winner (-0.000776 in isolation) never combined with the current best lineage.	-0.0004	discard	1.078989	+0.002045	15992593	600.123000	758.877000	1475.000000	apg-meta-0093		Tree-merge hypothesis. exp_003 (meta, keep, Δ=-0.000776) bumped ema_decay 0.9965→0.998 on the baseline branch; exp_006 (0.998→0.999) overshot, confirming 0.998 as a local optimum along that axis. Current best exp_088 descends through exp_005→exp_010→…→exp_088 and never incorporated exp_003's change (verified: snapshot 088 has ema_decay=0.9965). Warmdown_frac=0.72 means the 72% tail benefits from a wider EMA averaging window; half-life grows ~286→~346 steps. Single-scalar change at train_gpt.py:168 (default 0.9965→0.998). No env override for EMA_DECAY is injected by run_trial.sh, so the code default takes effect. Size: code=21751 B; single literal edit, zero model-size impact. Expected delta conservative (-0.0004) vs. exp_003's isolated -0.000776, accounting for diminishing returns when stacked on exp_088's muon-momentum-warmup refinement.
101	2026-04-22T09:06:48Z	ttt	088	088	ttt	Loosen TTT gradient clip norm 1.0→2.0 to pass more signal through on informative chunks; with ttt_epochs=4, mom=0.9, ttt_lr=0.005 giving tightly-bounded per-step moves, 1.0 was likely over-constraining rare-but-useful large-gradient updates.	-0.0003	eval_budget_overrun	1.078598			600.107000	805.893000	1538.000000	apg-ttt-0090		"Single-scalar change at line 1321 inside eval_val_ttt's per-SGD-step hot loop: clip_grad_norm_(ttt_params, 1.0) -> 2.0. Completely untouched TTT knob (all prior ttt knobs — lr, epochs, momentum, anchor, freeze_emb, per-epoch LR shape, momentum reset — have been exercised). Direction aligned with exp_014's ""more adaptation helps"" finding (ttt_epochs 3->4 kept, delta=-0.000278). Zero eval-time cost (same op, just different scalar). Zero size impact."
102	2026-04-22T09:09:49Z	quant	092	088	quant	Zig-zag encode int8 Q tensors (v→((v<<1)^(v>>7)) as uint8) before torch.save to rescue exp_092's MAD-scale GPTQ (bpb=1.075144 but size_blocked) — lossless signed→unsigned transform converts 2's-complement bimodal byte layout to a unimodal-near-zero distribution that brotli-11's Huffman stage compresses tighter, freeing enough bytes to fit under cap.	-0.0018	size_blocked	1.075031		17454182	600.042000	765.958000	1488.000000	apg-quan-0093		"Two-site change in GPTQ pack/unpack path: encode stored "".q"" tensors via _zigzag_encode_int8 in gptq_mixed_quantize (line 986), decode via _zigzag_decode_uint8 in dequantize_mixed (line 1012). Helpers added before _BSHF_MAGIC. Backward-compat guard: decode only runs when dtype==uint8 (new format); old int8-stored models still load. Zero bpb impact of zigzag alone — savings are pure compression. Combined with MAD scale (already in workdir from exp_092) the quant precision improves and zigzag frees the bytes needed to fit. If the new format saves ≥200 KB over the 2's-complement layout, MAD's bpb=1.075144 becomes a valid keep."
103	2026-04-22T09:17:22Z	eval	088	088	eval	Lower TTT SGD momentum 0.9→0.5: with only ~4 SGD steps per val chunk, mom=0.9 carries ~60% stale velocity from previous chunks' heterogeneous gradients; lower momentum lets each chunk's adaptation track its own distribution more locally.	-0.0015	discard	1.077838	+0.000894	15994290	600.095000	758.905000	1473.000000	apg-eval-0095		Single-line default change at eval_val_ttt config (ttt_momentum default 0.9→0.5). TTT_MOMENTUM env var is NOT injected by run_trial.sh (only TTT_ENABLED, MAX_WALLCLOCK_SECONDS, PYTHONUNBUFFERED), so the literal takes effect. Prior tree tried 0.9→0.95 (exp_039, discard +0.000178) and momentum-reset-per-chunk (exp_089, eval_budget_overrun). Going DOWN to a low fixed value is unexplored. Chunk size 65536 / seq_len 2048 = 32 sequences per chunk; with batch_seqs=32, one SGD step per epoch × ttt_epochs=4 = 4 updates per chunk. At mom=0.9 over 4 steps the buffer at chunk-end is ~65% legacy velocity from outside the chunk — a misalignment cost when val chunks have different distributions. Mom=0.5 shortens velocity half-life from ~6.6 to ~1 step, matching the per-chunk SGD horizon. Zero eval budget impact (same forward/backward compute). No size impact (no param changes).
104	2026-04-22T09:26:40Z	reg	088	088	reg	Inject LR-coupled gaussian noise (σ=0.003*lr_scale) into the post-Newton-Schulz Muon update — classical Neelakantan 2015 gradient-noise regularizer applied to the orthogonalized matrix update, auto-decaying to 0 through the 72% warmdown tail.	-0.001	discard	1.080328	+0.003384	15993156	600.007000	766.993000	1476.000000	apg-reg-0096		"Three-part edit: (1) New Hyperparameter muon_noise_base=0.003; (2) Muon.step adds `g = g + noise_scale * torch.randn_like(g)` AFTER Newton-Schulz and row-scale so the near-orthogonal update direction is preserved but diffused; (3) step_fn sets group[""noise_scale""] = h.muon_noise_base * lr_scale alongside the existing muon_wd_scale update, so noise decays linearly with the LR warmdown cosine. Rationale: past reg attempts failed because they degraded information (MLP dropout exp_040 +0.0098, token replacement exp_012 size_blocked, muon_wd raise exp_095 +0.0035). Gradient noise is information-preserving and SDE-motivated — canonical reg for underfit models where dropout kills capacity. Per-param noise drawn on the owning rank (i%world_size==rank) so it survives all_reduce without duplication. Noise applied in bfloat16 update-space; elements of Muon's g are ~1/sqrt(min_dim)~0.02-0.04, so σ=0.003 is ~7-15% relative perturbation at peak LR, tapering to 0 at warmdown end. Zero artifact-byte cost. Optimizer step is not torch.compile'd so the new randn_like call is safe."
105	2026-04-22T09:27:34Z	opt	088	088	opt	Lower adam_eps 1e-8 → 1e-10 (nanoGPT-speedrun canonical): smaller preconditioner denominator gives proportionally larger effective updates for low-second-moment parameters — most pronounced for rare-tail tok_emb rows under AdamW.	-0.0005	eval_budget_overrun	1.079099			600.073000	788.927000	1502.000000	apg-opt-0095		Single-default change at train_gpt.py:161 (ADAM_EPS 1e-8→1e-10). Affects optimizer_tok (AdamW, tied tok_emb 8192×512=4.2M params, lr=0.03, ~42% of trainable), optimizer_scalar (AdamW, q_gain[heads]+attn_scale+mlp_scale+resid_mix+skip_gates, lr=0.02), and optimizer_head (disabled under tie_embeddings=True, lm_head=None). Muon (matrix params, the bulk of the model) is not affected — it uses its own momentum buffer, not ε. Mechanism: for rare-vocab tok_emb rows where v̂ is small, update magnitude m̂/(√v̂+ε) is currently ε-limited; dropping ε lets these rows track their gradient signal. nanoGPT-speedrun (Moonshot/Keller) uses 1e-10 as default. Prior attempt exp_048 was size_blocked before GPU run, so this direction is unvalidated in our tree. Zero byte impact. Risk: for scalar params with genuinely small v̂ (legitimate converged state), smaller ε may cause late-training jitter; EMA/SWA tail should absorb this.
106	2026-04-22T09:34:58Z	meta	088	088	meta	Lower muon_momentum_warmup_start 0.92→0.90 on exp_088 baseline: widens the Muon momentum ramp range from 7pt (0.92→0.99) to 9pt (0.90→0.99) inside the compressed 22% warmup window, giving noisier/more-responsive early updates; mirror test of exp_015 (0.92→0.94 discard +0.00181, whose post-hoc signal was that Muon benefits from responsive early momentum).	-0.0004	discard	1.078567	+0.001623	15990823	600.018000	756.982000	1472.000000	apg-meta-0102		Single-literal default change at train_gpt.py:152 (MUON_MOMENTUM_WARMUP_START 0.92→0.90). Not harness-injected — default flip is effective. Zero code-byte growth, zero runtime impact, zero model-size impact. Untried direction: exp_015 probed +2pt (discard), exp_094 lowered peak (discard), exp_088 locked warmup fraction at 0.22 (keep). The start value is the one axis of the 3-knob Muon-momentum triplet never tested going down. At frac=0.5 through ramp, new momentum=0.945 vs old 0.955 — ~20% more gradient leak-through mid-ramp. Tests the opposite hypothesis from exp_015 on the now-correct 0.22 baseline.
107	2026-04-22T09:42:26Z	arch	088	088	arch	All-parallel residual (PARALLEL_RESIDUAL_START 7→0): every block runs attn and MLP in parallel off the same pre-residual input (GPT-J/PaLM style) instead of the hybrid where only layers 7-10 are parallel.	-0.0003	size_blocked	1.088497		16002559	600.036000	752.964000	1468.000000	apg-arch-0102		"Single-literal edit to Hyperparameters default (line 140). PARALLEL_RESIDUAL_START is NOT harness-injected, so the default literal takes effect. Previously untested direction in this research tree: exp_059 tested the OPPOSITE pole (7→11 all-sequential) but got harness_abort with no real signal. All-parallel has never been submitted. Structural hypothesis: the SOTA stack labels ""Parallel Residuals"" as a core component, but applies it to only 4 of 11 layers — extending it to all 11 tests whether the hybrid placement at layer 7 was accidental or principled. Zero code/byte/compute impact; pure architecture rearrangement. Risk: all-parallel typically hurts small models vs scaled LLMs since early sequential layers can't reuse the post-attention features. If hurts, informs future arch proposals that hybrid is principled; if helps, unlocks a new baseline to build on."
108	2026-04-22T09:51:29Z	quant	088	088	quant	Shrink GPTQ block_size 128→64 for finer error propagation (2× more error-update events per matrix, each with a better-conditioned 64×64 Hinv block) — theory says lower quantization error at zero entropy/size cost since scales remain per-row and int6 code distribution is unchanged.	-0.0015	keep	1.076865	-0.000079	15994682	600.041000	755.959000	1464.000000	apg-quan-0103	snapshots/108_quant	Single-literal change at line 933 (gptq_quantize_weight default block_size 128→64). Novel in-tree: exp_035 proposed 128→32 but was harness_abort (no real signal); no other block_size trial in history. Prior quant experiments touched clip_sigmas (exp_008), MinMSE refinement (exp_004), Hessian damping (exp_016), MAD dispersion (exp_092), zig-zag encoding (exp_102), closed-form scale refinement (exp_045) — NONE changed the GPTQ inner block granularity. Mechanism: GPTQ updates column-error E and propagates it to the right-side columns every block; smaller blocks = more propagation events = residual accumulation stays tighter. For a 768-col weight: block=128 gives 6 outer iters, block=64 gives 12 — 2× better error-absorption cadence. Size impact: ZERO (same Q dtype=int8, same per-row scales, same permutation). No change in entropy → brotli output unchanged. Runtime: same total FLOPs (block_size just partitions the work); wallclock unchanged within noise. Conservative vs exp_035's 32 so if this keeps, next quant trial can push further to 32 or 16.
109	2026-04-22T10:07:24Z	opt	088	108	opt	Decouple muon_momentum_warmdown_end (0.85) from muon_momentum_warmup_start (0.92): exp_010 cools Muon momentum 0.99→warmup_start during warmdown, locking the warmdown floor to 0.92. Lowering the floor to 0.85 makes deep-warmdown steps less momentum-dragged (fresher per-step gradient), letting the EMA averager (decay 0.9965, half-life ~200 steps) do more of the smoothing across the 72% warmdown tail — a Polyak-Ruppert shift of averaging from intra-step momentum to cross-step EMA.	-0.0006	discard	1.079184	+0.002319	15993281	600.122000	758.878000	1474.000000	apg-opt-0106		Two-site edit: (1) new hyperparam muon_momentum_warmdown_end=0.85 at line ~153 right after muon_momentum_warmup_start; (2) in step_fn (~line 1400) the lockstep-cool blend endpoint swaps from h.muon_momentum_warmup_start to h.muon_momentum_warmdown_end. Warmup dynamics (0.92→0.99 linearly over first 22% of budget) are untouched. exp_015 (raise warmup_start 0.92→0.94, discard) and exp_094 (lower peak 0.99→0.97, discard) both tested MOMENTUM CEILINGS. exp_010 (kept) established the lockstep-cool. No trial has tested LOWERING the warmdown FLOOR while keeping warmup start — this is the orthogonal untested knob, and the only way EMA can get more signal-bearing steps to average is if momentum doesn't erase them. Zero-byte code impact, zero runtime impact, zero model-size impact. Parent: 088 (val_bpb=1.076944).
110	2026-04-22T10:08:33Z	meta	088	108	meta	Lower muon_wd 0.095→0.065 (~32% reduction, nanoGPT-speedrun-aligned): untouched knob on ~28M Muon-managed matrix params. Under exp_088's earlier-peak momentum ramp (0.99 reached before frac=0.28), the smoothed gradient buffer makes decoupled weight-decay more-effective per step, so the baseline 0.095 likely overshoots — less WD should recover generalization headroom in the warmdown tail without destabilizing peak-LR training.	-0.0008	discard	1.079212	+0.002347	15995999	600.084000	754.916000	1473.000000	apg-meta-0107		Single-literal default change at train_gpt.py:166 (MUON_WD 0.095→0.065). Zero code-byte growth; size-neutral. muon_wd has NEVER been touched in any prior trial (grepped results.tsv). Consumed at optimizer init (Muon group weight_decay) and applied as decoupled p.data.mul_(1.0 - lr * wd) each Muon step over matrix_params (11 blocks × attn qkvo + mlp fcs). Sibling branches: embed_wd 0.085→0.07 (exp_041, size_blocked, bpb=1.078695); adam_wd never touched. Chose 0.065 (not 0.05) to stay small-radius and probe monotonicity before deeper cuts.
111	2026-04-22T10:09:50Z	loss	088	108	loss	Poly-1 loss with eps=-1.0 (L = CE + eps*(1-p_t)) — gradient on target logit scales by (1-p_t), acting as focal-γ=1 hard-example mining; directs training signal toward structurally hard tokens where an underfit 36M model has slack.	-0.001	size_blocked	1.091049		16000705	600.076000	756.924000	1476.000000	apg-loss-0103		Edit at GPT.forward (line 695-699): switch to reduction='none', compute pt=exp(-ce), return mean(ce - (1-pt)). Training-only; forward_logits (used by eval/TTT/GPTQ calibration) untouched so inference path + artifact bytes are identical to exp_088. Prior loss tree is barren: z-loss (009), label-smooth 0.001 (042), softcap (096), and position-weighted CE (034) all failed or aborted. Poly-1 with negative eps is novel in this tree and is gradient-equivalent to focal-γ=1, which shifts emphasis to hard tokens. Risk: focal-style reweighting can slow learning on high-frequency tokens, so the sign of delta is uncertain; worth the single trial.
