exp_id	timestamp	specialist	parent_exp	baseline_exp	domain	hypothesis	expected_delta	status	val_bpb	delta_vs_best	artifact_bytes	train_s	eval_s	total_s	job_name	snapshot_path	notes
784	2026-04-25T17:04:29Z	loss	750	750	loss	Replace TTT-only z-loss L2 form (1e-5*logsumexp^2.mean) with L4 form (6e-8*logsumexp^4.mean) — coef tuned to match L2's typical gradient magnitude at logsumexp~9; L4 penalizes outlier high-partition positions more aggressively than L2 while leaving low-logsumexp positions nearly untouched. Untested neighbor on z-loss-norm axis (L1 exp_771 discard, L2 exp_596 keep, variance exp_675 size_blocked); byte-neutral 1-char swap.	-0.0001	discard	1.073470	+0.001260	15998823	600.084000	592.000000	1538.000000	apg-loss-0778		Mechanism: TTT inner-loop z-loss is currently optimal at L2/coef=1e-5 (kept exp_596). L1 form was discarded (exp_771: 1.073297). L4 probes the higher-power side of the L_p axis. Coef 6e-8 derived from grad-equivalence at typical logsumexp value 9.0: L2 grad-on-logit ~2*1e-5*9=1.8e-4, L4 grad ~4*c*9^3=2916c → c≈6e-8. Byte change: literal `1e-5`→`6e-8` (4 chars→4 chars), `2`→`4` (1 char→1 char). Total bytes identical (23309). Risk: L4 with bounded LOGIT_SOFTCAP=30 has bounded penalty (max ~6e-8*30^4=4.86e-3 per position), well below noise. Direction-of-improvement: if z-loss helps via outlier-suppression, L4 should help more; if via uniform partition damping, L4 ≈ L2.
785	2026-04-25T17:04:53Z	meta	750	750	meta	grad_clip_norm 0.3→0.28 — untested gentle DOWN midpoint between current 0.3 and exp_525's size_blocked-at-improvement 0.25, consistent with the axis's DOWN-favoring asymmetry (0.4 UP discard +0.000340 vs 0.2 DOWN discard +0.000124, 0.25 DOWN size_blocked at bpb 1.074731 = trial-time improvement).	-0.00005	size_blocked	1.073114		16001729	600.008000	578.600000	1508.000000	apg-meta-0778		Single-literal change at line 162 (GRAD_CLIP_NORM 0.3→0.28). Zero new params, zero compile-graph risk, +1 byte code delta. Mechanism: 3-loop recurrence amplifies gradient norms in loop layers; tighter clip attenuates outliers proportionally without crushing real signal. Asymmetry signal: at depth-7 (exp_169) DOWN-33% (0.2) hurt only +0.000124 while at depth-11 (exp_233) UP+33% (0.4) hurt 2.7× worse (+0.000340), and at depth-20 (exp_525) the 0.25 midpoint actually measured an improved bpb 1.074731 but blocked on cap. 0.28 is a smaller -6.7% step (vs 0.25's -17%) that should retain some of the bpb signal while staying under cap. Untested midpoint despite repeated probing on this axis. Risk: low — single literal, cap-friendly direction (less weight-drift than 0.25 floor).
786	2026-04-25T17:06:53Z	reg	750	750	reg	Tighten TTT inner-loop grad_clip_norm 1.0 → 0.8: untested middle-DOWN probe between exp_244/180/351 (1.0→0.5, over-tight, all discards) and exp_101 (1.0→2.0, eval_budget_overrun). With exp_596 z-loss softening inner CE gradients and Nesterov+mu=0.9 amplifying outliers, a 20% tighter cap should stabilize early-chunk trajectories without the over-constraining that hurt prior 0.5 probes.	-0.0001	size_blocked	1.072267		16001917	600.109000	533.900000	1436.000000	apg-reg-0779		Single literal at line 1407 (TTT clip 1.0 to 0.8). +1 code byte. Zero structural change, zero new params, zero compile-graph risk. Expected near-noise effect; if it lands +eps, brackets DOWN-axis at this baseline; if -eps, suggests tighter TTT clip stabilizes Nesterov-amplified outliers under z-loss regime. exp_244/180/351 (0.5) all discarded ~+0.0001-0.0005; 0.8 splits the gap without repeating their over-tight failure.
787	2026-04-25T17:07:32Z	quant	750	750	quant	Narrow AWQ-style per-row scale-grid refinement (alpha in {0.95, 1.0, 1.05}) before GPTQ inner loop, picking alpha minimizing H-diag-weighted RTN error per row.	-0.0005	size_blocked	1.071334		16284777	600.087000	528.000000	1424.000000	apg-quan-0779		Tight 5pct grid vs exp_728 25pct that size_blocked at val_bpb=1.069841. Single-site insertion in gptq_quantize_weight after baseline scale computation; +405 code bytes. Most rows expected to keep alpha=1.0; tail-heavy rows pick 0.95 or 1.05.
788	2026-04-25T17:15:49Z	arch	750	750	arch	Asymmetric LayerScale init for parallel-residual blocks (7-10): mlp_scale starts at 0.5 instead of 1.0; attn_scale stays 1.0. Breaks the implicit equal-magnitude prior between parallel attn/mlp pathways and biases optimizer to attn-dominant features early; mlp grows during training.	-0.0003	size_blocked	1.072608		16005008	600.140000	595.500000	1534.000000	apg-arch-0779		Single-site edit at GPT.__init__ parallel_residual loop: also fills mlp_scale.data with 0.5 for blocks i in [parallel_residual_start, num_layers). attn_scale unchanged. Sequential blocks (0-6) unchanged. Inspired by PR#1518 finding that asymmetric init breaks Z2 symmetry in parallel routing; here applied to attn-vs-mlp asymmetry rather than two-lane lanes. Zero new params, byte-tiny (+~150 char comment + one line of code; packed delta ~50B). Mechanism untried in tree on this knob (init asymmetry of attn/mlp scales conditional on parallel_residual flag).
789	2026-04-25T17:31:06Z	ttt	750	750	ttt	Mean-preserving per-epoch linear LR decay within each TTT chunk (1.25x→0.75x of cos_lr across the 4 inner epochs): freshest-data epoch 0 gets the largest step, later epochs polish with smaller steps as gradient signal becomes increasingly correlated by re-traversing the same chunk; total LR budget per chunk is preserved.	-0.0003	eval_budget_overrun	1.072417			600.113000	600.700000	1536.000000	apg-ttt-0783		"Adds the orthogonal ""within-chunk"" axis to the existing cross-chunk cosine: schedule [1.25, 1.083, 0.917, 0.75] * cos_lr for _ep in [0..3], mean=1.0 cos_lr (integral preserved). exp_084 attempted the same idea but harness_aborted (never completed) and was on a much-earlier baseline. exp_546/552 tested per-epoch momentum ramp on the orthogonal axis (size_blocked / discard +0.000471). Cross-chunk LR-shape changes (linear vs cosine, exp_463 / exp_243) all discarded — but those modify the ALREADY-existing axis. This is the missing 2D shape: cross-chunk × within-chunk. Code +10 bytes (23309→23319), no new params, no compile-graph risk."
790	2026-04-25T17:31:27Z	opt	750	750	opt	Schedule optimizer_tok (AdamW on tied tok_emb) beta2 from 0.95 (peak-LR) up to 0.99 (deepest tail) lockstep with (1-lr_scale): longer second-moment EMA window in warmdown gives more stable preconditioner for rare-token rows whose gradients are sparse and small.	-0.0002	size_blocked	1.072797		16004756	600.073000	586.700000	1521.000000	apg-opt-0785		"Single-line addition at L1491 of step_fn (after the existing LR-scale loop): optimizers.optimizer_tok.param_groups[0][""betas""] = (h.beta1, h.beta2 + 0.04 * (1.0 - lr_scale)). Code +39 packed bytes (23309->23348). Mechanism: rare-token gradients in tied tok_emb become sparse and small-magnitude during warmdown; current static beta2=0.95 (~20-step v-EMA half-life) drops history just when noise-to-signal is most favorable for longer averaging. Schedule lifts beta2 to 0.99 (~100-step half-life) only as lr_scale falls. At lr_scale=1.0 the schedule reduces to the baseline (beta1, beta2)=(0.9, 0.95) so peak-phase trajectory is unchanged. Untested axis: static UP (exp_182 tok beta2 0.95->0.98 discard +0.000345 vs exp_164) and static DOWN cool with both groups (exp_262 0.95->0.9 size_blocked at 1.075224) were both flat/global; scheduled-UP-only-during-warmdown on tok_emb only is novel. Works with fused AdamW: PyTorch fused kernel reads betas from param_group dict each .step() call."
791	2026-04-25T17:41:44Z	quant	750	750	quant	Threshold-gated AWQ-style per-row scale refinement: keep grid alpha in {0.95,1.0,1.05} but only swap from alpha=1.0 if alt H-diag-weighted MSE less than 0.95x baseline.	-0.0004	size_blocked	1.071846		16273035	600.083000	588.100000	1527.000000	apg-quan-0788		Direct follow-up to exp_787 (val_bpb=1.071334 size_blocked +285KB at ungated grid). Gating keeps most rows at alpha=1.0 so int8 code distribution stays baseline-like, only outlier-tailed rows where 5pct MSE gain available actually pick non-trivial alpha. Trade-off: smaller subset of rows refined => smaller bpb gain (~-0.0004 vs -0.000876 ungated) but expected to fit. If still size_blocked, next try tighter grid {0.97,1.0,1.03} on top of gating.
792	2026-04-25T17:56:37Z	meta	750	750	meta	SCALAR_LR 0.02 → 0.018 (gentle DOWN -10%, untested midpoint between current and exp_204's failed -25% probe at depth 10).	-0.00005	size_blocked	1.071951		16002565	600.061000	578.400000	1510.000000	apg-meta-0788		Single-literal default change at line 149 (SCALAR_LR 0.02 → 0.018). Zero new params, zero code-byte impact (23295 → 23295 packed), zero compile-graph risk. Probes gap on a stale axis — last touched at depth 9-10 (exp_194 +50% UP discard +0.003842, exp_204 -25% DOWN discard +0.001269 on the much lighter pre-recurrence stack). The scalar-AdamW group has since accumulated 4 substantial composition changes: exp_267 added per-feature embed_scale [512] (now dominant by parameter count), exp_298 moved embed_scale INSIDE post-tok_emb RMSNorm (changes its gradient scale via 1/sqrt(d) RMS), exp_475 split q_gain into [H, 2] (88 params/layer × 11), and exp_538 added attn_out_gate per-head per-block (968 params total). The group went from ~150 scalars in exp_204's regime to >2000 mixed-magnitude scalars where embed_scale [512]·init=1.0 lives in a delicate post-RMSNorm calibration role. Mechanism: gentler scalar steps reduce embed_scale drift relative to RMSNorm's instantaneous stats; small LR cut also better matches exp_177's kept adam_wd 0.02→0.005 direction (group prefers gentler updates with embed_scale present). Expected delta is small — both prior probes are bracketed but the linear-interp prediction at -10% is ~+0.0005, and stack drift may have shifted the optimum slightly DOWN since the test. Untested midpoint, byte-neutral, single-literal.
793	2026-04-25T17:57:18Z	arch	750	750	arch	Milder asymmetric init for parallel-residual blocks (7-10): mlp_scale=0.8 (vs 1.0 baseline, attn=1.0). Same Z2-symmetry-breaking mechanism as exp_788's mlp_scale=0.5 (which gave val_bpb=1.072608, Δ≈-0.0006 but size_blocked at +5KB), at smaller magnitude to keep trained weights closer to baseline GPTQ entropy and fit under 16MB cap.	-0.0002	size_blocked	1.072819		16000816	601.032000	591.100000	1529.000000	apg-arch-0789		Direct follow-up to exp_788 (size_blocked, val=1.072608, Δ=-0.0006 if not blocked). exp_788 used 0.5 → trained weights drifted enough for brotli to compress 5KB worse. Halving the asymmetry to 0.8 should reduce the weight-trajectory drift proportionally, closer to baseline post-GPTQ entropy. Also trimmed the comment to save 200 packed code bytes for additional headroom (24506→24306). If 0.8 still trips size, likely need to lock to fewer blocks. If 0.8 fits but underperforms, could try 0.7 next.
794	2026-04-25T18:07:19Z	opt	750	750	opt	Per-group LR floor on optimizer_tok only at 5% of base_lr — keeps tied tok_emb's rare-token rows still learning through deep warmdown when Muon/scalar/head groups have effectively stopped updating; orthogonal to global MIN_LR axis (exp_660 discard, hurt all groups uniformly) and Muon-only floor (exp_680 discard).	-0.00010	size_blocked	1.073069		16003144	600.123000	580.400000	1515.000000	apg-opt-0791		"Two-line insertion in step_fn after the lr-scale loop: tok_g[""lr""] = tok_g[""base_lr""] * max(lr_scale, 0.05). Tied tok_emb dominates param mass (4.2M / ~30M); rare-token rows have small Adam v_hat throughout, so eps=1e-8 suppresses most updates in tail. 5% floor keeps tied-row learning at lr=0.0015 (vs 0.030 peak) through deepest ~5% of warmdown when Muon goes to 0. Other AdamW group (scalar) and Muon retain full warmdown to 0 — peak/warmdown symmetry preserved everywhere except this single dominant tied matrix. embed_wd=0.085 still bounds row growth. Code +45 packed bytes (23296->23341)."
795	2026-04-25T18:16:20Z	eval	750	750	eval	Stack Gradient Centralization (zero-mean per-row gradient on 2D+ ttt_params before clip+step) onto current best exp_750 — exp_750 forked from exp_596 (z-loss) and added the opt mm_blend tweak, but never inherited GC from exp_592/exp_746; the GC+z-loss combination at exp_746 was kept (Δ=-0.000005 over z-loss alone), so applying the same row-mean grad correction on top of the strictly-stronger 750 stack is the natural untried recombination.	-0.00001	size_blocked	1.072801		16001403	600.119000	523.700000	1421.000000	apg-eval-0788		+111 source bytes (~30 packed). Same 4-line edit as exp_746 over exp_596. Mechanism: zero-mean each output-row of grad in dim>=2 ttt_params before grad_clip+step. Orthogonal to mm_blend cool target (training-time Muon momentum) and z-loss (TTT inner CE magnitude). Risk: tight artifact margin — exp_750 had ~1286B headroom, this adds only ~30 packed code bytes so seed-variance is the main size risk.
796	2026-04-25T18:16:35Z	loss	750	750	loss	Temperature-scale TTT inner CE: F.cross_entropy(_lf/1.1, ...) — softens TTT per-chunk targets to T=1.1, reducing 21-epoch chunk overfitting, mechanism-distinct from all 18 prior z-loss-form variants (L1/L2/L4, hinge, var, anchor, max, decay, gate, scale all tested) which all modify the regularizer term, not the CE itself.	-0.0003	discard	1.079557	+0.007347	15999324	600.141000	530.800000	1428.000000	apg-loss-0788		Byte-neutral-ish (+4 chars '/1.1') untried CE-side temperature softening on TTT inner loop. Existing z-loss term unchanged. Mechanism-aligned with kept exp_596 (anti-overconfidence in TTT) but operates on softmax shape + per-step grad magnitude instead of LSE penalty. Risk: if TTT is under-adapting, softening hurts; we'd then know to try T<1.
797	2026-04-25T18:16:43Z	quant	750	750	quant	Pair brotli lgwin=22→24 (untried alone on current parent; estimated 150–500KB savings on the ~16MB compressed payload via 4× larger LZ77 window) with the threshold-gated AWQ-3 scale grid (α∈{0.95,1.0,1.05}, only swap if H-diag-weighted MSE drops &gt;5%) — exp_791 measured the gated-grid at val_bpb=1.071846 size_blocked +285KB on this same exp_750 parent, so lgwin=24 is exactly the size-saver needed to land that quality move under the cap.	-0.00035	size_blocked	1.071147		16270455	600.112000	544.200000	1457.000000	apg-quan-0792		Two-site composite. (1) Insert AWQ-gated scale-grid block in gptq_quantize_weight just after sf=s.float() — copies exp_791's threshold=0.95 logic verbatim (h_diag-weighted RTN-MSE comparison; only swap α=1.0→{0.95,1.05} if alt MSE &lt; 0.95×baseline). (2) brotli.compress gains lgwin=24 — max 16MB sliding window vs default 22 (4MB), enabling cross-matrix repeat detection in the ~30MB byte-shuffled raw blob. Code +359B (23309→23668). Risk if size_blocked: lgwin saving &lt; 285KB; would still yield a clean lgwin-only saving measurement (model_bytes vs exp_791) for follow-up.
798	2026-04-25T18:18:05Z	curr	750	750	curr	Stride+1 packing in _reset_shard: stride from seq_len (2048) to seq_len+1 (2049). Decorrelates seq-pos and file-pos modular coupling.	-0.0001	size_blocked	1.074176		16000508	600.036000	578.800000	1515.000000	apg-curr-0788		Untested stride; prior stride changes were +/-64-class (exp_047, exp_053, exp_715 all discard). +1 produces 0.05% data gap, zero overlap, full mod-2049 start-index cycling. Code-negative 23343 to 23304 bytes.
799	2026-04-25T18:18:21Z	tok	750	750	tok	Forward-time per-row RMS-equalized tied-readout: F.linear(x, F.rms_norm(tok_emb.weight, (D,)) * tied_embed_init_std) so every token's classifier row has identical L2=std*sqrt(D), decoupling logit-magnitude from row-magnitude drift while keeping raw tok_emb at the lookup path. Parameter-free, init-logit-magnitude-preserving, untried in tok history.	-0.0005	discard	2.557347	+1.485137	15710864	600.152000	593.100000	1533.000000	apg-tok-0788		Single-site forward edit at tied LM head (~L766). Adds 2 lines: W_eq = F.rms_norm(tok_emb.weight, (D,)) * tied_embed_init_std; logits_proj = F.linear(x, W_eq.to(x.dtype)). Parameter-free; +334 packed code bytes (23309→23643). Distinct from all 70+ prior tok experiments: per-row L2 equalization is applied to the WEIGHT MATRIX at FORWARD TIME at the readout (not init-time row-norm like exp_019, not output-side x*scale like exp_775/781, not output-side rms_norm(x*scale) like exp_677/721, not col-DC subtraction at GPTQ time like exp_616). Mechanism: F.rms_norm(W, (D,)) gives each row RMS=1 (row L2=sqrt(D)); scaling by tied_embed_init_std=0.005 restores row L2≈0.113 matching nn.init.normal_(std=0.005) — bitwise-near-identical at step 0 (only finite-sample row-L2 deviations differ). During training, lookup path uses raw tok_emb (radial gradients flow normally — frequency-driven row growth preserved as input-side signal), but readout sees rotation-only updates (tangent gradient through rms_norm Jacobian). Equalizes per-token classifier voting weight, which addresses a known long-tail vocab issue: frequent-token rows grow faster from lookup gradients, dominating logit magnitude irrespective of cosine alignment. Risks: (1) GPTQ calibrates Q(W) for X·W ≈ X·Q(W), but deployed forward computes X·rms_norm(Q(W))·std — radial component of quant noise is killed by rms_norm Jacobian (good), tangential preserved scaled by 1/||Q(W)||·std ≈ 1.0 at init magnitude (acceptable). (2) embed_wd=0.085 still drags rows toward zero; if rows shrink below init scale, tangential noise amplifies — but warmdown decay is bounded. Compile-graph safe: F.rms_norm and F.linear are both compile-friendly; only forward graph affected.
800	2026-04-25T18:18:21Z	reg	750	750	reg	adam_wd 0.005 to 0.006 gentle UP midpoint byte-neutral probe	-0.0002	discard	1.072391	+0.000181	15999015	600.046000	584.600000	1518.000000	apg-reg-0789		Single-literal at line 165 ADAM_WD 0.005 to 0.006. Zero code-byte delta. Scalar AdamW group dominated by ~1056 zero-init attn_out_gate_w params from exp_538 with no init-anchored optimum; slightly stronger WD pulls them more cleanly toward useful gate magnitudes during warmdown EMA integration. Directional data: +60% UP exp_550 val improvement size_blocked; -60% DOWN exp_452 size_blocked WORSE; -100% DOWN exp_257 discard +0.000935. UP direction favored at growing scalar group mass; gentle +20% UP at current best snapshot is untested midpoint with smaller weight-shift than exp_550.
801	2026-04-25T18:19:02Z	ttt	750	750	ttt	Hard-mask TTT inner CE to last 128 positions of each 2048-token training sequence; aligns adaptation gradient signal with late-context positions. Untried as HARD mask in our swarm.	-0.0006	size_blocked	1.079181		16002776	600.055000	589.900000	1529.000000	apg-ttt-0791		Structural-distinct vs all prior TTT tweaks (no momentum/LR/anchor/freeze). Inspired by PR #1318 focal-128 mask (val_bpb 1.0095). z-loss still over all positions. Mean preserves loss scale so SGD-Nesterov LR=0.005 and clip_grad_norm=1.0 unchanged. +41 raw / ~30 packed bytes.
802	2026-04-25T18:30:55Z	meta	750	750	meta	ADAM_EPS 1e-8 → 1e-7 (untouched UP direction): only DOWN was probed (exp_304 1e-8→1e-9 discard +0.000595); softer denominator caps effective LR specifically for low-2nd-moment params (rare-token tok_emb rows where v << eps), aligned with the stack's kept direction of damping volatile updates on rarely-touched state (exp_491 scalar freeze, exp_588 chunk momentum halving).	-0.0001	size_blocked	1.072196		16001887	600.004000	592.000000	1528.000000	apg-meta-0794		Single-literal default change at line 161 (ADAM_EPS 1e-8 → 1e-7). Zero code-byte / parameter / structural change. ADAM_EPS is NOT a harness-injected env var so the Python default takes effect (verified: harness env table covers MAX_WALLCLOCK_SECONDS, TTT_ENABLED, PYTHONUNBUFFERED only). Affects optimizer_tok (tied tok_emb, AdamW eps) + optimizer_scalar (q_gain/ln_scale/skip_*, AdamW eps); muon_beta2 is dead code. Mechanism: AdamW update = lr * m_hat / (sqrt(v_hat) + eps). For dense-gradient rows (common tokens, all scalar params) v >> 1e-7 so eps is irrelevant. For sparse rare-token rows where v ~ 1e-9, eps=1e-8 caps reciprocal at ~9500 vs eps=1e-7 caps at ~3150 — i.e. ~3x effective LR reduction on rarely-hit embedding rows, similar in spirit to exp_491's scalar freeze but applied via preconditioner softening rather than parameter masking. Untouched UP direction across 800+ trials (only exp_304 ever probed this axis, going DOWN). Risk: low (single literal change, ~9 byte char string identical length). Rebased to clean exp_750 first to clear residual SCALAR_LR=0.018 from exp_792 size_blocked.
803	2026-04-25T18:34:14Z	arch	750	750	arch	Loop-iteration-aligned U-Net split: shift num_enc 8->9 (len(all_indices)//2 + 1) so encoder ends at block-5-iter1 boundary and decoder starts at block-3-iter2; LIFO skip pairing now feeds prior-iter-end into next-iter-start (block-5-iter1 -> block-3-iter2) and same-block recurrent feedback (block-4-iter1 -> block-4-iter2). Block-0 output drops from skips; num_skip_weights stays at 8. Zero new params, byte-neutral.	-0.0003	discard	1.073728	+0.001518	15996079	600.090000	584.400000	1519.000000	apg-arch-0795		Saturation pivot: arch has been hammering small tweaks (gates, q_gain, init values) on top of exp_750 with all recent trials sub-noise-floor or size_blocked. This change moves on the U-Net topology axis instead — alters which positions receive skip connections, creating cross-iteration recurrent feedback that is mechanistically distinct from prior arch axes (no add'l params, no compile graph change). Single-line code edit at GPT.__init__'s active loop-mode branch; inactive (pre-loop-activation) split untouched. Risk: dropping block-0 from skips may hurt early-feature propagation; if so, the bpb regression vs +0.0006 mlp_scale=0.5 win in exp_788 will flag this as the wrong axis.
