exp_id	timestamp	specialist	parent_exp	baseline_exp	domain	hypothesis	expected_delta	status	val_bpb	delta_vs_best	artifact_bytes	train_s	eval_s	total_s	job_name	snapshot_path	notes
075	2026-04-22T06:45:13Z	opt	017	017	opt	Lower AdamW beta1 0.9→0.8 (nanoGPT-speedrun default) for tok_emb/lm_head/scalar optimizers — faster first-moment tracking (~5-step vs ~10-step EMA of gradients) better matches the compact ~1800-step 600s budget where loss-landscape curvature changes rapidly; Muon is untouched.	-0.0005	discard	1.079326	+0.001267	15993563	600.094000	750.906000	1463.000000	apg-opt-0066		One-line default change (Hyperparameters.beta1 literal). Affects optimizer_tok (tied tok_emb, lr=0.03), optimizer_head (lm_head, lr=0.008 — note: lm_head=None under tie_embeddings=True so this is dormant), and optimizer_scalar (scalars, lr=0.02). Muon matrix optimizer uses its own muon_momentum schedule (0.92→0.99 linear warmup) — untouched. Unexplored axis: the only prior beta trial was exp_021 cosine-cooling beta2 during warmdown (crashed); static beta change is a fresh direction. At 600s/~1800 steps, beta1=0.9 smooths gradients over ~10 steps which is slow relative to the aggressive LR schedule; 0.8 → ~5-step EMA reacts faster. Standard nanoGPT-speedrun choice at the same order-of-magnitude budget.
076	2026-04-22T06:45:13Z	curr	017	017	curr	Train-eval stride alignment: reduce training-sample stride from seq_len to seq_len-eval_stride (2048→1984) so each 64-token overlap region is seen once at deep context (pos ≥1984) and once at shallow context (pos ≤63) — mirroring eval's sliding-window-64 scoring pattern, at only ~3% token duplication vs exp_047's 50%.	-0.0003	harness_abort							apg-curr-0068		Single-line change in ShuffledSequenceLoader._reset_shard: stride = max(1, self.seq_len - 64). exp_047 halved stride (50% overlap) → +0.001 hurt. exp_025 quartered it → crashed. Smaller 3% overlap should avoid the duplication hurt while specifically teaching the eval pattern: the same token predicted once from ~2000 tokens of prior context, once from ~30 tokens. eval_stride is 64 in train_gpt.py:160. [QUARANTINED 2026-04-22T08:19:06Z: supervisor-synth failed after internal CLI name-cache miss; job_id-based poll fallback added post-hoc.]
077	2026-04-22T06:45:14Z	reg	017	017	reg	"Raise muon_wd 0.095 to 0.115 (+21%) to shrink matrix weights more aggressively: tighter L2 equilibrium both sharpens int6 quantization (smaller weights, less clip-sigma error) and provides gentle regularization on the most-redundant param bucket — an unexplored WD direction after exp_041's embed_wd cut went size_blocked and all prior reg attempts (dropout/noise) hurt this under-fit model</hypothesis> <parameter name=""notes"">Single-line constant change: Hyperparameters.muon_wd default 0.095 to 0.115 (line 163). All 5 prior reg trials were dropout/noise (040 MLP-drop +0.0098 bad; 050 resid-drop +0.0022 bad; 012 token-noise size_blocked; 033 NEFTune crash; 062 adam_wd=0 crash) — confirms under-fit regime where signal-removing regularizers hurt. WD-bump on matrix params is the orthogonal direction: shrinks weights (size-safe vs exp_041's LOWER embed_wd, size_blocked) and tightens the int6 quant distribution without removing training signal. Muon applies p.data.mul_(1 - lr*wd) so shrinkage naturally scales with the cosine LR warmdown; only the equilibrium weight-norm shifts." -0.001 harness_abort   15999615   1479.000000 apg-reg-0066   [QUARANTINED 2026-04-22T08:19:06Z: supervisor-synth failed after internal CLI name-cache miss; job_id-based poll fallback added post-hoc.]
078	2026-04-22T07:04:36Z	curr	017	017	curr	Mask CE loss on first 4 training positions (where context is &lt;4 tokens and gradient is context-starved/noisy) via ignore_index=-100 applied inside ShuffledSequenceLoader; TTT/eval unaffected since they bypass this loader	-0.0003	harness_abort							apg-curr-0078		"Two-spot edit: (1) ShuffledSequenceLoader.next_batch sets y[:, :4] = -100 after filling the batch (contained — TTT and sliding-window eval read val_tokens directly, never via this loader, so ignore_index only triggers in train CE). (2) GPT.forward() passes ignore_index=-100 to F.cross_entropy; no-op when no -100 targets are present (TTT path). Rationale: exp_013 masked 32 positions and size-blocked (dynamics shift → weights compressed worse). 4 positions is 8× milder (0.2% vs 1.6% of gradient reallocated), targeting ONLY the genuinely context-starved regime (pos 0 sees 1 tok, pos 3 sees 4 toks). Pattern from KB: exp_047 (halve stride) +0.001, exp_013 (mask 32) size-blocked but bpb+0.0008, exp_034 (0.5→1.5 linspace) +0.002. All prior mask/weighting attempts were coarser; K=4 is the minimum-risk variant of the ""focus on high-context"" direction that hasn't been measured cleanly. Expected delta -0.0003 assumes the size-block in exp_013 was dynamics-driven; K=4 should keep the weight distribution near baseline. [QUARANTINED 2026-04-22T08:19:06Z: supervisor-synth failed after internal CLI name-cache miss; job_id-based poll fallback added post-hoc.]"
079	2026-04-22T07:04:37Z	arch	017	017	arch	Initialize resid_mix[1] from 0.0 to 0.1 so every block gets a direct embedding-stream injection from step 0.	-0.001	harness_abort							apg-arch-0078		One-line Block.__init__ change: torch.zeros(dim) to torch.full((dim,), 0.1) in the stacked resid_mix tensor. Shape, dtype, optimizer group membership unchanged. Unexplored arch knob across the tree. [QUARANTINED 2026-04-22T08:19:06Z: supervisor-synth failed after internal CLI name-cache miss; job_id-based poll fallback added post-hoc.]
080	2026-04-22T07:04:37Z	loss	017	017	loss	Add deep-supervision auxiliary CE (α=0.1) from the encoder→decoder boundary tap via tied tok_emb — zero-byte, training-only gradient shortcut to the encoder stack.	-0.0005	harness_abort							apg-loss-0078		Loss-tree is 6/6 hurt: z-loss (009), label-smooth (026/042), pos-weighted CE (034), focal (054), first-N-mask, winsorization (070). Every prior attempt reshaped the per-token target distribution. This trial is structurally orthogonal — no change to the target or per-token weighting; instead it taps the hidden state at the encoder/decoder boundary, projects through the tied tok_emb (no new params), and adds an extra CE term with α=0.1. forward_logits untouched → eval/GPTQ/TTT-scoring paths are bit-identical. Inference cost: zero. Training cost: one extra RMSNorm + one extra (B,T,512)→(B,T,8192) matmul per step (~3-5% of step time). Risk: if that pushes train_s past 600 we get train_budget_overrun; if encoder-tap gradient conflicts with main late in training we get discard. Deep supervision is a published direction (GoogLeNet, UNet, Early-Exit) absent from this tree. [QUARANTINED 2026-04-22T08:19:06Z: supervisor-synth failed after internal CLI name-cache miss; job_id-based poll fallback added post-hoc.]
081	2026-04-22T07:04:39Z	tok	017	017	tok	Raise tied_embed_lr 0.03→0.038 (+27%): first trial to tune this completely-unexplored tok knob. exp_069 (raise embed_wd→+0.003 worse) and exp_041 (lower embed_wd→size_blocked) together triangulate the tied matrix at a tight optimum where constraint hurts but slack size-blocks — raising LR lets the dual-role tied matrix develop more discriminative output-head rows via gradient pull while AdamW's LR-coupled WD proportionally tightens shrinkage per step, keeping row-entropy bounded.	-0.0005	harness_abort							apg-tok-0078		One-line change at line 146 (TIED_EMBED_LR 0.03→0.038). Completely unexplored tok parameter — all prior tok trials touched init_std (x4), embed_wd (x2), per-vocab bias, or TTT-freeze. With tie_embeddings=1 this LR governs AdamW updates on the 8192×512 tied matrix which serves as BOTH input embedding and output head. Rationale: exp_069 raising embed_wd 0.085→0.11 hurt (+0.003) suggests the tied matrix is over-constrained; but exp_041 lowering embed_wd 0.085→0.07 size_blocked suggests we can't slack the constraint directly. Raising LR lets gradient pull grow discriminative rows while AdamW's LR-coupled decay (w - lr*wd*w) maintains proportional shrinkage — so equilibrium row-entropy is largely unchanged while the finite-horizon trajectory reaches further from init. +27% is modest enough to avoid the size cliff exp_011 (std→0.02) tripped. Size preflight: code=21460B, ample headroom. [QUARANTINED 2026-04-22T08:19:06Z: supervisor-synth failed after internal CLI name-cache miss; job_id-based poll fallback added post-hoc.]
082	2026-04-22T07:04:43Z	reg	017	017	reg	Lower adam_wd 0.02 to 0.008 (-60%) on the scalar-param optimizer: q_gain (init 5.25), attn_scale/mlp_scale (init 1.0), resid_mix[0] (init 1.0), skip_gates all have non-zero structural initializations that zero-anchored weight decay actively corrupts.	-0.0008	harness_abort							apg-reg-0078		Single-line change to Hyperparameters.adam_wd literal (line 162). Affects optimizer_scalar over ~25K control scalars. Novel knob: adam_wd never touched in tree. Reg history: dropout hurt, input noise size_blocked, embed_wd down size_blocked / up hurt, muon_wd up crashed. Reasoning: scalar decay pulls multiplicative gains toward 0, corrupting init-is-identity behavior. Size-safe (scalars pass through fp16 control-tensor path, not int6 GPTQ). [QUARANTINED 2026-04-22T08:19:06Z: supervisor-synth failed after internal CLI name-cache miss; job_id-based poll fallback added post-hoc.]
083	2026-04-22T07:04:48Z	meta	017	017	meta	Apply exp_003's proven EMA decay 0.9965→0.998 to the exp_017 branch: exp_003 kept Δ=-0.000776 on the baseline path but was never combined with exp_005's rope_dims=32 lineage that exp_017 descends from — pairing two independent kept wins.	-0.00035	harness_abort							apg-meta-0078		EMA at 0.998 gives half-life ~346 steps vs ~198 at 0.9965, pulling more of the 72% warmdown tail into the averaged weights. No runtime/size impact (single float literal). Expected delta scaled down ~50% from exp_003's -0.000776 since the diminishing-returns interaction with rope_dims=32 + ttt_epochs=4 is unknown. If this hurts or is neutral, it rules out compounding EMA+rope gains and recommends the exp_017 branch stays at 0.9965. [QUARANTINED 2026-04-22T08:19:06Z: supervisor-synth failed after internal CLI name-cache miss; job_id-based poll fallback added post-hoc.]
084	2026-04-22T07:04:49Z	ttt	017	017	ttt	Within-chunk linear LR decay across TTT epochs (1.25x→0.75x, mean-preserving): front-loads the largest step on epoch 0 when the gradient is freshest w.r.t. chunk data, then polishes with smaller steps to reduce chunk-level overfitting at epoch 4.	-0.0003	harness_abort							apg-ttt-0078		"Only modifies the inner-epoch LR inside eval_val_ttt. Per-chunk cos_lr over chunks is unchanged; mean within-chunk LR multiplier across the 4 epochs is exactly 1.0 (1.25+1.083+0.917+0.75)/4, so total integrated TTT ""learning budget"" per chunk is identical to exp_017. Only the temporal distribution changes. Unexplored axis: prior TTT trials tuned per-chunk LR (exp_073 +30% crashed), momentum (exp_031/037/039), epoch count (exp_014/017 kept), anchor (exp_027 crashed), param freezing (exp_049 discard) — nothing touched within-chunk LR shape. Zero eval-cost delta (just LR multiplication each epoch). [QUARANTINED 2026-04-22T08:19:06Z: supervisor-synth failed after internal CLI name-cache miss; job_id-based poll fallback added post-hoc.]"
085	2026-04-22T07:04:49Z	eval	017	017	eval	Reduce eval sliding-window stride 64→48: each scored token gets +8 avg context tokens (2024.5 vs 2016.5), boosting prediction quality at modest (1.33×) extra eval compute.	-0.0004	harness_abort							apg-eval-0078		Single-line default change at line 160 (EVAL_STRIDE 64→48). Unexplored direction: exp_024 went 48→32 (too aggressive, crashed); current baseline default was 64 so 48 hasn't been benchmarked against exp_017's TTT-epochs=4 stack. Stride is shared by both eval_val_sliding and eval_val_ttt (via h.eval_stride), so TTT chunk_windows also get ~33% more windows each. Context per scored token increases from [1985,2048] avg 2016.5 → [2001,2048] avg 2024.5. Total eval wall impact: ~25-33% more windows = maybe +50-100s across 8 GPUs, fits 600s budget. Expected delta modest (-0.0003 to -0.0006) since marginal context gain. Temperature calibration tried both ways failed (exp_044 soft/exp_072 sharp); this is a different lever (information content per prediction, not output distribution reshaping). [QUARANTINED 2026-04-22T08:19:06Z: supervisor-synth failed after internal CLI name-cache miss; job_id-based poll fallback added post-hoc.]
086	2026-04-22T07:04:50Z	quant	017	017	quant	Lower matrix_clip_sigmas 12.85→10.0: int6 step size shrinks ~22% (0.204σ→0.159σ per level), reducing round-to-nearest error on the bulk of weights while clipping only >10σ tails GPTQ can partially compensate; Q distribution also concentrates so byte-shuffle brotli packs tighter (size-safe).	-0.0008	harness_abort							apg-quan-0078		Single-scalar change at line 184. Never tried as a direct sweep: exp_004/008/045 all perturbed clip_sigmas via multi-point/per-row refinements and size_blocked due to metadata entropy growth — this change adds zero metadata. exp_016 reduced damping (trust H more) → hurt, suggesting the knob that matters most is not H-regularization; unexplored direction is the scale range itself. Expect tighter Q → smaller pack (more headroom) and lower quant error for typical weights. Risk: if weight distribution has heavy-tailed outlier channels (as some transformers do), 10σ clipping could degrade a few rows — but GPTQ's block-wise error propagation should absorb most of it. [QUARANTINED 2026-04-22T08:19:06Z: supervisor-synth failed after internal CLI name-cache miss; job_id-based poll fallback added post-hoc.]
087	2026-04-22T07:14:11Z	opt	exp_017	017	opt	Disable weight decay on scalar control tensors (adam_wd 0.02→0.0): q_gain=5.25, skip_weights, attn_scale, mlp_scale, resid_mix, skip_gates init at meaningful non-zero values — current AdamW coupled-WD compounds to ~80% shrinkage across the run (p *= (1-lr*wd)^steps), actively fighting the gradient. Standard practice (nanoGPT-speedrun, Llama) is no-WD on 1D params; untouched across the entire tree.	-0.0008	discard	1.079376	+0.001317	15999156	600.072000	758.928000	1470.000000	apg-opt-0078		Single-line default change at train_gpt.py:162 (ADAM_WD 0.02→0.0). Affects optimizer_scalar only (scalar_params: q_gain[heads], attn_scale/mlp_scale/resid_mix per-block + skip_weights/skip_gates). Matrix (Muon wd=0.095) and embedding (AdamW wd=0.085) WD unchanged. Rationale: at peak lr=0.02 × wd=0.02 = 4e-4 per step, compounded over ~4000 steps gives (1-4e-4)^4000 ≈ 0.20 — ~80% shrinkage toward zero on gates/scales that were initialized at specific learned-in-smoke values (q_gain=5.25!). Gradient keeps pulling back but decay direction fights it. Zero WD lets these small-N params settle at their true optima. Anti-anchor: prior opt trials all touched momentum/LR/clip/beta schedules — WD on scalar group is the last untouched regularizer.
088	2026-04-22T08:11:50Z	opt	017	017	opt	Shrink muon_momentum_warmup_fraction 0.33→0.22 so Muon momentum reaches peak 0.99 BEFORE warmdown begins at frac=0.28, giving the peak-LR phase a real peak-momentum window instead of still-ramping momentum colliding with exp_010's cool-during-warmdown coupling.	-0.0006	keep	1.076944	-0.001115	15992314	600.031000	755.969000	1471.000000	apg-opt-0088	snapshots/088_opt	Single-scalar change at line 154 (default 0.33→0.22). Env var MUON_MOMENTUM_WARMUP_FRACTION is NOT injected by run_trial.sh (grep-verified), so the code default is what executes. Under the current stack: warmdown starts at frac=1-0.72=0.28, but momentum ramp extends to 0.33, meaning momentum never reaches 0.99 cleanly — it's still climbing when exp_010 begins coupling it down with lr_scale. At 0.22 the ramp finishes at ~79% of peak-LR phase, giving a real 6%-of-budget window of (peak LR × peak momentum) before warmdown kicks in. Unexplored direction: exp_015 bumped the START 0.92→0.94 (worse), exp_029 WIDENED 0.33→0.45 (crashed); NARROWING has not been tested in the opt tree. Matches INIT.md's documented default and the canonical nanoGPT-speedrun 1000-step ramp (1000/4550≈0.22).
089	2026-04-22T08:12:09Z	ttt	017	088	ttt	Reset TTT SGD momentum buffers at chunk boundaries (not across): each val chunk is a non-stationary distribution, so velocity from chunk i opposes chunk i+1's gradient; momentum still accumulates across the 4 inner epochs on the same chunk.	-0.0004	eval_budget_overrun	1.079803			600.029000	792.971000	1509.000000	apg-ttt-0088		Single-site addition inside eval_val_ttt: optimizer.state.clear() is called right after setting cos_lr for the new chunk, before the inner epoch/batch loops. Structural change (new state lifecycle) rather than a knob sweep — prior TTT trials touched epoch count (014/017 keep), anchor coef (027 crash), Nesterov (031 crash), momentum cooling (037 crash), momentum value (039 discard +0.000178), param freeze (049 discard +0.000223), inner-epoch LR shape (084 crash); none touched momentum lifecycle. Rationale: main training carries momentum because steps draw i.i.d. samples (stationary); TTT traverses ~313 chunks each representing a different topic, so velocity from chunk i points in a direction that's essentially noise for chunk i+1. Within-chunk momentum (across 4 epochs, same data) is still meaningful and preserved. Zero runtime cost, zero size impact.
090	2026-04-22T08:28:09Z	arch	017	088	arch	Add Sub-LN (post-attention and post-MLP RMSNorm, no-affine) inside Block.forward: decouples direction from magnitude so attn_scale/mlp_scale purely control amplitude while F.rms_norm bounds residual-stream growth, especially valuable under 3-layer recurrence where blocks 3-5 are reused 3x.	-0.0015	crash				600.049000	236.951000	951.000000	apg-arch-0088		Sub-LN / NormFormer-style: insert F.rms_norm(attn_out) after attn and F.rms_norm(mlp_out) after mlp, in both parallel and sequential branches of Block.forward. Zero params added (RMSNorm without weight). At init the forward pass is unchanged because proj/c_v are zero-init so attn_out=mlp_out=0 and rms_norm(0)=0. Muon's orthogonalization is invariant to 1/sqrt(eps) grad amplification at init. Novel direction: prior arch trials touched rope_dims (005 keep), value-residual (001 crash), xsa_last_n (028 crash), SwiGLU (030 crash), resid_mix init (079 crash) — none normalized the residual-branch outputs. | torch.distributed.elastic.multiprocessing.errors.ChildFailedError: ============================================================ (train_gpt.py:945 in gptq_quantize_weight)
091	2026-04-22T08:36:43Z	meta	017	088	meta	Raise Adam beta2 0.95→0.98 (canonical LLM default): 2nd-moment EMA half-life grows ~14→~34 steps, smoothing the preconditioner denominator for tied tok_emb (4.2M params) and scalar groups without touching Muon; unexplored static tweak (only cosine-scheduled beta2 was tried in exp_021→crash; sibling exp_075 tightening beta1→0.8 hurt +0.0013, so lengthening beta2 is the symmetric unexplored direction).	-0.0004	discard	1.078984	+0.002040	15993930	600.080000	765.920000	1487.000000	apg-meta-0088		"Single-line literal change at train_gpt.py:157 (BETA2 default 0.95→0.98). Affects optimizer_tok (AdamW, tied tok_emb, 8192×512=4.2M) and optimizer_scalar (AdamW, ~25k control tensors) and optimizer_head (disabled under tie_embeddings=True). Muon groups use muon_beta2 separately (dead var — unused by Muon class). Zero runtime/size impact. No structural change, no crash risk. Rationale: β2=0.95 half-life≈14 steps is GPT-2-small-ish; GPT-3/Llama/most speedrun recent settings use 0.95-0.98 range, with 0.98 the canonical ""longer 2nd-moment memory"" choice. Expected modest bpb win on scalar-group convergence late in training."
092	2026-04-22T08:37:29Z	quant	017	088	quant	Replace per-row std with 1.4826×MAD (Median Absolute Deviation) in GPTQ scale computation — robust dispersion estimator gives finer quantization bins in the bulk for heavy-tailed LLM weight distributions while matching std exactly for Gaussian rows.	-0.0004	size_blocked	1.075144		17455687	600.008000	766.992000	1478.000000	apg-quan-0088		Single-line change at gptq_quantize_weight line 945: row_std from W.std(dim=1) to 1.4826*median|W-median|. Zero size impact (same fp16 scale per row). Novel in-tree: all prior quant experiments (exp_004/008/020/035/045/086) touched the clip multiplier, per-row grid search, closed-form refinement, block_size, or damping — nobody touched the dispersion estimator itself. Mechanism: at clip_sigmas=10 with int6 (63 levels), bin width = 0.323σ; for heavy-tailed weights (kurtosis>3 typical of attention projs), raw std is inflated 10-20% by outliers → bulk bins coarse → bulk quant error dominates. MAD tightens bulk bins at cost of a few more tail elements clipping (<<0.1% mass for LLM kurtosis). For Gaussian weights, 1.4826·MAD ≡ σ so this is a strict superset. Complements exp_016's signal that damp=0.003 was worse (suggesting GPTQ benefits from conservative, stable estimators).
