exp_id	timestamp	specialist	parent_exp	baseline_exp	domain	hypothesis	expected_delta	status	val_bpb	delta_vs_best	artifact_bytes	train_s	eval_s	total_s	job_name	snapshot_path	notes
715	2026-04-25T02:15:06Z	curr	596	596	curr	Train-eval stride alignment: packing stride 2048 to 1984 so overlap-region tokens appear at both deep and shallow context. Revives exp_076 mechanism which harness_aborted.	-0.0003	discard	1.075485	+0.003234	15998126	600.123000	582.300000	1516.000000	apg-curr-0708		Single-site edit in ShuffledSequenceLoader._reset_shard. num_sequences formula updated so last start_ind plus seq_len still fits. 3.2 percent more sequences per shard-epoch. 3 percent overlap is 16x smaller than exp_047 half-stride discard. Fresh on z-loss stack.
716	2026-04-25T02:22:15Z	arch	596	596	arch	Per-loop-iteration learnable residual-stream scale [num_loops+1]=3 (init=1.0) applied once at entry to each block within iteration k; breaks translational symmetry of applying the shared loop segment 3x identically. Retry of exp_709 crash with DDP ghost-touch fix.	-0.0003	size_blocked	1.073128		16002555	600.028000	591.700000	1532.000000	apg-arch-0710		exp_709 crashed in DDP all-reduce because loop_iter_scale received no grad during warmup's first 20 non-looped steps (default DDP errors on unused params). Fix: ghost-touch `x = x + 0.0 * loop_iter_scale.sum()` right after embed in forward_logits, making the param participate in every autograd graph. Multiply-by-zero is exact so output unchanged, but autograd plumbs grad=0 to the param, satisfying DDP's reducer. Rest of logic identical to 709. Code +201B vs 709.
717	2026-04-25T02:22:40Z	eval	596	596	eval	Per-vocab Newton logit-bias correction in parallel to existing scalar β Newton: incremental [V] bias updated per chunk from prefix-only g/h stats, clamped to [-0.05,0.05], applied to scoring as ((logits+_b)*β). New orthogonal calibration axis to scalar β.	-0.0003	eval_budget_overrun	1.074822			600.046000	603.600000	1539.000000	apg-eval-0710		Mirrors the existing per-chunk Newton β recalibration (lines 1346-1394) but extends from a scalar logit scaling to a per-vocab logit shift. Both Newton steps now share the same prefix-only softmax computation (`_z = _lf[_pm] + _b`), so β stats reflect the actual scored logits including bias. Per-vocab gradient g_v = Σ_t (p_t[v] - 1[y_t=v]); diagonal Hessian h_v = Σ_t p_t[v]*(1-p_t[v]). Damping via h.clamp_min(1.0) + outer clamp(-0.05,0.05) keeps bias gentle (≤5% logit shift). Causally legal: prefix tokens are unscored context, never the scored region. Untried axis in our domain — exp_634 (unigram cache bias) and exp_667 (chunk-delta lookahead) were the only similar attempts, both size_blocked. Code +151B; one extra all_reduce of 2× [V=8192] f64 tensors per chunk (~128KB × ~96 chunks = 12MB cumulative, negligible vs param grads). Eval cost: one extra _p.sum(0) and (_p*(1-_p)).sum(0) reduction per inner batch — bounded by the prefix-mask compute path which is a small fraction of scoring fwd.
718	2026-04-25T02:23:02Z	opt	596	596	opt	Decrease Muon Newton-Schulz iteration count 5 to 4 (muon_backend_steps): exp_710 just showed 5 to 6 hit train_budget at 600.0s exactly with +0.001620 regression, indicating the regime is speed-bound. Going 4 iters trades ~one order of polar-approx precision for about 20% faster Muon steps and a proportional gain in training-step count.	-0.0002	discard	1.072912	+0.000661	15999049	600.071000	585.800000	1522.000000	apg-opt-0711		Reverse-direction probe of exp_710. NS5 with 4 iters gives polar-factor approximation error roughly 1e-2 vs roughly 1e-4 at 5 iters (quintic convergence): looser but still useful as orthogonalized direction. Per-Muon-step cost: -3 BMMs (-20% NS time). Mechanism: more main-train steps for the same 600s wallclock; if exp_710's regression is dominated by step-budget loss rather than per-step direction quality, 4 iters should net positive. Risk: noisier orthogonalization could destabilize peak-LR trajectory.
719	2026-04-25T02:23:03Z	ttt	596	596	ttt	Per-chunk Lookahead slow-weights (Zhang 2019, α=0.5): clone TTT params at start; after each chunk's adaptation, slow.lerp_(fast,0.5); fast.copy_(slow). Untested at chunk cadence (exp_678 was per-epoch and busted eval budget). Mechanically distinct from momentum manipulation (exp_588/607) — operates on weight-space directly. Composes orthogonally with z-loss (per-step logit regularizer) by damping cumulative cross-chunk weight drift.	-0.0002	discard	1.073799	+0.001548	15996002	600.095000	582.100000	1522.000000	apg-ttt-0711		+123 packed code bytes (23296→23419). 15× per-chunk pullbacks (skipping last chunk). Each pullback: 50 ttt_params × 2 in-place ops = ~100 ops/chunk. Memory: +1× clone of ttt_params (~99MB GPU per rank, fits 80GB GPU). Score-first preserved: scoring at chunk c uses slow-pulled params from chunk c-1's adaptation, so each chunk benefits from less-noisy averaged weights. Risk: exp_588 (mb.mul_(0.5)) regressed under z-loss in exp_607, suggesting double-smoothing risk — Lookahead targets weight space (not momentum) so partial overlap; expecting partial gain or near-noise.
720	2026-04-25T02:23:48Z	quant	596	596	quant	Walsh-Hadamard pre-rotation along input axis for MLP-only GPTQ matrices	-0.0006	size_blocked	1.072278		16006507	600.032000	589.500000	1526.000000	apg-quan-0711		
721	2026-04-25T02:35:51Z	tok	596	596	tok	Dual-site embed_scale stacking exp_298 and exp_711 mechanisms with zero new params.	-0.0001	size_blocked	1.072255		16000389	600.054000	586.000000	1522.000000	apg-tok-0714		
722	2026-04-25T02:40:52Z	loss	596	596	loss	Replace TTT inner-loop L2 z-loss with rectified hinge form: 1e-5 * F.relu(logsumexp - 7.0).pow(2).mean() — concentrates partition-function regularization only on positions with lse > 7 (over-confident drift), leaves softer/uniform-ish positions unconstrained for faster per-chunk TTT adaptation. Mechanism-distinct from prior z-loss probes (L1 exp_664 discard, variance exp_675 size_blocked, anchor-at-log(V) exp_694 size_blocked, tail-PW exp_704 size_blocked, halve/double coef discard).	-0.0003	size_blocked	1.073042		16000016	600.059000	591.500000	1535.000000	apg-loss-0715		Single-line edit at line 1401. +17 bytes code. Hinge cutoff C=7.0 chosen so typical lse (~9-10 for soft predictions, higher for sharp) still triggers penalty, but very-uniform positions (lse≈log(V)≈9 if logits all ~0) are at threshold. Rationale: the gauge-fixing motivation of z-loss (prevent uniform logit drift inflating partition function) only requires upward-drift suppression; lower-tail logsumexp values don't need regularization, and removing pressure there frees CE-gradient for those positions during TTT's 16 SGD steps/chunk.
723	2026-04-25T02:42:37Z	reg	596	596	reg	Multiplicative uniform noise eps=0.03 on attn_out_gate output training-only	-0.0003	size_blocked	1.072818		16001140	600.032000	534.600000	1436.000000	apg-reg-0716		
724	2026-04-25T02:48:21Z	meta	596	596	meta	BETA2 0.95 to 0.96 untested midpoint between current and exp_126 0.97 UP probe that measured +0.000299 on depth-5 stack	-0.00005	discard	1.072689	+0.000438	15999250	600.091000	577.600000	1507.000000	apg-meta-0716		Single-literal change at line 160 BETA2 default 0.95 to 0.96, 4-char to 4-char byte-neutral. Affects optimizer_tok and optimizer_scalar only, not Muon. Axis history: exp_126 at 0.97 was +0.000299 closest-to-win, exp_068/091/159/182 at 0.98 hurt more, exp_294 at 0.93 and exp_262 at 0.90 both size_blocked. 0.96 is first beta2 probe under z-loss + GC + attn_out_gate regime.
725	2026-04-25T02:48:42Z	curr	596	596	curr	CUTMIX-LM token splice: p=0.05 per-sample, splice tail x[split:]/y[split-1:] from another batch sample at random split in [64, seq_len-64), injecting synthetic topic-switch events at long-context positions — novel curr axis (cross-sample content mixing untried; exp_624 did per-token random noise, not cross-sample splicing).	-0.0005	discard	1.074574	+0.002323	15999456	600.123000	583.600000	1523.000000	apg-curr-0716		Inserted just before `return x.to(device)` in ShuffledSequenceLoader.next_batch. For each of B samples at p=0.05, picks a src from rng.permutation(B) and splits at 64 + rng.integers(0, T-128). Splices x[bi, split:] = x[src, split:] and y[bi, split-1:] = y[src, split-1:] (the -1 fixes LM causality: y[split-1] must equal new x[split] = x_src[split] = y_src[split-1]). Uses self.rng (PCG64(rank)) so deterministic per-rank. Tests whether synthetic doc boundaries at random positions regularize long-context prediction. Genuinely untried axis — all prior curr input perturbations were single-token (exp_624) or position-level masking (exp_643/679/217/etc). Packed code grew +~1.8KB; size-tight but model-output-neutral edit.
726	2026-04-25T02:52:16Z	eval	596	596	eval	EMA decay 0.9 on the TTT-scoring Newton β accumulators (_g_acc, _h_acc): _g_acc = 0.9*_g_acc + _g_chunk (same for _h_acc). Current code uses uniform cumulative sums, which means chunk 1's stats weight equally with chunk 250's stats even though the TTT-adapted model has drifted substantially; EMA lets β track the adapted model's current residual imbalance.	-0.0003	eval_budget_overrun	1.075273			600.061000	603.800000	1540.000000	apg-eval-0721		Structural, untried in eval domain. Single-site 2-op edit at line 1402. Per-vocab _b is unchanged (already per-chunk local, not cumulative). Effective-N after decay=0.9 saturates at ~10 chunks' worth of prefix tokens (~650K tokens), which is plenty for a 2-parameter (β) Newton step and _h_acc.clamp_min(1.0) already handles small-N. If β has been saturating near its ±5% clamp this should let it track more tightly; if β has been stable at ~1.0 it's a wash.
727	2026-04-25T02:54:54Z	arch	596	596	arch	Self-keyed attn-output gate: source gate input from post-attention output y[..., :W_g] (per-head, each head sees its own output) instead of shared pre-attention input x[..., :W_g]; squeeze-excitation style, no param/size change vs exp_538.	-0.0004	size_blocked	1.073438		16004961	600.024000	599.000000	1521.000000	apg-arch-0721		Mechanism-distinct from (a) exp_538 current gate which reads shared pre-attn 12-dim window (all heads correlated via shared input); (b) exp_652 output-keyed [H,H] cross-head mixer over y.mean(-1) (size_blocked 1.073587); (c) exp_674 per-head offset window of pre-attn input (size_blocked 1.073571). Here each head's gate is a linear function of its OWN 12 output features, letting gates become mutually independent and condition on what that head just computed. Weight shape [H, W_g]=[8, 12] preserved; compute FLOPs equivalent to the F.linear op it replaces (B*T*8*12 either way); no new parameters. Should be size-neutral vs exp_596 (same param shapes) and eval-neutral (same FLOP count).
728	2026-04-25T03:01:32Z	quant	596	596	quant	Replace fixed 12.85σ-based GPTQ per-row scale heuristic with AWQ-style MSE-optimal scale grid search: pick per row the multiplicative candidate in {0.80, 0.90, 1.00, 1.10, 1.25} that minimizes round-MSE on permuted weights. Storage unchanged (fp16 per row); adapts scale to each row's real tail distribution rather than assuming Gaussian.	-0.0003	size_blocked	1.069841		17327115	600.067000	581.100000	1514.000000	apg-quan-0721		Structural shift from fixed sigma heuristic to per-row data-adaptive scale, AWQ-inspired. Zero size overhead: s remains fp16[rows]. Compute: 5 extra per-row round/clamp passes per matrix (~ms). Probes whether the 12.85σ Gaussian assumption is leaving per-row error on the table across heavy-tailed rows. Candidates span [0.80, 1.25]: 0.80 covers tighter-scale rows (fewer clipped, better resolution), 1.25 covers heavier-tail rows (fewer clipped at cost of resolution). Rebased from workdir's stale exp_720 WHT attempt back to exp_596 baseline first.
729	2026-04-25T03:06:39Z	ttt	596	596	ttt	Mid-chunk TTT SGD momentum buffer damping: at epoch 2 of 4 within each chunk multiply each ttt param momentum buffer by 0.7	-0.0002	size_blocked	1.073067		16001902	600.042000	527.100000	1425.000000	apg-ttt-0721		4-line insert at eval_val_ttt epoch loop head, +77 packed bytes. Novel axis: prior momentum damping probes were all at chunk boundaries (exp_588 kept at 0.5, exp_598 discard at 0.3, full resets all discarded). Mid-chunk damping is untested within-chunk analog. Orthogonal to exp_596 z-loss (per-step logit regularizer vs velocity state). By ep2 Nesterov mu=0.9 accumulated ~8 steps of velocity; 0.7 damping prevents lookahead compounding.
730	2026-04-25T03:07:10Z	opt	596	596	opt	Linearly cool ema_decay 0.9965 to 0.995 in lockstep with lr_scale during warmdown: symmetric DOWN application of the kept Muon-momentum cool pattern to the EMA decay. Untested direction on the EMA-decay axis.	-0.0003	eval_budget_overrun	1.074044			600.079000	603.900000	1549.000000	apg-opt-0721		Single 1-line insert + 2 var renames in the EMA update block. +15 packed code bytes (23296 to 23311). Half-life shift: 0.9965 (197 steps, ~6.5% of training) at peak to 0.995 (138 steps, ~4.6%) at lr_scale=0; concentrates EMA weight on the well-converged warmdown tail. Mirrors the kept exp_010/exp_324 cool-during-warmdown pattern which lowers Muon momentum 0.99 to 0.9375 floor for similar reasons (more reactive low-LR tail averaging). exp_544 was the UP-direction schedule (0.9965 to 0.998) and was size_blocked at bpb=1.074789 vs parent 1.074087, suggesting the schedule-shape axis matters. exp_393 const-UP at 0.998 hurt by +0.001989. DOWN direction never probed.
731	2026-04-25T03:12:26Z	tok	596	596	tok	Split-gauge embed_scale on x0 only inside rms_norm; x enters block 0 as plain unit-RMS.	-0.0002	size_blocked	1.072287		16003048	600.043000	588.600000	1525.000000	apg-tok-0724		Zero new params.
732	2026-04-25T03:15:59Z	reg	596	596	reg	Moderate UP probe embed_wd 0.085 → 0.095 (+11.8%, untested step-size between exp_661's +5.9% discard and too-high); tightens 4.2M-param tied tok_emb → improved int8 GPTQ + brotli compression.	-0.0003	discard	1.073409	+0.001158	15993780	600.053000	591.600000	1529.000000	apg-reg-0726		Single-literal change line 169. Prior embed_wd probes: exp_218 warmdown-scheduled boost discarded +0.001975; exp_661 gentle +5.9% (0.090) discarded +0.000560; exp_701 gentle -3.5% (0.082) discarded +0.000263; exp_041 LOWER direction size_blocked. The untested zone is a meaningfully larger UP step (doubled vs exp_661). Tied tok_emb is 4.2M params quantized at int8+brotli, and tighter weights → narrower distribution → strictly better compression (size-safe direction, counters the 4xx-series size_blocked tide). Mechanism: tok_emb rows are pulled more strongly toward 0; post-RMSnorm gauge fix (exp_298) makes input magnitude scale-invariant, so the effective change is on tok_emb *directional* diversity — shrinks rare-token distinctiveness slightly but may reduce overconfident lm_head logits (tied). Zero code bytes; code_bytes 23289 unchanged.
733	2026-04-25T03:16:44Z	loss	596	596	loss	Stack confidence-penalty (Pereyra 2017 with sign reversed) on top of the kept z-loss in the TTT inner CE: add -1e-5*&lt;p,log p&gt;.sum(-1).mean() i.e. +1e-5*H(p) — penalize entropy, encouraging the model to commit confidently to chunk-domain predictions during the ~16-step per-chunk SGD. Mechanism distinct from prior z-loss probes (z-loss controls lse magnitude only; entropy controls distribution shape). UNTRIED on TTT in this tree.	-0.0003	discard	1.072713	+0.000462	15998289	600.100000	579.900000	1518.000000	apg-loss-0726		Single-line edit at line 1401. Factored to share the 1e-5 coefficient and trailing .mean() with the z-loss term (saves ~10 chars vs separate terms). Coefficient picked to be magnitude-matched: lse^2 contributes ~1e-3 to loss at typical lse~10; H(p) contributes ~1e-4 at typical H~5 nats (so entropy term is ~10x smaller — gentle nudge). Sign chosen as ENCOURAGE-confidence (penalize H), reasoning: TTT chunks are topic-coherent, sharpening helps next-window scoring. Risk: counteracts tanh softcap=30 which already bounds magnitudes. Reverse direction (β<0, encourage entropy = label-smoothing-like) tried indirectly via exp_631 (label_smoothing=0.003 size_blocked).
734	2026-04-25T03:21:34Z	meta	596	596	meta	muon_wd attn-only 0.095 to 0.094 fine DOWN midpoint	-0.00005	size_blocked	1.072700		16001081	600.005000	585.100000	1523.000000	apg-meta-0728		
735	2026-04-25T03:23:29Z	eval	596	596	eval	Chunk-level SWA on TTT weights: maintain EMA (alpha=0.5) of post-training ttt_params; swap EMA into params for scoring pass only, restore trained weights before next chunk's TTT step. Polyak-Ruppert smoothing over the last ~2 chunks' TTT trajectories — structurally distinct from exp_676 (within-chunk tail avg, size_blocked) and exp_667 (forward-lookahead, size_blocked).	-0.0003	discard	1.072784	+0.000533	15999041	600.026000	583.300000	1520.000000	apg-eval-0728		Untried structural axis: cross-chunk SWA of TTT trajectory. exp_676 within-chunk Polyak signaled tail-avg helps (1.073513, size_blocked). exp_667 forward-lookahead also size_blocked. Cross-chunk EMA is the SWA dual — averages recent TTT iterates instead of extrapolating. ci=0 unchanged (EMA init=current). Memory ~2×ttt_params (~60MB). Per-chunk: 2 param-copies + 1 EMA update. Alpha=0.5 tracks adaptation tightly with moderate smoothing.
736	2026-04-25T03:24:20Z	tok	596	596	tok	Swap final_norm (parameter-free RMSNorm) to F.layer_norm at the post-trunk gauge-fix site feeding the tied softmax: zero-mean each token's x before F.linear(x, tok_emb.weight) to cancel spurious x-DC × row-sum contributions to logits without touching input-side x0 flow.	-0.0003	crash						28.000000	apg-tok-0735		Single-line edit at line 763: self.final_norm(x) -> F.layer_norm(x, (x.size(-1),)). Zero new params (final_norm was already parameter-free RMSNorm). Code bytes 23296 -> 23290 (slightly smaller). Novel axis: all prior LayerNorm/DC-removal tok trials (exp_380 discard +0.002807, exp_523 size_blocked, exp_699 discard +0.005447, exp_551 size_blocked, exp_616 size_blocked) targeted the INPUT side. OUTPUT side (between final_norm and tied F.linear) has never been tested. Mechanism: tied tok_emb rows have non-zero row-sums, so F.linear(x, W) produces a per-vocab logit offset proportional to x.mean * W.sum(-1) — a spurious unigram-like bias riding on x's DC. LayerNorm here strips that noise component without discarding variance info. | torch.distributed.elastic.multiprocessing.errors.ChildFailedError: ============================================================ (train_gpt.py:1065 in gptq_mixed_quantize)
737	2026-04-25T03:28:39Z	curr	596	596	curr	Sub-eval-stride jitter [0, 32) within each Latin-square bucket: phase = k*256 + rng.integers(0,32), tighter than exp_154's full-bucket-width jitter (which dilutes LS structure) — 32 = half eval stride 64, giving mod-64 RoPE-position diversity below the inert 256-token grid where shards rarely consume more than phase[0..2] in 600s.	-0.0001	discard	1.073365	+0.001114	15998960	600.053000	591.800000	1532.000000	apg-curr-0729		+10 bytes raw code. Distinct from exp_154 (full-bucket [0,256) jitter, discard +0.000683) because the jitter span (32) is much smaller than bucket width (256), so Latin-square bucket boundaries are preserved. Untested cross between exp_142 (LS-8 keep) and finer-than-bucket randomization. Phase still bounded by max_phase guard. Single-line mutation in _reset_shard.
738	2026-04-25T03:29:24Z	quant	596	596	quant	Narrow exp_728's MSE-optimal scale search candidate band from [0.80, 1.25] to [0.95, 1.20]: caps downside scale shrinkage at −5% to preserve brotli-friendly near-zero integer concentration (exp_728 hit val_bpb 1.069841 but blew artifact +1.33MB over cap from 0.80x candidates spreading integer histograms toward uniform high entropy). Upside +20% retained to capture heavy-tail rows.	-0.0007	size_blocked	1.072035		16329980	600.046000	583.200000	1516.000000	apg-quan-0729		Direct continuation of exp_728. The mechanism (per-row data-adaptive scale via MSE search) gave -0.0024 val_bpb but +1.33MB artifact. Hypothesis: most of the size cost came from rows where the search picked 0.80x or 0.90x scale, which spreads quantized integers across [-63,63] and inflates brotli output. Capping the search at 0.95x recovers most of the artifact size while retaining the gain on rows with mild tail-overestimate. Expect a fraction of the -0.0024 gain (perhaps -0.0005 to -0.001) at fit-in-size cost.
739	2026-04-25T03:30:46Z	arch	596	596	arch	Learnable per-head XSA strength [num_heads=8] init=1.0 per attention layer: replaces the hardcoded full-subtraction of V-direction inside _xsa_efficient with a scalar-per-head coefficient, letting each head independently learn how much exclusive-self-attention to apply. Step-0 identical to exp_538/596 (init=1.0 reproduces exact current XSA), structurally distinct from prior XSA trials (exp_178/215/268) which all treated strength as binary on/off per layer.	-0.0005	size_blocked	1.075220		16006864	600.020000	596.600000	1522.000000	apg-arch-0729		+329 code bytes. +88 fp32 scalars (11 layers × 8 heads) = ~176 bytes fp16 passthrough + ~330 bytes state-dict key metadata + brotli on near-uniform ones should pack to ~200-400 net bytes. Routed to scalar-AdamW via ndim<2 (auto, no CONTROL_TENSOR_NAME_PATTERNS update needed). Low compile-graph risk (simple broadcast mul). Mechanism: exp_178 (xsa_last_n=6, discard) and exp_268 (disable XSA on loops, size_blocked) both probed layer-level XSA toggles — both net-negative. Per-head continuous coef is the finer-grained untried axis: some heads' V-directions may carry more task-relevant signal than others, and fixed-strength XSA over-whitens those heads. Training gradient will differentiate.
