exp_id	timestamp	specialist	parent_exp	baseline_exp	domain	hypothesis	expected_delta	status	val_bpb	delta_vs_best	artifact_bytes	train_s	eval_s	total_s	job_name	snapshot_path	notes
325	2026-04-22T22:01:50Z	meta	298	324	meta	Raise matrix_lr 0.022 → 0.023 (+4.5%): half-step in the less-bad direction on a now-untested axis — exp_214 (0.024, +0.000180) hurt less than exp_224 (0.020, +0.000550), and several kept downstream changes (exp_245/264/280/298) have shifted the regime since the last matrix_lr probe.	-0.0001	discard	1.074371	+0.000091	15995475	600.043000	776.957000	1486.000000	apg-meta-0315		Single-literal edit at train_gpt.py:148 (MATRIX_LR default 0.022 → 0.023). Muon LR controls all ~29M Muon-managed matrix params (attn + MLP). Size-neutral: no WD change, no weight-magnitude shift expected. Rationale: exp_214 showed +9% (0.024) was mildly bad (+0.000180); the opposite −9% (exp_224 at 0.020) was worse (+0.000550). Since then, per-feature embed_scale (exp_190 kept) and recurrence-aware ln_scale correction (exp_245 kept) change the effective gradient-scale landscape on matrix params. 0.023 is a halfway probe — if the optimum sits between 0.022 and 0.024 under the current stack, this captures it without overshooting.
326	2026-04-22T22:01:50Z	curr	298	324	curr	Double Latin-square phase bucket count 8→16 in ShuffledSequenceLoader: finer within-shard phase granularity (128-token spacing vs 256-token) on the initial-phase draw, which is the dominant curr lever since shards don't exhaust in a 600s run. exp_207 tested the opposite direction (8→4) and lost +0.00085; the increase direction is orthogonal and untested.	-0.0001	size_blocked	1.078421		16018433	600.101000	792.899000	1500.000000	apg-curr-0315		"Three-site edit in ShuffledSequenceLoader: permutation(8)→(16) in __init__, % 8 → % 16 and // 8 → // 16 in _reset_shard. Zero byte impact (no new tables — permutations are 8→16 element ints, ~100 bytes in RAM, zero in pickle). At max_phase ≈ seq_len-1 = 2047, bucket width drops from 256 to 128. With ~13 shards/rank drawing from 16 buckets vs 8: expected distinct-phase-coverage per rank ≈ 8.4 (was ~6.6) — coarser per-phase redundancy but finer positional resolution. Orthogonal to all prior curr trials: exp_142 introduced the 8-bucket Latin-square (keep); exp_207 halved to 4 (discard +0.00085); no prior increase probe. Not a phase-scheduling rewrite (exp_259/279/289 all failed) — just granularity doubling within the proven-winning Latin-square structure. Since in a 600s run no shard exhausts (100M tokens/shard × 13 shards ÷ ~48 seq/batch × 2048 tok/seq ≈ 0.29 epochs), the initial phase-order[0] is the dominant control; finer granularity improves the expected L2 positional-offset diversity across shards-per-rank by sqrt(2) in the small-K regime. Risk: if exp_207's 4-bucket regression was due to ""fewer distinct phase buckets hit per rank"", then 16 (which also reduces per-phase hit rate) could likewise regress — but the underlying claim is that exp_207 lost positional RESOLUTION, not coverage, and this change increases resolution."
327	2026-04-22T22:08:40Z	ttt	298	324	ttt	Reset Nesterov SGD momentum buffer at each chunk boundary in eval_val_ttt: zero state['momentum_buffer'] for all ttt_params right after updating cos_lr, before inner epoch loop. Isolates each chunk's adaptation from prior chunks' gradient history (val data is not i.i.d. across chunks, and cosine-decaying LR means stale momentum from chunk 0's high-LR gradients disproportionately biases chunk N's small-LR updates).	-0.0002	discard	1.075004	+0.000724	15997599	600.136000	759.864000	1469.000000	apg-ttt-0317		Novel axis: exp_039 tuned momentum value (0.9→0.95, discard), exp_037 annealed momentum schedule (harness_abort), exp_151 enabled Nesterov (keep -0.000272). None reset the buffer. Zero budget cost (tiny memset per ~16 chunks). Risk: loses cross-chunk momentum smoothing if gradients across adjacent chunks are correlated (sequential val text). If that correlation matters more than distribution shift, trial discards and we learn momentum persistence is load-bearing.
328	2026-04-22T22:19:41Z	loss	298	324	loss	Re-introduce exp_186's proven u^2 convex position-weighted CE (pw = (0.9 + 0.2*u^2) / mean, mean-preserving) onto exp_298 baseline — position weighting was stripped from current best, and u^2 spreads the +0.2 tilt smoothly across all T vs sigmoid/hard-mask variants that concentrate it on ~64–300 tail positions and keep hitting size_blocked by only 0.9–2.8 KB.	-0.00005	discard	1.074657	+0.000377	15998193	600.038000	769.962000	1482.000000	apg-loss-0323		Single-site edit in GPT.forward replacing plain F.cross_entropy(mean) with per-token CE multiplied by a T-length weight pw=0.9+0.2*u^2 normalized to mean 1.0, broadcast across the batch. Zero new params, zero inference cost, mean-preserving so no LR retuning. Rationale: (1) exp_186 proved u^2 ramp is -0.000062 on its parent, and current best lacks any position weighting; (2) size_blocked attempts on exp_298 were sigmoid (exp_318, +2,799 B over, bpb=1.074464 which would be a keep) and hard masks (exp_300 +938 B, exp_309 +11.5 KB); (3) the u^2 shape spreads gradient perturbation uniformly across all T positions rather than concentrating on the last 64–300, so weight-distribution change per step is roughly 3–6× gentler than sigmoid, reducing the risk that brotli entropy overflows the ~7 KB headroom. If this still size_blocks, I've bounded the problem: even the gentlest smooth position-weighting is compression-hostile on this baseline, and the loss domain needs a structurally different direction (focal, logit-margin, or entropy regularization).
329	2026-04-22T22:22:34Z	eval	298	324	eval	Soft eval-aligned TTT loss: mean-preserving 1.5x upweight on the last stride=64 positions of each TTT training seq, keeping unit weight on the first 1984. Interpolates between current unweighted TTT (alpha=0) and exp_322's hard-mask failure (alpha=infinity, +0.0117 regression).	-0.0004	size_blocked	1.074548		16000500	600.014000	754.986000	1462.000000	apg-eval-0323		Single edit inside eval_val_ttt inner SGD loop (replaces `loss = base_model(x,y)` with forward_logits + per-token CE, mean-preserving weights [1,...,1, 1.5 x stride]). Realigns TTT gradient distribution with the sliding-window scored distribution (last-stride positions) without zeroing short-context signal that exp_322 lost. Code delta only; model bytes untouched.
330	2026-04-22T22:22:57Z	arch	298	324	arch	Per-KV-head learnable V-gain (shape=[num_kv_heads]=4 per layer, init=1.0) applied right after c_v projection to complete the Q-K-V gain trio: QK-Gain already sharpens attention scores; V-gain decouples attention direction from output magnitude per head, letting heads specialize by how much they read rather than just where.	-0.0003	size_blocked	1.075124		16001988	600.114000	791.886000	1499.000000	apg-arch-0323		Two-site edit on exp_298. (1) CausalSelfAttention.__init__ adds self.v_gain = nn.Parameter(torch.ones(num_kv_heads, dtype=torch.float32)) right after self.q_gain. (2) In forward, after v = self.c_v(x).reshape(bsz, seqlen, num_kv_heads, head_dim), multiply v *= self.v_gain[None,None,:,None]. Identity at init (byte-equivalent to exp_298 at step 0). 4 kv-heads × 11 layers = 44 fp32 scalars (~176 B raw, scalar passthrough in GPTQ, ~0 compressed bytes). Auto-routes to scalar AdamW via ndim=1. XSA uses F.normalize(v) which strips magnitude, so XSA is invariant. Orthogonal to prior tried axes: per-feature residual scales (attn_scale/mlp_scale) are on OUTPUT side, per-feature embed_scale (exp_298) is at embedding, per-loop iter_scale (exp_321 crash) was residual-additive. v_gain acts BEFORE attention at V-projection granularity.
331	2026-04-22T22:23:16Z	tok	298	324	tok	"Swap tied tok_emb init from nn.init.normal_ to nn.init.trunc_normal_ at ±2σ (PaLM/T5/BLOOM/Llama standard): clips the ~5% of rare-token rows beyond ±2σ=±0.01 that, under tied embeddings, double as outlier softmax classification directions and can create spurious early-grad spikes.</hypothesis> <parameter name=""notes"">Single-line edit in GPT._init_weights: nn.init.normal_(mean=0, std=0.005) -> nn.init.trunc_normal_(mean=0, std=0.005, a=-0.01, b=0.01). Zero params added, zero bytes delta; model pack approximately exp_298. Mechanistic rationale: with tied embeddings the tok_emb rows ARE the output softmax classifier rows, so the Gaussian tail mass (~5% of 8192 rows beyond ±2σ) creates rare-token classifiers whose initial direction is dominated by the random outlier, forcing the first hundred grad steps to correct artifacts before real signal can be absorbed. Truncating the tails at ±2σ removes the outliers while keeping the bulk of the distribution and its natural per-row variance intact — distinct from exp_019's equi-row-norm sphere init (discarded, +0.001603) which forced EVERY row to identical L2 norm and destroyed natural row-magnitude variation; this keeps in-bulk variance and only removes outliers. First-try attempt at this direction: exp_032 proposed trunc_normal at ±2σ but was harness_abort'd (never reached GPU), so the hypothesis has not been disproven. Zero risk of size_blocked (no param delta) or crash (stdlib nn.init). Standard practice in PaLM/T5/BLOOM/Llama adoption of trunc_normal is specifically to prevent pre-training outlier classifiers under tied embeddings.</notes> </invoke>" -0.0002 discard 1.075264 +0.000984 15993763 600.005000 779.995000 1491.000000 apg-tok-0323  
332	2026-04-22T22:25:05Z	quant	298	324	quant	Shrink GPTQ block_size 64 to 16 in gptq_quantize_weight: 4x more Hessian-compensated error-propagation events per matrix than the exp_298 default (which still has block_size=64).	-0.00005	size_blocked	1.074487		16002345	600.031000	755.969000	1464.000000	apg-quan-0324		
333	2026-04-22T22:30:45Z	curr	324	324	curr	Replace random-permutation 8-phase Latin-square with Van der Corput base-2 (bit-reversed) order [0,4,2,6,1,5,3,7] plus per-shard random rotation: low-discrepancy at every prefix length 1..8, so the 2-5 phases each shard actually visits in 600s are guaranteed evenly spread rather than randomly clusterable.	-0.0001	discard	1.075953	+0.001673	15995702	600.135000	757.865000	1467.000000	apg-curr-0327		Single-site edit in ShuffledSequenceLoader.__init__ at line ~367: replace `[self.rng.permutation(8).tolist() for _ in self.files]` with VdC base-2 order [0,4,2,6,1,5,3,7] plus per-shard cyclic rotation via rng.integers(8). Zero model-byte impact (~+10 packed code bytes). Preserves per-shard diversity (rotation) while fixing prefix-coverage at small k. Novel vs prior curr work: exp_142 introduced Latin-square 8-phase (-0.000028); exp_326 tried 8→16 bucket count (size_blocked). This change improves the *quality* of the 8-order rather than adjusting the count or the stride.
334	2026-04-22T22:30:52Z	reg	298	324	reg	Time-anneal Muon weight decay: WD=0 for first 15% of budget (exploration), linearly ramp 0→1 from 15% to warmdown-start (42%), then full per-group base WD throughout the warmdown tail — concentrates regularization pressure on the settled-feature + EMA-warmdown regime where overfit risk peaks.	-0.0008	size_blocked	1.078942		16004098	600.091000	772.909000	1484.000000	apg-reg-0327		"Novel axis vs exp_141 (depth-targeted muon_wd on recurrent, keep -0.000274) and exp_164 (type-targeted muon_wd_mlp=0.125 on MLP, keep -0.000024): same per-group base rates, orthogonal TIME profile. Under-fit regime is sensitive to early WD drag (dropout-style regularizers like exp_040 hurt by -0.009791); removing WD pressure during the first 15% should help exploration, while holding full WD during warmdown (where EMA/LAWA accumulate and low-LR high-fidelity optimization can still overfit) preserves the late-phase regularization benefit. Two-site edit: (1) Optimizers.__init__ stashes group[""base_wd""] alongside base_lr so restore-after-warmup preserves it; (2) step_fn multiplies each Muon group's weight_decay by a linear ramp on elapsed-fraction before optimizers.step(). Scalar and tok optimizers untouched (so embed_scale/skip_weights keep current trajectories). Zero new params, zero new env vars, zero byte impact. Risk: if early WD was genuinely helping Muon find its Newton-Schulz iteration pre-conditioner, removing it might slow convergence; but warmup_steps=20 + 15% ramp-free exploration is well short of the ""post-trust-region"" phase where Muon's orthogonalization stabilizes."
335	2026-04-22T22:33:33Z	opt	324	324	opt	Power-shape Muon momentum blend: replace max(lr_scale, 0.25) with max(lr_scale**0.85, 0.25) — preserves exp_324's deep-tail floor while holding momentum slightly higher through mid-warmdown to recover part of exp_314's sqrt-blend bpb benefit (1.074206, size_blocked) without tripping size.	-0.00010	discard	1.074354	+0.000074	15997945	600.071000	765.929000	1477.000000	apg-opt-0327		Single-line edit at ~L1497 in step_fn: `mm_blend = max(lr_scale, 0.25)` → `mm_blend = max(lr_scale ** 0.85, 0.25)`. Integral of extra momentum-hold above linear ≈0.028 (vs current 0.031, vs sqrt 0.167 size_blocked). Concave power only affects lr_scale ∈ (0.204, 1.0] because the floor dominates below that; at lr_scale=0.5 momentum rises from 0.955→0.964; at lr_scale=0.8 from 0.976→0.978; peak (lr_scale=1.0) unchanged at 0.990. Direction-averaging improves in mid-warmdown where per-step gradient noise is already non-negligible but the floor hasn't engaged. Size risk low: brotli entropy of weights scales with weight drift, and drift is proportional to integrated momentum-hold — 5% more hold vs current should stay ~800KB under the 16MB cap.
336	2026-04-22T22:34:28Z	meta	324	324	meta	Lower muon_wd_mlp 0.125 → 0.115 (−8%) on MLP-only Muon WD group: probes the untested DOWN direction on the split-by-type axis established by exp_164's keep (0.095→0.125 on MLPs).	-0.00005	keep	1.074171	-0.000109	15999605	600.136000	769.864000	1478.000000	apg-meta-0328	snapshots/336_meta	Single-literal edit at train_gpt.py:172 (muon_wd_mlp default 0.125→0.115). exp_164 kept the UP move attn=0.095, mlp=0.125 (Δ=-0.000024). exp_187 tested raising MLP further on recurrent segments only (0.155 discard). exp_110 tested uniform muon_wd DOWN (0.095→0.065 discard) — but that affected attention too. The clean DOWN direction on MLP-only WD has never been tested. Optimum on the 0.095↔0.125 axis may sit between them; 0.115 is a conservative 8% step. Size risk: less WD → slightly larger MLP matrices → marginal brotli bloat. Headroom is ~180 KB, so 8% WD reduction should stay well within cap.
337	2026-04-22T22:36:35Z	ttt	324	336	ttt	Exclude the looped blocks [loop_start..loop_end] from the TTT optimizer — they are called (num_loops+1)=3 times per forward, so their TTT backward gradient accumulates 3× signal (same recurrence amplification exp_141 and exp_245 compensated); freezing them during TTT focuses adaptation on unique-role layers (blocks 0-2, 6-10) + embedding/norms/scalars and avoids 3×-amplified TTT noise on the shared-weight recurrent core.	-0.0003	size_blocked	1.074818		16002195	600.071000	737.929000	1447.000000	apg-ttt-0328		Single-site edit in eval_val_ttt around line 1336. Builds loop_param_ids = {id(p) for i in [loop_start..loop_end] for p in base_model.blocks[i].parameters()}, sets requires_grad False on those params (so autograd skips their backward), filters ttt_params to exclude them, optimizer sees only non-loop params. Final `for p in base_model.parameters(): p.requires_grad_(True)` at function end restores full grad state for the post-eval phase. Zero size impact. Motivation: exp_141 (+1.3× Muon WD on loop blocks, kept -0.000274) and exp_245 (divide ln_scale by sqrt(num_loops+1) for loop blocks, kept -0.000272) both show the recurrent core over-adapts; applying the same principle to TTT. Distinct from exp_049 (froze tied tok_emb, discard) which removed the most widely-used parameter; this freezes narrowly-over-amplified parameters instead. Distinct from exp_327 (reset momentum buffer, discard) and exp_264 (alternate batch order, kept) — those tuned the update direction; this tunes WHICH parameters update.
338	2026-04-22T22:53:23Z	loss	324	336	loss	Re-enable mild label_smoothing=0.002 on the current exp_324 baseline's plain CE — a midpoint between the known-good old-default 0.003 and the known-worse 0.001 (from exp_042 regression), untested on the current stack (QK-gain 5.25 + embed_scale-inside-RMSNorm + Muon-mom-floor + TTT). Also motivates TTT stability: softer train distribution is a better-conditioned init for per-chunk inner-loop SGD.	-0.0003	discard	1.076647	+0.002476	15972997	600.138000	785.862000	1493.000000	apg-loss-0333		Single-site edit in GPT.forward: add label_smoothing=0.002 to F.cross_entropy. Zero new params, ~20-byte code delta. Rationale: (i) prior tree default was ls=0.003, exp_042 confirmed 0.003→0.001 hurt +0.001926 but current stack lost the smoothing through rebases — never directly tested. (ii) Distinct from exp_132 CP β=0.003 (gradient shape differs: label smoothing scales NLL by (1-eps) and adds avg-CE, CP subtracts β·H). (iii) Small enough (0.002) to avoid exp_132's mild regression (+0.000324 at β=0.003). Risk: redundant with CP family if empirically equivalent; may reproduce exp_132-like tiny regression. Upside if distinct: small improvement from better-calibrated train→TTT transition.
339	2026-04-22T22:54:12Z	quant	324	336	quant	Position-weighted Hessian accumulation in GPTQ calibration: scale each token's activation by sqrt(linspace(0.9,1.1,T)) before x.T@x so the Hessian emphasises late-context positions that dominate the stride-64 sliding-window eval — mean-preserving (trace unchanged), size-neutral (calibration only), mirrors exp_176's proven 0.9→1.1 training-CE weighting.	-0.00008	discard	1.074215	+0.000044	15998345	600.115000	765.885000	1479.000000	apg-quan-0333		Two-site edit inside collect_hessians (make_hook and make_output_hook): apply sqrt(linspace(0.9,1.1,T)) along T before reshape+addmm, so H = Σ_t w_t x_t x_t^T with mean(w_t)=1.0. Rationale: eval scores every token under ≥1984 tokens of context (stride-64 sliding window), but current calibration weights all positions equally (t=0 activations have 0 context and don't match eval regime). Gentle 0.9→1.1 ramp matches exp_176/186's winning training-CE schedule — too aggressive (e.g. 0.5→1.5) would distort H's conditioning. Novel axis vs prior quant trials (damping, block_size, per-row scales) — this is the first calibration-reweighting experiment in the tree.
340	2026-04-22T22:54:22Z	tok	324	336	tok	Add output-side per-feature bias output_bias_feat (shape=[embedding_dim]=512, init=0) applied to x via F.linear(x + output_bias_feat, tok_emb.weight) before the tied softmax — structural DUAL of input-side embed_scale and mathematically a rank-1 per-vocab logit bias (W @ b) that captures frequency-prior capacity at 512 params instead of the full 8192-dim vocab_bias that size-blocked exp_023/146/166/219/249/277/317.	-0.00015	discard	1.075298	+0.001127	15998811	600.009000	760.991000	1481.000000	apg-tok-0333		Three-site edit on exp_324 baseline. (1) GPT.__init__: after embed_scale, add self.output_bias_feat = nn.Parameter(torch.zeros(h.embedding_dim, dtype=torch.float32)) [512 fp32 params, ~2KB raw, scalar passthrough → ~1KB compressed, well under 180KB headroom]. (2) forward_logits: replace F.linear(x, tok_emb.weight) with F.linear(x + output_bias_feat.to(x.dtype), tok_emb.weight) on the tied branch only — mathematically equivalent to adding (tok_emb.weight @ output_bias_feat) as a per-vocab logit bias, giving a rank-1 frequency-prior term without an 8192-param addition. (3) Optimizers.__init__: append output_bias_feat to scalar_params so it trains in the scalar AdamW group (lr=scalar_lr, wd=adam_wd=0.005) alongside embed_scale/ln_scale/qk_gain. Why 512 and not 8192: the last seven full-vocab-bias proposals (exp_146..exp_317) all tripped size_blocked despite some showing val_bpb in the 1.074-1.076 range. 512 scalars is ~1/16 the byte budget and sits far from the cap. Zero-init makes it a no-op at step 0. Distinct from exp_260 (per-feature output GAIN, discarded): that scaled x multiplicatively; this shifts x additively, and its rank-1-per-vocab equivalence explicitly targets unigram-prior direction in embedding space. TTT-safe: ttt_params = base_model.parameters() already sweeps all nn.Parameters, so it participates in chunk-wise SGD updates. GPTQ-safe: it's a 1-D scalar, not a 2-D matrix, so GPTQ SDClip only touches 2-D Linear/Embedding weights — passthrough fp16.
341	2026-04-22T22:55:37Z	eval	324	336	eval	Apply T=0.97 logit sharpening at eval_val_ttt scoring site (divide logits by 0.97 before CE); exp_044 showed T=1.05 (smoothing) hurt +0.0026 so optimum lies at T<=1.0, and GPTQ weight noise widens output entropy — mild sharpening should recover calibration. TTT training loss untouched.	-0.0003	discard	1.075324	+0.001153	15999076	600.052000	751.948000	1459.000000	apg-eval-0333		Single-site edit in eval_val_ttt scoring CE. exp_072 (same idea) was harness_abort so never completed; exp_044's T=1.05 rules out the smoothing side. Zero size/time impact.
