exp_id	timestamp	specialist	parent_exp	baseline_exp	domain	hypothesis	expected_delta	status	val_bpb	delta_vs_best	artifact_bytes	train_s	eval_s	total_s	job_name	snapshot_path	notes
891	2026-04-26T02:31:23Z	ttt	750	750	ttt	Re-introduce exp_588's TTT chunk-boundary momentum_buffer halving (mb.mul_(0.5) for ci>0): proven Δ=-0.000727 at exp_538 baseline, lost when lineage forked exp_596 from exp_538 instead of exp_588.	-0.0005	eval_budget_overrun	1.072598			600.143000	600.700000	1542.000000	apg-ttt-0882		Mechanism: SGD+Nesterov accumulates momentum across TTT chunks. Distribution shift between chunks makes prior-chunk momentum partially misdirected. Halving (×0.5) softly decorrelates without discarding all carry-over signal. exp_588 measured -0.000727 vs exp_538 baseline (1.073466→1.072739). Code: 3 compact lines added inside the chunk-adaptation block, after cosine LR update. Packed +53 bytes (19815→19868). Size risk: exp_769 added +45 bytes and was size_blocked due to +2308 bad-seed model variance; this run is slightly larger (+53 bytes) but hopes for a normal seed. If size_blocked, retry with LOWBIT_LAYERS escape. The improvement should stack onto exp_750 since z-loss (exp_596) and Muon warmdown (exp_750) are training-side changes orthogonal to eval-time TTT momentum management.
892	2026-04-26T02:52:22Z	opt	750	750	opt	Shorten warmdown_frac from 0.72 to 0.67: expands the stable peak-LR+peak-momentum window from 6% to 11% of the 600s budget (frac 0.22→0.33 vs 0.22→0.28), giving ~155 more steps at full LR for the undertrained model to explore before refinement begins. Linear decay shape preserved unchanged.	-0.001	discard	1.072896	+0.000686	15993592	600.016000	580.600000	1514.000000	apg-opt-0888		Warmdown_frac (the fraction of training time spent in the LR decay phase) has never been varied in our ~880-trial run. The initial multi_596 baseline uses 0.72 (vs the seed default of 0.58), implying longer warmdown was found beneficial. However, our 0.22 muon_momentum_warmup_fraction leaves only a 6% stable plateau (frac 0.22-0.28). Shortening warmdown to 0.67 gives 11% plateau (frac 0.22-0.33), adding ~155 more steps at full LR + full momentum. River-valley loss-landscape theory (arxiv 2410.05192) says rapid cooldown suppresses oscillations — we keep linear decay shape (which was critical: exp_850 cosine +0.004 massive discard) but start it 5% later. Risk: slightly fewer warmdown refinement steps may hurt GPTQ fidelity; code bytes unchanged.
893	2026-04-26T02:52:48Z	meta	750	750	meta	ADAM_EPS 1e-8 → 2e-8 (2× UP gentle midpoint between current 1e-8 and exp_802's 1e-7 size_blocked-at-improved-bpb 1.072196): half-step retry of the strongest recent meta UP signal at minimal-step to ease the size cap.	-0.0001	discard	1.072999	+0.000789	15993356	600.059000	583.900000	1517.000000	apg-meta-0888		Single-literal default change at L161 (ADAM_EPS 1e-8 → 2e-8). Byte-neutral, zero new params, zero compile-graph or quant-path risk. exp_802 (1e-8 → 1e-7, 10× UP) was the strongest recent meta UP signal: measured bpb=1.072196 (-0.000014 vs current best 1.07221) but size_blocked. exp_304 (1e-8 → 1e-9, 10× DOWN) hurt +0.000595 — direction is clear UP helps. exp_819 (tok-only UP) and exp_845 (scalar-only UP) confirmed the synergy is whole-stack. Mechanism: AdamW denominator floor sqrt(v)+eps; for rare tok_emb rows where v ~ 1e-7, 2e-8 vs 1e-8 changes effective LR by ~10-15% (caps update size on rarely-touched rows), aligned with the kept stack's direction of damping volatile updates on rarely-touched state (exp_491 scalar freeze, exp_588 chunk momentum halving). 2× UP is a much gentler perturbation than exp_802's 10×, so weight-magnitude trajectory drift is proportionally smaller → cleaner final-weight statistics → better quant blob compressibility, addressing the cap fragility that took down exp_802. Workdir was rebased: ENABLE_LOOPING_AT 0.40 → 0.35 reset to exp_750's actual snapshot value (workdir had stale state from discarded exp_883).
894	2026-04-26T02:55:03Z	quant	750	750	quant	Continuous proportional H damping (exp_818's formula: hd *= 1+0.01*hd/mean(hd), mean=1.01) paired with brotli lgwin=24 (16MB LZ77 window vs default 4MB) to recover the artifact headroom that exp_818 lost when size_blocked.	-0.00013	discard	1.072365	+0.000155	15996622	600.044000	591.600000	1533.000000	apg-quan-0889		Two-part combo: (1) exp_818's continuous proportional damping showed val_bpb=1.072053 (Δ=-0.000157 vs exp_750) but was size_blocked. (2) lgwin=24 estimated to save 150-500KB from larger LZ77 back-reference window on the ~37MB uncompressed model blob. exp_888 (discrete 3-level) showed artifact=15,996,151 (+21KB vs ~15,975KB baseline) with the discrete approximation — continuous proportional version likely adds ~50-100KB more. lgwin=24 should compensate. Eval time exp_888=588.6s — brotli lgwin=24 adds ~5-10s, expected ~595-598s total, under 600s cap.
895	2026-04-26T02:57:05Z	eval	750	750	eval	Raise TTT gradient clip threshold 1.0→2.0: exp_244 showed tighter clip (0.5) hurt BPB by +0.000489, implying the 1.0 clip is actively binding; allowing larger per-step gradient magnitudes should enable more aggressive TTT adaptation.	-0.0002	discard	1.072261	+0.000051	15995677	600.058000	583.100000	1517.000000	apg-eval-0891		exp_244 established tighter clip (0.5) hurts, suggesting the current 1.0 is too conservative. With GC zero-meaning each gradient row, the remaining magnitude encodes genuine per-neuron adaptation signal; capping it at 1.0 total-norm discards signal. 2.0 allows ~2x the step for high-gradient parameters. AdaGC (arxiv 2502.11034) found per-tensor adaptive clipping reduces perplexity 3.5% on Llama-2 vs global clipping; this is a simpler approximation. Zero added compute vs current.
896	2026-04-26T02:59:58Z	arch	750	750	arch	Switch attn-output gate input from x[..., :12] (pre-attn input) to v.reshape(...,-1)[..., :12] (V projection slice): VGA-style value-state gating per arxiv 2510.09017, byte-neutral (gate_w shape [H=8, W=12] unchanged), single-line forward edit.	-0.0002	size_blocked	1.072806		16000049	600.047000	593.400000	1518.000000	apg-arch-0892		VGA (NeurIPS 2025 best-paper-adjacent) decouples value-state and attention-score updates by gating on V instead of x. Distinct from exp_727 (y-keyed, post-attn output) and exp_597 (additive V-bias, not gate). Step-0 transparent (gate_w zero-init). Byte-neutral: same param count, same gate shape; only the gate's input tensor changes from x to v_flat. v_flat is a view (no copy) since c_v output is contiguous and reshape preserves stride. Mechanism: gradient flows through c_v then x via gate_w, coupling gate learning to V representation rather than raw input embedding; theoretically motivated to break extreme-token / attention-sink cycles.
897	2026-04-26T03:00:52Z	reg	750	750	reg	Zero WD on attn_out_gate_w: split 88 zero-init per-head sigmoid gate params out of scalar AdamW group into their own sub-group with weight_decay=0.0, letting gradient signal grow them to their true optimum without pull-toward-zero opposition.	-0.0002	discard	1.073045	+0.000835	15995837	600.139000	578.300000	1503.000000	apg-reg-0892		Zero-init params (all 88 attn_out_gate_w) start at 0. With adam_wd=0.005 and scalar_lr, each step applies pull-to-zero force proportional to the current gate value, fighting gradient growth. The gate's equilibrium value under WD is gradient_signal/(lr*wd); removing WD lets gates find their unconstrained optimum. Previous attempt exp_712 was size_blocked (model-byte seed variance, +45 code bytes), not invalidated. Clean rebase to exp_750 gives same code footprint. Code bytes 19,860 (+45 over baseline). Two-site edit: gate_params comprehension added; optimizer_scalar uses 2 groups.
898	2026-04-26T03:00:59Z	tok	750	750	tok	Add output-side gauge-fixed out_scale [dim=512, init=1.0] applied INSIDE final_norm (F.rms_norm(x * out_scale, ...)), symmetric with the kept input-side embed_scale. Unlike exp_886's failed head_scale (outside norm, absorbable into tok_emb), inside-norm acts directionally and cannot be collapsed into tok_emb.weight learning.	-0.0001	size_blocked	1.073582		16001535	600.099000	586.800000	1524.000000	apg-tok-0892		Mechanism: F.rms_norm(x * s) lets the model emphasize which trunk output features contribute most to next-token prediction, in a way that cannot trivially be absorbed into tok_emb rows (the normalization denominator creates a nonlinear interaction). exp_886 tried head_scale outside the norm and got +0.002615 regression — likely because weight decay (adam_wd=0.005) on an outside-norm scale is catastrophic (decays logit magnitudes). Inside the norm, weight decay pulls s toward 0 which just makes features more equal (not catastrophic). GPTQ hook still attaches to final_norm and correctly captures the scaled activations. out_scale is frozen during TTT (numel=512 < 10000). +1024 bytes model (fp16 passthrough), +28 packed code bytes.
899	2026-04-26T03:02:24Z	curr	750	750	curr	Port exp_186's u² position-weighted CE (pw=0.9+0.2*u², normalized to mean 1.0) onto exp_750 baseline: up-weights high-context late positions by ~14% vs early positions, aligning training gradient with stride-64 sliding-window eval; this technique was kept twice on the exp_164 branch (Δ=−0.000171+−0.000062) but was never applied to the current main lineage (exp_142→exp_196→...→exp_750).	-0.0001	discard	1.073384	+0.001174	15994182	600.051000	532.600000	1441.000000	apg-curr-0892		exp_176 (loss specialist, exp_164 baseline): linear 0.9→1.1 pos_w → keep Δ=−0.000171. exp_186: replaced with u² form pw=0.9+0.2u² → keep Δ=−0.000062. Neither was ever applied to the main lineage which went exp_164→exp_177(meta)→exp_196(curr)→...→exp_750. exp_237 tried a step-function variant (last-64 positions 1.5x) on exp_212 and was discarded — that's a different form. The smooth u² ramp is the kept form and is untested on exp_750.
900	2026-04-26T03:03:48Z	ttt	750	750	ttt	Alternate TTT batch-traversal order across per-chunk epochs (fwd on even, rev on odd): decorrelates SGD gradient directions across the 4 inner epochs, replicating exp_264's proven Δ=-0.000084 keep on a baseline that lacked Nesterov/z-loss — now applying it to exp_750 where it has never been tried.	-0.00008	discard	1.072974	+0.000764	15996669	600.092000	589.400000	1526.000000	apg-ttt-0892		exp_264 showed alternating traversal keeps at Δ=-0.000084, but that branch was never merged into the exp_750 lineage (which went 151→164→177→...→596→750 bypassing exp_264). The mechanism — reversing the within-chunk sequence order on odd epochs so epoch-0 and epoch-1 gradients point in decorrelated directions — is orthogonal to Nesterov (velocity direction) and z-loss (logit magnitude). Single-line change: `_bsteps=range(0,my_chunk_seqs,batch_seqs)` + `for bs in(reversed(_bsteps)if _ep%2 else _bsteps)`. Code bytes delta: 0 (19855 vs 19856).
