exp_id	timestamp	specialist	parent_exp	baseline_exp	domain	hypothesis	expected_delta	status	val_bpb	delta_vs_best	artifact_bytes	train_s	eval_s	total_s	job_name	snapshot_path	notes
504	2026-04-23T09:13:00Z	curr	491	491	curr	8-bucket within-shard positional stratification in _reset_shard: split each file's sequence range into 8 contiguous physical buckets, shuffle within each, then interleave round-robin so the ~4 pops per batch from each file span 4 distinct physical regions — adds within-file spatial dispersion on top of exp_196's between-file stratification, no virtual-shard/batch-assignment changes.	-0.00015	size_blocked	1.074845		16002804	600.117000	565.900000	1473.000000	apg-curr-0497		Complements exp_196 at the intra-shard level rather than extending to K=24 virtual shards (exp_495 size_blocked path). Each batch's per-file ~4 pops now come from 4 distinct positional buckets of the file, reducing within-batch topical clustering when adjacent crawled docs cluster inside a FineWeb bin. Size-neutral edit (only reorders sequence_order). Interleaved block placed at tail so list.pop() consumes the stratified region first; leftover-bucket remainders stay at head (unreached in 600s).
505	2026-04-23T09:14:49Z	tok	491	491	tok	Add post-RMSNorm per-feature additive bias (embed_bias, shape=[512], init=0) at block-0 entry — RMSNorm-beta counterpart to the existing embed_scale gamma. Gives block 0's residual a learnable non-zero origin along each feature axis; orthogonal to exp_486 (INSIDE-norm, gauge-coupled) and exp_496 (output-side logit_bias).	-0.00010	size_blocked	1.075402		16004214	600.010000	569.100000	1482.000000	apg-tok-0497		Three-site edit. (1) GPT.__init__ after self.embed_scale: add self.embed_bias=nn.Parameter(torch.zeros(512)). (2) GPT.forward_logits: replace `x = F.rms_norm(x * embed_scale,…)` with the same expression `+ self.embed_bias.to(x.dtype)` — applied AFTER the RMSNorm (post-norm beta). (3) Optimizers.__init__: register embed_bias on scalar AdamW group (alongside embed_scale). Shape [embedding_dim=512] fp32; numel=512<65536 → GPTQ passthrough; ~2KB raw, ≪1KB compressed via brotli on zero-init smoothness. Frozen during TTT by existing numel<10000 gate. Distinct from prior tok attempts: exp_190/267/298 are MULTIPLICATIVE pre-norm gains; exp_486 was INSIDE-norm additive (gauge-coupled); exp_496/023 were OUTPUT-side logit_bias (size-blocked at 8192 vocab). No time/compile-path risk.
506	2026-04-24T05:27:24Z	curr	491	491	curr	Activate the dead 8-phase rotation: cap per-reset sequence pool at 2500 (shards have ~50k, training pulls ~9.6k/shard → phase_order[0] is the only phase ever sampled today) and switch random phase permutation to bit-reversed [0,4,2,6,1,5,3,7] with per-shard rotation so the first ~4 phases visited differ by ≥seq_len/4 in offset, giving identical shard tokens ~4 distinct RoPE alignments instead of 1.	-0.0003	crash						323.000000	apg-curr-0506		Two-part edit in ShuffledSequenceLoader (lines ~364-381). (1) Replace `self._phase_order = [self.rng.permutation(8).tolist() for _ in self.files]` with bit-reversed Van der Corput sequence [0,4,2,6,1,5,3,7], per-shard-rotated by `si % 8` to decorrelate phase start across sibling shards. (2) Add `self._per_reset_cap = 2500` and truncate `sequence_order = self.rng.permutation(num_sequences)[:self._per_reset_cap]`. Analysis: at train_batch_tokens=786432, ws=8, seq_len=2048 → 48 seqs/rank/step; ~2000 steps in 600s → ~9.6k pulls/shard, far less than ~50k seqs/shard, so the existing 8-phase scheme is dead code. Cap=2500 yields ~4 resets/shard → 4 distinct phases visited. Bit-reversed ordering ensures those 4 phases are {0, seq_len/2, seq_len/4, 3*seq_len/4} — maximally-spread RoPE-offset coverage instead of the ~29% chance of adjacent (offset 256) phases under the current random permutation. Zero parameter delta; code +552 bytes compressed; no touch to tensor shapes, optimizer groups, or compile graphs. | torch.distributed.elastic.multiprocessing.errors.ChildFailedError: ============================================================ (train_gpt.py:442 in next_batch)
507	2026-04-24T05:32:26Z	arch	491	491	arch	Activate x0 injection only on LOOPED blocks: init resid_mix[1]=0.05 for blocks [3..5] (baseline=0 uniformly). Looped blocks are called num_loops+1=3 times per forward; a small embedding-anchor per iteration refreshes features that drift through repeated self-attention, complementing exp_245's loop ln_scale damping on the input side.	-0.0003	crash						17.000000	apg-arch-0507		Zero-param edit. Fills self.blocks[i].resid_mix[1] with 0.05 for i in [loop_start..loop_end] under no_grad during GPT.__init__, placed after exp_245 loop-aware ln_scale correction. resid_mix shape [2, dim=512]; [1] is the x0 mix vector (was zeros at init). With num_loops+1=3 iterations x 3 loop blocks = 9 looped forwards per step, cumulative x0 contribution via residual carry is several hundredths of x0 magnitude. Orthogonal to exp_459 (uniform 0.08 across ALL blocks -> discarded) and exp_381 (loop x0 scale DOWN via mix[1]/=3 -> eval_budget_overrun); UP-in-loop-only is the untried arm. Looped blocks revisit state via iterative refinement without direct embedding connection each call; injecting 0.05*x0 gives each pass a fresh content anchor without over-dominating accumulating refinement signal. Minimal size impact (+333 code bytes; resid_mix param shape unchanged). | torch.distributed.elastic.multiprocessing.errors.ChildFailedError: ============================================================ (train_gpt.py:720 in __init__)
508	2026-04-24T05:49:00Z	arch	491	491	arch	Per-iteration scalar gain on residual increment of LOOPED blocks: loop_iter_gain[0..num_loops] (3 fp32 scalars, init=1.0) multiplies (y - x_prev) for each of the 3 invocations of shared blocks[3..5], letting shared weights specialize contribution magnitude per loop call (Universal-Transformer layer-ID style, scalar-only form).	-0.0005	crash						18.000000	apg-arch-0508		Adds self.loop_iter_gain = nn.Parameter(ones(num_loops+1)) to GPT (3 scalars, ndim=1, numel=3 → scalar passthrough, ~6 B packed). Builds _enc_call_plan/_dec_call_plan in __init__ as lists of (block_idx, iter_idx) tuples where iter_idx is 0..num_loops for looped-block calls (successive invocations of blocks[3..5]) and -1 for non-looped positions. forward_logits switches to the plan; when iter_idx>=0, applies x = x_prev + s*(y - x_prev) scaling the residual increment by loop_iter_gain[iter_idx]. Orthogonal to exp_245 which applies the SAME static 1/sqrt(num_loops+1) factor to every iteration's ln_scale; this is LEARNED and per-iteration. Registered in Optimizers scalar_params (AdamW scalar_lr=0.02). numel<10000 → TTT-freeze per exp_491 policy. Python-level branches on iter_idx>=0 specialize at torch.compile trace time. Targets gaps.md #9 (Universal Transformer layer-ID embeddings, scalar-only minimal variant) — no prior arch experiment or external PR (including PR#1485 recur345) has tried per-iteration differentiation of shared-weight loop calls. | torch.distributed.elastic.multiprocessing.errors.ChildFailedError: ============================================================ (train_gpt.py:728 in __init__)
509	2026-04-24T07:40:23Z	opt	491	491	opt	Replace Muon Newton-Schulz fixed coefficients (3.4445, -4.775, 2.0315) repeated 5× with 5 per-iteration Polar Express minimax-optimal tuples (PR #1344/#1787): aggressive first step (a=8.16) then tapered convergence (a=2.35 by step 5), producing a tighter approximation of the polar factor per gradient without adding NS iterations.	-0.00020	size_blocked	1.074577		16003139	600.045000	562.100000	1473.000000	apg-opt-0509		Single-site edit at train_gpt.py:820-832 (now ~820-850). Added module-level _PE_COEFFS 5-tuple + replaced static (a,b,c) with per-iteration unpacking. `@torch.compile` preserved — tuple iteration unrolls at trace time when called with steps=5 (MUON_BACKEND_STEPS default). No new hparams, no env vars, no param count change. ~900 bytes of source; model-byte risk negligible vs 16MB cap (exp_241 6-step variant was 15.993MB packed, same order). Orthogonal axis to every prior opt experiment: exp_241 changed step COUNT (5→6, discard); exp_273 added grad centralization to inputs; exp_441 decoupled Nesterov coef. Coefficient POLYNOMIAL itself is genuinely untouched. Rationale: per-iteration minimax vs fixed-poly gives ~2× tighter U V^T approximation at step 5 in theory; translates to cleaner orthogonal update direction per Muon step, matters most at peak momentum (0.99) where direction quality compounds. No interaction with exp_324 mm_blend floor (that's outside this function). No interaction with MuonEq-R row_normalize (applied BEFORE NS; coefficients don't depend on row scale).
510	2026-04-24T07:42:09Z	quant	491	491	quant	Winsorize per-feature activation at ±6σ before accumulating GPTQ Hessian H=X.T@X: caps rare outliers' disproportionate inflation of H.diag() on sink columns, stabilizes act-order permutation against outlier-batch noise. Novel axis — all prior H probes touched H post-accumulation (damping, block_size, row-scale, act-order weighting).	-0.0002	discard	1.075132	+0.001154	15646190	600.064000	569.300000	1468.000000	apg-quan-0509		Two-site edit in collect_hessians: adds _winsorize(x) helper (per-feature std clamp to ±6σ), applied both in make_hook (input activations for attn/mlp CastedLinears) and make_output_hook (pre-tied-head output for tok_emb). Pure activation-side pre-processing — Hessian shape/structure unchanged. 6σ is light (≈0 clipped for Gaussian post-RMSNorm attn inputs; meaningfully clips the SiLU²-output tail feeding c_proj where mlp_clip_sigmas=14.0 was already widened to accommodate heavy tails). Orthogonal to current hybrid damping (1.005·mult + 0.005·add). Size-neutral (brotli entropy shift bounded).
511	2026-04-24T07:42:47Z	tok	491	491	tok	test	-0.0002	size_blocked	1.076504		16009642	600.146000	565.800000	1478.000000	apg-tok-0509		
512	2026-04-24T07:43:10Z	reg	491	491	reg	Rare-target loss upweighting during main train: per-token CE × rsqrt(tok_emb row-norm)/mean, clamped to [0.7,1.5], mean-preserving — redistributes gradient signal toward BPB-relevant tail tokens using row norm as frequency proxy. Zero params, eval/GPTQ untouched.	-0.0003	size_blocked	1.074777		16006584	600.086000	562.200000	1476.000000	apg-reg-0509		gaps.md Gap 5 directly; untried in our tree. Every WD-split permutation (exp_164/248/353/375/385/462/473/483/493/502) has been tried, all discard or size_blocked. Every dropout/noise attempt (exp_040/271/293/302) hurt the undertrained model. This is a loss-reshape orthogonal to both axes. Mean-preserving keeps LR/grad-clip calibrated. Row-norm weights are detached so no feedback loop into embedding gradient. Eval path (base_model.eval()) bypasses the branch via self.training gate, so GPTQ calibration, sliding-window scoring, and byte accounting see unweighted CE. Risk: TTT's own backward also calls model.train() and will see weighting, but clamp+mean-preserve bounds the disturbance.
513	2026-04-24T07:43:19Z	arch	491	491	arch	Symmetric MLP output gate: per-token scalar data-dependent gate sourced from first 16 dims of normed MLP input (zero-init CastedLinear[16→1], 2*sigmoid=1 at step 0), mirrors exp_475's kept attn_gate_proj on the MLP branch that currently has no gate.	-0.0003	eval_budget_overrun	1.074903			600.070000	603.900000	1575.000000	apg-arch-0509		"New mlp_gate_proj CastedLinear(16,1, zero-init) added inside MLP; gate = 2*sigmoid(proj(x[...,:16])) multiplies F.silu(fc(x)).square()-projected output. Added ""mlp_gate_proj"" to CONTROL_TENSOR_NAME_PATTERNS so it routes to scalar AdamW group (same path as attn_gate_proj). Cost: 16 fp32/layer × 11 layers = 176 params; numel<=65536 triggers fp16-passthrough in gptq_mixed_quantize (~350 B raw), brotli on near-zero init compresses to tens of bytes. Orthogonal to per-feature mlp_scale (post-projection, outside MLP) and to attn-side gate. PR#1667 shipped this mechanism as an implementation OPTION (gate_mlp_out flag) but disabled it in their scored run — no prior evaluation of the MLP-side gate exists in our swarm (grep mlp.gate returned 0 results) or in any submitted PR."
514	2026-04-24T07:44:00Z	loss	491	491	loss	Byte-weighted CE (mean-preserving, per-target UTF-8 byte count) replaces plain-mean CE — aligns training grad with BPB metric that's evaluated token-bytes-weighted. Prior loss keeps reweighted by POSITION; this reweights by TARGET-TOKEN BYTES (untested axis).	-0.0005	size_blocked	1.139194		16003125	600.127000	564.900000	1475.000000	apg-loss-0509		GPT.__init__ builds self.ce_byte_w buffer (persistent=False, not in state_dict) using spm on h.tokenizer_path: per-token UTF-8 base-byte count, control/unk/unused zeroed, mean-preserving over valid tokens. forward(inp,tgt) now returns (ce_none * ce_byte_w[tgt]).mean(). Affects training CE and TTT loss only — eval_val_ttt scoring uses val_data.base_bytes_lut independently. Size_project: +365 code bytes over exp_491 baseline (headroom tight but code expansion is small; model bytes should be unchanged). Syntax checked clean.
515	2026-04-24T07:45:31Z	meta	491	491	meta	Raise muon_momentum_warmup_fraction 0.22→0.25 (+13.6% UP): probes the completely-untested UP side of exp_088's 0.33→0.22 kept optimum — all DOWN probes (0.22→0.15/0.16) on post-088 lineages discarded, suggesting 0.22 is at or just above optimum, while 0.25 brackets the untested opposite side.	-0.0001	discard	1.074092	+0.000114	15999667	600.025000	560.900000	1465.000000	apg-meta-0509		"Single-literal edit at train_gpt.py:157 (MUON_MOMENTUM_WARMUP_FRACTION default 0.22→0.25). Slower momentum ramp → peak 0.99 reached at ~150s instead of ~132s, so more of the early peak-LR phase runs at sub-peak momentum (0.92→0.99 traverse extended by ~18s). Prior exp_191 (0.22→0.16 DOWN, discard +0.000027) and exp_128/383 (0.22→0.15 DOWN, discard) establish DOWN tail is weak-negative; exp_029 UP on old lineage (0.33→0.45) was harness_abort not signal. 0.25 is a half-step back toward exp_088's pre-keep baseline 0.33. Zero-size change — single literal. exp_451 (concave ramp, faster-to-peak shape) was size_blocked at 1.074712 on current lineage, tangentially suggesting ""faster to peak"" does not help further — so a slightly slower ramp is the cleaner untested probe."
516	2026-04-24T07:45:40Z	ttt	491	491	ttt	"Lower TTT SGD learning rate 0.005 → 0.004 (-20% DOWN probe): first kept probe on the ttt_lr axis. exp_073 tried +30% UP but was harness_abort; DOWN never tested. After exp_491 narrowed adaptation to high-rank matrices (~37M params) via scalar freeze, Nesterov μ=0.9 integrates 3.44× per-chunk with grad_clip_norm=1.0 binding most steps → per-chunk weight drift may be over-aggressive. -20% LR gently attenuates drift compounding across ~8-15 chunks without cutting adaptation count.</hypothesis> <parameter name=""notes"">Single-literal change at line 183 (TTT_LR default 0.005→0.004). Zero code/size impact. ttt_lr feeds the SGD constructor (line 1375) and the per-chunk cosine decay baseline (line 1424). Orthogonal to exp_491 (param-filter, keep), exp_151 (Nesterov, keep), exp_264 (fwd/rev alternation, keep), exp_017 (epochs 3→4, keep). Untried axis despite being central to TTT dynamics. Risk: if clip_grad_norm=1.0 is always binding then step magnitude approx lr/(1-mu)=10*lr; at 0.004 the 4-step accumulated step is 0.0138 vs 0.0172 baseline (20% smaller). If adaptation was already below-optimum (exp_014/017 precedent suggested MORE helps), -20% regresses modestly (~+0.0002). If over-adapting, gain. No size or compile-path risk." -0.00015 size_blocked 1.081495  16002272 600.135000 562.400000 1470.000000 apg-ttt-0509  
517	2026-04-24T07:46:02Z	eval	491	491	eval	Half-decay TTT momentum_buffer at chunk boundaries (vs exp_491's hard-zero): _mb.zero_() → _mb.mul_(0.5) preserves 50% of the prior chunk's terminal direction for the first SGD step of the new chunk, betting on positive cross-chunk gradient correlation from locally-stationary val distribution.	-0.00008	size_blocked	1.074457		16002257	600.112000	522.900000	1429.000000	apg-eval-0509		"Current exp_491 zeros momentum_buffer at every chunk boundary (-0.000043 improvement over prior keep/drift baseline). This edit changes the single op zero_() → mul_(0.5), a 0-param single-op change. Rationale: with 4 SGD steps per chunk per rank and μ=0.9+Nesterov, chunk-k's terminal buffer ≈ μ^3·g1 + μ^2·g2 + μ·g3 + g4 — dominated by recent grads that for locally-stationary text correlate positively with chunk-(k+1)'s g1. Halving retains the low-frequency drift (shared across chunks) while attenuating chunk-k-specific high-frequency components. If -0.000043 was the gain from full-reset, mild-reset sits between full-carry (exp_481-era baseline) and full-reset — may extract a bit more. If discard, points toward ""zero is actually correct"" conclusion. Code bytes dropped by 18B (comment shortened), same model_bytes expected, size headroom unchanged."
518	2026-04-24T07:47:19Z	curr	491	491	curr	Token-id-stratified CE loss weight w=0.95+0.10*(target_id/8191) up-weights high-id (rare) tokens — gaps.md Gap 5, untried in this swarm and externally; static arithmetic on flat_targets, torch.compile-safe (no bincount).	-0.0001	size_blocked	1.074774		16000620	600.137000	561.800000	1476.000000	apg-curr-0509		"Single-site edit in GPT.forward (lines 804-808). Replaces F.cross_entropy(reduction='mean') with reduction='none' + per-token weight w=0.95+0.10*(target/8191), then weighted mean (ce*w).sum()/w.sum() preserves loss scale per batch. SentencePiece BPE assigns lower IDs to higher-frequency pieces, so this gently up-weights rare tokens — concentrating gradient mass where val_bpb is most uncertain. Range [0.95, 1.05] is conservative to keep weight-entropy / quantization size impact small (curr-domain has many size_blocked priors near current best). Differs from crashed exp_272 by avoiding torch.bincount (dynamic shape) — pure arithmetic so torch.compile fullgraph stays clean.</notes> </invoke>"
519	2026-04-24T08:01:59Z	curr	491	491	curr	test	-0.0001	crash						317.000000	apg-curr-0519		torch.distributed.elastic.multiprocessing.errors.ChildFailedError: ============================================================ (train_gpt.py:427 in next_batch)
520	2026-04-24T08:10:58Z	opt	491	491	opt	Per-group Muon momentum split: add static momentum_offset=-0.01 on the MLP matrix group only (MLP peak 0.98 vs attn 0.99), warmdown cool applies symmetrically via the scheduled base muon_momentum; mirrors the proven muon_wd attn/mlp split (exp_164 keep), trusting fresher grads for the 2×-larger-per-block MLP params while preserving attention's ~100-step direction averaging	-0.00015	discard	1.074288	+0.000310	15999889	600.029000	563.000000	1467.000000	apg-opt-0516		"Two-site edit: (1) Optimizers.__init__ adds ""momentum_offset"": -0.01 to the MLP Muon param_group dict. (2) step_fn replaces `group[""momentum""] = muon_momentum` with `group[""momentum""] = muon_momentum + group.get(""momentum_offset"", 0.0)`. Zero parameter cost, +22 packed-code bytes. Static (not scheduled) offset avoids the eval_budget_overrun failure of exp_423 which scheduled offset -0.02→0 during warmdown. Attn group (no offset key) continues to follow the stock schedule at 0.99 peak, warmdown-cooled to floor 0.9375. MLP group tracks at 0.98 peak, floor 0.9275. 0.98 ≈ 50-step effective-history EMA vs 0.99 ≈ 100-step — halves MLP's gradient-memory window to match its proportionally-larger update variance. All prior per-group Muon splits have been on WD (kept, exp_164) or LR (unexplored); momentum is the symmetric untried axis. Confidence: moderate — the -0.02 scheduled variant (exp_423) didn't run cleanly, DOWN direction on shared momentum (exp_094 0.99→0.97) was -0.001022 discard, but a per-group DOWN-only probe may invert that result if MLP is the dominant overfitter."
521	2026-04-24T08:13:27Z	reg	491	491	reg	Add label_smoothing=0.02 to main training cross-entropy — target-shape regularizer never tried in this tree; flattens training targets to calibrate logit magnitudes for int6 GPTQ rounding and damp overconfident gradients from q_gain=5.25 sharpening.	-0.0005	discard	1.084148	+0.010170	15973453	600.077000	565.200000	1479.000000	apg-reg-0519		Single-kwarg edit at train_gpt.py:801-804. Rebased to exp_491 first (workdir held exp_512's size_blocked rare-target upweight code). Motivation: every reg attempt in this lineage has been either Muon WD splits (saturated chain exp_141/164/336/177/245/267/280/298/324/336/475/491), dropout/noise (all discarded — under-fit regime), or scalar-AdamW WD tweaks (saturated). Label smoothing is structurally orthogonal: doesn't remove signal (unlike dropout), doesn't re-weight gradient magnitude (unlike exp_512's failed row-norm reweight), sits on TARGET side of CE rather than weight/optimizer side. Epsilon=0.02 conservative (Szegedy 2016 uses 0.1; small vocab 8192 spreads uniform mass thinner; logit_softcap + q_gain=5.25 already produce confident logits). Side-effect on TTT: inner-loop loss at line 1443 also sees smoothing; exp_491 froze control scalars during TTT so main-train-converged q_gain preserved. Zero added params/state, ~30 code bytes (code_bytes 25609).
