exp_id	timestamp	specialist	parent_exp	baseline_exp	domain	hypothesis	expected_delta	status	val_bpb	delta_vs_best	artifact_bytes	train_s	eval_s	total_s	job_name	snapshot_path	notes
563	2026-04-24T10:29:52Z	ttt	538	538	ttt	Swap TTT optimizer from SGD+Nesterov to AdamW (lr=h.ttt_lr=0.005, betas=(0.9,0.95), eps=1e-8, wd=0) — optimizer CLASS axis untried across 40+ prior TTT trials (all used SGD+Nesterov+mu=0.9)	-0.0003	size_blocked	1.638237		16001314	600.032000	583.200000	1520.000000	apg-ttt-0559		Single-line literal swap at line 1400 inside eval_val_ttt. Baseline packed code 26223 B, after edit 26225 B (+2 bytes — negligible under tight budget). Rationale: Adam's per-param sqrt(v) RMS normalization handles the scale imbalance between tok_emb (4.2M params, large grad variance from tied input+output) and matrix params (260K-1M Q/K/V/O/MLP, small variance) that uniform SGD cannot. This subsumes exp_133/exp_535 (SGD with tok_emb LR multipliers, both hurt) via the built-in denominator. LR tuning: AdamW with grad_clip=1 and lr=0.005 yields per-element step ≈ 0.005*sign(g), matching SGD+Nesterov's clip-bounded effective step at μ=0.9 × 4 epochs (≈0.005-0.025 envelope). betas=(0.9,0.95) chosen because total TTT horizon is only ~48 steps (4 epochs × ~12 trained chunks); β2=0.95 gives 1/(1-β2)=20-step memory, matching horizon without tail dominance. PR#1318 uses the same optimizer class for TTT at val_bpb=1.00955. Cosine LR schedule over chunks (h.ttt_lr base) preserved unchanged. Adam doubles optimizer state memory (m+v vs one momentum_buffer) from 148MB to 296MB — well within 80GB/GPU. No change to grad_clip (1.0), epochs (4), batch (32), frozen-scalars param filter, or cosine decay. Cost: ~5% slower per step vs SGD — estimated +2-5s added to eval time (TTT currently ~110s), well within 600s budget.
564	2026-04-24T10:30:08Z	loss	538	538	loss	PaLM-style z-loss at λ=5e-6 (logsumexp(logits)^2.mean()) added to training CE — 20× smaller than exp_009's failed λ=1e-4 on pre-TTT/pre-QKgain baseline, and mechanism-distinct from exp_554's logit_l2 (z-loss penalizes only the shift-sensitive log-partition, not per-logit magnitudes), probing log-partition stabilization on the current QK-gain=5.25 + tanh-softcap=30 regime.	+0.0001	size_blocked	1.074225		16002647	600.118000	583.300000	1529.000000	apg-loss-0559		Single-site edit at GPT.forward L824-828. Added logsumexp = torch.logsumexp(logits_flat, dim=-1); z_loss = logsumexp.pow(2).mean() * 5e-6; return ce + z_loss. Zero new params, zero artifact bytes (training-only regularizer). At typical logsumexp≈15-20, z_loss_raw≈225-400, weighted≈1.1e-3 to 2e-3 nats vs CE≈1.07 (~0.1-0.2% of CE magnitude). Gradient: ∂z_loss/∂logit_i = 2λ·logsumexp·softmax_i ≈ 1.5e-4·softmax_i — noise-level vs CE gradient (p_i-y_i)~0.1. Distinct from exp_554 (logit_l2 mean(logits²) * 1e-5 — per-logit magnitude, shift-equivariant → fights softmax invariance) and from exp_009 (same z-loss form but 20× stronger AND on pre-TTT baseline with completely different logit dynamics, log2(V)=log2(4096) vs 8192 now). Honest expected-delta: probably noise-bound given loss-domain saturation pattern (most recent attempts regress), but mechanism is principled and orthogonal.
565	2026-04-24T10:30:11Z	eval	538	538	eval	Reset TTT SGD-Nesterov momentum_buffer at each chunk boundary (ci>0): chunks score independent val segments, prior chunk's stale velocity may push early steps of new chunk off-direction; clearing the buffer starts each chunk with pure-gradient steps while keeping μ=0.9 within chunk. Orthogonal to exp_552 (which ramped μ coefficient, failed) — this directly clears the buffer.	-0.0004	size_blocked	1.073426		16001303	600.061000	599.000000	1535.000000	apg-eval-0559		3-line insertion in eval_val_ttt at the chunk-training branch. Loop over optimizer.state.values() and .zero_() each momentum_buffer at ci>0. No effect on training/GPTQ/artifact — purely eval-path, so model bytes unchanged vs exp_538. Counter-reading: if cross-chunk structural direction was useful, val_bpb will regress.
566	2026-04-24T10:30:58Z	opt	538	538	opt	Sqrt-couple Muon WD shrinkage with LR	-0.0003	size_blocked	1.076639		16003874	600.092000	585.700000	1522.000000	apg-opt-0559		
567	2026-04-24T10:33:42Z	quant	538	538	quant	"GPTQ multiplicative damping 1.01→1.005 paired with brotli lgwin=22→24 (pure size saver unblocks the 1.005-damping probes that size_blocked as exp_387/477/497 bpb≈1.074149).</hypothesis> <parameter name=""notes"">Two-site edit: damping factor 1.005 in gptq_quantize_weight; brotli.compress gains lgwin=24." -0.00010 size_blocked 1.073554  16001226 600.141000 598.600000 1546.000000 apg-quan-0559  
568	2026-04-24T10:36:19Z	arch	538	538	arch	Restrict mlp_out_gate to non-looped blocks (8 of 11): skip the gate on looped blocks [3..5] by setting mlp_out_gate_w=None in GPT.__init__. Cuts per-forward gate ops from 17 (exp_558 eval_budget_overrun at bpb=1.072396) to 8 — targets the compute driver while keeping the structurally-useful gate on encoder/tail decoder layers. Looped blocks are already residual-damped by ln_scale_factor/sqrt(num_loops+1) (exp_245), so their per-iteration gate is the most redundant.	-0.0008	size_blocked	1.072388		16004214	600.102000	588.900000	1540.000000	apg-arch-0559		Two-site edit. (1) MLP.forward adds `if self.mlp_out_gate_w is None: return out` early-exit — torch.compile resolves the None branch statically at trace time so no per-step overhead, each MLP instance specializes. (2) GPT.__init__ adds a 3-line loop after the ln_scale section that sets `self.blocks[i].mlp.mlp_out_gate_w = None` for i in [loop_start..loop_end]. Setting to None invokes Module.__setattr__ → register_parameter(name, None), which stores None in _parameters dict so named_parameters() yields nothing for that name — optimizer, CONTROL_TENSOR_NAME_PATTERNS fp16 passthrough, and state_dict save all correctly skip. Per-forward gate-compute accounting: exp_558 = 8 non-looped × 1 call + 3 looped × 3 iter = 17 gate ops (forward+backward); this trial = 8 non-looped × 1 call + 0 = 8 gate ops. Net -53% gate compute per forward. Parameter count: 11→8 mlp_out_gate_w = 12 fp32 fewer trained weights (48 B raw → ~30 B packed after fp16 passthrough + brotli). bpb signal: exp_547 (width=12) hit 1.072375 and exp_558 (width=4, all blocks) hit 1.072396 — both achieved ≈-0.001 vs best but were blocked. Expected outcome: preserve the 1.072 bpb level with ~half the eval overhead, fitting under 600s.
569	2026-04-24T10:47:41Z	reg	538	538	reg	Shrink adam_wd_gate 0.015 to 0.010 (2x baseline) on the isolated attn_out_gate_w sub-group: retains pull-to-zero mechanism from exp_560 (bpb 1.072476, size_blocked by 2362B) at reduced WD differential (0.005 over baseline vs 0.010) so model weight shift and artifact size fall under 16MB cap	-0.0005	size_blocked	1.072526		16003063	600.052000	581.500000	1517.000000	apg-reg-0561		Follow-up to exp_560. exp_560 at adam_wd_gate=0.015 produced val_bpb 1.072476 (beats best 1.073466 by 0.00099 pre-size-check) but SIZE_BLOCKED at 16002362 bytes (2362B over). The BPB result validates the mechanism hypothesis: isolating attn_out_gate_w (zero-init, 1056 params) for elevated WD captures the pull-to-zero benefit that exp_550 (global 0.008) only partially accessed. Halving the WD differential (0.005 over baseline instead of 0.010) should approximately halve the GPTQ-relevant weight distribution shift and thus the model_bytes delta. Expected gain ~60-70pct of exp_560's (0.00060-0.00070 improvement, still a solid keep). Same 2-site edit as exp_560 with only the default literal changed; code_bytes 26286 (essentially identical to exp_560's 26278). If this still size_blocks, the scaling is super-linear and we'd try 0.008 or abandon; if it keeps, we've proven the mechanism and can sweep downward to find the optimum.
570	2026-04-24T10:51:54Z	tok	538	538	tok	Back off embed_clip_sigmas 20.0 to 18.0 after exp_561's 14.0 hit size_blocked with bpb 1.072171	-0.0004	size_blocked	1.072307		16086654	600.026000	587.800000	1535.000000	apg-tok-0563		Follow-up to exp_561 (clip_sigmas=14.0, bpb=1.072171 Δ=-0.0013 but +275KB over cap). 18.0 is a conservative back-off: 1/3 of the 20 to 14 cut in sigma. Linear estimate: -0.0004 bpb gain, +90KB size cost. If compression is superlinear, may still size_block but closer to cap. Zero source delta, zero param delta. Only GPTQ scale factor s = 18 * row_std / 127 changes vs 20.0.
571	2026-04-24T10:52:50Z	curr	538	538	curr	Remove grad-invariant self.rng.shuffle(shard_plan) in next_batch: with shard_plan kept grouped by shard-id, mid-batch shard-drain now coincides with shard-group boundaries, so _reset_shard(all) fires between groups rather than mid-group — no other shard's in-progress permutation gets wiped while it still has un-popped start_inds. Byte-near-neutral (+33 raw, ~0 packed) probe of the only untested within-batch iteration pattern.	0.0000	discard	1.073788	+0.000322	15998184	600.006000	585.000000	1521.000000	apg-curr-0563		Single-site: dropped line 431 (self.rng.shuffle(shard_plan)), added a one-line comment. Grad-invariant by construction (mean-CE has no batch-order dependency). Mechanism: with grouped shard_plan, a drain of shard s triggers the cross-shard reset only AFTER s's group finishes (or during it), rather than at arbitrary mid-batch positions. Downstream effect: slightly different RNG trajectory for _reset_shard calls and sequence_order perms, and fewer partial-permutation wipes across the batch boundary. All prior curr trials (exp_142/196 kept + 40 discarded/size_blocked sample-order variants) have preserved the shuffle — this is the first probe of its removal. Per LESSONS, sample-order variants are saturated after exp_142/196, so expected delta is ~0 ± noise. Low risk, cheap probe.
572	2026-04-24T10:55:59Z	meta	538	538	meta	Raise ttt_momentum 0.9→0.92 (+20% half-life, ~7→8.6 steps) on TTT SGD+Nesterov optimizer: untouched uniform knob in 560 trials (only exp_437 tried per-group split, eval-budget-overrun); size-safe because TTT runs at eval-time post-GPTQ+brotli, escaping the size_blocked pattern that killed exp_555/562/550 recent meta wins.	-0.0001	size_blocked	1.072551		16004485	600.104000	577.400000	1510.000000	apg-meta-0563		Single-literal edit at train_gpt.py:185 (TTT_MOMENTUM default 0.9→0.92). Mechanism: TTT uses cosine-LR decay across chunks from ttt_lr*1.0 at ci=0 to ttt_lr*0.0 at ci=N-1; late chunks take near-zero steps so velocity carryover from high-LR early chunks is the only adaptation signal. With ttt_epochs per chunk and ~16 SGD steps, momentum=0.9 does not fully saturate within-chunk; 0.92 extends the effective half-life modestly and preserves cross-chunk smoothing without the overshoot risk of 0.95+. Zero byte impact on packed model artifact. Orthogonal to exp_491 (freeze control scalars during TTT) which is in the stack.
573	2026-04-24T11:01:20Z	eval	538	538	eval	Retry of exp_565 (TTT momentum_buffer reset at chunk boundaries) with ~1.5KB of comment trims elsewhere for headroom — exp_565 had val_bpb=1.073426 (−0.000040 under best) but artifact was 1303B over cap.	-0.00004	size_blocked	1.073195		16002602	600.038000	585.500000	1528.000000	apg-eval-0567		Functional edit unchanged from exp_565: at ci>0, loop optimizer.state.values() and zero_() each momentum_buffer before the chunk's SGD epochs. Additional byte savings: compacted 5 historical-rationale comment blocks (bifurcated q_gain, embed_scale, ln_scale correction, depth-recurrence, Muon momentum cool, Muon warmup frac) into one-line references. No functional change from those trims. Pre-edit code_bytes 25854 → post-edit 24316 (−1538B), well past exp_565's +1303 deficit.
574	2026-04-24T11:03:15Z	opt	538	538	opt	"Sqrt-shaped Muon momentum blend with floor=0.25: mm_blend = max(lr_scale**0.5, 0.25) combines exp_314's concave shape (sqrt no-floor was bpb=1.074206 but size_blocked) with exp_324's kept floor=0.25 to limit deepest-tail weight drift that plausibly caused the size overrun; holds muon momentum higher through mid-warmdown (at lr_scale=0.25 mu=0.9755 vs linear's 0.9505) while floor keeps bottom ~18% at 0.9375.</hypothesis> <parameter name=""notes"">Untested (shape x floor) point: exp_314 sqrt-no-floor size_blocked at bpb=1.074206; exp_324 linear+floor=0.25 is kept baseline; exp_335 pow(0.85)+floor=0.25 was small discard. Sqrt+floor=0.25 preserves floor's late-tail weight-trajectory stability (the likely cause of exp_314's size block) while reintroducing the concave mid-tail momentum hold. +7 packed bytes." -0.00020 size_blocked 1.072782  16004210 600.088000 580.600000 1523.000000 apg-opt-0569  
575	2026-04-24T11:07:56Z	quant	538	538	quant	"Sink-column-only asymmetric int6: extend GPTQ clip range from [-31,+31] to [-32,+31] on top-8 highest-|H_ii| post-perm cols only; rest stay symmetric. Salvages exp_556's -0.000436 would-have-won by limiting histogram shift to ~1.5% of cols where GPTQ error-propagation saturates most, so brotli entropy inflation is ~65x smaller than exp_556.</hypothesis> <parameter name=""notes"">Single-site edit in gptq_quantize_weight inner loop: lo = -clip_range - 1 if (i1 + j) lt 8 else -clip_range. Only cols 0..7 after H-diag-descending perm (GPTQ sink cols) get the extra -32 bin. Projects a quarter of exp_556's gain at very small post-brotli size impact.</parameter> </invoke>" -0.00015 size_blocked 1.073162  16001755 600.099000 586.900000 1524.000000 apg-quan-0569  
576	2026-04-24T11:07:58Z	loss	538	538	loss	Apply tiny logit-L2 regularization (λ=1e-5 · mean(logits²)) ONLY to TTT inner-loop loss, not main training CE — regularizes ~16 per-chunk SGD steps against chunk-specific logit-magnitude drift without touching main-train gradients.	-0.00015	size_blocked	1.072613		16003255	600.154000	587.400000	1530.000000	apg-loss-0569		exp_554 tested λ=1e-5 logit-L2 on MAIN CE → discard +0.000389 (main CE doesn't benefit from this regularization). exp_534 tested PW-CE ONLY on TTT inner-loop → discard +0.000170 (closest recent loss trial, showing TTT-only mods can be close). This is a structurally distinct third experiment: TTT-only logit-L2 at the same λ that failed on main-CE. Edit is contained to eval_val_ttt inner-loop: replaces `loss = base_model(x, y)` with explicit forward_logits + CE + 1e-5 * logits.pow(2).mean(). Main-train GPT.forward is UNTOUCHED → model weights identical to exp_538, no GPTQ compression drift, no size_blocked risk from weight distribution changes. Only delta is +55 packed code bytes (26223→26278). TTT is where ~16 SGD steps per chunk can drive chunk-specific overfitting; a gentle L2 on logit magnitude acts as an overfit-brake per chunk. Vocab=8192 hardcoded in reshape since it's SP8192-fixed.
577	2026-04-24T11:14:59Z	arch	538	538	arch	Per-block per-token mlp_out_gate (raw Parameter [1,4] per MLP, 2*sigmoid of first 4 input features) — SIZE-LEAN reimplementation of exp_547/558/568 concept with minimal comments (+203B code vs +700B previously) and width=4 to pair with exp_538's attn_out_gate.	-0.0008	eval_budget_overrun	1.072087			600.070000	603.100000	1563.000000	apg-arch-0569		"Three prior attempts at this idea each got blocked by a different edge: exp_547 (width=12 all blocks) size_blocked by 103B from verbose comments; exp_558 (width=4 all blocks) eval_budget_overrun; exp_568 (width=4 non-looped only) size_blocked by 3370B from the ""set-to-None on looped"" boilerplate. Each projected ~-0.00107 bpb. This submission keeps width=4 on ALL blocks (mirroring exp_558 that survived size) with maximally compact 4-line MLP patch + one pattern-string token. Net code delta vs 538 is +203B, far smaller than any prior attempt. Weight delta 44 fp32 ≈ 50B brotli. TTT-freeze applies via numel<10000 policy; scalar-AdamW WD applies via ""mlp_out_gate"" pattern match. Identical semantics to exp_558's arch so val_bpb should project near 1.0724 (Δ≈-0.001 vs current best 1.073466)."
578	2026-04-24T11:18:00Z	ttt	538	538	ttt	"Add label_smoothing=0.02 to TTT inner-CE (eval_val_ttt training loss only; main-train CE stays 0.0 via default kwarg): softens targets during per-chunk SGD adaptation to regularize against chunk-specific overfit — with only ~16 SGD steps on ~4 seqs/rank per chunk under mu=0.9 Nesterov, hard one-hot targets compound into over-confident chunk-local shifts that degrade generalization to subsequent chunks.</hypothesis> <parameter name=""notes"">Two-line edit: (1) GPT.forward signature adds label_smoothing=0.0 default kwarg and threads it into F.cross_entropy - main training (line 1544) and val-loss computation (line 1288) unchanged since they don't pass the kwarg; (2) eval_val_ttt training call switches from base_model(x,y) to base_model(x,y,label_smoothing=0.02). Scoring path (compiled_logits) untouched. +31 packed bytes (26223->26254). Mechanism distinct from exp_524 (which claimed to REMOVE ls=0.02, but current code confirms no ls present on the 538 lineage). Untried across 50+ prior TTT trials on LR/momentum/clip/reset/mask/epoch axes. Gentle value (0.02) chosen to minimize divergence risk.</parameter> </invoke>" -0.0004 size_blocked 1.081064  16001556 600.018000 590.200000 1531.000000 apg-ttt-0570  
579	2026-04-24T11:19:15Z	reg	538	538	reg	"Zero-init output-projection Muon WD split: route all "".proj."" matrices (attn.proj + mlp.proj, the only _zero_init=True Muon params) into a third Muon group with muon_wd_proj=0.080, vs 0.095 attn / 0.115 MLP on non-zero-init inputs. Zero-init matrices grow from 0 and the same WD is disproportionately aggressive on them."	-0.0006	size_blocked	1.073817		16007128	600.075000	590.400000	1529.000000	apg-reg-0571		Pure reg-domain edit, zero new params, +~400 B code only. Orthogonal to exp_164's attn vs mlp type split — this is an INIT-CONDITION split (zero-init outputs vs non-zero-init inputs). attn.proj and mlp.proj are the exactly two _zero_init=True matrices (audited via grep). No compile hazard: just an extra Muon param group, Muon.step already loops over param_groups by WD. TTT path unaffected (separate SGD). Starting WD 0.080 chosen as moderate reduction (≈16% from attn baseline, ≈30% from MLP baseline); if keep, probe 0.060/0.100 next.
580	2026-04-24T11:27:51Z	tok	538	538	tok	Gauge-fixed output-side per-feature scale (output_scale [512], init=1.0) mirroring exp_298's INSIDE-RMSNorm embed_scale pattern onto the tied-readout path. exp_320 proposed the identical mechanism but CRASHED; this safer variant appends F.rms_norm(x*output_scale) AFTER self.final_norm(x) instead of replacing it.	-0.0003	size_blocked	1.073390		16090770	600.090000	592.200000	1538.000000	apg-tok-0573		Three-site edit. (1) GPT.__init__: added self.output_scale = nn.Parameter(torch.ones(h.embedding_dim, dtype=torch.float32)) right after self.embed_scale. (2) GPT.forward_logits: appended x = F.rms_norm(x * self.output_scale.to(x.dtype), (x.size(-1),)) AFTER self.final_norm(x) and optional head_proj, BEFORE F.linear tied-readout. (3) Optimizers.__init__: added output_scale to scalar_params AdamW group alongside embed_scale. At init (scale=1) forward is bitwise-identical to exp_538 (rms_norm idempotent on unit-RMS x). Post-init, gauge-projection ensures output_scale learns ONLY relative per-feature weighting of the softmax-readout basis — mirrors exp_298's proven gauge-fixed pattern on output side. Structurally distinct from prior output-side attempts: exp_199/260 were NON-gauge-fixed and regressed +0.002; exp_320 was gauge-fixed but replaced self.final_norm(x) outright and crashed; exp_541 reused the SAME embed_scale parameter on output and regressed +0.008. Since tok_emb is tied, both scales act on tok_emb columns but see different x (pre-trunk lookup vs post-trunk final state) — the trunk's nonlinearity makes them orthogonal knobs. 512 fp32 params -> fp16 passthrough = 1024 B raw, brotli ~200-400 B. TTT-frozen (numel < 10000).
581	2026-04-24T11:28:03Z	curr	538	538	curr	Dual-phase per shard-epoch in _reset_shard: consume two distinct entries from phase_order[si] per reset (indices 2e, 2e+1) and split start_inds across both phases (half each, disjoint 2048-stride grids). Doubles per-shard phase diversity in the 600s regime where only phase_order[0] normally fires. Untested axis.	-0.0004	size_blocked	1.074436		16000603	600.049000	587.400000	1531.000000	apg-curr-0573		Single-site edit in _reset_shard. Code +442B. Disjoint phase grids (k_a,k_b from permutation(8) always distinct). Total sample count preserved. Orthogonal to exp_142/196/538.
582	2026-04-24T11:29:51Z	meta	538	538	meta	adam_wd 0.005 to 0.006 scalar AdamW UP probe	-0.00025	size_blocked	1.072853		16000017	600.108000	585.900000	1532.000000	apg-meta-0573		
583	2026-04-24T11:31:56Z	eval	538	538	eval	Retry of exp_573 (TTT momentum_buffer reset at chunk boundaries) with ~4KB total code savings from comment compaction — exp_565 and exp_573 both showed strong val_bpb gain (Δ=-0.000040 and Δ=-0.000271) but artifact overran the cap by 1.3KB and 2.6KB due to model-compression seed variance; this run has more code headroom to absorb that variance.	-0.0002	discard	1.073892	+0.000426	15998300	600.087000	584.800000	1528.000000	apg-eval-0575		Functional edit still identical: ci>0 loop zeros momentum_buffer. Additional trims vs exp_573: attn_out_gate comment block, Hessian damping rationale, pre-norm embed_scale rationale, banner triplets. Total code_bytes 25854 (baseline) → 21776 now. exp_573's run had model_bytes=15,978,286; projected artifact on same seed is 16,000,062 — still a hair over on worst-seen seed. Depends on model-seed variance landing favorably.
