exp_id	timestamp	specialist	parent_exp	baseline_exp	domain	hypothesis	expected_delta	status	val_bpb	delta_vs_best	artifact_bytes	train_s	eval_s	total_s	job_name	snapshot_path	notes
220	2026-04-22T16:46:20Z	opt	196	212	opt	Shorten warmdown_frac 0.72→0.65: reclaim 7% of budget (42s) as peak-LR learning — extends the peak-momentum×peak-LR overlap window from 36s to 78s (exp_088's proven-valuable regime), while 390s warmdown tail still gives ~15 EMA half-lives for convergence.	-0.0003	discard	1.075928	+0.000906	15992662	600.134000	755.866000	1468.000000	apg-opt-0213		Single-literal edit at Hyperparameters.warmdown_frac default (line 108). Zero-byte, zero-param. Revives the exp_022 aborted hypothesis (never ran) but from the current-best baseline exp_196. Direction reasoning: exp_088's big win (-0.001115) came from ensuring peak Muon momentum (0.99) is reached before warmdown begins (muon_momentum_warmup_fraction=0.22 < warmdown_start=0.28). Shortening warmdown_frac shifts warmdown_start from 0.28→0.35 (frac), creating 78s instead of 36s of peak-momentum×peak-LR overlap — double the exp_088 window that already paid. EMA convergence side: ema_decay=0.9965 → half-life ~26s; 390s tail = 15 half-lives, so zero risk of under-converged EMA. Counter-risk: nanoGPT-speedrun canonical uses 30% warmdown; this model's 72% choice implies EMA benefits outweigh peak-LR — if so, 0.65 may regress. Either way the trial discriminates which regime this stack actually sits in.
221	2026-04-22T16:49:45Z	quant	exp_212	212	quant	Per-matrix Hessian-weighted scale refinement after GPTQ: closed-form solve for scalar α minimizing tr((W−αQ·diag(s)) H (W−αQ·diag(s))^T) and fold into per-row fp16 s (size-neutral).	-0.00015	discard	1.075690	+0.000668	15993907	600.023000	760.977000	1471.000000	apg-quan-0214		Appends ~6 lines to end of gptq_quantize_weight. Given fixed integer codes Q (GPTQ output), α = ((W_perm*(Wq@H)).sum())/((Wq*(Wq@H)).sum()) is the closed-form Hessian-weighted MSE optimum, clamped to [0.75,1.25] as a safety margin. Updates s ← (sf·α).to(fp16) and returns as before. Byte-neutral: Q tensor untouched, s keeps shape/dtype/row-ratios → brotli entropy unchanged. Distinct from prior size_blocked attempts: exp_004 (per-row α-grid), exp_008 (per-layer α-grid stored separately), exp_045 (per-row closed-form). Per-MATRIX (one scalar per weight, ~30 total) absorbed into existing s = no new stored tensors, no entropy change. Rationale: SDClip (clip_sigmas=12.85) is optimal PRE-quantization; GPTQ's error propagation shifts the effective optimum, so an α slightly off 1.0 recovers a small chunk of Hessian-weighted MSE. Compute cost tiny (~30 extra matmuls of size rows×cols×cols at pack time).
222	2026-04-22T16:50:31Z	eval	196	212	eval	Label-smoothing ε=0.02 applied ONLY to TTT-training CE (scoring + main training unchanged): regularizes the per-chunk 4-epoch SGD updates against overconfident chunk-specific n-gram memorization that would bias subsequent-chunk scoring.	-0.0004	discard	1.083241	+0.008219	15993750	600.005000	771.995000	1483.000000	apg-eval-0214		Two-site edit: (1) GPT.forward gains optional label_smoothing=0.0 kwarg (default preserves main-training compile path — F.cross_entropy passes 0.0 through its no-smoothing branch). (2) eval_val_ttt TTT-training pass (line ~1367) calls base_model(x, y, label_smoothing=0.02). Scoring pass (lines ~1327) still uses plain F.cross_entropy on fp32 logits → val_bpb definition untouched. Novel region: prior LS experiments (exp_026 annealed on main CE → harness_abort; exp_042 lowered main LS 0.003→0.001 → discard) all operated on main-training loss; TTT-only smoothing is distinct — TTT adapts on ~32K-token chunks for 4 epochs at lr=5e-3, a regime that can memorize local patterns; smoothing damps the gradient magnitude on confident correct predictions by (1-ε)≈0.98 without blocking corrections. Zero-param, +~30 bytes code, eval-compute unchanged. Expected delta cautious (-0.0004): TTT SGD is only ~4 steps/chunk so regularization headroom is small, but directionally helpful.
223	2026-04-22T16:52:07Z	ttt	212	212	ttt	Increase TTT epochs per chunk 4→5: direct extrapolation of the only twice-validated TTT axis (exp_014 Δ=-0.000278 and exp_017 Δ=-0.000413 both kept 3→4); with Nesterov (exp_151) + cos_lr decay already in place, the added 5th epoch runs at the lowest LR per chunk and should provide modest additional per-chunk refinement without destabilizing earlier-epoch-dominated updates.	-0.00015	eval_budget_overrun	1.077336			600.053000	785.947000	1496.000000	apg-ttt-0215		"One-literal edit at train_gpt.py:184 (TTT_EPOCHS default 4→5). Untried in history: exp_014/017 stopped at 3→4; no 4→5 or 4→6 trial exists. Budget impact: TTT adapt loop runs 25% more inner iterations; current eval is well under 600s cap and exp_014 (4-epoch) did not trip budget, so headroom is expected to absorb the extra epoch. Orthogonal to exp_213's failed momentum-reset direction — keeps the proven ""more refinement per chunk"" axis active while leaving optimizer state unchanged between chunks (which has been confirmed better than reset: exp_213/171/113/089/064/060 all discarded)."
224	2026-04-22T16:54:13Z	meta	212	212	meta	Lower matrix_lr 0.022→0.020 (−9%): exp_214 showed +9% (0.022→0.024) hurt by +0.000180, so the untried opposite direction probes whether the Muon LR optimum actually sits below 0.022 (adam_wd has already been halved post-exp_177, so the effective regularization landscape has shifted since matrix_lr was last tuned).	-0.00008	discard	1.075572	+0.000550	15996955	600.121000	774.879000	1483.000000	apg-meta-0215		Single-literal change on line 148 (MATRIX_LR default 0.022 → 0.020). Zero-param, zero-byte, zero-eval-cost. Probes the untested side of exp_214's matrix_lr sweep. With adam_wd now 4× lower than when matrix_lr was last co-optimized, there's a plausible story that slightly smaller Muon steps pair better with the less-damped Adam group. If this also discards, the 0.022 optimum is confirmed in both directions and we should stop tuning matrix_lr.
225	2026-04-22T16:58:38Z	arch	212	212	arch	Swap MLP activation from SiLU² to Primer-canonical ReLU²: F.silu(fc(x)).square() → F.relu(fc(x)).square(). Primer (So et al., 2021) proved ReLU² beats every alternative for small LM, and it is the nanoGPT-speedrun default — current code's SiLU² is an uninvestigated deviation.	-0.001	discard	1.363735	+0.288713	15973483	600.027000	749.973000	1461.000000	apg-arch-0217		Single-token edit in MLP.forward (line 568). Zero param count change, zero byte impact. ReLU² gives exact-zero sparsity on negative pre-activations, which is mildly favorable for GPTQ: zero-valued hidden columns have zero Hessian contribution, so quantization error budget shifts to active columns only. Distinct from prior MLP arch trials: exp_030/exp_177 tried SwiGLU (2-projection gated, param-increasing); this keeps the 1-projection non-gated topology but switches activation to the Primer-paper-recommended ReLU². Searched KNOWLEDGE.md and events.jsonl — no prior trial tests F.relu in the squared-activation MLP. Expected -0.001 based on Primer's ~1-3% perplexity wins translating to ~0.001 bpb at this baseline.
226	2026-04-22T17:05:10Z	loss	212	212	loss	Restore exp_186's u² position-weighted CE (pw = 0.9 + 0.2·u², mean-preserving over T=2048) on top of exp_212; the proven PW keep (Δ=-0.000062) was dropped from the current best lineage at exp_190→exp_196→exp_212, and the quantization-axis exp_212 change is orthogonal to training gradient shape.	-0.00006	eval_budget_overrun	1.075661			600.066000	797.934000	1510.000000	apg-loss-0218		"Single-site edit in GPT.forward (line ~743): replace reduction=""mean"" CE with reduction=""none"" CE multiplied by pw = 0.9+0.2·u² (u=linspace(0,1,T)), pw/pw.mean() normalized. Mean-preserving so effective LR unchanged; zero-param, zero-byte. Explicitly NOT the exp_216 stack (no anti-focal afw — that collapsed hard-token gradient and pushed bpb to 1.77). PW CE never tried on exp_212's specific lineage (quant damp=0.02); prior proven instance ran on exp_176 (curr) parent. Expected gain is the same small magnitude as exp_186 standalone (~Δ=-6e-5) since the damping change lives at quantization-time and doesn't touch training gradients."
227	2026-04-22T17:08:00Z	curr	212	212	curr	Cross-rank+cross-shard Latin-square phase coordination: replace per-(rank,shard) random permutation(8) with deterministic phase[(rank,si)][j]=(rank+si+j) mod 8, so first-epoch phase offsets tile [0,8) uniformly across the rank x shard grid instead of multinomial-colliding, giving max starting-offset diversity in the first shard-epoch where most of the short run lives.	-0.00005	discard	1.077588	+0.002566	15994804	600.086000	762.914000	1474.000000	apg-curr-0219		Single-site edit inside ShuffledSequenceLoader.__init__ (line ~367). Preserves exp_142's per-shard Latin-square property (same 8-phase table, same epoch-cycling via _phase_epoch) but swaps independent rng.permutation(8)-per-shard for deterministic (rank+si+j) mod 8. RNG plumbing unchanged downstream — sequence_order still uses self.rng.permutation. Zero param change, zero code-size impact, zero eval cost. Extends curriculum's tightening trend (exp_142, exp_196) along the missing cross-rank axis.
228	2026-04-22T17:10:36Z	reg	exp_212	212	reg	Within-attention Muon WD split: QK-reader matrices (c_q, c_k) get muon_wd_qk=0.115 (21% boost) while V-reader + attn.proj stay at muon_wd=0.095; orthogonal to exp_164 (attn-vs-mlp type split) and exp_141 (recurrent depth split).	-0.0003	discard	1.077086	+0.002064	15996218	600.073000	749.927000	1457.000000	apg-reg-0219		Three-site edit: (1) add muon_wd_qk hyperparam after muon_wd_mlp (line 172-ish); (2) Optimizers.__init__ splits the matrix-attn iteration into matrix_attn_qk_params (.c_q./.c_k. matches) vs matrix_attn_vo_params (c_v, attn.proj); (3) optimizer_muon now has 3 param groups with per-group WD (0.115 / 0.095 / 0.125). Rationale: QK projections form the attention bilinear pattern — most sensitive to spurious-pattern overfit. V+proj is information routing (attn.proj is zero-init + already regularized). Distinct-param split is balanced (QK ≈ 4.3M, V+proj ≈ 4.3M). Zero tensor-shape changes → zero artifact byte delta. No train/eval timing impact (same Muon step count, same WD application). Novelty: 200+ trials have not split within-attention WD by QK-reader vs V/proj-writer; the two prior successful reg keeps both used Muon WD splits on different axes.
229	2026-04-22T17:14:51Z	tok	212	212	tok	Add a single learnable scalar logit_temp (init=1.0) inside the output softcap: softcap*tanh(logit_temp*logits/softcap). Direct output-side analog of the existing learnable qk_gain=5.25; lets the tied tok_emb decouple output logit sharpness from input embedding magnitude at ~0 byte cost.	-0.0003	discard	1.078914	+0.003892	15980066	600.073000	764.927000	1475.000000	apg-tok-0221		Three-site edit on exp_212 snapshot: (1) new nn.Parameter torch.ones(()) declared right after self.logit_softcap=h.logit_softcap in GPT.__init__ (scalar fp32); (2) forward_logits softcap line updated to multiply logits by logit_temp before tanh; (3) scalar_params.append(base_model.logit_temp) in optimizers setup, joining the scalar-AdamW group (same treatment as skip_weights/skip_gates). Rationale: with tie_embeddings=True the tok_emb matrix must jointly optimize for (a) input compositional vectors (need moderate row norms for layer-norm-friendly features) and (b) output logit projection (needs row norms scaled for correct softmax sharpness under CE). qk_gain solves this for attention; no analog exists on the output side. exp_044 tried a fixed eval-only temperature (T=1.05) and hurt bpb by +0.0026, but that's a very different experiment — a learnable train-time scalar optimized end-to-end is orthogonal. The Late QAT path sees logit_temp on the recompiled graph (scalar Parameter, not a Python bool) so torch.compile hazard does not apply. Artifact bytes: +4 raw, passthrough fp16 in quantization (numel < 65536 threshold); well within headroom.
230	2026-04-22T17:16:10Z	opt	212	212	opt	Cosine-anneal grad_clip_norm from 0.3 at peak to 0.15 at end of warmdown (C¹-smooth via 0.5*(1 + 0.5*(1 - cos(pi*lr_scale)))), lockstep with LR — revival of never-run exp_036, targets outlier-gradient contamination of the EMA tail where low-LR updates are dominated by averaging.	-0.0003	discard	1.075233	+0.000211	15996116	600.036000	757.964000	1466.000000	apg-opt-0223		Single-site edit in step_fn replacing the unconditional clip_grad_norm_(..., h.grad_clip_norm) with a cosine-annealed schedule. clip_mul=1.0 at lr_scale=1 (no effect during warmup/peak), clip_mul=0.5 at lr_scale=0 (half-magnitude tightening at end-of-warmdown). Zero-param, zero-byte impact beyond the comment; runs every step but math is scalar. Revives the aborted exp_036 hypothesis — never ran on any stack — rather than resweeping knobs exp_220 (warmdown_frac shorten) and exp_214 (matrix_lr raise) already rejected.
231	2026-04-22T17:18:16Z	quant	212	212	quant	Continue damp trajectory: GPTQ Hessian damp coefficient 0.02→0.03 (1.5×). exp_212 showed 0.01→0.02 helped by -0.000224; exp_016 showed 0.01→0.003 hurt by +0.000354. This tests whether the optimum is past 0.02 or bracketed between 0.02 and 0.03.	-0.00005	discard	1.075302	+0.000280	15993173	600.127000	766.873000	1475.000000	apg-quan-0224		Single-literal change in gptq_quantize_weight (line 991: 0.02→0.03). Size-neutral — same Q dtype (int8-stored int6), same s shape/dtype (fp16 per-row). Zero-byte code diff at pack time (ASCII digit swap). Cost: nothing at train/eval time (damp is a scalar add on the diag). Signal: bracket the damp optimum. If better, future quant trials can explore 0.04; if worse, exp_212 is the peak and alternative quant directions (e.g., block_size 64→32) become priority.
232	2026-04-22T17:21:26Z	ttt	212	212	ttt	Reset SGD momentum buffer at each TTT chunk boundary: stale Nesterov momentum from the prior chunk's text distribution drags the first SGD step of the next chunk, and cosine-decayed per-chunk LR amplifies this drag at late chunks (LR shrinks while momentum magnitude does not).	-0.0003	discard	1.075520	+0.000498	15992691	600.065000	776.935000	1486.000000	apg-ttt-0225		"Single edit inside eval_val_ttt, at the start of each chunk's SGD phase (right after setting cos_lr), sets optimizer.state[p]['momentum_buffer']=None per param. PyTorch SGD treats None buffer as ""initialize from current gradient on next step,"" so the first step of each chunk becomes pure gradient (no inherited direction). Zero bytes, zero params, zero runtime cost. Untried direction: exp_037 proposed cosine-cooling momentum across chunks but was aborted; exp_039 (mom 0.9→0.95) confirmed momentum is already near-saturation, suggesting momentum accumulation — not momentum magnitude — is the remaining regression. Rationale aligns with the exp_223 signal that MORE TTT adaptation (epochs 4→5) hurt: drift is the problem, not under-adaptation."
233	2026-04-22T17:23:25Z	meta	212	212	meta	Loosen grad_clip_norm 0.3→0.4 (+33%): exp_169 tested the −33% side (0.3→0.2, discard +0.000124); the +33% side is completely untried. The 3-loop recurrence amplifies loop-layer gradient norms, so a slightly looser clip preserves informative updates during the peak-LR × peak-momentum window without risking the kind of clip-induced saturation a tighter value showed.	-0.0002	discard	1.075362	+0.000340	15994428	600.064000	752.936000	1459.000000	apg-meta-0225		Single-literal edit at train_gpt.py:162 (GRAD_CLIP_NORM default 0.3 → 0.4). Zero-byte, zero-param, zero-eval-cost. Probes the asymmetric untested upper side of the grad_clip_norm axis — the only prior probe (exp_169) went downward and lost by +0.000124. All other optimizer-LR axes (matrix_lr, scalar_lr, beta2, adam_wd) already have two-sided probes; this is the last unsymmetric-tested core optimizer knob at local ±33% radius.
234	2026-04-22T17:24:04Z	eval	212	212	eval	Halve ttt_chunk_tokens 65536 to 32768: doubles score-train boundaries and total TTT SGD steps while keeping total SGD-token exposure constant; finer-grained Nesterov-momentum trajectory.	-0.0004	eval_budget_overrun	1.077738			600.150000	788.850000	1498.000000	apg-eval-0225		Single-literal edit at Hyperparameters.ttt_chunk_tokens default (line 186). Zero-byte, zero-param. At 32K chunks: chunk_seqs=16, my_chunk_seqs=2 per rank of 8, batch_seqs=32 still gives 1 batch per epoch times 4 epochs = 4 SGD steps per chunk, so total steps 2x via doubled num_chunks (~608 to ~1220). Per-step effective global batch halves (16 seqs vs 32) so gradient variance rises, but cross-chunk Nesterov momentum integrates it (exp_213 discard showed momentum across chunks is load-bearing). Cosine-LR over chunks keeps same integral at finer resolution. Extra wall from loop overhead is sub-second. Risk: smaller per-step batch at same LR may overshoot; mitigated by grad_clip_norm=1.0 and cos LR decay.
235	2026-04-22T17:30:21Z	arch	212	212	arch	Full QKV-norm: add F.rms_norm on V in CausalSelfAttention.forward (symmetric with existing Q/K norm). Decouples attn output magnitude from input scale, makes XSA's internal F.normalize(v) a near no-op, and narrows V's dynamic range for GPTQ int6 calibration of self.proj. Especially valuable under 3-layer recurrence where V is re-projected repeatedly.	-0.0005	discard	1.078327	+0.003305	15998035	600.142000	770.858000	1482.000000	apg-arch-0226		Single-line addition between K-norm and RoPE (line 548). Zero params, zero bytes. Chameleon-style full QKV-norm is well-documented at small scale; untried in this tree. Note: V no longer carries input magnitude info into the softmax-weighted aggregation — if attention at small scale relies on V-magnitude heterogeneity for informativeness, this could hurt. XSA interaction is favorable (vn = normalize(v) becomes ≈ v itself, removing numerical drift from renorm). Interacts cleanly with parallel-residual topology.
236	2026-04-22T17:34:23Z	loss	212	212	loss	"Steeper u² position-weighted CE: pw = 0.8 + 0.4·u² (ratio 1.5, mean-preserving) vs current 0.9 + 0.2·u² (ratio 1.22). Probes the untested ""PW coefficient strength"" axis — exp_156 (linear 1.22) and exp_186 (u² 1.22) both kept, but no ratio > 1.22 has run (exp_034 at 3.0 was aborted)."	-0.0001	discard	1.075623	+0.000601	15992674	600.020000	778.980000	1490.000000	apg-loss-0228		Single literal change at line 763: 0.9 + 0.2·u² → 0.8 + 0.4·u². Zero params, zero bytes. Same u² curvature shape (mean-preserving after pw/pw.mean()), only the end-to-end ratio changes 1.22→1.5. Directional test: if PW helped a little at ratio 1.22 (Δ=-0.000062 isolated in exp_186), does more aggressive tilt help more or overshoot an optimum? Aligned with sliding-window eval where only the last ~64 of 2048 positions are scored per window — training gradient concentrates toward where val_bpb is actually measured. Does NOT alter anchor point (0.8 + 0.4 = 1.2 max weight before normalization), so first-position weight drops from 0.93 → 0.74 of mean; last-position rises from 1.14 → 1.11 of mean (slight). Wait — recompute: normalized pw_last = (0.8 + 0.4)/(0.8 + 0.4/3) = 1.2/0.933 = 1.286; pw_first = 0.8/0.933 = 0.857. So ratio 1.286/0.857 = 1.50. First position gets 0.857× mean gradient, last gets 1.286×.
237	2026-04-22T17:41:34Z	curr	212	212	curr	Eval-aligned step-function position weighting on training CE: upweight the last 64 positions' loss by 1.5x (mean-preserving), matching exactly the stride-64 sliding-window regime the evaluator scores. Targets eval's scoring distribution — every eval-scored token sits in positions [T-64, T) with 1984-2047 tokens of context — without the smooth-ramp compute overhead or off-target early-position weighting of exp_186's u² scheme.	-0.00025	discard	1.075052	+0.000030	15994302	600.122000	770.878000	1479.000000	apg-curr-0230		Single-site edit in GPT.forward (lines 743-747 → 743-760). Zero bytes, zero params, zero eval-path impact (eval uses forward_logits directly, not forward). Training CE: pw=[1.0]*1984 + [1.5]*64, scaled by T/pw.sum() = 2048/2080 ≈ 0.9846. Effective weights: 0.9846 on first 1984 positions, 1.477 on last 64. Cross_entropy switched to reduction=none then weighted .mean() over (B,T); sum-scale preserved vs the prior mean reduction. torch.compile-safe: T=2048 specialized under dynamic=False/fullgraph=True. exp_226 attempted full-sequence u² ramp and hit eval_budget_overrun (timing, not correctness); this step-function is cheaper and purely forward-side. Distinct from all prior curr trials (none touched per-position weighting; loss-domain u² was a full-sequence ramp, not step-function).
