exp_id	timestamp	specialist	parent_exp	baseline_exp	domain	hypothesis	expected_delta	status	val_bpb	delta_vs_best	artifact_bytes	train_s	eval_s	total_s	job_name	snapshot_path	notes
148	2026-04-22T12:25:47Z	opt	108	142	opt	Shrink warmdown_frac 0.72→0.60 to expand the peak-LR+peak-momentum window 6%→18% of training — frac=[0.22,0.40] at peak-LR+peak-momentum instead of only [0.22,0.28], tripling the window exp_088 opened by shrinking Muon momentum warmup 0.33→0.22.	-0.0008	discard	1.077537	+0.000974	15993050	600.056000	756.944000	1474.000000	apg-opt-0139		"warmdown_frac has never been directly swept in this tree. exp_022 tried 0.72→0.65 but was harness_abort (never ran on GPU). exp_088 WIN (Muon momentum warmup 0.33→0.22) pulled the end-of-momentum-warmup to frac=0.22, meaning the ""real peak-momentum window"" before warmdown begins is only [0.22, 1-0.72]=[0.22, 0.28] — just 6% of budget. Shortening warmdown to 0.60 extends peak window to [0.22, 0.40] = 18% of budget, 3× exposure. Warmdown tail is still 1200+ steps at ~2000 total steps, plenty for EMA (half-life ~200 steps at decay=0.9965) to converge. Risks: (a) less tail time might hurt EMA quality; (b) coupling with Muon momentum cool-down schedule (exp_010) — the cool now happens over a shorter window so momentum drops faster per-step. Single-literal change at train_gpt.py:108. Zero param/byte growth."
149	2026-04-22T12:40:07Z	meta	exp_142	142	meta	Revive orphaned exp_003 keep on current best lineage: EMA_DECAY 0.9965 to 0.998.	-0.0003	size_blocked	1.078881		16000133	600.007000	758.993000	1473.000000	apg-meta-0147		
150	2026-04-22T12:44:58Z	arch	142	142	arch	Add V-norm (F.rms_norm on v over head_dim) symmetric with existing Q/K-norm in CausalSelfAttention.forward: bounds attention-output magnitude independent of V-row outliers, completing the Q/K/V normalization triad (Kimi-K2/Qwen3 style).	-0.0003	discard	1.078499	+0.001936	15999081	600.104000	766.896000	1475.000000	apg-arch-0148		Single-line insertion at CausalSelfAttention.forward (~line 510): `v = F.rms_norm(v, (v.size(-1),))` placed immediately after existing q/k RMSNorms, BEFORE flash_attn_3_func. Zero parameters added (F.rms_norm is scale-free here — the RMSNorm class has no learnable weight). XSA (_xsa_efficient) is compatible: it uses F.normalize(v, dim=-1) internally which is direction-only, idempotent to an RMS rescaling. Prior arch tree has extensively tested Q-side/residual knobs (rope_dims, resid_mix init, parallel_residual_start, skip_gates), but V-norm specifically — the missing third leg of the QKV-norm triad — has never been proposed. Rationale: under q_gain=5.25 + QK-norm the attention is strongly sharpened; attention output magnitude is therefore dominated by argmax V-row magnitudes rather than averaged, so unnormalized V-outliers can inject residual-stream spikes. V-norm bounds per-head attention output to RMS≈1, delegating magnitude control entirely to the per-channel attn_scale param (init 1.0) which is already learnable. Expected compression impact: negligible — v's activation statistics shift but the c_v projection weight distribution is unchanged during training, and GPTQ calibrates on the new activation path coherently. Rebased workdir to exp_142 first (best snapshot) to drop stale exp_143 resid_mix edit.
151	2026-04-22T13:00:35Z	ttt	142	142	ttt	Enable Nesterov momentum on the TTT SGD optimizer (nesterov=True) so the ~16 SGD steps/chunk lookahead the next-step gradient, giving effectively near-second-order dynamics in this extremely-low-step regime where classical-momentum staleness dominates.	-0.0004	keep	1.076291	-0.000272	15994052	600.110000	695.890000	1403.000000	apg-ttt-0147	snapshots/151_ttt	"Single-flag change at eval_val_ttt line 1254 (SGD constructor). Rebased workdir to exp_142 first to wipe stale -100 mask left from exp_139. exp_031 proposed Nesterov previously but was harness_abort and never actually ran, so this is a genuinely untested direction. Orthogonal to exp_039 (which raised momentum scalar 0.9→0.95 and was worse) — Nesterov fixes the update rule, not the scalar. Zero param change, zero training-time change, zero model-bytes change. Risk: with grad-clip=1.0 already applied, Nesterov's lookahead magnitude is bounded so divergence is unlikely.</notes> </invoke>"
152	2026-04-22T13:00:49Z	opt	142	151	opt	Exclude Muon matrix params from global grad_clip_norm — Newton-Schulz already bounds per-layer Muon update spectrum, so global L2 clipping couples Muon grads to sparse tok_emb/lm_head outliers and damps them unnecessarily; clip only Adam-managed (tok_emb + lm_head + scalar/control) params at the same 0.3 threshold.	-0.0010	discard	1.076593	+0.000302	15996230	600.115000	769.885000	1482.000000	apg-opt-0149		Single-site edit in train_model: precompute _non_muon_params (filter out ids from optimizer_muon.param_groups) once before step_fn, swap the single clip_grad_norm_ call target from base_model.parameters() to _non_muon_params. Threshold unchanged (h.grad_clip_norm=0.3). Zero param-count change, ~400 bytes of code growth. Distinct from all prior opt trials (which all touched schedule shape, momentum peak/warmup, or weight-decay targeting — never the clip target set). Risk: if clip was silently protecting against embedding-driven instability by damping the WHOLE net's early grads, isolating clip to the Adam side could let Muon take a single bad step early. Mitigation: Newton-Schulz outputs are bounded in norm regardless of input grad magnitude, so Muon's actual p.add_ magnitude per step is bounded by lr * aspect_ratio^0.5 ≈ matrix_lr * 1.0 = 0.022, far below the clip-equivalent scale.
153	2026-04-22T13:01:18Z	quant	142	151	quant	Tighten matrix_clip_sigmas 12.85→10.5 — direct SDClip scale tightening (18% smaller quant scale → finer int6 resolution for bulk Gaussian weights) without the aggressive per-row MinMSE that size-blocked exp_145/exp_004/exp_008.	-0.0008	size_blocked	1.073723		17017775	600.139000	748.861000	1466.000000	apg-quan-0148		Baseline SDClip int6 uses matrix_clip_sigmas=12.85 (very conservative: sf=12.85*std/31=0.414*std, typical |w|=0.8σ → int≈1.9). P(|w|>12.85σ) ≈ 10^-38 for Gaussian so NO clipping happens — 12.85 is purely a grid-coarseness choice. Muon-trained matrix weights are Gaussian-like with row_max/row_std≈3.5, so clip_sigmas well above ~6 has zero clipping probability. Dropping to 10.5 (18% tighter scale: sf=0.339σ, |w|=0.8σ→int≈2.4) still has P(clip)<10^-25 for Gaussian, but gives strictly finer resolution for bulk weights → better post-quant MSE → lower bpb. Size cost comes only from slightly higher Q-value entropy (spread from mostly-{0,±1} toward {0,±1,±2,±3}), expected 20-60 KB within the ~180 KB headroom. Differs from prior quant attempts (exp_145 max-abs, exp_008 per-layer α-grid, exp_004 per-row MinMSE) which all went MUCH more aggressive (effective clip_sigmas≈3.5) and size-blocked. This is a calibrated middle ground — the direct constant sweep has never been tried at any specific intermediate value.
154	2026-04-22T13:01:38Z	curr	142	151	curr	Add uniform intra-bucket jitter to exp_142's Latin-square phase cycling: each reset samples jitter∈[0,bucket_width) on top of the bucket offset so repeat visits to the same bucket k land on a DIFFERENT actual phase. Preserves Latin-square coverage guarantee at bucket granularity while extending phase coverage from 8 discrete points to continuous over [0,max_phase).	-0.0004	discard	1.076974	+0.000683	15994770	600.134000	754.866000	1469.000000	apg-curr-0148		Single-site edit in ShuffledSequenceLoader._reset_shard (~line 367). Without jitter, the 9th+ epoch of a shard revisits bucket k with IDENTICAL start_inds set (only permutation order differs) — so model sees exactly the same tokens in shuffled order. Jitter via self.rng.integers(0, bucket_width) makes every repeat visit sample a fresh phase within the bucket, giving genuinely-new stream cuts. bucket_width=(seq_len)//8=256 so jitter range is [0,256). Zero params, ~600 bytes of code growth (mostly comment).
155	2026-04-22T13:01:59Z	reg	142	151	reg	Continuous input-embedding Gaussian noise σ=0.015 added to post-RMSNorm x in forward_logits, train-only via self.training gate — a smoother alternative to exp_040's failed MLP hidden dropout and exp_012's size-blocked discrete token-replacement.	-0.0005	discard	1.076571	+0.000280	15991802	600.092000	761.908000	1480.000000	apg-reg-0148		One-line addition at train_gpt.py:~672 inside GPT.forward_logits: `if self.training: x = x + torch.randn_like(x) * 0.015`. Post-RMSNorm x has unit RMS so σ=0.015 = ~1.5% perturbation per element. Zero new params; ~120 code bytes (comment + line). Gated on self.training so: (1) val/eval passes see zero noise — no metric contamination, (2) TTT-score pass under inference_mode sees zero noise — legal, (3) TTT-train inner step sees noise — acts as mild chunk-overfitting regularizer. Structural motivation: prior reg trials show dropout-style disruption HURTS at this param count (exp_040: +0.0098) while targeted weight-regularization HELPS (exp_141: -0.00027). Continuous Gaussian noise on embeddings is between these — preserves gradient topology (unlike dropout masks) but still smooths the embedding geometry. Risk: model may need extra redundancy to denoise, slightly inflating brotli-compressed model bytes (exp_012 was size_blocked for a similar reason). If size_blocks, next iter tries σ=0.008.
156	2026-04-22T13:03:20Z	loss	142	151	loss	Gentle position-weighted CE (linspace 0.9→1.1 across T=2048, mean-preserving): aligns training gradient with eval's stride-64 scored regime [1984,2047] by a 20% amplitude tilt toward late positions, structurally distinct from prior per-token (exp_144 focal), target-side (exp_042 smoothing), and symmetric (exp_009 z-loss) loss trials.	-0.001	keep	1.076091	-0.000200	15994389	600.061000	768.939000	1485.000000	apg-loss-0148	snapshots/156_loss	"Single-site edit in CasualDecoder.forward (train_gpt.py lines 705-709). Replaces plain mean-reduction F.cross_entropy with a per-token CE (reduction=""none"") multiplied by a position weight vector w(t)=linspace(0.9,1.1,T) broadcast across batch, then mean-reduced. Key property: mean(linspace(0.9,1.1,T))==1.0 exactly, so the global gradient magnitude is preserved — the existing LR schedule (warmdown fraction, Muon momentum ramp, etc.) stays calibrated. Zero new params, zero compile-graph hazards (pw is a fresh tensor each forward, no mutable state). Compute cost negligible: one extra linspace+expand (no additional matmul). Motivation: eval scores only positions [1984,2047] (stride-64 sliding window, context_size=1984); training CE averages over all 2048 positions, giving the eval regime only 3.1% of the gradient. 20% amplitude slope shifts roughly 10% of gradient mass toward the eval-target tail. Contrast with exp_034 (linspace 0.5→1.5, 100% amplitude, harness_abort): 5× gentler to stay in small-perturbation regime and avoid training instability. Structural novelty vs all executed loss trials: exp_009 z-loss (symmetric logsumexp² regularizer), exp_042 label_smoothing down (target-side symmetric), exp_144 focal γ=1 (per-token difficulty, position-agnostic). This is the first POSITION-based loss reshape actually to execute."
157	2026-04-22T13:05:03Z	eval	142	156	eval	Temperature sharpening T=0.97 on scoring logits in eval_val_ttt (divide logits by 0.97 before CE) — opposite direction of exp_044 (T=1.05 worsened +0.00261), motivated by GPTQ int6 weight noise flattening the output distribution.	-0.0005	discard	1.077622	+0.001531	15994133	600.102000	761.898000	1473.000000	apg-eval-0148		Single-site edit at eval_val_ttt scoring (line 1275): logits.reshape(...).float() → logits.reshape(...).float()/0.97. Applied ONLY to the scoring cross_entropy (drives reported val_bpb), NOT to the TTT training CE at line 1322 so the gradient signal is unchanged. Rationale: exp_044 established bpb is highly sensitive to T (Δ=+0.00261 for T=1.05). By local quadratic assumption, if optimum T*<1 (as GPTQ softening suggests), T=0.97 should improve over T=1.0 — if T*≈1.0 this costs ~0.0009, so 50/50 risk with asymmetric upside. Size/time impact: zero (single fp32 division).
158	2026-04-22T13:05:21Z	tok	142	156	tok	Zipf-weighted row-magnitude init for tied tok_emb: after normal_ init, multiply row i by 1/sqrt(1 + i/1024) so rare high-ID tokens start with smaller norms. Tied embeddings feed F.linear for output logits (row-norm-sensitive), so rare-token logits start small → low-confidence uniform prior for rares at t=0, matching BPB's objective.	-0.0005	discard	1.077884	+0.001793	15996825	600.126000	764.874000	1478.000000	apg-tok-0148		Single-site edit in _init_weights (GPT class). Distinct from prior tok experiments: exp_011 (raised std uniformly, size_blocked), exp_019 (equi-row-norm sphere, discard), exp_038 (lowered std uniformly, discard), exp_032 (trunc_normal same std, never ran), exp_146 (learnable output bias, eval_budget_overrun). None tried rank-graded magnitude. Zero added params. Shrinks norms (never grows), so GPTQ quant range narrows → no size risk. SP8192 BPE roughly frequency-orders IDs, so low-rank rows stay at full init for common tokens while high-rank rows ≈1/3× init_std ≈ lm_head-style near-zero for rarest.
159	2026-04-22T13:09:55Z	meta	142	156	meta	Bump Adam beta2 0.95→0.98: tied embedding (4.2M params) sees sparse per-row gradients; longer 2nd-moment half-life (~35 vs ~14 steps) stabilizes Adam's preconditioner for long-tail vocab rows.	-0.0006	discard	1.076664	+0.000573	15990461	600.071000	754.929000	1463.000000	apg-meta-0150		Single-literal edit at train_gpt.py:160 (BETA2 default 0.95→0.98). Affects optimizer_tok (tied embedding, 4.2M params, sparse gradients) and optimizer_scalar (tiny dense-gradient groups — near-no-op). optimizer_head is None under tie_embeddings=True. muon_beta2 is declared but UNUSED (verified: no h.muon_beta2 consumer), so this change is Adam-only. Untried direction on tree: exp_021 (harness_abort, never ran GPU) proposed cosine-cooling beta2 downward. Size risk low — smoother preconditioning should produce steadier embedding weights, not larger ones, unlike exp_149 (EMA_DECAY bump, size_blocked) which averaged more of the early-training trajectory.
160	2026-04-22T13:24:19Z	arch	142	156	arch	Restore orphaned exp_005 win: rope_dims 16→32 (50% partial RoPE). exp_005 proved -0.000788 on the older stack but the change was lost at exp_014 when a sibling specialist rebased from a pre-exp_005 ancestor; every subsequent keep (including current best exp_142) inherits rope_dims=16.	-0.0005	discard	1.077070	+0.000979	15992468	600.122000	696.878000	1398.000000	apg-arch-0151		Single-literal default change at Hyperparameters.rope_dims (line 130): 16→32. Zero added params, zero code-byte delta. Confirmed via snapshot inspection that exp_005's snapshot has rope_dims=32, exp_010 inherited, but exp_014_ttt→...→exp_142_curr all have 16. No later keep has touched rope_dims, so the change is safely orthogonal to exp_088 (Muon momentum fraction), exp_108 (GPTQ block), exp_141 (Muon WD recurrent), exp_142 (loader phase cycling). Risk: diminished magnitude on a tighter baseline (1.0766 vs 1.0810 at exp_005 time).
161	2026-04-22T13:28:59Z	ttt	151	156	ttt	Add weight_decay=1e-4 to the TTT SGD(Nesterov) optimizer so the L2 pull dampens Nesterov-amplified cumulative drift across ~176 SGD steps (11 chunks × 16 steps), preventing late-chunk divergence without an explicit weight anchor.	-0.0004	discard	1.076620	+0.000529	15993225	600.036000	764.964000	1479.000000	apg-ttt-0156		Single-kwarg addition on line 1254 SGD constructor. No new env var, no new logic, ~0 compute overhead (SGD's WD is a fused add). Rationale: current best (exp_151) enabled Nesterov, which amplifies update magnitudes via look-ahead momentum. Over 11 TTT chunks the Nesterov-accelerated updates can compound parameter drift in tok_emb / attention matrices; small WD=1e-4 provides a gentle L2 pull that counters this without the semantics of an anchor toward pretrained weights (pulls toward 0 instead). Distinct from prior TTT trials: exp_039 (momentum↑, discarded), exp_049 (freeze tok_emb, discarded), exp_147 (momentum decay, discarded), exp_151 (Nesterov, kept). No prior trial tested WD in the TTT inner loop. Risk: tok_emb shrinkage could hurt softmax sharpness; 1e-4 × lr 0.005 × 16 steps ≈ 8e-6 cumulative relative shrink per chunk, negligible.
162	2026-04-22T13:32:21Z	curr	151	156	curr	Replace exp_142's independent per-shard random 8-bucket permutations with a deterministic bit-reversal order [0,4,2,6,1,5,3,7] offset by shard index (si%8) — low-discrepancy guarantees within-shard (first k visits maximally span phase space) and guaranteed cross-shard coverage at any epoch index.	-0.0001	discard	1.077682	+0.001591	15994462	600.124000	758.876000	1472.000000	apg-curr-0159		Single-site edit at ShuffledSequenceLoader.__init__ (~line 361). exp_142 (curr, keep -0.000028) introduced per-shard random permutations of 8 phase buckets; exp_154 (curr, discard +0.000683) added within-bucket jitter and hurt. This trial keeps the clean exp_142 phase-grid structure but replaces random per-shard permutations with a bit-reversal permutation (canonical 1D low-discrepancy on powers of 2) cycled with a per-shard offset. Two guarantees vs exp_142: (a) within-shard, for ANY k<=8 visits to a shard, the k buckets used are the first k of the bit-reversal order — so the two extreme phases {0, max/2} are ALWAYS sampled in the first two epochs instead of probabilistically missed under random permutation, and the quarter-points {max/4, 3*max/4} are ALWAYS sampled by epoch 4. Under 600s budget ~2-3 epochs/shard, this fixes exp_142's coupon-collector variance. (b) cross-shard: at any epoch index j, the phases used by 8 consecutive shards form a full bit-reversal permutation of {0..7}, so any window of 8 shards covers all buckets exactly once. Baseline (rng.permutation) at epoch 0 across 12 shards covers all 8 buckets with probability ~0.80 (Stirling). Zero params, ~400B code growth (mostly comment). Model bytes identical (no model change). RNG stream still consumed for sequence_order shuffle inside _reset_shard and shard draw in next_batch — only the _phase_order allocation differs.
163	2026-04-22T13:32:41Z	opt	151	156	opt	Cosine-symmetric linear cool of AdamW beta1 0.9→0.8 during LR warmdown (lockstep with lr_scale), on tok_emb + scalar AdamW groups. Mirrors exp_010's winning Muon momentum cool — low-LR tail has lower gradient noise, so tightening first-moment EMA window (~10→~5 steps) tracks refined signal instead of dragging in stale peak-phase momentum. Unlike exp_075 (static beta1=0.8, discarded +0.00127) this preserves beta1=0.9 during peak-LR and only contracts in warmdown; unlike exp_021 (beta2 cool, harness_abort) it targets the first moment which dominates update direction.	-0.0003	discard	1.076237	+0.000146	15993426	600.032000	752.968000	1464.000000	apg-opt-0159		Single-site 8-line insertion in step_fn between the existing Muon momentum cool and the lr_scale loop. Skips optimizer_muon (Muon has its own schedule). Applies to tok_emb AdamW, scalar AdamW, and lm_head Adam (latter is None when tie_embeddings=True). During the 20-step warmup phase (lr_scale=1.0, elapsed_ms=0), beta1_cooled=0.9 → no behavior change. During 28% peak-LR, lr_scale=1.0 → beta1=0.9 identical to baseline. Only in the 72% linear warmdown does beta1 ramp 0.9→0.8. Symmetric with exp_010's muon_momentum cool (0.99→warmup_start=0.92) also linear in lr_scale. Adam's first moment is stored in optimizer state (unaffected by EMA), so this alters update DIRECTION not magnitude at tail.
164	2026-04-22T13:34:02Z	reg	151	156	reg	Split Muon weight decay by parameter TYPE: keep muon_wd=0.095 on attention matrices, raise to 0.125 (1.32x) on MLP matrices only — MLPs are 2.7× the attention-matrix mass and the dominant overfit risk.	-0.0003	keep	1.076067	-0.000024	15990602	600.152000	755.848000	1473.000000	apg-reg-0159	snapshots/164_reg	Orthogonal to exp_141's depth-targeted WD (1.3x on recurrent layers, -0.000274 keep). This is a type-targeted split: Muon gets two param groups split by .mlp. name match — attn-matrices (c_q/c_k/c_v/proj = ~8.6M params across 11 layers) stay at 0.095; mlp-matrices (fc+proj = ~23M params across 11 layers) rise to 0.125. Rationale: 1) exp_141 validated 1.3x Muon WD as a live knob, 2) exp_041 showed LOWERING embed_wd trips size_blocked — raising WD is safe on the size dimension (smaller weights compress better under SDClip-int6+brotli-11), 3) MLPs dominate parameter count so type-targeting here concentrates regularization where it matters most, 4) attention matrices carry routing information and are more WD-sensitive (keep them at 0.095). Implementation: two new `muon_wd_mlp` hparam + split in Optimizers.__init__ + list-of-dicts to Muon constructor; standard PyTorch param-group semantics (defaults merge into groups, overrides win). Risks: if Muon's step() has subtle multi-group behavior I missed, crash. If MLP WD=0.125 is too aggressive globally (vs. exp_141's 3-layer subset), mild regression instead of improvement.
