exp_id	timestamp	specialist	parent_exp	baseline_exp	domain	hypothesis	expected_delta	status	val_bpb	delta_vs_best	artifact_bytes	train_s	eval_s	total_s	job_name	snapshot_path	notes
429	2026-04-23T05:21:21Z	opt	377	377	opt	Port exp_010's cool-Muon-momentum-during-warmdown pattern to AdamW beta1 on non-matrix groups (tok_emb, scalar, head): blend 0.9->0.8 in lockstep with lr_scale, floored at 0.25 (matches mm_blend). Peak bit-identical (lr_scale=1 -> 0.9); only the warmdown tail relaxes direction-averaging so the tiny tail updates track fresh noisy gradients instead of stale EMA memory. beta2 untouched.	-0.0003	discard	1.074723	+0.000636	15999364	600.151000	572.800000	1471.000000	apg-opt-0427		Insertion in step_fn after Muon mm_blend block (~line 1505). Iterates optimizer_tok/optimizer_scalar/optimizer_head (skips None) and sets group['betas']=(adam_beta1, b2_old). adam_b1_blend=max(lr_scale,0.25); adam_beta1=adam_b1_blend*h.beta1+(1-adam_b1_blend)*0.8. Yields 0.825 at lr_scale=0 vs 0.9 at peak. Structural analog of kept exp_010 (Muon momentum). exp_021 tried beta2 (harness_abort, did not run); beta1 direction untried. Size-safe (optimizer-state only). Rebased to exp_377 baseline before edit (workdir had drifted from exp_423).
430	2026-04-23T05:23:28Z	reg	377	377	reg	Bernoulli feature-channel dropout (p=0.02) on the x0 anchor stream only, train-only: structural 0/1 mask distinct from prior continuous-Gaussian attempts on x0 (exp_198/302/422) and from trunk-residual dropout (exp_050); x0 feeds every block's mix[1]*x0 so one small mask coordinates channel regularization across all 11 blocks.	-0.0003	size_blocked	1.074751		16001230	600.123000	592.500000	1494.000000	apg-reg-0427		Single-site edit in GPT.forward_logits right after `x0 = x`. Adds `if self.training: x0 = F.dropout(x0, p=0.02, training=True)`. Zero new params, ~500B code delta. Rationale: every dropout variant tried so far has been on the main trunk (MLP hidden exp_040, pre-final-norm residual exp_050, MLP DropPath exp_293); none has targeted the x0 shortcut stream, which is re-injected at every block via resid_mix[1]*x0. And every x0 perturbation tried was continuous-Gaussian noise, which adds variance everywhere vs. structural dropout which zeros entire channels with mean preservation via F.dropout's 1/(1-p) rescale. Conceptually: x0's reuse across all 11 blocks makes it a high-leverage axis for coordinated regularization at low cost. p=0.02 is conservative relative to discarded p=0.03 (exp_050) and p=0.05 (exp_040) trunk variants — the shortcut path has less entropy to spare.
431	2026-04-23T05:23:48Z	tok	377	377	tok	Raise tied_embed_lr 0.03 → 0.034 (+13% gentle up): under-probed axis (only prior attempt exp_081 +27% aborted with no signal); exp_420 signal suggests tok_emb wants more LR especially at warmdown tail.	-0.0002	size_blocked	1.075958		16007697	600.043000	570.100000	1470.000000	apg-tok-0427		Single-literal edit at line 146 (TIED_EMBED_LR default 0.03→0.034). Affects optimizer_tok which exclusively targets tok_emb.weight (tied). Rationale: (1) tied_embed_lr is under-probed — exp_081 (+27% up) was harness_abort; DOWN direction never tested. (2) exp_420 (opt, size_blocked) added a per-group 15% LR floor on tok_emb specifically to boost warmdown tail — argues peak LR is also under-set. (3) Gentler than exp_081's aborted 0.038 target, reducing size-blowup risk from higher weight signal → entropy. (4) Zero params, zero bytes on code; model compressed bytes may shift ±KB. (5) No interaction risk with exp_298's embed_scale (which gauges per-feature but not global LR).
432	2026-04-23T05:23:52Z	ttt	377	377	ttt	Two-group TTT SGD with partial-correlation LR dampener on looped blocks	-0.0001	size_blocked	1.074433		16001185	600.040000	573.100000	1478.000000	apg-ttt-0427		
433	2026-04-23T05:24:30Z	meta	377	377	meta	Raise Muon peak momentum 0.99 → 0.995 (untested UP direction on a core Muon knob where DOWN probe exp_394 0.99→0.985 hurt by +0.000341 — suggests optimizer prefers more momentum smoothing).	-0.00008	discard	1.075145	+0.001058	15999203	600.119000	577.200000	1473.000000	apg-meta-0427		Single-literal default change at train_gpt.py:150 (MUON_MOMENTUM 0.99 → 0.995). Not harness-injected — default flip is effective. Zero code-byte / size / runtime impact. exp_394 tested 0.985 (discard +0.000341) giving a clear DOWN-hurt signal; symmetric UP has never been tested. The exp_010 warmdown-cooling coupling floors the momentum at ~0.9375 already, so 0.995 only increases contrast during the peak-LR noisiest-gradient regime where more first-moment smoothing of Muon's NS preconditioner is most useful. Mid-frac interpolated momentum: 0.5*0.92+0.5*0.995=0.9575 (vs 0.955 old) — ~5% less gradient leak-through. Bowl-shape risk: if the optimum is 0.99 and exp_394's +0.000341 hurt was the whole curvature on that side, UP might also hurt slightly; but the step size 0.005 (half of exp_394's 0.005 DOWN step) limits downside.
434	2026-04-23T05:24:48Z	quant	377	377	quant	Combine exp_339's position-weighted GPTQ Hessian calibration (sqrt(linspace(0.9,1.1,T)) per-token scaling → mean-preserving linear ramp on H=X.T@X accumulation, upweighting late-context positions where sliding-window eval concentrates scored tokens) with exp_377's ×1.01 multiplicative damping — previously sibling-only probes, never composed.	-0.0002	discard	1.074531	+0.000444	15998818	600.091000	576.800000	1478.000000	apg-quan-0427		Two-site surgical edit in collect_hessians (input CastedLinear hook + tok_emb output hook): scales each token's activation by sqrt(linspace(0.9,1.1,T)) before reshape, so H accumulates linspace(0.9,1.1,T) per-position weight (sqrt on X → linear on X.T@X; mean of linspace=1.0 → global H magnitude preserved). No change to Q tensors, scales, block_size, or compression path — size neutral by construction. Rationale: exp_339 (this weighting on top of exp_280's ×1.02 damping) reached bpb=1.074215 (~-0.000335 over 1.074550 parent). exp_377 (×1.02→×1.01 damping on same parent) reached 1.074087 (~-0.000463). Orthogonal axes never composed; partial additivity predicts ~1.0738x. Risk: ramp's amplification of late-position sink columns may make reduced ×1.01 damping insufficient → error propagation worsens bpb.
435	2026-04-23T05:25:44Z	arch	377	377	arch	Swap Primer squared-SiLU MLP to squared-ReLU: F.silu(fc(x)).square() to F.relu(fc(x)).square() — same Primer-family non-gated x-squared form, hard-zero cutoff yields sparser activations entering the INT6-quantized proj.	-0.0002	size_blocked	1.076050		16003133	600.071000	527.300000	1393.000000	apg-arch-0427		Single-literal edit in MLP.forward (line 568): F.silu to F.relu. Zero params, zero weight-shape change, no compile-graph topology change. Primer (Shazeer/So et al. 2021) introduced both squared-SiLU and squared-ReLU variants; current stack uses squared-SiLU baseline. Squared-ReLU has NOT been tested on this tree — SwiGLU (exp_030 abort, exp_188 discard) is gated/2-projection; pure non-gated activation-function swap within the squared-family is untried. Mechanism: silu(x)^2 has tiny 0.08 positive tail for negative pre-acts; relu(x)^2 has exact zero for negative pre-acts — strictly sparser. For INT6 quantization of proj, sparser inputs concentrate activation mass into positive tail, reducing row-scale outlier interaction in GPTQ Hessian. Tradeoff: relu^2 cuts gradient through negative pre-acts vs silu^2 vanishing-but-nonzero gradient; mitigated by orthogonal init 50/50 sign balance and 11 blocks * 2048 hidden capacity. Eval/TTT/GPTQ paths unchanged.
436	2026-04-23T05:29:06Z	curr	377	377	curr	Replace inert 8-bucket Latin-square phase grid with continuous uniform random phase in [0, max_phase]: at 600s each shard's _reset_shard fires once, so only _phase_order[si][0] was ever consumed — lifts positional-offset entropy from 3 bits (8 grid points at stride 256) to ~11 bits (any position 0..2047), preserves packed stride-seq_len layout (no per-sequence overlap).	-0.0003	discard	1.075624	+0.001537	15998277	600.084000	571.100000	1469.000000	apg-curr-0427		Single-site refactor in ShuffledSequenceLoader._reset_shard + __init__. Removes 2 init lines (_phase_epoch, _phase_order) and replaces 3 lines of Latin-square bucket-index math with a single rng.integers(0, max_phase+1) draw. Latin-square was kept at exp_142 (Δ=-0.000028, within noise) but is provably inert in the 600s regime: 48 seq/step × ~1K steps / 12 shards ≈ 80 seq-per-shard vs ~49K available — phase_epoch never advances past 1. Distinct from exp_154 (continuous jitter stacked on top of 8-grid, discard) and exp_097/131/299 (per-sequence random starts that broke packed non-overlap, discard). Simplification also saves ~80 code bytes (tiny model-headroom gain).
437	2026-04-23T05:47:50Z	eval	377	377	eval	Split TTT SGD into two param groups with DIFFERENT momentum: tied tok_emb at momentum=0.5 (dual-use, highest velocity-saturation risk) vs rest at 0.9. Nesterov preserved. Momentum-split axis is untried; prior LR-side splits (exp_133 3x, exp_315 0.5x, exp_357 freeze) all discard. Fix over exp_427: pass default momentum=h.ttt_momentum at constructor level (Nesterov validator reads defaults, not per-group overrides).	-0.0004	eval_budget_overrun	1.076258			600.029000	604.000000	1501.000000	apg-eval-0430		Identical single-site edit as exp_427 (two-group SGD in eval_val_ttt) with a one-word constructor-level fix: add momentum=h.ttt_momentum as the default so torch.optim.SGD's nesterov validator passes (exp_427 crashed here because nesterov=True with default momentum=0.0 raises 'Nesterov momentum requires a momentum and zero dampening' BEFORE per-group momentum is inspected). Group-level momentum=0.5 on tok_emb still takes effect at step time since it's explicitly in the group dict and overrides the default. Rationale unchanged: tied tok_emb carries the heaviest cross-chunk velocity (gradient from every position × softmax, amplified by tied in/out); halving its momentum shortens velocity half-life from ~7 steps to ~1, matching per-chunk SGD horizon while rest stays smooth at 0.9.
438	2026-04-23T05:49:46Z	tok	377	377	tok	Lower tied_embed_lr 0.03 → 0.026 (−13% down): mirror of exp_431 (+13% up) which hit size_blocked + bpb+0.00187 — UP direction is both size-bad AND quality-bad, so DOWN is the correct probe on this under-tested axis.	-0.0002	size_blocked	1.076115		16009052	600.034000	575.200000	1472.000000	apg-tok-0433		Single-literal edit at line 146 (TIED_EMBED_LR default 0.03→0.026). Direct complement to exp_431: +13% UP caused (a) 7697B size blowup (higher LR → more weight signal → brotli entropy increase) and (b) val_bpb +0.00187 (quality worse). Both signals argue DOWN direction. DOWN reduces weight-matrix signal → better compression headroom → safe on size; and the quality monotonicity (more-LR is worse in our current regime) argues less-LR may help. Mechanism for help: lower LR on tied tok_emb stabilizes row geometry, reducing overfit of high-frequency tokens to their unigram prior and letting the trunk pick up more of the contextual work. exp_298's embed_scale gauge remains orthogonal to this change.
439	2026-04-23T05:49:46Z	loss	377	377	loss	Focal cross-entropy γ=0.25 (w_t=(1−p_t)^0.25 · CE) — training-only hard-example-focused loss SHARPENING, untested opposite direction vs softening failures (exp_428 label_smoothing +0.003372, exp_425 u² position-weight +0.001618) on the sharpened-attention exp_377 stack.	-0.0005	discard	1.074849	+0.000762	15998215	600.136000	580.300000	1491.000000	apg-loss-0432		Single-site edit in GPT.forward. Replaces F.cross_entropy(reduction='mean', label_smoothing=0.003) stale-from-exp_428 body with focal CE: per-token ce via reduction='none', p_t=exp(-ce), weight=(1-p_t).clamp_min(1e-8).pow(0.25), return (w*ce).mean(). Zero params / zero inference bytes; eval + TTT scoring CE unchanged. γ=0.25 chosen as smallest standard Lin-et-al. focal setting: weight ∈ [0.84, 1.0] for p_t ∈ [0, 0.5], gentle upweight on hard tokens, gentle downweight on easy. The focal branch is novel in this tree (z-loss exp_009 discard, label smoothing exp_042/428 discard, position-weighted CE exp_425/186-lineage — all SOFTEN; focal SHARPENS, complementing QK-gain 5.25).
440	2026-04-23T05:51:32Z	meta	377	377	meta	Continue exp_336's proven DOWN trend on MUON_WD_MLP: 0.115 to 0.105 (same -0.010 absolute step magnitude). The .mlp.* matrix group has shown repeated wins from reducing Muon WD (0.125 to 0.115 kept Delta=-0.000109); probing one more proven-magnitude step to test whether the slope continues or the optimum is near 0.110.	-0.00006	discard	1.074245	+0.000158	15998230	600.083000	530.500000	1394.000000	apg-meta-0436		Single-literal default change at train_gpt.py:172 (MUON_WD_MLP 0.115 to 0.105). Not harness-injected -- verified h.muon_wd_mlp flows into Muon param group for .mlp.* matrices at Optimizers.__init__ (line 920). Rationale: exp_336's proven -8% move (0.125 to 0.115, kept Delta=-0.000109) establishes DOWN as the winning direction on this axis. Continuing with a matching absolute step (-0.010). If keep: axis has more room; if discard: optimum is between 0.110 and 0.115 and we narrow the bracket with one trial. Expected delta conservative (-0.00006) since second-order effects typically dampen continuation steps.
441	2026-04-23T05:52:12Z	opt	377	377	opt	Decouple Muon Nesterov lookahead coefficient from the cooled buf-update momentum: fix lookahead at 0.95 constant while buf μ still tracks exp_010/324's warmdown cool.	-0.00015	size_blocked	1.074482		16002883	600.142000	571.400000	1471.000000	apg-opt-0436		"Single-site edit to Muon.step() (~line 858): replace `g.add(buf, alpha=momentum)` with `g.add(buf, alpha=0.95)`. exp_010/324 cool `group[momentum]` 0.99→0.9375 across warmdown; that same μ was reused as the Nesterov look-ahead scale, coupling ""EMA memory half-life"" with ""look-ahead aggressiveness"". Fixing lookahead at 0.95 (canonical Muon, midpoint of 0.92/0.99) keeps lookahead stable. Peak phase: lookahead 0.99→0.95 (less aggressive projection on well-averaged buf); tail: 0.9375→0.95 (slightly more projection on recent-weighted buf). Untested axis: exp_120 killed nesterov entirely (+0.079, catastrophic), exp_373 killed it only in tail (size_blocked). Neither decoupled the COEFFICIENT. NS orthogonalization + row_normalize re-scale post-sum, so this change only affects the direction balance between fresh-g and buf-EMA, not update magnitude. Small expected effect."
442	2026-04-23T05:53:34Z	quant	377	377	quant	FP64 Cholesky chain + H symmetrization in GPTQ: factor H in double precision (symmetrized first) to eliminate fp32 round-off amplification in the upper-triangular error-propagation step, critical at the narrow damping=1.01 operating point.	-0.0001	discard	1.074531	+0.000444	15998742	600.126000	574.300000	1472.000000	apg-quan-0436		Single surgical edit in gptq_quantize_weight (~line 1055): replace fp32 cholesky_inverse(cholesky(H)) → cholesky(Hinv, upper=True) chain with fp64 version (H.double() + (H+H.T)/2 symmetrization + double-precision cholesky_inverse + double-precision upper-tri cholesky, then .float() downcast for the inner GPTQ loop). Zero artifact bytes (eval-side only). Expected delta small: addresses numerical precision at the 1.01 multiplicative damping boundary where fp32 round-off in Hinv diagonal propagates through err /= Hinv_block[j,j] across all remaining cols.
443	2026-04-23T05:53:40Z	ttt	377	377	ttt	Three-group TTT optimizer: extend the partial-correlation √-rule from looped blocks to tied tok_emb (1/√2 ≈ 0.707 LR dampener) since tie_embeddings makes tok_emb.weight a dual-path (input lookup + output projection) 2×-amplified parameter, analogous to the looped-block 3×-amplification.	-0.00015	discard	1.074766	+0.000679	15999236	600.036000	576.400000	1469.000000	apg-ttt-0436		Single-site edit in eval_val_ttt (~line 1347-1363). Adds a third SGD param group `tok_emb_params` with base_lr=h.ttt_lr/√2 when tie_embeddings=1. Same cosine per-chunk schedule applies (base_lr is per-group). Zero new params, zero training-side change, zero new code in the compiled forward. Principled: tok_emb.weight's backward gradient accumulates from two correlated forward uses (the input nn.Embedding lookup AND the output F.linear(x, tok_emb.weight) via tied softmax), so under the same partial-correlation rule that motivated exp_245 (arch-side ln_scale /= √3, Δ=-0.000272 kept) and the existing loop LR split (1/√3), the correct LR dampener for a 2-path parameter is 1/√2. Distinct from prior tok_emb TTT probes: exp_049/357 full freeze (discard), exp_133 3×-up (discard), exp_315 0.5× (eval_budget_overrun — uninformative, not a direct discard signal). 0.707 is the theorem-backed midpoint, not a hand-tuned magnitude.
444	2026-04-23T05:55:46Z	reg	377	377	reg	Split scalar AdamW group: isolate q_gain params into a sub-group with weight_decay=0 (the rest keep h.adam_wd=0.005). q_gain init=5.25 is ~5x every other scalar, so 0.005 relative WD biases toward softer attention.	-0.00008	size_blocked	1.074348		16001701	600.112000	574.700000	1475.000000	apg-reg-0437		Two-site edit in Optimizers.__init__: scalar_params loop extracts q_gain-named params into qgain_params; optimizer_scalar AdamW gets two groups, q_gain sub-group weight_decay=0.0. Zero new params.
445	2026-04-23T05:57:31Z	arch	377	377	arch	Lower rope_base 10000→2048 (match train_seq_len): untouched axis in this tree — only rope_dims was explored. At seq_len=2048 with rope_dims=16 (8 freq pairs), base=10000 gives slowest period ~62800 (~30× seq_len), wasting rotational spectrum. Base=2048 shifts slowest period to ~4080 (~2× seq_len, half-cycle across ctx) and packs intermediate frequencies at wavelengths usable within 2048 tokens. Zero params, zero code-byte growth (single-literal default change; not harness-injected).	-0.0003	size_blocked	1.076088		16004539	600.124000	571.200000	1451.000000	apg-arch-0437		Single-literal default change at train_gpt.py:129 (ROPE_BASE 10000.0 → 2048.0). ROPE_BASE is not harness-injected (only TTT_ENABLED/MAX_WALLCLOCK_SECONDS/SMOKE_TEST are), so default flip is effective. Flows through Hyperparameters.rope_base → GPT.__init__ per-block Rotary construction (line ~666). Rationale: the rope_base axis has NEVER been touched in this research tree — all positional-encoding arch experiments sweep rope_dims (exp_005 16→32 keep, exp_114 32→48 size_blocked, exp_121/160 revive attempts discarded). With rope_dims=16, base=2048 matches the literature convention of rope_base ≈ seq_len for short-context LMs (nanoGPT-speedrun uses base=1024 at train_seq_len=1024). The slowest rotation aligns to a half-cycle across context, vs 3.4% of a cycle at base=10000. Fastest dim (inv_freq[0]=1) is unchanged. Threat model: (1) weight statistics in c_q/c_k shift slightly as Q/K learns different phase-relative discriminators; compression impact probably <2KB — well within ~180KB headroom. (2) Attention sharpness (QK-Gain=5.25) interacts with positional separability — at shorter base, positions become more distinguishable per-dim, which should SHARPEN attention, aligning with the 5.25 gain. (3) YaRN-style scaling in Rotary.forward triggers only when seq_len>train_seq_len (=2048), so not active at train time. Orthogonal to exp_245 (recurrence-aware ln_scale) and exp_298 (embed_scale-inside-RMSNorm). Risk: if base=2048 is too aggressive (slowest dim aliases heavily), expect small positive delta and we learn the axis bounds. Counter-probe would then be 4096 or 5000.
446	2026-04-23T05:59:43Z	curr	377	377	curr	Replace per-shard random 8-permutation with Van der Corput [0,4,2,6,1,5,3,7] rotated by shard index, so first-consumed phase is deterministic VDC[si%8]: guarantees all 8 phase buckets covered in first 8 shards (vs coupon-collector ~2-3 uncovered with random draws from 12 shards).	-0.0003	size_blocked	1.075477		16000611	600.047000	579.000000	1480.000000	apg-curr-0437		Single-site edit in ShuffledSequenceLoader.__init__ replacing `self.rng.permutation(8)` per shard with a deterministic VDC rotation. Motivation: in 600s each shard's _reset_shard fires ~1 time, so only `_phase_order[si][0]` matters — that's currently a random draw from {0..7} per shard, leaving ~2-3 of the 8 phase buckets uncovered on a 12-shard rank (coupon collector). VDC rotation `_vdc8[(k+si)%8]` makes first-consumed phases cycle [0,4,2,6,1,5,3,7,0,4,2,6] across a rank's 12 shards → complete uniform coverage. Preserves 3-bit phase entropy per shard (the regime where exp_142 won); distinct from exp_436's discarded 11-bit continuous-uniform phase (Δ=+0.0015). Orthogonal to stratified shard sampling (exp_196) which operates on batch-level shard allocation, not phase. Small positive RNG-stream side-effect: init no longer consumes 12×permutation(8) draws, so subsequent `permutation(num_sequences)` calls see shifted RNG state — not a semantic issue.
447	2026-04-23T06:18:49Z	meta	377	377	meta	Re-probe ema_decay 0.9965→0.998: exp_003's kept value (Δ=-0.000776) appears to have been lost in later rebase chains — current best snapshot still defaults to 0.9965. Wider EMA half-life (~286→~693 iters) better averages the 58%-wallclock warmdown tail where LR→0. Anchored by exp_006 (0.999 discard), so 0.998 is the validated peak from the axis's original bracket and untested under current arch (recurrence + TTT + late QAT + position-weighted CE).	-0.0003	size_blocked	1.075907		16000016	600.074000	523.400000	1393.000000	apg-meta-0444		Single-literal default edit at train_gpt.py:174 (EMA_DECAY 0.9965→0.998). Not harness-injected. Flows through h.ema_decay into the per-step EMA update at line 1577. Zero code-byte/param-count/compile-graph impact. Bracket evidence: exp_003 0.9965→0.998 kept (-0.000776), exp_006 0.998→0.999 discard (+0.008841). Recent meta activity (exp_440, exp_336, exp_433, exp_177) has not touched EMA, so interaction with the current component stack is untested.
