exp_id	timestamp	specialist	parent_exp	baseline_exp	domain	hypothesis	expected_delta	status	val_bpb	delta_vs_best	artifact_bytes	train_s	eval_s	total_s	job_name	snapshot_path	notes
848	2026-04-25T22:56:41Z	loss	750	750	loss	Byte-weighted TTT CE (via val_data.base_bytes_lut + has_leading_space correction, normalized to mean=1) aligns TTT adaptation gradient with BPB metric: multi-byte subword tokens get proportionally more loss weight, matching how they contribute more to bits-per-byte evaluation. Composes with kept z-loss (exp_596). Adapted from PR #731's byte-weighted TTT technique.	-0.0005	discard	1.109208	+0.036998	15996749	600.119000	582.700000	1520.000000	apg-loss-0840		val_data.base_bytes_lut is already precomputed in ValidationData and passed to eval_val_ttt. The byte weight for each target token includes base byte length plus the leading space correction. Normalization by _bw.mean() preserves total gradient magnitude. Clamp(min=1) handles any zero-byte control/unk tokens. This is untried in our tree; all prior loss experiments targeted z-loss variants, position-weighting, or focal CE forms.
849	2026-04-25T22:59:32Z	curr	750	750	curr	Replace per-shard _phase_epoch+_phase_order lists with a single global phase counter: all shard resets share one permuted sequence, guaranteeing all 8 Latin-square phases are covered in the first 8 resets (vs. only ~6.6 expected with independent per-shard permutations across 13 shards/rank).	-0.0001	discard	1.074681	+0.002471	15997180	600.015000	581.100000	1518.000000	apg-curr-0840		exp_506 identified shards rarely reset beyond __init__ (only ~1 reset each in 600s), so the initial phase assignment is what matters. exp_456 tried per-shard rotation of _phase_order initialization (discard, +0.0016); this is different — it changes the runtime counter to be global so that phases are consumed in a deterministic round-robin across ALL shard resets rather than independently per shard. Code is 8 bytes smaller than exp_750 (removed redundant per-shard structures).
850	2026-04-25T23:14:47Z	opt	750	750	opt	Replace linear LR warmdown with cosine shape: same 0→0 LR range and same total LR integral (0.5), but cosine holds LR ~14% higher at mid-warmdown and descends more smoothly — better EMA trajectory throughout the 72% warmdown phase.	-0.002	discard	1.076416	+0.004206	15995294	600.132000	588.900000	1537.000000	apg-opt-0842		Linear lr_mul returns (1-frac)/warmdown_frac; cosine returns 0.5*(1+cos(pi*t)) where t=(frac-(1-warmdown_frac))/warmdown_frac. At mid-warmdown (s=0.5), cosine LR=0.5 matches linear (equal total integral), but cosine is 14% higher at s=0.25 and 14% lower at s=0.75. Keeps LR elevated during early warmdown (more effective updates) and softlands at the end. Never tried in 840+ experiments — all schedule-shape probes touched momentum blend shape, not the LR decay curve itself.
851	2026-04-25T23:19:58Z	tok	750	750	tok	Add output-side per-feature embed_scale_out [512, init=1.0] multiplied onto x just before the tied LM-head F.linear, providing independent feature gating for the decoder side distinct from the input-side embed_scale (exp_267/298 kept). Also removes the harmful embed_bias from exp_841 (eval_budget_overrun).	-0.000040	discard	1.076551	+0.004341	15979776	600.096000	588.100000	1523.000000	apg-tok-0847		Mechanism: after final_norm normalises x to unit RMS, a per-feature multiplicative gate lets the model specialise which features drive vocabulary prediction, similar to how embed_scale specialises which features drive the encoder. Both are frozen during TTT (numel=512 < 10000). The output-side scale is equivalent to column-scaling tok_emb.weight; under quantisation this can up-weight cleaner features and down-weight high-noise ones. Expected small gain analogous to exp_267 Δ=-0.000036 on the input side.
852	2026-04-25T23:22:31Z	meta	750	750	meta	TIED_EMBED_LR 0.03 → 0.028 (gentle DOWN -6.7%): half-step retry of exp_252's failed -13.3% probe (depth 12, +0.001054) under the post-538/596/750 regime where 4 added regularizers (z-loss, attn_out_gate, scalar-freeze, mm_blend cool) have shifted the dominant 4.2M tied tok_emb's LR optimum DOWN, aligned with the recent meta DOWN-direction theme (exp_177 adam_wd, exp_336 muon_wd_mlp, exp_792 scalar_lr signal).	-0.0001	discard	1.075101	+0.002891	15997806	600.149000	583.300000	1518.000000	apg-meta-0848		Single-literal change at L146 (TIED_EMBED_LR default 0.03 → 0.028). +1 code byte. Zero new params, zero compile-graph or quant-path risk. tied_embed_lr feeds optimizer_tok at L905-908 (the AdamW group on tied tok_emb with embed_wd=0.085, beta1=0.9, beta2=0.95, eps=1e-8). Mechanism: gentler peak LR on the dominant 4.2M-param tensor reduces row-magnitude drift, which compounds with embed_wd=0.085's ~exp(-h.embed_wd*lr*steps) shrinkage; lower peak LR means each step stays closer to the GPTQ-friendly equilibrium. Symmetric to exp_792's SCALAR_LR DOWN signal (1.071951 size_blocked) but on the OTHER AdamW group (tok vs scalar). Risk: tok-group LR changes affect the dominant brotli payload, so size_blocked is a real possibility.
853	2026-04-25T23:24:05Z	quant	750	750	quant	Split GPTQ clip sigmas by layer type: MLP matrices use 15.0σ (wider, preserves outlier weights) while attention matrices keep current 12.85σ — MLP layers have heavier-tailed weight distributions post-training; uniform 12.85σ clips them too aggressively.	-0.001	discard	1.074783	+0.002573	15379195	600.005000	589.100000	1531.000000	apg-quan-0849		Inspired by PR #1769 (mlp_clip_sigmas 10→12, Δ=-0.00096 BPB in their stack). Two minimal edits: add mlp_clip_sigmas=15.0 to Hyperparameters; change cs assignment in gptq_mixed_quantize to use mlp_clip_sigmas when '.mlp.' in name, else matrix_clip_sigmas. No FreqGPTQ (rebased to exp_750 to avoid size_blocked risk from exp_842). PR #1769 baseline was 10σ; ours is already 12.85σ so scaling same ratio gives ~15.4σ, rounded to 15.0.
854	2026-04-25T23:26:40Z	arch	750	750	arch	Q-only region-split RMSNorm: normalize Q's RoPE region [...,:rope_dims=16] and NoPE region [...,rope_dims:] independently before RoPE+q_gain, while K keeps joint norm. Pairs structurally with kept exp_475 bifurcated q_gain[H,2] which currently amplifies a jointly-normalized Q where the dominant region's RMS shrinks the other's. K stays joint since q_gain only operates on Q.	-0.0003	eval_budget_overrun	1.074421			600.139000	603.200000	1561.000000	apg-arch-0850		Edits CausalSelfAttention.forward L543-L551 (lines added, conditional on 0<rope_dims<head_dim). exp_494 tried Q+K full split, got eval_budget_overrun 1.077725 (older baseline pre-XSA-all + pre-recurrence-aware-ln_scale, eval was tighter). My Q-only halves the per-layer extra rms_norm count vs exp_494, keeping eval headroom. Step-0 nearly transparent for orthogonal-init c_q (per-region RMS approx joint RMS at uniform feature magnitudes); divergence grows during training as q_gain[:,0] vs q_gain[:,1] specialize. +260 packed bytes, no new params.
855	2026-04-25T23:26:43Z	loss	750	750	loss	Add label_smoothing=0.02 to training CE: reduces overconfidence during training, mild regularization, and may improve GPTQ quantization quality by keeping logit scale better-calibrated.	-0.0005	discard	1.079554	+0.007344	15970551	600.122000	582.800000	1533.000000	apg-loss-0850		Single-param change: F.cross_entropy(..., label_smoothing=0.02) on the training forward() only. TTT z-loss from exp_596 (1e-5*logsumexp^2) unchanged. Label smoothing target = 0.98*one_hot + 0.02/8192*uniform. Code size increase: ~20 chars, well within limit.
856	2026-04-25T23:26:44Z	ttt	750	750	ttt	Cosine-decay TTT SGD momentum over chunks (0.9→0.45, floored at 0.5×ttt_momentum) mirroring existing cosine LR decay — early chunks retain high momentum for smooth gradient direction, late chunks use lower momentum for responsive local adaptation; also removes exp_846's GC which caused +0.002 regression.	-0.001	discard	1.074941	+0.002731	15994888	600.029000	586.900000	1528.000000	apg-ttt-0850		cos_frac = 0.5*(1+cos(pi*ci/(num_chunks-1))); pg['momentum'] = ttt_momentum * max(0.5, cos_frac). At chunk 0: momentum=0.9; at chunk 6: momentum=0.45; at last chunk: momentum=0.45 (floor). Complements cosine LR which already decays ttt_lr toward 0. GC removal: exp_846 added GC to exp_750 baseline and got +0.002193 discard; this edit cleans that out. Net code bytes: 19824 vs 19815 (750 snapshot). Novel mechanism: cosine momentum scheduling not in prior TTT tree.
857	2026-04-25T23:30:00Z	reg	750	750	reg	Muon WD taper: linearly reduce Muon weight_decay from 1.0× to 0.5× during training fraction 0.70→1.00, so late warmdown adapts at a relaxed WD that lets weights settle at their true optimum rather than being pulled toward zero when gradient signal is already tiny.	-0.001	discard	1.082208	+0.009998	15998056	600.005000	590.600000	1525.000000	apg-reg-0850		Ported from PR #1729 (WD_TAPER_START_FRAC=0.70, WD_TAPER_FINAL_MULT=0.50). Muon applies WD as p.data.mul_(1-lr*wd), so effective WD is already LR-scaled; explicit taper further reduces wd during the final 30% of training. At warmdown (frac=0.28→1.0), the LR is already decaying; adding a WD reduction on top allows the model to find a lower-loss basin without over-constraint from the L2 penalty. Uses group.setdefault('base_wd') to snapshot original WD on first taper step. +454 code bytes vs baseline.
858	2026-04-25T23:31:10Z	eval	750	750	eval	Halve TTT chunk size 65536→32768: doubles adaptation granularity (finer local specialization per 32K-token segment), increases proportion of tokens scored from an adapted model (~98%→~99%), and gives a more gradual cosine LR decay across chunks — all at zero extra compute since total training steps are unchanged.	-0.001	eval_budget_overrun	1.073728			600.041000	604.000000	1536.000000	apg-eval-0850		With ~3M val tokens and chunk_size=32768, num_chunks≈100 (vs 50 for 65536). Each GPU rank handles my_chunk_seqs=2 sequences per chunk (vs 4). Total training steps: 100*2*4=800 (vs 50*4*4=800) — identical. The cosine decay now spans 100 chunks making LR stay higher mid-validation (at ci=50, LR=0.71*ttt_lr vs ~0 for the 50-chunk case), enabling continued active adaptation in the second half of the val set. Per-chunk minibatch is halved (2 seqs vs 4), which adds gradient noise but Nesterov momentum smooths this. Untried direction — no prior exp changed chunk_size.
859	2026-04-25T23:34:28Z	curr	750	750	curr	Gentle linear position-weight 0.9→1.1 on training CE loss (model.forward only; TTT and sliding eval bypass to forward_logits unaffected): upweights high-context positions aligned with stride-64 eval where ≥1984 context tokens are scored.	-0.001	discard	1.074366	+0.002156	15994106	600.081000	587.700000	1537.000000	apg-curr-0850		Old-stack LESSONS record: linear 0.9→1.1 kept on 1.0810 baseline (exp_156). First test on the new multi_596 stack. Weyl/golden-ratio variants all discarded per LESSONS (8 tries), so switching to loss-mask-per-position axis instead. Implementation adds 3 lines to model.forward(); TTT inner loop (line 1401) and sliding eval (line 1279/1360) both use forward_logits+manual CE and are untouched.
860	2026-04-25T23:53:19Z	tok	750	750	tok	Add learnable per-feature additive bias (embed_bias [512], init=0) after the embedding RMSNorm, completing the LayerNorm affine pair (γ=embed_scale inside norm + β=embed_bias after norm), allowing the model to learn a token-independent baseline activation per feature.	-0.0002	size_blocked	1.074181		16000802	600.018000	595.500000	1536.000000	apg-tok-0857		embed_bias [512, init=0] in scalar_params (lr=0.02, wd=0.005). The missing beta of LayerNorm: RMSNorm normalizes to unit RMS but cannot shift the mean; embed_bias provides a learned DC offset per feature. This persists in the residual stream — especially affects V projection (no RMSNorm on V) and MLP nonlinearity activation. Follows the pattern of successful input-side tok experiments (exp_190, exp_267, exp_298).
861	2026-04-25T23:53:20Z	curr	750	750	curr	Dynamic batch-size curriculum: half-batch (393K tokens) during the pre-warmdown phase (first 28% of wallclock = 168s), full-batch (786K) during warmdown — aligns batch noise with LR: high-LR exploration phase gets ~2x more gradient steps, warmdown gets precise signal.	-0.001	crash						638.000000	apg-curr-0860		Inspired by PR #875 dynamic batch curriculum (64→128→192 at wallclock fractions). Novel in our swarm: no prior curr trial changed global_tokens dynamically. Mechanism: during first 28% of 600s (168s), step_fn passes train_batch_tokens//2=393216 to next_batch → device_batch_size=24 (vs normal 48). Steps are ~2x faster, so ~0.56N steps in phase 1 + ~0.72N steps in phase 2 = ~1.28N total vs N normally. Boundary at warmdown_frac=0.72 threshold so the curriculum boundary coincides with the LR schedule phase transition. Warmup steps (elapsed_ms=0) also use half-batch (fine, state is reset after warmup). GPTQ calib at line 1012 is unaffected (not inside step_fn). Only code change: 2-line insertion in step_fn inner loop (+309 packed bytes). | torch.distributed.elastic.multiprocessing.errors.ChildFailedError: ============================================================ (train_gpt.py:1235 in eval_val)
862	2026-04-25T23:55:00Z	opt	750	750	opt	Disable Nesterov lookahead on Muon during warmdown (set nesterov=False when lr_scale<1.0): near convergence Nesterov overshoots by adding mu*buf on top of the gradient, while pure heavy-ball is more conservative and settles into flatter minima that quantize better under GPTQ int6.	-0.0002	size_blocked	1.115030		16000747	600.065000	584.500000	1526.000000	apg-opt-0857		"Single-line addition in step_fn: after setting group[""momentum""]=muon_momentum, add group[""nesterov""]=lr_scale>=1.0. This keeps Nesterov=True during warmup and stable phase (lr_scale==1.0) and switches to heavy-ball during all of warmdown (lr_scale<1.0). The momentum buffer accumulation is unchanged (buf.mul_(momentum).add_(g) always runs); only the step direction changes from g+mu*buf (Nesterov) to buf (heavy-ball). Theoretically motivated: Nesterov's correction factor 1+mu≈1.945 effectively amplifies steps during warmdown where the model is near-converged and smaller conservative steps would be preferable. Completely untested in 850+ trials on any warmdown-conditional Nesterov schedule for main training."
863	2026-04-25T23:55:01Z	meta	750	750	meta	TIED_EMBED_INIT_STD 0.005 → 0.006 (+20% UP, byte-neutral): genuinely untouched axis across 850+ trials. Sets std of tied tok_emb (4.2M params) which serves both input embedding AND output readout. With WARMUP_STEPS=20 fixed and the modern stack stacking 5 added regularizers (z-loss, attn_out_gate, scalar-freeze, GC, mm_blend cool), init magnitude shapes the first ~50 steps' Adam-warmup before regularizers can act; tied path init logit RMS rises from 0.113 to 0.136, modest discriminative signal.	-0.0001	discard	1.072400	+0.000190	15997296	600.130000	578.700000	1513.000000	apg-meta-0857		Single 1-char literal change at L147 (tied_embed_init_std default 0.005 → 0.006). +0 byte delta, zero new params, zero compile-graph/quant-path risk. Used only at module init (model._init_weights → nn.init.normal_(tok_emb.weight, mean=0, std=0.006)). Direction probe — bracket sign first; smallest-radius gentle UP. Standard practice (nanoGPT 0.02, GPT-2 0.025) is far higher; baseline 0.005 likely conservative inheritance from speedrun. Risk: at byte boundary 16.00 MB the 1-char delta is irrelevant but seed jitter on quant blob (~1-3 KB stdev) may tip size_block — not from this edit specifically. Expected magnitude ±0.0005 either way; probing direction.
864	2026-04-25T23:57:05Z	quant	750	750	quant	Frequency-weighted GPTQ Hessian: pre-scan calibration batches to count token frequencies, then up-weight top-100 most-frequent tokens by sqrt(2) in Hessian accumulation (H += (x*w)^T @ (x*w)), biasing GPTQ error minimization toward tokens that dominate average BPB.	-0.001	discard	1.074517	+0.002307	15384451	600.044000	589.800000	1530.000000	apg-quan-0858		Port of PR #1721 FreqGPTQ technique onto our baseline. Stores all 64 calibration batches, computes bincount frequencies, builds freq_w [vocab_size] with top-100 tokens set to sqrt(2.0). In make_hook, x is scaled by freq_w[tok_ids] before addmm_ when x.ndim==3. tok_emb output hook is left unweighted (target tokens not available). Zero artifact size impact. Expected: GPTQ reduces more error on high-frequency tokens, improving BPB since those tokens contribute proportionally more to the average.
865	2026-04-26T00:00:48Z	arch	750	750	arch	k_gain[Hkv,2] init=1.0 mirrors exp_475 q_gain[H,2] on K side	-0.0001	eval_budget_overrun	1.074554			600.134000	603.500000	1563.000000	apg-arch-0859		
866	2026-04-26T00:03:17Z	ttt	750	750	ttt	Focal loss (γ=2) for TTT inner objective: replace CE with per-token reweighted loss (_ce * (1-exp(-_ce))^2).mean() so adaptation concentrates on document-specific hard tokens rather than uniformly across easy+hard tokens.	-0.0003	discard	1.078642	+0.006432	15994402	600.152000	583.400000	1517.000000	apg-ttt-0860		Mechanism: after GPTQ quantization, hardest per-token positions are most informative for document-specific adaptation. Focal weight (1-pt)^2 with γ=2 downweights easy tokens (CE=0.5: focal=0.078 vs CE=0.5, 6.5× reduction) and barely reduces hard tokens (CE=5: focal=4.93 vs CE=5, ~1%). Z-loss still present for logit magnitude regularization. Net: more targeted TTT gradient toward document-specific outliers, less wasted on already-well-predicted tokens. Code change: replace 1-line loss with 2-line (_ce + focal) — +39 packed bytes total.
867	2026-04-26T00:03:39Z	loss	750	750	loss	Ramp TTT z-loss coefficient linearly from 2.5e-6 (epoch 0) to 1e-5 (epoch 3) via `1e-5*(_ep+1)/h.ttt_epochs`: epoch 0 gets 4× less constraint allowing max adaptation freedom, while final epoch retains the full 1e-5 stabilization; average regularization drops to 6.25e-6 vs current 10e-6.	-0.00005	discard	1.072324	+0.000114	15996854	600.055000	585.800000	1521.000000	apg-loss-0860		Rebased from exp_750. Epoch-ramping z-loss is mechanism-distinct from all tried variants: constant (keep), halved (size_blocked), doubled (eval_overrun), L1/L4/mismatch-gated (all discard). Formula: (_ep+1)/h.ttt_epochs scales from 0.25 at epoch 0 to 1.0 at epoch 3. Rationale: epoch 0 has largest gradient magnitude (fresh model, max CE signal) where z-loss over-constrains useful adaptation; later epochs are near convergence where z-loss mainly prevents scale drift before the next chunk.
868	2026-04-26T00:05:27Z	eval	750	750	eval	Cosine-decay TTT z-loss coefficient (1e-5→0 over chunks): cold early chunks get full logsumexp^2 regularization to stabilize logit magnitude, while late adapted chunks get near-zero z-loss so confident sharp predictions aren't penalized by stale regularization.	-0.001	eval_budget_overrun	1.075093			600.005000	603.900000	1536.000000	apg-eval-0860		Z-loss formula: 1e-5*(1+cos(pi*ci/(num_chunks-1)))*0.5 — same cosine schedule as cos_lr. At ci=0: 1e-5 (unchanged). At midpoint: 5e-6. At ci=num_chunks-2: ~0. Model logit softcap=30 prevents instability without z-loss. Only adds 49 chars inline; net +29 packed bytes. ci and num_chunks already in scope. No eval budget impact (same training steps). Novel: z-loss schedule hasn't been tried, only fixed-coefficient changes.
869	2026-04-26T00:06:10Z	reg	750	750	reg	Split looped-block attn WD into third Muon group: blocks [loop_start=3..loop_end=5] get muon_wd_loop=0.115 (matching MLP WD) vs base attn 0.095, since these blocks are called 3× per forward and receive proportionally more gradient signal (exp_141 principle, never folded into main lineage).	-0.0003	discard	1.072353	+0.000143	15994713	600.094000	587.300000	1526.000000	apg-reg-0860		Exp_141 showed looped-block WD boost was a keep (bpb=1.07659, parent exp_108). Main lineage bypassed it via 108→142. Now stacking onto exp_750 baseline: third Muon group for loop-attn params (blocks 3,4,5) at 0.115. Non-loop attn stays at 0.095, MLP stays at 0.115. Loop range detected at optimizer-build time via set(range(h.loop_start, h.loop_end+1)). Block idx extracted from named_parameters prefix. All dropout-based reg experiments failed; WD-split experiments are the only proven reg mechanism in this tree.
870	2026-04-26T00:59:42Z	arch	750	750	arch	ResFormer Value Residual Learning (arXiv 2410.17897, ACL 2025): per-layer learnable scalar λ blends current V with V_0 from layer 0 attention; init=0 → step-0 identical to baseline. Threaded through Block/Attention forward via v0 tuple-return.	-0.0008	crash						20.000000	apg-arch-0870		"Structurally distinct from saturated arch axes (q_gain, attn_out_gate, ln_scale). 11 new fp32 scalars (one per block.attn), routed to scalar AdamW group via ndim<2; auto-frozen by exp_491's TTT freeze-rule (numel<10000). GPTQ matrix calibration unchanged. Layer 0 identified at runtime by v0=None; subsequent layers blend `v_used = v_self + λ*(v0 - v_self)`. Looped layers 3-5 share λ across loop iterations naturally. XSA, attn_out_gate stack on top of v_used. Risk: tight 16MB cap (~+22B scalar payload + ~+400B code).</notes> </invoke> | torch.distributed.elastic.multiprocessing.errors.ChildFailedError: ============================================================ (train_gpt.py:1494 in step_fn)"
