exp_id	timestamp	specialist	parent_exp	baseline_exp	domain	hypothesis	expected_delta	status	val_bpb	delta_vs_best	artifact_bytes	train_s	eval_s	total_s	job_name	snapshot_path	notes
112	2026-04-22T10:10:07Z	curr	088	108	curr	Stratified (low-discrepancy) within-shard start indices: partition [0, max_start] into num_sequences equal bins, draw one uniform start per bin, then shuffle — gives minimum-spacing ≈ seq_len with no bin-collisions, sitting between packed (zero in-bin variance) and IID (Poisson clumping).	-0.0003	discard	1.079458	+0.002593	15994688	600.048000	764.952000	1488.000000	apg-curr-0102		Replaces the IID uniform starts at ShuffledSequenceLoader._reset_shard with a 1D Latin-hypercube / jittered-grid sampler. For <1-epoch training, Poisson clumping from IID wastes context-position coverage — stratified sampling guarantees every bin contributes one sample. This is a genuinely new curr knob: prior curr trials only touched stride (025/047/053/076), position masks (013/078), stratification-by-shard (067), or IID uniform (097 discard). None tried within-shard low-discrepancy start spacing. Size-neutral (same N starts, same tolist serialization). Expected: small improvement (-0.0003) — IID is already a reasonable baseline, but partial-epoch training amplifies clumping cost. If discard, curriculum signal is saturated at the sampling level and future curr attempts should explore loss-weighting or sequence-length schedules instead.
113	2026-04-22T10:11:18Z	ttt	088	108	ttt	Reset SGD momentum buffer at each TTT chunk boundary — stale momentum direction from prior chunk's gradients is distributionally misaligned with new chunk's text, and with ~4 SGD steps/chunk at momentum=0.9 the prior chunk's first-step gradient still carries 66% weight into the new chunk's first step.	-0.0003	discard	1.077680	+0.000815	15992449	600.019000	757.981000	1472.000000	apg-ttt-0103		Single-line structural change inside eval_val_ttt's chunk loop: clears optimizer.state (SGD momentum_buffer entries) at the start of each chunk's TTT phase. Zero runtime overhead (one defaultdict alloc per chunk). Untouched direction: all prior ttt trials were scalar tweaks (lr/momentum/epochs/clip/anchor/Nesterov) or structural freezes (exp_049 embeddings). Momentum buffer LIFETIME is novel. Principle: chunks correspond to distinct val-doc neighborhoods; cross-chunk momentum transfer pollutes the first few steps of each new chunk, where LR is already being decayed by the cosine-over-chunks schedule. Fresh momentum aligned with new chunk's gradients should give cleaner local adaptation. Expected -0.0003 via reduced early-chunk noise; worst case is a no-op if prior momentum was already near-zero due to the cosine decay.
114	2026-04-22T10:19:28Z	arch	088	108	arch	Extend partial-RoPE coverage rope_dims 32→48 (75% of head_dim=64, leaving 16 dims NoPE): continues exp_005's kept trajectory (16→32, Δ=-0.000788) at zero parameter cost, giving attention more positional signal while retaining some NoPE dims for position-invariant semantic matching.	-0.0003	size_blocked	1.089296		16001341	600.082000	745.918000	1455.000000	apg-arch-0108		Single-literal default change at train_gpt.py:130 (ROPE_DIMS 32→48). ROPE_DIMS is NOT harness-injected (only TTT_ENABLED/MAX_WALLCLOCK_SECONDS/SMOKE_TEST are) so the default literal is effective. Zero code-byte growth. Zero added parameters (rope_dims is a slice index into existing q/k dims). 48 is even (required by RoPE pairing), divides evenly into head_dim=64, and leaves a 16-dim NoPE tail per head. Rationale: exp_005's 16→32 keep (-0.000788) was the only arch keep in the tree; diminishing-returns argues the remainder of the 16-step budget (32→48) likely yields a smaller positive delta, while full 64-dim RoPE would lose any NoPE benefit entirely. Threat model: weight statistics unchanged so brotli model bytes should be stable (was ~15.78 MB for exp_088 stack); compile trace unchanged (just a slice shape constant). Risk is metric regression if the NoPE tail was doing useful work at 32 dims — in that case expected delta flips to ~+0.0002 and lands as discard, which is still a cheap signal for the next arch trial.
115	2026-04-22T10:32:39Z	quant	108	108	quant	Shrink GPTQ block_size 64→32 on exp_108: monotonic extension of the confirmed 128→64 winning direction — 2× more error-propagation events per matrix (16 vs 8 for 512-col weights) with smaller better-conditioned 32×32 Hinv sub-blocks.	-0.0002	discard	1.077062	+0.000197	15993722	600.130000	762.870000	1475.000000	apg-quan-0109		Single-literal change at train_gpt.py:933 (gptq_quantize_weight default block_size 64→32). Novel from current best: exp_035 proposed 128→32 but was harness_abort (no real signal), so 32 has never been evaluated. exp_108 kept 128→64 (Δ=-0.000079). block_size only affects quantization error-propagation logic, not stored tensor shapes, so size risk is minimal — expect model bytes to match exp_108 (~15.82 MB) within noise. Risk: smaller Hinv blocks may be numerically weaker for highly rank-deficient layer heads, but residual error from each block is still propagated into subsequent columns globally via the Hinv[i1:i2, i2:] update, preserving GPTQ's global compensation property.
116	2026-04-22T10:33:55Z	tok	088	108	tok	Introduce a learnable scalar logit_gain (init=1.0) multiplied into logits pre-softcap so the scalar-optimizer group can grow output magnitude without pulling on embed_wd=0.085 which compresses tied tok_emb rows for input regularization.	-0.0008	discard	1.080352	+0.003487	15981299	600.125000	759.875000	1472.000000	apg-tok-0103		Tied tok_emb serves dual roles: input directions (regularized by embed_wd=0.085) and output magnitude (uncapped except by logit_softcap=30). A scalar logit_gain under the scalar optimizer (LR=0.02, WD=0.02) gives gradient a clean knob for 'make logits sharper' without forcing embedding rows to grow, which would also inflate quantization entropy. Structurally different from tried tok trials: exp_099 used FIXED *3.0 (size_blocked at smoke stage due to entropy blow-up from day one); exp_023 was a per-vocab bias vector (harness_abort, no data); all prior init_std sweeps (exp_011/019/032/038) left both roles coupled. Init=1.0 means step-0 behavior is identical to baseline; any deviation is gradient-earned. 3 edits: (1) new nn.Parameter in GPT.__init__, (2) multiply in forward_logits pre-softcap, (3) append to scalar_params in Optimizers. New param is float32 scalar, ndim=0 so restore_fp32_params keeps it float32, GPTQ passthroughs it (numel<65536), EMA's state_dict-iteration catches it automatically.
117	2026-04-22T10:34:49Z	eval	088	108	eval	Sharpen scoring logits with T=0.95 (divide by 0.95) in eval_val_ttt score-first pass only; counters GPTQ int6 noise that flattens logit distribution. exp_044 showed T=1.05 smoothing HURT by +0.0026 — the opposite direction is untested.	-0.0010	discard	1.079705	+0.002840	15997270	600.145000	756.855000	1469.000000	apg-eval-0104		Single-site change at line ~1275 in eval_val_ttt: `logits` → `(logits / 0.95)` only inside the `torch.no_grad()` score-first block. TTT training forward at line ~1315 (loss = base_model(x, y)) is untouched, so TTT gradient dynamics and model state are unchanged. eval_val_sliding and pre-quant eval_val are also untouched — only the `quantized_ttt val_bpb` leaderboard metric is affected. Zero runtime cost (elementwise scalar div, fused into CE). Risk: if optimal T* is exactly 1.0 (not <1), this hurts symmetrically to exp_044 by a smaller magnitude (0.95 is half-step vs 1.05's mirror). Structurally different from recent eval work (103 TTT momentum, 101 TTT clip, 017 ttt_epochs).
118	2026-04-22T10:35:01Z	reg	088	108	reg	Targeted Muon weight-decay hike on c_q/c_k projections only (muon_wd_qk=0.15 vs global muon_wd=0.095); attention sharpness is already handled by learnable q_gain=5.25, so containing Q,K magnitudes specifically regularizes attention without shrinking V/O or MLP capacity — orthogonal to the global muon_wd=0.115 hike in exp_095 that hurt everything uniformly.	-0.0005	discard	1.077259	+0.000394	15991734	600.057000	761.943000	1475.000000	apg-reg-0106		Per-layer-type regularization: split Muon into two param groups. Group A = attention Q and K projections (blocks.*.attn.c_q, blocks.*.attn.c_k) with weight_decay=0.15. Group B = everything else (c_v, attn.proj, mlp.fc, mlp.proj) with weight_decay=0.095. Same LR scheduler applies since base_lr is set on both groups (line 849-850). V/O and MLP capacity preserved. Distinct from exp_095 (global +0.02 wd hike, Δ=+0.0035 discard) and exp_077 (same uniform hike, harness_abort). Targets the tension between q_gain=5.25 multiplying QK scores and high Q,K weight norms producing peaked softmax that is hard to quantize at int6.
119	2026-04-22T10:35:54Z	meta	108	108	meta	Revive exp_003's proven EMA_DECAY 0.9965→0.998 on exp_108's lineage — the exp_088/108 sub-tree forks from exp_005, bypassing exp_003's kept change, so 0.998 is absent from current baseline.	-0.0005	discard	1.080676	+0.003811	15996418	600.076000	743.924000	1455.000000	apg-meta-0113		Single-literal change at train_gpt.py:168 (EMA_DECAY default 0.9965→0.998). Zero code-byte growth; size-neutral. Verified lineage: current best exp_108 descends exp_088 → exp_017 → exp_005 → exp_000 (never through exp_003). exp_003 keep (-0.000776 vs exp_000) proved 0.998 is better; exp_006 showed 0.999 is much worse (+0.008841), so 0.998 is the known sweet spot — not a sweep extrapolation. EMA half-life grows ~197→346 steps (~9%→~15% of ~4500-step run), better aligned with the 0.58 warmdown fraction tail where ensemble averaging pays off. Orthogonal to exp_088's Muon momentum change and exp_108's GPTQ block_size change. Marginal δ likely smaller than the original -0.000776 due to stacking diminishing returns, hence conservative -0.0005 estimate.
120	2026-04-22T10:42:44Z	opt	108	108	opt	Disable Nesterov look-ahead in Muon: with momentum=0.99 + MuonEq-R row-norm, Nesterov's g+0.99*buf quantity is ~99% momentum-dominated, so NS orthogonalizes a doubly-amplified momentum vector; vanilla momentum orthogonalizes the true EMA-smoothed gradient (buf) for a cleaner rotation-consistent update.	-0.0008	discard	1.156336	+0.079471	15997324	600.016000	754.984000	1474.000000	apg-opt-0114		Single-arg edit at Optimizers.__init__ (line 838): add nesterov=False to the Muon(...) call. Muon.__init__ already accepts nesterov kwarg; default was True. Zero code-byte growth (comment + kwarg). Nesterov has NEVER been toggled in Muon in this tree (exp_031 was TTT SGD nesterov, harness_abort). Structurally different from the muon_momentum_warmup_{start,fraction} sweeps (exp_015/029/088/106/109). If this wins it reframes our mental model of MuonEq-R's update direction; if it loses we learn Nesterov is structurally load-bearing despite the 0.99 momentum regime.
121	2026-04-22T10:58:50Z	arch	108	108	arch	Re-apply exp_005's kept rope_dims 16 to 32 on the exp_108 snapshot which still carries rope_dims=16, compounding exp_005's proven gain with the later quant wins.	-0.0005	discard	1.077588	+0.000723	15992347	600.108000	768.892000	1479.000000	apg-arch-0115		Single-literal change at line 130 (ROPE_DIMS default 16 to 32). ROPE_DIMS is NOT harness-injected. exp_005 (rope_dims=32) was kept without size_blocking pre-quant-changes; exp_114 (32 to 48) hit size_blocked, so ceiling is between 32 and 48. Downside is a clean post-run size_blocked if GPTQ compresses rope_dims=32 rotated weights worse on top of block_size=64.
122	2026-04-22T11:00:23Z	curr	108	108	curr	Remove per-rank shard stripe (all_files[rank::world_size] → all_files): every rank now samples from the full shard pool, widening per-rank shard-origin diversity ~world_size× and eliminating the systematic per-rank topic/style bias; per-rank PCG64(rank) seeding keeps independent sampling.	-0.0004	discard	1.078255	+0.001390	15993088	600.031000	757.969000	1474.000000	apg-curr-0114		Single-line edit at ShuffledSequenceLoader.__init__: drop the [h.rank::h.world_size] slice. Novel in-tree — prior curr trials touched within-shard starts (097 IID, 112 LHS — both discard), stride (025/047/053/076), position masks (013/078), within-batch shard draw order (067 — discard). File-partitioning (cross-rank shard routing) has NEVER been touched. mmap is lazy so extra memmaps are address-space only; per-rank num_tokens cache cost is ~100 file-header reads at init (~tens of ms). The edit is loader-only; model/quant/eval paths unchanged, so byte budget is ~identical to 108 (+~500 bytes from comment). Expected: small negative delta by improving cross-rank gradient mixture and removing systematic topic bias in each rank's partial-epoch sample.
123	2026-04-22T11:00:24Z	ttt	108	108	ttt	Shrink TTT training mini-batch 32→1 (scoring stays at 32): with chunk=65536/seq_len=2048/world=8 there are only ~4 seqs per rank per chunk, so batch_seqs=32 collapses to ONE optimizer step per epoch — shrinking to 1 gives 4× more SGD updates per chunk (16 vs 4) at identical FLOPs, enabling actual per-chunk convergence.	-0.0010	eval_budget_overrun	1.078876			600.065000	787.935000	1499.000000	apg-ttt-0114		Novel untried TTT structural change. Prior TTT trials touched ttt_epochs (exp_014/017 keep), momentum (exp_039 discard), anchor coef (exp_027 abort), Nesterov (exp_031 abort), tok_emb freezing (exp_049 discard), and momentum-buffer reset (exp_113 discard) — NONE touched the training mini-batch. The TTT inner loop is gradient-step-starved: chunk=65536, seq_len=2048 → 32 seqs/chunk, 4 seqs/rank/chunk, batch_seqs=32 collapses to 1 step/epoch × 4 epochs = only 4 SGD updates per chunk. Going micro-batch=1 gives 16 updates/chunk (4× more) with zero extra FLOPs (GPU saturates on bs=1 seq=2048 anyway). All-reduce overhead adds ~1-2s total vs ~370s TTT — negligible. Scoring loop deliberately unchanged to preserve throughput. Expected gain: +noisier-but-more-frequent SGD lets each chunk actually reach its local minimum, sharpening per-chunk adaptation; analogous to why small-batch SGD beats large-batch at fixed compute in the classical generalization literature.
124	2026-04-22T11:00:53Z	loss	108	108	loss	Fixed-cap per-token CE winsorization at 7.0 nats: torch.clamp(ce, max=7.0).mean() zeros gradient from the extreme tail (~0.1-1% of tokens at steady state) to damp SGD variance from structurally unpredictable tokens (encoding garbage, random URL slugs).	-0.0005	discard	1.299998	+0.223133	15984482	600.143000	751.857000	1462.000000	apg-loss-0114		"Single-site edit at GPT.forward (line ~698): reduction=""mean"" -> reduction=""none"" followed by .clamp(max=7.0).mean(). Distinct from prior loss trials: (1) exp_070 proposed dynamic cap (3x batch_mean) but was harness_abort - infrastructure failure, not hypothesis rejection; this is the fixed-cap variant. (2) All 6 resolved loss trials (z-loss exp_009, smoothing exp_026/042, focal exp_054, pos-weight exp_034, first-64-mask exp_066, Poly-1 exp_111) reshape the CE objective globally; clamp is identity for ~99% of tokens (<=7 nats) so the central distribution is unchanged - only filters the outlier tail. exp_111 (Poly-1 gamma=1, focuses MORE on hard tokens) hurt +0.014, suggesting hard-tail is noise not signal. Early training (avg CE ~5 nats) cap=7 fires rarely; steady state (avg ~2.6) cap=7 fires on <1% tokens. Zero new params, ~50 code bytes, negligible compute. Safe under torch.compile - no Python-bool branching, no new tensors."
125	2026-04-22T11:03:14Z	quant	108	108	quant	GPTQ column ordering: importance-weighted (||W[:,c]||² · H_cc) descending instead of pure activation-order (H_cc), better ranking columns by their contribution to output variance under the GPTQ quadratic loss.	-0.0003	discard	1.077204	+0.000339	15992131	600.054000	756.946000	1479.000000	apg-quan-0120		"Single-literal change at train_gpt.py:941. Baseline act_order sorts columns by H.diag() descending; this variant multiplies by (W_orig**2).sum(dim=0) to get the weight-squared-norm × activation-variance product, which is the diagonal of W^T H W — the correct ""per-column importance"" proxy for the GPTQ objective tr((W-Q)·H·(W-Q)^T). Compression-neutral: same Q distribution across the matrix, only column visit order changes. Zero scale bytes delta. Novel in tree: prior quant trials modified block_size (108, 115, 035), damping (016), clip_sigmas (008), post-GPTQ scale refinement (004, 045) — column-ordering criterion itself has never been touched."
126	2026-04-22T11:06:03Z	meta	108	108	meta	BETA2 0.95→0.97 for the two AdamW groups (tied tok_emb + scalars: QK-gains, LN scales, skip gates/weights) — extends second-moment EMA half-life ~14→22 steps, an untouched knob across 120+ prior trials.	-0.0003	discard	1.077164	+0.000299	15995380	600.105000	763.895000	1477.000000	apg-meta-0120		Single-literal default change at train_gpt.py:160 (BETA2 0.95→0.97). Size-neutral, compile-safe, zero code-byte growth. Affects optimizer_tok (tied embedding, LR=0.03) and optimizer_scalar (LR=0.02); optimizer_head is inactive (tie_embeddings=True → lm_head=None). Untouched by any prior trial — BETA1, BETA2, ADAM_WD, SCALAR_LR, WARMUP_STEPS all never touched in meta history. Conservative move (0.97 vs GPT-2's 0.98) to avoid straying too far from nanoGPT-speedrun's 0.95 baseline. Dirty workdir (had stale EMA 0.998 + muon_wd 0.065 from aborted prior sessions) was rebased to exp_108 first. muon_beta2 field exists at line 164 but is dead (Muon constructor doesn't read it) — not changing.
127	2026-04-22T11:08:19Z	eval	108	108	eval	Halve TTT_CHUNK_TOKENS 65536→32768 to double TTT adaptation granularity: ~2× as many score-then-train chunks over the val sequence, so each score-first pass runs on a model adapted on more recent context (closer spatial locality between adaptation data and scored tokens). Total SGD step count is ~constant (num_chunks doubles, chunk_seqs halves), but update/scoring cadence is 2× finer.	-0.0003	eval_budget_overrun	1.078945			600.090000	787.910000	1499.000000	apg-eval-0120		Single-literal default change at train_gpt.py:180 (TTT_CHUNK_TOKENS 65536→32768). Zero code-byte growth. ttt_chunk_tokens is an untouched knob across the entire tree — no prior exp has modified it. Aligned with the kept TTT-adaptation direction (exp_017 epochs 3→4 Δ=-0.000413, exp_014 Δ=-0.000278). Cosine-over-chunks LR schedule (line 1301, `cos_lr = ttt_lr * 0.5 * (1 + cos(π * ci / (num_chunks-1)))`) automatically adapts resolution: finer grid gives smoother LR decay. Risk: chunk-boundary overhead (allreduces, SGD state bookkeeping) roughly doubles, but per-chunk work halves, so eval wall should be ~flat. If baseline eval was comfortably under 600s, this stays safe.
128	2026-04-22T11:24:03Z	opt	108	108	opt	Shrink muon_momentum_warmup_fraction 0.22→0.15: extends the peak-LR+peak-momentum window from 6% to 13% of training (frac 0.15→0.28), pushing exp_088's proven direction (0.33→0.22 kept Δ=-0.001115) further.	-0.0005	discard	1.077328	+0.000463	15997184	600.063000	749.937000	1461.000000	apg-opt-0121		Single-literal change at train_gpt.py:157 (MUON_MOMENTUM_WARMUP_FRACTION default 0.22→0.15). Zero code-byte growth; size-neutral. Direction is monotonic with exp_088 (0.33→0.22, Δ=-0.001115). Rationale: warmdown_frac=0.72 fixes warmdown start at frac=0.28; with momentum warmup ending at frac=0.22, the peak-LR+peak-momentum overlap was only 6% of training. Shrinking to 0.15 yields ~13% (the actual high-signal learning phase where both LR and momentum are maxed). Risk of early destabilization is low: the 20-step CE warmup (~12s) happens BEFORE the momentum ramp has meaningful influence; by step ~20 elapsed_ms is still ≪ 15% of 600s (~90s). Comment block at line 153–156 updated to reflect new rationale.
129	2026-04-22T11:25:23Z	reg	108	108	reg	Denoising-style input-embedding Gaussian noise (std=0.005) on hidden state only, during training mode; x0 long-range residual stays clean so the network learns to denoise back toward the unperturbed embedding reference.	-0.0005	discard	1.077242	+0.000377	15994827	600.074000	759.926000	1472.000000	apg-reg-0120		Single-site edit in GPT.forward_logits (after x0=x capture): `if self.training: x = x + torch.randn_like(x) * 0.005`. Novel direction in reg domain: exp_012 (token REPLACEMENT @3%) and exp_040 (MLP activation dropout @0.05) both regressed heavily — this is a much milder (~0.5% additive perturbation on unit-norm rms-normed embeddings) and targets a different layer (input representation vs hidden activation / vocab tokens). x0 is deliberately captured BEFORE noise so that the parallel-residual x0 injection at every block acts as a clean teacher signal — the network must denoise noisy x back toward clean x0. No new params, ~2 code bytes growth. TTT's training phase will also fire noise (base_model.train() during SGD adapt), which is aligned with TTT regularization goals. Risk: model is demonstrably noise-sensitive (exp_040's -0.01 regression), so std=0.005 was chosen well below that threshold.
