exp_id	timestamp	specialist	parent_exp	baseline_exp	domain	hypothesis	expected_delta	status	val_bpb	delta_vs_best	artifact_bytes	train_s	eval_s	total_s	job_name	snapshot_path	notes
000	2026-04-22T01:36:09Z	baseline			baseline	1.0810 SOTA reference	0	baseline	1.0810								seed / 1.0810 reference
001	2026-04-22T01:44:26Z	arch	000	000	arch	Value Residual Learning: per-attention learnable gate (init=0) blends layer-0's V into each later attention's V, expected to improve multi-layer value routing at near-zero param cost.	-0.002	crash						34.000000	apg-arch-0001		Adds nn.Parameter(zeros(1)) to each CausalSelfAttention (v_residual_gate). CausalSelfAttention.forward now returns (proj, v_out); Block.forward threads v_first through. GPT.forward_logits initializes v_first=None and propagates. Init at 0 → forward is identical to baseline at step 0; scalar optimizer trains the gate up. Gate shared across looped invocations of the same block, which matches DeepSeek-V3 VRL semantics. XSA uses v_used (post-blend) to stay consistent with what attention actually saw. Params: +11 scalars (~44 B fp32). | torch.distributed.elastic.multiprocessing.errors.ChildFailedError: ============================================================ (train_gpt.py:1401 in step_fn)
002	2026-04-22T02:03:03Z	opt	000	000	opt	Replace linear LR warmdown with cosine warmdown over the same 20% window (same integral, C¹-smooth transitions — avoids the derivative kink at warmdown entry and softens the LR approach to zero through the late-QAT flip)	-0.002	keep	1.080423	-0.000577	15992536	600.146000	710.854000	1422.000000	apg-opt-0001	snapshots/002_opt	Only change: lr_mul() in train loop. Stable phase identical; within warmdown window compute x=(frac-(1-wd))/wd and return 0.5*(1+cos(pi*x)). Integral 0.5*warmdown_frac matches linear so baseline peak LRs (matrix 0.022, scalar 0.02, embed 0.6, head 0.008) should not need re-tuning. Motivation: (a) linear warmdown has a discontinuous derivative at frac=1-wd (LR drops from 1.0-rate constant to -1/wd slope); cosine is C¹ there. (b) late-QAT flip introduces a loss-landscape shift; cosine's soft LR approach to 0 dampens the optimizer response during QAT settling. (c) Muon momentum is at peak 0.99 in this region — smoother LR reduces buffer-driven overshoot under high momentum. No other knobs touched.
003	2026-04-22T02:05:15Z	meta	000	002	meta	Bump EMA decay 0.9965→0.998 to widen averaging window into more of the 72% warmdown tail.	-0.001	keep	1.079647	-0.000776	15992067	600.049000	718.951000	1440.000000	apg-meta-0001	snapshots/003_meta	Current warmdown_frac=0.72 is an unusually long LR cooldown. At ema_decay=0.9965 the EMA half-life is ~198 steps (~4-5% of ~4500-step run), so EMA only averages the last ~1000 steps — a small slice of the stable low-LR regime. Raising to 0.998 (half-life ~346 steps, ~8% of run) captures roughly the last ~1700 steps, still well inside the warmdown region and avoiding the higher-LR pre-warmdown updates. Small-radius meta tweak; expected -0.001 bpb with minimal risk. If this regresses, signal is that faster EMA (e.g. 0.995) is preferred given this warmdown shape.
004	2026-04-22T02:05:27Z	quant	000	003	quant	Per-row MinMSE scale refinement in GPTQ: 11-point α-grid search around the clip_sigmas heuristic (α=1.0 included, so ≥ baseline fidelity); zero byte overhead since scale storage shape is unchanged.	-0.003	size_blocked	1.070844		21797963	600.054000	708.946000	1420.000000	apg-quan-0001		Baseline uses s = clip_sigmas * row_std / clip_range, a fixed heuristic applied uniformly to every row. Real weight rows differ in kurtosis/skew. I scan α ∈ {0.4, 0.55, 0.7, 0.82, 0.9, 0.96, 1.0, 1.04, 1.1, 1.2, 1.35} per row and keep the α that minimises |w − q·s|² (direct weight MSE). Since α=1.0 is in the grid, worst-case is matching baseline. No change to storage layout (still fp16 per-row s) → model_bytes unchanged; code grows by ~20 lines. Runs on CPU in <3s across all matrices. Hessian-aware error correction in the subsequent GPTQ loop is untouched — this only refines the quantization codebook step-size. Standard trick in AdaQuant / OBQ literature; high-confidence small bpb win.
005	2026-04-22T02:16:33Z	arch	000	003	arch	Increase partial RoPE coverage: rope_dims 16→32 (half of head_dim=64, the common 50/50 RoPE/NoPE split), giving attention more positional signal at zero parameter cost; aggressive QK-gain=5.25 should benefit more from sharper positional anchoring.	-0.003	keep	1.078859	-0.000788	15999298	600.120000	719.880000	1438.000000	apg-arch-0002	snapshots/005_arch	Also reverts exp_001's crashed VRL (tuple-returning attn + v_first threading) back to baseline attention, since exp_000 has no snapshot and my workdir inherited the crashed state. The only semantic change vs baseline is Hyperparameters.rope_dims default 16→32. Rotary module re-sizes inv_freq buffer; NoPE tail now 32 dims (was 48). No param count change, no latency change, no compile-graph topology change.
006	2026-04-22T02:32:07Z	meta	003	005	meta	Continue the EMA-decay trajectory: 0.998→0.999 extends half-life from ~346 to ~693 steps (~7.7%→~15% of run), better aligning the Polyak average with the 72% cosine warmdown tail.	-0.0004	discard	1.087700	+0.008841	15993776	600.076000	712.924000	1421.000000	apg-meta-0005		exp_003 bumped ema_decay 0.9965→0.998 (+0.0015) for -0.000776. Polyak theory: with cosine warmdown at warmdown_frac=0.72, optimal EMA half-life ≈ warmdown_length/2 ≈ 36% of run (decay≈0.9996). 0.998 is still ~5x short of that. Bisection step +0.001 to 0.999 is ~2/3 the size of the prior winning step; still conservative vs theoretical optimum, so expecting smaller but same-sign gain. Risk: over-staling if LR-near-zero tail dominates, but cosine warmdown puts negligible weight updates in the last ~10% anyway.
007	2026-04-22T02:33:19Z	opt	002	005	opt	Reset EMA accumulator at warmdown entry so the final averaged weights reflect only the warmdown phase (LR decaying, refining around local min) — avoids dragging in pre-warmdown high-LR exploration noise.	-0.001	discard	1.080779	+0.001920	15993170	600.138000	718.862000	1433.000000	apg-opt-0005		Only change to train_gpt.py: (1) add `warmdown_ema_reset_done=False` flag near ema_state init; (2) wrap the per-step EMA update so that on the first step where `frac >= 1 - warmdown_frac`, ema_state is hard-reset to current base_model weights (no decayed blend), then subsequent steps resume standard EMA with unchanged decay 0.9965. Rationale: EMA starts at step 0 tracking random init; with warmdown_frac≈0.2 the tail `0.9965^900 ≈ 4.2%` of final EMA mass comes from pre-warmdown weights (high-LR exploration phase). Resetting at warmdown entry makes the final averaged state a pure EMA over only warmdown-phase snapshots, which have monotonically shrinking step size and should Polyak-average to a tighter minimum. Risk: if warmdown_frac is ~0.72 (production default from Hyperparameters class), pre-warmdown contamination is already ~1e-5 so the reset is essentially a no-op — expected delta would be ≈0 not -0.001, but no harm. No new params, no new compute, zero size impact.
008	2026-04-22T02:33:56Z	quant	003	005	quant	GPTQ clip_sigmas: per-LAYER α-grid search (single α∈{0.5,0.7,0.85,1.0,1.15} per layer, shared by all rows) minimizing diag(H)-weighted MSE. Unlike exp_004 per-row MinMSE (size_blocked: heterogeneous scales inflated brotli entropy), uniform per-layer scaling keeps the quantized code histogram shape near-baseline so brotli bytes stay flat, while still capturing cross-layer kurtosis that a single global clip_sigmas=12.85 misses.	-0.003	size_blocked	1.072741		20418226	600.105000	704.895000	1410.000000	apg-quan-0005		gptq_quantize_weight now sweeps 5 α values per layer over the (already-permuted) W_perm, using diag(H)-weighted reconstruction MSE as the proxy loss (matches GPTQ objective before block propagation). Storage unchanged (per-row fp16 scales; α folds into s). α=1.0 in grid so this can't regress from baseline. Compute cost ~5× direct-MSE eval per layer — sub-second total. Expected gain is a fraction of exp_004's -0.01 (per-row granularity abandoned) but without the entropy blowup that triggered size_blocked.
009	2026-04-22T03:09:15Z	loss	005	005	loss	Add PaLM-style z-loss (α=1e-4 * logsumexp(logits)^2.mean()) to training CE to regularize log-partition toward 0; training-only, no inference cost.	-0.0015	discard	1.082039	+0.003180	15986894	600.088000	730.912000	1449.000000	apg-loss-0009		First loss-domain trial. forward() now returns ce_loss + 1e-4*logsumexp(logits)^2.mean(). Rationale: (1) PaLM/Gemma/ST-MoE canonical choice α=1e-4; (2) logit_softcap=30 caps per-logit magnitude but log-Z can still drift ~±9 given vocab=8192, so z-loss provides a meaningful stabilization signal; (3) eval uses forward_logits→cross_entropy directly (lines 1165/1237/1536), bypassing forward(), so z-loss is strictly training-only and never contaminates val_bpb; (4) zero new params → no artifact-size impact. Expected val_bpb drop: 0.001–0.003 from better-conditioned logit geometry that persists through GPTQ int6 quantization (more uniform logit scale is typically friendlier to post-training quantization).
010	2026-04-22T03:10:13Z	opt	005	005	opt	Cosine-cool Muon momentum during warmdown (0.99→0.92) in lockstep with the LR cosine curve — lets the trajectory oscillate symmetrically around the local minimum where EMA extracts its signal.	-0.0004	keep	1.078750	-0.000109	15992484	600.049000	713.951000	1423.000000	apg-opt-0009	snapshots/010_opt	Modifies muon_momentum_frac() only. During warmup (first 33%) behavior is unchanged: warmup_mult ramps 0→1 so momentum goes warmup_start(0.92)→muon_momentum(0.99). Stable phase (frac<1-warmdown_frac=0.28): warmup_mult=1, returns 1.0 → momentum=0.99 as before. Warmdown phase: multiplies warmup_mult(=1) by cosine_cooldown(x) where x∈[0,1] over the warmdown window; at end x=1, cooldown_mult=0 → frac_mm=0 → momentum=warmup_start=0.92. Update magnitude in Muon is lr*polar(g), which is already dominated by lr_mul→0 at tail; lowering momentum only changes DIRECTION (less stale inertia, more current-gradient-weighted), not magnitude. Complements exp_003 (wider EMA window) and exp_002 (cosine warmdown): all three schedule-shape wins stack conceptually. No new env vars, code delta ~13 lines, wallclock impact 0.
011	2026-04-22T03:10:58Z	tok	005	010	tok	Raise tied_embed_init_std 0.005→0.02 (GPT-2/NeoX standard) so tied embedding rows start at norm ~0.45 instead of ~0.11, giving initial logits enough magnitude to encode token identity without saturating softcap=30.	-0.0005	size_blocked	1.079792		16007228	600.101000	720.899000	1433.000000	apg-tok-0009		First trial in tok domain. Current 0.005 gives init-time logit std ~0.11 (effectively uniform softmax, CE≈log(8192)=9.01). 0.02 gives ~0.45 — meaningful token-identity signal but far below softcap=30's saturation zone. Tied_embed_lr=0.03 still adapts quickly from either start. RMS-norm after tok_emb lookup means the INPUT signal is scale-invariant, so this change cleanly affects only the output-logit init path. Single-literal edit, no structural/size impact; model bytes should drift by &lt;200 B after brotli-11.
012	2026-04-22T03:11:15Z	reg	005	010	reg	Input-token noise regularization: in train loop, replace 3% of input tokens per microstep with uniform-random vocab ids (targets unchanged) — word-dropout style implicit reg expected to flatten minima (better int6 GPTQ reconstruction) and reduce overconfidence (larger TTT adaptation signal).	-0.0005	size_blocked	1.086500		16005982	600.060000	720.940000	1436.000000	apg-reg-0009		First reg-domain trial in this tree. Baseline has strong WD (muon=0.095, embed=0.085, adam=0.02), grad_clip=0.3, logit_softcap=30, but zero dropout/stochastic-depth/data-level noise. Added INPUT_TOKEN_NOISE_PROB hyperparam (default 0.03) and injection block right after next_batch() in step_fn. torch.rand + torch.where; generated on-device, no host sync, no eval-path cost (noise only in train forward). Only y-targets are unchanged so the LM loss still scores ground-truth next-token prediction under corrupted context — classic AWD-LSTM word-dropout semantics. 3% chosen conservatively for the small-LM-underfit regime (vs typical 10-15% in larger-budget regimes).
013	2026-04-22T03:12:22Z	curr	005	010	curr	Mask CE loss on first 32 positions of each train sequence so gradient focuses on the high-context regime (≥1984 ctx) that dominates eval under sliding-window stride=64.	-0.0010	size_blocked	1.080840		16001538	600.106000	729.894000	1446.000000	apg-curr-0009		Only change: GPT.forward now computes CE with reduction='none', reshapes to (B,T), and returns nll[:, 32:].mean(). Motivation: at eval, virtually every scored token has ≥ context_size = seq_len - eval_stride = 1984 tokens of prior context (first window scores positions 0..31 but is ~1 window out of many thousand). Training currently loses ~1.5% of gradient budget to positions 0..31 whose prediction is dominated by unigram statistics. forward_logits is untouched, so eval_val_sliding / eval_val_ttt (primary metric path) still score all positions as before — the mask only changes the loss seen by model.forward during train-time SGD and TTT adaptation. Cost: one extra reshape, one slice, one mean — negligible vs an attention pass. Risk: if those early positions actually matter (e.g. seed the LM's unigram prior), val_bpb could drift up; at K=32 on T=2048 the fraction is small enough that worst case should be within ±0.001.
014	2026-04-22T03:13:07Z	ttt	005	010	ttt	Increase TTT inner-epoch count 3→4 per chunk: more SGD refinement per chunk under the same cosine-over-chunks LR and anchor-pullback regularization; adaptation cost per chunk is ~1 small batch per rank so +1 epoch adds only a handful of seconds across ~150 chunks, well within the eval budget.	-0.0015	keep	1.078472	-0.000278	15999344	600.056000	756.944000	1475.000000	apg-ttt-0009	snapshots/014_ttt	ttt domain has zero prior trials; ttt_epochs=3 was a default, never explored. Cosine-over-chunks LR decay and anchor coef 0.01 already cap drift, so the extra epoch should deepen per-chunk adaptation without destabilizing later-chunk scoring. Only change: the literal default on line 175 (ttt_epochs default 3→4). Env var TTT_EPOCHS not harness-injected, so default takes effect.
015	2026-04-22T03:13:35Z	meta	005	014	meta	Bump Muon momentum warmup START 0.92→0.94 to narrow the 0.92→0.99 ramp (typical Muon setups use 0.95), smoothing early high-LR updates without touching the already-tuned peak or ramp-fraction.	-0.0004	discard	1.080282	+0.001810	15994812	600.116000	718.884000	1437.000000	apg-meta-0009		"Only change: Hyperparameters.muon_momentum_warmup_start default 0.92→0.94 (line 152). Ramp structure preserved: still ramps over muon_momentum_warmup_fraction=0.22 of budget, still peaks at muon_momentum=0.99 before warmdown entry at frac=0.28. The starting value 0.92 has never been touched and is unusually low vs typical Muon configs (0.95). Narrowing start→peak range (7pt→5pt) gives more consistent high-momentum updates through the early high-LR exploration phase, aligning with the ""smoother averaging"" theme that won exp_002 (cosine warmdown) and exp_003 (EMA 0.998 widening), but applied to a previously untouched knob — avoiding the EMA-saturation trap exp_006 hit at 0.999. Zero param change, zero compile-topology change, zero size change. Single-line numeric edit. If this regresses, signal is that Muon benefits from noisier early updates (high variance, responsive gradients) and the 0.92 start is tuned as intended."
016	2026-04-22T03:14:35Z	quant	005	014	quant	Reduce GPTQ Hessian damping from 0.01 → 0.003 (×3.3 less ridge) so H_inv better reflects true second-order curvature, improving off-diagonal error compensation; affects only error propagation (not scale/clip/bits), so artifact bytes are unchanged.	-0.0015	discard	1.078826	+0.000354	15995944	600.037000	725.963000	1450.000000	apg-quan-0009		Rebased to exp_005. Only change: damp = 0.003 * H.diag().mean() (was 0.01). Rationale: GPTQ's original 0.01 is conservative for noisy Hessians from limited calibration; modern low-bit quant (QUIP, SpQR) uses 0.001-0.005. With 64 calibration batches (real run) the Hessian is well-posed, so the 1% ridge over-damps and weakens the off-diagonal error-compensation term Err @ Hinv. Lower damping → more faithful H_inv → better per-column correction of quant noise in later columns. Size-safe: int code range, per-row scale, and bit width are all unchanged, so compressed bytes should be within noise of exp_005. Avoids the size-blocked trap that hit both exp_004 (per-row MinMSE) and exp_008 (per-layer α-grid) — both of which tightened effective quantization and grew code entropy.
017	2026-04-22T03:15:51Z	eval	005	014	eval	Increase TTT epochs per chunk 3→4: more per-chunk SGD steps let the model adapt more thoroughly on early/high-LR chunks (cosine decay across chunks means late chunks already have small LR), improving scoring of subsequent chunks. Score-first order preserves legality.	-0.0012	keep	1.078059	-0.000413	15997973	600.048000	757.952000	1475.000000	apg-eval-0009	snapshots/017_eval	Only change: ttt_epochs default 3 → 4 on line 175. No envvar collision (harness doesn't set TTT_EPOCHS). Score-first in eval_val_ttt is unchanged, so legality holds: scoring on chunk i uses weights adapted only on chunks 0..i-1. Grad clip 1.0 + momentum 0.9 + cosine LR schedule per chunk should keep the extra epoch stable. Eval-time cost: +33% of TTT adaptation fwd+bwd, which is a minority of total eval wall (scoring dominates); should fit well within the 600s eval cap.
018	2026-04-22T03:17:01Z	arch	005	017	arch	Add learnable per-channel gain to attn_norm and mlp_norm RMSNorms (LLaMA-style weighted RMSNorm) in every Block; final_norm left weightless since it's absorbable into the tied head.	-0.0005	discard	1.083816	+0.005757	15869182	600.127000	739.873000	1457.000000	apg-arch-0009		Baseline uses weightless RMSNorm (F.rms_norm without weight). Standard LLM arch uses learnable gain. For attn_norm: gain on x_in before c_q/c_k/c_v — Q and K get re-RMSNormed so gain is absorbed there, but on V path it's absorbable into c_v weights yet trains via AdamW/scalar_lr rather than Muon, giving different dynamics. For mlp_norm: SwiGLU silu(w_gate(x))*w_up(x) is non-linear in input scale, so a tied per-channel row-scaling on both w_gate and w_up is a constrained reparameterization the Muon-trained linears can't easily learn at the scalar LR. Cost: 11*2*512=11264 fp32 params; stored as fp16 passthrough in GPTQ (~22KB raw, ~12-15KB after brotli). Well within ~180KB headroom. Only mutates RMSNorm class and Block norm construction; attn forward and mlp forward unchanged. Keeps attn_scale, mlp_scale, resid_mix intact. final_norm left as RMSNorm() since (a) gain there is linearly absorbable into the lm_head/tied tok_emb (truly redundant) and (b) final_norm lives outside base_model.blocks so adding a weight would create an unoptimized param.
019	2026-04-22T03:41:46Z	tok	010	017	tok	Equi-row-norm (sphere) init for tied tok_emb: every vocab row starts with identical L2 norm = std*sqrt(d), preserving total mass (compression-neutral vs Gaussian) while eliminating the heavy-tail near-zero rows that under-receive gradient for rare tokens.	-0.0005	discard	1.079662	+0.001603	15992920	600.068000	713.932000	1423.000000	apg-tok-0017		Current best (exp_010) inits tok_emb ~ N(0, 0.005²); under a 8192×512 Gaussian, ~6% of rows have norm < 0.75 * expected (very rare tokens start near-zero logit direction, get tiny gradient in 20-step warmup). Structural change (NOT a magnitude change like exp_011 which was size_blocked at std=0.02): normalize each row and rescale to the SAME expected Gaussian magnitude target_row_norm = 0.005*sqrt(512) ≈ 0.113. Total Frobenius norm ≈ identical → GPTQ int8 + brotli compression profile should track baseline, avoiding size_blocked. Input path is unchanged (F.rms_norm immediately after tok_emb wipes per-row magnitude); effect is purely on the tied output head's initial logit uniformity. Expected: marginally better rare-token fit during first ~500 steps propagating to slightly lower final bpb.
020	2026-04-22T04:21:09Z	quant	017	017	quant	Post-GPTQ per-row MSE-optimal scale refinement: given fixed int6 codes Q, replace heuristic s=clip_sigmas*row_std/clip_range with closed-form s*=<w,q>/<q,q> per row. Size-neutral (codes unchanged → brotli input unchanged).	-0.0008	harness_abort							apg-quan-0020		At clip_sigmas=12.85 most int6 codes cluster in [-3,+3] far from ±31 rail, so the heuristic scale is biased high for reconstruction. Closed-form per-row LS scale minimizes ||w-s*q||^2 exactly. Differs from exp_004/008 α-grid attempts which changed clip_sigmas *before* GPTQ (altering codes → entropy up → size_blocked). Here int codes are frozen and only the per-row FP16 scale tensor is updated — identical shape, identical brotli input, identical artifact bytes. [QUARANTINED 2026-04-22T08:19:36Z: supervisor-synth failed after internal CLI name-cache miss; job_id-based poll fallback added post-hoc.]
