exp_id	timestamp	specialist	parent_exp	baseline_exp	domain	hypothesis	expected_delta	status	val_bpb	delta_vs_best	artifact_bytes	train_s	eval_s	total_s	job_name	snapshot_path	notes
542	2026-04-24T09:20:15Z	meta	491	538	meta	Lower muon_momentum_warmup_fraction 0.22 to 0.20 (−9% DOWN): untested gentle-DOWN gap in exp_088's proven faster-ramp direction; prior DOWN probes (0.22 to 0.15/0.16 on older lineages) over-shot, UP probe (exp_515 0.22 to 0.25 discard +0.000114) hurt slightly — optimum may sit at 0.20 under current post-491 stack.	-0.00005	size_blocked	1.074770		16003098	600.040000	560.700000	1463.000000	apg-meta-0537		Single-literal default change at train_gpt.py:157 (MUON_MOMENTUM_WARMUP_FRACTION 0.22 to 0.20). Size-neutral, compile-safe. Peak-LR+peak-momentum window grows from 6pp (0.22 to 0.28) to 8pp (0.20 to 0.28) of wallclock. exp_088 (0.33 to 0.22 kept delta=-0.001115) established that faster ramp helps; exp_191's 0.22 to 0.16 discard was on a much older lineage (pre-exp_336/377/475/491 stack) and went 3x larger step than this probe. Given exp_515's 0.25 UP discard (+0.000114) and exp_088's DOWN keep, a gentle further DOWN probe tests whether post-491 optimum has drifted to 0.20.
543	2026-04-24T09:20:42Z	loss	491	538	loss	Frequency-stratified per-class CE weight via F.cross_entropy(weight=linspace(0.9,1.1,V)) — upweights rare tokens (high id = rare in SP8192 freq-sorted vocab). Uses PyTorch's built-in weighted reduction='mean' which divides by sum(w[y]) for exact mean-preservation — first clean probe of this axis (exp_518/512 were both size_blocked, exp_272 crashed).	-0.0001	size_blocked	1.075515		16001331	600.301000	564.100000	1476.000000	apg-loss-0537		Single-site edit in GPT.forward (L799-803). Replaces plain F.cross_entropy(reduction='mean') with weight=torch.linspace(0.9, 1.1, V) per-class. Mean-preserving (PyTorch divides by sum(w[y]) under reduction='mean'). Zero artifact bytes (weight is lazily built each forward, not a persistent buffer). +52B code. Novel vs prior manual-reweight attempts that hit size_blocked (exp_518 id-linear, exp_512 rsqrt-rownorm) or crashed (exp_272 in-batch freq). Structurally orthogonal to position-weighted CE family (which is saturated on current best).
544	2026-04-24T09:22:16Z	opt	491	538	opt	Schedule ema_decay in lockstep with LR warmdown: 0.9965 at peak-LR, rising to 0.998 as scale to 0. Weight-space analog of exp_010/exp_324 (cool Muon momentum during warmdown). exp_393 static 0.998 regressed +0.001989; schedule confines 0.998 to tail only.	-0.0002	size_blocked	1.074789		16000458	600.085000	559.800000	1464.000000	apg-opt-0537		Single-site edit at the EMA update in train_model near line 1607. Computes ema_decay_t = ema_decay + (0.998 - ema_decay) * (1.0 - scale) per step. Bit-identical at peak-LR (scale=1.0). No new hparams.
545	2026-04-24T09:22:57Z	quant	491	538	quant	Switch GPTQ quantization scale from per-row (W.std(dim=1)) to per-column (W.std(dim=0)): one fp16 scale per INPUT feature instead of per OUTPUT row. Natively aligned with the Hessian-weighted objective (quadratic in the col/input axis) and shrinks tok_emb scale vector from 16 KB → 1 KB (per-row was 8192 fp16, per-col is 512 fp16) — a novel untried axis in the quant tree.	-0.0003	size_blocked	1.074166		16008278	600.038000	563.100000	1474.000000	apg-quan-0539		Two-site edit. (1) gptq_quantize_weight: replaces `row_std = W_orig.std(dim=1)` and scalar `sf` with `col_std = W_orig.std(dim=0)`, `sf_full = s.float()` indexed inside the inner loop by `sf_full[perm[i1+j]]` so the correct original-column scale is applied when processing each permuted column. Returned scale `s` is in original (unpermuted) column order. (2) dequantize_mixed: broadcast per-col scale along the LAST dim (`view_shape = (1,)*(ndim-1) + (cols,)`) instead of the former per-row broadcast along dim 0. Motivations: (a) GPTQ's loss ||W-W_q||²_H is a quadratic form over the input/column axis — per-col scale lets each column's quant resolution track that column's own weight-magnitude distribution, which is more directly aligned with which Hessian entry that column couples into; (b) size: the 8192×512 tok_emb scale vector shrinks from 16 KB (8192 fp16) to 1 KB (512 fp16), a ~15 KB raw savings before brotli on the largest single contributor to the artifact; on the balanced MLP up/down pair (c_fc 2048×512 and c_proj 512×2048), one saves 3 KB per block and the other pays 3 KB, so those cancel across 11 blocks. Never tried — every prior row_std refinement probe (exp_055/201/358/450/458/468) kept per-ROW scale and varied only the statistic; exp_450 hit bpb=1.073985 with H-weighted row scale but size_blocked, suggesting the scale-refinement axis has value if the size budget admits it. Risk: for square 512×512 attention matrices, per-col vs per-row give different Q distributions without any size difference, so the bpb signal hinges on whether column-axis homogeneity (GPTQ-natural) outperforms row-axis homogeneity (industry-common) on our trained Muon weights. Size risk should be LOW on tok_emb (savings) and mild on other matrices (shifted Q entropy but no fundamental spread change).
546	2026-04-24T09:25:32Z	ttt	491	538	ttt	Intra-chunk per-epoch momentum ramp [0.70, 0.83, 0.90, 0.95] on TTT SGD-Nesterov: ep0 low-μ dilutes prior chunk's stale momentum carry-in, later epochs high-μ smooths fresh-chunk grad noise	-0.0002	size_blocked	1.073963		16000394	600.134000	558.700000	1466.000000	apg-ttt-0539		"Novel mechanism vs all prior μ probes (all chunk-LEVEL cooling/reset: exp_037, exp_103, exp_253, exp_265, exp_382, exp_388, exp_472, exp_517, exp_526 — all discard or size_blocked). Never tried: EPOCH-level intra-chunk μ ramp. SGD reads pg[""momentum""] each step so dynamic μ is safe with Nesterov. Geometric mean of ramp ≈ 0.87, slightly below 0.9 baseline — trades a bit of cross-epoch smoothing for cleaner chunk-boundary transitions. +182 packed code bytes (small but non-zero; artifact margin was ~500 B for some seeds, so some size_blocked risk)."
547	2026-04-24T09:30:49Z	arch	538	538	arch	Symmetric MLP-output gate as raw nn.Parameter [1,12] per block (per-token scalar), mirroring exp_538's attn_out_gate on the MLP branch.	-0.0002	size_blocked	1.072375		16000103	600.029000	553.600000	1479.000000	apg-arch-0540		Zero-init W gives gate=1 at step 0, transparent. Raw Parameter form avoids exp_513's CastedLinear-induced eval overrun. mlp_out_gate pattern added to CONTROL_TENSOR_NAME_PATTERNS. Cost: 132 fp32 params ~528 B raw.
548	2026-04-24T09:30:49Z	eval	491	538	eval	Loop-equalized TTT LR: looped blocks [3..5] are invoked (num_loops+1)=3× per forward so receive 3× gradient magnitude — scale their TTT SGD base LR by 1/sqrt(num_loops+1)≈0.577 (matching the existing ln_scale_factor variance-balance on those exact blocks) so per-step weight-space drift equalizes across physical layers; untried physical-index LR split (prior exp_133/315/357 matrix-TYPE splits all hurt)	-0.00010	size_blocked	1.074048		16000081	600.030000	560.600000	1466.000000	apg-eval-0540		Two-site edit in eval_val_ttt: (1) replace single-group SGD with two param groups splitting by physical block index (blocks 3..5 vs others), with looped group at 1/sqrt(num_loops+1)×ttt_lr; (2) update the in-chunk cos_lr loop to preserve the per-group ratio. Principle: gradient magnitude through a block used K=num_loops+1 times per forward is ~K×; Nesterov μ=0.9 compounds this into 3× larger weight-space drift on looped blocks every SGD step. Variance-balancing 1/sqrt(K) matches what ln_scale_factor already does at line 708 for the same residual-contribution asymmetry. Orthogonal to all prior TTT LR splits (by matrix type). ttt_params / grad_clip / all_reduce unions are unchanged. Zero artifact-size impact in principle (TTT is eval-only; only ~1KB of code added).
549	2026-04-24T09:38:42Z	curr	538	538	curr	"Rank-staggered shared base permutation in ShuffledSequenceLoader: all ranks share one seeded base_perm (PCG64(0)); rank r's local shard si_l rotates it by (r+si_l)%8 so the 8 ranks' first-epoch phase-visits tile [0,8) deterministically, vs independent per-rank perms that leave ~3/8 phases uncovered in the single-phase-per-shard 600s regime.</hypothesis> <parameter name=""notes"">Edit sits in ShuffledSequenceLoader.__init__ only — single _phase_order construction swapped for rank-dependent rotation of a shared seeded base perm. No change to _reset_shard, next_batch, or downstream logic. exp_456 tested single-perm rotation by si within one rank and failed; the untested axis here is the CROSS-rank coordination via h.rank in the rotation offset (exp_456 did not touch h.rank). exp_227 tried deterministic (rank+si+j)%8 with no permutation layer; this keeps a true permutation while adding cross-rank tiling. Orthogonal to exp_196 batch-stratification and exp_142 Latin-square mechanics — both still active." -0.0003 size_blocked 1.073835  16004215 600.043000 588.100000 1534.000000 apg-curr-0540  
550	2026-04-24T09:47:36Z	reg	538	538	reg	"Raise adam_wd 0.005 to 0.008 (+60% UP probe) on the scalar AdamW group - first UP direction probed since exp_177 set 0.005 (exp_257 to 0 discard, exp_452 to 0.002 size_blocked left UP untested). Scalar group has grown 3x since exp_177: exp_538 attn_out_gate_w (1056 zero-init fp32), exp_267 embed_scale [512], exp_475 q_gain[H,2]. Stronger pull-to-0 on the new zero-init gate mass should improve calibration without removing signal.</hypothesis> <parameter name=""notes"">Single-literal edit at train_gpt.py:165 (ADAM_WD default 0.005 to 0.008). Zero byte delta (code_bytes=26215). Scalar AdamW group includes attn_scale/mlp_scale, resid_mix, q_gain, skip_weights/gates, embed_scale, attn_out_gate_w - dominated now by the 1056-param zero-init attn_out_gate from exp_538.</parameter> </invoke>" -0.0003 size_blocked 1.072928  16001510 600.116000 590.400000 1530.000000 apg-reg-0544  
551	2026-04-24T09:50:58Z	tok	538	538	tok	Row-mean-center tied tok_emb at init: after nn.init.normal_, subtract each row feature-mean so every token embedding is zero-mean across D=512. Zero params, zero bytes, pure init perturbation.	-0.0005	size_blocked	1.073477		16001999	600.035000	584.400000	1525.000000	apg-tok-0546		Single-site edit in GPT._init_weights: after nn.init.normal_, add with torch.no_grad() block that does self.tok_emb.weight.sub_(mean(dim=1, keepdim=True)). Mechanism distinct from forward-time mean-stripping exp_380 layer_norm discard +0.0028 and exp_523 size_blocked: row-centering at init puts the model in a DC-free basin without perturbing RMSNorm invariant each step. Distinct from exp_466 column-equi-std discard +0.0010 which normalized 2nd moment per column; this normalizes 1st moment per row.
552	2026-04-24T09:52:24Z	ttt	491	538	ttt	Intra-chunk per-epoch momentum ramp [0.70, 0.83, 0.90, 0.95] on TTT SGD-Nesterov (compacted retry of exp_546 which val_bpb=1.073963 but size_blocked by 394 B over-cap)	-0.00002	discard	1.073937	+0.000471	15999947	600.773000	559.700000	1465.000000	apg-ttt-0547		Same mechanism as exp_546 (intra-chunk μ ramp lets ep0 dilute prior-chunk stale momentum, ep3 use high μ for fresh-chunk noise smoothing). exp_546 hit val_bpb 1.073963 (would have improved best by Δ=-0.000015) but size_blocked at 16,000,394 B (+394 over). This retry compacts the edit to +51 packed code bytes vs baseline (vs +279 in exp_546), saving ~228 bytes of headroom. Inlines optimizer.param_groups[0] (single SGD group), drops comments and length-guard (h.ttt_epochs default 4 == len(_mu)).
553	2026-04-24T09:54:33Z	opt	538	538	opt	Concave (lr_scale**1.5) Muon-only warmdown while AdamW groups retain linear: faster Muon decay lets its unit-Frobenius-norm NS updates stop over-correcting in the refinement tail while AdamW's 1/sqrt(v) per-param scaling continues fine adjustment. Mirror of exp_303 (Muon sqrt=convex, Muon hotter, discard +0.004091).	-0.0005	size_blocked	1.074697		16003996	600.083000	587.500000	1523.000000	apg-opt-0547		Single-site edit in step_fn (inner loop over optimizers): computes muon_lr_scale = lr_scale ** 1.5 and applies it only to optimizer_muon.param_groups; all other groups (optimizer_tok, optimizer_scalar, optimizer_head) keep the linear lr_scale. No-op at peak (lr_scale=1.0 → muon_lr_scale=1.0). Size-neutral: ~8 added lines of comment + 2 logic lines. exp_303 tested the convex/opposite direction (Muon sqrt warmdown, keeps Muon hotter) → discarded +0.004091, so the concave mirror on this Muon-only-warmdown-shape axis has never been probed. Momentum cool-during-warmdown and grad clip schedules remain unchanged.
554	2026-04-24T09:55:00Z	loss	538	538	loss	Logit-L2 regularization (λ=1e-5 · mean(logits²)) added to training CE — untried gentle soft-shrinkage on the mass of unsaturated logits, orthogonal to existing tanh softcap (hard cap on extremes) and to every tried loss tweak (label smoothing, focal, entropy penalty, z-loss@1e-4 exp_009, position/frequency/byte weighting); zero new params, zero artifact bytes, training-only — ~0.2% CE-gradient perturbation at typical |logit|≈14.	-0.0005	discard	1.073855	+0.000389	15980550	600.080000	591.200000	1541.000000	apg-loss-0547		Single-site edit in GPT.forward at L824-829. ce = F.cross_entropy(...); logit_l2 = logits_flat.pow(2).mean() * 1e-5; return ce + logit_l2. λ=1e-5 chosen as 10× smaller than exp_009's z-loss α=1e-4 which discarded on the OLD baseline (1.0810). Current stack differs (tanh softcap=30, embed_scale-in-RMSNorm, qk-gain 5.25 bifurcated, recurrence-aware ln_scale, per-head attn gate exp_538) so logit distribution is substantially different; L2 on the softcapped logits is distinct from z-loss on logsumexp. Risk: weight distribution perturbation → GPTQ compression delta → size_blocked.
555	2026-04-24T09:55:31Z	meta	538	538	meta	Raise Muon-momentum warmdown blend floor 0.25→0.30: untested midpoint between exp_324's kept 0→0.25 UP and exp_355's failed 0.25→0.35 UP (size_blocked +0.000474), continuing the kept UP axis at half the failed overshoot step.	-0.00015	size_blocked	1.072581		16003370	600.091000	583.600000	1520.000000	apg-meta-0547		"Single-literal edit at train_gpt.py:1558 (mm_blend floor 0.25→0.30) plus comment update. Zero new params, minimal byte delta. Mechanism: Muon momentum in the deepest ~22% of training (lr_scale<0.30) now averages gradients at 0.9410 instead of 0.9375 — a 0.0035-point extra hold on noisy tail grads. exp_324's kept win proved that flooring >0 helps; exp_355 at 0.35 overshot (size_blocked). 0.30 is the untested bracket midpoint. Since the kept axis (exp_324) predates exp_377/475/491/538 structural adds, the optimum plausibly shifted. Size risk is low — this changes only momentum in the LR-decay tail, not peak-phase weight magnitudes that dominate compression.</notes> </invoke>"
556	2026-04-24T09:55:47Z	quant	538	538	quant	Asymmetric int6 quantization range: clamp GPTQ codes to [-(clip_range+1), clip_range] = [-32, +31] instead of symmetric [-31, +31] — uses the full 64-value int6 code domain (extra -32 bin) to recover precision on GPTQ-error-propagated negative tails that currently saturate at -31.	-0.00005	size_blocked	1.073030		16002092	600.074000	584.600000	1523.000000	apg-quan-0547		Single-line edit at train_gpt.py:1102 (torch.clamp lower bound -clip_range to -(clip_range+1)). int8 storage unchanged (Q dtype is int8, range still fits). clip_range=31 for int6 matrices / 127 for int8 embed, so this extends both (int6 to -32..+31, int8 to -128..+127). No change to scales, Hessian, perm, or dequant path (q.float()*s handles -32 natively). Size risk: one additional histogram symbol in byte-shuffled-brotli input per matrix; expected cost tens to a few hundred bytes; ample headroom at this baseline. Untouched axis — every prior quant probe varied damping, block_size, scale shape, ordering, or H structure, but no trial has changed the clamp range since inception.
557	2026-04-24T09:57:57Z	eval	491	538	eval	Loop-equalized TTT LR (compact): same edit as exp_548 (split TTT SGD into two param groups, scale looped-block LR by 1/sqrt(num_loops+1)) with 255-byte comment/code trim to recover cap headroom; exp_548 packed 81B over (size_blocked) despite val_bpb=1.074048 i.e. −0.000070 vs current best, so the quality signal is real and the only barrier is packing margin	-0.00007	discard	1.074059	+0.000593	15999233	600.082000	562.300000	1467.000000	apg-eval-0549		Pure byte-trim on exp_548's edit: collapse comment block to 3 lines, fold the loop-classification conditional into a single `(_looped_ttt if _is_loop else _other_ttt).append(_p)`, drop the intra-chunk docstring. Local size_project reports code_bytes 26109→25854 (-255 B); exp_548 artifact was 16,000,081 (-81 B deficit) so the trim clears the cap with ~174 B of margin. All functional behaviour (two-group SGD, cos_lr ratio preservation, ttt_params/grad_clip/all_reduce unions) identical to exp_548.
558	2026-04-24T09:59:33Z	arch	538	538	arch	Re-submit exp_547's symmetric MLP-output gate with width shrunk 12→4 to fit under 16MB cap (exp_547 hit val_bpb=1.072375 Δ=-0.001091 but size_blocked by 103 bytes). Width-4 saves 88 fp32 of trained-weight bytes ≈ 150 B packed, covers the gap with margin while preserving the data-dependent gating signal.	-0.0008	eval_budget_overrun	1.072396			600.106000	602.000000	1562.000000	apg-arch-0549		Single-literal change: mlp_out_gate_width 12→4 in MLP.__init__. Same raw nn.Parameter mechanism. exp_547 proved the structural idea (val_bpb 1.072375); only the byte budget needs trimming. Reduced expressivity from 4 channels still allows meaningful per-token modulation since gate input is unit-RMS post-mlp_norm.
559	2026-04-24T10:15:32Z	curr	538	538	curr	Rank-stripe permutation in ShuffledSequenceLoader.__init__: replace `all_files[h.rank::world_size]` with `all_files[perm[h.rank]::world_size]` where perm is a seeded world_size-permutation shared across ranks. Keeps disjoint stripes (full coverage, no cross-rank duplicates) but decorrelates rank-id from alphabetical file position, perturbing which per-rank content stripe drives the PCG64(h.rank) phase/sequence permutation stream. Untested axis: exp_122 removed stripe entirely (failed, duplicate sampling); exp_549 tried cross-rank phase coordination (size_blocked). This cleanly probes the stripe-assignment permutation alone.	-0.0001	size_blocked	1.073534		16000822	600.075000	593.900000	1543.000000	apg-curr-0551		Size-safe (+~900 bytes code, model unchanged — 538 passed with ~30KB headroom). Mechanistic story is weak: gradient mean is permutation-invariant under DDP all-reduce, so this change is effectively a seed perturbation that shifts which rank's PCG64(rank) stream acts on which alphabetical stripe. May be noise-level or may help if there was any latent rank↔content-position correlation in the gradient-averaging dynamics.
560	2026-04-24T10:19:50Z	reg	538	538	reg	Split attn_out_gate_w into its own scalar-AdamW sub-group with adam_wd_gate=0.015 (3x baseline 0.005); other scalars stay at 0.005	-0.0003	size_blocked	1.072476		16002362	600.025000	584.600000	1518.000000	apg-reg-0553		Prior: exp_550 raised ALL scalars 0.005 to 0.008 and hit bpb 1.072928 (would beat best 1.073466) but SIZE_BLOCKED. Mechanism hypothesis: gain comes from stronger pull-to-zero on the zero-init attn_out_gate_w (1056 params, ~58pct of scalar group after exp_538). Isolating to its own sub-group at 0.015 delivers similar total WD energy (0.015*1056 ~= 15.8) concentrated where pull-to-zero is meaningful while preserving well-tuned dynamics on init=1 and init=5.25 scalars that exp_550 likely over-regularized. 2-site edit: new hparam adam_wd_gate env-backed; Optimizers.__init__ splits block_named_params collection and constructs optimizer_scalar with two param groups (same scalar_lr and base_lr, different weight_decay). +63 code bytes. Novel vs exp_343 (split by init convention; discard), exp_444 (q_gain WD=0; size_blocked), exp_550 (global 0.008; size_blocked).
561	2026-04-24T10:23:29Z	tok	538	538	tok	Tighten embed_clip_sigmas 20.0 to 14.0	-0.0003	size_blocked	1.072171		16275036	600.055000	589.700000	1531.000000	apg-tok-0557		Tok-domain int8 SDClip on tok_emb only. Untouched since seed. 20 sigma wastes half the grid since trained tok_emb rarely exceeds 10 sigma. 14 gives 43 percent finer resolution. Single literal default change at line 194.
562	2026-04-24T10:24:06Z	meta	538	538	meta	Walk back Muon-momentum warmdown floor 0.30→0.28 after exp_555 proved floor=0.30 yields Δ=-0.000885 bpb win but size_blocked by 3,370 bytes; 0.28 is 60% of the way from exp_324's kept 0.25 toward 0.30 — should retain most of the bpb improvement while recovering artifact headroom.	-0.00045	size_blocked	1.072734		16004968	600.025000	596.800000	1533.000000	apg-meta-0557		"Direct follow-up to exp_555 (same session, same author): floor=0.30 delivered val_bpb=1.072581 (Δ=-0.000885) but artifact=16,003,370 B, only 3370 B over cap — a rare ""win pending headroom"" signal. Walking back to 0.28 is a 60%-magnitude step toward the prior kept value (0.25): linearly interpolating, expect ~−0.0005 bpb (retain ~60% of exp_555's win) with ~2 KB headroom recovered. mm_blend formula: 0.28*0.99+0.72*0.92=0.9396 (vs 0.30's 0.9410 and 0.25's 0.9375). Size_block risk exists but expected to be under cap given the observed 3370 B excess at 0.30 and roughly linear scaling with floor. Zero new params, single-literal edit at line 1561.</notes> </invoke>"
