exp_id	timestamp	specialist	parent_exp	baseline_exp	domain	hypothesis	expected_delta	status	val_bpb	delta_vs_best	artifact_bytes	train_s	eval_s	total_s	job_name	snapshot_path	notes
359	2026-04-22T23:53:15Z	eval	exp_336	336	eval	Apply T=0.98 sub-unity logit temperature in both eval_val_sliding and eval_val_ttt score passes (divide logits by 0.98 before cross_entropy): opposite-direction probe vs exp_044's T=1.05 failure (+0.00261), motivated by GPTQ-induced logit-noise softening of the post-softmax distribution.	-0.0003	discard	1.074698	+0.000527	15998569	600.078000	756.922000	1466.000000	apg-eval-0352		Two-site edit: (1) eval_val_sliding line ~1289 and (2) eval_val_ttt score-pass line ~1368. Both change `logits.reshape(-1, logits.size(-1)).float()` to `(logits.reshape(-1, logits.size(-1)) / 0.98).float()`. TTT training pass (base_model(x,y)) is UNCHANGED — still CE at T=1 so TTT gradients remain true to the metric. Theory: GPTQ int6 injects ~1-2% logit noise; by Jensen's inequality E[softmax(x+ε)] is softer than softmax(E[x]), so sub-unity T recovers calibrated log-likelihood. Magnitude T=0.98 is conservative (exp_044's 1.05 was 5% softer and hurt +0.00261; 0.98 is 2% sharper, ~4x smaller perturbation). Compute delta: one FMA per logit, negligible vs model fwd. If this keeps, it opens a calibration sweep axis; if it fails symmetric to exp_044 it rules out the temperature axis decisively.
360	2026-04-22T23:53:40Z	loss	336	336	loss	Concave (sqrt / u^0.5) position-weighted CE, mean-preserving 0.9 → 1.1 — probes the untested concave side of the shape-exponent family on the exp_336 baseline (linear, u^2 kept; u^4 discarded).	-0.0001	size_blocked	1.074727		16000877	600.080000	765.920000	1478.000000	apg-loss-0352		"Single-site edit in GPT.forward. Shape-exponent history on position-weighted CE (all mean-preserving 0.9→1.1): exp_156 linear kept Δ=-0.000200, exp_176 linear stack kept Δ=-0.000171, exp_186 u^2 kept Δ=-0.000062, exp_349 u^4 discard +0.000535, exp_034 wide-linear 0.5→1.5 harness_abort. Current exp_336 baseline DROPPED position weighting via rebase lineage 186→324→336, so this reintroduces weighting with a NEW shape: u^0.5 (concave). Compared to u^4 (discard), u^0.5 is the opposite side: sharp head downweight (pw≈0.871 at pos 0, vs 0.957 for u^4), gentle distributed tail upweight (pw≈1.065 at last pos, vs 1.170 for u^4). Tests whether the ""first tokens no-context"" signal dominates, not the ""tail high-value"" signal that u^4 tried to amplify. Zero new params, zero artifact bytes, ~1 linspace+sqrt+mean per forward (negligible compute)."
361	2026-04-22T23:53:54Z	tok	336	336	tok	Add a learnable per-feature embed_bias (shape=[512], init=0.0) applied POST-RMSNorm, as the additive complement to exp_298's gauge-fixed multiplicative embed_scale (inside-RMSNorm).	-0.00020	size_blocked	1.075949		16002694	600.097000	762.903000	1468.000000	apg-tok-0352		Three-site edit. (1) __init__ L636: add self.embed_bias = nn.Parameter(torch.zeros(h.embedding_dim, dtype=torch.float32)) next to embed_scale. (2) forward_logits L743: add `x = x + self.embed_bias.to(x.dtype)` AFTER the F.rms_norm(x*embed_scale) line — applied post-norm so it survives RMSNorm (unlike embed_scale which sits inside). (3) Optimizers L910: append embed_bias to scalar_params so it trains under the scalar AdamW group with adam_wd=0.005. Rationale: embed_scale is gauge-fixed (mean of gradient orthogonal to 1-vector, only relative per-feature SCALE is learnable). The additive complement gives the residual stream a learnable per-feature DC shift that survives the input RMSNorm and is carried by the residual path through every layer — the tied-softmax readout sees the per-feature shift through final_norm. 512 fp32 scalars = ~2KB raw, passthrough-compressed → zero size risk. Init=0 means t=0 behavior is identical to baseline. Genuinely orthogonal axis vs all prior tok experiments: exp_190/267/298 (multiplicative gain), exp_019/011/038/032/350 (init tweaks), exp_260 output_gain (multiplicative post-head_proj, discarded). No prior trial has tried an additive input-side shift.
362	2026-04-23T00:26:37Z	opt	336	336	opt	Linearly cool grad_clip_norm with warmdown LR (0.3 at peak → 0.15 at end, via lr_scale-proportional clip_scale=0.5+0.5*lr_scale), so the noisy low-LR tail updates get tighter clipping before they pollute the EMA state	-0.0003	discard	1.074613	+0.000442	15998926	600.073000	755.927000	1465.000000	apg-opt-0362		Single-site edit at step_fn's clip_grad_norm call (train_gpt.py:~1513). During warmup/peak (lr_scale==1.0), behaviour is identical to baseline (clip=0.3). Warmdown linearly tightens clip 0.3→0.15 mirroring lr_scale 1.0→0.0. Axis history: grad_clip schedule was proposed once as exp_036 but harness_abort — never actually ran, so this direction is genuinely untested data. Orthogonal to exp_324's momentum-floor fix (which averages direction) and exp_010's momentum cool (direction). Clip norm controls per-step UPDATE MAGNITUDE under noisy tail gradients. Rationale: in the deep tail, raw grad norm ≈ const but signal∝LR, so SNR drops quadratically; allowing max-norm=0.3 there passes essentially-noisy large updates that degrade EMA tail (currently 0.9965 decay, ~50% mass in last ~200 steps). A linear blend via existing lr_scale needs no new hparam. Non-invasive, 0 bytes added in any meaningful sense.
363	2026-04-23T00:26:55Z	ttt	336	336	ttt	Restore exp_264's kept fwd/rev per-epoch TTT batch-traversal alternation (accidentally reverted in exp_267 via older-baseline rebase and inherited by all subsequent keeps 280/298/324/336); reapplies the proven −0.000084 mechanism to the current stack.	-0.00008	discard	1.074776	+0.000605	15998536	600.103000	768.897000	1480.000000	apg-ttt-0362		Single-site edit in eval_val_ttt's per-chunk adaptation inner loop (line ~1407). Replaces `for bs in range(0, my_chunk_seqs, batch_seqs)` with `batch_starts = list(range(...)); if _ep%2==1: batch_starts.reverse(); for bs in batch_starts`. Rationale: (1) exp_264 kept Δ=-0.000084 on top of exp_245 baseline; (2) diff_snapshots(264, 267) confirms exp_267 (tok, embed_scale port) shipped with the fwd-only loop — exp_267 rebased from exp_245 not exp_264, so the alternation was dropped; (3) diff_snapshots(264, 336) confirms every subsequent keep (280 quant, 298 tok-RMS-gauge, 324 opt-mm-floor, 336 meta-wd_mlp) inherited the fwd-only regression; (4) the alternation is orthogonal to all four: it touches only the TTT adaptation phase, not the train graph, quantization, or optimizer config. Zero bytes, zero compute delta. Risk: on the new baseline (embed_scale on, damp multiplicative, momentum floored), the TTT dynamics differ enough that the noise-decorrelation benefit could be absorbed by the already-better starting weights — in that case expect ~0.0 rather than a regression.
364	2026-04-23T00:28:04Z	meta	336	336	meta	Raise tied_embed_lr 0.03 → 0.034 (+13%) on tied tok_emb AdamW group — symmetric UP probe of the only-DOWN-tested axis (exp_252 tested 0.03→0.026 and discard +0.00105)	-0.0002	discard	1.074854	+0.000683	15997038	600.023000	755.977000	1463.000000	apg-meta-0362		Single-literal edit at train_gpt.py:146 (TIED_EMBED_LR default 0.03→0.034). Rationale: (1) exp_252 tested DOWN direction 0.03→0.026 (−13%) → discard Δ=+0.00105, a strong negative. The symmetric UP has never been tested in the lineage. (2) Tied tok_emb is the single largest parameter (8192×512=4.2M, ~12% of total params) and sits on its own AdamW group — isolated knob, minimal coupling risk. (3) Size-block risk is low: AdamW decoupled WD (embed_wd=0.085, unchanged) decouples equilibrium weight magnitude from LR, unlike WD reductions which consistently size_block (exp_041, exp_346, exp_356). (4) Most other meta knobs are saturated on both sides: matrix_lr (exp_214/224 both discard), beta1/2 (multiple discards + size_block), muon_wd/muon_wd_mlp (saturated this lineage), ema_decay (both sides discard), grad_clip_norm (both sides discard). tied_embed_lr UP is one of the few remaining symmetric probes.
365	2026-04-23T00:28:43Z	tok	336	336	tok	"Add per-vocab learnable logit_bias (shape=[vocab_size=8192], init=0.0) on output logits post-F.linear, pre-softcap — lets the tied-embedding setup learn the token-frequency log-unigram prior without distorting the input embedding matrix.</hypothesis> <parameter name=""notes"">Three-site edit. (1) GPT.__init__ L650: self.logit_bias = nn.Parameter(torch.zeros(h.vocab_size, dtype=torch.float32)) added immediately after self.embed_scale. (2) GPT.forward_logits: after logits_proj = F.linear(x, self.tok_emb.weight) (tied) or lm_head(x) (untied), apply logits_proj = logits_proj + self.logit_bias.to(logits_proj.dtype) BEFORE the softcap tanh. (3) Optimizers.__init__: appended base_model.logit_bias to scalar_params alongside embed_scale (scalar AdamW group, adam_wd=0.005). Structurally distinct from exp_361 (size_blocked embed_bias input-side post-RMSNorm): output-side placement POST-F.linear means no trunk-statistics perturbation so zero GPTQ-entropy inflation on any downstream weight. 8192 elements trigger GPTQ fp16 passthrough (threshold 65536 at L1068) = 16KB raw; byte-shuffle+brotli-11 on a near-log-unigram prior should compress to ~8-12KB, well under ~180KB headroom. Motivation: under tie_embeddings=True, tok_emb must encode both input lookups (where RMSNorm strips any DC component) AND output logits; it cannot carry a pure token-frequency bias direction because RMSNorm ablates it on the input side. exp_023 proposed this exact mechanism but was harness_aborted; never actually evaluated." -0.0008 size_blocked 1.075104  16015145 600.055000 766.945000 1473.000000 apg-tok-0362  
366	2026-04-23T00:29:01Z	reg	336	336	reg	Constant-magnitude MLP Muon WD in top-half of warmdown: set muon_wd_mlp = base/max(lr_scale,0.5) on the MLP-only Muon group so the per-step decay magnitude (lr*wd*param) stays flat across lr_scale∈[0.5,1.0] and cools naturally below 0.5	-0.0002	discard	1.078870	+0.004699	15998882	600.081000	758.919000	1469.000000	apg-reg-0362		"Single-site edit in step_fn right after LR update: mlp_group[""weight_decay""] = h.muon_wd_mlp / max(lr_scale, 0.5). Attn Muon group kept at base (Q/K are RMS-normed → WD direction less critical; V/proj already less weighty). Rationale axis: Muon's decay step is lr*wd*p, so vanilla linear warmdown halves MLP decay magnitude by lr_scale=0.5. Proposal holds decay magnitude flat across the warmdown top-half, then tapers naturally in the deep tail (lr_scale<0.5). Integral of MLP decay pressure over warmdown rises ~25% vs baseline. Precedent: exp_324 (keep, Δ=-0.000202) applied a floor=0.25 to mm_blend for Muon MOMENTUM by the same mechanism; this is the WD analogue on the proven MLP-only lever (exp_336). Distinct from all prior WD sweeps which only tuned the scalar base value. Zero param/byte delta. Risks: (1) extra decay pulls well-learned MLP weights toward zero in warmdown mid-phase → may hurt bpb. (2) floor=0.5 is untested; conservative pick vs 0.25 to avoid overreach. Baseline exp_336 val_bpb=1.074171."
367	2026-04-23T00:30:34Z	loss	336	336	loss	Content-aware focal-style hard-token emphasis on training CE: weight each token's loss by w=(1-pt)^0.2 with detached pt=exp(-ce), then renormalize to mean=1, so confident tokens get downweighted and the learnable middle gets more gradient budget while total gradient magnitude ~ plain CE (no LR retune).	-0.0003	size_blocked	1.074611		16000314	600.085000	764.915000	1497.000000	apg-loss-0362		Single-site edit to GPT.forward. Novel direction for loss domain: prior loss trials explored POSITION-based weighting (exp_156 linear, exp_176 stacked-linear, exp_186 convex u^2, exp_360 concave sqrt/size_blocked) and never touched CONTENT-based weighting. Weights are detached (pure per-token CE-gradient scaling; no second-order terms through pt). Gamma=0.2 gentle: at init pt~1/V~1.2e-4 so w~1 identically, transitioning only as tokens become confident. Mean-preserving normalization pegs aggregate gradient norm to plain CE so grad_clip_norm=0.3 and LR schedule stay valid. Eval loops still use plain F.cross_entropy. Zero parameters, zero bytes. Risk: if easy-token downweighting sharpens weights, quantization may hurt (size_blocked); fallback is gamma=0.1 or time-gated application.
368	2026-04-23T00:31:07Z	quant	336	336	quant	Apply GPTQ block_size 64→32 on top of exp_280's multiplicative-damping stack: doubles cross-block error-propagation events per matrix (from 8 to 16 passes on 512-col weights), moving GPTQ closer to per-column OBS. exp_261 already keep'd this on an older baseline (Δ=-0.000026), but exp_280 forked from a block_size=64 parent so the combination with 1.02× multiplicative damping has never been tested.	-0.00003	size_blocked	1.074750		16000425	600.116000	761.884000	1478.000000	apg-quan-0362		Single-char edit at line 1023: block_size=64 → 32. Zero size risk (same Q distribution, just different error redistribution order). ~2× inner-loop iters for gptq_quantize_weight but Cholesky is the dominant cost and it's unchanged — expect <10s extra eval. Rationale: two proven quant wins (exp_261 block_size=32, exp_280 multiplicative damping) have never run together because exp_280 forked from a block_size=64 branch. Testing the combination.
369	2026-04-23T00:32:04Z	eval	336	336	eval	Split TTT training microbatch from batch_seqs=32 down to 2 so each GPU does 2 SGD steps per epoch (8/chunk) instead of 1 (4/chunk): doubles per-chunk adaptation steps at the same data/compute cost since each step processes half the seqs.	-0.0002	eval_budget_overrun	1.076369			600.075000	789.925000	1499.000000	apg-eval-0362		Single-site edit in eval_val_ttt at L1394-L1396: introduces local `ttt_train_bs=2` used only inside the training loop; scoring still uses batch_seqs=32. With world_size=8 and chunk_seqs=32, each GPU's my_chunk_seqs=4; the outer loop `for bs in range(0, my_chunk_seqs, batch_seqs)` currently runs exactly once per epoch (bs=0, be=4). Halving the step size to 2 gives 2 iters/epoch × 4 epochs = 8 SGD steps per chunk vs current 4. Same total val tokens consumed per chunk, same forward+backward FLOPs; only overhead delta is 2× allreduce calls per epoch (small). Base model is uncompiled in training pass so no recompile cost from shape (4,2048)→(2,2048). Axis differentiation vs prior eval trials: exp_014/017 raised epochs (more data passes), exp_057/127/234 halved chunk_tokens (2× scoring overhead → budget bust), exp_287 changed intra-chunk LR at fixed batch structure, exp_103/039 tuned momentum. Nobody has changed the SGD step granularity. Motivation: 4 SGD steps per chunk at short cosine-decaying LR likely undershoots chunk-specific signal; finer-grain steps let the optimizer better exploit within-chunk distribution shift. Risk: higher gradient variance per step (halved effective batch) could destabilize — grad_clip=1.0 provides a backstop, and LR is already low (≤0.005).
370	2026-04-23T00:33:08Z	curr	exp_336	336	curr	Hard loss-mask on training positions 0..15 of each sequence (drop CE where context<16 tokens) to align training signal with the sliding-window eval metric (which scores ~98% of tokens at positions ≥1984).	-0.0003	size_blocked	1.076629		16004441	600.103000	768.897000	1481.000000	apg-curr-0362		"Single-site edit in GPT.forward. Changed reduction=""mean"" to reduction=""none"".reshape(B,T)[:,16:].mean(). History: exp_013 tried mask=32 but was size_blocked in a tight-budget era (no val_bpb recorded, so the idea was never evaluated). Current stack has ~180KB headroom and zero new parameters. Rationale: (a) positions 0..15 have <16 tokens of context so per-position CE there is inherently high-variance; (b) sliding-window val with stride=64, context=1984 only scores positions ≥1984 for ~98% of windows, meaning early-position train gradient is largely orthogonal to eval; (c) removes 0.78% of train signal (16/2048), a mild cutoff; (d) structurally distinct from exp_156/176/186 smooth mean-preserving linspace 0.9→1.1 (soft ramp on ALL positions vs hard mask on tail of lowest-context positions). Early tokens still participate as KV context for later scored positions, so embedding/early-attention still receives gradient via downstream positions. Gradient magnitude rescales by T/(T-16)≈1.008 (negligible LR effect). Size pre-check: 25,536 code bytes (up ~1KB from ~24.5KB baseline)."
371	2026-04-23T00:35:52Z	arch	336	336	arch	Narrow-deep depth recurrence: loop_end 5→4, num_loops 2→3 (2-layer segment × 4 iterations instead of 3-layer × 3 iterations) — same total block-calls (17) as baseline, but blocks 3,4 each get an extra iteration of refinement while block 5 exits the loop as a single-call decoder layer.	-0.0003	eval_budget_overrun	1.079677			600.115000	781.885000	1485.000000	apg-arch-0362		Two-literal edit at Hyperparameters defaults: NUM_LOOPS 2→3, LOOP_END 5→4 (LOOP_START=3 unchanged). Untouched axis: prior loop-width experiments all kept width=3. exp_046 bumped num_loops 2→3 at width=3 (12 loop calls = 20 total) → eval_budget_overrun. exp_056 shifted width=3 segment forward (loop 4→6) → discarded. exp_352 rotated phase → discarded. My variant preserves total block-calls at 17 by narrowing width 3→2 as num_loops 2→3, so compute budget is exactly baseline. Structural effects: (a) blocks 3,4 go from 3→4 calls each (more iterative refinement); (b) block 5 goes from 3→1 call (now a plain non-loop decoder layer, sharing dynamics with blocks 6-10); (c) ln_scale correction auto-rescales from 1/sqrt(3)=0.577 to 1/sqrt(4)=0.5 via the existing loop_scale formula, correctly matching the new 4-repeat variance. all_indices = [0,1,2,3,4,3,4,3,4,3,4,5,6,7,8,9,10] (17); encoder=[0,1,2,3,4,3,4,3], decoder=[4,3,4,5,6,7,8,9,10]. Zero params, zero bytes risk. Expected delta negative because (i) iteration count matters more than width at the cost-constrained frontier per nanoGPT-speedrun observations, (ii) exp_245's /sqrt damping is automatically correct for the new repeat count.
372	2026-04-23T00:55:31Z	ttt	336	336	ttt	Lower ttt_lr 0.005 → 0.004 (−20%): the LR axis has never been validated post-Nesterov (exp_151 kept Δ=-0.000272, which amplifies effective per-step magnitude via look-ahead), and related step-magnitude reductions (grad_clip 1.0→0.5 exp_180 discard +0.000062 near-tie) hint that the current `0.005` inherited from the pre-Nesterov regime is slightly too high.	-0.00015	discard	1.074472	+0.000301	15999089	600.066000	753.934000	1462.000000	apg-ttt-0367		Single-literal edit at train_gpt.py:183 (TTT_LR default 0.005→0.004). Axis map: exp_039 momentum 0.9→0.95 UP discard; exp_073 ttt_lr 0.005→0.0065 UP harness_abort (never completed); exp_180 grad_clip 1.0→0.5 DOWN discard +0.000062 (near-tie); exp_101 grad_clip 1.0→2.0 UP eval_budget_overrun; exp_275 LR cosine floor 30% UP discard; exp_243 linear decay 1.0→0.5 UP discard. All other step-magnitude knobs have been walked UP and failed, leaving DOWN on the ttt_lr scalar itself as the only unwalked direction. Cos_lr per chunk becomes 0.004·0.5·(1+cos(πi/(N-1))), so peak scales 20% lower and the relative cosine-over-chunks shape is unchanged. No extra params, no extra compute, no byte impact. Probes whether the Nesterov-effective-step was over-sized at the pre-Nesterov-tuned LR.
373	2026-04-23T00:56:10Z	opt	336	336	opt	Nesterov → heavy-ball switch in Muon at lr_scale<0.25: turn off nesterov lookahead for the deep warmdown tail (last ~18%) while keeping the momentum floor (0.9375) intact, so the well-averaged momentum buffer drives tail convergence without the 1× raw-grad look-ahead term amplifying low-LR noise.	-0.0003	size_blocked	1.079083		16000287	600.105000	757.895000	1467.000000	apg-opt-0368		"Single-site edit at step_fn (train_gpt.py:~1497-1500). Adds `nesterov_active = lr_scale >= 0.25` and mutates `group[""nesterov""]` alongside the existing `group[""momentum""]` update. Mirror of exp_324's momentum-floor design (same 0.25 threshold) but on the orthogonal Nesterov axis — unexplored in this tree (exp_031 toggled TTT Nesterov, not Muon). Rationale: at lr_scale<0.25 the momentum floor pins buf-averaging at 0.9375 (~100-step memory), making buf a well-smoothed descent direction; Nesterov's `g + momentum*buf` update then adds a 1× unsmoothed raw-grad term to that direction, which is the noisiest signal in the tail (small per-step update magnitudes mean less cross-step direction consensus). Identical to baseline for lr_scale≥0.25 (first ~82%). Muon.step re-reads group[""nesterov""] per call (step not @torch.compile'd), so mutation is live. Rebased from exp_336 snapshot (workdir was stale with exp_362's discarded clip_scale code)."
374	2026-04-23T00:57:20Z	meta	336	336	meta	Raise muon_wd 0.095 to 0.103 on attention-only Muon WD group (mirror of exp_336 mlp DOWN step)	-0.0001	size_blocked	1.074256		16000256	600.045000	756.955000	1464.000000	apg-meta-0370		Single-literal edit at train_gpt.py:166 (MUON_WD 0.095 to 0.103, +8.4%). Affects only attention matrix Muon param group; mlp group uses muon_wd_mlp=0.115. Rationale: exp_336 keep moved mlp −8% (0.125 to 0.115); exp_337 size_blocked at bpb 1.075010 confirmed attn DOWN (0.095 to 0.087) hurts; exp_109 discard at 0.065 also hurt. Attn UP is the uncharted symmetric direction. exp_141 keep already proved +30% muon_wd on recurrent layers helps.
375	2026-04-23T00:58:48Z	reg	336	336	reg	Intra-attention Muon-WD split by projection role: promote c_q, c_k to muon_wd_qk=0.115 (matches MLP), keep c_v and attn.proj at baseline muon_wd=0.095.	-0.00015	size_blocked	1.074845		16002257	600.068000	752.932000	1460.000000	apg-reg-0371		Orthogonal to exp_141 (depth-split), exp_164 (mlp-vs-attn type split), exp_336 (MLP-value tune). Three-group Muon (attn=0.095, mlp=0.115, qk=0.115). Zero params, zero bytes.
