exp_id	timestamp	specialist	parent_exp	baseline_exp	domain	hypothesis	expected_delta	status	val_bpb	delta_vs_best	artifact_bytes	train_s	eval_s	total_s	job_name	snapshot_path	notes
627	2026-04-24T14:00:08Z	ttt	596	596	ttt	"Stack Gradient Centralization (exp_592 mechanism: zero-mean each 2D+ gradient along all non-output-row dims) on top of exp_596's TTT-only z-loss. GC and z-loss are siblings of exp_538 (both kept independently: -0.000300 and -0.000188 respectively) but never combined. GC projects each weight-matrix gradient onto the row-mean-zero subspace; z-loss regularizes logit log-partition. Four-line insert between DDP all_reduce and clip_grad_norm; +64 code bytes.</hypothesis> <parameter name=""notes"">Edit at eval_val_ttt line ~1406: 4-line GC block inserted after dist.all_reduce, identical to exp_592's kept edit. exp_607 (mb.mul_(0.5) + z-loss stack) regressed +0.000362 showing momentum-damping doesn't stack with z-loss; GC is direction-projection (not history/magnitude), minimal overlap. Size: code_bytes 23296 → 23360 (+64B). Expected: additive -0.0003 → 1.0720; partial overlap -0.0001 to -0.0002 → 1.0720-1.0721." -0.00020 size_blocked 1.072492  16000700 600.008000 587.300000 1524.000000 apg-ttt-0618  
628	2026-04-24T14:11:23Z	arch	596	596	arch	Add learnable per-feature final_gamma (init=1.0, shape=[model_dim=512]) after final_norm and before tied-embedding logit projection — adds output-side gauge freedom that is absorbable at inference but training-distinct from tok_emb due to 17× weaker weight decay (0.005 vs 0.085) and slower lr (0.02 vs 0.03).	-0.0002	discard	1.074830	+0.002579	15979877	600.013000	584.300000	1526.000000	apg-arch-0621		"Three-site edit: (1) GPT.__init__ adds self.final_gamma=nn.Parameter(torch.ones(model_dim)) after self.final_norm. (2) forward_logits multiplies by final_gamma between final_norm and head_proj/F.linear. (3) Optimizers.__init__ appends final_gamma to scalar_params via hasattr hook (same pattern as embed_scale). Mechanism: prior arch author noted ""final_norm left weightless since absorbable into tied head"" — but absorption is inference-only. During training gamma gets scalar-AdamW (lr=0.02, wd=0.005) while tok_emb gets tied_embed path (lr=0.03, wd=0.085, 17× stronger wd). Gamma thus carves out a low-decay output-side gauge tok_emb cannot cheaply reach, decoupling input/output scales under tied embeddings. 512 fp32 trainable → fp16 passthrough at GPTQ (numel<65536) → near-uniform init compresses well via brotli. Code +161 bytes, expected total artifact growth ~200-500 bytes. numel=512<10000 → TTT-frozen (exp_491 rule). Untested in our tree; ancestor reasoning excluded it without measurement."
629	2026-04-24T14:12:20Z	reg	596	596	reg	Raise adam_wd 0.005 to 0.006 UP probe on scalar AdamW group atop exp_596 z-loss baseline.	negative_0.0004	eval_budget_overrun	1.072473			600.091000	600.800000	1543.000000	apg-reg-0621		test
630	2026-04-24T14:12:29Z	meta	596	596	meta	Raise ttt_momentum 0.9 to 0.91 (untested midpoint on proven UP axis): exp_572 at 0.92 measured bpb=1.072551 but was size_blocked; under exp_596 z-loss regime a gentle momentum bump compensates for softer CE gradients.	-0.0003	size_blocked	1.072748		16001273	600.049000	583.000000	1518.000000	apg-meta-0621		Single-literal default change at line 181 (TTT_MOMENTUM 0.9 to 0.91). Pure eval-time hyperparameter affecting only TTT SGD+Nesterov; zero impact on training, GPTQ, or brotli compression. Effective step accumulator 1/(1-mu) goes from 10x to 11.1x, far below exp_572 at 0.92 (12.5x).
631	2026-04-24T14:23:04Z	loss	596	596	loss	Add label_smoothing=0.003 to TTT inner-loop CE on top of exp_596's z-loss: untried-on-TTT axis (prior label-smoothing trials exp_042/exp_428 only modified main-train CE, where train/val objective mismatch compounds over 20K+ steps); TTT's ~16-step-per-chunk adaptation with score-first has negligible compounding risk and mild smoothing should regularize against overfitting to each chunk's idiosyncratic tokens (helping the NEXT chunk's scoring under score-first), mechanism-orthogonal to the logsumexp^2 z-loss.	-0.0002	size_blocked	1.073246		16004030	600.022000	585.100000	1527.000000	apg-loss-0626		Single-arg change at line 1401 — adds label_smoothing=0.003 kwarg to F.cross_entropy inside the TTT inner-loop loss expression. Zero new params, no model-bytes impact, <30 source bytes added (lzma-friendly: duplicates an existing kwarg pattern). ε=0.003 on 8192-way softmax distributes ~3.7e-7 probability mass per non-target class; gradient perturbation ~0.3% of CE magnitude. z-loss coefficient 1e-5 preserved. Rationale for ε choice: matches failed-on-main exp_428 value, but TTT's much shorter exposure (~16 steps × 4 epochs per chunk × ~6 non-last chunks ≈ 400 total grad updates vs 20K+ for main training) means the compounding train/val objective mismatch that sank exp_428 on main-train doesn't apply here. Backward: even if the smoothing ε is suboptimal, this establishes a signed gradient for the axis (go higher vs lower ε) which nobody has probed in TTT.
632	2026-04-24T14:25:39Z	opt	596	596	opt	Port exp_592's Gradient Centralization (row-mean subtraction) from TTT SGD to main-training Muon: insert `g = g - g.mean(dim=-1, keepdim=True)` immediately after `g = p.grad`, before momentum accumulation. Structurally orthogonal to Muon's NS orthogonalization (singular-value management) and row-normalize (L2-norm management); GC removes per-row DC, leaving only differential signal for NS to polarize.	-0.0003	discard	1.073387	+0.001136	15995233	600.137000	583.600000	1517.000000	apg-opt-0627		Single-line edit in Muon.step (+65 code bytes). exp_592 proved row-mean subtraction helps SGD on TTT (keep, Δ=-0.000300). Porting to main Muon is the untried axis: both buf and Nesterov-shifted g become row-centered, NS sees DC-free input. Expected slightly tighter polar factor and implicit anchoring of per-row output biases. Risk: model_bytes shift after trajectory change may breach cap (margin historically ~500B).
633	2026-04-24T14:26:27Z	quant	596	596	quant	"Top-2 sink-col asymmetric int6 in GPTQ: extend quantization range from [-31,+31] to [-32,+31] on only the first 2 post-perm columns (highest-H_ii) per matrix; rest stay symmetric. Recovers precision on -31-saturated negative tail where GPTQ error-propagation concentrates, at ~1/4 of exp_575's top-8 histogram-shift cost (1755B size_blocked).</hypothesis> <parameter name=""notes"">Single-site edit in gptq_quantize_weight inner loop: lo = -clip_range - 1 if (i1 + j) < 2 else -clip_range; q_col clamp uses lo. After perm=argsort(H.diag(), descending=True), cols 0-1 are top-2 highest-H_ii sink columns where 1/Hinv[j,j] amplification drives negative-tail saturation most. Linear scaling of exp_575 (top-8, val=1.073162, size_blocked by 1755B) projects Δ≈-0.000076 at ~440B overhead. exp_556 (all cols, val=1.073030, size_blocked) and exp_584 (top-8+lgwin=24 size_blocked) confirm direction has real bpb gain; need smaller K to fit. z-loss parent may narrow tail distribution slightly vs exp_575's pre-arch parent. Code +15B (23296→23311)." -0.00008 discard 1.072395 +0.000144 15997932 600.073000 578.000000 1514.000000 apg-quan-0627  
634	2026-04-24T14:30:02Z	eval	596	596	eval	"Context-target-frequency (""unigram cache"") logit bias at TTT scoring: add damp=0.05 * mean-centered log-smoothed frequency of y_batch[:, :context_size] to logits before CE, zero-masked for ws=0. Context targets are strictly-prior val tokens scored in earlier windows."	-0.0008	size_blocked	1.072832		16004387	600.143000	590.400000	1527.000000	apg-eval-0628		"Untried axis in our tree: no eval-side cache-LM / context-prior bias trial exists (all prior ""logit bias"" attempts were STATIC learned parameters, size_blocked). Inspired by external PR #1350's L-BFGS SLOT (logit-space delta optimized on already-scored context positions) but uses a cheap closed-form frequency prior instead of L-BFGS — avoids memory/compute overhead and eval-budget risk. Mean-centering keeps the bias softmax-equivariant. Causal: context targets val_tokens[ws+1..ws+context_size] precede scored targets val_tokens[ws+context_size+1..ws+wlen] in the val stream and have all been scored in previous windows. damp=0.05 is conservative first probe; if keep, next step tunes damp."
635	2026-04-24T21:32:27Z	opt	596	596	opt	Bias-corrected EMA decay schedule: replace constant ema_decay=0.9965 with per-step _d=min(h.ema_decay, step/(step+1)) so the averaged weights at the end of training aren't biased toward the initial (post-warmup-restore) state. At step 0 the EMA is fully replaced by the post-step weights; _d hits the target 0.9965 around step 285 (~15% through the ~1800-step run), identical to current behavior thereafter.	-0.0005	crash						29.000000	apg-opt-0635		Untried axis: no prior opt trial has scheduled ema_decay over time. exp_393 raising target decay 0.9965→0.998 hurt (+0.002) because init-bias pollution grew; exp_007 resetting EMA at warmdown entry hurt (+0.002) because it dropped too much bulk history. Bias correction is the complementary fix — keeps the long target-decay memory intact while discarding the init junk. Under ~1800 steps with ema_decay=0.9965, initial weights contribute 0.9965^285≈0.37 at step 285 and ~5% even at step 850; this schedule zeros that at step 0 and converges to existing behavior before warmdown (frac>=0.28). One-line change; no new hparams/params/model bytes. | torch.distributed.elastic.multiprocessing.errors.ChildFailedError: ============================================================ (train_gpt.py:362 in __init__)
636	2026-04-24T21:35:26Z	reg	596	596	reg	"Set PREQUANT_TTT_WD default 0.0 -> 0.01: the 21-epoch full-parameter AdamW pre-quant TTT pass runs with zero weight decay in the baseline — this is the only AdamW optimizer in the pipeline with no WD (main-train AdamW scalar group = 0.02, Muon = 0.095/0.115), and it is an untouched axis across ~50 reg trials. A mild decoupled WD anchors 21-epoch val-adaptation drift, tightens weight norms into GPTQ int6 (lower clip-sigma error), and improves brotli compressibility.</hypothesis> <parameter name=""notes"">One-literal change at line 174 (PREQUANT_TTT_WD default 0.0 -> 0.01). Zero code-size delta, zero new params. Pre-quant TTT AdamW already reads h.prequant_ttt_wd into weight_decay kwarg (line 1130). Effective per-step decay lr*wd = 5e-4 * 0.01 = 5e-6; over ~2100 pre-quant TTT steps (21 epochs x ~100 chunk-batches/rank), cumulative weight shrinkage ~1% of non-decay equilibrium — small enough not to wash out val-adaptation signal but enough to pull overconfident post-adapt weights slightly toward 0 before GPTQ quantization grid. Untouched axis: no reg trial or any other specialist has modified prequant_ttt_wd; all WD trials have been on main-train Muon or scalar AdamW groups. Size-safe: slight weight shrinkage strictly improves int6 GPTQ + brotli-11, not hurts." -0.0005 crash      31.000000 apg-reg-0636  torch.distributed.elastic.multiprocessing.errors.ChildFailedError: ============================================================ (train_gpt.py:362 in __init__)
637	2026-04-24T21:36:32Z	tok	596	596	tok	Test embed_scale restoration	-0.0002	crash						26.000000	apg-tok-0636		torch.distributed.elastic.multiprocessing.errors.ChildFailedError: ============================================================ (train_gpt.py:362 in __init__)
638	2026-04-24T21:40:14Z	tok	596	596	tok	Retry exp_637 - restore exp_298 per-feature embed_scale gamma inside post-tok_emb RMSNorm	-0.0002	crash						27.000000	apg-tok-0638		torch.distributed.elastic.multiprocessing.errors.ChildFailedError: ============================================================ (train_gpt.py:362 in __init__)
639	2026-04-24T21:42:27Z	tok	596	596	tok	Restore exp_298 per-feature embed_scale gamma INSIDE post-tok_emb RMSNorm with explicit dtype cast to avoid fp32/bf16 autocast compile hazard (exp_637/638 crashed without cast)	-0.0002	crash						25.000000	apg-tok-0639		torch.distributed.elastic.multiprocessing.errors.ChildFailedError: ============================================================ (train_gpt.py:362 in __init__)
640	2026-04-24T21:49:30Z	arch	596	596	arch	Add parameter-free per-head sub-LN (F.rms_norm over head_dim) on attention output after XSA and before the data-dependent attn_out_gate: pairs with existing QK-norm so gate and proj receive unit-RMS per-head signal regardless of content strength.	-0.0005	crash				600.071000	28.900000	980.000000	apg-arch-0635		Single-site edit in CausalSelfAttention.forward between XSA and gate. Zero new params (RMSNorm without gamma). Complements QK-norm (already in code) to form sandwich normalization around softmax. Not attempted in this tree; nearest related trial exp_628 (final_gamma, discard, +0.002579) acted on final_norm output, a different site. Placement before gate preserves exp_538's per-head gate semantics (gate scales unit-norm heads); placing after reshape/before proj would neutralise the gate by normalising away its per-head scaling. Under GPTQ: proj's input distribution becomes more stable (bounded unit-RMS head blocks) which may also help calibration. | torch.distributed.elastic.multiprocessing.errors.ChildFailedError: ============================================================ (train_gpt.py:1033 in gptq_quantize_weight)
641	2026-04-24T21:52:15Z	tok	596	596	tok	"Raise EMBED_CLIP_SIGMAS 20.0 to 24.0 (+20% UP probe): exp_561 (to 14) and exp_570 (to 18) both DOWN-direction probes size_blocked at improved-bpb but oversize artifacts; UP direction is completely untried in tok history. Wider clip means larger GPTQ scale s = cs*row_std/127, so ~25% more weights round to 0 in tok_emb (4.2M params), giving better brotli-11 compression headroom; quant-error per non-zero only rises ~20%.</hypothesis> <parameter name=""notes"">Single-line default change at line 197 (EMBED_CLIP_SIGMAS 20.0 to 24.0). Zero new params, zero code-byte impact. Mechanism: SDClip uses s = clip_sigmas * row_std / (2^(bits-1)-1). Going 20 to 24 raises s by 20%, which enlarges the |w|<s/2 zero-rounding zone and concentrates int8 entropy near 0 for better brotli compression. Trade-off accepts mild fidelity loss (+~0.0005 bpb expected) for byte headroom that the recent best's child branches desperately need (most exp_596 children size_blocked). Even a discard at small +delta provides actionable signal on the UP direction's slope, complementing exp_561/570's DOWN measurements at 14/18 (size_blocked at bpb=1.072171 / 1.072307). Risk: low - single-literal change, isolated to GPTQ tok_emb path, no interaction with TTT or compile graph." +0.0005 crash      27.000000 apg-tok-0641  torch.distributed.elastic.multiprocessing.errors.ChildFailedError: ============================================================ (train_gpt.py:362 in __init__)
642	2026-04-24T22:00:56Z	ttt	596	596	ttt	Floor TTT cosine-decay LR at 20% of peak (h.ttt_lr * 0.2) so late chunks continue adapting; current schedule gives last ~25% of chunks cos_lr < 10% of peak, effectively freezing them despite scoring-first order. Z-loss stabilizes per-step noise enough to afford more late-chunk adaptation.	-0.0003	discard	1.073544	+0.001293	15998326	600.048000	598.000000	1540.000000	apg-ttt-0636		Single-line edit at the TTT cos_lr line: wraps the cosine expression in max(..., h.ttt_lr * 0.2). Zero architectural impact; zero model-byte impact; tiny code-byte delta. Direction untested in tree: all prior TTT-schedule trials kept the cosine-to-zero tail. Complements exp_596 z-loss which already reduced per-step gradient variance.
643	2026-04-24T22:01:15Z	curr	596	596	curr	Mask training-CE loss on positions 0..3 of each sequence via y[:, :4] = -100 in ShuffledSequenceLoader.next_batch — F.cross_entropy's default ignore_index=-100 handles it (no forward edit). These 4 cold-start positions have 0-3 tokens of context (pure unigram/bigram regime), contribute ~0.2% of gradient signal, and are far from the 1984+-ctx regime eval scores under stride-64 sliding windows. Cleanly redirects that sliver of gradient to high-context positions.	-0.0003	discard	1.072996	+0.000745	15998949	600.153000	530.400000	1430.000000	apg-curr-0637		Single-line loader edit (+~15 packed bytes). exp_078 proposed a very similar mask-4 scheme but was harness_abort (never actually ran); exp_013 (mask 32) and exp_309 (mask 64) both size_blocked, suggesting aggressive masking bloated code — at 4 positions this is strictly minimal. Calibration loader calls next_batch too but uses only x (discards y), so GPTQ is unaffected; eval_val constructs y directly from val_tokens so -100 mask never appears there. TTT paths have their own per-chunk CE and bypass ShuffledSequenceLoader. Pure re-targeting of train-gradient distribution toward the eval-relevant long-context regime.
644	2026-04-24T22:02:28Z	meta	596	596	meta	muon_wd (attn-only Muon WD) 0.095 → 0.090 (-5.3% DOWN): smaller-step probe on the attn sub-group of the exp_164 type-split, untested across the size_blocked -7%/-8% probes (exp_414 discard, exp_346/489 size_blocked) and now evaluated under the new z-loss + attn_out_gate + Gradient-Centralization regime where the data-dependent gate already regularizes attn matrices, so the joint WD optimum should shift DOWN (exp_336 mechanism: probe DOWN on each sub-group first).	-0.00008	size_blocked	1.072766		16002483	600.149000	581.500000	1519.000000	apg-meta-0637		Single-literal edit at line 166 (MUON_WD default 0.095 → 0.090). Size-neutral code change (0-byte delta in code). The change only affects Muon.weight_decay on the matrix_attn_params group (created in Optimizers.__init__ line 912); matrix_mlp_params keeps muon_wd_mlp=0.115 and all AdamW groups are untouched. Smaller magnitude than prior -8% attn DOWN probes (exp_414 discard +0.000192, exp_489 size_blocked at 1.074149, exp_346 size_blocked at 1.075010) gives a more gentle trajectory change and hence better odds of passing the size gate that failed at -7/-8%. If attn Muon WD optimum really has shifted DOWN under the newer regularizers (exp_538 attn_out_gate, exp_596 z-loss, exp_592 GC on TTT), expect a small improvement; if the old -8% discard signal was the true ceiling for DOWN, expect modest regression (~+0.0001).
645	2026-04-24T22:02:54Z	loss	596	596	loss	Extend z-loss regularization from TTT inner CE (already at 1e-5) into MAIN pretraining CE at 5e-7 (conditional on self.training), so logit-partition is kept under control throughout the ~10k training steps too — an untouched axis in our tree (all 5 recent loss trials targeted TTT only).	-0.0004	discard	1.073238	+0.000987	15999158	600.031000	594.100000	1543.000000	apg-loss-0637		Edit at line ~772 of GPT.forward: compute CE as before, then if self.training add 5e-7 * logsumexp(logits,-1)^2.mean(). Coefficient 5e-7 is 20x smaller than TTT's 1e-5 to account for ~100x more training steps. Guard self.training so eval_val scoring (which shares forward) remains unchanged and val_bpb accounting stays clean. Expected mechanism: better-calibrated logit scales going INTO GPTQ calibration, compounding with eval-time TTT z-loss. Risk: train_s is ~596s already (4s headroom); a logsumexp per forward adds trivial compute but recompile from self.training flip could add latency — mitigated since torch.compile time doesn't count toward budget.
646	2026-04-24T22:05:08Z	quant	596	596	quant	Mild six-sigma winsorized row_std in GPTQ SDClip: clamp W before recomputing std, finer bins on heavy-tail rows.	-0.00010	size_blocked	1.072235		16002325	600.008000	588.900000	1531.000000	apg-quan-0638		Softer version of exp_092 MAD direction to avoid size_block.
647	2026-04-24T22:05:43Z	opt	596	596	opt	Disable MuonEq-R row-normalization on MLP matrix group only (attn keeps row_normalize=True). Novel opt axis: per-group toggle of the row-equalization pre-NS5 step. MLP matrices are tall/skinny (4*D x D) with heterogeneous hidden-neuron row magnitudes that row-normalization squashes before NS5; exp_241's notes already implicate row_normalize in amplifying small-sigma directions. Keeping attn row-normalized preserves the per-head equalization MuonEq-R was designed for while letting NS5 see natural MLP row-norm variance.	-0.0003	size_blocked	1.107760		16152163	600.079000	528.400000	1429.000000	apg-opt-0639		"Single-site 26-byte edit: add `""row_normalize"": False` to the MLP Muon param group dict in Optimizers.__init__ (line 913). The Muon.step loop already reads row_normalize per-group via `group.get(""row_normalize"", False)`, and the constructor-supplied defaults propagate row_normalize=True to attn. Zero new params, zero model_bytes change, zero eval-time impact. Prior art: exp_520 (per-group momentum split, discard +0.00031), exp_164/exp_336 (per-group WD split, both keeps). Per-group row_normalize split is genuinely untried across 635 trials. Risk: if MLP benefits from row-normalization more than attn does, we'd expect a mild regression; this is a signal-revealing probe either way."
