exp_id	timestamp	specialist	parent_exp	baseline_exp	domain	hypothesis	expected_delta	status	val_bpb	delta_vs_best	artifact_bytes	train_s	eval_s	total_s	job_name	snapshot_path	notes
038	2026-04-22T05:25:41Z	tok	017	017	tok	Lower tied_embed_init_std 0.005→0.003 (closer to NanoGPT's 0.02·sqrt(2/(5·n_layer))≈0.0038 prescription): smaller embedding-row entropy compresses better post-GPTQ (more byte headroom) and softens initial tied-head logits, giving a cleaner early CE gradient without changing any code paths.	-0.0003	discard	1.078585	+0.000526	15990492	600.119000	753.881000	1468.000000	apg-tok-0038		One-line hparam change: Hyperparameters.tied_embed_init_std default 0.005→0.003. No structural changes, no new params, no new code paths — a deliberately minimal, low-crash-risk tok move after the 18-crash streak. Complements exp_011 (0.005→0.02) which was size_blocked AND worse val — that direction clearly points smaller. exp_019 (equi-row-norm at std·sqrt(d)) and exp_032 (trunc_normal_) didn't work, so sticking with the same distribution shape and only tightening scale. Expected: marginally better compression headroom and slightly smoother early training.
039	2026-04-22T05:26:02Z	ttt	017	017	ttt	Raise TTT SGD momentum 0.9→0.95: in the very-low-step-count-per-chunk TTT regime (≈4 SGD steps/chunk under a steep cosine-over-chunks LR), higher momentum better smooths/transfers gradient signal from high-LR early chunks into low-LR later chunks without perturbing scoring.	-0.0006	discard	1.078237	+0.000178	15998444	600.024000	752.976000	1462.000000	apg-ttt-0038		Only change: line 176, ttt_momentum default 0.9 → 0.95. Unexplored TTT knob (prior TTT trials touched epochs/nesterov/anchor/schedule-shape). No code-bytes growth, no model-bytes impact (eval-only schedule scalar). Chose 0.95 over 0.99 as a conservative midpoint — 0.99 risks overshoot given the tiny batch and short schedule. Rebased workdir to exp_017 first to clear stale nesterov=True from crashed exp_031.
040	2026-04-22T05:26:03Z	reg	017	017	reg	MLP hidden dropout p=0.05 between silu²(fc(x)) and proj — first dropout-based regularizer tried in this tree, targets the widest activation tensor per block for maximum regularization impact with zero params/bytes added.	-0.0008	discard	1.087850	+0.009791	15997234	600.998000	767.002000	1482.000000	apg-reg-0038		One-line change inside MLP.forward: wrap the post-silu² hidden in F.dropout(p=0.05, training=self.training) before the down-projection. Hits the 2048-wide MLP hidden (11 blocks × unique weights; 3-layer recurrence means looped blocks see independent dropout masks each iteration — effectively deeper regularization). Rationale vs prior reg trials: exp_012 (input-token replacement, size_blocked — perturbed embedding gradient distribution, weights drifted high-entropy) and exp_033 (NEFTune, crashed during cluster fault window) both perturbed the embedding/input side. MLP-internal dropout is structurally different: it regularizes the widest hidden and leaves embeddings untouched, so weight entropy of tok_emb (the largest GPTQ tensor) is unchanged → should be size-neutral. Compile safety: F.dropout compiles cleanly; self.training branches are handled by torch.compile dynamic shapes/specialization (train vs eval graphs cached separately, same as any standard nn.Dropout). TTT scoring uses inference_mode+model.eval() → dropout = identity, no interference with score-first protocol. TTT inner-train toggles train(), so dropout is active during inner SGD — this may marginally hurt per-chunk fit but is consistent with training-time regularization philosophy. Expected magnitude: p=0.05 is mild; classical GPT-2 used 0.1 residual dropout. Starting small since no MLP dropout has ever been tried here and 35M params at high-depth recurrence may already be under-regularized. Size impact: net code_bytes went 21718→21473 (-245B) — single-liner is actually shorter than the f-string log line it displaces in the pack diff.
041	2026-04-22T05:26:06Z	meta	017	017	meta	Lower embed_wd 0.085→0.07 (≈18% reduction): tied tok_emb matrix also serves as the output head under tie_embeddings=True, so current WD doubly constrains both input representations and output logits; a small loosening gives the most visible parameter a hair more capacity without approaching zero-WD territory.	-0.0005	size_blocked	1.078695		16001508	600.631000	758.369000	1473.000000	apg-meta-0038		Meta-axis gap: weight-decay coefficients have never been tweaked by any specialist across 37 trials. embed_wd=0.085 is atypically high (canonical AdamW on LM embeddings is 0.01–0.1, and here the tied head shares this WD). Single-literal edit on line 164, no code-bytes growth, no schedule change, no interaction with recent crash-patterns (exp_022 shorter warmdown_frac, exp_029 wider momentum warmup, exp_036 cosine-cool grad_clip). Magnitude (~18%) matches exp_003's successful EMA radius. Downside-bounded: if WD was helping, signal will be small-positive discard; if overshooting, small-negative keep.
042	2026-04-22T05:26:35Z	loss	017	017	loss	Lower label_smoothing 0.003 → 0.001: val BPB uses plain CE (no smoothing), so training smoothing creates a train/val objective mismatch — shrink it 3× while keeping a tiny 0.001 safety floor against rare-row drift with tied embeddings.	-0.00025	discard	1.079985	+0.001926	15972057	600.115000	770.885000	1483.000000	apg-loss-0038		"Only change: F.cross_entropy label_smoothing=0.003 → 0.001 in GPT.forward (line 705). Zero code-byte growth, zero model-byte growth, no new control flow — maximally safe edit. Rationale vs prior loss trials: exp_009 (additive z-loss α=1e-4) was Δ=+0.003180, showing this model is already well-regularized — the fix direction is to REMOVE regularization, not add. exp_026 (anneal smoothing 0.02→0) and exp_034 (position-weighted CE) both crashed environmentally (18 consecutive crashes across all specialists in two bursts). I'm going with the simplest possible edit to test the ""less smoothing helps"" direction without any code complexity that could mask a real signal. At V=8192 with logit_softcap=15 bounding logit norm, rare-row collapse is well-controlled by existing mechanisms, so a trickle (1.2e-7 prob mass per non-target) should suffice."
043	2026-04-22T05:26:46Z	opt	017	017	opt	Replace linear LR warmdown with cosine warmdown over the same 72% window — exp_002's proven idea (-0.000577 in isolation) was never combined into the exp_017 baseline (lineage went exp_000→exp_005→exp_017, skipping exp_002); cosine is C¹-smooth at both endpoints and compounds cleanly with the Muon-momentum cosine-cool already in place from exp_010, yielding a cos² product LR×momentum trajectory during warmdown.	-0.0003	discard	1.078837	+0.000778	15994832	600.110000	759.890000	1472.000000	apg-opt-0038		Single 6-line edit to lr_mul() only. Replaces `(1.0 - frac) / h.warmdown_frac` (linear 1→0) with `0.5 * (1 + cos(pi * t))` where t=(frac - (1 - warmdown_frac)) / warmdown_frac (0→1 through warmdown). Same integral as linear (both 0.5 * warmdown_frac), so total gradient-update budget in warmdown tail is preserved — the only change is curve shape. Cosine is tangent to 1 at entry and tangent to 0 at end (zero derivative at both endpoints), avoiding the discontinuous-slope corner of linear-warmdown entry. Risk analysis: exp_002 proved cosine-warmdown safe on exp_000 baseline (-0.000577, kept); exp_017 adds exp_010's Muon-momentum cooling (`muon_momentum = 0.92 + 0.07 * frac_mm * lr_scale`) which reads lr_scale = lr_mul(frac). Under cosine warmdown, muon_momentum now cools via cos(pi*t) instead of linear — same endpoints (0.99→0.92) but smoother hand-off. No optimizer-state surgery during warmdown, so exp_021/036 crash modes don't apply. math.cos is already imported. Expected magnitude -0.0003 (reduced vs exp_002's -0.000577 due to diminishing returns after EMA-averaging the tail and TTT smoothing the eval).
044	2026-04-22T05:27:16Z	eval	017	017	eval	Apply T=1.05 logit temperature calibration in eval_val_ttt scoring (divide logits by 1.05 before cross_entropy) — GPTQ-int6 + TTT models typically over-concentrate probability mass; mild softening of the softmax is a standard post-hoc calibration trick that lowers NLL on over-confident models without touching TTT SGD dynamics.	-0.001	discard	1.080666	+0.002607	15996108	600.054000	751.946000	1464.000000	apg-eval-0038		Pure post-prediction calibration within eval domain. One-line change: `logits.reshape(-1, logits.size(-1)).float()` → `(logits.reshape(-1, logits.size(-1)) / 1.05).float()` in eval_val_ttt scoring. TTT training loop unchanged (still uses un-tempered base_model(x,y) loss), so adaptation dynamics identical. exp_024 (stride) and exp_037 (ttt momentum cool) crashed — this is structurally simpler (single float op on scoring logits) and should be robust to whatever caused those crashes. T=1.05 is a moderate smoothing; if direction is wrong the effect is small since temp is near 1.
045	2026-04-22T05:27:28Z	quant	017	017	quant	Hessian-weighted closed-form per-row scale refinement after GPTQ (keeping Q fixed): analytically solve s_r = (Q_r·H·W_r)/(Q_r·H·Q_r) — the exact minimizer of ‖W-sQ‖²_H at fixed Q — replacing the heuristic clip_sigmas·row_std/clip_range. Q bytes unchanged so brotli payload is size-neutral, only the fp16 per-row scales shift, with fallback to heuristic when refined value is non-finite or >4× away.	-0.002	size_blocked	1.078577		16001173	600.033000	765.967000	1475.000000	apg-quan-0038		Motivation: exp_004 (grid-search scale, size_blocked @ 1.0708) and exp_008 (per-layer α grid, size_blocked @ 1.0727) both showed very large bpb gains from better scales, but they re-quantized Q → entropy rose → brotli blew up. Closed-form refinement at FIXED Q strictly reduces the Hessian-weighted reconstruction error (the GPTQ objective itself) without touching Q, so the compressed payload is bytewise identical — only ~100 KB of fp16 scales change. exp_020 (the previous attempt at a fixed-Q scale refinement) crashed; this version is defensive: operates entirely on CPU in the already-permuted (Q,H) frame, clamps denominator, falls back to the heuristic on non-finite or out-of-band (>4× or negative) refinements. Expected: captures a fraction of the 0.006-0.008 bpb gap shown by exp_004/008 without the size blowup.
046	2026-04-22T05:28:02Z	arch	exp_017	017	arch	Increase depth-recurrence num_loops 2→3: the shared loop segment [3..5] is replayed 4 times instead of 3, growing effective depth from 17 to 20 layers during active-recurrence phase — pure parameter-free capacity via the architecture's core param-golf trick.	-0.001	eval_budget_overrun	1.085969			600.162000	816.838000	1533.000000	apg-arch-0038		Single default change: NUM_LOOPS 2→3 on line 136. No new params, no code-byte growth. Depth during active phase: 3 pre-loop + 4×3 loop + 5 post-loop = 20 layers (vs 17 baseline, +17.6% block calls). Step time +~18% during ~65% active phase → ~11% fewer total steps; the tradeoff bets that extra depth > extra steps at 36M-param scale. Untried direction in the tree — all prior arch work focused on XSA / RoPE / MLP / residual topology, never touching the num_loops knob. Looping activation curriculum (enable_looping_at=0.35) is preserved, so the first 35% of training still runs shallow for gradient flow stability.
047	2026-04-22T05:28:28Z	curr	017	017	curr	Halve training-sample stride (seq_len→seq_len//2) in ShuffledSequenceLoader so each in-shard token serves as a training target at two distinct context-window offsets per epoch, lightly augmenting prefix-context diversity without changing total tokens/step.	-0.0003	discard	1.079067	+0.001008	15996422	600.078000	757.922000	1490.000000	apg-curr-0038		Curriculum is an under-explored direction: exp_013 (first-32-position loss mask) went size_blocked and exp_025 (stride→seq_len//4) crashed — but the baseline actually uses stride=seq_len (disjoint), not seq_len//2 as exp_025 assumed. This trial establishes the true stride=seq_len//2 midpoint. Bounds-safe num_sequences formula (num_tokens-seq_len-1-phase)//stride+1 replaces the looser baseline expression, and max_phase tightened to stride-1 so phase never exceeds one stride. Only mutation is _reset_shard; calib_loader uses the same loader so Hessian samples shift position slightly but still draw legal calibration data. No param/shape changes; code grows ~100 B. Model bytes should be essentially unchanged under identical quantization pipeline.
048	2026-04-22T05:55:21Z	meta	017	017	meta	Lower adam_eps 1e-8→1e-10 (nanoGPT-speedrun default): finer preconditioner denominator for low-variance Adam groups (tied tok_emb, scalars/gates) lets small-gradient rare-token rows and control tensors keep taking meaningful steps late in warmdown.	-0.0010	size_blocked	1.078333		16000484	600.051000	762.949000	1483.000000	apg-meta-0048		Meta-axis gap: adam_eps never touched across 41 trials. Single-line default change on line 158 (1e-8 → 1e-10); flows into three Adam/AdamW optimizers (tok AdamW w/ embed_wd=0.07, scalar AdamW w/ adam_wd=0.02, head Adam — currently no-op under tie_embeddings=True). Zero-byte / zero-time cost. Rationale: at late warmdown where gradients shrink ~linearly with lr_scale, effective Adam step lr*m/(sqrt(v)+eps) behaves like lr when v>>eps^2 but collapses for tensors with tiny variance (rare-vocab tied embedding rows, learnable QK gain, RMSNorm/skip scalars). Smaller eps keeps preconditioning active on those exact parameters. nanoGPT-speedrun and Karpathy GPT-2 recipes default to eps=1e-10 for small-LM pretrain. Orthogonal to prior meta work (exp_003 EMA decay, exp_015 muon momentum start, exp_041 embed_wd). Risk: grad_clip_norm=0.3 bounds any over-aggressive step from a near-zero-variance row.
049	2026-04-22T05:55:23Z	ttt	017	017	ttt	Freeze tied tok_emb during TTT: exclude the 8192×512 tied embedding from the TTT SGD param list (all other params still adapt). tok_emb receives ~2x backward gradient via the tied input+output path, and each 32K chunk only touches a small fraction of the 8192 vocab → sparse, over-aggressive row updates on a high-curvature matrix; freezing it prevents vocab-row drift while attention+MLP still do local-style adaptation.	-0.0008	discard	1.078282	+0.000223	15995683	600.127000	761.873000	1475.000000	apg-ttt-0048		"Parameter-efficient TTT — unexplored knob in this tree (prior ttt trials: epochs, momentum, nesterov, anchor, schedule-shape; none filtered WHICH params update). Implementation: ttt_params filters out any named param containing ""tok_emb""; explicit requires_grad=False on tok_emb to save backward compute. Grad clip / all-reduce / optimizer all operate on filtered list. Compiled scoring graph (forward_logits) unchanged. Training-time loop and torch.compile baseline both untouched — this is an eval-only change."
050	2026-04-22T05:55:29Z	reg	017	017	reg	Pre-final-norm residual dropout p=0.03: a single F.dropout on the residual stream just before final_norm in forward_logits — applied once per forward pass (no recurrence compounding, unlike exp_040's MLP dropout which triggered 3× in looped blocks 3-5), regularizes only the final representation feeding logits, disabled under inference_mode so TTT is unaffected.	-0.0008	discard	1.080235	+0.002176	15997025	600.023000	770.977000	1483.000000	apg-reg-0048		Reg domain history: exp_012 (token replacement) size_blocked, exp_033 (NEFTune) crashed, exp_040 (MLP hidden dropout p=0.05) discarded badly (+0.0098) — likely because MLP sits inside recurrent blocks 3-5 so dropout compounded 3× per pass. This edit places a single F.dropout call OUTSIDE the recurrence (after the last decoder block, before final_norm), at a gentler p=0.03. Targets the post-block residual that is most directly tied to logit overfitting. Single point of application → predictable regularization strength. No new params, no new code paths, +~40 code bytes. Rebased to exp_017 from prior workdir state.
051	2026-04-22T05:55:35Z	tok	017	017	tok	Add a learnable scalar logit_scale (init 1.0) applied before the tanh softcap, acting as a learned output-softmax temperature that decouples softmax sharpness from the slow growth of tied tok_emb rows (std=0.005 init → tiny logits for many steps).	-0.0006	discard	1.081657	+0.003598	15984112	600.100000	758.900000	1472.000000	apg-tok-0048		One scalar fp32 parameter (~4 bytes) added to GPT as self.logit_scale, injected into scalar_params so the AdamW scalar optimizer trains it. forward_logits: logits_proj *= scale before softcap tanh, preserving the ±30 hard bound. Init 1.0 is a drop-in neutral at step 0 (identical behavior to baseline). Tied tok_emb rows start at norm ~0.005·√512≈0.113, so early logits_proj has magnitude ~0.1–0.3 → far from softcap saturation → softmax is uniform-ish for many steps; a learnable scalar lets the model ramp logit sharpness from step 0 instead of waiting for tok_emb to grow. Prior tok attempts tried init_std tweaks (011 size-block, 038 discard, 019 discard) or per-vocab bias (023 crash) — a single scalar is structurally much safer than 8192-element bias and doesn't touch compression entropy. Registered via hasattr guard in Optimizers to avoid breaking rebased baselines. Preflight ok: code 21.6 KB, syntax ok, headroom ~180 KB untouched.
052	2026-04-22T05:56:17Z	opt	017	017	opt	Replace the linear Muon-momentum warmup ramp with a cosine ramp of identical integral/endpoints, giving C¹-smooth transitions at t=0 and t=1 and a continuous derivative into the existing exp_010 cosine cool-down.	-0.0005	discard	1.078428	+0.000369	15990568	600.105000	765.895000	1476.000000	apg-opt-0048		Single 3-line edit in muon_momentum_frac(). Linear `min(elapsed_ms / warmup_ms, 1.0)` → `0.5 * (1 - cos(π * t))`. Endpoints and integral unchanged (both 0→1 over the same window, mean=0.5). Derivative changes: linear had d=1 everywhere; cosine has d=0 at both ends and peak d=π/2 at t=0.5. This makes the combined warmup→peak→cool-down (exp_010) momentum trajectory C¹-continuous, matching the smoothness of the cosine LR warmdown (exp_002). Zero code-byte growth, zero structural change, no new hparams. Opt-axis is the only one with momentum-schedule shape left to explore: exp_015/029 touched the start/length, exp_010 touched the cool-down shape, but the ramp *shape* itself is still linear.
053	2026-04-22T05:57:07Z	curr	017	017	curr	Drop training-sample stride from seq_len//2 to seq_len (no overlap)	-0.0004	discard	1.078446	+0.000387	15996535	600.109000	755.891000	1471.000000	apg-curr-0048		One-line edit in ShuffledSequenceLoader._reset_shard: stride = self.seq_len // 2 -> stride = self.seq_len. Opposite direction to exp_047/exp_025 which reduced stride and hurt. Removes gradient correlation between 50%-overlapping consecutive samples and doubles shard-reshuffle frequency so each token is seen across more random phases.
054	2026-04-22T05:57:10Z	loss	017	017	loss	Replace plain CE with focal reweighting γ=0.5 ((1-p_t)^0.5, mean-preserving) — shifts gradient mass toward hard tokens instead of regularizing toward uniform (opposite direction to the 4 prior loss trials that all hurt).	-0.0008	discard	1.080594	+0.002535	15999330	600.013000	764.987000	1480.000000	apg-loss-0048		"Loss-tree status before: 4/4 loss trials hurt (exp_009 z-loss +0.003, exp_042 label_smoothing +0.002, exp_026/exp_034 crashed). Both non-crash losses were ""push toward uniform"" regularizers. Focal reweight goes the opposite way — upweights hard tokens, downweights easy ones, with mean-preserving normalizer so overall scale unchanged. Implementation: F.cross_entropy(reduction=""none"") → per_tok, then w=(1-exp(-per_tok))^0.5 under no_grad, mean-preserve normalize, return (w*per_tok).mean(). γ=0.5 conservative (at p_t=0.9 weight≈0.32, at p_t=0.5 weight≈0.71). No new params, no code-byte/model-byte growth, training-only (val forward unchanged). Safety vs exp_034 (crashed on position-weighted CE): shape-matched broadcast because w and per_tok both come from logits_flat[B*T,V] → [B*T], and all math is inside with torch.no_grad(); no autograd path through weights."
055	2026-04-22T05:57:20Z	quant	017	017	quant	Use Hessian-diagonal-weighted row_std (weighting each column by H_ii) instead of unweighted std for the INITIAL SDClip scale — aligns the clip budget with the GPTQ objective ‖W-W_q‖²_H without touching Q codes post-hoc, so compressibility is preserved unlike prior scale-refinement attempts (exp_004/008/045 all size_blocked).	-0.0008	size_blocked	1.077829		16542957	600.125000	755.875000	1470.000000	apg-quan-0048		Replaces `row_std = W_orig.std(dim=1)` with Hessian-weighted std computed in permuted space (H already permuted to match W_perm). Size-neutral in expectation: Q is still `round(W_perm/sf)` with sf in the same clip_sigmas*row_std/clip_range family — just row_std is now activation-variance-weighted. High-activation input columns (where quant error hurts output most) get more weight in determining the row scale; low-activation columns contribute less. Unexplored axis vs the 3 prior size-blocked scale-refinement trials which all modified s AFTER Q was fixed.
056	2026-04-22T05:58:29Z	arch	017	017	arch	Shift the 3-layer recurrence segment one layer deeper: loop_start 3→4, loop_end 5→6 — rebalances encoder/decoder distribution of looped vs unique slots without changing effective depth, params, bytes, or FLOPs.	-0.0008	discard	1.080515	+0.002456	15994564	600.117000	760.883000	1477.000000	apg-arch-0048		Zero byte, zero FLOP change; only physical-block indices shift. Loop-position axis unexplored across 46 trials. Prior arch sweeps touched num_loops (exp_046 eval_budget_overrun) and xsa_last_n (exp_028 crash). Baseline 17 effective layers preserved (num_loops=2 with 3-layer segment). New distribution: encoder 4 unique + 4 loop slots, decoder 5 loop slots + 4 unique — more symmetric than baseline 3/5 + 4/5.
