exp_id	timestamp	specialist	parent_exp	baseline_exp	domain	hypothesis	expected_delta	status	val_bpb	delta_vs_best	artifact_bytes	train_s	eval_s	total_s	job_name	snapshot_path	notes
258	2026-04-22T18:43:33Z	arch	245	245	arch	Learnable scalar MLP-attn coupling β (init=0) in parallel blocks: inside blocks 7-10, feed β*attn_out into mlp_norm's input (mlp_in = x_in + β*attn_out). At init β=0 exactly recovers PaLM-style parallel block (zero regression risk); training can drift β>0 to restore partial sequential-block expressiveness without collapsing parallel residuals. Orthogonal to exp_245 (loop ln_scale) and exp_254 (static parallel ln_scale, discarded — that was a damper, this is a cross-path conditioner). Adds 11 scalar params (~44 bytes fp32), zero compute bump at init.	-0.0005	crash						27.000000	apg-arch-0257		Two-site edit: (a) Block.__init__ adds self.parallel_mlp_attn_coupling = nn.Parameter(torch.zeros((), dtype=torch.float32)); (b) Block.forward parallel branch computes beta=coupling.to(x_in.dtype), mlp_in = x_in + beta*attn_out, mlp_out = mlp(mlp_norm(mlp_in)*ln_scale_factor). Residual sum unchanged. Param has ndim=0 so routes to scalar_params (AdamW @ scalar_lr=0.02, wd=adam_wd=0.005). Name doesn't match CONTROL_TENSOR_NAME_PATTERNS so normal scalar handling applies. Non-parallel blocks carry the param but never read it (dead branch, zero grad). Expected: small negative delta if parallel blocks benefit from any attn→mlp conditioning; otherwise β stays near 0 and result tracks noise around baseline. | torch.distributed.elastic.multiprocessing.errors.ChildFailedError: ============================================================ (train_gpt.py:1486 in step_fn)
259	2026-04-22T18:43:52Z	curr	245	245	curr	Cross-shard anti-correlated phase cycles: replace per-shard independent permutation(8) with a shared base permutation shifted by shard-index mod 8, so concurrent shards always use distinct phases (eliminating the ~12.5% phase-collision probability per pair) and batches spanning multiple shards see maximally diverse positional offsets.	-0.00006	discard	1.075711	+0.000961	15995235	600.039000	765.961000	1476.000000	apg-curr-0250		Single-line edit at ShuffledSequenceLoader.__init__. Before: each shard gets its own rng.permutation(8); at any _phase_epoch value j, two random shards collide on the same phase ~12.5% of the time, reducing within-batch positional-offset diversity. After: one shared _base = rng.permutation(8), and _phase_order[si][j] = (_base[j] + si) % 8. Each shard's 8-reset cycle still visits all 8 phases (permutation property preserved). At any j, shards with distinct (si%8) are GUARANTEED distinct phases. For ~13 shards/rank, first 8 shards collision-free; remaining 5 minimally overlap with first 5 — strictly better cross-shard phase diversity than random. Orthogonal to exp_196 (stratified shard-count quotas) and exp_142 (per-shard deterministic phase cycle — this one is CROSS-shard). Zero cost: no new params, no new data access, no new ops. RNG state advances by 1 permutation call vs len(files) calls — tiny seed-drift but negligible. Expected gain in line with prior curr kept wins (exp_142 -0.000024, exp_196 -0.000087).
260	2026-04-22T18:44:21Z	tok	245	245	tok	Add output-side per-feature readout gain (shape=[embedding_dim], init=1.0) applied right before the tied F.linear softmax after final_norm/head_proj. Structurally distinct from exp_190's input-side embed_scale (which is not on the exp_245 branch): the input gamma modulates the residual stream as it enters, the output gain modulates logit computation — breaks hard-tied symmetry in an orthogonal direction.	-0.00025	discard	1.076893	+0.002143	15975695	600.049000	775.951000	1482.000000	apg-tok-0251		Three-site edit on exp_245 base (rebased fresh since my prior workdir had exp_249's discarded logit_bias). (1) GPT.__init__ adds self.output_gain = nn.Parameter(torch.ones(h.embedding_dim, fp32)) right after tok_emb. (2) forward_logits applies x = x * self.output_gain.to(x.dtype) between final_norm/head_proj and the tied F.linear. (3) Optimizers.__init__ appends base_model.output_gain to scalar_params. 512 fp32 = 2KB raw; numel<=65536 so GPTQ passthrough as fp16 (~1KB on disk). Zero size/compile risk. Mechanism: in tied-embedding setup, tok_emb rows do input lookup, its columns do output classification; per-feature output gain reweights classification without untying, giving dimensions independent input/output importance. Orthogonal to exp_190 (not present here).
261	2026-04-22T18:49:24Z	quant	245	245	quant	Shrink GPTQ block_size 64→32 (halve from exp_108's winning 128→64): doubles cross-block Hessian-aware error-propagation events per weight matrix from 8 to 16, moves GPTQ closer to exact Optimal-Brain-Surgeon per-column updates without changing quantization codes/scales distribution (zero brotli entropy impact, zero size risk).	-0.00015	keep	1.074724	-0.000026	15994232	600.134000	758.866000	1469.000000	apg-quan-0252	snapshots/261_quant	"Single-literal default-arg edit at line 998 of gptq_quantize_weight. exp_035 tried 128→32 but harness-aborted (never measured); current best is 64 (exp_108). Stacks the ""finer error propagation"" axis on top of exp_212's damping-0.02 keep. Zero-byte change (same int8-stored int6 codes, same per-row fp16 scale shape, same compression path) — only Hessian-weighted cross-block correction cadence changes, so size_blocked risk is zero. Expected bpb improvement small (~half of exp_108's -0.000079 since log-halving of block size yields diminishing returns as GPTQ asymptotes toward exact OBS)."
262	2026-04-22T18:50:55Z	opt	245	261	opt	Cool Adam beta2 (0.95→0.90) during LR warmdown in lockstep with lr_scale on the two AdamW groups (tok_emb + scalar), mirroring exp_010's proven Muon-momentum cool — faster 2nd-moment adaptation in the low-LR tail lets preconditioning track recent gradient variance on rare-signal directions.	-0.0003	size_blocked	1.075224		16001001	600.108000	764.892000	1482.000000	apg-opt-0252		"Two-site edit: new hparam beta2_warmdown_end=0.90 at line 165-block, plus in-loop update of group[""betas""]=(h.beta1, adam_beta2) on all non-Muon optimizers right after the existing muon_momentum warmdown cool. Zero-byte, zero-param, zero-eval-cost. exp_021 proposed this but was harness-aborted (never executed). Raising beta2 was uniformly bad (exp_091/126/159/182 all discards → 2nd moment already over-smoothed), but the symmetric LOWER direction during warmdown has never been tested in isolation. Kept beta1 fixed at 0.9 since exp_163 already tested aggressive beta1 cool (0.9→0.8, discard +0.000146) — the aggressive drop was likely the problem there, and this trial keeps the variables separated."
263	2026-04-22T18:58:26Z	meta	exp_245	261	meta	Raise AdamW BETA1 0.9→0.92 on all AdamW groups (tied tok_emb + scalar params + optional lm_head): a smaller version of exp_136's 0.9→0.95 which size_blocked at bpb=1.077256 but never had its training signal confirmed, and a genuinely untested point between exp_075's failed 0.9→0.8 (discard +0.001267) and the LLM-standard 0.95.	-0.00015	discard	1.075632	+0.000908	15997273	600.108000	758.892000	1468.000000	apg-meta-0254		Single-literal edit at train_gpt.py:159 (BETA1 default 0.9→0.92). Adam beta1 controls first-moment half-life (~10 steps at 0.9, ~13 at 0.92 — gentle smoothing of momentum updates). exp_136 tried 0.95 (size_blocked, val_bpb=1.077256 which beat the 1.076944 best at that time), but the 5pt jump pushed artifact >16MB after GPTQ+brotli. 0.92 is a 2pt perturbation — smaller distributional shift on weights fed to GPTQ, so pack-size risk is much lower. Exploring the UP direction first probed by exp_136; DOWN direction (exp_075 0.9→0.8) was decisively discarded at +0.001267, making UP the only remaining direction on this axis. Orthogonal to all other recent meta tweaks (exp_252 tied_embed_lr, exp_233 grad_clip, exp_177 adam_wd), and interacts only through AdamW moment estimates which are discarded post-training (zero direct model-size contribution; only indirect via the weight distribution entering GPTQ).
264	2026-04-22T19:02:22Z	ttt	245	261	ttt	Alternate TTT batch-traversal order across per-chunk epochs (fwd, rev, fwd, rev): decorrelates SGD+momentum noise across epochs and smooths both epoch- and chunk-boundary transitions (chunk i's last batch ends spatially near chunk i+1's first batch under even ttt_epochs=4).	-0.0003	keep	1.074640	-0.000084	15991808	600.077000	750.923000	1462.000000	apg-ttt-0254	snapshots/264_ttt	Single-site 6-line edit inside eval_val_ttt training loop (line ~1367). Zero bytes, zero params, zero added eval cost (just reverses a Python list every other epoch). Orthogonal axis to prior TTT trials: exp_253 (per-chunk momentum reset) showed carrying momentum HELPS — this keeps momentum carried but changes the spatial correlation pattern that momentum accumulates over. With ttt_epochs=4 (even), chunk i terminates at batch_M (reversed) and chunk i+1 begins at batch_0 — the very next batch in val data spatially, so the carried velocity from the end of chunk i is aligned with a physically-adjacent gradient. In strict forward order, chunk boundaries always jump from batch_M to batch_0 (huge spatial gap in val text), wasting the carried momentum's spatial prior.
265	2026-04-22T19:05:51Z	eval	245	264	eval	Cosine-cool TTT SGD momentum 0.9→0.5 in lockstep with existing cos_lr across chunks, so late low-LR chunks shed the stale direction carried from early high-LR chunks without a hard per-chunk reset.	-0.0003	discard	1.074880	+0.000240	15991921	600.019000	757.981000	1468.000000	apg-eval-0257		"Single-site edit inside eval_val_ttt's per-chunk LR setter (line ~1361). Introduces cos_frac shared between cos_lr and new cos_mom = 0.5 + (ttt_momentum - 0.5) * cos_frac → momentum interpolates 0.9 at chunk 0 to 0.5 at last chunk, matching cos_lr shape. Zero bytes, zero params, zero eval-cost (two float muls per chunk). Addresses the same ""stale high-LR momentum"" pain point that exp_255/exp_253 attacked with hard zero-reset (both discard, +0.000883/+0.000695) — softer, gradient continuity preserved. exp_037 proposed similar but harness_abort so never actually ran. exp_039 (0.9→0.95 global) hurt, which is consistent with ""momentum should shrink not grow"" here. Revert of exp_255's per-chunk reset: harness rebased to exp_245 first so baseline is clean."
266	2026-04-22T19:12:48Z	loss	245	264	loss	Selective (confidence-gated) entropy bonus: loss = CE - 0.005·mean(H * [ce<0.5]), applying the entropy-flattening pressure only on positions the model has already learned (p_correct>0.6), leaving hard-token gradient untouched — exp_132's blanket β=0.003 entropy bonus discarded because it degraded learning on hard tokens.	-0.0002	discard	1.076043	+0.001403	15993172	600.033000	792.967000	1505.000000	apg-loss-0261		Single-site edit in GPT.forward. No-grad mask = (ce < 0.5). Entropy term computed from log_softmax (numerically stable). Zero bytes, zero params. Mechanism distinct from exp_132 (no gating), from LS (uniform target), and from PW CE (position-axis only). Targeted at GPTQ-int6 argmax-flip robustness on easy positions where softening costs nothing.
267	2026-04-22T19:13:19Z	tok	245	264	tok	Port exp_190's proven per-feature input-side embed_scale (shape=[embedding_dim], init=1.0) onto the exp_245 baseline — applied after the post-lookup F.rms_norm and before embed_proj, registered in the scalar AdamW group.	-0.00035	keep	1.074604	-0.000036	15998555	600.079000	758.921000	1468.000000	apg-tok-0261	snapshots/267_tok	exp_190 was a tok KEEP (Δ=-0.000463) but exp_245 comes from a sibling branch that never inherited embed_scale. Three-site edit: (a) GPT.__init__ declares self.embed_scale = nn.Parameter(torch.ones(embedding_dim)); (b) forward_logits multiplies the post-lookup rms_norm output by embed_scale.to(x.dtype) BEFORE embed_proj (this is the 'residual-stream entry' gain, not the output gain exp_260 tried at post-head_proj); (c) Optimizers.__init__ appends base_model.embed_scale into scalar_params so it joins the existing scalar AdamW group (same LR/WD as skip_weights). 512 fp32 scalar passthrough params → zero compressed-byte risk; torch.compile-safe (same pattern as skip_weights). Expected delta approximates exp_190's original -0.000463 but discounted since exp_245's looped-block ln_scale correction may have already absorbed part of the variance-equalization benefit that embed_scale provides.
268	2026-04-22T19:13:47Z	arch	245	267	arch	Disable XSA on looped blocks [3,4,5] only (pre-loop 0-2 and post-loop 6-10 keep XSA): XSA's V-direction subtraction compounds across the 3 loop passes of each physical block, over-damping attention; loop_seg benefits from standard attention while non-loop layers retain XSA sharpening.	-0.0005	size_blocked	1.077634		16001076	600.058000	726.942000	1436.000000	apg-arch-0261		Sibling of exp_245 (loop-aware ln_scale variance fix): this corrects XSA's compounding V-subtraction on looped blocks. Single-site addition in GPT.__init__ just after exp_245's loop_scale block. Zero params, zero bytes. Orthogonal to exp_028 (which proposed global xsa_last_n 11→5 but harness_aborted) — mine is targeted loop-aware disable, keeping XSA on non-loop layers where each pass is a distinct depth-ascending step.
269	2026-04-22T19:16:20Z	curr	245	267	curr	Per-shard independent reset on exhaustion in ShuffledSequenceLoader.next_batch: when shard si runs dry mid-batch, reset only si (not all shards), preserving remaining-but-unused sequences in the other shards and letting each shard's _phase_epoch advance at its own rate proportional to shard size.	-0.0002	discard	1.075853	+0.001249	15992476	600.073000	767.927000	1475.000000	apg-curr-0261		"One-line-of-logic change at line 442-444 of ShuffledSequenceLoader.next_batch. The original ""for si2 in range(num_shards): self._reset_shard(si2)"" was triggered whenever ANY shard ran dry, clobbering start_inds in every other shard and discarding their remaining sequences. In a 500M-token single-epoch regime this wastes real data diversity. Replacement: ""self._reset_shard(si)"". Orthogonal to exp_196 (stratified quotas), exp_142 (Latin-square phase cycling), exp_259 (cross-shard phase shift — was discarded, so breaking its phase-correlation invariant is safe). Preserves stratified quota logic; the top-of-next_batch full reset (when total<=0) is untouched because that path fires only when every shard is genuinely empty. Expected effect: modestly more distinct sequences seen during training → small bpb improvement."
270	2026-04-22T19:19:16Z	quant	261	267	quant	Raise GPTQ Hessian damping 0.02→0.03 (1.5× from exp_212's winning 0.01→0.02 bump): monotonic improvement from the known 0.003→0.01→0.02 sweep suggests the Hessian ridge is still under-regularized at 0.02, so a cautious next step probes where the peak lies without overshooting.	-0.00010	discard	1.074759	+0.000155	15996557	600.013000	751.987000	1458.000000	apg-quan-0263		Single-literal edit at gptq_quantize_weight line 1004: 0.02→0.03 on the damping-as-fraction-of-H.diag.mean constant. Zero size risk (pure scalar). Directly extends exp_212's proven direction; if this keeps, the next probe would go to 0.045 to locate the peak. If it discards, the peak is between 0.02–0.03 and a follow-up would try 0.024 or 0.025.
271	2026-04-22T19:20:20Z	reg	245	267	reg	Per-head multiplicative noise on q_gain (±2% uniform) during training only — mean-preserving DropHead-style reg on attention sharpness, zero-param, zero-byte.	-0.0003	discard	1.075244	+0.000640	15992832	600.103000	766.897000	1480.000000	apg-reg-0262		Single-site edit in CausalSelfAttention.forward (line 559): before the q = q*q_gain broadcast, compute q_gain_eff = q_gain * (1 + U(-0.02, 0.02)) when self.training, else q_gain. Noise is drawn fresh per forward over shape [num_heads]=8 scalars only — tiny tensor, no activation noise. Mean-preserving so training CE expectation is unchanged. Targets the aggressive qk_gain_init=5.25 sharpness that this stack uses — forces attention to tolerate small gain perturbations, similar to DropConnect applied to a single scalar per head. Distinct from prior reg failures: activation dropout (exp_040 MLP, exp_050 residual) zeros ACTIVATIONS at high rate; additive input/embedding Gaussian noise (exp_129, 155, 198) perturbs EMBEDDINGS. This perturbs only the 8 q_gain scalars multiplicatively — localized to attention sharpness, does not touch residual stream or activations. Zero param count change, zero artifact-size change (no new buffers or params). Eval sets model.eval() so noise auto-disables at TTT/GPTQ/sliding-window time. Compile: self.training is a standard nn.Module flag, torch.compile produces two guarded graphs (train/eval), same pattern as Dropout.
272	2026-04-22T19:21:04Z	loss	264	267	loss	In-batch rare-token CE boost (mean-preserving): weight = 1 + 0.1/occurrences then normalized to mean 1, so targets appearing once in a microbatch get 1.10× gradient and common ones ~1.0×. Frequency-based reweighting is orthogonal to the CE-based focal family (exp_054/144 discard) and to position-weighted CE (saturated on current lineage).	-0.0003	crash						129.000000	apg-loss-0270		Single-site edit in GPT.forward. torch.bincount over flat_targets (V=8192) then weight[targets]/weight.mean() mean-preserved. Expected: rare tokens have higher baseline nll and dominate val_bpb per-occurrence, so a gentle gradient boost on them reduces total nll. Risk: torch.compile may graph-break on bincount but forward already has breaks and no_grad scope isolates the weight computation. Zero bytes, zero params. Distinct mechanism from focal (uses target counts not predicted probabilities) and from position weighting (uses vocab identity not temporal index). | torch.distributed.elastic.multiprocessing.errors.ChildFailedError: ============================================================ (train_gpt.py:773 in forward)
273	2026-04-22T19:23:18Z	opt	261	267	opt	Add Gradient Centralization (Yong et al., 2020) inside Muon: subtract per-row mean of 2D grads (each output neuron's grad zero-mean over input dim) before the momentum buffer update — removes mean-direction bias that LayerNorm would null out in the next forward anyway.	-0.0003	discard	1.075858	+0.001254	15978962	600.004000	768.996000	1479.000000	apg-opt-0263		Single-site edit in Muon.step after g = p.grad. Adds `if g.dim() == 2: g = g - g.mean(dim=1, keepdim=True)`. Zero new state, zero new hparams, zero artifact-size impact. Standard FC-layer GC formulation. Never tried in this tree per KNOWLEDGE.md grep. Compose order: grad → GC → buf → Nesterov → (row_normalize) → Newton-Schulz. GC is compatible with MuonEq-R row-normalize and NS orthogonalization (both operate on the centered manifold). Theoretical rationale: removes the shared mean-direction component that contributes nothing to LayerNorm-normalized activations downstream, reducing gradient noise that gets amplified by Muon's momentum=0.99 peak. Rebased to exp_261 first (workdir had stale exp_262 size_blocked code).
274	2026-04-22T19:27:25Z	meta	261	267	meta	Narrow EMA averaging window: EMA_DECAY 0.9965 to 0.994 (effective horizon 286 to 167 steps). Every attempt to RAISE ema_decay back to exp_003's kept 0.998 failed on newer baselines (exp_119, 149, 184, 242); the narrower direction is the only untested side of this axis.	-0.0003	discard	1.075086	+0.000482	15993453	600.140000	755.860000	1466.000000	apg-meta-0264		Single-literal edit at train_gpt.py:174 (EMA_DECAY default 0.9965 to 0.994). No structural change - EMA is an averaging-only accumulator, bytes unaffected. exp_003 kept 0.9965 to 0.998 (-0.000776) on the old baseline, but four subsequent revivals (exp_119 +0.0038, exp_149 size_blocked, exp_184 +0.0018, exp_242 +0.0020) all failed on newer lineages while nobody tested the opposite direction. With warmdown_frac=0.58 dominating the run, late-phase weights converge cleaner, so a narrower averaging window focusing on the final ~4% of the run should reject noisier mid-warmdown contamination.
275	2026-04-22T19:31:44Z	ttt	exp_264	267	ttt	Add 30% LR floor to TTT chunk-cosine schedule (cos_lr = ttt_lr · (0.3 + 0.7·cos_ratio)): late chunks (~last 15%) currently train at near-zero LR, leaving the val tail under-adapted; floor preserves peak LR at chunk 0 but keeps late chunks meaningfully learning for next-chunk scoring.	-0.0002	discard	1.074716	+0.000112	15991790	600.151000	771.849000	1481.000000	apg-ttt-0266		Single-site edit at line 1361 (the cos_lr assignment inside eval_val_ttt). With num_chunks≈150 and the pure cosine schedule, cos_ratio<0.3 for ci≳120 — those chunks run ~16 SGD steps at lr≤0.0015, barely moving weights. Since scoring happens BEFORE training each chunk, chunk i's training affects chunk i+1's score; a flatter tail lets late chunks contribute nontrivial adaptation for the scoring of the very last chunks of val. Blended (0.3 + 0.7·cos) rather than max(cos, 0.3) to keep C¹-smooth and peak at 1.0 × ttt_lr at chunk 0. Zero bytes, zero param delta, zero added eval cost (pure schedule shape change). Complements exp_264 (fwd/rev alternation) rather than replacing it — exp_264 smooths batch-order, this smooths LR-over-chunks. Related prior: exp_037 (cosine-cool TTT momentum across chunks) was harness-aborted so this is untested territory for TTT chunk-schedule shape.
