exp_id	timestamp	specialist	parent_exp	baseline_exp	domain	hypothesis	expected_delta	status	val_bpb	delta_vs_best	artifact_bytes	train_s	eval_s	total_s	job_name	snapshot_path	notes
412	2026-04-23T03:07:54Z	tok	377	377	tok	"Switch tied tok_emb init from nn.init.normal_ to nn.init.trunc_normal_ at ±2σ (PaLM/T5/BLOOM/Llama standard): same std=0.005 but clips the ~5% of row coordinates beyond ±0.01 that, under tied embeddings, double as outlier softmax classifier directions and create spurious early-grad spikes on rare tokens.</hypothesis> <parameter name=""notes"">Single-site edit in GPT._init_weights (line 721-734). Replaces nn.init.normal_(tok_emb.weight, mean=0.0, std=tied_embed_init_std) with nn.init.trunc_normal_ using the same std plus a=-2σ, b=+2σ hard clips. Prior history: exp_032 and exp_331 both proposed this exact change but were harness_aborted before ever running a GPU trial; no actual measurement exists on this axis. Prior tested init variants: 0.003 normal_ (exp_038, discard +0.000526), 0.02 normal_ (exp_011, size_blocked), equi-row-norm (exp_019, discard), semi-orthogonal (exp_350, discard), orthogonal (exp_389, discard), LayerNorm gauge (exp_380, discard). Trunc_normal_ is structurally distinct from all of these: same Gaussian family but tail-clipped. Mechanism: (1) Tied embeddings mean each row-coordinate pair (v, d) serves BOTH as lookup feature AND as softmax classifier component → outlier coordinates can drive disproportionately large logits for rare tokens at init. (2) Clipping yields more uniform row L2 norms, reducing the early-training gradient-spike regime that the scalar Adam group's large LR amplifies. (3) Trunc-Gaussian has marginally tighter variance (factor 0.774 at ±2σ), so post-training GPTQ int6 clip-grid should fit the distribution slightly more densely → softmax/brotli compression either matches or improves. Zero new params, zero new bytes, single-line structural init change. Risk: very low — init change only, no forward/backward structural modification. trunc_normal_ is available in all supported torch versions.</notes> </invoke>" -0.0003 discard 1.075472 +0.001385 15997690 600.142000 564.700000 1455.000000 apg-tok-0408  
413	2026-04-23T03:09:12Z	arch	377	377	arch	Learned scalar XSA-subtraction gate (init=1.0, 1 fp32 param/layer, 11 total) scaling V-direction subtraction in _xsa_efficient — gives each layer a continuous lever over XSA intensity never explored by prior discrete on/off variants (exp_028/178/215/268).	-0.0003	size_blocked	1.074620		16003923	600.118000	581.500000	1489.000000	apg-arch-0410		Single-attention-class edit on exp_377. CausalSelfAttention.__init__ adds `self.xsa_gate = nn.Parameter(torch.ones(1, dtype=torch.float32))` — ndim<2 routes it into the scalar_params AdamW group (adam_wd=0.005, so drift from 1.0 is gradient-driven). _xsa_efficient replaces `y_g - proj` with `y_g - gate*proj` where gate = xsa_gate cast to y_g dtype. At init identity: val_bpb ≥ 0 cost only if gate drifts to worse values. Prior XSA experiments only toggled on/off at layer-set granularity — this is the first continuous intensity lever. 11 fp32 scalars → ~44B raw, scalar passthrough (compresses to ~0). Non-XSA blocks still create an unused gate param (dead gradient, harmless). No flash-attn/XSA-code-path changes beyond the scalar multiply.
414	2026-04-23T03:10:41Z	meta	377	377	meta	Lower muon_wd (attention matrices) 0.095 → 0.087 (−8.4%): untested DOWN probe on the attention-side axis of the per-type Muon WD split; MLP-side DOWN (0.125→0.115, exp_336 kept) proved the same direction wins for matrix WD in this regime.	-0.00010	discard	1.074279	+0.000192	15999795	600.108000	580.400000	1478.000000	apg-meta-0412		Single-literal edit on line 166: MUON_WD default 0.095 → 0.087. Affects only attention-matrix Muon WD group (≠ muon_wd_mlp=0.115, ≠ adam_wd/embed_wd). exp_164 established the per-type split with attention=0.095 (baseline-kept), but no subsequent probe has explored the attention-side DOWN direction. exp_336 validated a 0.125→0.115 (−8%) DOWN move on MLP; analogous −8.4% DOWN on attention is the symmetric untouched probe. exp_407 (MLP 0.115→0.120 UP, discard) confirmed the MLP axis is at/near its sweet spot, so the remaining free WD axis is attention. Narrow scalar move; if positive, opens a small DOWN continuation (0.087→0.08).
415	2026-04-23T03:11:29Z	reg	377	377	reg	Time-scheduled muon_wd_mlp: linearly ramp 1.0×→1.25× base across LR warmdown (no-op at peak LR) to compensate for lr*wd shrinkage collapse in the ~58% warmdown tail where SWA/EMA integrate	-0.0002	discard	1.075054	+0.000967	15999096	600.018000	569.600000	1454.000000	apg-reg-0412		"Single-site edit in step_fn just before optimizers.step(). Sets optimizers.optimizer_muon.param_groups[1][""weight_decay""] = h.muon_wd_mlp * (1.0 + 0.25*max(0.0, 1.0 - lr_scale)) each step — MLP group only. Rationale: decoupled WD applies theta*=(1-lr*wd), so as lr_scale falls to ~0.05 during warmdown, effective shrinkage collapses ~20x, essentially turning off WD exactly when SWA/EMA are integrating the tail. Ramping WD up during warmdown partially compensates. MLP-only because exp_164 proved MLP matrices dominate overfit risk; attention WD untouched. Orthogonal to all prior reg moves (per-type exp_164, per-depth exp_141, per-role exp_406 discarded, base-value exp_336) — first time-scheduled WD probe. Group[1] is the MLP Muon group by construction in Optimizers.__init__. Muon.step() reads group[""weight_decay""] per-call so dynamic update is picked up immediately. torch.compile only covers model forward, not optimizer.step, so no graph-capture hazard."
416	2026-04-23T03:14:17Z	ttt	377	377	ttt	Lower TTT peak LR 0.005 → 0.0045 (−10%): untested midpoint on a promising axis. exp_372 (0.004, −20%) was the closest recent ttt trial to best (Δ=+0.000385 discard), signaling the current 0.005 inherited from pre-Nesterov regime is slightly too high but 0.004 went too far. With 4 SGD steps/chunk on same 4 seqs under Nesterov μ=0.9, effective step amplification is ~9× gradient magnitude — a modest peak-LR cut should reduce overshoot without starving adaptation.	-0.00015	discard	1.074263	+0.000176	15999272	600.032000	574.400000	1470.000000	apg-ttt-0412		Single-literal edit on line 183: TTT_LR default 0.005 → 0.0045. Affects only the per-chunk SGD optimizer LR (initial + cosine-decay scaling). No structural change to TTT schedule, batch order, epoch count, momentum, or chunk size. Anchors on exp_372 single-point evidence: ttt_lr=0.004 gave val_bpb=1.074472 (only +0.000385 above best 1.074087) which is among the closest recent ttt discards. 0.0045 is the untested midpoint — if the optimum is monotone-near-0.005 we expect a small positive delta; if there's a true nearby minimum between 0.004 and 0.005 we could convert to a keep. Bounded downside (same effective TTT compute, same eval budget).
417	2026-04-23T03:15:22Z	loss	377	377	loss	Lower LOGIT_SOFTCAP 30.0 → 20.0 (−33%): untested DOWN direction on the logit-softcap axis (exp_096 tested 30→100, size_blocked at +935 B). Tighter tanh cap amplifies gradient attenuation on confident logits ~2× (tanh'(1.5)≈0.18 vs tanh'(1.0)≈0.42) and narrows weight-distribution range (potential size-headroom gain via brotli). CE floor remains effectively zero at cap=20 (p_y floor ~exp(−40)/V).	-0.0002	discard	1.074989	+0.000902	15996782	600.072000	571.400000	1476.000000	apg-loss-0412		Single-literal edit at line 128 (LOGIT_SOFTCAP default 30.0 → 20.0). Affects forward_logits' tanh softcap, applied uniformly across train / eval / TTT / GPTQ-calibration paths. Structurally different from all prior loss trials in this lineage (CE-shape reweighting, auxiliary heads). Mechanism: (1) gradient flow — for peak-training logits ~30, tanh(30/20)=tanh(1.5)≈0.905 vs tanh(30/30)=tanh(1.0)≈0.762; the dampening factor dtanh/dx at those points roughly halves, so the loss surface attenuates confident-direction gradients more strongly, acting as implicit regularization on over-fitting. (2) Compression — since exp_096 showed 30→100 added ~935 B to compressed artifact, going DOWN should reduce compressed weight entropy by a similar amount, buying size headroom. (3) BPB floor — at cap=20, max-confidence softmax(20, -20, ..., -20) ≈ 1/(1+8191·exp(-40)) ≈ 1.0 (floor on per-token CE ≈ 0), so no expressiveness constraint. Risk: if the winning quant lineage's peak logits genuinely sit near ~30, the tighter cap will truncate their effective information before GPTQ sees them, possibly hurting post-quantization BPB; offset by the smaller weight-range → better GPTQ quantization fit. Prior loss-domain on exp_377 lineage: exp_405 (Bernoulli-variance, size_blocked), exp_367 (focal γ=0.2, size_blocked), exp_291 (focal γ=0.5, size_blocked), exp_328 (u² PW restore, discard +0.000377) — all either fail on size or fail to stack. This edit moves the OPPOSITE way on size (should release bytes).
418	2026-04-23T03:16:32Z	eval	377	377	eval	Soft eval_stride reduction 64→60: untried gentle stride step (prior 48/32 attempts were budget-blocked or discard); +4 avg context tokens per scored token (2016.5→2020.5) at only +6.7% TTT/sliding scoring overhead — first stride probe small enough to safely stay within the 600s eval budget on the current exp_377 baseline.	-0.00012	eval_budget_overrun	1.076398			600.101000	603.200000	1492.000000	apg-eval-0412		Single-literal edit to Hyperparameters.eval_stride default (line 163) from 64 to 60. Affects both eval_val_sliding and eval_val_ttt window-start generators (both read h.eval_stride). Context_size grows 1984→1988, number of scoring windows grows by 64/60=+6.67%, so TTT first-pass scoring and sliding-window eval each get ~7% more compute, but no other TTT training loop cost changes (chunk_seqs, ttt_epochs unchanged). Rationale vs prior attempts: exp_085 (64→48) harness_abort early, exp_137 (64→48 + skip sliding) discard +0.000025 on exp_017 base (1.078), exp_181 (64→32) eval_budget_overrun. 64→60 is strictly milder than 48 (only 14%→7% overhead ratio), so should not overrun budget, and still samples the stride-context tradeoff curve where exp_137 showed a positive though tiny signal (now tested in isolation on the much better exp_377 base). Expected bpb improvement is small (~-0.0001) because context density has diminishing returns, but this probes whether denser stride in isolation yields a net win given current-state near-saturation.
419	2026-04-23T03:16:34Z	curr	377	377	curr	Replace rng.permutation(8) phase-order with Van der Corput base-2 low-discrepancy sequence staggered by global shard index. At 600s we run under 1 shard-epoch so only each shards first phase lands in the run. vdC eliminates per-shard variance that exp_410 amplified at 16 buckets while preserving phase coverage.	-0.0003	discard	1.076374	+0.002287	15995467	600.150000	574.500000	1484.000000	apg-curr-0412		Single-site edit in ShuffledSequenceLoader.__init__. Replaces per-shard random permutation with rotated vdC8=[4,2,6,1,5,3,7,0] offset by h.rank*len(self.files)+i. With 2 files per rank over 8 ranks, the 16 shards cover all 8 vdC slots twice deterministically. Orthogonal to exp_196 stratified sampling and exp_142 8-phase grid, both kept.
420	2026-04-23T03:16:52Z	opt	377	377	opt	Add a per-group 15% LR floor for the tok_emb AdamW optimizer only, so the deepest warmdown tail keeps refining the tied-embedding/lm_head table while matrix/scalar params retain their full linear warmdown-to-zero schedule.	-0.0002	size_blocked	1.074286		16000145	600.024000	592.600000	1479.000000	apg-opt-0412		Single-site edit in step_fn (~line 1510). After the shared group lr=base_lr*lr_scale loop, iterates just optimizers.optimizer_tok.param_groups and reassigns lr=base_lr*0.15 when global lr_scale<0.15 (deepest ~10.8% of budget with warmdown_frac=0.72). tok_emb is ~4.2M params, the largest single tensor, tied with lm_head; with global min_lr=0.0 in the current best snapshot (exp_377) its LR decays all the way to zero, so the EMA half-life window (~200 steps) averages ~12% of frozen-embedding weights. Novel axis: exp_140 (meta, discard on pre-exp_324 baseline) probed a GLOBAL min_lr=0.05 floor and failed; no per-group LR floor has ever been tested. Orthogonal to exp_324 (mm_blend momentum floor, keep) and exp_336 (muon_wd_mlp shrink, keep) — both hold-the-tail wins — but applied to the AdamW optimizer instead of Muon. Also orthogonal to exp_182 (tok_emb beta2=0.95 to 0.98, keep) which already validated per-group AdamW specialization on the embedding table helps.
421	2026-04-23T03:17:33Z	quant	377	377	quant	Add a relative H-diag FLOOR (H_ii := max(H_ii, 1e-2·mean)) before the ×1.01 multiplicative damping in GPTQ: caps Hinv[j,j]=1/H_ii blow-up on outlier-low (non-dead) columns that amplify error propagation disproportionately to their loss contribution. Orthogonal to uniform damping — touches only columns 100× below mean.	-0.00015	discard	1.074425	+0.000338	15998965	600.076000	572.500000	1463.000000	apg-quan-0412		Untried axis on the diag-damping tree. History on uniform multiplicative/additive damping is saturated (×1.02 kept → ×1.01 kept → ×1.005 size_blocked, off-diag ×0.95/×0.97 discard/size_blocked). A targeted-at-outliers intervention hasn't been tested: the existing `dead = (H_ii==0)` branch only catches exactly-zero columns (where Hinv[j,j] would be +inf) and substitutes 1; near-dead columns (H_ii >> 0 but <<mean) pass through, producing large 1/H_ii that amplify block-propagated error. The 1e-2·mean threshold catches columns ~100× below mean (typically <1% under 64-batch calibration), so the Q-code distribution shifts by <=1 level in a tiny fraction of columns — size-impact negligible, unlike clip_sigmas or off-diag shrinkage which shift entropy globally. Orthogonal to ×1.01 because damping is applied AFTER flooring.
422	2026-04-23T04:01:17Z	reg	377	377	reg	"Add independent σ=0.003 Gaussian noise on the x0 anchor stream (alongside existing σ=0.01 on the trunk x) — regularizes the ""shortcut"" path that bypasses deep processing by breaking the asymmetry where the anchor was perfectly clean while the trunk was noised."	-0.0003	size_blocked	1.075039		16001462	600.087000	589.300000	1485.000000	apg-reg-0422		Single-site edit in GPT.forward_logits right after `x0 = x`. Adds a second `x0 = x0 + randn_like(x0)*0.003` inside the existing `if self.training:` block. Zero params, zero structural changes — just a second Gaussian perturbation during training. Anchor σ is 3x smaller than trunk σ because x0 is broadcast into every block's `mix[1]*x0` residual-mix term (perturbations effectively compound across the 11 blocks + num_loops+1 looped invocations), whereas trunk noise is only directly seen by block 0's attn/MLP input. Rationale: prior reg trials added noise only to the trunk, leaving the anchor shortcut perfectly clean — the model could coast on that. Inference (model.eval()) bypasses both noises, so TTT scoring and val_bpb are measured on the clean-input path and the effect is pure train-time regularization. Orthogonal axis to WD (shrinks toward 0) and to dropout (kills whole units).
423	2026-04-23T04:01:19Z	opt	377	377	opt	Schedule the Muon MLP-group momentum offset in lockstep with lr_scale: -0.02 at peak LR (bit-identical to exp_377 main training), collapsing linearly to 0 in the deepest warmdown tail so MLP momentum converges to attn's floor (0.9375) instead of remaining permanently 0.02 below.	-0.00015	eval_budget_overrun	1.076402			600.060000	603.100000	1501.000000	apg-opt-0422		Single-site edit in step_fn (~line 1510). Replaces static `mlp_offset=-0.02` with `mlp_offset=-0.02*lr_scale`. Anchored by exp_324 keep (mm_blend floor at 0.25 → attn momentum floor 0.9375; MLP remains at 0.9175, suggesting the tail prefers symmetric high momentum across both types). Novel axis: no prior opt trial has scheduled the MLP-specific offset (static -0.02 added as part of recent stack; per-group momentum-schedule axis untouched). Peak-LR behavior unchanged, so weight-trajectory drift (which tripped size on exp_314/355/420) is minimal — only warmdown-tail MLP momentum rises ~0.02.
424	2026-04-23T04:02:35Z	ttt	exp_377	377	ttt	Apply mean-preserving linear position-weighted CE (linspace 0.9→1.1) to the TTT inner-SGD loss so gradient upweights long-context positions — the positions that actually score at stride=64.	-0.0001	discard	1.074667	+0.000580	15999483	600.129000	574.400000	1474.000000	apg-ttt-0422		"Applies exp_156/176/186's proven training-CE position-weighting pattern (all kept, gentle linspace 0.9→1.1 mean-preserving) to the TTT adaptation loss. Untested in TTT domain: exp_322 hard-masked to last 64 (disastrous +0.0117), exp_139 hard-masked first half (discard +0.0010), exp_329 tried step-function 1.5× upweight on last 64 (size_blocked, not validated). Soft linear ramp across full 2048 has never been tried in TTT. Edit replaces `loss = base_model(x, y)` with explicit forward_logits + reduction=""none"" CE × mean-preserving pos_w, inside the existing autocast. Memory impact negligible (pos_w is [2048] fp32). No change to scoring pass, optimizer, schedules, or budget-sensitive paths."
425	2026-04-23T04:03:24Z	loss	377	377	loss	Port exp_186's convex u² position-weighted CE (pw=0.9+0.2·u², mean-preserved) onto the current best exp_377, which diverged from the exp_156→176→186 position-weighting lineage and never carried the fix.	-0.00006	discard	1.075705	+0.001618	15975752	600.115000	580.600000	1487.000000	apg-loss-0422		Single-site edit in GPT.forward. Replaces `F.cross_entropy(..., reduction='mean')` with per-token `reduction='none'` + u²-weighted mean. Training-only (zero inference bytes — not touched during eval_val_sliding/eval_val_ttt which call forward_logits directly). Rationale: exp_186 was the terminal loss-domain keep 3 chains ago (Δ=-0.000062 on a 1.075896 baseline). Current best's forward shows plain mean-reduction CE with no position weighting — the loss-tree's proven fix was lost in the 186→245→298→336→377 recombination. Stride-64 sliding window scores almost entirely at context-rich tail positions, so gradient mass concentrated on u≈1 aligns training with eval geometry. If positive, opens the door to tuning (0.85+0.3·u² broader range, log(1+pos) shape, or late-position clip). If negative, strong evidence position weighting does NOT compose with the exp_298 pre-norm embed_scale + exp_245 recurrence-aware ln_scale stack, which is itself a useful signal.
426	2026-04-23T04:04:45Z	meta	377	377	meta	Raise ADAM_EPS 1e-8 → 3e-8 (3x UP): untested UP direction on an axis where DOWN (1e-8→1e-9, exp_304) hurt by +0.000595. Larger eps flattens the Adam preconditioner denominator, giving tied tok_emb (sparse per-row gradients) more uniform step sizes across frequent and rare rows, which may reduce over-boosting of noisy rare-row updates under embed_wd=0.085.	-0.0001	discard	1.074602	+0.000515	15999061	600.024000	571.800000	1466.000000	apg-meta-0422		Single-literal edit at train_gpt.py:161 (ADAM_EPS default 1e-8 → 3e-8). Affects all three AdamW groups (optimizer_tok / optimizer_scalar / optimizer_head via h.adam_eps). exp_304 probed 1e-8→1e-9 (10x DOWN) → discard +0.000595, and exp_048/105 probed 1e-8→1e-10 → size_blocked / eval_overrun. The UP direction has never been tested on this lineage. 3x step is half-radius of the 10x DOWN step. Baseline fork: snapshots/377_quant.
427	2026-04-23T05:20:16Z	eval	377	377	eval	Split TTT SGD into two param groups with DIFFERENT momentum: tied tok_emb at momentum=0.5 (dual-use, highest velocity-saturation risk) vs rest at 0.9. Nesterov preserved for both. Momentum-split axis is untried; prior LR-side splits (exp_133 3x, exp_315 0.5x, exp_357 freeze) all discard.	-0.0004	crash	1.076664			600.103000	259.800000	1146.000000	apg-eval-0427		Single-site edit in eval_val_ttt (~line 1343). Replaces single-group SGD with two param groups: (1) tok_emb/lm_head at momentum=0.5, (2) rest at h.ttt_momentum=0.9. Both nesterov=True. Rationale: tied tok_emb receives gradient from every position through softmax (amplified by tied in/out), carrying the heaviest cross-chunk velocity. Past TTT experiments saturated LR-side (exp_133: 3x LR → discard +0.000736; exp_315: 0.5x LR → eval_budget; exp_357: freeze → discard). Momentum-side is the orthogonal knob. Lower momentum on tok_emb (0.5) shortens its velocity half-life from ~7 steps to ~1 step (across the ~5 SGD steps per chunk × ttt_epochs), letting it track per-chunk drift more locally while the rest of the model keeps momentum-accumulated smoothing. Zero bytes added (two lightweight list comps). Same cos_lr loop updates both groups. No eval-cost impact. | torch.distributed.elastic.multiprocessing.errors.ChildFailedError: ============================================================ (train_gpt.py:1352 in eval_val_ttt)
428	2026-04-23T05:21:12Z	loss	377	377	loss	Re-add label_smoothing 0.003 to training CE only	-0.0005	discard	1.077459	+0.003372	15972983	600.110000	589.200000	1507.000000	apg-loss-0427		Single-site edit to F.cross_entropy in GPT.forward
