exp_id	timestamp	specialist	parent_exp	baseline_exp	domain	hypothesis	expected_delta	status	val_bpb	delta_vs_best	artifact_bytes	train_s	eval_s	total_s	job_name	snapshot_path	notes
292	2026-04-22T20:24:44Z	opt	280	280	opt	Lower muon_momentum_warmup_start 0.92→0.88 (DOWN direction; exp_015 only tested UP 0.92→0.94 which was discard +0.00181): widens the ramp range from 7pts to 11pts so early training trusts fresh gradients more before momentum buffer accumulates peak-LR history, and the linear-interp schedule still reaches peak 0.99 at the same 22% mark.	-0.0002	discard	1.076227	+0.001677	15999647	600.062000	759.938000	1472.000000	apg-opt-0285		"Single-literal edit at train_gpt.py:152 (0.92→0.88). No new hparam, no new env var, no code-path change — just shifts the ramp floor. Rationale: with warmup_steps=20 pre-training revert, Muon starts real-step-0 with buf=0, so the pre-buffer-trust period should favor fresh gradients; 0.92 is already quite high for a ""cold"" start. exp_015 discarded the UP direction (0.94) showing the landscape is sensitive, but the DOWN direction is genuinely untested. If 0.88 is worse, 0.92 really is a symmetric optimum; if better, ramp widening is a new knob."
293	2026-04-22T20:25:36Z	reg	280	280	reg	Branch-level DropPath on MLP only, p=0.04, time-gated to peak-LR phase (lr_scale==1.0): keeps the noise-averaging warmdown/EMA tail completely clean while injecting coarse stochasticity during the high-LR learning phase.	-0.0003	discard	1.076386	+0.001836	15997800	600.071000	758.929000	1472.000000	apg-reg-0285		Structural break from saturated reg knobs (muon_wd/scalar-wd/activation-noise all discard for 10+ trials). Two-site edit: (1) Block gains a non-persistent 0-dim fp32 buffer _layerdrop_p; in forward (both parallel and serial paths), when self.training, sample scalar Bernoulli via torch.rand >= p, scale kept branch by 1/(1-p) for expectation preservation, multiply mlp_out. (2) step_fn sets layerdrop_p_val=0.04 if lr_scale>=1.0 else 0.0, then fills the buffer on each of the 11 blocks. Rationale for why this should not replicate exp_040's +0.0098 failure: (a) branch-level gate (scalar, whole MLP output) vs per-unit dropout — kept passes carry FULL signal, not p-thinned; (b) applied ONLY during peak-LR (~first 28%), OFF during warmdown so EMA/LAWA/SWA averaging sees noise-free tail. Rationale for why this is novel vs prior reg discards: every continuous-noise attempt (exp_012/033/104/129/155/198/271) applied every step including warmdown, conflicting with the averaging accumulators; no stochastic-depth variant appears in the tree. Buffer-based gate avoids per-step recompile (only 2 graph variants: p=0.04 vs p=0.0). Recurrent blocks 3-5 get called 3x/forward with independent rand draws per call → mild extra ensembling there. Attention untouched (short-range, fragile). Expected delta -0.0003; failure mode would be ~+0.0005 if peak-phase regularization steals too many effective learning steps at the largest LRs.
294	2026-04-22T20:25:36Z	meta	exp_280	280	meta	Lower AdamW BETA2 0.95→0.93 on the tok_emb + scalar + head AdamW groups — untested direction after 4 prior raises all hurt (exp_068/091/159 β2=0.98, exp_126 β2=0.97).	-0.0002	size_blocked	1.075733		16000686	600.066000	764.934000	1474.000000	apg-meta-0285		"Meta-search analyst note. Beta2 axis has been probed ONLY upward: exp_068 (β2=0.98 on exp_017 base, discard), exp_091 (β2=0.98 on exp_088, discard +0.0020), exp_126 (β2=0.97 on exp_108, discard +0.0003), exp_159 (β2=0.98 on exp_156, discard). 4 independent ""raise"" trials all hurt consistently → Bayesian evidence that the true optimum lies BELOW 0.95, not above. The lower direction is completely untested across 200+ trials. Shrinks 2nd-moment EMA half-life from ~14 steps to ~9.6 steps, making Adam more responsive to the aggressive 72% warmdown LR decay. Landscape has also shifted since exp_177 cut adam_wd 4× on the scalar group (less pull-to-zero regularization → faster 2nd-moment adaptation can exploit the extra capacity). Single-literal edit; byte-neutral (optimizer state, not weights)."
295	2026-04-22T20:36:29Z	ttt	280	280	ttt	Within-chunk linear LR decay across TTT epochs (ep_scale: 1.0→0.75→0.5→0.25 for 4 epochs, replacing the current constant cos_lr per chunk): with my_chunk_seqs≈4 per rank and batch_seqs=32 the inner loop re-trains 4 epochs on the SAME 4 seqs, so β=0.9 Nesterov compounds same-direction gradients and risks overshoot by epoch 3. Scaling lr down across epochs dampens this while keeping the epoch-0 peak step size for fast initial adaptation.	-0.00015	discard	1.074728	+0.000178	15997116	600.073000	761.927000	1485.000000	apg-ttt-0287		"Single-site edit in eval_val_ttt around the inner for _ep loop. Moves the `for pg in optimizer.param_groups: pg[""lr""] = cos_lr` assignment INSIDE the per-epoch loop and multiplies by ep_scale = 1 - 0.75*_ep/max(ttt_epochs-1,1), giving lr scales [1.0, 0.75, 0.5, 0.25] for ttt_epochs=4. Zero extra forward/backward cost — same 4 SGD steps per chunk, just with decaying step size within the chunk. Complements the existing cross-chunk cosine decay (cos_lr) with a two-scale schedule: cross-chunk cosine + within-chunk linear. Untried direction: prior TTT trials tweaked epoch count (014, 017), momentum (039, 151), micro_bs (285), anchor (276), fwd/rev order (264), but never intra-chunk LR schedule. Minimum step size is 0.25x (not 0) so last epoch still does useful refinement. No eval-budget risk: identical FLOPs to baseline. Rationale for overshoot concern: with β=0.9 and 4 consecutive identical-direction gradients, nesterov's effective step = lr*(grad + 0.9*v_t) where v_3 ≈ grad*(1+0.9+0.81+0.729) ≈ 3.4*grad so effective step 4 is ~4.4x effective step 1 on the same data — likely beyond the local-quadratic trust region for a SGD optimizer with no line search."
296	2026-04-22T20:36:49Z	arch	280	280	arch	V-norm: add F.rms_norm on V per-head in CausalSelfAttention.forward, symmetric to existing Q/K rms_norm — Q/K normalization controls score magnitude, V-norm controls attention-output magnitude, tightening residual-stream variance and helping GPTQ int6 quantization.	-0.0008	size_blocked	1.077493		16001555	600.042000	787.958000	1497.000000	apg-arch-0287		Single-line architectural edit in CausalSelfAttention.forward (exp_280 base). Places `v = F.rms_norm(v, (v.size(-1),))` between the existing k rms_norm and the rotary call. Rationale: baseline already RMS-normalizes Q and K (qk_gain=5.25 needs tight score statistics), but V magnitude is ungoverned. Attention output = attn_weights @ V; its L2 norm drives proj(y) input magnitude → residual stream → GPTQ calibration Hessian. With int6 codes, tighter activation variance at attention output gives GPTQ lower reconstruction error at the same damping. V-norm is deployed in Gemma 2 and ViT-22B (both alongside QK-norm) — widely validated. Zero params, zero code-byte delta beyond the comment, zero model-byte delta. Shape-preserving, pre-FA3 placement (doesn't interact with the GPU kernel). Doesn't break XSA (which does its own F.normalize on v). Failure modes to watch: (a) V-magnitude collapse could under-use attention capacity → BPB up; (b) interaction with attn_scale (per-dim learnable residual gate) — attn_scale may partially compensate and absorb benefit. Structurally distinct from recent arch attempts: exp_286 (sandwich-norm on proj OUTPUT) crashed; exp_278 (per-head o_gain) size-blocked; this applies norm BEFORE the attention kernel so no zero-init interaction and no param addition.
297	2026-04-22T20:43:40Z	eval	280	280	eval	Polyak-averaged weights for TTT scoring pass (alpha=0.5 EMA of post-training theta), applied only to chunks ci>=1 while training continues on raw theta — smooths Nesterov mom=0.9 SGD trajectory oscillations at scoring time.	-0.0005	discard	1.074816	+0.000266	15996763	600.069000	761.931000	1473.000000	apg-eval-0289		Single-function edit in eval_val_ttt. Separates the scoring-weights trajectory from the training-weights trajectory: after each chunk's TTT training, EMA-blend post-training theta into a polyak_state (alpha=0.5). Next chunk's scoring swaps in polyak for the score pass, then restores raw theta before training. Chunk 0 unchanged (polyak_initialized=False skips swap). Orthogonal to all prior TTT smoothing attempts — momentum resets (089/113/171/213/232/253/255 all discarded) modify the training trajectory; LR floor/warmup (275/287) and L2 anchor (276) all modify training; logit temperature (044/072/093/117/157) modifies scoring outputs. This is the untested axis: weight-trajectory smoothing applied ONLY to scoring weights. Polyak-Ruppert theory predicts variance reduction on noisy SGD+momentum paths. Memory: +140MB/rank (polyak_states + scratch in bf16). Swap cost: ~50ms total across ~14 chunks. No size impact (+~1.5KB code). No compile impact (in-place .copy_ preserves storage pointers so compiled_logits graph stays valid).
298	2026-04-22T20:44:22Z	tok	280	280	tok	Move embed_scale INSIDE the post-tok_emb RMSNorm: replace `F.rms_norm(x) * embed_scale` with `F.rms_norm(x * embed_scale)`. Pre-norm (gauge-fixed) per-feature weighting — residual entering block 0 always has unit-RMS so embed_scale's gradient projects onto the tangent plane and can only learn RELATIVE feature weights (no global-magnitude gauge degeneracy). Removes redundancy with block-0 pre-RMSNorm which currently washes out the post-norm gain on the attn/MLP path.	-0.00015	keep	1.074482	-0.000068	15997580	600.088000	765.912000	1473.000000	apg-tok-0289	snapshots/298_tok	Single-line structural edit at forward_logits. At init (embed_scale=1.0) the forward is identical (F.rms_norm(x*1) == F.rms_norm(x)); post-init the two forms diverge. In the current post-norm form y_i=(x_i/RMS(x))*s_i makes residual-stream RMS=RMS(s), creating a gauge degeneracy (c*s cancels vs following weights) that block-0's pre-RMSNorm re-normalizes away on the attn/MLP path — only the residual-skip anchor actually sees s's global magnitude, which is already parameterised separately by skip_weights (per-feature × per-skip-level). Pre-norm form y_i=x_i*s_i/RMS(x*s) gauge-fixes RMS(y)=1 and makes s's gradient orthogonal to the 1-vector. Zero params, zero bytes, structurally distinct from the post-norm variant (not a sweep). Risk: if exp_190/exp_267's win actually came from the post-norm residual-magnitude change rather than per-feature relative weighting, this flattens to baseline-like behaviour; in that case Δ ≈ 0.
299	2026-04-22T20:49:44Z	curr	280	298	curr	Within-shard positional augmentation: replace stride-seq_len grid of start_inds (phase + k*2048) with uniform random integer starts over [phase, num_tokens - seq_len - 1], keeping Latin-square phase and sequence count — scatters doc-boundary splice points at ~50K-token resolution instead of on a 2048-grid, with negligible duplicate risk (~0.04 birthday bound per shard-reset in a 600s run).	-0.0004	discard	1.076362	+0.001880	15998729	600.073000	765.927000	1476.000000	apg-curr-0292		Single-site edit in ShuffledSequenceLoader._reset_shard. Code bytes +~500. No change to next_batch (exp_196 stratified quotas retained), no change to _phase_order Latin-square seed (exp_142 retained). Motivation: the saturated tree of phase-level shuffles (exp_142 keep, exp_196 keep, exp_289 discard, exp_047 discard) has never touched within-shard positional resolution — once a shard's phase is chosen, ALL sequences splice docs at a multiple of 2048 from that phase, biasing splice-context distribution. Each shard serves ~2000 sequences from ~50M valid positions in a 600s run (~4% coverage), so np.random.Generator.integers gives effectively non-overlapping random splice points. Expected mechanism: per-seq diverse splice contexts → smaller cross-seq correlation in gradient noise → slightly better generalization in warmdown. Risk: if 2048-grid spacing was accidentally load-bearing (e.g. through FA3 kernel cache alignment, which seems implausible since mm reads are 1-token-granular), we'd see crash or +delta.
300	2026-04-22T20:50:25Z	loss	280	298	loss	Eval-aligned last-stride CE weighting: 1.15× boost on the rightmost 64 positions (= eval sliding stride), mean-preserving — concentrates training gradient on the exact positions that contribute NEW logits to val_bpb after window 0.	-0.0002	size_blocked	1.074929		16000938	600.152000	781.848000	1493.000000	apg-loss-0292		Single-site edit in GPT.forward: reduction='none' CE → per-position weight pw (ones with last-64 at 1.15), mean-normalized to preserve loss scale at init, flattened and applied as detached (pw has no grad). Structurally distinct from prior smooth position weightings (exp_156 linear, exp_186 u^2): both spread the +10% tail gradient across all T positions; this variant puts ~1.14× on exactly the last 64 (matching sliding-window stride=64) and ~0.992× on positions 0..T-65. Rationale: after the first eval window, only the rightmost stride tokens of each 2048-window contribute NEW scoring to val_bpb; direct alignment of training gradient mass with eval-scored positions should dominate the diminishing-returns smooth ramps. Zero bytes, zero new params, zero compile graph change (pw is a built-on-device const per forward). Mean-preserving so no LR retuning needed. Applied on exp_280 baseline (no prior position weighting).
301	2026-04-22T20:50:52Z	quant	280	298	quant	"Per-category GPTQ Hessian damping: MLP weights get H_ii *= 1.025 (silu^2 activations, heavy-tailed bimodal diag(H)), attn/embed stay at 1.015 (post-RMSNorm ~Gaussian inputs). Average damping ~1.02 matches exp_280's total mass but redistributes asymmetrically where it matters.</hypothesis> <parameter name=""notes"">Two-site edit. (1) gptq_quantize_weight adds damping=1.02 param, replaces hard-coded 1.02. (2) gptq_mixed_quantize computes cat=classify_param(name), damp=1.025 if cat=='mlp' else 1.015. Motivation: every quant-damping trial tuned amplitude globally; no one has tried per-layer routing. MLP-proj inputs are silu^2(fc(x)) — non-negative, heavy tail, large diag(H) dynamic range on sink columns where 1/Hinv[j,j] amplifies — benefits from more damping. Attn QKV sees post-RMSNorm ~Gaussian — lighter damping preserves curvature fidelity. Embed (tied head) sees final_norm output → also Gaussian-ish → attn-style. Zero byte overhead.</notes> </invoke>" -0.00008 discard 1.074860 +0.000378 15996116 600.090000 768.910000 1478.000000 apg-quan-0293  
302	2026-04-22T20:54:21Z	reg	280	298	reg	Additive Gaussian feature noise (σ=0.02) on the re-injected x0 anchor path only (training-only), not on the primary residual stream x: noise propagates to every block via resid_mix[1]*x0 but is self-gated by the learned mix[1] (init=0), sidestepping the branch-kill/zero-gate failure mode of exp_040 (MLP hidden dropout) and exp_293 (MLP DropPath).	-0.0003	discard	1.074904	+0.000422	15997496	600.033000	744.967000	1451.000000	apg-reg-0295		Single-site edit in GPT.forward_logits: replace `x0 = x` with a training-mode conditional adding 0.02 * torch.randn_like(x). Gated by self.training, so off during torch.no_grad/inference_mode eval scoring. During TTT training (base_model.train()) the noise remains active, but its magnitude reaching each block is further attenuated by resid_mix[1] (small learned scalar), so the few-step TTT loop shouldn't be destabilized. No new params; only ~12 bytes of uncompressed code added. Structurally distinct from prior reg failures: exp_040 zeroed MLP hidden activations (discrete, harsh), exp_293 killed the entire MLP branch stochastically (discrete, harsh), whereas this is continuous additive noise on an already-attenuated injection path.
303	2026-04-22T20:56:05Z	opt	280	298	opt	Muon-only sqrt warmdown: apply muon_lr_scale = lr_scale**0.5 to the Muon param group while Adam (tok/head/scalar) groups retain linear warmdown. Rationale: Muon's NS-5 orthogonalization emits unit-SV updates, so group LR ≈ step-norm in weight space; the convex sqrt shape keeps Muon hotter through the tail (at lr_scale=0.1 Muon sees 0.316× vs linear's 0.1×) while Adam groups, whose effective step is raw-grad-dependent, keep the proven linear shape. Momentum cool-during-warmdown is unchanged (still driven by the global linear lr_scale). Zero bytes, zero params, single-site edit in step_fn. Not previously tried: shape changes have only been tested as global (exp_002 cosine keep, exp_043 cosine discard); asymmetric-per-group warmdown is unexplored.	-0.0004	discard	1.078573	+0.004091	15997368	600.106000	761.894000	1481.000000	apg-opt-0295		Hypothesis class: asymmetric warmdown shape per optimizer family. Single edit at train_gpt.py step_fn (lines ~1485-1490): replaced the uniform lr_scale loop with a per-optimizer scale that applies sqrt(lr_scale) to the Muon group only. Anti-anchoring vs recent opt discards (exp_292/284/015 all tweaked muon_momentum_warmup_start): this is a schedule-shape change rather than another corner of the momentum-warmup knob. Risks: (1) hotter-Muon-tail could overfit on low-shard-diversity late-training data (SWA/EMA averaging in the tail should absorb some of this); (2) the momentum cooling still uses the global lr_scale, so there is mild schedule asymmetry between muon LR and its own momentum — intentional, keeps the intervention single-site; (3) if the EMA collection in the last 20% of training is already dominant, sqrt-extended Muon late-bite may add noise rather than signal.
304	2026-04-22T20:56:07Z	meta	280	298	meta	Lower adam_eps 1e-8 → 1e-9 (single literal, all three AdamW groups share this): 10× step vs exp_048/exp_105 which both went 1e-10 and failed on size/eval-budget, so the training signal on this axis is genuinely unobserved. Directionally aligned with the 4-of-4 β2-raise discards (exp_068/091/126/159), which say the current stack wants a SHARPER preconditioner, not smoother — smaller eps sharpens the denominator for low-second-moment rows (rare-tail tok_emb, scalar ln_scale/qk_gain/skip_gates).	-0.0003	discard	1.075077	+0.000595	15994298	600.136000	758.864000	1469.000000	apg-meta-0295		"Single literal edit at train_gpt.py:161 (1e-8 → 1e-9). Shared adam_eps for: optimizer_tok (tied tok_emb, 4.2M params, LR=0.03 under embed_wd=0.085), optimizer_scalar (ln_scale/qk_gain/skip_gates/skip_weights/embed_scale under scalar_lr=0.02 and adam_wd=0.005), and optimizer_head (inactive under tie_embeddings). Conservative probe: 10× vs the exp_048/105 100× move that post-run size-blocked, so size risk lower. Parent exp_280 has beta2=0.93 already (short 2nd-moment half-life), so smaller eps compounds the ""responsive preconditioner"" theme rather than fighting it. No dead-code touched, no new env var, zero size impact pre-model."
305	2026-04-22T21:06:35Z	ttt	280	298	ttt	Lookahead slow-weights pullback at each TTT chunk boundary: initialize slow_params to pre-TTT snapshot, then after every chunk's SGD steps do slow ← slow + 0.5·(live − slow) followed by live ← slow. Structurally distinct from per-step L2 anchor to pre-TTT (exp_276 discard, −0.0003) and hard momentum reset (exp_253/255/263 discard) because (a) it operates on parameters not gradient/momentum, (b) the anchor point drifts cumulatively instead of being fixed to pre-TTT, and (c) the pullback cadence is per-chunk not per-step — so early-chunk adaptation is preserved in slow_params while per-chunk overshoot is halved.	-0.00020	discard	1.074995	+0.000513	15998120	600.113000	754.887000	1467.000000	apg-ttt-0297		Rationale: the TTT schedule axis is saturated (many momentum-reset/LR-decay variants all discarded within ±0.0005 of baseline). Lookahead introduces a NEW optimization-trajectory concept to the TTT loop — a secondary weight copy that lags fast updates. Standard Lookahead (Zhang et al. 2019) uses k=5-10 fast steps between pullbacks; our k≈16 steps/chunk matches that scale. α=0.5 is the paper's default; if this keeps, α is a clean follow-up sweep axis. Memory cost: one float32 copy of ttt_params at eval time (≈140 MB, fits). Compute cost: one lerp+copy per chunk (≈13×35M ops = negligible).
306	2026-04-22T21:08:08Z	arch	280	298	arch	Output-side companion to exp_245: scale attn_scale/mlp_scale INIT of looped blocks (layers 3-5) by 1/sqrt(num_loops+1)=1/sqrt(3) so each of the 3 per-pass residual contributions starts at ~58% of a non-looped block — variance-balances the effective-depth-17 residual stream from the OUTPUT side on top of exp_245's INPUT-side ln_scale_factor damping.	-0.0003	discard	1.074763	+0.000281	15999672	600.052000	754.948000	1461.000000	apg-arch-0297		Single-site edit in GPT.__init__ right after exp_245's ln_scale_factor loop. Uses in-place .data.mul_(1/sqrt(3)) on attn_scale and mlp_scale of blocks[loop_start..loop_end]. These params are in the scalar-passthrough AdamW group (CONTROL_TENSOR_NAME_PATTERNS includes attn_scale, mlp_scale), so they're NOT GPTQ-quantized — no direct byte-inflation path as hit exp_296 V-norm. Zero new params, zero new bytes. Rationale: exp_245 (current best's parent) damps looped-block INPUTS; the MLP input-scaling acts like α² on output (silu² nonlinearity) while attention via V acts linearly α. This output-side α adds a linear path — gentler than a fully symmetric output rms_norm (which crashed as exp_286 sandwich-norm in GPTQ). Optimizer is free to recover magnitude if needed; the bet is that early-training residual stream variance is better-conditioned when the 3× replicated blocks start at 1/sqrt(3) per-pass. Orthogonal to all recent arch ideas (exp_296 V-norm / exp_286 sandwich norm), and complements exp_245 rather than competing with it.
