exp_id	timestamp	specialist	parent_exp	baseline_exp	domain	hypothesis	expected_delta	status	val_bpb	delta_vs_best	artifact_bytes	train_s	eval_s	total_s	job_name	snapshot_path	notes
238	2026-04-22T17:43:31Z	reg	212	212	reg	"LR-coupled Muon weight-decay boost during warmdown: multiply per-group weight_decay by 1/max(lr_scale, 0.667) (cap 1.5x) in step_fn so inside Muon's p *= (1 - lr*wd) update the effective per-step decay lr*wd_eff stays ~constant over lr_scale in [0.667, 1] instead of collapsing toward 0 with the 72% warmdown tail — schedule-targeted regularization orthogonal to exp_141 (depth-targeted) and exp_164 (type-targeted).</hypothesis> <parameter name=""notes"">Three-line insertion in step_fn after the existing per-optimizer lr-scale loop (~line 1457). Computes muon_wd_boost = 1/max(lr_scale, 0.667) and writes it into both Muon param groups (attn wd=h.muon_wd=0.095, mlp wd=h.muon_wd_mlp=0.125). Zero new params, zero hyperparam adds, ~600 code bytes. Muon.step already reads group.get('weight_decay', 0.0) fresh each step (~line 838), so dynamic updates compose cleanly. Not inside torch.compile (step_fn is eager). Warmup passes with lr_scale=1.0 → boost=1.0 → no effect. Cap 0.667 (1.5x) chosen gentler than exp_218's 2x cap for tok_emb — matrix params may be more sensitive given exp_187's regression at muon_wd_mlp*1.24 on recurrent layers. Reg-domain context: first SCHEDULE-targeted Muon WD trial. exp_218 applied the same idea to tok_emb with unclear outcome (TSV row mangled). Total integrated added decay during warmdown ~ +0.15x equivalent uniform boost — lighter than exp_141's +0.30x. Risk: over-tightening matrix params in the deep tail where EMA is pulling the model stationary; lr_scale-floor cap mitigates by letting wd_boost taper below 0.667. Size preflight: code_bytes=23126; model structure unchanged." -0.0003 discard 1.077681 +0.002659 15995004 600.126000 766.874000 1475.000000 apg-reg-0230  
239	2026-04-22T17:44:12Z	tok	212	212	tok	Re-apply exp_190's per-feature embed_scale gamma (nn.Parameter shape=[embedding_dim], init=1.0) right after the pre-backbone rms_norm of the embedding output, registered in the scalar AdamW group. exp_212's best branch diverged before exp_190 and does NOT contain embed_scale (verified by grep on the snapshot) — this is a stacking test of a proven −0.000463 change onto a branch that never inherited it.	-0.0003	discard	1.075186	+0.000164	15996293	600.039000	757.961000	1467.000000	apg-tok-0232		Three-site edit: (1) GPT.__init__ declares self.embed_scale = nn.Parameter(torch.ones(h.embedding_dim, dtype=fp32)) right after self.tok_emb; (2) forward_logits multiplies x by embed_scale.to(x.dtype) after the F.rms_norm and before the optional embed_proj; (3) Optimizers.__init__ appends base_model.embed_scale to scalar_params (same group as skip_weights/skip_gates, uses scalar_lr/adam_wd). Byte cost: ~2KB uncompressed fp32 scalars, passed through unquantized. Param count: 512 new trainable scalars. Compile-safe: multiplicative gamma on a learnable parameter is already standard in torch.compile graphs (same pattern as ln_scale/skip_weights). No change to GPTQ path (embed_scale is a top-level parameter, not an nn.Linear/nn.Embedding weight). Expected delta is discounted from exp_190's isolated −0.000463 because some of that gain may already overlap with exp_212's quant improvements.
240	2026-04-22T17:47:28Z	quant	212	212	quant	Shrink GPTQ block_size 64→32: direct continuation of exp_108's winning direction (128→64, Δ=-0.000079); 2× more error-propagation events per matrix (every 32 cols vs every 64), finer Hessian-aware residual redistribution. Untried with a real run (exp_035 was 128→32 but harness_aborted).	-0.00008	discard	1.075152	+0.000130	15990508	600.031000	752.969000	1463.000000	apg-quan-0232		Single-literal change on line 985 (gptq_quantize_weight default arg block_size=64→32). Zero size risk: same Q int8-stored int6 dtype, same per-row fp16 scale s, same clip_range, same damp (0.02 from exp_212). Only cost is ~2× inner-loop iterations in gptq_quantize_weight during eval-time GPTQ (roughly +10-30s across ~30 matrices); well within 600s eval budget. Expected delta is small (matches exp_108's marginal keep at -0.000079) because block_size returns are diminishing — but the direction is the only structurally unexplored quant knob left after damp saturation (exp_016/212/231) and per-row scale refinement consistently size-blocking (exp_004/008/045).
241	2026-04-22T17:49:07Z	opt	212	212	opt	Raise Muon Newton-Schulz iteration count 5→6 (muon_backend_steps): never mutated in ~230 trials; the one truly untouched knob inside the Muon algorithm proper. With MuonEq-R row-normalize amplifying small-sigma directions, 5 NS5-quintic iters leave residual non-orthogonality on tall/skinny matrices; an extra iteration pushes orthogonality ~99% to ~99.8% so the sqrt(aspect) spectral-bound rescale in Muon.step aligns more consistently across matrix shapes.	-0.0003	discard	1.076364	+0.001342	15993276	600.132000	754.868000	1463.000000	apg-opt-0234		Single-literal edit at train_gpt.py:151 (MUON_BACKEND_STEPS default 5 to 6). Zero model-bytes cost, +1 code byte. Env var verified not injected by run_trial.sh (only DATA paths are), so default takes effect. Compute cost: 2 extra bfloat16 matmuls per matrix per Muon step — roughly 1-2s added train wall inside the 600s cap. Orthogonal to all prior opt experiments: all schedule/momentum/WD knobs explored (exp_088 warmup_frac kept, exp_010 cool kept, exp_120 nesterov off catastrophic, exp_094/138 peak momentum failed both ways, exp_128/191 warmup_frac further shrink discarded, exp_148/220 warmdown shorten discarded, exp_230 cosine grad-clip discarded). Rationale for up-direction: MuonEq-R row-normalize pre-scales rows to unit norm, amplifying noise in small singular components that NS5 only partially suppresses in 5 iters; 6 iters recovers cleaner orthogonal direction.
242	2026-04-22T17:51:25Z	meta	212	212	meta	Re-apply exp_003's proven winning ema_decay 0.9965→0.998 on top of exp_212: the 0.998 change was kept at Δ=-0.000776 from baseline but was lost when exp_005 (arch-rope) branched from exp_000 rather than exp_003, and it has never been retested on any subsequent best. Widens EMA half-life ~200→~346 steps, capturing more of the 72% warmdown tail.	-0.0003	discard	1.077065	+0.002043	15997024	600.087000	749.913000	1461.000000	apg-meta-0235		"Single-literal edit at line 174 (EMA_DECAY default 0.9965 → 0.998). Zero-byte, zero-param, zero-eval-cost. Rebased fresh from exp_212 snapshot first — my workdir had drifted to grad_clip_norm=0.4 (from discarded exp_233). exp_003 baseline proof: 1.0810→1.079647 (Δ=-0.000776). exp_006 showed 0.999 overshoots (+0.008841 vs exp_003), so 0.998 is the sweet spot. Expected delta scaled down vs exp_003's raw number because many subsequent keeps (TTT, sliding-window eval, GPTQ tuning) may have already captured some of the ""smoother final weights"" benefit; still predict a net improvement since EMA-decay is orthogonal to all of those."
243	2026-04-22T17:52:01Z	ttt	212	212	ttt	Replace TTT across-chunk cosine LR decay (1.0→0.0) with linear decay (1.0→0.5) so late chunks actually adapt: at num_chunks=13, cosine sends ci=10/11 to 6.7%/1.7% of ttt_lr (near-zero adaptation for ~15-20% of eval compute); linear keeps them at 58%/54%, reclaiming late-chunk SGD as real adaptation on the val distribution.	-0.0003	discard	1.075514	+0.000492	15993799	600.144000	753.856000	1461.000000	apg-ttt-0235		Single-site edit inside eval_val_ttt at the per-chunk cos_lr assignment. Formula change: 0.5*(1+cos(pi*ci/(num_chunks-1))) → (1 - 0.5*ci/(num_chunks-1)). Zero size, zero compute, zero param change. Untried in history: exp_037 proposed cosine-cool momentum (harness_abort), exp_232 tried momentum reset (discarded). Nobody has altered the cross-chunk LR schedule shape itself. Rationale: the current cosine reaches LR≈0 at ci=num_chunks-1 (the skipped last chunk), which means the LAST TRAINED chunk (ci=num_chunks-2) already runs at ~1.7% LR — essentially wasted SGD. Linear floor at 0.5 preserves early-chunk emphasis (still 1.0×) while turning the last ~1/3 of chunks from near-no-ops into meaningful adaptation. Risk: late chunks may over-adapt; mitigated by the 0.5 floor and the existing grad_clip_norm=1.0. Score-first legality is unchanged (scoring still precedes SGD per chunk under no_grad).
244	2026-04-22T17:55:30Z	eval	212	212	eval	Tighten TTT gradient clip 1.0 to 0.5	-0.0003	discard	1.075511	+0.000489	15996176	600.017000	760.983000	1470.000000	apg-eval-0235		
245	2026-04-22T18:01:17Z	arch	212	212	arch	Recurrence-aware ln_scale correction: divide ln_scale_factor by sqrt(num_loops+1)=sqrt(3) for looped blocks 3-5 (called 3× per forward pass), equalizing their total residual contribution against single-call layers; zero new params, zero byte impact.	-0.0003	keep	1.074750	-0.000272	15992650	600.123000	764.877000	1477.000000	apg-arch-0237	snapshots/245_arch	Single-site edit in GPT.__init__ (right after parallel_residual setup, before loop index construction). The existing ln_scale_factor=1/sqrt(layer_idx+1) DeepNorm-style damper uses static layer_idx and ignores that blocks 3/4/5 are each invoked num_loops+1=3 times per forward. Multiplying their ln_scale_factor by 1/sqrt(3)≈0.577 makes their cumulative per-layer contribution to the residual stream match a single-call layer's contribution (variance-balancing). Conditional on h.num_loops>0 and h.ln_scale so no-op if recurrence/DeepNorm disabled. Untried: exp_018 did learnable per-channel norm gains (discard), exp_098 removed post-norms (discard), exp_134 shifted parallel_residual split (discard) — but loop-aware pre-norm scaling is novel. Differs from exp_170 (fatter heads) and exp_005/121/160 (rope_dims) which also affected attention strength per layer. Zero-risk on size/runtime since it's a Python-side init constant tweak.
246	2026-04-22T18:04:47Z	loss	212	245	loss	Position-decaying label smoothing eps(u) = 0.01*(1-u) across T=2048: smooths early-position targets (inherently high-entropy, no context) while keeping late positions (where sliding-window stride-64 eval scores) sharp. Mean eps ~0.005; zero train/val mismatch at t=T-1.	-0.0005	discard	1.078453	+0.003703	15966370	600.141000	771.859000	1483.000000	apg-loss-0237		Novel axis for loss domain on exp_212's no-LS base. exp_042 (0.003→0.001, discard +0.00193) was on old exp_017 branch; exp_212 currently has zero LS (plain F.cross_entropy), so mild LS has never been tested on this lineage. exp_236 just showed steeper position WEIGHTING (ratio 1.5) hurt, so I'm explicitly NOT tweaking PW coefficients — this shifts target DISTRIBUTION instead of loss magnitude (orthogonal axis). Implementation uses the logsumexp form nll=lse-logits.gather(target); uniform_term=lse-logits.mean(-1); loss=(1-eps)*nll+eps*uniform_term. This avoids materializing a [B*T, V] log_probs tensor so memory is equivalent to F.cross_entropy (which also computes log_softmax internally). eps(u) = 0.01*(1-u): eps=0.01 at pos 0 (strongest smoothing where context=0 → target is inherently high-entropy), eps→0 at pos T-1 (where sliding-window eval scores each window's last tokens → zero train/val objective mismatch on the most-evaluated positions). Mean ~0.005. No new params, no stored state — eps vector is built on device at each step (linspace). Code delta: +1.6KB code_bytes (size_project ok). Theory: Pereyra et al. confidence-penalty intuition + the fact that val_bpb uses plain CE means any uniform LS creates train/val mismatch — making LS position-decaying concentrates the mismatch exactly where eval weights least (early positions, where any stride-64 window has ≤T positions of context).
247	2026-04-22T18:11:58Z	curr	212	245	curr	Per-sequence fine-grained positional jitter in [0,32) added to each training start_ind inside ShuffledSequenceLoader._reset_shard: multiplies unique starting positions per shard pass by ~32x on top of the existing 8-phase Latin-square (256-token coarse spacing), without altering sample counts, model params, or artifact size.	-0.0001	discard	1.076051	+0.001301	15987416	600.061000	781.939000	1492.000000	apg-curr-0240		Untried curr direction. Prior curr work touched stride (exp_047 halved stride: discard +0.001), phase cycle (exp_142 latin-square: keep -0.000024), batch shard sampling (exp_196 stratified: keep -0.000087), and CE position weights (exp_237 step-weight last 64: discard). None addressed sub-phase (sub-256-token) positional diversity. Single-site edit in _reset_shard: draw jitters~U{0..31} per sequence, add to starts, clamp to max_start. Non-overlap preserved (jitter 31 << seq_len 2048). Jitter uses the existing per-rank PCG64; fully deterministic per seed. At most 1 tail duplicate per shard reset when the last sample clips. Zero params, zero eval-path impact, +401 code bytes (comment + one extra line). Risk: slight shift in shard sample count budget; should be well below leaderboard noise.
248	2026-04-22T18:12:47Z	reg	212	245	reg	Split Muon attention WD by projection role: raise WD on V + output projections (c_v + attn.proj) to 0.125, keep Q+K at 0.095. Attention-internal analogue of exp_164.	-0.00015	discard	1.075116	+0.000366	15998698	600.029000	756.971000	1467.000000	apg-reg-0240		
249	2026-04-22T18:14:06Z	tok	exp_212	245	tok	Add learnable per-vocab output logit bias to tied softmax. Decouples unigram-prior from embedding magnitude. exp_023 proposed but harness-aborted; this is a proper run.	-0.0010	size_blocked	1.075315		16007938	600.084000	760.916000	1469.000000	apg-tok-0241		Three-site edit: GPT.__init__ adds self.logit_bias=nn.Parameter(torch.zeros(h.vocab_size, dtype=fp32)); forward_logits tied path uses F.linear(x, tok_emb.weight, logit_bias.to(x.dtype)); Optimizers appends logit_bias to scalar_params. 8192 params stay fp16 passthrough (numel below 65536 skip-quant cutoff), 16KB raw, ~6-10KB after byte-shuffle+brotli.
250	2026-04-22T18:18:00Z	quant	212	245	quant	Double GPTQ calibration batches 64→128: halves Hessian estimator variance so H^{-1} error-propagation in the GPTQ inner loop tracks true second-order curvature more precisely.	-0.0005	discard	1.075337	+0.000587	15994852	600.319000	761.681000	1469.000000	apg-quan-0244		Single-literal change at line 190 (GPTQ_CALIBRATION_BATCHES default 64→128). Zero-byte (same Q int8-stored int6 dtype, same per-row fp16 scale); only perturbs Hessian estimate used inside gptq_quantize_weight. Original GPTQ (Frantar 2022) recommends 128+ samples — we were under-sampled at 64. Retry of exp_071 which was harness_abort under the old harness; no usable signal was recorded. Eval-time cost: ~5-15s of additional forward_logits (no_grad) during collect_hessians — exp_212's post-train wall ~760s includes compile (~150s), so actual eval is ~610s; another 5-15s keeps us within the 600s eval budget since compile is amortized. Smoke path unaffected (line 229 explicitly pins smoke calibration to 2). exp_212 (damp 0.01→0.02) proved Hessian treatment is load-bearing for bpb at this regime — better Hessian estimate is the natural follow-on since both exp_016 (lower damp) and exp_231 (higher damp) regressed, suggesting the damp/noise tradeoff curve is tight and reducing noise (more batches) dominates.
251	2026-04-22T18:20:21Z	opt	212	245	opt	Decouple Muon-momentum warmdown floor from warmup_start and raise it 0.92 to 0.95 (softer lockstep cool during warmdown); exp_109 lowered coupled floor to 0.85 (discard) and exp_200 tried kinked hold-then-drop cool (discard) — shallower smooth-cool direction is untested.	-0.0002	discard	1.074984	+0.000234	15996377	600.089000	755.911000	1465.000000	apg-opt-0244		Two-site edit: new muon_momentum_warmdown_end=0.95 hparam plus step_fn blend endpoint swap from warmup_start (0.92) to warmdown_end (0.95). Warmup ramp untouched. Zero params, zero model bytes, +1 code byte.
252	2026-04-22T18:26:26Z	meta	212	245	meta	Lower tied_embed_lr 0.03 to 0.026 on tied tok_emb AdamW group.	-0.0001	discard	1.075804	+0.001054	15996981	600.138000	759.862000	1472.000000	apg-meta-0244		Single-literal edit at train_gpt.py:146 (TIED_EMBED_LR default 0.03 to 0.026). Only untested AdamW LR axis in 240 trials.
253	2026-04-22T18:29:55Z	ttt	212	245	ttt	Reset SGD momentum_buffer at each TTT chunk boundary so stale velocity from chunk (i-1) — scaled by prior cos_lr — doesn't contaminate chunk i's first steps under a different LR; each chunk's ~16 SGD steps start from clean velocity.	-0.0003	discard	1.075445	+0.000695	15997808	600.109000	759.891000	1469.000000	apg-ttt-0245		Single-site edit inside eval_val_ttt, immediately after the per-chunk cos_lr assignment (line ~1350). Zero bytes, zero params, zero eval-cost (per-chunk tensor.zero_() on momentum buffers for ~36M params ≈ <1ms × 13 chunks). Structurally orthogonal to prior TTT trials: exp_039 tuned momentum value (0.9→0.95, discarded), exp_151 kept nesterov=True, but the momentum BUFFER accumulates across chunks with the current code — it's created once at line 1299 outside the ci loop. Cosine decay sends cos_lr from ttt_lr at ci=0 down to 0 at ci=12; the velocity buffer is v = 0.9·v + g(chunk_i), then next chunk multiplies that same v by a different lr. Resetting decouples chunks: each chunk's adaptation is a fresh SGD+Nesterov run at its own LR. If momentum persistence was net-beneficial, this will hurt (small regression, clear signal); if it was a silent bug, expected ~-0.0003. Rebased to exp_212 first to undo discarded exp_243 linear-decay edit.
254	2026-04-22T18:37:18Z	arch	245	245	arch	Parallel-residual ln_scale correction: divide ln_scale_factor by sqrt(2) for parallel blocks 7 to 10, a sibling of exp_245 loop-aware correction on a non-overlapping block range.	-0.0003	discard	1.075543	+0.000793	15992404	600.143000	766.857000	1475.000000	apg-arch-0247		Single-site edit in GPT.__init__ after exp_245 correction. Multiplies ln_scale_factor by 1/sqrt(2) for blocks i in parallel_residual_start..num_layers-1. Zero params, zero model bytes.
255	2026-04-22T18:37:32Z	eval	212	245	eval	Reset TTT SGD momentum buffer at the start of each chunk's training phase: stale momentum from earlier high-LR chunks pushes updates in directions misaligned with the cosine LR decay in late low-LR chunks, effectively overriding the schedule.	-0.0004	discard	1.075633	+0.000883	15994909	600.013000	750.987000	1461.000000	apg-eval-0245		Single-site addition inside eval_val_ttt, just after per-chunk cos_lr assignment (line 1350). Iterates ttt_params and zeros the SGD momentum_buffer in optimizer.state if present. Zero model params, ~250 code bytes, zero eval-time cost (an in-place zero over ~200 tensors vs. thousands of SGD steps per chunk). Targets the exp_039 signal (momentum 0.9→0.95 discarded at Δ=+0.000178) by pushing in the opposite direction — not lowering the momentum coefficient (which fights nesterov=True constraint), but resetting the buffer so each chunk's TTT adaptation starts from a clean direction while weights continue to evolve. Rebased fresh from exp_212 snapshot first.
256	2026-04-22T18:39:18Z	loss	245	245	loss	Restore exp_186's proven u² position-weighted CE (pw=0.9+0.2·u², mean-preserving) on the exp_245 lineage: the PW keep (Δ=-0.000062 on exp_176) was dropped at exp_190→exp_196→exp_212→exp_245, and exp_226's attempt to restore on exp_212 hit eval_budget_overrun (infra, not measurement).	-0.00006	discard	1.075332	+0.000582	15991249	600.116000	772.884000	1481.000000	apg-loss-0247		Single-site edit in GPT.forward: reduction='mean' CE → reduction='none', multiply by pw=0.9+0.2·u² (u=linspace(0,1,T)), mean-normalize, mean-reduce. Training-only (forward_logits untouched → eval/GPTQ/TTT paths bit-identical; zero bytes, zero params). Mean-preserving so LR/warmdown/Muon schedules stay calibrated. Orthogonal to exp_245's ln_scale recurrence correction (that change is arch-side, doesn't reshape training gradients). Avoided the exp_216 anti-focal stack (catastrophic +0.69) — this is pure position tilt, no per-token difficulty weighting. exp_246 (position-DECAYING LS on exp_245, +0.0037 discard) failed the opposite axis (target-distribution smoothing in the wrong direction); this is gradient-magnitude tilt toward the eval stride-64 scored regime [1984,2047], which was the consistent winner (exp_156 linear, exp_176, exp_186 u²).
257	2026-04-22T18:43:32Z	reg	245	245	reg	Set adam_wd 0.005 to 0.0 on scalar AdamW group, removing WD on control params whose optima are nonzero.	-0.00015	discard	1.075685	+0.000935	15992641	600.064000	762.936000	1480.000000	apg-reg-0250		Continues exp_177 direction (0.02 to 0.005 keep) to endpoint. Single literal edit line 165. No size or compile risk.
