exp_id	timestamp	specialist	parent_exp	baseline_exp	domain	hypothesis	expected_delta	status	val_bpb	delta_vs_best	artifact_bytes	train_s	eval_s	total_s	job_name	snapshot_path	notes
804	2026-04-25T18:39:08Z	opt	750	750	opt	Per-group Muon matrix_lr split: introduce matrix_lr_mlp=0.023 for MLP Muon group while attn group keeps matrix_lr=0.022 (per-group base_lr). Mirrors the kept attn/mlp WD asymmetry (exp_164/exp_336) on the LR axis.	-0.0001	size_blocked	1.072548		16001322	600.046000	578.400000	1511.000000	apg-opt-0795		Untried axis: previous matrix_lr probes (exp_214 0.024, exp_325 0.023, exp_714 0.0225) all hurt globally, but the MLP-only application halves the global perturbation while targeting the larger-param-mass group that the WD split has already shown wants less regularization (exp_336 lowered muon_wd_mlp). +23 packed bytes; same trajectory direction as the WD asymmetry. exp_325 was closest to keep at +0.000091 globally — restricting +0.001 to MLP only should cut that delta below noise while net-positive on the larger group.
805	2026-04-25T18:48:34Z	reg	750	750	reg	TTT input-token dropout p=0.03 mask-to-0 before forward_logits in eval_val_ttt train phase: token-level augmentation regularizes inner SGD against per-chunk overfitting.	-0.0002	size_blocked	1.073592		16000808	600.149000	585.000000	1523.000000	apg-reg-0802		+46 code bytes. Single line at L1398. Mask rate 3% corrupts ~60 of 2048 positions per seq. Affects only TTT train forward; score-phase untouched. Untried mechanism class.
806	2026-04-25T18:48:35Z	ttt	750	750	ttt	Recurrence-aware per-block-group TTT LR: divide TTT lr by sqrt(num_loops+1)=sqrt(3) on looped blocks 3-5 only (the blocks invoked 3x per forward), leaving other blocks at full lr. Mirrors exp_245's kept ln_scale variance-balancing on these same blocks.	-0.0003	discard	1.077586	+0.005376	15999460	600.143000	536.600000	1439.000000	apg-ttt-0802		Looped blocks 3-5 are invoked num_loops+1=3 times per forward, so their parameters accumulate ~3x grad in TTT backprop vs non-looped blocks 0-2,6-9. SGD step magnitude scales with ||grad||, so looped blocks effectively receive sqrt(3)x larger update steps in expectation under noisy SGD. Damping their TTT lr by 1/sqrt(3) restores variance-balanced per-block update magnitudes — same principle as exp_245 (kept Δ=-0.000272) which divided ln_scale_factor by sqrt(num_loops+1) on the identical block range. Implementation: split ttt_params into 2 SGD param_groups by id-set membership in blocks[loop_start..loop_end], attach lr_mul to each group, multiply through in the existing per-epoch lr-sweep line. +1 line at SGD construction (5 lines total), +1 token in lr loop. Structurally distinct from all prior TTT tweaks (no prior TTT trial has used per-group lr scaling).
807	2026-04-25T18:49:27Z	loss	750	750	loss	Mismatch-gated mean-preserving TTT z-loss: replace `1e-5*lse².mean()` with `1e-5*sum(lse²·1[ŷ≠y])/sum(1[ŷ≠y])` on the TTT inner CE — penalize log-partition magnitude only on positions where argmax prediction is wrong, leaving already-correct positions with unconstrained logit-magnitude freedom for sharpening. Mechanism-distinct from all 11 prior TTT z-loss probes (L1/variance/anchor=log(V)/hinge/tail-PW/amax/coef-halve/coef-double/byte-weight/PW-CE/label-smoothing).	-0.0003	discard	1.073486	+0.001276	15998905	600.100000	580.000000	1513.000000	apg-loss-0802		Edit at line 1401: introduce _wr=(argmax!=y).float() mask. Numerator: sum(lse²·_wr); denominator: sum(_wr).clamp_min(1.0). Renormalization keeps regularization magnitude similar to current 1e-5 on average, but concentrated on hard positions. +45 packed code bytes vs exp_750 baseline. Compile-friendly (argmax detached automatically). Hypothesis: kept exp_596 z-loss is over-regularizing positions the model has already nailed; gating to mismatch positions preserves the regularization where it matters (preventing overconfident-but-wrong drift in TTT) while letting confident-correct positions continue sharpening.
808	2026-04-25T18:56:56Z	tok	750	750	tok	Halve gradient on tied tok_emb classifier path (W_cls = 0.5*W + 0.5*W.detach()): lookup path retains full gradient, output classifier contributes 0.5x backward grad. Forward identity, zero new params. Tests whether dual-pull tied tok_emb benefits from input-lookup-dominant gradient flow.	-0.0005	size_blocked	1.075415		16004353	600.076000	580.700000	1519.000000	apg-tok-0802		Single-site forward edit at L767 forward_logits. Replaces logits_proj = F.linear(x, tok_emb.weight) with: W = tok_emb.weight; W_cls = 0.5*W + 0.5*W.detach(); F.linear(x, W_cls). Forward value identical (W.detach() == W numerically). Backward: ∂(W_cls)/∂W = 0.5, halving the gradient flowing back into tok_emb from the classifier path, while the input-side self.tok_emb(input_ids) lookup keeps full gradient. Code +102 packed bytes (23309→23411). Mechanism: tied embeddings receive competing pulls — sparse frequency-weighted lookup gradients vs dense loss-weighted classifier gradients. Halving classifier-side reduces over-pull on row magnitudes (which encode unigram prior), letting input-driven directional structure dominate. Distinct from exp_532 (scale_grad_by_freq=True input-side, size_blocked) and exp_491 (control-scalar TTT freeze) — those touched different paths. Distinct from exp_775/781/799 (output-side gain/normalize, all discarded/crashed) — those changed FORWARD value, this preserves forward and only reweights backward. Risk: if classifier gradient is essential for tok_emb learning, BPB regresses by ~+0.001-0.005. Either outcome informative on the dual-role gradient balance axis. torch.compile-safe (detach is standard op).
809	2026-04-25T19:00:20Z	quant	750	750	quant	"Stochastic (unbiased) rounding in GPTQ inner loop: replace torch.round(w_col/sf) with torch.floor(w_col/sf + U[0,1)) using a fixed-seed Generator. Storage neutral; structurally novel for this codebase (entire tree uses torch.round).</hypothesis> <parameter name=""notes"">Single-site edit in gptq_quantize_weight inner loop. dither drawn per-column from torch.rand(rows, generator=sr_gen) seeded 0xA1F0 for reproducibility. Theory: deterministic round-to-nearest gives correlated residual signs across rows near half-integer boundaries; GPTQ propagates the actual error but the per-row correlation couples cross-column errors. Stochastic dither decorrelates rows so error propagation acts on zero-mean per-row noise. Storage unchanged. Code +338B (23295->23633). Risk: noise variance may dominate over bias-removal at int6 bin width ~0.2 sigma." -0.0001 size_blocked 1.081207  16058892 600.135000 589.200000 1527.000000 apg-quan-0802  
810	2026-04-25T19:05:00Z	meta	750	750	meta	Enable amsgrad=True on optimizer_tok (tied tok_emb AdamW) only — caps v_t monotonically non-decreasing to fix rare-row Adam-divergence where beta2=0.95 lets v_r decay between row hits causing oversized updates; untouched axis across 800+ trials.	-0.0003	discard	1.075748	+0.003538	15992887	600.119000	580.500000	1513.000000	apg-meta-0804		Single-flag addition at L908 adding amsgrad=True to optimizer_tok AdamW only. Code +14B. amsgrad+fused supported since torch 2.1 (environment 2.9.1). Scalar group untouched.
811	2026-04-25T19:12:45Z	eval	750	750	eval	Replace per-row GC with per-column GC on TTT SGD: attacks per-input-feature bias mode. exp_762 doubly-centered failed; pure column-only untested vs kept exp_592 row-only.	-0.0001	discard	1.072790	+0.000580	15996526	600.063000	525.500000	1423.000000	apg-eval-0802		1-line edit, byte-saving (-19 packed). Tied tok_emb [8192,512] dominant bias may be per-feature shift across vocab.
812	2026-04-25T19:14:21Z	arch	750	750	arch	Swap MLP activation silu²→gelu² (Primer-style x²-family kept, but use GELU's sharper shoulder vs SiLU): byte-neutral 4-char swap, sparser hidden activations entering int6-quantized proj, untried in this swarm (only silu²/relu² endpoints have been tested).	-0.0005	size_blocked	1.073935		16003611	600.052000	587.300000	1525.000000	apg-arch-0805		Single-line edit on Block.MLP.forward (line 581). silu(x) and gelu(x) differ near the origin: gelu(-3)~-0.004 vs silu(-3)~-0.142, so gelu²(x) is ~10x closer to relu² for negative pre-activations while keeping a smooth gradient (unlike relu² which has hard zero gradient). Hypothesis: tighter input distribution to the int6 proj → cleaner GPTQ calibration. relu² (exp_435) was size_blocked at val_bpb=1.076 (~+0.001 vs parent), suggesting non-silu activations are competitive but historically ≥ silu²; gelu² is the untested midpoint with a different rationale (smoothness + sparsity, not just sparsity).
813	2026-04-25T19:15:45Z	curr	750	750	curr	Predecessor-special CE mask in train_loader: y[x<3]=-100 drops CE on positions where input token is UNK/BOS/EOS, removing gradient noise from document-boundary-conditioned predictions. Mechanism-distinct from exp_679 (target-side mask, discarded +0.0017).	-0.0002	discard	1.074293	+0.002083	15999006	600.032000	581.200000	1515.000000	apg-curr-0802		Untried in our swarm (exp_679 was target-side mask y<3). ~0.2% of positions affected if SP8192 fineweb data has explicit document boundaries. Calib_loader unaffected (discards y). F.cross_entropy default ignore_index=-100 handles drop. Anti-anchoring vs the recent stride/phase tweaks crowding curr domain.
814	2026-04-25T19:22:31Z	opt	750	750	opt	Cool target 0.93→0.94 on Muon momentum mm_blend (single-literal byte-neutral): probe untested UP midpoint between exp_750's kept 0.93 and exp_251's old-baseline-discarded 0.95.	-0.0001	size_blocked	1.073217		16001986	600.126000	582.300000	1516.000000	apg-opt-0808		"Single-literal change at line 1486 (and matching comment at line 1484). Byte-neutral (code_bytes=23,318, identical to parent). exp_750's keep took cool target 0.92→0.93 with Δ=-0.000036; the natural follow-up is testing whether the trend continues UP. exp_251 tested 0.95 on a much-older baseline (1.075-ish, discard +0.000774), so 0.95 was bad in that regime, but 0.94 as the local midpoint is genuinely untested at any baseline. If kept, extends to 0.95 retest at current best; if discarded, confirms 0.93 is local optimum on this axis. Zero size or compile risk given byte-identical code.</notes> </invoke>"
815	2026-04-25T19:25:56Z	ttt	750	750	ttt	Hard-mask TTT z-loss to last-128 positions to match CE scope: replace logsumexp.mean() over all 2048 positions with logsumexp.mean() over only the last-128 logits (same window where CE is masked). Eliminates z-loss gradient on positions 0..1919 that have no CE signal during TTT; aligns regularization with the actual TTT objective. Distinct from exp_704 (soft tail re-weighting, size_blocked, never measured) — hard mask zeros out positions 0..1919 entirely. Bonus: -22 code bytes (23428→23406) by collapsing reduction='none'+reshape into pre-slice.	-0.0002	size_blocked	1.077717		16002769	600.055000	587.400000	1538.000000	apg-ttt-0808		Single-line structural edit at L1403-1405. Behavioral change: z-loss now scoped to last-128 logits (same as CE), eliminating gradient mismatch where regularizer pulled logits down on 1920 positions with no CE signal. Per-element gradient scale 16x larger (smaller mean denominator) but total parameter gradient comparable since OLD averaged dlse/dθ over 2048 positions; NEW averages over 128. Closest sibling exp_704 was a soft mean-preserving reweight (linspace 0.5,1.5) and went size_blocked — this is structurally different (hard mask, also saves bytes). Risk: if z-loss derived signal from full-sequence logit calibration, restricting it could regress.
816	2026-04-25T19:29:03Z	loss	750	750	loss	Byte-neutral quartic TTT z-loss: 1e-5*lse.pow(2).mean() to 1e-7*lse.pow(4).mean() at L1401	-0.0001	discard	1.074947	+0.002737	15996364	600.014000	587.400000	1529.000000	apg-loss-0808		
817	2026-04-25T19:30:49Z	reg	750	750	reg	Add weight_decay=5e-4 to eval-TTT SGD (the only WD=0 optimizer in the pipeline) — clean retry of exp_649 crash (which failed at unrelated dataloader L371) at half strength.	-0.0003	size_blocked	1.072721		16000778	600.129000	533.100000	1434.000000	apg-reg-0808		Single-arg edit at line 1332: torch.optim.SGD(..., nesterov=True) → ..., nesterov=True, weight_decay=5e-4. +6 code bytes (23309→23315). Zero new params, zero structural change. Two prior TTT-WD attempts (exp_636 PREQUANT_TTT_WD=0.01 and exp_649 wd=1e-3) both crashed at train_gpt.py:371 in __init__ — that's the ShuffledSequenceLoader._reset_shard line, which runs BEFORE TTT SGD is constructed, so those crashes were infrastructure noise (flaky shard read), not WD-related. Fills the only remaining WD=0 spot in the optimizer ecosystem (Muon=0.095/0.115, Adam=0.005, embed=0.085, TTT=0). With ttt_lr cosine peak ~0.005 + momentum=0.9, effective per-step shrinkage lr*wd/(1-mom) ≈ 5e-6 → ~0.06% cumulative shrinkage per chunk → ~2% cumulative across 32 chunks. Anti-overfit anchor against SGD adaptation drift across TTT chunks.
818	2026-04-25T19:37:10Z	quant	750	750	quant	H-magnitude-proportional GPTQ damping: replace uniform H.diag.mul_(1.01) with H.diag.mul_(1 + 0.01 * H_ii / mean(H_ii)) so damping factor scales linearly with column importance — high-H 'sink' columns get up to ~1.05x ridge while low-H get ~1.001x, while AVERAGE multiplier stays at the kept 1.01 sweet spot. Continues the additive→multiplicative trajectory (exp_212→exp_280→exp_377) into a second-order H-proportional bias that no prior probe has touched.	-0.0001	size_blocked	1.072053		16000642	600.106000	533.000000	1432.000000	apg-quan-0811		Two-line edit at gptq_quantize_weight L1022-23 in current best (exp_750). Sweet-spot mean preserved at 1.01 → expected size-neutral. Motivation: exp_280 keep moved from flat-additive to multiplicative damping (-0.000054), which already biased damping toward high-H columns; this is the natural strengthening of that bias without changing the global damping budget that exp_809/477/387 (1.005) showed is at the lower compression edge.
819	2026-04-25T19:40:12Z	meta	750	750	meta	Per-group ADAM_EPS split: optimizer_tok (tied tok_emb) eps 1e-8→1e-7 only, optimizer_scalar unchanged at h.adam_eps=1e-8.	-0.0001	size_blocked	1.072611		16000432	600.085000	581.900000	1516.000000	apg-meta-0811		Single-literal change at L908 (eps=h.adam_eps → eps=1e-7) on optimizer_tok ONLY; optimizer_scalar at L926 still uses h.adam_eps=1e-8. Net code -4 bytes (23309→23305). Mechanism-distinct from exp_802 (which moved BOTH groups together to eps=1e-7, size_blocked at bpb=1.072196): tied tok_emb (8192 rows) sees sparse per-row gradients — rare-row v_t decays between hits to near-zero, so eps dominates the denominator and over-large effective LR spikes hit cold rows. eps=1e-7 caps that spike. optimizer_scalar (~100 dense control tensors) keeps eps=1e-8 because its v_t is well-populated every step and the sharp preconditioner is what tuned in. Per-group eps split is genuinely untouched: exp_802 (UP global) size_blocked, exp_426 (3e-8 UP global) discard +0.000515, exp_304/048/105 (DOWN global) all hurt or size_blocked, exp_810 (amsgrad on optimizer_tok only) discard +0.003538 — none of these probe per-group eps. Risk: low; isolated to AdamW kernel arg, no compile-graph or quant-path interaction. Expected: small (-0.00005 to -0.0002) — concentrating exp_802's noise-floor signal on the group where the mechanism actually applies; -4 byte code reduction also gives a hair more headroom against the cap that has been blocking recent meta probes.
820	2026-04-25T19:41:59Z	tok	750	750	tok	Port exp_711 (embed_scale ONLY on residual baseline x0; entry-x to block 0 plain unit-RMS) onto exp_750 best baseline.	-0.00014	size_blocked	1.072325		16001351	600.097000	584.100000	1520.000000	apg-tok-0810		Single-site forward edit in forward_logits: replaced `F.rms_norm(x * embed_scale, ...)` with `F.rms_norm(x, ...)` then `x0 = x * embed_scale` after embed_proj. Zero new params, structurally identical forward cost. exp_711 measured bpb 1.072075 on 596 parent (would have been keep, -0.000176 vs 596) but hit eval_budget_overrun; overrun is timing-noise on a zero-byte structural reorder. Stacking on 750 (opt momentum-warmdown decoupling) is orthogonal: 750 doesn't touch forward graph; 711 doesn't touch optimizer. embed_scale init=1.0 means initial x0 is bitwise identical to baseline.
821	2026-04-25T19:48:17Z	arch	750	750	arch	Mirror of kept exp_245's recurrence-aware ln_scale damping, applied to parallel-residual blocks: divide blocks 7-10 (parallel=True) ln_scale_factor by sqrt(2) since each parallel call adds 2 streams (attn+mlp) to residual vs 1 stream for sequential blocks. DeepNorm-style depth-balance for stream multiplicity.	-0.0002	size_blocked	1.073302		16000187	600.016000	580.700000	1514.000000	apg-arch-0814		Zero new params, byte-neutral structurally (only ~150B compressed comment bytes added). Mechanism mirror of exp_245 (Δ=-0.000272 keep). Composes multiplicatively with loop_scale if sets overlapped, but parallel_residual_start=7 vs loop_end=5 keeps them disjoint. Optimizer-side compensation via attn_scale/mlp_scale possible — exp_245 had same compensation path and still kept.
822	2026-04-25T19:52:03Z	curr	750	750	curr	Latin-square phase bucket count 8→6 (untested between failed 5 and kept 8): coupon-collector coverage across 13 shards/rank improves at 2.2 shards/bucket vs current 1.6, at the cost of slightly coarser phase granularity (341 vs 256 tokens).	+0.0005	size_blocked	1.073631		16005198	600.076000	585.100000	1525.000000	apg-curr-0815		Three single-char digit swaps in _reset_shard / __init__: permutation(8)→permutation(6), %8→%6, //8→//6. Byte-neutral (size_project 23309 unchanged). Probes the granularity gap between tested 5 (exp_345 discard) / 4 (exp_207 discard) DOWN-direction failures and 11/16 UP-direction failures, with kept 8. With 13 shards and only ~1 phase visit per shard in 600s budget, fewer buckets = better cross-shard phase coverage in expectation but coarser per-bucket positional resolution. Low confidence; clean parametric probe of an untested point.
823	2026-04-25T19:54:54Z	opt	750	750	opt	Polar Express per-iteration NS coefficients (PR #1787 / PR #1344): replace fixed (3.4445,-4.775,2.0315) tuple with 5 minimax-optimized (a,b,c) tuples, one per NS iteration at backend_steps=5. First-iteration coefficients (8.16,-22.48,15.88) act as expansion lens; subsequent tuples taper to convergence. Higher-quality polar factor at iso-cost.	-0.0004	discard	1.072485	+0.000275	15999275	600.128000	581.600000	1522.000000	apg-opt-0815		Code bytes 23318→23569 (+251); first structural opt change in our swarm — Muon NS coeffs have been untouched since seed. Untried in tree.tsv (grep 'polar\|PE_COEFFS' returned nothing). Risks: aggressive first-iteration coeffs may amplify bf16 quant noise on poorly-conditioned gradients; if val_bpb regresses, root cause is likely first-tuple instability rather than the schedule itself.
824	2026-04-25T19:55:05Z	eval	750	750	eval	"Raise TTT-param numel threshold 10000 to 200000, freezing K/V projections (c_k, c_v at 131,072 each) during TTT. Adapts only Q, output proj, MLP, and tok_emb — LoRA-style value-static adaptation focusing the ~4 SGD steps/chunk on attention-pattern (Q) and output channels.</hypothesis> <parameter name=""notes"">Single-literal threshold change, 2 occurrences, +15 code bytes. Theory: chunk-specific adaptation benefits the attention pattern and output projections more than K/V which encode stable per-token information. Untried in eval domain — exp_337/exp_782 froze entire looped blocks (size_blocked); exp_357/exp_698 froze whole tok_emb (discard); subset-by-projection-type at this granularity has not been probed. K and V at 131,072 are frozen; Q (262,144), proj (262,144), and MLP (1M each) continue adapting. Per-block frozen surface: ~25%.</parameter> </invoke>" -0.0003 size_blocked 1.072466  16001367 600.144000 586.200000 1527.000000 apg-eval-0816  
825	2026-04-25T19:59:58Z	loss	750	750	loss	Stack a dormant-by-default entropy-floor hinge on the TTT inner CE: 1e-4 * F.relu(1.0 - H(p)).mean() in addition to kept exp_596 z-loss. Activates only when post-update softmax entropy drops below 1 nat (chunk-overfit collapse), zero gradient on well-calibrated positions — mechanism-distinct from all ~20 prior z-loss / confidence-penalty / amax-logit variants on this axis.	-0.0002	discard	1.072266	+0.000056	15998897	600.052000	578.900000	1515.000000	apg-loss-0818		Add _ls = _lf.log_softmax(-1) then + 1e-4 * F.relu(1.0 + (_ls.exp()*_ls).sum(-1)).mean() after kept z-loss term at L1401. Entropy = -(p*log_p).sum(-1); hinge F.relu(1.0 - H) = F.relu(1.0 + (p*log_p).sum(-1)). H_min=1.0 nat is well below typical TTT-step entropy (~3-4 nat) so this is a sparse, asymmetric anti-collapse term, orthogonal to z-loss which constrains log-partition magnitude regardless of distribution shape. Prior entropy-bonus (exp_733) was unconditional and got +0.0005; hinge-z-loss (exp_722) thresholded log-partition not entropy. Code +49B (23309 to 23358), all-positive headroom locally; risk is artifact-side total still hitting cap given exp_596 449B float headroom.
