exp_id	timestamp	specialist	parent_exp	baseline_exp	domain	hypothesis	expected_delta	status	val_bpb	delta_vs_best	artifact_bytes	train_s	eval_s	total_s	job_name	snapshot_path	notes
182	2026-04-22T14:39:04Z	opt	164	177	opt	Raise AdamW beta2 0.95→0.98 for the tok_emb optimizer only (largest Adam-managed tensor, 4.2M params, Zipfian heavy-tailed grads under tied embeddings) — more stable second-moment denominator on rare-token directions; scalar/head groups keep 0.95.	-0.0003	discard	1.076203	+0.000345	15991861	600.032000	759.968000	1473.000000	apg-opt-0177		Two-site edit: (1) add Hyperparameters.tok_emb_beta2=0.98 near the Adam betas block (line ~161). (2) change optimizer_tok AdamW betas from (h.beta1, h.beta2) to (h.beta1, h.tok_emb_beta2). Motivation: under tie_embeddings the tok_emb matrix is the biggest Adam tensor and its gradient is heavy-tailed (token-frequency Zipfian). beta2=0.95 half-life ≈14 steps under-smooths v; 0.98 (half-life ≈35) gives more stable 1/sqrt(v) preconditioning for rare-token rows while common-token rows still drive magnitude. Orthogonal to all prior opt edits: exp_088 (momentum_warmup_frac), exp_010 (momentum cool), exp_002/043 (cosine WD), exp_163 (beta1 cool discard), exp_172 (muon_wd ramp discard). tok_emb's Adam betas have not been differentiated from scalar group in any prior trial. Zero parameter-count change, zero size impact — pure hyper tweak. Risk: on short (~200-step) runs beta2=0.98 may be too slow to adapt initially; justification is that tok_emb gets dense gradient every step (not sparse under tie_embeddings) so early adaptation isn't the bottleneck, variance is.
183	2026-04-22T14:40:48Z	quant	164	177	quant	Per-module GPTQ clip_sigmas: tighten attn matrices (c_q/c_k/c_v/attn.proj) to 12.0 while keeping MLP/other at 12.85. Captures the bpb win of exp_165 (size_blocked at global 12.0) while limiting the entropy hit to ~27% of matrix params so size stays under 16MB.	-0.0004	size_blocked	1.075490		16092416	600.148000	696.852000	1396.000000	apg-quan-0177		"exp_165 (global cs=12.0) and exp_175 (global cs=12.5) both produced raw bpb improvements (1.075267 / 1.075442) but tripped size_blocked. The bpb sensitivity to clip_sigmas is proven; the size cost scales with per-matrix entropy times matrix bytes. Attn matrices (512×512, 512×256 x4 per block) are ~27% of matrix params vs MLP's ~73%. Localizing the tighter clip to attention should: (1) cost <27% of exp_165's size overshoot, (2) retain per-param bpb gain since attn errors propagate through the residual stream more broadly than MLP errors. Single-site edit in gptq_mixed_quantize switching on "".attn."" in name. Expected Δ ≈ -0.0004: a fraction of exp_165's unobserved delta (would have been ~-0.0008 vs prior best)."
184	2026-04-22T14:48:39Z	meta	exp_177	177	meta	Restack exp_003's proven EMA_DECAY 0.9965→0.998 (-0.000776 keep) onto current best exp_177: the current chain (exp_000→005→010→088→…→177) never inherited exp_003's EMA widening since it branched through exp_005, so this reapplies a validated orthogonal averaging tweak atop the accumulated optimizer/loss/reg stack.	-0.0003	discard	1.077653	+0.001795	15994247	600.033000	749.967000	1459.000000	apg-meta-0178		Single-literal edit at train_gpt.py:174 (EMA_DECAY default 0.9965→0.998). Half-life shifts from ~198→~346 training steps, aligning the averaging window with more of the warmdown tail (WARMDOWN_FRACTION=0.58). exp_006 proved 0.999 is too aggressive (+0.008841), so 0.998 stays inside the validated sweet spot. EMA is the sole parameter averaging mechanism in the file (LAWA/SWA not active) so no interaction risk. Zero bytes, zero train/eval cost — just changes the per-step EMA accumulator coefficient.
185	2026-04-22T14:50:12Z	curr	164	177	curr	Per-sequence ±64-token start_ind jitter in ShuffledSequenceLoader._reset_shard decorrelates training windows from the strict phase+k*seq_len grid that persists in 600s runs (where _reset_shard only fires once per shard), matching eval's stride-64 sliding-window resolution without incurring exp_047's overlap penalty.	-0.00015	discard	1.076896	+0.001038	15990913	600.033000	770.967000	1487.000000	apg-curr-0177		Single-site edit in ShuffledSequenceLoader._reset_shard. Replaces rigid `phase + sequence_order * seq_len` grid with `base + jitter` where jitter ~ U{-64,...,64} per sequence, clipped to [0, num_tokens - seq_len - 1]. Worst-case consecutive-sequence overlap is ~128 tokens (~6%), vs exp_047's 50% stride halving that hurt +0.001. Insight: in a 600s run each shard only consumes ~40-80k of its ~50k-per-phase pool, so the Latin-square cycling (exp_142) rarely advances past the initial phase — every sequence sits on a fixed seq_len-step anchor. Jitter breaks that anchor, matching eval's stride-64 positional resolution. Start_inds list size is unchanged, so artifact-size delta is zero. Jitter draw is deterministic per (rank, seed) via self.rng.
186	2026-04-22T14:53:42Z	loss	176	177	loss	Replace exp_176's linear position-weighted CE with a convex (u^2) ramp: pw = 0.9 + 0.2*u^2 normalized to mean 1.0 — same ~0.2 peak-to-floor range, but concentrates more gradient mass on tail positions (matching stride-64 sliding-window eval) without the sharp-boundary failure mode that sank exp_167's sigmoid variant.	-0.0003	keep	1.075796	-0.000062	15993734	600.023000	764.977000	1473.000000	apg-loss-0177	snapshots/186_loss	Single-site edit in CausalDecoder.forward (train_gpt.py ~line 727-733). Replaces linspace(0.9, 1.1, T) with u=linspace(0,1,T); pw = 0.9 + 0.2*u*u; pw /= pw.mean(). Post-norm pw ranges [0.931, 1.138]; mean exactly 1.0 so LR schedule stays calibrated. exp_156/exp_176 linear ramp proves tail-tilting helps (-0.000200 / -0.000171). exp_167 (sigmoid, amp 0.3 on 3% of positions) lost +0.000467 — too sharp. This is the INTERMEDIATE shape: smooth across all positions but convex so the late 25% of positions carry ~38% of integrated tilt (vs 25% for pure linear). Zero params/bytes, one extra elementwise mul. First CURVATURE-based position reweighting (vs linear/sigmoid/focal/z-loss).
187	2026-04-22T14:58:44Z	reg	164	186	reg	Depth-targeted MLP Muon WD: loop-segment MLPs (layers 3-5, used 3x/forward) at muon_wd_mlp_recurrent=0.155, non-loop MLPs at 0.125	-0.0002	discard	1.075962	+0.000166	15992662	600.029000	748.971000	1458.000000	apg-reg-0177		Single-site edit in Optimizers.__init__; new hyperparameter muon_wd_mlp_recurrent=0.155 stacks exp_141 depth insight onto exp_164 MLP-type split
188	2026-04-22T15:02:18Z	arch	exp_177	186	arch	Swap Primer-style silu²(fc(x)) MLP for SwiGLU (silu(fc(x))*fc_up(x)), param-neutral via mlp_mult 4.0→2.625 (hidden 2048→1344, 3×512×1344=2.06M ≤ baseline 2×512×2048=2.10M per block, saves ~360K params).	-0.001	discard	1.083445	+0.007649	15852837	600.067000	749.933000	1469.000000	apg-arch-0182		"Two-edit change: (1) MLP class adds self.fc_up = CastedLinear(dim,hidden) and forward computes self.proj(F.silu(self.fc(x)) * self.fc_up(x)); (2) mlp_mult default 4.0→2.625 so hidden=1344 keeps MLP-matrix params roughly neutral (3×512×1344=2.064M vs 2×512×2048=2.097M per block, 11 blocks: saves ~360K params). Motivation: arch domain has been small-tweaked to local-min — XSA coverage, head split, resid_mix init, parallel_residual_start, rope_dims replay all failed recently. SwiGLU is a QUALITATIVE activation/topology change (gated vs non-gated) that's field-standard for LLaMA/Mistral/PaLM; exp_030 proposed SwiGLU but was harness_abort (never GPU-tested). Orthogonal init applies automatically to fc_up (both dims ≥64), and name `.mlp.fc_up.weight` routes to the Muon MLP group with muon_wd_mlp=0.125 via the existing `.mlp.` check. Expected +: gated conditional compute gives cleaner neuron-dropout behavior and potentially friendlier int6-quant distribution (gate learns ""on/off"" rather than magnitude blend). Expected -: Primer silu² was specifically designed for small-scale models and is competitive here; changing gradient dynamics mid-optimized-stack may destabilize late-QAT. Net expected_delta -0.001."
189	2026-04-22T15:05:01Z	ttt	177	186	ttt	Freeze scalar/norm parameters (p.ndim<=1: ln_scale, qk_gain, skip_gates, skip_weights) during TTT — matrices still adapt fully but the ~30K sensitive scalar params (in exp_177's ADAM_WD=0.005 group) are held fixed to avoid chunk-local over-calibration from SGD+Nesterov over ~60 steps.	-0.0002	discard	1.075927	+0.000131	15994489	600.112000	751.888000	1463.000000	apg-ttt-0183		Single-site edit in eval_val_ttt param setup (~line 1264). Replaces `ttt_params = [all params]; set all requires_grad=True` with `ttt_params = [ndim>=2]; set requires_grad = (ndim>=2)`. The scalar params are the same ones meta-exp_177 identified as needing 4x lower weight decay during training — consistent signal that they're sensitive. TTT's fixed-LR SGD has no WD schedule to protect them. Inverse of exp_049 which froze 2D tok_emb (discarded with Δ=+0.000223): freezing complement (1D only) is a structurally different question. Zero new params. End-of-fn `requires_grad_(True)` restore loop unchanged — clean rollback to training state. If scalars genuinely need TTT adaptation, expect ~+0.0001 discard; if they drift-hurt, expect ~-0.0002 keep.
190	2026-04-22T15:05:21Z	tok	177	186	tok	Add a learnable per-feature gamma vector (embed_scale, shape=[512], init=1.0) applied right after the input-embed RMSNorm, decoupling per-feature entry magnitudes from the tied tok_emb row statistics that are shared with the logit projection.	-0.0005	keep	1.075333	-0.000463	15992859	600.041000	702.959000	1402.000000	apg-tok-0183	snapshots/190_tok	Three-site edit on exp_177 baseline: (1) new nn.Parameter torch.ones(embedding_dim) in GPT.__init__ right after tok_emb; (2) forward_logits multiplies F.rms_norm(tok_emb(x)) by embed_scale.to(x.dtype) before embed_proj; (3) Optimizers.__init__ appends base_model.embed_scale to scalar_params so it lives in the scalar AdamW group (same LR/WD as skip_weights/skip_gates/qk_gain). Motivation: the input RMSNorm strips per-token magnitude info and the tied tok_emb's row norms are jointly optimized for input AND output paths; a diagonal per-feature gain on the input side lets the model re-weight features entering the first block independently of logit-projection row norms. 512 fp32 params → passthrough float16 in the quantized artifact (numel<<65536), compresses to ~1KB under brotli-11; negligible size impact. Zero effect on GPTQ Hessians, byte-shuffle, TTT, or sliding-window eval paths. Compatible with torch.compile (standard broadcast mul). Risk: could interact with ln_scale_factor=1/sqrt(L+1) in early blocks or shift the warmdown's effective LR-scaling balance; if embed_scale collapses toward zero the network still works (effective peak-LR on scalar group is high enough to recover). Not tried before in tok branch: prior tok trials targeted init distribution (std, sphere, trunc_normal, L2-cap) and TTT-specific freezing — none added a dedicated learnable input-scale parameter.
191	2026-04-22T15:13:40Z	opt	177	190	opt	"Shrink muon_momentum_warmup_fraction 0.22→0.16: continues exp_088's proven ""faster momentum ramp"" direction (kept, -0.001115). With warmdown beginning at frac=0.28, this doubles the at-peak-momentum plateau from 6% (0.22→0.28) to 12% (0.16→0.28) of the 600s budget, giving Muon more full-0.99-momentum convergence while LR is still at peak before exp_010's cosine cool-down kicks in during warmdown."	-0.0003	discard	1.075885	+0.000552	15992235	600.065000	752.935000	1462.000000	apg-opt-0184		Single-literal edit at line 157: MUON_MOMENTUM_WARMUP_FRACTION default 0.22→0.16. Zero-parameter, zero-byte. Orthogonal to all other kept changes (exp_010 cosine-cool momentum during warmdown, exp_088 shrunk fraction, exp_177 adam_wd reduction). With WARMUP_STEPS=20 → ~1s of fixed-step LR warmup, LR reaches peak long before frac=0.16 (~96s), so no early-training instability risk. Effective schedule: momentum linearly ramps 0.92→0.99 across frac 0→0.16, plateaus at 0.99 during frac 0.16→0.28, then cosine-cools 0.99→0.92 in lockstep with lr_scale during frac 0.28→1.0.
192	2026-04-22T15:15:26Z	quant	177	190	quant	Shrink GPTQ block_size 64 to 32 in gptq_quantize_weight: doubles Hessian-compensated error-propagation events per matrix, continuing exp_108's kept 128-to-64 trend. Size-neutral (identical Q codes and fp16 scales).	-0.0004	discard	1.075979	+0.000646	15993191	600.074000	756.926000	1467.000000	apg-quan-0184		Quant subtree has one keep (exp_108, 128 to 64, -0.000079) and a wall of size_blocked clip-tightening attempts (exp_165/175/183). Smaller block_size is size-neutral: output format (int8 Q, fp16 per-row scales) unchanged. exp_035 tried 64 to 32 but harness-aborted without a metric. Parent exp_177 freshly rebased.
193	2026-04-22T15:18:23Z	eval	177	190	eval	Raise TTT cosine LR floor from 0 to 0.1×ttt_lr: late chunks (last ~20% where cos≈-1→0) currently receive effectively-zero TTT updates, starving later-chunk scoring. The new curve decays from 1.0 at ci=0 to 0.1 at ci=N-1, keeping a gentle drip of adaptation through the tail.	-0.0002	discard	1.075752	+0.000419	15990286	600.045000	755.955000	1465.000000	apg-eval-0183		Single-line edit in eval_val_ttt (~line 1316). Previous cosine: ttt_lr*0.5*(1+cos(pi*ci/(N-1))) → maps ci=0→ttt_lr, ci=N-1→0. New curve: ttt_lr*(0.1 + 0.45*(1+cos(...))) → ci=0→ttt_lr, ci=N-1→0.1*ttt_lr. TTT momentum 0.9 + Nesterov (exp_151 kept) means residual adaptation accumulates; previous zero-LR tail wasted that momentum. Untried: prior eval trials explored ttt epochs, LR, grad clip, stride — but NOT the cosine floor. Zero compute cost (same SGD step count, just nonzero LR on the late few). Risk: over-fitting drift on late chunks; mitigated by the small 0.1× floor and the existing per-step grad clip 1.0.
194	2026-04-22T15:23:33Z	meta	177	190	meta	Raise scalar_lr 0.02 to 0.03 on scalar-params AdamW group (ln_scale, qk_gain, skip_gates, skip_weights).	-0.0003	discard	1.079175	+0.003842	15994797	600.068000	753.932000	1462.000000	apg-meta-0187		Single-literal edit at train_gpt.py:149. Follows exp_177 adam_wd reduction; per-group LRs have never been tuned.
195	2026-04-22T15:28:01Z	loss	186	190	loss	Extend exp_186's winning position-weighted-CE trend (linear → u² → u⁴): replace pw = 0.9 + 0.2·u² with pw = 0.9 + 0.2·u⁴ (mean-preserving), concentrating more gradient mass in the last ~25% of positions aligned with the stride-64 eval zone.	-0.00015	discard	1.075940	+0.000607	15993837	600.074000	776.926000	1486.000000	apg-loss-0187		Single-site edit in CausalDecoder.forward. Raw pw range unchanged (0.9→1.1, same as exp_156/176/186). After mean-norm (mean=0.940), pw ∈ [0.957, 1.170] vs exp_186's [0.931, 1.138]: HIGHER floor (less head suppression) and HIGHER peak (more tail emphasis). u⁴ remains smooth (no sharp transition like exp_167's sigmoid). The last 25% of positions carry ~59% of the integrated tilt (vs 38% for u², 25% for linear), better targeting eval-scored positions [1984, 2047]. Adds one elementwise square vs exp_186. Zero-byte, zero-param, zero inference cost.
196	2026-04-22T15:28:34Z	curr	177	190	curr	Stratified per-batch shard sampling in ShuffledSequenceLoader.next_batch (largest-remainder method): replace multinomial rng.choice(p=remaining/total) with a deterministic quota assignment per batch — floor(B*remaining_s/total) per shard, leftover slots to largest-fractional-part shards. Caps within-batch shard-count variance from multinomial std≈1.9 (B=48,K=12) to ≤1, tightening the gradient estimator when FineWeb shards have distinct crawl-batch content distributions. Time-averaged shard coverage unchanged.	-0.0003	keep	1.075246	-0.000087	15993891	600.029000	693.971000	1392.000000	apg-curr-0187	snapshots/196_curr	Single-site edit in ShuffledSequenceLoader.next_batch. Orthogonal to exp_142 (which fixed the phase/position axis via Latin-square phase cycling) — this fixes the shard-selection axis. Unlike exp_185 (±64 jitter) and exp_047 (stride halving), this does NOT break the per-shard Latin-square grid; each sequence still lives on phase+k*seq_len anchors. Only the inter-batch shard assignment changes, from multinomial to stratified. rng stream is preserved (self.rng.shuffle of the quota plan) so seed determinism is maintained. Falls back cleanly if a shard quota exceeds its remaining start_inds (mid-batch reset path, rare in a single 600s run).
197	2026-04-22T15:33:20Z	arch	186	196	arch	Extend parallel residual into the looped block: parallel_residual_start 7→3 makes layers 3-10 GPT-J-parallel (attn+MLP both read x_in), removing the arbitrary attn→MLP order bias that sequential residual bakes into each of the 3 re-invocations of the shared loop block (layers 3-5).	-0.0004	discard	1.087216	+0.011970	15851461	600.145000	738.855000	1450.000000	apg-arch-0191		Single-literal change to Hyperparameters.parallel_residual_start (line 140) from 7 to 3. No param count change. Un-tried middle-ground: exp_059 (→11 all-sequential) harness_aborted, exp_107 (→0 all-parallel) size_blocked, exp_134 (→9 fewer parallel) discarded +0.000945. 7→3 targets only the loop span (3-5) plus existing decoder, keeping encoder pre-loop (0-2) sequential for initial feature-extraction refinement. Size-blocking risk exists but is milder than exp_107 (8 parallel vs 11).
198	2026-04-22T15:38:50Z	reg	186	196	reg	Post-embed Gaussian noise (σ=0.02) on the main stream during training only — x0 residual injection stays clean so noise doesn't propagate permanently; disabled during TTT to keep its ~16 SGD steps/chunk deterministic. Structurally orthogonal to every Muon-WD-split trial (exp_141/164/187) and distinct from exp_040's catastrophic MLP activation dropout because it regularizes input features, not signal-path activations.	-0.0008	discard	1.075691	+0.000445	15994684	600.150000	767.850000	1478.000000	apg-reg-0191		Three-site edit: (1) Hyperparameters.embed_noise_std=0.02 (line ~184). (2) GPT.__init__ stores self.embed_noise_std=h.embed_noise_std. (3) forward_logits adds `x = x + std*randn_like(x)` guarded by `self.training and std>0`, placed AFTER x0 is copied so x0 stays clean. (4) eval_val_ttt zeros base_model.embed_noise_std at start so TTT's base_model.train() call doesn't re-enable noise during SGD adaptation. Zero added params, zero inference cost (guard false under eval()). Sigma 0.02 = 2% of unit-RMS features — mild, well below exp_040's catastrophic p=0.05 MLP dropout; input-noise regularizes gradient variance rather than zeroing signal.
199	2026-04-22T15:40:28Z	tok	190	196	tok	Add a symmetric learnable per-feature head_scale (shape=[512], init=1.0) applied to x right before the tied F.linear(x, tok_emb.weight) projection — mirrors exp_190's embed_scale on the output side and decouples output logit weighting from input embed weighting (both paths use the same tied tok_emb matrix).	-0.00030	discard	1.077814	+0.002568	15974713	600.055000	757.945000	1470.000000	apg-tok-0191		Three-site edit on exp_190 (current best): (1) new nn.Parameter torch.ones(embedding_dim) declared right after self.embed_scale in GPT.__init__; (2) forward_logits multiplies x by self.head_scale.to(x.dtype) between final_norm/head_proj and the tied F.linear call; (3) scalar_params list in Optimizers.__init__ appends base_model.head_scale alongside embed_scale, so both get AdamW scalar LR+WD. Rationale: tok_emb serves double-duty as input embedding and as the classifier matrix. exp_190's embed_scale decoupled input-side per-feature weighting; the output side still has no per-feature gain between final_norm and the tied linear. head_scale cannot be absorbed into tok_emb because rescaling tok_emb columns would corrupt the input path. 512 fp32 scalars (~2 KB raw, passthrough fp16 in quantized artifact, numel<<65536 — no size hit). init=1.0 preserves current behavior at step 0; stability should match embed_scale's trajectory.
200	2026-04-22T15:43:31Z	opt	190	196	opt	Delay Muon momentum cool-down to the last half of warmdown: hold peak momentum 0.99 for lr_scale∈[0.5, 1.0], then cool 0.99→0.92 as lr_scale goes 0.5→0 (cool_factor = min(1.0, 2.0 * lr_scale)); peak-momentum time grows from 28% to 64% of budget.	-0.0003	discard	1.075849	+0.000603	15998372	600.093000	751.907000	1462.000000	apg-opt-0193		Single-site edit at step_fn ~line 1429. exp_010 kept linear cool in lockstep with LR (-0.000109). This preserves exp_010's endpoint behavior (momentum=0.92 at end) but delays cool-down onset: the cool now occurs only across the last half of warmdown (last 36% of the run, where LR is already below 0.5×peak). Rationale: Muon's peak-momentum smoothing gives the largest exploration/signal-to-noise benefit while LR is still meaningful; early warmdown (lr_scale 1.0→0.5) has significant residual learning that benefits from high momentum. Cool-to-settle is only genuinely needed at the very end. Zero params, zero bytes, orthogonal to exp_088's ramp-up fraction and exp_010's linear-cool shape (this keeps the endpoints but bends the shape).
201	2026-04-22T15:48:34Z	quant	190	196	quant	Replace uniform per-row std with Hessian-diagonal-weighted per-row RMS when setting GPTQ clip scale: rows whose weight mass sits on high-activation-variance columns get proportionally tighter scales, size-neutral.	-0.0003	size_blocked	1.075951		16138864	600.028000	756.972000	1465.000000	apg-quan-0194		Single-site edit in gptq_quantize_weight. Swaps unweighted per-row std for Hessian-diag-weighted RMS. Size-neutral; per-row fp16 scale count and int6 code shape unchanged. Orthogonal to exp_108 block_size=64 and exp_190 embed_scale.
