exp_id	timestamp	specialist	parent_exp	baseline_exp	domain	hypothesis	expected_delta	status	val_bpb	delta_vs_best	artifact_bytes	train_s	eval_s	total_s	job_name	snapshot_path	notes
466	2026-04-23T07:01:28Z	tok	377	377	tok	Column-equi-std post-init of tied tok_emb.weight: after nn.init.normal_, rescale each of D=512 feature-dim columns to have EXACTLY std=tied_embed_init_std, eliminating the ~0.8% finite-sample per-column variance asymmetry that RMSNorm (feature-global-per-token) cannot correct — orthogonal axis to discarded row-space init variants (exp_019 equi-row-norm, exp_179 row-L2 cap).	-0.0002	discard	1.075080	+0.000993	15999681	600.416000	568.800000	1469.000000	apg-tok-0457		"Single-site post-init edit in GPT._init_weights, right after nn.init.normal_(tok_emb.weight, std=tied_embed_init_std). Computes col_std = tok_emb.weight.std(dim=0, unbiased=False, keepdim=True).clamp_min(1e-12) then scales weight by tied_embed_init_std / col_std (under no_grad). Effect: each of the 512 feature-dim columns starts with EXACTLY variance=std^2, removing the ~sqrt(1/(2V))≈0.8% CV in column stds from the naive normal_ draw. Zero learnable params added, zero state_dict change, zero model bytes; preserves all downstream machinery (embed_scale is per-feature learnable init=1.0, ScaledRMSNorm, GPTQ embed_bits=8 tok_emb path). Orthogonal to row-space init variants — exp_019 (equi-row-norm, discard Δ=+0.001603), exp_179 (soft row-L2 cap on outlier ~5%, discard +0.000154), exp_158 (Zipf row-mag, discard +0.001793), exp_350 (semi-orthogonal row init, discard +0.001544), exp_389 (orthogonal, discard +0.001719). All prior attempts acted on rows; column-space per-feature variance equalization is untested. Motivation: post-tok_emb rms_norm normalizes globally across feature dims per-token but CANNOT remove the finite-sample per-feature std imbalance across tokens; pre-equalizing removes a small init-time asymmetry in what each input feature ""sees"" before the trunk's first learnable per-feature weighting (embed_scale). Expected magnitude small (~0.8% per-column imbalance at init, fading quickly as weights train) but directionally negative for val_bpb by reducing gradient noise in the first ~100 steps. Expected Δ ≈ -0.0002 with wide uncertainty; downside ~+0.0002. Preflight: syntax_check ok, size_project code_bytes=24954 (+~700 from baseline, well within budget)."
467	2026-04-23T07:19:07Z	loss	377	377	loss	Re-add exp_156's proven gentle linear position-weighted CE (linspace 0.9 to 1.1) onto exp_377 which dropped PW-CE via stale rebase.	-0.00015	discard	1.074639	+0.000552	15999785	600.127000	566.300000	1465.000000	apg-loss-0461		
468	2026-04-23T07:20:58Z	quant	377	377	quant	Tempered Hessian-weighted row scale with exponent alpha=0.5 (sqrt of H_diag): interpolates between uniform W.std (current best exp_377) and full H-weighting (exp_450, bpb=1.073985 but size_blocked). Sqrt compresses H-range so per-row scale variance drops, cutting brotli entropy cost while preserving relative-importance ordering.	-0.00005	size_blocked	1.074477		16016634	600.067000	580.300000	1482.000000	apg-quan-0462		Surgical edit in gptq_quantize_weight: replaces `row_std = W_orig.std(dim=1)` with H-weighted row rms where H-weights are H.diag().sqrt() instead of full H.diag(). exp_450 proved H-weighting gains -0.000102 bpb but adds ~350 KB brotli entropy. Mean-rescale (exp_458) didn't save bytes — shape matters, not magnitude. Sqrt tempering compresses a 100x H-dynamic-range to 10x, so per-row scale SHAPE is more uniform. Expected outcome: partial bpb gain from exp_450 with size staying under 16 MB.
469	2026-04-23T07:24:36Z	eval	377	377	eval	Position-weighted TTT training CE (linspace(0.5, 1.5, seq_len), mean-preserving): aligns per-chunk SGD adaptation gradient with the sliding-window scoring regime, which evaluates only the last eval_stride positions per window (all with ≥1984 tokens of context). With only ~4 SGD steps per chunk, shifting gradient direction to emphasize late-position predictions matches the scored objective.	-0.0002	size_blocked	1.074316		16002917	600.036000	569.300000	1464.000000	apg-eval-0464		Inside eval_val_ttt (SGD-over-chunks adaptation only; scoring loop unchanged). Replace `loss = base_model(x, y)` with explicit per-position CE, weighted by a precomputed torch.linspace(0.5, 1.5, seq_len). Mean of linspace(0.5, 1.5) = 1.0 exactly, so expected gradient magnitude is unchanged vs baseline; only direction shifts toward late-position next-token prediction. ttt_pos_weights precomputed once before chunk loop. scoring loop (torch.no_grad() path) NOT touched — legality preserved. +260 code bytes (24563→24823) out of ~180KB headroom. Probe amplitude (3:1 late:early) is larger than exp_156's training-CE keep (1.22:1 via linspace(0.9,1.1)) because TTT scoring is narrower (last stride positions only) than sliding-window training-scoring overlap. Rebased from exp_377 to restore clean TTT_LR=0.005 baseline.
470	2026-04-23T07:24:40Z	meta	377	377	meta	Lower embed_wd 0.085 to 0.080 gentle DOWN probe on tied tok_emb AdamW WD	-0.0001	size_blocked	1.074599		16004509	600.134000	578.900000	1480.000000	apg-meta-0464		Single-literal edit at line 173 (EMBED_WD default 0.085 to 0.080). Prior DOWN probe exp_041 at -18% size_blocked with no signal; UP probe exp_069 at +30% discarded +0.003. Gentle -5.9% is 3x smaller than exp_041 to stay under size cliff. Tok_emb is int8-quantized so magnitude growth has sub-linear brotli impact.
471	2026-04-23T07:27:34Z	opt	377	377	opt	Tighter tok_emb LR floor at 0.08 (vs exp_420's 0.15 size_blocked at bpb=1.074286): floors only the AdamW-tok group's LR scale during the deepest ~5.8% of training (lr_scale<0.08), letting rare-token embedding rows keep refining while Muon/scalar/head fully decay. 3x less embedding drift than exp_420 so targets staying within the int8+brotli byte cap.	-0.0001	discard	1.074254	+0.000167	15999083	600.117000	569.200000	1464.000000	apg-opt-0467		Single-site edit in step_fn right after the uniform lr_scale loop: compute tok_lr_scale = max(lr_scale, 0.08) and override optimizers.optimizer_tok.param_groups[*].lr. tok_min_lr_scale literal 0.08 is narrower than exp_420's 0.15 so fewer tail steps see the floor AND the capped tied_embed_lr in the floor phase is 0.0024 (vs 0.0045 in exp_420). No param-count change, no architectural change, no momentum/clip/schedule interactions. If this still size_blocks, the next probe is an even tighter 0.05 or removing the floor for lr_scale<=0.04.
472	2026-04-23T07:29:10Z	ttt	377	377	ttt	Cool TTT SGD momentum in lockstep with cosine LR schedule	-0.00015	discard	1.074678	+0.000591	15999229	600.054000	575.200000	1474.000000	apg-ttt-0467		eval_val_ttt momentum cooling
473	2026-04-23T07:30:47Z	reg	377	377	reg	Encoder-vs-decoder MLP Muon WD split: decoder MLPs (blocks 5-10) get muon_wd_mlp_dec=0.125 (+8.7%), encoder MLPs (blocks 0-4) stay at 0.115 — novel axis orthogonal to prior type (exp_164) and loop-vs-non-loop (exp_346) splits.	-0.0001	discard	1.074264	+0.000177	15999971	600.133000	575.400000	1473.000000	apg-reg-0467		Three-site edit in Optimizers.__init__ (and one new Hyperparameter). (1) Line ~173: new muon_wd_mlp_dec=0.125. (2) Optimizers.__init__: split matrix_mlp_params into encoder/decoder lists keyed by int(name.split('.',1)[0]) vs n_enc=base_model.num_encoder_layers (=h.num_layers//2=5). (3) Add 3rd Muon group for decoder MLPs. Rationale: decoder blocks read skip connections from the encoder (extra effective input capacity) and sit closer to the output head, so a modest +8.7% WD biases the higher-capacity half toward tighter norms. Distinct from exp_164 depth (loop-vs-non-loop) because encoder vs decoder includes non-loop block 6-10 as the targeted half, not block 3-5. Also distinct from exp_141 recurrence (targeted 3-5 only). Zero new crash surface — same Muon multi-group semantics already in use. +7 code lines only; size should stay <16MB comfortably.
474	2026-04-23T07:30:58Z	curr	377	377	curr	Block-shuffled within-shard sequence order (B=8): replace rng.permutation(num_sequences) with per-8-block shuffle, blocks kept in natural order. Untried axis — exp_047 probed stride, exp_456/464 probed phase; no prior trial touched the within-shard permutation structure.	-0.0003	discard	1.077370	+0.003283	15999224	600.043000	576.600000	1474.000000	apg-curr-0467		Single-site edit in ShuffledSequenceLoader._reset_shard (~L379-381). Replaces full random permutation with block-B=8 shuffle: sequence_order = arange(n), shuffle within non-overlapping blocks of 8. Preserves macro shard-position ordering (possible FineWeb crawl-date locality) while still breaking micro-level patterns. start_inds.pop() consumes tail-first, so last-block-first consumption under LR warmdown — if any shard content drift exists, imposes a soft curriculum. If FineWeb shards have no locality, this is a null-op in expectation. Phase scheme (Latin-square per-shard 8-bucket) and stratified largest-remainder shard sampling unchanged.
475	2026-04-23T07:31:52Z	arch	377	377	arch	"Bifurcated q_gain [num_heads, 2]: one scalar per head for RoPE region (first rope_dims=16 of head_dim), separate scalar per head for NoPE region (remaining 48 dims). Cheap structural variant of size_blocked exp_465's [H, D] (88 vs 504 params/layer). Partial-RoPE assigns positional-phase vs content-key roles to these two regions; scalar q_gain forces identical sharpening across both — splitting breaks that tie.</hypothesis> <parameter name=""notes"">Two-site edit in CausalSelfAttention: (1) line 526: q_gain shape (num_heads,) → (num_heads, 2), same init qk_gain_init. (2) forward() line 551: replace single broadcast mul with split(rope_dims)/mul/cat — RoPE dims scaled by gain[:,0], NoPE dims by gain[:,1]. Step-0 identical to baseline (both cols init 5.25). Extra params: 11 blocks × 8 heads × 1 = 88 fp32/layer = 968 total (~4 KB raw, fp16 passthrough via CONTROL_TENSOR_NAME_PATTERNS → expected <1 KB packed after brotli on near-uniform init). Exp_465's full [H, D] was only ~6× more params and size_blocked at 1.074286 (close to best) — structural idea validated; this is the byte-efficient port." -0.0003 keep 1.074021 -0.000066 15998390 600.015000 590.800000 1495.000000 apg-arch-0467 snapshots/475_arch 
476	2026-04-23T07:41:17Z	tok	377	475	tok	Feature-level F.dropout(p=0.02) on tok_emb output during training only, applied between the embedding lookup and the post-lookup RMSNorm (gauge-fix site): regularizes the INPUT use of the tied-embedding matrix (sparse lookup, more overfit-prone than the dense tied readout) without perturbing the output-tied gradient path. p=0.02 is 2.5x gentler than exp_040's failed MLP-hidden p=0.05 and at a structurally upstream site. Zero params, zero bytes.	-0.0003	size_blocked	1.076035		16002101	600.094000	574.300000	1470.000000	apg-tok-0467		Two-line edit in GPT.forward_logits (after `x = self.tok_emb(input_ids)`, before the gauge-fix RMSNorm): `if self.training: x = F.dropout(x, p=0.02)`. Gate via self.training so TTT (inference_mode) and eval see 100% of features. Rescaling (×1/0.98) handled by F.dropout automatically. Dropout applied pre-RMSNorm so zeros propagate to x0 (anchor) and block[0], then get normalized. Tied lm_head uses x_final (post-trunk), never sees this mask — tied matrix still gets clean output-gradient. Novelty: input-embedding-output dropout has not been probed in tree — exp_040 was MLP-hidden dropout (p=0.05, discard +0.009791), exp_012 was token-id noise (size_blocked). Mechanism: breaks co-adaptation of feature combinations flowing from sparse embedding lookup into trunk, at low enough rate not to materially perturb EMA/LAWA averages. Risk: stochasticity may slightly shift final weight entropy, nudging compressed size (no new params — ~180KB headroom should absorb drift).
477	2026-04-23T07:49:42Z	quant	exp_377	475	quant	Lower GPTQ multiplicative Hessian damping 1.01 → 1.005 (−50% damping strength): continuation of the kept DOWN trajectory 1.02 (exp_280 keep) → 1.01 (exp_377 keep).	-0.00004	size_blocked	1.074467		16000564	600.109000	572.800000	1471.000000	apg-quan-0469		Single-line edit in gptq_quantize_weight: H.diagonal().mul_(1.01) → H.diagonal().mul_(1.005). Same shape of s / Q as exp_377 (uniform W.std row scale, block_size=32, matrix_clip_sigmas=12.85 int6, embed_clip_sigmas=20.0 int8). No size risk since scale tensor layout is byte-identical. Risk: Cholesky could choke if some H is borderline singular at 0.5% ridge; H is E[x x^T] over 64 calibration batches × 2048 T ≈ 130k samples per layer, so diag entries are strongly positive for non-dead cols — expect Cholesky to succeed. Expected tiny improvement if the DOWN trajectory still has slope; flat or regression means the axis is saturated.
478	2026-04-23T07:50:07Z	loss	377	475	loss	Multi-Token Prediction auxiliary CE (α=0.05): add a small-weight CE term on target[t+1] (two-steps-ahead token) alongside the standard next-token CE, forcing the rep at t to encode near-future signal. Training-only, same tied head, zero new params.	-0.0004	size_blocked	1.088749		16006005	600.112000	572.700000	1478.000000	apg-loss-0469		"Single-site edit in GPT.forward (L779-783). Splits the single F.cross_entropy into main_loss (target[t]) + 0.05 * aux_loss (target[t+1], from logits[:, :-1]). Auxiliary uses the same tied lm_head so zero bytes added to artifact and zero new parameters. Gloeckle et al. 2024 ""Better & Faster Large Language Models via Multi-token Prediction"" showed MTP improves small models, especially on reasoning/compression — exactly the regime here (35.9M params, 8192 vocab, high-compression eval). Orthogonal to all prior loss-domain experiments: exp_009 z-loss, exp_042 label-smoothing tweak, exp_156/176/186/467 position-weighting. The N=1 offset with α=0.05 is a conservative probe; if beneficial, α and offset can be tuned in follow-ups. Main risk: the aux gradient asks logits[t] to assign probability to BOTH target[t+1] and target[t+2], which may blur next-token accuracy; 0.05 weight keeps this small. Logit_softcap already applied inside forward_logits, so both terms see the same capped logits."
479	2026-04-23T07:54:01Z	meta	377	475	meta	Lower adam_wd 0.005→0.002 (2.5× further DOWN) on scalar-params AdamW group — direct continuation of exp_177's proven DOWN direction (0.02→0.005, Δ=−0.000038).	-0.00004	size_blocked	1.074650		16002260	600.011000	577.400000	1480.000000	apg-meta-0472		Single-literal edit at train_gpt.py:165 (ADAM_WD default 0.005→0.002). Scalar AdamW group holds ln_scale (init=1.0), q_gain (init=5.25), skip_weights/gates, embed_scale, and all CONTROL_TENSOR_NAME_PATTERNS (attn_scale, mlp_scale, resid_mix) — hundreds of fp32 scalars with naturally small gradient variance. exp_177 argued 0.02→0.005 reduced over-regularization of small-magnitude late-training drift. Going further to 0.002 tests whether the WD-DOWN curvature extends. Size-neutral: scalar params are fp16-passthrough and don't participate in GPTQ (only matrices are quantized), so compressed artifact bytes are unchanged. Expected Δ roughly matches exp_177's magnitude (~−4e-5); could be null if 0.005 was already near-optimal on this axis. Risk: if too low, qk_gain/ln_scale may drift toward instability, but this manifests as small positive Δ rather than crash.
480	2026-04-23T07:58:14Z	ttt	377	475	ttt	Per-chunk Nesterov momentum-buffer reset in eval_val_ttt: zero state['momentum_buffer'] for all TTT params at each chunk boundary so inherited stale direction from early high-LR chunks on different-distribution data doesn't leak into late low-LR chunks; keeps proven within-chunk μ=0.9 Nesterov smoothing (exp_151) while discarding inter-chunk carry-over (orthogonal lever from exp_472's gradual μ cooling 0.9→0.5, which discarded).	-0.0003	size_blocked	1.074829		16000519	600.021000	586.800000	1494.000000	apg-ttt-0476		Single-site insertion in eval_val_ttt (~L1393) right after the cos_lr param-group update and before the intra-chunk SGD loop. For each p in ttt_params, if optimizer.state[p] has a non-None 'momentum_buffer' tensor, call .zero_() in-place. Chunk 0 has empty state (first pass), so the guards handle init. Cost: O(num_params * num_chunks) zero_() ops — negligible (~ms). No model-bytes change, eval-only edit. Rationale: cos_lr decays monotonically 1.0→0.0 across chunks; persistent momentum from high-LR early chunks is stale when applied to low-LR late chunks on different text. Nesterov look-ahead uses the buffer directly so staleness is amplified. Expected: modest win via cleaner per-chunk LR respect.
481	2026-04-23T07:58:18Z	opt	377	475	opt	Raise peak Muon momentum 0.99 to 0.992: untried PEAK momentum axis	-0.0002	discard	1.074416	+0.000395	15998160	600.135000	586.100000	1481.000000	apg-opt-0476		Single-literal edit line 150 MUON_MOMENTUM 0.99 to 0.992. Rebased to exp_377. Cool-blend logic intact.
482	2026-04-23T07:58:29Z	eval	377	475	eval	Floor TTT cosine LR at 0.1×ttt_lr instead of decaying to 0 (mirrors exp_324's Muon-momentum warmdown-floor win on opt side): keeps late chunks doing small-LR adaptation so the last ~20% of chunks still contribute gradient before scoring their successors.	-0.0002	discard	1.074559	+0.000538	15998455	600.149000	567.300000	1457.000000	apg-eval-0476		Single-site edit in eval_val_ttt (~L1396). Replaces `cos_lr = h.ttt_lr * 0.5 * (1 + cos(pi*ci/(N-1)))` with floored form `cos_frac = 0.5*(1+cos(...)); cos_lr = h.ttt_lr * (0.1 + 0.9*cos_frac)` — range [0.1, 1.0] × ttt_lr. Orthogonal to exp_463's shape-change (discard) and exp_039's flat-momentum bump (discard). Precedent: exp_324 proved schedule-floor tricks work (momentum floor 0.9375 vs decay-to-0.92).
483	2026-04-23T08:01:19Z	reg	377	475	reg	Intra-MLP Muon WD split: mlp.fc stays at muon_wd_mlp=0.115 (feature-creating, silu²-squashed), mlp.proj drops to muon_wd_mlp_proj=0.095 to match attn's WD — structural parity between the two zero-init residual-writers (attn.proj + mlp.proj) while preserving firm WD on the feature-creating path.	-0.00010	size_blocked	1.074832		16001928	600.087000	570.800000	1469.000000	apg-reg-0476		"Three-site edit in Optimizers.__init__. (1) Line ~173 adds Hyperparameter muon_wd_mlp_proj=0.095 (matches attn muon_wd baseline). (2) In the param-bucketing loop, "".mlp.proj."" goes to a new matrix_mlp_proj_params list; "".mlp.fc."" (and anything else under .mlp.) stays in matrix_mlp_params. (3) Muon group list gains a third group keyed on muon_wd_mlp_proj. Motivation: mlp.proj is zero-init (CastedLinear._zero_init=True), writes directly to residual stream, structurally analogous to attn.proj (also zero-init, residual-writer). attn.proj runs at muon_wd=0.095 under the current best; matching mlp.proj to that baseline while keeping mlp.fc firm aligns shrinkage with the actual role each matrix plays. Prior proj-group experiments grouped attn.proj+mlp.proj together (exp_406 both at 0.060 discard, exp_462 both at 0.125 discard); neither tested mlp.proj alone at the attn-matched intermediate. Structurally-motivated split on the MLP-only Muon axis, orthogonal to the exp_473 encoder/decoder split and the exp_336 DOWN probe on muon_wd_mlp."
484	2026-04-23T08:03:21Z	curr	377	475	curr	Replace within-shard random permutation with a golden-ratio LCG order (stride≈0.618·N, coprime with N, per-epoch random offset): deterministic low-discrepancy sequence ordering, untried permutation-STRUCTURE axis orthogonal to exp_474's block-B=8 (locality) and exp_047's half-stride (overlap).	-0.0002	discard	1.075692	+0.001671	15999853	600.106000	588.200000	1491.000000	apg-curr-0476		Single-site edit in ShuffledSequenceLoader._reset_shard (line ~380). Replaces `sequence_order = self.rng.permutation(num_sequences)` with a coprime golden-ratio LCG: sequence_order = (arange(N)*stride + offset) % N where stride = floor(0.618·N) (bumped until coprime with N), offset drawn per-epoch from self.rng. Since gcd(stride,N)=1 this is an exact permutation (same marginal position coverage as rng.permutation). What changes: consecutive pops from the same shard sit exactly ~0.618·N apart in shard position every epoch, vs a random permutation's ~N/3 average with high variance. Hypothesis: tighter cross-microstep decorrelation of same-shard draws reduces gradient noise on the Muon update. Small-numeric edge case N≤1 handled (falls back to arange).
