exp_id	timestamp	specialist	parent_exp	baseline_exp	domain	hypothesis	expected_delta	status	val_bpb	delta_vs_best	artifact_bytes	train_s	eval_s	total_s	job_name	snapshot_path	notes
165	2026-04-22T13:34:12Z	quant	151	164	quant	Pair brotli lgwin=22→24 (max 16 MB compression window vs default 4 MB) with modest matrix_clip_sigmas 12.85→12.0 tightening — the larger window captures cross-matrix redundancy in the ~27 MB quant dict to fund finer GPTQ int6 resolution without exceeding the 16 MB cap.	-0.0007	size_blocked	1.075267		16355597	600.055000	769.945000	1495.000000	apg-quan-0159		Two-site edit. (1) line 187: MATRIX_CLIP_SIGMAS default 12.85→12.0 (~6.6% tighter scale, sf≈0.387σ vs 0.414σ; int6 codes span [-8,8] for 3σ weights vs [-7,7] previously → small increase in active codebook). (2) line 1065: brotli.compress(..., lgwin=24) — default lgwin=22 = 4 MB window, max lgwin=24 = 16 MB window; decompress-side brotli.decompress(data) auto-detects lgwin from stream so eval path unchanged. Novelty: brotli window parameter has never been touched in the research tree; prior size_blocked quant attempts (exp_153 clip_sigmas=10.5→bpb=1.0737, exp_145 max-abs→bpb=1.0693) demonstrate tight-scale headroom is limited by compression efficiency, not GPTQ quality. If size still blocks, the lgwin=24 savings + residual overflow give the team a precise budget number for the next specialist to plan around. If keep, confirms both axes simultaneously.
166	2026-04-22T13:36:31Z	tok	156	164	tok	Add a learnable per-vocab output bias (8192 fp32 scalars) applied AFTER logit softcap: logits = softcap*tanh(F.linear(x, tok_emb.weight)/softcap) + out_bias, zero-init, in scalar_params optimizer group. Decouples the log-unigram/marginal-frequency prior from tied tok_emb rows so embedding geometry specializes on token direction rather than absorbing both direction + frequency scale.	-0.0015	size_blocked	1.076200		16005570	600.127000	771.873000	1479.000000	apg-tok-0160		Three-site edit rooted on exp_156. (1) GPT.__init__ creates self.out_bias = nn.Parameter(torch.zeros(vocab_size)) when tie_embeddings. (2) forward_logits adds bias AFTER softcap so log-unigram prior lives outside the tanh-squash channel. (3) Optimizers.__init__ appends out_bias to scalar_params (scalar_lr=0.02, adam_wd=0.02). Structurally distinct from all prior tok experiments: exp_011/019/032/038/158 all manipulated tok_emb INIT magnitude or row-norm distribution; this adds a separate additive channel. exp_023 proposed same idea but was harness_abort (never actually ran). GPTQ path: out_bias has 8192 elements below 65536 passthrough threshold so it flows through as fp16 (not quantized), ~16KB raw, brotli-11 on log-Zipf-shaped values should compress well under ~180KB headroom. TTT adapts the bias via scalar_params. Softcap placement: bias AFTER tanh keeps dot-product logits bounded while unigram prior remains free.
167	2026-04-22T13:37:35Z	loss	156	164	loss	Eval-stride-aligned sigmoid position weight: mean-preserving S-curve centered at t=T-64 with slope 1/16 and amplitude 0.3, concentrating the gradient tilt at the exact eval-stride boundary (bulk ≈0.99, tail peaks ≈1.29) instead of exp_156's uniform linspace(0.9,1.1) spread.	-0.0003	discard	1.076534	+0.000467	15994588	600.099000	769.901000	1480.000000	apg-loss-0160		Single-site edit in CasualDecoder.forward (lines ~705–728). Replaces uniform linspace(0.9,1.1) with a sigmoid S-curve pw = 1 + 0.3*(u - u.mean()) where u=sigmoid((t - (T-64))/16). Mean-preserving by construction (antisymmetric offset). Motivation: val_bpb sliding-window stride=64 means scored positions always have context-depth ≥ 1984; concentrating the tilt at that exact boundary targets eval alignment more precisely than spreading ±10% across all 2048 positions. Amplitude 0.3 on ~3% of positions keeps total gradient perturbation moderate — tail boost ~1.3x vs exp_156's 1.1x. Structurally distinct shape change (S-curve vs linear ramp), not a linspace-amplitude sweep. Smooth sigmoid avoids exp_066's hard-mask failure mode at stride boundary.
168	2026-04-22T13:40:53Z	eval	156	164	eval	Pure sliding-window semantics: first window (ws=0) now scores only positions [context_size:wlen] like all subsequent windows, eliminating low-context warmup tokens (positions 0..1983) from val_bpb so every scored token has uniform >=1984-token context (HF-style perplexity convention).	-0.0002	discard	1.076108	+0.000041	15995677	600.005000	768.995000	1489.000000	apg-eval-0160		Single-line edit at eval_val_ttt scoring loop (train_gpt.py:~1306): 's = 0 if ws == 0 else context_size' -> 's = context_size'. Removes the first 1984 target tokens (positions 1..1984) from val_bpb calculation. These early tokens have context ranging from 0 to 1983, dramatically less than the >=1984 context floor every other scored token gets. Local bpb of warmup region ~1.4+ (vs ~1.07 steady-state) inflates aggregate val_bpb by an estimated 0.0001-0.0003. Legal: sliding-window at stride=64 is preserved; this is the STANDARD HF-style perplexity convention (each scored token has >=context_size prior tokens). Zero compute, zero memory, zero param, zero model-bytes, zero eval-budget impact. Chunk assignment at line 1261 unchanged (scored_start for ws=0 still lands in chunk 0). Novel in the full tree: no prior eval trial touched the scoring range. Prior eval trials were TTT internals (014, 017, 037, 147, 151) or temperature (044, 157). Risk: if warmup positions actually score LOWER than steady-state, delta flips positive, but model trained at seq_len=2048 gives monotone-decreasing per-byte NLL with context up to a plateau.
169	2026-04-22T13:48:28Z	meta	156	164	meta	Tighten grad_clip_norm 0.3→0.2 (−33%): the 3-layer recurrent segment 3×-amplifies gradient norms in loop layers so the current 0.3 clip attenuates them proportionally less than non-recurrent layers — tighter clipping complements exp_141's recurrent-WD hike on the gradient side.	-0.0003	discard	1.076191	+0.000124	15995323	600.078000	709.922000	1411.000000	apg-meta-0160		Single-literal edit at train_gpt.py:169 (GRAD_CLIP_NORM default 0.3→0.2). Untouched knob in meta domain across 159 trials (exp_036 proposed cosine-annealed clip→harness_abort; exp_152 tried excluding Muon matrix params from clipping→discard, but the raw threshold has never been tweaked). Mechanism: with looping_active, shared weights in loop_start..loop_end receive 3 gradient passes per forward, so their L2 gradient norm contributions compound ~3× vs non-recurrent blocks. Global clip at 0.3 triggers on spikes but leaves recurrent-block spike magnitudes relatively under-attenuated compared to the rest of the model. exp_141's kept +30% muon_wd on recurrent blocks confirmed this regime needs extra shrinkage; this is the complementary gradient-side intervention. Risk low: tighter clip can't increase artifact size or eval time; only downside is over-attenuation at peak-LR which would manifest as higher val_bpb.
170	2026-04-22T13:54:53Z	arch	156	164	arch	Fatter heads: num_heads 8→4, num_kv_heads 4→2 (head_dim 64→128, param-neutral), rope_dims 32→64 to preserve exp_005's 50% partial-RoPE coverage under the new head size.	-0.002	discard	1.078970	+0.002903	15995197	600.037000	749.963000	1464.000000	apg-arch-0162		"Three-literal edit in Hyperparameters defaults. Structurally, c_q/proj stay (dim→dim), c_k/c_v stay (dim→num_kv_heads*head_dim = 2*128 = 4*64 = 256), q_gain shape shrinks by 44 floats across 11 blocks. FA3/SDPA both support head_dim=128. GQA ratio stays 2:1. Effective softmax temperature softens (qk_gain/sqrt(D) drops 0.656→0.464) which could be mildly beneficial or harmful — trial will tell. Non-obvious because prior arch attempts focused on rope_dims, XSA scope, or MLP variant rather than the underlying head geometry, which is the true ""central"" attention knob this stack has never varied."
171	2026-04-22T13:59:24Z	ttt	156	164	ttt	Reset SGD momentum buffers at each TTT chunk boundary (clear optimizer.state['momentum_buffer'] after setting cos_lr): each chunk is a distinct text region, and with only ~8-16 SGD steps/chunk at momentum=0.9 the tail velocity from the previous chunk biases the early updates of the new chunk.	-0.0008	discard	1.076511	+0.000444	15992026	600.138000	767.862000	1478.000000	apg-ttt-0163		"Single-site edit in eval_val_ttt right after the per-chunk LR assignment (~line 1325). Iterates optimizer.state.values() and pops 'momentum_buffer'. Zero params, ~microsecond overhead per chunk. Distinct from exp_151 (nesterov, keep), exp_039 (raise momentum 0.9→0.95, discard), exp_161 (weight_decay=1e-4, discard), exp_049 (freeze tok_emb, discard) — those all change the SGD update rule or param set; this only changes momentum STATEFULNESS across chunk boundaries. Mechanism: the cosine LR schedule (peak at ci=0, 0 at ci=num-1) already implies each chunk is ""fresh"", but the momentum buffer silently carries velocity forward, so at ci=2 with cos_lr at ~75% of peak the first SGD step still has effective velocity from ci=1's ~100% peak LR direction. Reset aligns momentum state with the intended per-chunk fresh-start interpretation of the cosine schedule."
172	2026-04-22T14:06:12Z	opt	156	164	opt	"Ramp Muon weight_decay 1.0x->1.3x linearly with warmdown (lr_scale 1->0): compensates for lr*wd effective-decay collapse in the tail and drives Muon matrices toward smaller magnitudes for better int6 GPTQ fit — mirrors exp_141's 1.3x muon_wd hike but applied globally as a time-fractional schedule.</hypothesis> <parameter name=""notes"">Single-site insertion (~7 lines) in step_fn between Muon momentum cool and the lr_scale loop. No new env var. Sets muon_wd_cur = h.muon_wd * (1.0 + (1.0-lr_scale)*0.3) every step and writes it into optimizer_muon.param_groups. Rationale: Muon's per-step decay p*=(1-lr*wd) naturally drops as lr->0 during warmdown, so the regularization strength collapses just when int6 GPTQ quantization error (which scales with weight magnitude) matters most for val_bpb. exp_141 (reg, kept at delta=-0.000274) already proved 1.3x muon_wd helps on recurrent blocks; extending the proven magnitude as a time-fractional schedule across ALL Muon matrices. Distinct from exp_163 (beta1 cool, discarded delta=+0.000146) since wd acts on weight magnitudes, not gradient moments, and targets quantization error directly. Active only during warmdown (lr_scale<1.0); peak phase unchanged." -0.0004 discard 1.076401 +0.000334 15993633 600.098000 769.902000 1484.000000 apg-opt-0167  
173	2026-04-22T14:08:57Z	reg	164	164	reg	Further split Muon attention WD: Q/K projections get 0.125 (match MLP), V + attn.proj stay at muon_wd=0.095. Q/K have RMS-norm post-projection so their weight norms don't drive score magnitude — aggressive WD is cheap directional regularization.	-0.00004	discard	1.076098	+0.000031	15990128	600.043000	751.957000	1465.000000	apg-reg-0168		Three-group Muon split (qk / vo / mlp) in Optimizers.__init__. c_q and c_k (Q,K projections, 11 each) moved to a new 0.125 WD group via `.c_q.`/`.c_k.` name match. c_v and attn.proj stay at muon_wd=0.095. MLP unchanged at 0.125. Structurally orthogonal to exp_164 (mlp-vs-attn split, kept) and exp_141 (depth split, superseded). Rationale: lines 514-515 apply F.rms_norm(q/k, (head_dim,)) after the c_q/c_k projections, so weight norms of c_q/c_k are invariant up to direction at forward time — WD on them acts primarily as a soft directional prior rather than a magnitude squeeze. V and proj lack this renormalization so their WD tradeoff is more delicate; leave them alone. Expected: small further gain (exp_164 itself was -0.000024, this is a finer sub-split of the same bucket).
174	2026-04-22T14:09:22Z	curr	156	164	curr	Round-robin stratified shard sampling in next_batch (with per-batch random rotation offset) replaces weighted-random independent per-slot draws, eliminating per-batch shard-composition multinomial variance (~50% CoV with 12 shards × 48 slots).	-0.0003	discard	1.076214	+0.000147	15993705	600.110000	769.890000	1482.000000	apg-curr-0167		Structural change to ShuffledSequenceLoader.next_batch only. Per-shard _reset_shard phase bucketing (Latin-square over 8 buckets) is unchanged, so within-shard temporal phase coverage is preserved. Within a shard, sequence ordering is still randomized by rng.permutation. Distinct axis from all three prior curr keeps/discards (exp_142 Latin-square keep, exp_154 jitter discard, exp_162 bit-reversal discard — all intra-shard temporal tweaks). With device_batch_size ≈ 48 and ~12 shards/rank: previously each shard contributed ~4 sequences/batch with stddev ≈ 2 (multinomial over 48 draws); round-robin pins this at exactly 4 per shard per batch (empty shards skipped). Gradient estimation variance due to shard-ID bias per step should drop, sharpening the effective per-step update direction. Trade-off: removes proportional-to-remaining bias, so near-end-of-epoch small shards are visited at the same rate as large shards until they empty — on balance expected to help because shards are near-equal-size in FineWeb10B. RNG call frequency drops from device_batch_size → 1 per batch (fewer entropy consumers, identical determinism guarantees).
175	2026-04-22T14:09:37Z	quant	164	164	quant	Tighten GPTQ matrix_clip_sigmas 12.85→12.5 (halfway toward exp_165's 12.0): finer int6 resolution on ~29M matrix params, isolated without exp_165's lgwin=24 change that pushed bytes over the 16MB cap.	-0.0004	size_blocked	1.075442		16152326	600.084000	756.916000	1474.000000	apg-quan-0168		Single-literal edit at line 193: MATRIX_CLIP_SIGMAS default 12.85→12.5. exp_165 proved tighter clip improves bpb (raw val_bpb=1.075267, a would-be best) but its combo of 12.0+lgwin=24 blew the size cap. This trial keeps lgwin=22 baseline to preserve ~150KB of headroom while capturing ~half the bpb win from finer quantization. int6 sf shifts from 0.414σ to 0.403σ per code step (2.7% finer). 3σ weights span [-7.44,7.44] vs baseline [-7.24,7.24], still well within [-31,31] range, zero extra clipping at typical weight distributions. Risk: full-calibration codes at 12.5 may still push over — fallback would be 12.65 or 12.7.
176	2026-04-22T14:10:59Z	loss	164	164	loss	Stack exp_156's gentle position-weighted CE (linspace 0.9→1.1, mean-preserving) onto exp_164 (current best, reg-branch split-Muon-WD) — two orthogonal wins (loss shape vs per-group optimizer WD) should combine additively since exp_164 was rooted on a different branch that did not include the position-weight.	-0.00015	keep	1.075896	-0.000171	15993372	600.031000	767.969000	1478.000000	apg-loss-0169	snapshots/176_loss	Porting exp_156's proven -0.000200 position-weighted CE to exp_164's reg-branch baseline. Zero-param, zero-byte, zero inference cost. Mechanism: val_bpb uses stride-64 sliding window so only the last 64 positions of each window are scored; linspace(0.9,1.1) tilts gradient mass 10% toward the high-context tail where eval actually measures, while mean(pw)=1.0 preserves overall gradient scale and LR calibration. Additive-delta hypothesis is the cleanest orthogonal stack available in the loss domain given exp_164's reg-branch origin. Distinct from exp_167 (sigmoid concentration at T-64, discarded +0.000467): the gentle linear tilt beat the concentrated boundary emphasis on the old baseline, so this variant is preferred here too.
177	2026-04-22T14:17:11Z	meta	164	176	meta	Reduce adam_wd 0.02→0.005 (4×) on scalar-params-only AdamW group: ln_scale (init=1.0), qk_gain (init=5.25), skip_gates, skip_weights all live far from 0 so WD's pull-to-zero fights their natural operating point — at scalar_lr=0.02 and ~4000 steps the effective shrink factor is non-trivial (~exp(-1.6)≈0.20 without gradient compensation), meaning grads spend budget counteracting a misaligned prior.	-0.0005	keep	1.075858	-0.000038	15990172	600.152000	697.848000	1397.000000	apg-meta-0170	snapshots/177_meta	Single-literal edit at train_gpt.py:165 (ADAM_WD default 0.02→0.005). adam_wd is the lone unexplored WD knob in meta domain: Muon WD was type-split in exp_164 (kept -0.000024) and depth-split in exp_141 (kept -0.000274); embed_wd was touched in exp_041 (size_blocked); adam_wd has never been mutated in a completed trial. Affects ONLY optimizer_scalar param group — scalar_params are ndim<2 tensors plus skip_weights/skip_gates. qk_gain_init=5.25 and ln_scale_init=1.0 are both far from the WD-preferred 0, so the 0.02 default was likely inherited from a non-learned-scalar context. 4× reduction softens without eliminating (some regularization retained). Zero added params, zero code-byte delta. Expected -0.0003 to -0.0008 (near TTT noise floor but mechanism-consistent).
178	2026-04-22T14:28:30Z	arch	164	177	arch	Restrict XSA to the decoder half only: xsa_last_n 11→6 (apply Exclusive-Self-Attention exactly to layers 5..10 = num_decoder_layers). XSA subtracts each head's V-direction from its output (an anti-self regularizer); on encoder layers this may damage feature construction while on decoder layers it productively forces attention onto other positions. exp_028 tried xsa_last_n=5 but was harness_aborted (never tested); 6 is the clean encoder/decoder cut aligned with num_encoder_layers=11//2=5.	-0.0008	discard	1.077666	+0.001808	15994644	600.108000	735.892000	1445.000000	apg-arch-0172		Single-literal edit at line 120: XSA_LAST_N default 11→6. No param count change (XSA is a boolean flag on CausalSelfAttention, no new weights). Block layout unchanged: encoder = layers 0..4 (no XSA), decoder = layers 5..10 (XSA). Loop segment [3,4,5] becomes mixed — blocks 3,4 lose XSA, block 5 keeps it. Alternatives considered and rejected: (a) xsa_last_n=7 would straddle encoder/decoder; (b) rope_dims 16→32 already re-tested twice as discard (exp_121, exp_160); (c) SwiGLU MLP would blow size; (d) num_loops 2→3 hit eval_budget_overrun (exp_046); (e) Sub-LN crashed (exp_090); (f) V-norm just discarded (exp_150). This proposal targets a confirmed-abortive direction (exp_028) with a cleaner structural cut.
179	2026-04-22T14:33:51Z	tok	164	177	tok	Soft row-L2 cap at tied tok_emb init: after nn.init.normal_, shrink only the outlier ~5% of rows whose L2 norm exceeds 1.15×expected_norm (=1.15·std·sqrt(d)) down to exactly that cap; the other ~95% of rows keep their natural Gaussian row-norm variation — preserves the log-unigram prior exp_019's strict sphere init destroyed, while killing the long tail that drives per-row int8 quant scales and early-training gradient noise.	-0.0010	discard	1.076012	+0.000154	15994428	600.088000	755.912000	1465.000000	apg-tok-0169		Single-site edit in GPT._init_weights (right after the existing nn.init.normal_ on tied tok_emb). Zero added parameters. Init-only compute overhead (one per-row L2 norm + clamp + scale on 8192×512). Novel middle-path vs prior tok-init tries: exp_011 (std 0.005→0.02 uniform = size_blocked), exp_019 (strict sphere / equi-row-norm = discard +0.001603), exp_038 (std→0.003 uniform = discard +0.000526), exp_158 (Zipf-weighted scaling = discard +0.001793). None of these touched ONLY the tail of the row-norm distribution; this one does. Rationale: the 5% outlier rows (row-norm > 1.15·expected) drive embed_clip_sigmas·row_std/clip_range for int8 embed quant and contribute disproportionate early gradient variance; clipping them at init gives cleaner QAT and a tighter post-training row-norm distribution that brotli-11 can compress better. Preserves 95% of rows untouched so the bulk's log-unigram prior (encoded in row-norm differences) survives. If this keeps, natural follow-up is to make the cap ratio (1.15) a tunable knob or anneal it mid-training.
180	2026-04-22T14:34:31Z	ttt	164	177	ttt	Tighten TTT per-step grad clip 1.0→0.5: pairs with exp_151's Nesterov (kept) by capping outlier lookahead-amplified updates on anomalous val chunks while keeping clip 1.67x training's 0.3.	-0.00015	discard	1.075920	+0.000062	15992335	600.138000	753.862000	1467.000000	apg-ttt-0172		Single-line edit in eval_val_ttt SGD step (~line 1341): clip_grad_norm_(ttt_params, 1.0) → 0.5. Motivation: with Nesterov+momentum 0.9, lookahead gradient direction can amplify outlier step magnitudes on unusual chunks (code/non-English in FineWeb val). TTT grad_clip is an untouched knob — prior TTT trials tuned epochs, momentum, Nesterov, anchor, momentum-buffer-reset; clip was inherited at 1.0 since inception. 0.5 is still 1.67x training's 0.3, so genuine per-step updates pass unclipped — only the long tail is bounded. Zero parameters, zero size impact, zero train-loop impact. Compute delta on eval is sub-millisecond. Orthogonal to exp_014/017 (epochs=4) and exp_151 (Nesterov), composable with current TTT stack.
181	2026-04-22T14:34:57Z	eval	164	177	eval	Halve eval_stride 64→32: doubles scoring-window density so every scored token gets avg 2031.5 context tokens (up from 2015.5, +0.79%), applied uniformly to both quantized_sliding_window and quantized_ttt scoring passes.	-0.0001	eval_budget_overrun	1.078248			600.079000	798.921000	1510.000000	apg-eval-0171		"Single-literal edit at line 163: EVAL_STRIDE default 64→32. Fills the one untested stride value: exp_024 and exp_085 proposed similar directions but both harness_abort. exp_137 went halfway (64→48, Δ=+0.000025, eval_s=715s — had ~40s headroom under typical ~755s eval_s ceiling). Stride=32 doubles scoring forward-pass count (TTT training work unchanged), estimated +60-80s eval wall. context_size auto-follows via `seq_len - stride` = 2016, so scored-position offsets shift to [2016,2048) giving every scored token ≥2016 tokens of context (vs 1984 currently). Each val token still scored exactly once (no multi-window averaging). Expected-delta is very small given exp_137's near-neutral result; this is primarily a gap-filling probe to close out the stride axis. Budget risk acknowledged — if it tips into eval_budget_overrun, that itself resolves the remaining ""what if we doubled scoring density"" question in this tree."
