exp_id	timestamp	specialist	parent_exp	baseline_exp	domain	hypothesis	expected_delta	status	val_bpb	delta_vs_best	artifact_bytes	train_s	eval_s	total_s	job_name	snapshot_path	notes
057	2026-04-22T05:59:49Z	eval	017	017	eval	Halve ttt_chunk_tokens 65536→32768: doubles TTT adaptation frequency so roughly half of val tokens gain an extra score-after-adapt cycle without changing total TTT FLOPs.	-0.0005	eval_budget_overrun	1.079645			600.082000	788.918000	1506.000000	apg-eval-0048		One-line change: Hyperparameters.ttt_chunk_tokens default 65536→32768. Same eval_val_ttt control flow — num_chunks doubles (~15→~30 for ~1M val tokens), scored tokens per chunk halves, SGD-steps-per-chunk stays at ttt_epochs=4 (since my_chunk_seqs/GPU drops from 4→2, still only 1 batch per epoch). Net effect: ~2× total TTT SGD steps but each with half-size batch → similar total train FLOPs. Scoring compute unchanged (same total scored tokens, compile cache hits across chunks). Main val_bpb lever: tokens in position [ttt_chunk, 2·ttt_chunk] now get scored with weights adapted on chunk 0, whereas before they were part of the first un-adapted chunk. Unexplored axis — prior TTT-domain trials touched epochs (017 kept, 039 discard), momentum (037 crash), anchor (027 crash code-nonexistent), nesterov (031 crash), temperature (044 discard), stride (024 crash). Chunk cadence is fresh ground. Budget impact: current TTT eval ~370s, expect +20-50s overhead from extra chunk-transition bookkeeping — safe inside 600s cap.
058	2026-04-22T06:14:50Z	tok	017	017	tok	Replace F.rms_norm with F.layer_norm on the post-tok_emb input embedding: zero-mean + unit-var input (vs rms-only) strips any column-mean bias from tok_emb rows before it is stored as x0 and propagated through every block's skip path, giving better-conditioned early residuals as rows drift during training.	-0.0003	harness_abort							apg-tok-0058		Unexplored axis in tok domain: all prior tok trials touched tok_emb init (std, sphere-norm, trunc-normal) or output-side scale/bias (learnable logit_scale, per-vocab bias) — the input-side normalization operator itself was untouched. F.layer_norm is drop-in param-free (same signature, eps default 1e-5); zero code-byte growth, zero model-byte growth, zero new params. At init with std=0.005 the row-mean is ~0 so it's neutral step-0; during training as tok_emb rows drift, LayerNorm actively zeros the column-mean of the post-lookup embedding, removing a constant-bias direction that currently enters x0 and is reused via skip_weights in every decoder block. Risk: if the model was relying on preserving row-mean as an implicit scalar carrier, zeroing it could hurt — but that would be unusual with tied embeddings since the output projection sees raw (un-layernormed) tok_emb rows anyway. [QUARANTINED 2026-04-22T07:17:56Z: supervisor-synth failed after internal CLI name-cache miss; job_id-based poll fallback added post-hoc.]
059	2026-04-22T06:14:54Z	arch	017	017	arch	Disable parallel residual entirely (parallel_residual_start 7→11): all 11 layers use sequential residual (attn_out feeds into MLP input via x_mid), trading the parallel-residual compute pattern for added sequential expressivity at identical FLOP count — a structural axis not touched since baseline.	-0.0008	harness_abort							apg-arch-0058		Current best (exp_017) uses parallel residual on decoder layers 7-10 (4 of 11 physical blocks). Parallel residual (GPT-J/PaLM style) reads x_in for BOTH attn and mlp branches; sequential reads post-attn x for mlp. Same matmuls, same FLOP count — the only difference is the data-dependency graph. At tiny scale (36M params, 11 layers), the sequential path lets mlp transform attn_out instead of treating it as an independent addend, which is usually more expressive. Recent arch trials (exp_056 loop shift discard, exp_028 XSA-restriction crash, exp_030 SwiGLU crash) touched different axes; parallel residual placement has not been tuned. Zero byte impact, zero compile-path change. Risk: the 7-layer parallel/4-layer sequential split may have been compile-tuned so that breaking it costs some torch.compile graph reuse. Low probability, acceptable cost. [QUARANTINED 2026-04-22T07:17:56Z: supervisor-synth failed after internal CLI name-cache miss; job_id-based poll fallback added post-hoc.]
060	2026-04-22T06:14:56Z	eval	017	017	eval	Clear TTT SGD momentum buffer at each chunk boundary: with only ~4 SGD steps per chunk the β=0.9 buffer stays dominated by the previous chunk's gradient direction, biasing early steps of each new chunk toward a stale loss landscape; fresh momentum per chunk lets cos_lr own adaptation without cross-chunk drift.	-0.0003	harness_abort							apg-eval-0058		"Single-line addition `optimizer.state.clear()` right after the per-chunk cos_lr update in eval_val_ttt (between setting pg[""lr""] and computing my_seq_s). Zero byte impact, zero FLOP impact outside a tiny reset. Unexplored knob: prior TTT trials touched epochs (exp_017, exp_014), momentum value (exp_039), nesterov (exp_031, crashed), anchor coeff (exp_027, crashed), freeze-tok_emb (exp_049), chunk size (exp_057, overran), cosine-momentum (exp_037, crashed). None touched cross-chunk momentum persistence. With chunk_seqs~32 and 8 ranks giving ~4 seqs/rank and batch_seqs=32 → 1 step/epoch × 4 epochs = 4 steps per chunk, the momentum buffer never has time to fully adapt within a chunk (β^4≈0.66 carries over), so step 1 of a new chunk is actually more dominated by prior-chunk momentum than current-chunk gradient. Principled reset. Expected delta small (-0.0003) since the effect is concentrated in early steps of each of ~14 chunks. [QUARANTINED 2026-04-22T07:17:56Z: supervisor-synth failed after internal CLI name-cache miss; job_id-based poll fallback added post-hoc.]"
061	2026-04-22T06:14:56Z	quant	017	017	quant	Raise GPTQ Hessian damping 0.01→0.03 (3×): smoother H_inv produces less chaotic error-propagation updates and fewer outlier codes, which should either improve brotli compressibility or marginally stabilize quantization vs exp_016's opposite-direction damping cut (0.01→0.003, discard).	-0.0003	harness_abort							apg-quan-0058		Single-line change at train_gpt.py:936 (damp = 0.01 → 0.03 * H.diag().mean()). Prior damping trial exp_016 went 0.01→0.003 (less damping, more aggressive H_inv inversion) and discarded +0.000354; the opposite direction is unprobed. Reasoning: quant fidelity-push trials all hit size_blocked (exp_004/008/045/055 with bpb 1.070-1.078 but oversize) — the entropy of code values is already at the cap. More damping moves GPTQ update toward RTN-regularized behavior which typically produces smoother, less outlier-dominated code distributions that brotli handles better. Numerical stability of Cholesky also improves with more diagonal ridge. Fidelity cost should be small because damp·mean(diag(H)) is still well below H's leading eigenvalues. Risk: if damping dominates, GPTQ's error-redistribution signal is weakened and bpb hurts ~+0.0005. [QUARANTINED 2026-04-22T07:17:56Z: supervisor-synth failed after internal CLI name-cache miss; job_id-based poll fallback added post-hoc.]
062	2026-04-22T06:15:02Z	reg	017	017	reg	Zero weight decay on scalar/control params (adam_wd 0.02→0.0): q_gain (init 5.25), attn_scale/mlp_scale/resid_mix/skip_weights (init 1.0) and skip_gates are meaningfully non-zero learnable control tensors — the 0.02 wd fights their functional targets; standard modern transformer practice is to exclude scalars/norms/biases from weight decay.	-0.0010	harness_abort							apg-reg-0058		One-line change: adam_wd default 0.02→0.0 (line 162). Affects only the third AdamW (scalar/control params: attn_scale, mlp_scale, resid_mix, q_gain, skip_weights, skip_gates, and all 1D params). These have structural init values (q_gain=5.25, scales=1.0) that the 0.02 shrinkage was fighting. Scalar params are tiny (~few thousand floats) — negligible size impact, unlike exp_041's embed_wd reduction which went size_blocked. Anti-anchoring against reg-domain dropout failures (exp_012/033/040/050 all hurt) — the model is underfitting, so easing over-aggressive regularization on control tensors should help val_bpb without adding a new dropout-style penalty. [QUARANTINED 2026-04-22T07:17:56Z: supervisor-synth failed after internal CLI name-cache miss; job_id-based poll fallback added post-hoc.]
063	2026-04-22T06:15:02Z	meta	017	017	meta	Narrow Muon momentum warmup fraction 0.33→0.22 (documented default, unexplored narrowing direction): momentum reaches peak 0.99 ~33% faster, giving more of the 28% peak-LR window to peak-momentum Muon updates.	-0.0003	harness_abort							apg-meta-0056		Single-line default change on line 154. exp_015 narrowed the AMPLITUDE (start 0.92→0.94, discard +0.0018); exp_029 WIDENED the fraction 0.33→0.45 and crashed. Narrowing the fraction (0.33→0.22) is the unexplored direction, and 0.22 matches INIT.md's documented default. Zero code-byte growth, zero model-byte impact (schedule-only), safe for compression budget (exp_041/048 size_blocked were weight-magnitude knobs). Stacks cleanly on exp_010's cosine-cool-momentum-during-warmdown keep since both touch distinct phases of the momentum curve. [QUARANTINED 2026-04-22T07:17:56Z: supervisor-synth failed after internal CLI name-cache miss; job_id-based poll fallback added post-hoc.]
064	2026-04-22T06:15:03Z	ttt	017	017	ttt	Reset SGD momentum buffers at each TTT chunk boundary (optimizer.state.clear() after cos_lr set) so cross-chunk stale direction (momentum=0.95 has ~20-step memory) no longer undoes the cosine LR decay across chunks; within-chunk acceleration is preserved.	-0.0004	harness_abort							apg-ttt-0057		TTT optimizer is constructed once outside the chunk loop (line 1251), so momentum buffers persist across chunks. Cos LR decay across chunks is meant to dampen late-chunk updates, but persistent high-magnitude momentum from early chunks effectively undoes this decay. Each val chunk is a different semantic segment, so cross-chunk gradient direction is stale. Single-line addition of `optimizer.state.clear()` inside the chunk loop, after the cos_lr is set. No new params, no code-byte growth beyond comments, no compute change (clearing state is O(num_params) on host). Unexplored in TTT subtree: prior ttt trials touched epochs (014/017 keep), momentum value (039 discard), Nesterov (031 crash), per-chunk momentum schedule (037 crash), anchor coeff (027 crash), freeze tok_emb (049 discard) — none addressed the persistent-vs-reset momentum question. [QUARANTINED 2026-04-22T07:17:56Z: supervisor-synth failed after internal CLI name-cache miss; job_id-based poll fallback added post-hoc.]
065	2026-04-22T06:15:03Z	opt	017	017	opt	Decouple Muon weight decay from LR scaling: scale wd by 1/max(lr_scale,0.1) so shrinkage (1-lr*wd) stays pinned at peak throughout the 72% cosine warmdown.	-0.0005	harness_abort							apg-opt-0058		Single insertion in step_fn. wd_coef=1/max(lr_scale,0.1). Main training unchanged; warmdown wd grows 0.095 to 0.95 keeping lr*wd at peak. Adam/tok/head untouched. [QUARANTINED 2026-04-22T07:17:56Z: supervisor-synth failed after internal CLI name-cache miss; job_id-based poll fallback added post-hoc.]
066	2026-04-22T06:26:56Z	loss	017	017	loss	Mask first 64 training-loss positions via ignore_index=-100 to align train CE with eval's sliding-window stride=64 distribution (where scored tokens have ≥1984 tokens of context).	-0.0008	discard	1.082221	+0.004162	15998557	600.210000	763.790000	1478.000000	apg-loss-0058		Loss-domain history: 5/5 trials hurt because they reshape the CE objective (z-loss, label smoothing, focal) and eval uses plain CE. This edit is different: keeps plain CE, but drops the first 64 positions per sequence where teacher-forcing loss approaches unigram entropy and contributes dominant high-variance gradient noise (log probs can be ~9+ nats). Eval sliding-window stride is exactly 64, so every scored val token has ≥1984 tokens of left context — train/val distributions mismatch was largest for positions 0..63. Positive side-effects: (1) TTT inner loop (line 1312) also skips first 64 per chunk, further matching eval stride; (2) only ~3% of training tokens are dropped so gradient signal is minimally reduced while variance goes down materially. Implementation is a 3-line clone+scatter then F.cross_entropy(..., ignore_index=-100) — no new params, no byte growth.
067	2026-04-22T06:29:44Z	curr	017	017	curr	Stratified shard sampling within each batch: use shard-draw sampling without replacement (distinct shards per batch when possible) instead of i.i.d. proportional draws, to reduce per-batch gradient variance via stratification.	-0.0005	discard	1.078349	+0.000290	15995841	600.057000	758.943000	1473.000000	apg-curr-0058		ShuffledSequenceLoader.next_batch: before each sample, exclude already-used shards in the batch via `eligible = remaining * (~batch_used)`, resetting `batch_used` only when all eligible shards are exhausted. With ~12 shards/rank and device_batch_size≈16, batches now contain up to 12 distinct shards (plus ≤4 repeats) vs the current i.i.d. draw where repeats are common by coupon-collector. Curriculum tree so far explored stride knobs (exp_025/047/053: all hurt or noise), position masking (exp_013 size_blocked, exp_034 crashed) — batch-composition stratification is the first principled variance-reduction angle tried. Size impact: +~200 code bytes, far from the 16MB gate. Mechanism if it helps: smoother SGD from per-batch shard-diversity guarantee; if it hurts: shards in FineWeb are already topically uniform and stratification is a wash or adds bias from forced-distinct draws near end-of-epoch.
068	2026-04-22T06:43:45Z	meta	017	017	meta	Raise Adam β2 0.95→0.98 (tok/head/scalar AdamW): smoother 2nd-moment denominator benefits the sparse-gradient tied tok_emb (8192 rows under LR=0.03 where β2=0.95 gives only ~13-step half-life per rare-row), with minimal impact on dense scalar params.	-0.0005	discard	1.078453	+0.000394	15995573	600.146000	760.854000	1472.000000	apg-meta-0066		Unexplored across the entire tree: every prior meta trial touched EMA decay, Muon momentum warmup, warmdown fraction, embed_wd, or adam_eps. β2 tuning is a canonical transformer-training knob (GPT-3 uses 0.95, PaLM/Llama 0.95, but many small-model recipes raise to 0.98 or 0.99 for stability on sparse embedding gradients). Single-line default change on line 157. Affects all three AdamW optimizers (tok, head-unused-because-tied, scalar). Muon untouched.
069	2026-04-22T06:44:28Z	tok	017	017	tok	Raise embed_wd 0.085→0.11 (≈+30%): stronger weight decay on the 4.2M-param tied tok_emb matrix shrinks per-row magnitudes during the 72% warmdown, yielding both byte headroom (GPTQ scale grid tightens on homogeneous rows) and mild regularization on the dominant over-parameterized tensor.	-0.0003	discard	1.081108	+0.003049	15986038	600.066000	761.934000	1476.000000	apg-tok-0066		One-line default change at line 164 (EMBED_WD 0.085→0.11). Unexplored direction — every prior tok magnitude trial either GREW embeddings (exp_011 std up, exp_041 wd down both size_blocked) or SHRANK init (exp_038 std down, discard +0.0005). embed_wd shrinks *during training* rather than at init, a different dynamics: peak-magnitude point shifts earlier, warmdown tail starves tail-row norms more. Direct attack on the size_blocked pattern that dogs the tok branch.
070	2026-04-22T06:45:02Z	loss	017	017	loss	Per-token CE loss winsorization at 3× batch mean — zero gradient contribution from the ~1-3% outlier tokens (cap detached via torch.no_grad) to reduce SGD variance without reshaping the CE target distribution, distinct from all 6 prior loss-domain trials which deformed the objective.	-0.0003	harness_abort							apg-loss-0068		Loss-tree is 6/6 hurt because every prior trial (z-loss exp_009, label-smoothing exp_026/042, position-CE-weight exp_034, focal exp_054, first-64-mask exp_066) reshaped the training CE distribution and eval uses plain CE. This edit keeps plain CE exact for the central 97-99% of tokens: compute ce with reduction='none', compute cap=3.0*ce.mean() under no_grad (so cap has zero gradient), then torch.minimum(ce, cap).mean(). Tokens where ce < cap have identical plain-CE gradient; tokens where ce >= cap contribute zero gradient (min derivative picks the constant branch). Net effect: a gradient-variance damper that preserves the objective for typical tokens. Implementation ~8 lines, no new params, +~120 code bytes, negligible compute (one reduction + pointwise min over per-token CE). Safety vs crashes: ce is shape-matched to flat targets already, all ops inside the existing forward shape contract — no new control flow or buffers that could trip torch.compile (exp_026/034 crashes were on schedule-live tensors and reshape-heavy per-position weights; this just adds min over the same per-token tensor). [QUARANTINED 2026-04-22T08:19:06Z: supervisor-synth failed after internal CLI name-cache miss; job_id-based poll fallback added post-hoc.]
071	2026-04-22T06:45:03Z	quant	017	017	quant	Double GPTQ calibration batches 64→128: halves Hessian estimator variance so error-propagation in the GPTQ inner loop tracks true curvature more accurately, yielding cleaner int6 codes without changing scales, shapes, or artifact size.	-0.0003	harness_abort			15999484			1471.000000	apg-quan-0066		Single-line default change at train_gpt.py:181 (gptq_calibration_batches 64→128). Smoke override at line 220 still pins to 2 so pack-size preflight is unaffected. Calibration runs in eval phase (serialize() after training), cost ≈ +5–10 s of 8 GPUs forward passes vs ~60 s eval headroom. Size-neutral: Hessian is averaged across batches, not stored. Unexplored axis — prior quant trials touched scale refinement (004/008/020/045), damping (016/061), and block_size (035), but never the calibration sample count itself. [QUARANTINED 2026-04-22T08:19:06Z: supervisor-synth failed after internal CLI name-cache miss; job_id-based poll fallback added post-hoc.]
072	2026-04-22T06:45:04Z	eval	017	017	eval	Apply T=0.97 temperature sharpening to eval scoring logits (both sliding and TTT) only — compensates for GPTQ int6 noise that flattens the predictive distribution; exp_044 showed T=1.05 (softer) costs +0.0026, motivating the opposite direction.	-0.0010	harness_abort							apg-eval-0066		"Divide logits by 0.97 just before F.cross_entropy in eval_val_sliding AND the TTT score-first loop. TTT *training* path (base_model(x,y) → GPT.forward) is deliberately untouched so SGD gradients remain unchanged. Logit softcap stays at 30.0; effective cap after /0.97 is ~30.9, a 3% widening. Expected small improvement if GPTQ makes logits slightly underconfident (as typical for post-training int6).</notes> </invoke> [QUARANTINED 2026-04-22T08:19:06Z: supervisor-synth failed after internal CLI name-cache miss; job_id-based poll fallback added post-hoc.]"
073	2026-04-22T06:45:04Z	ttt	017	017	ttt	"Raise ttt_lr 0.005 → 0.0065 (+30%) — continues the ""more adaptation"" direction (which worked on the epochs 3→4 axis for exp_014/017) on the fully unexplored LR axis."	-0.0003	harness_abort			15999359			1470.000000	apg-ttt-0066		"Single-line default change on line 174: ttt_lr 0.005→0.0065. Rationale: ttt_lr has been 0.005 since inception — completely untouched across ~50 trials. Prior TTT axis touches: epochs (014/017 keep), momentum (039 discard), nesterov (031 crash), anchor (027 crash), freeze tok_emb (049 discard), momentum-reset (064 crash). The LR axis has zero prior probes. Physical motivation: exp_014 and exp_017 both showed that ""more adaptation per chunk"" (epochs 3→4, effective magnitude lr×epochs 0.015→0.020) improves val_bpb. Pushing lr to 0.0065 gives 4×0.0065=0.026 effective magnitude — continues the established direction on an orthogonal knob. Cosine LR decay across chunks still throttles late-chunk updates; grad_clip_norm=1.0 still caps outlier steps. No code-bytes growth, no eval-time growth (same num_chunks × epochs × batches), no model-bytes impact. Risk: if 4×0.005=0.020 was at or near the adaptation-magnitude optimum, +30% overshoots and regresses modestly. [QUARANTINED 2026-04-22T08:19:06Z: supervisor-synth failed after internal CLI name-cache miss; job_id-based poll fallback added post-hoc.]"
074	2026-04-22T06:45:13Z	arch	017	017	arch	Add learnable per-head attention output gain (o_gain, init=1.0, shape [num_heads]) applied to attention output before proj — symmetric to per-head q_gain but on the output side; gives scalar AdamW a fast-moving per-head path for reweighting head contributions that is gauge-equivalent at init but training-separable from the Muon-orthogonalized proj matrix.	-0.0004	harness_abort							apg-arch-0066		Three-spot edit: (1) add self.o_gain = nn.Parameter(torch.ones(num_heads)) in CausalSelfAttention.__init__ next to q_gain; (2) apply y = y * o_gain[None,None,:,None] after FA3 and XSA, before reshape+proj; (3) add 'o_gain' to CONTROL_TENSOR_NAME_PATTERNS. 8 heads x 11 physical blocks = 88 new fp32 scalar params (~352 bytes). Unlike q_gain (sharpens scores) or attn_scale (per-dim 512), o_gain is per-head output reweighting. Only arch trial touching the attention-output pathway this tree. [QUARANTINED 2026-04-22T08:19:06Z: supervisor-synth failed after internal CLI name-cache miss; job_id-based poll fallback added post-hoc.]
