exp_id	timestamp	specialist	parent_exp	baseline_exp	domain	hypothesis	expected_delta	status	val_bpb	delta_vs_best	artifact_bytes	train_s	eval_s	total_s	job_name	snapshot_path	notes
021	2026-04-22T04:21:14Z	opt	017	017	opt	Extend exp_010 warmdown cosine-cooling to Adam beta2 (0.95→0.90), same frac_mm shape as beta1 (0.9→0.85) — shrinks 2nd-moment window from ~20 to ~10 steps in the low-LR tail so per-param Adam scaling tracks the refined end-of-training noise profile alongside beta1.	-0.0006	harness_abort							apg-opt-0020		Single-line schedule added next to existing adam_beta1 line. betas tuple now carries scheduled (beta1, beta2) each step across optimizer_tok (tok_emb AdamW) and optimizer_scalar (scalar AdamW); optimizer_head is None under tied embeddings. Interpolation `(1-frac_mm)*0.90 + frac_mm*h.beta2` uses the same frac_mm used for Muon momentum and beta1 — ramps up during warmup (first 33% wallclock), stays at h.beta2=0.95 in the middle, cosine-cools to 0.90 across the 72% warmdown. Rationale: stale v̂ estimate in the low-LR tail mismatches the shifted noise profile just like stale m̂ does (exp_010's rationale). Size impact: trivial (~200 code bytes). No envvar collision (BETA2 only consulted at init; mutation happens in-loop per step). [QUARANTINED 2026-04-22T08:19:36Z: supervisor-synth failed after internal CLI name-cache miss; job_id-based poll fallback added post-hoc.]
022	2026-04-22T04:21:14Z	meta	017	017	meta	Shorten warmdown_frac 0.72→0.65 to reclaim ~7% of the budget as peak-LR learning (28%→35%) while the EMA tail (half-life ~346 steps) still covers the ~2960-step warmdown by many half-lives.	-0.0002	harness_abort							apg-meta-0020		Meta axis shift away from momentum/EMA ramp tweaks (exp_003/006/015 all touched those). Only change: Hyperparameters.warmdown_frac default 0.72→0.65. Still linear LR decay — cosine warmdown (exp_002) is not in the current best chain. With ema_decay=0.998 (tail-heavy), shortening warmdown gives ~230 more peak-LR steps at negligible cost to averaging quality. [QUARANTINED 2026-04-22T08:19:36Z: supervisor-synth failed after internal CLI name-cache miss; job_id-based poll fallback added post-hoc.]
023	2026-04-22T04:21:18Z	tok	017	017	tok	Add a learnable per-vocab logit bias (8192 fp16-passthrough scalars) to the tied softmax so the frequency-prior signal lives in a dedicated parameter instead of being co-encoded into tied tok_emb rows.	-0.002	harness_abort							apg-tok-0020		Added self.logit_bias = nn.Parameter(zeros(vocab_size, fp32)) in GPT.__init__ (right after logit_scale), adds it to logits before the softcap tanh, and registers it in Optimizers.scalar_params so it trains via scalar AdamW (same LR as logit_scale). Zero-init ⇒ init forward matches baseline exactly. The bias is 8192 * 4 = 32 KB fp32 in memory but passes through GPTQ as fp16 (numel ≤ 65536), so raw persisted = 16 KB; brotli on a low-entropy frequency prior should compress to ≈4–8 KB. Headroom vs 16 MB cap was ~180 KB, comfortably covering this. Pre-run code_bytes went from 21.8 KB to 21.9 KB. Rationale: with tied embeddings, tok_emb rows are simultaneously input lookup vectors and output classifier vectors. Any mass dedicated to log p(token) (the ~log 8192 unconditional spread across vocab) has to be represented in the same rows that also carry semantic direction; a separate additive bias decouples these. Known to help small tied-embedding LMs; novel in this tree's tok-domain history (exp_011 raised init_std — size_blocked; exp_019 used sphere init — worse). [QUARANTINED 2026-04-22T08:19:36Z: supervisor-synth failed after internal CLI name-cache miss; job_id-based poll fallback added post-hoc.]
024	2026-04-22T04:21:19Z	eval	017	017	eval	Reduce sliding-window eval_stride 48→32: every scored token sees 2016 tokens of context (was 2000), improving scoring fidelity in both eval_val_sliding and TTT score-first passes without changing the training step cost.	-0.0003	harness_abort							apg-eval-0020		Only change: Hyperparameters.eval_stride default 48→32 (line 160). Rationale: context_size = seq_len - stride, so min context per scored token goes 2000→2016 (+0.8% context). Stride is never set by the harness (INIT.md harness-managed env list does NOT include EVAL_STRIDE), so changing the default takes effect. Cost: ~1.5× more windows in eval_val_sliding and in TTT's score-first pass; TTT training (per-chunk SGD on chunk_seqs = ttt_chunk_tokens // seq_len) is unaffected since it's token-based, not window-based. First eval-domain stride mutation in this tree. [QUARANTINED 2026-04-22T08:19:36Z: supervisor-synth failed after internal CLI name-cache miss; job_id-based poll fallback added post-hoc.]
025	2026-04-22T04:21:19Z	curr	017	017	curr	Reduce overlapping-sample stride from seq_len//2 to seq_len//4 in ShuffledSequenceLoader._reset_shard: each token is supervised at 4 positions-in-window per epoch (quartile context depths) instead of 2, doubling context-length diversity with zero per-step compute cost and no loss-semantics change.	-0.0005	harness_abort							apg-curr-0020		One-line change: stride = self.seq_len // 2 → self.seq_len // 4 (and updated comment). Rationale vs prior curr trial (exp_013, size_blocked from first-32-position CE masking): this preserves loss semantics everywhere — it only adds more overlapping windows to the sampling pool — so weight-distribution entropy should stay compression-friendly and avoid a post-run size_block. Under the 600s wallclock cap, the start-index pool per shard is 2× larger, so less cycling and more batch-level variety. Risk: 4-way overlap means a given target token may appear in multiple near-contemporaneous batches with highly correlated prefixes, mildly increasing redundancy. [QUARANTINED 2026-04-22T08:19:36Z: supervisor-synth failed after internal CLI name-cache miss; job_id-based poll fallback added post-hoc.]
026	2026-04-22T04:21:24Z	loss	017	017	loss	Anneal label smoothing in lockstep with lr_scale: eps=0.02 during warmup/main training, linearly decays to 0 across the warmdown window so EMA/SWA converges on sharp logits (better GPTQ argmax preservation and sharper TTT start) while early training keeps the baseline regularization.	-0.0008	harness_abort							apg-loss-0020		Baseline uses fixed F.cross_entropy(label_smoothing=0.02). Edit adds LABEL_SMOOTHING_MAX hyper (default 0.02), a non-persistent 0-dim buffer `label_smoothing_eps` on GPT, and a manual CE (log_softmax + gather + uniform term) so eps can be a live tensor. step_fn writes base_model.label_smoothing_eps.fill_(h.label_smoothing_max * lr_scale) each step → eps is 0.02 while lr_scale=1.0 (warmup + pre-warmdown) and decays 0.02→0 across the 72% warmdown. Persistent=False means the buffer isn't in state_dict so warmup-state restore doesn't touch it. Only prior loss trial was exp_009 (z-loss, failed); this is a schedule on an existing loss term rather than a new term. [QUARANTINED 2026-04-22T08:19:36Z: supervisor-synth failed after internal CLI name-cache miss; job_id-based poll fallback added post-hoc.]
027	2026-04-22T04:21:33Z	ttt	017	017	ttt	Halve TTT anchor coefficient 0.01→0.005: with ttt_epochs now 4 (exp_017), each chunk takes 33% more SGD steps than the 3-epoch design, making the anchor term α(p−p0) relatively stronger and over-throttling useful drift — relaxing lets the cosine-over-chunks LR schedule own regularization on its own.	-0.00030	harness_abort							apg-ttt-0020		"Only change: line 178 default 0.01 → 0.005. ttt_lr/ttt_momentum/ttt_chunk_tokens/ttt_epochs unchanged. Rationale: (a) anchor_coef was never explored — single knob in TTT code; (b) exp_017 (3→4 epochs) kept with -0.000413 delta, validating ""more adaptation"" direction. Anchor term is applied after all_reduce with coef scaled by (p-p0); over ~150 chunks with 4 SGD steps/chunk, drift is compounded enough that 0.01 is a strong brake. 0.005 still provides meaningful pullback (cos_lr decay toward 0 on late chunks combined with coef*(p-p0) still stabilizes). Risk: if drift was actually harmful and anchor was correctly pinning, this regresses — but the score-first protocol means drift only affects FUTURE chunks, not current one's eval. [QUARANTINED 2026-04-22T08:19:36Z: supervisor-synth failed after internal CLI name-cache miss; job_id-based poll fallback added post-hoc.]"
028	2026-04-22T04:21:34Z	arch	017	017	arch	Restrict Exclusive-Self-Attention to top 5 decoder layers only (xsa_last_n 11→5): removes XSA's V-direction subtraction from encoder layers (0-2) and looped layers (3-5, each fired 3× under depth recurrence), letting early/middle attention retain full value signal while keeping XSA where feature decorrelation helps most.	-0.0005	harness_abort							apg-arch-0020		Single-line change: Hyperparameters.xsa_last_n default 11→5. XSA subtracts F.normalize(v)·y projection from attention output each call; in the recurrence setup blocks[3..5] get XSA applied on every loop iteration (encoder pass + 3 decoder passes = up to 4× XSA on looped blocks' y), which may over-suppress self-referential attention content. xsa_last_n is an untested axis — every prior trial inherited =11. With num_layers=11, the new value places XSA on blocks 6,7,8,9,10 — exactly the parallel-residual post-loop tail where decorrelating attn and mlp branches matters most. No param-count change; tiny compute saving (XSA off on 6 of 11 blocks). Rebased from best=exp_017. [QUARANTINED 2026-04-22T08:19:36Z: supervisor-synth failed after internal CLI name-cache miss; job_id-based poll fallback added post-hoc.]
029	2026-04-22T04:35:26Z	meta	017	017	meta	Widen Muon momentum warmup fraction 0.33→0.45: delays reaching peak 0.99 momentum so more of the peak-LR phase runs at sub-peak momentum, giving smoother 2nd-moment buildup — the symmetric move vs exp_015's discarded ramp-narrowing (start 0.92→0.94), orthogonal to exp_010's warmdown cosine-cool of momentum.	-0.0004	harness_abort							apg-meta-0029		Only change: MUON_MOMENTUM_WARMUP_FRACTION default 0.33→0.45 (line 154). No code-bytes growth, no model-bytes growth (purely a schedule scalar). Axis untouched by prior meta trials — exp_003/006 touched EMA decay, exp_015 touched the ramp START (narrower ramp, failed), exp_022 touched warmdown_frac (crashed with 020–026 cohort). Rationale: under 72% warmdown the momentum trajectory is never stably pinned at 0.99 — the stream is warmup (0→0.33) → brief peak → warmdown cool (0.28→1.0); widening warmup to 0.45 overlaps the cool more and trades peak dwell for smoother ramp. Note on risk: exp_015's failure at the symmetric narrow direction is weak but present evidence that the current ramp timing isn't the local optimum; EV modest (-0.0004). [QUARANTINED 2026-04-22T08:19:36Z: supervisor-synth failed after internal CLI name-cache miss; job_id-based poll fallback added post-hoc.]
030	2026-04-22T04:35:31Z	arch	017	017	arch	Switch MLP from non-gated silu-squared (Primer-style) to 2-projection SwiGLU (silu(fc(x)) * fc2(x), Llama/Mistral standard) with hidden=1344 (2/3 * mlp_mult * dim, 32-aligned) so total MLP params stay ~neutral (slight -360K decrease); input-dependent gating should be more expressive per-parameter than a fixed pointwise nonlinearity.	-0.0015	harness_abort							apg-arch-0029		MLP: hidden 2048 → 1344 (2-proj gated). Params per unique MLP: 2*512*2048=2.10M → 3*512*1344=2.06M. Replaces `F.silu(fc(x)).square()` (single-proj non-gated Primer variant) with `F.silu(fc(x)) * fc2(x)` (SwiGLU). `classify_param` puts the new fc2.weight in the 'mlp' bucket via the `.mlp.` substring match, so Muon+row-normalize picks it up uniformly. Naming: kept `self.fc` + added `self.fc2` to minimize diff; `self.proj` keeps `_zero_init=True`. Per-channel mlp_scale is unchanged (dim-sized). No data-path or quant-path interactions: fc2 is a plain CastedLinear and gets orthogonal init via `_init_weights` (shape 1344×512, both ≥64). Expected direction: SwiGLU has been shown to beat non-gated variants across Llama-scale training budgets at matched params; squared-activation is non-standard outside Primer. Risk: slight under-parametrization of the MLP at our mini scale could make the gate less effective than the ReLU²-like sharp activation. Size should improve by ~150KB vs baseline. [QUARANTINED 2026-04-22T08:19:36Z: supervisor-synth failed after internal CLI name-cache miss; job_id-based poll fallback added post-hoc.]
031	2026-04-22T04:35:31Z	ttt	017	017	ttt	Enable Nesterov momentum on the TTT SGD optimizer (nesterov=True) — the look-ahead gradient gives effectively-second-order acceleration on the chunk-local, approximately-convex TTT objective where we run only 4 inner epochs per chunk, at zero extra compute and no memory delta vs heavy-ball SGD.	-0.0008	harness_abort							apg-ttt-0029		One-line change to the TTT optimizer constructor: add nesterov=True (default dampening=0 satisfies Nesterov's constraint). All other TTT hypers identical to exp_017 (ttt_lr=0.005, ttt_epochs=4, ttt_momentum=0.9, ttt_chunk_tokens=65536, cosine-over-chunks LR). Rationale vs prior TTT trials: exp_014 and exp_017 both explored epochs count (kept, diminishing returns); exp_027 tried anchor regularization (crashed). The SGD→Nesterov axis has never been touched. Heavy-ball with momentum=0.9 and only 4 epochs per chunk underconverges; Nesterov evaluates the gradient at the already-momentum-advanced point, which (a) adds no grad-eval cost, (b) reduces the effective condition-number dependence, and (c) is especially useful in few-step regimes where momentum would otherwise overshoot the optimum. Grad clip at 1.0 is already in place to cap any overshoot. [QUARANTINED 2026-04-22T08:19:36Z: supervisor-synth failed after internal CLI name-cache miss; job_id-based poll fallback added post-hoc.]
032	2026-04-22T04:35:34Z	tok	017	017	tok	Switch tied tok_emb init from normal_ to trunc_normal_ at ±2σ (PaLM/T5/BLOOM standard): same std=0.005 but clip extreme tail rows that inflate GPTQ clip_sigmas and cause early CE spikes on rare tokens.	-0.0005	harness_abort							apg-tok-0029		Only change: _init_weights (line 648) replaces nn.init.normal_ with nn.init.trunc_normal_ at a=-2*std, b=+2*std on tok_emb. std unchanged (0.005). Rationale: exp_011 showed larger init std → size_blocked (outlier rows inflate quantization range), so tighter tails should marginally help compression AND give a smoother tied-softmax start. Unrelated to exp_019 (equi-row-norm, which flattened every row to identical norm — this only clips outliers, preserves the natural norm distribution). Expected delta small (-0.0005) because the network quickly washes out init; main value is stability + compression headroom. [QUARANTINED 2026-04-22T08:19:36Z: supervisor-synth failed after internal CLI name-cache miss; job_id-based poll fallback added post-hoc.]
033	2026-04-22T04:35:34Z	reg	exp_017	017	reg	NEFTune: inject uniform noise U(-α/√(T·D), α/√(T·D)) with α=5 on post-RMSNorm token embeddings during training only (disabled at TTT); a well-literature-validated regularizer not previously tried in this tree (exp_012 tried token replacement, which is structurally different).	-0.0015	harness_abort							apg-reg-0020		Only reg prior (exp_012, token replacement) was size_blocked, so this direction is largely unexplored. NEFTune's noise is tiny in absolute terms (~5/sqrt(2048*512) ≈ 0.0049 = 0.5% of unit-RMS post-norm activations), so I expect modest weight-entropy increase; headroom is ~180KB so a size_blocked outcome is a plausible (but informative) failure mode. Added self.neftune_alpha to GPT; gated in forward_logits on `self.training and neftune_alpha>0`; explicitly cleared to 0 at eval_val_ttt entry to preserve TTT's deterministic per-chunk anchor-pullback regime. Main-train torch.compile traces the noise branch with training=True (self.training specialization cached separately), pre-quant eval re-traces with training=False so noise is dead-code eliminated; TTT scoring uses compiled_logits in eval mode so no noise there either, and TTT inner-train base_model(x,y) is uncompiled so the dynamic neftune_alpha=0 takes effect immediately. [QUARANTINED 2026-04-22T08:19:36Z: supervisor-synth failed after internal CLI name-cache miss; job_id-based poll fallback added post-hoc.]
034	2026-04-22T04:35:35Z	loss	017	017	loss	Position-weighted training CE (linspace 0.5→1.5, mean-preserving) upweights long-context positions to align the train loss distribution with the sliding-window stride-64 eval where every scored token has ≥1984 ctx.	-0.0010	harness_abort							apg-loss-0029		"Training forward() replaced fixed reduction=""mean"" with reduction=""none"" × linear pos_weight. Pos_weight is torch.linspace(0.5, 1.5, T) so mean(w)=1 preserves gradient scale vs uniform CE. Rationale: eval metric computes BPB only on windows with context_size=seq_len-stride=1984, so training signal at positions 0..~500 (where context is bigram-dominated) is distributionally different from eval and effectively noise relative to what matters. Upweighting late-ctx tokens 3× more than early ones should concentrate gradient on eval-matching positions without starving any position entirely. Distinct from exp_013 (curr, hard-mask first 32) which was size_blocked; this is a soft reweight, adds ~10 lines of code and no parameters. Distinct from exp_009 (z-loss, discarded) and exp_026 (anneal-eps, crashed) — both were output-distribution regularizers; this one is a positional importance reweighting. [QUARANTINED 2026-04-22T08:19:36Z: supervisor-synth failed after internal CLI name-cache miss; job_id-based poll fallback added post-hoc.]"
035	2026-04-22T04:35:36Z	quant	017	017	quant	Shrink GPTQ block_size 128→32: 4× more error-propagation events per matrix (16 vs 4 for 512-col weights) finer-grained redistributes accumulated quant error via Hinv, expected small bpb win at size-neutrality (codes stay in [-31,+31] so brotli entropy ~unchanged).	-0.0003	harness_abort							apg-quan-0029		One-line change: gptq_quantize_weight default block_size 128→32 (line 930). Rebased to exp_017 first to get a clean baseline (exp_016 damping change and exp_020 s_opt change were both lingering in my workdir). Chose block_size because the quant branch history shows code-entropy changes (exp_004/008) blow size; damping changes (exp_016) regress; s_opt refinement (exp_020) crashed — block_size is the one remaining GPTQ hyperparameter with a published quality lever and no size impact. Literature: QUIP/SpQR/AWQ-GPTQ all report small consistent gains from block_size<128 on low-bit settings; Frantar 2022's 128 default was a speed compromise for billion-param models. Codes retain same clip_range and per-row scale, so brotli+byte-shuffle compression should be within a few KB of baseline. GPTQ runtime goes up ~4× on the inner boundary loop but total per-matrix GPTQ cost is still sub-second — fits well inside the 600s eval budget. [QUARANTINED 2026-04-22T08:19:36Z: supervisor-synth failed after internal CLI name-cache miss; job_id-based poll fallback added post-hoc.]
036	2026-04-22T04:35:36Z	opt	017	017	opt	Cosine-anneal grad_clip_norm in lockstep with LR warmdown (0.3 → 0.15 at end): in the low-LR tail, LR no longer masks outlier gradient spikes, so tighter clipping preserves the smooth trajectory that EMA (decay=0.998) averages.	-0.0004	harness_abort							apg-opt-0029		One-line schedule on grad_clip_norm: clip = h.grad_clip_norm * (0.5 + 0.5 * lr_scale). Mirrors exp_010's Muon momentum cooling philosophy applied to a new knob (exp_010 kept, Δ=-0.000109). During hold and warmup lr_scale=1.0 → clip_scale=1.0, i.e. baseline behavior. Only changes warmdown: cosine-decays clip from 0.3 to 0.15. Runs outside torch.compile (step_fn is eager), no state, no param_groups change. Expected mechanism: fewer spurious large updates in the refinement phase → cleaner EMA samples. [QUARANTINED 2026-04-22T08:19:36Z: supervisor-synth failed after internal CLI name-cache miss; job_id-based poll fallback added post-hoc.]
037	2026-04-22T04:35:39Z	eval	017	017	eval	Cosine-cool TTT SGD momentum (0.9→0) across chunks in lockstep with the existing cos_lr schedule, so late low-LR chunks run nearly pure-SGD without stale velocity from early high-LR chunks (mirrors exp_010's Muon momentum cool pattern).	-0.0002	harness_abort							apg-eval-0029		"Single localized change in eval_val_ttt: factor cos_frac = 0.5*(1+cos(pi*ci/(N-1))) out of the LR computation, then set pg[""momentum""] = h.ttt_momentum * cos_frac alongside pg[""lr""]. The SGD optimizer's velocity buffer persists across chunks (it's constructed once outside the chunk loop); cooling its blend factor means mid/late chunks progressively discount stale velocity from high-LR early chunks. At ci=0 momentum=0.9 (baseline), at ci=N-1 momentum=0 (pure SGD step, though cos_lr=0 there anyway so it's moot). Mid-chunks see 0.45 momentum — more responsive to recent gradients, less inertia across the distribution-shift front. No time/memory cost, no code-size change (+6 LOC, smoke code_bytes=21625 ok vs 16MB cap). [QUARANTINED 2026-04-22T08:19:36Z: supervisor-synth failed after internal CLI name-cache miss; job_id-based poll fallback added post-hoc.]"
