exp_id	timestamp	specialist	parent_exp	baseline_exp	domain	hypothesis	expected_delta	status	val_bpb	delta_vs_best	artifact_bytes	train_s	eval_s	total_s	job_name	snapshot_path	notes
376	2026-04-23T01:00:16Z	loss	336	336	loss	Steeper linear position-weighted CE (linspace 0.85->1.15, mean-preserving, +-15% span) — probes the untested SPAN axis of the proven monotonic-ramp family (prior shape tests at +-10% span: linear kept in exp_156/176, convex u^2 kept in exp_186, concave sqrt size_blocked in exp_360).	-0.00015	discard	1.074810	+0.000639	15997937	600.031000	769.969000	1481.000000	apg-loss-0371		Single-site edit to GPT.forward on top of exp_336. Replaces plain CE reduction=mean with mean-preserving per-token linear weight pw = torch.linspace(0.85, 1.15, T) broadcast over batch. Shape axis explored at +-10% (linear/u^2/sqrt); span axis not probed. Linear gave largest isolated kept delta (-0.000200 exp_156). Mean-preserving keeps aggregate gradient magnitude identical to plain CE — no LR retune. Zero new parameters, ~0 runtime cost.
377	2026-04-23T01:02:45Z	quant	336	336	quant	"Lower GPTQ multiplicative Hessian damping 1.02→1.01 (−50% damping strength): pure scalar downward probe on exp_280's winning multiplicative-damping scheme — never directly A/B'd. Multiplicative damping under-damps low-H bulk columns by design (1.02·H_ii adds only 0.02·H_ii ridge), so halving the factor preserves more genuine Hessian curvature for error-propagation on the bulk of columns while still proportionally ridge-regularising high-H sink columns. Size-neutral (scalar literal only).</hypothesis> <parameter name=""notes"">Single-literal edit at train_gpt.py:1032 (H.diagonal().mul_(1.02) → 1.01). Rationale: exp_280's 1.02 kept (Δ=-0.000054) but the scalar axis has been completely unexplored since — all post-280 quant trials were structural (progressive ramp exp_290, per-category exp_301, off-diag shrinkage exp_348, per-row Hessian-weighted sigma exp_358, block_size exp_368, pos-weighted H exp_339). Under multiplicative damping, a column with H_ii = 0.1·mean gets a ridge of only 0.002·mean, while H_ii = 10·mean gets 0.2·mean — so the 1.02 factor effectively damps only the high-activation tail. Lightening to 1.01 reduces over-damping on the tail without meaningfully changing bulk-column conditioning. Size risk: damping tune doesn't change Q distribution structurally (same int6 codes, same per-row fp16 scales, just slightly different error-redistribution magnitudes); empirical comparators (exp_290, exp_301, exp_348) all produced valid runs, none size_blocked. Expected Δ uncertain in sign — this is a probe to determine the scalar-axis curvature around 1.02." -0.0001 keep 1.074087 -0.000084 15999822 600.072000 765.928000 1477.000000 apg-quan-0372 snapshots/377_quant 
378	2026-04-23T01:03:25Z	eval	336	377	eval	Apply logit temperature T=0.97 (3% sharpening, divide logits by 0.97) inside eval_val_ttt scoring pass only — symmetric opposite of exp_044 (T=1.05 softening → Δ=+0.002607) on the hypothesis that GPTQ-int6 flattens output distributions and optimal T<1.	-0.0010	discard	1.075124	+0.001037	15999543	600.142000	771.858000	1483.000000	apg-eval-0371		Single-site edit at eval_val_ttt line ~1367 (scoring CE only). Touches ONLY the torch.no_grad() scoring branch; TTT SGD training branch (base_model(x,y)) is untouched. Zero size impact (arithmetic-only change). First-order CE derivative dL/dT at T=1 ≈ +0.052 bpb/ΔT (inferred from exp_044's Δ=+0.002607 at ΔT=+0.05), so the improving direction is T<1. Chose T=0.97 conservatively; T=0.95 would be bolder. Expected second-order curvature reduces -0.0016 leading-order to ~-0.0010 realistic.
379	2026-04-23T01:04:27Z	curr	336	377	curr	Alternate Weyl multiplier across shard-epochs (golden φ⁻¹≈0.618 on even epochs, silver √2−1≈0.414 on odd) in _reset_shard to decorrelate consecutive-epoch within-shard visit orders: both irrationals give valid low-discrepancy sequences, and silver ≠ 1−golden so the two orders are structurally different (not just reverses).	-0.0002	size_blocked	1.076365		16002271	600.097000	768.903000	1473.000000	apg-curr-0372		Single-site edit in ShuffledSequenceLoader._reset_shard at line 391-398. Changes the Weyl-multiplier 0.618 to branch on `self._phase_epoch[si] % 2`. Zero-compute, entropy-neutral (same set of start_inds, different order). History: exp_142 KEPT (8-phase latin-square) and exp_196 KEPT (largest-remainder shard sampling) are preserved. Exp_279 (phase-level Weyl) discarded. Exp_185/247 (random jitter) discarded. Exp_162/333/354 (deterministic VdC) discarded. This idea is orthogonal: keeps the existing golden-Weyl visit on even epochs (the current kept direction) and ADDS a different ordering on odd epochs. Risk: size_blocked possible if different gradient trajectory changes weight entropy (low risk — same tokens, just different order).
380	2026-04-23T01:06:21Z	tok	336	377	tok	Swap F.rms_norm → F.layer_norm at the post-tok_emb / embed_scale gauge-fix site: adds mean-centering alongside variance-normalization, stripping any DC/unigram direction from tok_emb rows before the residual is frozen as x0 and replicated through every decoder via skip_weights.	-0.0004	discard	1.076894	+0.002807	15999038	600.160000	773.840000	1483.000000	apg-tok-0372		Single-site edit at train_gpt.py:743: F.rms_norm(x*embed_scale, (D,)) → F.layer_norm(x*embed_scale, (D,)). Zero params, zero model-bytes delta. Gauge-fix from exp_298 is preserved — LayerNorm is still variance-normalizing on a unit-mean-output surface, so embed_scale still lives on the gauge-fixed relative-weighting manifold. Novelty vs history: exp_058 proposed the same swap but was harness-quarantined pre-run (internal CLI name-cache bug); it also targeted a pre-embed_scale baseline. Here the swap lives on the current best (exp_336) which has the gauge-fixed embed_scale — a distinct operating point. Mechanism: during 600s of training the tied tok_emb rows typically develop a shared offset (the unigram direction): this offset enters the residual, becomes x0, and is carried into every decoder block via the skip pathway with per-feature skip_weights modulation. Mean-centering at the entry removes that DC carrier, so skip_weights only route token-specific deviation. Functional eps default (1e-5) is close to rms_norm's default; bfloat16 path unchanged. No classifier-side change, so GPTQ state_dict layout is identical and the ~15.78MB quantized artifact should round-trip unchanged.
381	2026-04-23T01:11:17Z	arch	336	377	arch	Recurrence-aware x0-INJECTION correction (orthogonal to exp_245): for looped blocks [3..5], scale the mix[1]*x0 embedding-injection term in Block.forward by 1/(num_loops+1)=1/3 so the per-forward TOTAL x0 contribution of a looped block equals that of a single-call block; exp_245 damps attn/MLP OUTPUTS via ln_scale_factor but leaves the residual-stream x0 injection at 3× magnitude.	-0.0003	eval_budget_overrun	1.077273			600.081000	784.919000	1491.000000	apg-arch-0372		Two-site edit. Block.__init__: new attribute self.x0_scale = 1.0 (Python float, constant-folded by torch.compile). Block.forward: x_in = mix[0]*x + self.x0_scale * mix[1] * x0. GPT.__init__: after exp_245's ln_scale block, set self.blocks[i].x0_scale = 1.0/(num_loops+1) for i in [loop_start..loop_end]. Zero new params, zero model bytes. Magnitude (1/N) rather than variance (1/sqrt(N)) scaling because x0 is the SAME tensor across the N calls, so contributions are perfectly correlated, not independent. Tried landscape: all prior loop-scaling knobs (exp_245 kept, exp_306 discard, exp_254 discard) touched attn/MLP output paths, not x0 injection.
382	2026-04-23T01:25:13Z	ttt	336	377	ttt	Cosine-cool TTT SGD momentum 0.9 to 0.5 in lockstep with cosine LR schedule over chunks.	-0.00015	discard	1.074589	+0.000502	15999971	600.152000	761.848000	1473.000000	apg-ttt-0376		Single-site edit in eval_val_ttt per-chunk adaptation block (~line 1388). Adds cos_mom = 0.5 + (m-0.5)*cos_factor and sets pg[momentum] alongside pg[lr]. Axis: exp_037 proposed 0.9 to 0 direction but harness_aborted. exp_039 tested UP (0.9 to 0.95) and was discard, so DOWN direction is formally untested on current stack (Nesterov since exp_151, fwd/rev alternation from exp_264). Using conservative floor 0.5 not 0 to avoid extrapolation. Zero size cost; negligible compute.
383	2026-04-23T01:25:23Z	opt	336	377	opt	Tighten muon_momentum_warmup_fraction 0.22→0.15: shortens the 0.92→0.99 ramp so peak momentum lands earlier and the peak-momentum × peak-LR coupling window grows from ~6% to ~13% of budget — never-probed DOWN direction on this axis (exp_029 only tested UP to 0.45, harness_abort).	-0.0005	discard	1.074985	+0.000898	15999407	600.082000	746.918000	1454.000000	apg-opt-0376		Single-literal edit at train_gpt.py:157 (MUON_MOMENTUM_WARMUP_FRACTION default 0.22→0.15). Ramp still completes before warmdown (frac=0.28), so exp_010's cool-during-warmdown lockstep is preserved. Avg momentum over peak-LR phase (frac 0..0.28) rises from ~0.962 to ~0.971 — modest but directionally toward more Muon look-ahead during hot learning. Axis map: exp_015 probed start 0.92→0.94 UP (discard +0.0018); exp_029 probed fraction 0.33→0.45 UP (harness_abort, unvalidated); DOWN direction on fraction never tested. Trajectory change is mild so GPTQ-size risk is low (unlike exp_373's nesterov switch which size_blocked).
384	2026-04-23T01:27:38Z	meta	exp_336	377	meta	Lower muon_momentum_warmup_start 0.92→0.90 (DOWN direction, mirror of discarded exp_015 UP): widens the warmup ramp span from 0.07 to 0.09 across the same 22% time-fraction, giving gentler momentum early when gradients are high-variance	-0.0003	discard	1.075066	+0.000979	15999454	600.009000	766.991000	1480.000000	apg-meta-0376		Single-literal edit at train_gpt.py:152 (MUON_MOMENTUM_WARMUP_START 0.92→0.90). Pure trajectory change — cannot affect artifact size (final weights still GPTQ'd). Axis map: exp_015 tried UP (0.92→0.94) discard Δ=+0.001810; DOWN direction completely untested. Complements exp_324's kept Muon-momentum warmdown floor at 0.9375. Start=0.90 matches typical nanoGPT-speedrun configs. Keeps 0.22 warmup fraction so momentum still reaches 0.99 before warmdown begins at frac=0.28.
385	2026-04-23T01:30:11Z	reg	336	377	reg	Lower muon_wd_qk 0.115 → 0.095 (match attn c_v/proj group): Q/K outputs are RMS-normed before SDPA so row-norms are absorbed, making MLP-matched WD over-regularize direction diversity. Symmetric DOWN test mirroring exp_336's MLP WD win.	-0.00008	discard	1.074447	+0.000360	15998627	600.032000	769.968000	1476.000000	apg-reg-0379		Single-literal edit at train_gpt.py:179 (MUON_WD_QK default 0.115 → 0.095, -17%). Affects only attention c_q, c_k Muon param group (group[2] in optimizer_muon). Three-group Muon remains: attn c_v+proj=0.095, mlp=0.115, qk=0.095 now (merges QK back to attn rate). Rationale: post-c_q/c_k F.rms_norm in CausalSelfAttention.forward (line 553-554) kills row-scale signal, so Muon WD's uniform row-shrink can only affect column-pattern / direction diversity — 0.115 (matching dense-output mlp params) may over-suppress useful Q/K direction variance. Axis map: exp_164 split mlp↑attn DOWN, exp_336 mlp DOWN keep Δ=-0.000109, exp_375 introduced QK split at 0.115 size_blocked, exp_374 attn UP size_blocked. QK DOWN direction untested. Expected ≈ exp_336 magnitude. Zero size risk (no new params, no new code paths).
386	2026-04-23T01:31:44Z	loss	exp_336	377	loss	Re-introduce exp_186's convex u^2 position-weighted CE (pw = 0.9 + 0.2*u^2, mean-preserved) onto current best — the kept improvement was inadvertently dropped by exp_190's forward() refactor and has been missing from the best chain since.	-0.00005	size_blocked	1.074780		16001302	600.066000	792.934000	1504.000000	apg-loss-0380		"Confirmed via diff_snapshots(186, 190): exp_190 tok specialist replaced the whole GPT.forward method with plain reduction=""mean"" CE, discarding exp_186's convex (u^2) position weighting. Every subsequent best (190→196→...→336) inherits the plain form. The position-weighted form was validated 3x (exp_156 linear, exp_176 stacked linear, exp_186 convex) at span ±10% with mean-preserving normalization — size-safe, zero-param, zero-inference-cost. exp_376 recently showed span ±15% is too much on current baseline, so staying at ±10% (as exp_186 did) is the right span."
387	2026-04-23T01:32:07Z	quant	exp_377	377	quant	Halve GPTQ multiplicative Hessian damping 1.01→1.005 (scalar-downward continuation of the monotonic winning trajectory exp_280 1.02→exp_377 1.01).	-0.00005	size_blocked	1.074465		16002147	600.099000	749.901000	1455.000000	apg-quan-0381		Single-literal edit at train_gpt.py:1036. H.diagonal().mul_(1.01)→H.diagonal().mul_(1.005). Axis history: exp_212 additive 0.01→0.02 kept Δ=-0.000224; exp_280 additive→multiplicative 1.02 kept Δ=-0.000054; exp_377 mult 1.02→1.01 kept Δ=-0.000084. All three downward damping steps kept — continuation probes whether we've reached the minimum. At 1.005, multiplicative damping adds only 0.5% to diag, keeping max curvature on high-H sinks while under-damping bulk. If discard, we've bracketed; if keep, axis still has room. Zero size risk (scalar edit).
388	2026-04-23T01:34:25Z	eval	377	377	eval	Cosine-cool TTT SGD momentum 0.9→0.3 in lockstep with the existing cosine LR decay across eval chunks — orthogonal schedule axis never probed (exp_037 was harness_abort)	-0.00015	discard	1.074463	+0.000376	15999178	600.069000	755.931000	1467.000000	apg-eval-0381		"Single-site edit in eval_val_ttt at the TTT chunk-loop LR-assignment block (around L1390-L1394 post-edit). Changed cos_lr assignment to also anneal `pg[""momentum""]` using the same cos_frac = 0.5*(1+cos(pi*ci/(num_chunks-1))) schedule, mapped onto [0.3, h.ttt_momentum=0.9]. Floor 0.3 keeps momentum strictly positive so nesterov=True remains well-defined (PyTorch SGD with nesterov requires momentum > 0). History: momentum-scalar axis tested UP (exp_039 0.9→0.95 discard) but never as a schedule; LR schedule axis already cosine (baseline). No change to training loop, no change to parameter count, no change to artifact size. Rationale: late chunks at low cos_lr have the model already well-adapted to val distribution; high momentum there propagates stale gradients from earlier chunks' still-large-update regime into the low-update regime, potentially pushing past local optima. Cooling momentum lets late-chunk updates act more locally. Keeps early-chunk full-momentum trajectory smoothing intact. Zero train-time impact; eval-only pathway through eval_val_ttt SGD branch (scoring branch untouched, TTT_ENABLED=1 injected by harness)."
389	2026-04-23T01:35:05Z	tok	377	377	tok	Orthogonal init for tied tok_emb [V=8192, D=512] with gain=std*sqrt(V)≈0.452: decorrelates the 512 column-features exactly at init (columns orthonormal) while preserving expected per-row L2≈std*sqrt(D). Structurally distinct from exp_019 (row-norm equalized, Gaussian cols) and exp_032 (trunc_normal).	-0.0005	discard	1.075806	+0.001719	15997438	600.065000	766.935000	1476.000000	apg-tok-0381		Single-site edit at GPT._init_weights (line 723). Replaces nn.init.normal_(tok_emb.weight, std=0.005) with nn.init.orthogonal_(tok_emb.weight, gain=0.005*sqrt(8192)). Tied embedding so both input-lookup and output-softmax start with exactly orthonormal feature columns (512 decorrelated directions) rather than asymptotically-orthogonal Gaussian. Row-norm preserved in expectation. Zero params / zero compressed bytes; init-time only. Axis untouched by tok tree: covariance structure of the init distribution (row-norm uniformity was exp_019, tail-clipping was exp_032, std-scalar was exp_038).
390	2026-04-23T01:37:39Z	curr	377	377	curr	Replace random 8-permutation phase_order with bit-reversed [0,4,2,6,1,5,3,7] rotated by shard-index: guarantees the 2-3 phase buckets actually used per shard (600s budget = ~2-3 epochs) are maximally spread (k=2 → 1024-token gap; k=3 → equispaced at 0/512/1024) rather than unluckily adjacent under random permutation.	-0.00015	eval_budget_overrun	1.078106			600.018000	793.982000	1506.000000	apg-curr-0381		Single-site edit to ShuffledSequenceLoader.__init__ (train_gpt.py line ~367). Replaces `self._phase_order = [self.rng.permutation(8).tolist() for _ in self.files]` with a bit-reversed list [0,4,2,6,1,5,3,7] rotated by shard-index `si`. Per-shard `+si` rotation preserves the inter-shard randomness that exp_354's shared-VdC lost. Entropy-neutral: same set of phase buckets and same training tokens — only the prefix-visit order changes. Unlike exp_370 (loss mask, size_blocked) and exp_379 (Weyl alternation on sequence_order, size_blocked), this touches only the phase-bucket permutation prefix for ~2-3 epochs per shard, so the weight-distribution perturbation is much smaller and size_blocked risk is low. Orthogonal to exp_142 (which introduced phase cycling via random permutation — this replaces the random permutation with a deterministic low-discrepancy one). Axis map: exp_142 introduced the 8-bucket phase cycle (kept, Δ=-0.000028); exp_196 added stratified shard sampling (kept, Δ=-0.000087); exp_354 tried phase-level VdC with homogenized-across-shards pattern (failed). Untouched: sequence_order permutation inside a shard (still `rng.permutation`), shard-sampling stratification.
391	2026-04-23T01:43:25Z	arch	377	377	arch	Init resid_mix[1] (embedding-injection x0 mix) to 0.08*ones(dim) instead of zeros across ALL blocks: activates the direct x0 to residual pathway at step 0, providing gradient flow to tied tok_emb from the start rather than forcing mix[1] to lift off zero via indirect signal.	-0.0005	discard	1.074289	+0.000202	15998926	600.016000	754.984000	1471.000000	apg-arch-0382		Single-line init edit at Block.__init__. resid_mix shape [2,dim]: mix[0]=ones, mix[1] zeros to 0.08*ones. Under tied embeddings gradient for mix[1] flows DIRECTLY back to tok_emb each block. Zero new params, zero bytes delta, no forward/compile changes.
392	2026-04-23T01:53:55Z	ttt	377	377	ttt	Zero SGD momentum buffer at each TTT chunk boundary (keep 0.9 coefficient): decouples per-chunk adaptation so cos_lr schedule's ~0 late-chunk LR is not polluted by velocity accumulated under high early-chunk LR. Mechanism-distinct from exp_382 which cooled the coefficient.	-0.0003	size_blocked	1.075354		16000314	600.151000	755.849000	1465.000000	apg-ttt-0385		Single-site edit at eval_val_ttt just after cos_lr assignment (~line 1394). Iterates optimizer.state and zeroes 'momentum_buffer' tensor in-place at each chunk start. Within-chunk momentum smoothing (0.9, Nesterov) preserved across the 4 SGD steps; only cross-chunk carry-over killed. Zero params delta; tiny per-chunk overhead (one tensor.zero_() per param × 15 chunks).
393	2026-04-23T01:54:17Z	opt	377	377	opt	Raise ema_decay 0.9965 → 0.998 on the current best: revives exp_003's isolated keep (Δ=-0.000776) that never merged into the best lineage, validated-upper-bound by exp_006 (0.999 was worse).	-0.00020	discard	1.076076	+0.001989	15999878	600.078000	685.922000	1389.000000	apg-opt-0385		Single-literal edit at train_gpt.py:174 (EMA_DECAY default 0.9965→0.998). Half-life widens from ~198 steps (~4% of run) to ~347 steps (~7% of run), capturing more of the deep warmdown tail. Rationale for re-probing on current best: the stack now includes exp_010 (cosine-cool Muon momentum during warmdown) and exp_324 (floor mm_blend at 0.25) — both increase late-tail update noise, which a longer EMA window dampens more effectively than at the old 0.9965 baseline. Zero parameter/byte delta; interaction risk low since EMA is computed post-step and applied only at final weights.
394	2026-04-23T01:58:11Z	meta	377	377	meta	Lower Muon peak momentum 0.99 to 0.985 (untested core knob across 384 trials)	-0.0002	discard	1.074428	+0.000341	15999150	600.124000	758.876000	1465.000000	apg-meta-0388		
395	2026-04-23T01:59:23Z	reg	377	377	reg	Warmdown-aware Muon weight-decay boost: scale all 3 Muon-group WDs by (1 + 0.3*(1-lr_scale)) so effective per-step shrinkage decays sub-linearly with LR during the 72% warmdown tail — mirror of exp_010's momentum cooling, proportional across attn/mlp/qk groups (preserves exp_164/exp_336 ratio).	-0.0004	size_blocked	1.075059		16001511	600.048000	755.952000	1467.000000	apg-reg-0388		"Two-site edit. (1) Optimizers.__init__: store group[""base_wd""] = group[""weight_decay""] alongside base_lr for all 3 Muon groups. (2) step_fn: after computing lr_scale, compute wd_scale = 1 + (1-lr_scale)*0.3 and write group[""weight_decay""] = group[""base_wd""] * wd_scale. Hardcoded boost=0.3. At warmup/peak (lr_scale=1): identity. At warmdown end (lr_scale=0): wd x1.3, so effective shrinkage lr*wd decays as (1-f)*(1+0.3f) instead of (1-f), flattening envelope in [f~0.5]. Zero param/model-bytes delta — wd group dict is python-visible to Muon.step (not torch.compiled). Orthogonal to all prior reg WD-scalar tweaks (exp_141 depth, exp_164 type, exp_336 mlp, exp_385 qk). Completely untried axis (time-varying Muon WD)."
