exp_id	timestamp	specialist	parent_exp	baseline_exp	domain	hypothesis	expected_delta	status	val_bpb	delta_vs_best	artifact_bytes	train_s	eval_s	total_s	job_name	snapshot_path	notes
130	2026-04-22T11:25:59Z	tok	108	108	tok	Switch tied tok_emb init from normal_ to trunc_normal_ at ±2σ (PaLM/T5/BLOOM standard): same std=0.005 but clips outliers that force wider GPTQ per-row scales and bias rare-vocab initial directions that barely move in a <1-epoch run.	-0.0003	discard	1.076932	+0.000067	15989225	600.016000	756.984000	1477.000000	apg-tok-0120		Revives exp_032 which was harness_abort — never actually executed on GPU. Single-site edit at _init_weights (train_gpt.py:650-654). Zero change to model structure, hyperparameters, optimizer, or eval path; only the sampling distribution for tok_emb init changes. Clips ~4.6% of row entries (the tails past ±2σ), concentrating mass within ±0.010 instead of a heavy-tail Gaussian. GPTQ int6 per-row scale s_r = clip_sigmas * row_std / 31 — trimmed tails should leave row_std barely changed at init but reduce asymmetric outlier pressure on rare-vocab rows that never drift far from init. Worst case: near no-op (well-trained rows wash out init shape); best case: marginal compression + cleaner quantization for long-tail rows. Orthogonal to exp_019's sphere init (that equi-normalized row norms; this keeps Gaussian shape but truncates tails). Size: trivial code delta (~60 bytes raw, ~15 after lzma), zero model bytes delta.
131	2026-04-22T11:29:39Z	curr	108	108	curr	"Replace tiled-phase-plus-permutation sequence starts in ShuffledSequenceLoader._reset_shard with fully-random per-sequence uniform starts: same num-sequences per shard epoch, but each sequence gets an independent start anywhere in [0, num_tokens-seq_len-1] instead of phase+k*seq_len — removes per-epoch phase-lock so start-offset coverage is decorrelated across samples.</hypothesis> <parameter name=""notes"">Prior curr tile-overlap experiments (exp_047 halved stride discard +0.001; exp_025 //4 stride abort) tested deterministic OVERLAPPING tiling. This is different — still ~non-overlapping in expectation (expected overlap per shard ≈ seq_len*num_seq/num_tokens ≈ 2048*24k/50M ≈ 1 span), but each sample's start is independent of the shard's epoch-phase. Distinct from exp_122 (shard-stripe removal) which touched the shard SET per rank. Single 6-line mutation in _reset_shard; size-neutral (code 21.9KB)." -0.0003 discard 1.078442 +0.001577 15996367 600.122000 756.878000 1471.000000 apg-curr-0126  
132	2026-04-22T11:30:14Z	loss	108	108	loss	Confidence penalty (entropy bonus) β=0.003: loss = CE − 0.003·H(p) smooths output distributions for robustness to GPTQ int6 weight noise at eval.	-0.0005	discard	1.077189	+0.000324	15996965	600.041000	764.959000	1477.000000	apg-loss-0126		Single-site edit at GPT.forward (lines ~698-703). Fused log_softmax once → NLL + entropy; net forward cost ≈ baseline (drops CE's internal softmax). Training-only auxiliary: zero artifact byte impact, zero eval overhead. Distinct from prior loss trials: exp_009 regularized logsumexp² (z-loss), exp_042 smoothed TARGETS (label smoothing), exp_124 clamped per-token CE (winsorization, catastrophic). This regularizes the OUTPUT distribution directly via Pereyra et al. 2017's confidence penalty. β=0.003 is deliberately conservative — literature uses 0.1-0.3 for NMT; our logit_softcap=30 already saturates peaked distributions so a smaller nudge should suffice without hurting CE accuracy. Key motivation for this tree: eval applies int6 quantization weight noise → logit perturbation. Training with slightly higher-entropy targets = more noise-tolerant token predictions at eval time.
133	2026-04-22T11:30:56Z	ttt	108	108	ttt	Split TTT SGD into two param groups giving tied tok_emb a 3x LR multiplier.	-0.0008	discard	1.077340	+0.000475	15995016	600.072000	756.928000	1476.000000	apg-ttt-0126		
134	2026-04-22T11:32:00Z	arch	108	108	arch	Shift parallel_residual_start 7→9, flipping layers 7,8 from parallel to sequential residual (only final 2 layers stay parallel); sequential residual lets MLP see attn output (more expressive), and reduces the parallel-residual count that exp_107 showed bloats compressed bytes.	-0.0010	discard	1.077810	+0.000945	15990033	600.088000	773.912000	1490.000000	apg-arch-0126		Single-literal change at train_gpt.py:140 (PARALLEL_RESIDUAL_START default 7→9). PARALLEL_RESIDUAL_START is NOT harness-injected so changing the Python default is the effective mutation. Middle-ground test: exp_107 (start=0, all parallel) size_blocked at 1.088; exp_059 (start=11, all sequential) harness_aborted with no signal. 7 vs 9 tests whether shrinking parallel from 4 layers to 2 both improves expressivity (sequential residual chains attn→MLP through the same residual step) and reduces weight entropy (fewer parallel blocks to diversify). Zero parameter-count and zero compute change — all 11 blocks still allocated with same per-block parameters; only the `self.parallel` flag differs for layers 7 and 8. Loop segment [3..5] is entirely within sequential region in both old and new configs, so num_loops/encoder_indices/decoder_indices unaffected.
135	2026-04-22T11:33:07Z	quant	108	108	quant	Per-category GPTQ block_size: 32 for attention projections (c_q/c_k/c_v/c_o), keep 64 for MLP and tok_emb — targets attention's channel-outliers with finer error-propagation granularity while leaving MLP's already-tuned block_size alone.	-0.00015	discard	1.077165	+0.000300	15997427	600.147000	757.853000	1472.000000	apg-quan-0127		"Single-literal change at gptq_mixed_quantize (line 982 area): adds `bs = 32 if "".attn."" in name else 64` dispatch and passes block_size=bs to gptq_quantize_weight. Byte-neutral: same quant codes and fp16 row-scales; block_size only controls GPTQ's error-propagation cadence within a matrix. Rationale: exp_108 proved 128→64 helped (-0.000079); exp_035 tried 32 globally but harness_aborted (no signal). This is targeted — attention projections carry the well-known channel outliers (a few large-magnitude columns per layer), so finer block_size lets GPTQ propagate the clipping error across more adjacent non-quantized columns. MLP's Gaussian-like weights don't benefit similarly, and the 64 baseline is already optimal for them. No change to tok_emb (int8, separate path)."
136	2026-04-22T11:35:36Z	meta	108	108	meta	"Raise AdamW BETA1 0.9→0.95 on the two AdamW groups (tied tok_emb + scalar control tensors): the remaining unexplored corner of the (BETA1, BETA2) landscape after exp_075 (BETA1↓0.8, discard +0.0013), exp_126 (BETA2↑0.97, discard +0.0003) and exp_091 (BETA2↑0.98, discard +0.0020) all hurt.</hypothesis> <parameter name=""notes"">Single-literal default change at train_gpt.py:159 (BETA1 0.9→0.95). Size-neutral, compile-safe. Affects optimizer_tok (tied tok_emb ~4.2M sparsely-updated rows benefit from ~14-step vs ~7-step first-moment EMA) and optimizer_scalar (~100 control tensors: qk_gain, attn_scales, skip_weights/gates, LN scales). Does NOT affect Muon (matrix_params in blocks, uses momentum not betas). Canonical Chinchilla/PaLM/Gemma uses (0.9, 0.95); all three neighbor tweaks in the beta plane hurt, so raising BETA1 is the symmetric untried direction." -0.0003 size_blocked 1.077256  16003979 600.021000 749.979000 1461.000000 apg-meta-0128  
137	2026-04-22T11:44:07Z	eval	108	108	eval	Reduce eval_stride 64→48 (per-scored-token avg context 2015.5→2023.5 tokens, +33% scoring windows) and skip quantized_sliding_window when TTT is enabled (TTT is primary metric; sliding is only the fallback regex) to reclaim the added TTT-scoring cost.	-0.0002	discard	1.076890	+0.000025	15993743	600.090000	715.910000	1436.000000	apg-eval-0128		Two coupled eval-domain edits, baselined on exp_108 (rebased). (1) EVAL_STRIDE default 64→48 at line 163: scored NLL range per window widens from [1984,2047]=64 tokens to [2000,2047]=48 tokens, total window count +33%. Affects both eval_val_sliding and eval_val_ttt scoring uniformly. (2) Guard the quantized_sliding_window timed_eval with `and not h.ttt_enabled` at line 1545 so it is skipped whenever TTT is enabled. run_classify's primary regex matches only `quantized_ttt val_loss: val_bpb:F`; sliding_window fallback only fires when TTT disabled — safe to drop. Budget argument: skipped sliding saves ~60–80s; stride reduction adds ~33% to remaining TTT scoring path (~+60–80s). Net change near zero, with more context per scored token in both TTT score and TTT train paths. Distinct from exp_024 (stride 48→32, harness_abort without conclusion) — smaller step AND combined with the budget-reclaiming skip, so less risk of eval_budget_overrun like exp_127.
138	2026-04-22T11:55:12Z	opt	108	108	opt	Raise Muon peak momentum 0.99→0.995 (untested UP direction; exp_094 tested 0.99→0.97 DOWN and was worse). MuonEq-R row-norm makes orthogonalized update magnitude-invariant, so higher momentum only lengthens effective gradient-history window (~100→~200 steps). Warmdown cool still pulls momentum back to 0.92, so tail refinement unchanged; peak-LR exploration gets wider basin integration.	-0.0003	discard	1.077945	+0.001080	15995041	600.102000	757.898000	1468.000000	apg-opt-0131		Single-literal change at train_gpt.py:150 (MUON_MOMENTUM default 0.99→0.995). Zero code-byte growth. Rebased workdir to exp_108 first (workdir had stale exp_128 defaults: warmup_fraction=0.15). Direction is strictly opposite of known-bad exp_094 (0.99→0.97 discard). exp_120 (Nesterov=off, Δ=+0.079) confirmed high-momentum+Nesterov is load-bearing. With warmdown_frac=0.72 and exp_010 linear cool 0.99→0.92, raising peak to 0.995 widens the warmdown cool range (0.995→0.92) by 0.005 but preserves the warmdown floor unchanged. Effective gradient EMA half-life at peak: ~138 steps (0.995) vs ~69 steps (0.99). With 8 GPUs reaching ~1800-2000 steps in 600s, half-life is well under the steady 28-72% window. Size-neutral, compile-safe.
139	2026-04-22T12:11:27Z	ttt	108	108	ttt	Mask the first half (positions 0..1023) of each TTT training sequence via ignore_index=-100 so TTT gradient comes only from high-context positions, aligning it with the eval distribution where scored tokens always have >=1984 tokens of context.	-0.0004	discard	1.077871	+0.001006	15991903	600.043000	760.957000	1471.000000	apg-ttt-0136		Single-site edit in eval_val_ttt's inner training loop (~line 1312). y = local[1:].reshape(-1, seq_len).clone() (clone to avoid corrupting reused local); y[:, :seq_len//2] = -100. F.cross_entropy in GPT.forward uses reduction='mean' with default ignore_index=-100, so masked positions contribute zero gradient and are excluded from the denominator. Rationale: TTT currently averages CE over all 2048 positions, but scored eval positions (sliding window stride=64) always have context_size=2048-64=1984 tokens of prior context. Training signal from positions 0..1023 (context <=1023) is a structurally different prediction task from what eval measures. Halving the contributing positions concentrates TTT adaptation on the high-context regime that matches the metric. Compute cost: essentially zero — forward pass unchanged, CE mean now over half the positions (slightly cheaper). Eval-budget-neutral. Novel direction: prior TTT trials tuned LR/momentum/epochs/chunk-size/param-groups; none targeted the train/eval distribution mismatch.
140	2026-04-22T12:11:28Z	meta	108	108	meta	Raise min_lr 0.0→0.05 to floor the linear warmdown LR at 5% of peak in the final ~3.6% of training, preserving late-training refinement into the EMA tail (half-life ~200 steps under decay=0.9965) — completely untouched knob in 140 trials.	-0.0002	size_blocked	1.077318		16002706	600.119000	750.881000	1463.000000	apg-meta-0137		Single-literal edit at train_gpt.py:143 (MIN_LR default 0.0→0.05). MIN_LR is NOT a harness-injected env var so changing the Python default takes effect. Zero code-byte growth; zero step-speed impact. With warmdown_frac=0.72 the linear decay lr_mul=(1-frac)/0.72 hits 0.05 at frac=0.964, so only the last ~3.6% of training steps are clipped. EMA_DECAY=0.9965 half-life ~200 steps ≈ 5% of a ~4000-step run, meaning those clipped steps still materially weight the averaged weights. Hypothesis: keeping a small LR alive in that window lets the EMA tail capture continued refinement instead of frozen weights. Risks: (a) floor muddies warmdown convergence and hurts; (b) delta is too small to measure (near-zero). Expected delta −0.0002; acceptable outcome is any net-negative or neutral signal that motivates a follow-up sweep on min_lr ∈ {0.02, 0.05, 0.1}.
141	2026-04-22T12:11:29Z	reg	108	108	reg	Targeted Muon weight-decay hike (muon_wd_recurrent=0.1235, 1.3x muon_wd) on recurrent-segment blocks [loop_start..loop_end] only, since these are traversed (num_loops+1)=3x per forward and receive ~3x more gradient signal per step than non-recurrent blocks — equalizing shrinkage-per-gradient-step is a structurally-motivated split never tried in this tree.	-0.0003	keep	1.076591	-0.000274	15993290	600.072000	754.928000	1469.000000	apg-reg-0134	snapshots/141_reg	Split matrix_params into recurrent (name starts with 3. through 5.) and other; Muon gets two param groups with weight_decay=0.1235 (recurrent, ~25% of matrix params) vs 0.095 (other). Net effective muon_wd is +7.5%, concentrated on the 3 shared blocks. Distinct from exp_077/095 (+21% global hike, discard), exp_118 (QK-specific hike, discard), exp_082 (adam_wd cut). Motivation is WD-per-gradient-step equalization, not raw WD magnitude. Base_lr propagation covered by existing loop. Compile-safe. Size preflight: code=22,258B, total ~15.80MB.
142	2026-04-22T12:11:29Z	curr	108	141	curr	Latin-square deterministic phase cycling in ShuffledSequenceLoader: per-shard, cycle through 8 evenly-spaced phase buckets in a random per-shard order, replacing the per-shard-epoch uniform-random phase choice — reduces phase-coverage variance when a shard only gets 1-3 epochs within the 600s budget.	-0.0003	keep	1.076563	-0.000028	15998305	600.108000	762.892000	1476.000000	apg-curr-0137	snapshots/142_curr	"Two-site edit to ShuffledSequenceLoader: (1) __init__ adds self._phase_epoch=[0]*N and self._phase_order=[rng.permutation(8).tolist()]*N; (2) _reset_shard replaces `phase = int(rng.integers(max_phase+1))` with deterministic bucket selection `phase = k*(max_phase+1)//8` where k cycles through the per-shard random permutation of 8 buckets. Keeps tile structure (stride=seq_len) intact — unlike exp_131 (fully-random per-seq, discard) which destroyed tiling, and unlike exp_047 (stride//2, discard) which doubled samples with overlap. Motivation: with ~1-2 shards/rank and ~1-3 shard-epochs/shard in 600s, uniform-random phase has high variance — 3 random draws from [0,2048) may cluster. Latin-square guarantees the first K visits land in K distinct buckets, stratifying which token-positions act as ""sequence start"" across limited epochs. Novel in tree; curr domain has no keeps yet."
143	2026-04-22T12:11:34Z	arch	108	142	arch	Init resid_mix[1] (x0/embedding injection scale) from 0.0→0.05 per-layer: give every block a weak embedding-bypass channel from step 0 so gradient has informative signal immediately; with 3-layer recurrence (layers 3-5 called 3x) every loop pass sees x0 re-injected consistently from the start.	-0.0006	discard	1.078249	+0.001686	15995059	600.137000	761.863000	1476.000000	apg-arch-0137		Single-site init change at train_gpt.py:547 (resid_mix construction). Zero params added, zero code-byte growth (~80 bytes of comment + literal swap). Gradient is free to drive back to 0 if harmful. Revives the direction of exp_079 (proposed 0.1, harness_abort → never ran) with conservative 0.05 — distinct datapoint. Baseline exp_108 has resid_mix[1]=0 at init. Key assumption: x is accumulated residual with large norm; x0 is rms_norm'd embedding with norm ~1, so 0.05*x0 is a weak perturbation unlikely to destabilize early training.
144	2026-04-22T12:11:47Z	loss	108	142	loss	Focal-style (γ=1) per-token CE reweighting, mean-normalized: w=(1-p_correct) under no_grad, then normalized so focal_w.mean()=1 to preserve overall gradient magnitude (LR schedule stays calibrated). Redirects gradient budget from saturated easy tokens (common function words, trailing punctuation) toward content tokens where ~36M-param capacity is information-limited.	-0.0004	discard	1.085601	+0.009038	15999180	600.029000	770.971000	1484.000000	apg-loss-0136		Structurally distinct from every prior loss trial in the tree. Prior loss trials are all SYMMETRIC token reshapings: exp_009 z-loss (logsumexp penalty across all tokens), exp_042 label smoothing (target-side uniform smear), exp_124 CE clamp(max=7.0) (upper-cap, catastrophic +0.22), exp_132 entropy bonus (output distribution flattening, symmetric). Position-weighting (exp_034) was never executed (harness_abort). Per-token DIFFICULTY reweighting has never been tried. Mechanism: at ~36M params over ~1.5B tokens, easy function-word tokens (articles, punctuation, common affixes) saturate to high p_correct very early in training; their CE gradient contribution then drops to ~0 anyway, but still occupies ~half the mean-normalization denominator. Under focal w=(1-p_correct), these tokens get weight near 0 post-normalization, shifting the effective token budget toward harder content tokens where gradient is still informative. Mean-normalization (divide by focal_w.mean()) is critical: without it, overall gradient magnitude would decay as the model improves (p_correct rises), drifting the LR curriculum. With normalization, gradient SCALE stays fixed and only the PER-TOKEN distribution shifts. no_grad on focal_w ensures no second-order path through p_correct into weights. Risk: with γ=1 and typical p_correct≈0.05 → focal_w≈0.95 for most tokens but ≈0 for the ~30-40% easy tokens, normalization amplifies hard tokens ~1.5-2×, which may increase per-batch loss variance. If variance is an issue, γ=0.5 would soften; γ=2 would sharpen. γ=1 is the standard default and the natural first-test operating point.
145	2026-04-22T12:12:00Z	quant	108	142	quant	Replace GPTQ per-row σ-based SDClip scale (clip_sigmas*row_std/clip_range) with max-abs scale (row.abs().amax()/clip_range): uses full int6/int8 range for every row with zero clipping, ~3× finer quantization bins on non-outlier rows where current clip_sigmas=12.85σ wastes ~70% of int6 range.	-0.0004	size_blocked	1.069273		24663708	600.110000	737.890000	1442.000000	apg-quan-0137		Single-site edit at gptq_quantize_weight lines 948-949. clip_sigmas parameter now unused but kept in signature for API compatibility (still passed by gptq_mixed_quantize). Size-neutral: scale tensor is still [rows] float16. Affects both matrices (int6, clip_sigmas=12.85 removed) and tok_emb (int8, clip_sigmas=20.0 removed) uniformly. Risk: rows with extreme outliers will underutilize bins for bulk weights — but SDClip with clip_sigmas=12.85 already effectively never clipped (~99.99% of rows have max < 12.85σ), so max-abs is strictly higher resolution for the common case. Novel: exp_004/008/045 all refined scales *within* the SDClip framework (α-grids, closed-form post-pass); none replaced the σ-based formula with max-abs. Untried knob.
146	2026-04-22T12:12:47Z	tok	108	142	tok	Add a learnable 8192-dim output logit bias applied AFTER the tanh softcap: frees tied tok_emb rows from encoding unigram frequency via their norms (unconstrained log-prior shifts live in the bias), moving that capacity to directional/semantic content while the softcap still bounds the inner-product term.	-0.001	eval_budget_overrun	1.076864			600.043000	805.957000	1511.000000	apg-tok-0133		Novel tree-wide: exp_023 (harness_abort, never executed) proposed a similar learnable bias but gave no signal. Three-site edit: (1) new nn.Parameter(zeros) of shape [8192] on GPT with dtype=float32; (2) forward_logits adds it AFTER softcap so bias adds unconstrained shifts, softcap still caps inner-product; (3) parameter registered in scalar_params (lr=scalar_lr=0.02, wd=adam_wd=0.02, betas). Size: 8192-elem param → numel<=65536 passthrough branch in gptq_mixed_quantize → fp16 (~16KB raw, ~10-12KB after byte-shuffle+brotli11). Code grew ~400 bytes. Fits headroom (prior art shows ~180KB headroom). Rationale: tied-embed outputs are x·E_j + logit_softcap-bounded; currently tok_emb rows must jointly encode direction AND magnitude (frequency). A dedicated bias gives the unigram prior a free home. At ~36M params and ≤1 epoch, this should free ~0.5-2% of tok_emb capacity for semantics. Post-softcap placement is deliberate: pre-softcap, a large bias magnitude (up to ~log(vocab)≈9) would push the tanh deep into saturation, killing gradient to tok_emb.
147	2026-04-22T12:14:35Z	eval	108	142	eval	Cosine-cool TTT SGD momentum 0.9→0 across chunks in lockstep with the existing cos_lr schedule, so late low-LR chunks effectively do vanilla SGD and the momentum buffer can't carry stale early-chunk grads into the precision-adaptation tail.	-0.00020	discard	1.077407	+0.000844	15992897	600.141000	763.859000	1486.000000	apg-eval-0138		"Revives exp_037 (harness_abort, never ran on GPU). Single-site edit at eval_val_ttt (~line 1296): factor out cos_frac = 0.5*(1+cos(pi*ci/(N-1))) used for both pg[""lr""] = ttt_lr*cos_frac and pg[""momentum""] = 0.9*cos_frac. First chunk keeps current behavior (cos_frac=1.0 → lr=0.005, mom=0.9). Last chunk: lr=0, mom=0. Motivation: exp_039 raised mom 0.9→0.95 and got +0.000178 (worse), indicating less momentum is directionally correct. In the 4-SGD-steps-per-chunk regime, a persistent 0.9 momentum buffer integrates grads from ~10 chunks back — stale in the late tail where cos_lr is tiny. No change to param count, code bytes, or eval compute (just scalar updates per chunk)."
