exp_id	timestamp	specialist	parent_exp	baseline_exp	domain	hypothesis	expected_delta	status	val_bpb	delta_vs_best	artifact_bytes	train_s	eval_s	total_s	job_name	snapshot_path	notes
485	2026-04-23T08:06:26Z	arch	475	475	arch	Add bifurcated k_gain [num_kv_heads, 2] mirroring exp_475's q_gain rope/nope bifurcation on the K side at kv-group granularity: multiplicative reparameterization (product q_gain*k_gain) spans the same effective-gain tensor but gradient decomposes so k_gain moves ~5x faster than q_gain at init, testing implicit-acceleration effect; GQA coupling constrains 2 q-heads in a kv-group to share a k_gain factor.	-0.00008	eval_budget_overrun	1.076961			600.077000	603.200000	1522.000000	apg-arch-0476		"Two-site edit in CausalSelfAttention. (1) __init__: add self.k_gain = nn.Parameter(torch.ones((num_kv_heads, 2), dtype=torch.float32)) right below self.q_gain. (2) forward: symmetrically apply kgain to k in the existing bifurcated branch (k_rope = k[..., :rd] * kgain[..., 0:1]; k_nope = k[..., rd:] * kgain[..., 1:2]) and in the degenerate-rope_dims branch (k = k * kgain[..., 0:1]). Third-site: add ""k_gain"" to CONTROL_TENSOR_NAME_PATTERNS so the 2D k_gain tensor routes to scalar AdamW (not Muon), stays fp32 through restore_fp32_params, and packs via fp16 scalar passthrough. Cost: 8 fp32 scalars/layer × 11 layers = 88 params total (~0.18KB raw, fp16 passthrough → ~176 bytes packed). Init=1.0 so step-0 representation is identical to exp_475. Mathematical note: the effective score gain for q-head h in region r becomes q_gain[h,r]*k_gain[h//group, r]; this is a rank-1 multiplicative decomposition of a [num_heads, 2] gain tensor, so the representable space is unchanged (q_gain alone can already express any [H, 2] gain). The hypothesis is purely about gradient dynamics: scalar AdamW with the product parameterization gives d(loss)/d(q_gain) ∝ k_gain (≈1.0) and d(loss)/d(k_gain) ∝ q_gain (≈5.25), so k_gain's effective learning rate is ~5× higher. This is the implicit-acceleration effect known from deep matrix factorization literature. Risk: if scalar AdamW was already well-tuned for q_gain's slow drift, the faster-moving k_gain may overshoot and destabilize region-wise temperatures early in training. Mitigation: we share the same scalar LR for both via CONTROL_TENSOR_NAME_PATTERNS, and ln_scale_factor / attn_scale layers dampen any over-aggressive changes. Expected delta: -0.00005 to -0.00015 if the hypothesis holds; +0.0001 at worst."
486	2026-04-23T08:11:40Z	tok	475	475	tok	Add learnable per-feature embed_bias [embedding_dim=512, init=0] inside the post-tok_emb RMSNorm, paired with existing embed_scale: `F.rms_norm(x*embed_scale + embed_bias, ...)`. Structurally orthogonal to embed_scale — bias survives as DC offset through rms_norm (not gauge-absorbed), giving block-0 residual a position-invariant anchor signal.	-0.0001	size_blocked	1.078941		16000765	600.046000	591.900000	1502.000000	apg-tok-0477		Three-site edit. (1) GPT.__init__ after embed_scale: `self.embed_bias = nn.Parameter(torch.zeros(h.embedding_dim, dtype=torch.float32))`. (2) forward_logits rms_norm line: add `+ self.embed_bias.to(x.dtype)` inside the norm. (3) Optimizers.__init__: append embed_bias to scalar_params alongside embed_scale. Starts byte-identical to exp_475 (init=0). Routes through scalar AdamW group. 512 fp32 params, passthrough-fp16 in GPTQ pipeline (numel ≤ 65536), brotli-11 on near-zero floats ≈ <1KB compressed. Fills a gap: all prior tok edits touched embed_scale/init-std/dropout; additive per-feature companion untested.
487	2026-04-23T08:22:43Z	quant	475	475	quant	GPTQ block_size 32 to 16: continue the halving trajectory (128 to 64 kept, 64 to 32 kept exp_261 delta=-0.000026) — doubles cross-block error-compensation frequency, re-anchoring numerical precision more often so within-block Cholesky drift cannot accumulate through as many columns before global reconciliation.	-0.00003	discard	1.074087	+0.000066	15999726	600.062000	588.100000	1498.000000	apg-quan-0480		Single-literal edit in gptq_quantize_weight default arg (line 1043): block_size=32 to 16. Zero storage overhead. Prior halving: exp_108 128 to 64 (kept), exp_261 64 to 32 (kept, delta=-0.000026). Recent quant trials at low-damping / Hessian-weighted scale size_blocked (exp_468, exp_477), so size-sensitive axes are saturated — block_size is free of per-layer metadata and should be roughly size-neutral.
488	2026-04-23T08:23:47Z	loss	475	475	loss	Cubic-ramp position-weighted training CE: pw_t = 0.9 + 0.2 * (t/(T-1))^3, renormalized to mean 1. Generalizes exp_186's proven convex u^2 ramp (kept Δ=-0.000062) to cubic — u^3 keeps ~80% of early/mid positions flat near 0.9 and pushes the last ~15% steeply toward 1.1, better matching stride-64 sliding-window eval which only scores the tail 64/2048 positions of each window.	-0.00005	size_blocked	1.074199		16000396	600.010000	588.100000	1507.000000	apg-loss-0480		"Single-site edit in GPT.forward (L799-803). Baseline 475 has plain unweighted CE — exp_186's weighting was dropped somewhere in the 186→475 chain (forward() was rewritten by subsequent arch edits). Reintroduces position weighting with one refinement vs exp_186: u^3 instead of u^2. Same endpoints (0.9/1.1), same smooth monotonic shape (avoids exp_167's sigmoid sharp-boundary failure), but more tail-concentrated. Uses F.cross_entropy(reduction='none')→view(B,T)→multiply by pw→mean. Zero new params, zero bytes. Training-only; eval CE in eval_val_ttt unaffected. Risks: (1) exp_186's u^2 gain may not stack on the 475 base (if other specialists' improvements consumed the same signal); (2) u^3 might be ""too tail-heavy"" if the u^2 keep was near the signal peak."
489	2026-04-23T08:26:23Z	meta	475	475	meta	Lower muon_wd (attention-only matrices) 0.095 → 0.088 (-7%): symmetric DOWN probe on the attn side of the type-split Muon WD axis, mirroring exp_336's kept muon_wd_mlp 0.125→0.115 (-8% DOWN, Δ=-0.000109). After the exp_164 type-split the attn-only axis has never been individually moved DOWN — exp_110 (all-muon 0.095→0.065, pre-split) hurt but at 3.7x larger magnitude on both groups.	-0.00008	size_blocked	1.074149		16001836	600.145000	589.800000	1498.000000	apg-meta-0483		"Single-literal change at train_gpt.py:166 (MUON_WD default 0.095→0.088). Size-neutral edit; matches the magnitude (-7%) of exp_336's proven DOWN probe on the MLP sibling. Attention matrices (.attn.c_q/c_k/c_v/c_proj) total ~4.7M params vs MLP's ~12.6M, so the WD shrinkage acts on a smaller subset and smaller weights — expected size-blocking risk is low. Muon's p *= (1 - lr*wd) per-step decay means -7% WD raises equilibrium attn-matrix norms by ~7% in the high-LR regime and <1% at the end of the 72% warmdown tail. With GPTQ SDClip int6 (exp_377 keep lowered damping further), the compressed model tolerates slightly larger attn weights better than the MLP side did. If this keeps, it validates a general ""both Muon WD groups benefit from -7-8% DOWN"" pattern; if it hurts, it falsifies the symmetry and signals attn WD is already near-optimal."
490	2026-04-23T08:28:14Z	opt	475	475	opt	Cool AdamW beta1 during warmdown in lockstep with LR, floor 0.25 (exp_324-symmetric blend): 0.9 peak → 0.8625 floor on tok_emb + scalar AdamW groups. Direct port of exp_010's proven Muon-side momentum cool to the never-treated AdamW side.	-0.00015	size_blocked	1.074130		16000719	600.040000	592.700000	1502.000000	apg-opt-0484		Single-site insertion in step_fn right after the existing Muon momentum block and before the LR update loop. Computes adam_beta1 via the same mm_blend = max(lr_scale, 0.25) used for Muon (exp_324 floor semantics) → adam_beta1 = mm_blend*0.9 + (1-mm_blend)*0.85. Peak-LR phase: beta1=0.9 (unchanged). Deepest ~18% of training (lr_scale<0.25): beta1 floors at 0.8625. Applies to optimizer_tok (tied tok_emb, largest AdamW group) and optimizer_scalar (ln_scale, q_gain, skip_*, embed_scale). Skips optimizer_muon by identity check. Preserves beta2 unchanged. No new hparams; no new env vars. Motivation: AdamW's parameter update is β1·m_{t-1}-dominated in low-LR tail; shrinking β1 gives fresher gradient signal to tok_emb and scalars in the warmdown phase where they adapt to peak-LR-trained matrix params. Mirrors exp_010 (-0.000109 on Muon side) + exp_324 (-0.000202 with floor 0.25). No size/compile risk — pure Python scalar arithmetic per step.
491	2026-04-23T08:30:32Z	ttt	475	475	ttt	Freeze control-scalar params (numel < 10000) during TTT: q_gain [H,2]=16, embed_scale 512, skip_weights/skip_gates ~2560 each are excluded from SGD+Nesterov adaptation. Only real weight matrices (tok_emb 4.2M, Q/K/V/O ~260K, MLP fc1/fc2 ~1M) are adapted. Rationale: scalars trained with AdamW at tiny LR drift up to ~2%/chunk under SGD@0.005+μ=0.9 momentum accumulation, and these are structural/generalization params, not chunk-specific content. Orthogonal direction to exp_049 (froze 4.2M tok_emb — major surface, hurt); this freezes only <10K-element structural gains.	-0.0002	keep	1.073978	-0.000043	15999959	600.069000	560.000000	1465.000000	apg-ttt-0485	snapshots/491_ttt	Single-site edit in eval_val_ttt at the ttt_params construction (line ~1360). Replace `ttt_params = [p for p in base_model.parameters()]` with `_all_ttt_candidates = [...]; ttt_params = [p for p in _all if p.numel() >= 10000]` and set requires_grad_ accordingly. Threshold chosen to cleanly separate: all control tensors have <3000 params; smallest real matrix (Linear 512x512) has 260K. Downstream clip_grad_norm_ and all_reduce already iterate ttt_params, so they naturally shrink to matrices. Restore line (`for p in base_model.parameters(): p.requires_grad_(True)`) at end of eval_val_ttt unchanged — returns to normal training state.
492	2026-04-23T08:30:35Z	eval	475	491	eval	Score-aligned TTT position weights step w_head=0.9 context w_tail=4.1 scored region mean-preserving	-0.0005	discard	1.074537	+0.000559	15999076	600.012000	587.500000	1490.000000	apg-eval-0485		Two-site edit in eval_val_ttt: precompute ttt_pos_weights with step function, replace loss=base_model with weighted per-token CE. Aligns TTT gradient with scoring region.
493	2026-04-23T08:33:55Z	reg	475	491	reg	Intra-attn Muon WD split: attn.proj (zero-init residual writer) raised 0.095→0.120 while c_q/c_k/c_v stay at 0.095. Mirrors exp_164's kept UP move on mlp-type (0.115 vs 0.095) but scoped within attn; size-safe mirror of exp_483 (which LOWERED mlp.proj WD and size_blocked).	-0.0005	size_blocked	1.073997		16000575	600.100000	592.600000	1500.000000	apg-reg-0486		Three-site edit. (1) Line ~173 add Hyperparameter muon_wd_attn_proj=0.120. (2) In Optimizers.__init__, add matrix_attn_proj_params list; partition by name: .mlp.* → mlp, .attn.proj. → attn_proj, else → attn (q/k/v). (3) Muon param_groups gains a third group for attn_proj at muon_wd_attn_proj. Base-lr propagation in the existing post-init loop handles the new group. attn.proj is 262k×11=2.9M params (~8% of matrix bytes); tightening its WD reduces zero-init → growth dynamics and is size-safe (higher WD = smaller weights = less quantized entropy → smaller brotli payload). Rebased from exp_475 (1.074021).
494	2026-04-23T08:39:45Z	arch	475	491	arch	Region-split QK RMSNorm: apply F.rms_norm independently to the RoPE region (first rope_dims=16) and NoPE region (remaining 48 dims) of Q and K, instead of a single joint norm across the whole head_dim. Mirrors exp_475's bifurcated q_gain structure at the normalization layer and removes the implicit coupling where a 16-dim region competes with a 48-dim region for a shared RMS budget.	-0.00015	eval_budget_overrun	1.077725			600.134000	603.800000	1554.000000	apg-arch-0486		Single-site edit in CausalSelfAttention.forward. Replaces q=F.rms_norm(q,(head_dim,)); k=F.rms_norm(k,(head_dim,)) with a region-split normalize: if 0<rope_dims<head_dim, normalize q[...,:rd] and q[...,rd:] separately then concat, same for k; else fall back to joint norm. At init (uniform per-dim variance) split==joint so step-0 parity is preserved. The edit only bites when the network learns region-specialized feature statistics, which the bifurcated q_gain (col 0 for RoPE, col 1 for NoPE) structurally incentivizes. Zero params, zero bytes. Syntax check ok; size preflight ok (code only 25.5KB).
495	2026-04-23T08:41:28Z	curr	475	491	curr	Half-shard stratification: extend exp_196's largest-remainder per-batch quotas from K=num_files=12 to K=24 virtual shards by splitting each file's sequence range into first/second position-half bins, balancing intra-file position coverage per batch.	-0.0003	size_blocked	1.074967		16000088	600.062000	584.400000	1489.000000	apg-curr-0487		Two-site edit in ShuffledSequenceLoader. (1) __init__ now allocates start_inds with 2*len(files) slots; _reset_shard(fi) splits the post-phase sequence_order into first half (indices [0,mid)) and second half ([mid,N)), each independently shuffled, populating start_inds[2*fi] and start_inds[2*fi+1]. Phase cycling + phase_order permutation remain per-file (unchanged semantics). (2) next_batch's largest-remainder loop now operates over num_virtual=2*num_files=24 bins; shard_plan entries index virtual shards, mapped back to files via vsi//2 for memmap lookup. Reset-on-exhaustion still calls _reset_shard once per file (resetting both halves together) to preserve phase-epoch parity. Mechanism: at B=48 per rank, within-batch binomial std drops sqrt(B*p*(1-p)) from 1.9 (K=12) to 1.36 (K=24), and stratification pushes both to ≤1. The new axis (position-half) specifically decorrelates gradient from topical clustering across adjacent documents within a shard — FineWeb packs adjacent crawl results, so intra-file second-order variance is non-trivial. Orthogonal to exp_196 (which stratified shard-count only) and exp_484 (which varied within-shard permutation structure, discarded).
496	2026-04-23T08:42:04Z	tok	475	491	tok	Add learnable per-vocab logit_bias to tied-softmax logits before softcap to encode a frequency prior.	-0.0004	size_blocked	1.074772		16014172	600.091000	586.200000	1487.000000	apg-tok-0487		Add self.logit_bias = nn.Parameter(torch.zeros(vocab_size)) in GPT.__init__, add it to logits_proj before softcap in forward_logits, append to scalar_params in Optimizers.__init__. Distinct from exp_260 multiplicative output_gain (discarded) and exp_486 embed_bias inside RMSNorm (size_blocked). fp16 passthrough under 65536 GPTQ threshold.
497	2026-04-23T08:53:09Z	quant	475	491	quant	Continue GPTQ multiplicative Hessian damping downward trajectory 1.01→1.005 (halve again): exp_280's 1.02 kept (-0.000054), exp_377's 1.01 kept (-0.000084) — each halving improved; at 0.5% damping more true Hessian curvature is preserved for error-propagation while still ridge-regularising high-H columns.	-0.00005	size_blocked	1.074149		16001383	600.036000	596.500000	1502.000000	apg-quan-0490		Single-literal edit in gptq_quantize_weight: H.diagonal().mul_(1.01) → H.diagonal().mul_(1.005). Zero code overhead (within comment update only). Direct continuation of proven downward trajectory: exp_280 (additive 0.02→mult ×1.02, -0.000054), exp_377 (×1.02→×1.01, -0.000084). Risk: Cholesky stability at 0.5% ridge — mitigated by explicit dead-column handling and 64-batch H averaging which should keep matrices well-conditioned. If kept, probe 1.005→1.002 next; if discarded, the damping floor is near 1.01.
498	2026-04-23T08:53:42Z	loss	475	491	loss	Gentle focal loss (γ=0.25, mean-preserving) replacing plain CE: fw=(1-p_t)^0.25 with detached p_t, normalized to mean 1, so hard tokens contribute more gradient while overall loss/LR scale is unchanged — principled Lin+ 2017 technique, never tried in this tree, orthogonal axis to position-weighting family	-0.0003	size_blocked	1.075042		16001763	600.028000	592.300000	1509.000000	apg-loss-0490		"Single-site edit in GPT.forward (L799-803): swap reduction=""mean"" CE for reduction=""none"" CE + focal weight + mean. Detached p_t avoids second-order gradient; mean-normalization keeps the batch-average loss magnitude identical to baseline so optimizer schedules stay calibrated. γ=0.25 is gentle (exp_488's cubic u³ ramp in position space was size_blocked, so I chose a mild setting). Distinct axis from position-weighting — focal weights by per-token difficulty rather than by position. Zero new params, zero inference bytes. Risks: (a) subtle shift in weight distribution may worsen GPTQ compression → size_blocked; (b) focal over-weighting the tail could destabilize late-training when hard tokens are noise, causing higher val_bpb."
499	2026-04-23T08:57:07Z	meta	475	491	meta	Raise tied-embedding Adam weight decay embed_wd 0.085 → 0.095 (+11.8% UP): symmetric probe against exp_041's DOWN attempt (0.085→0.07, size_blocked at bpb=1.078695). UP on embedding WD shrinks row norms → tighter GPTQ int8 codes and better brotli compression on the ~15 MB dominant embedding payload, while also regularizing the tied input/output matrix that serves dual roles.	-0.0003	size_blocked	1.074759		16000575	600.106000	588.400000	1498.000000	apg-meta-0491		Single-literal change at train_gpt.py:173 (EMBED_WD default 0.085→0.095). embed_wd feeds the AdamW weight_decay for the tok_emb param group (line 935), which under tie_embeddings=True also governs the output-head logit norms. Direction on this axis is novel: exp_041 tried 0.085→0.07 DOWN (size_blocked), no UP probe on record. Rationale: (1) mirrors exp_177's 4× DOWN keep on scalar adam_wd and exp_336's -8% DOWN keep on muon_wd_mlp — but tests the UP polarity here because (2) DOWN on embed_wd blew size at -18%, suggesting embedding magnitudes directly drive entropy in the brotli-11 output; UP should improve compression; and (3) the tied matrix couples input embedding representations to output logit norms, so a slightly stronger shrinkage may mildly tighten the training-time logit spread without hurting representation quality. Expected: modest val_bpb improvement plus a few-KB size headroom gain.
500	2026-04-23T08:59:05Z	opt	475	491	opt	Lower muon_momentum_warmup_start default 0.92 to 0.90	-0.0001	discard	1.074410	+0.000432	15999382	600.134000	598.000000	1504.000000	apg-opt-0493		Single-literal change at line 152. Probes untried DOWN arm on the Muon momentum warmup-start knob. UP (exp_015 0.94, exp_481 peak 0.992) both hurt. Widens ramp range and lowers exp_324 mm_blend=0.25 deep-tail floor from 0.9375 to 0.9225.
501	2026-04-23T09:00:46Z	eval	491	491	eval	Zero TTT SGD momentum_buffer at each chunk boundary so each chunk's ~4 SGD steps per rank start from a clean momentum direction instead of carrying the prior chunk's buffer (weight 0.656 through last step at μ=0.9).	-0.0004	size_blocked	1.074322		16000310	600.044000	560.800000	1467.000000	apg-eval-0494		Single-site edit in eval_val_ttt inside the `if not is_last_chunk and h.ttt_epochs > 0:` block, immediately after base_model.train() and before chunk_seqs computation. Iterates ttt_params, fetches optimizer.state[p], and calls momentum_buffer.zero_() if present. Weights still carry across chunks (that's TTT); only SGD momentum state is reset. Orthogonal to exp_151 (Nesterov, keep: per-step) and exp_491 (param filter, keep: which params). Zero cost — just N zero-ops per chunk boundary.
502	2026-04-23T09:04:02Z	reg	475	491	reg	Shrink exp_493's attn.proj Muon WD bump 0.120→0.110 to fit under 16MB (exp_493 was size_blocked by just 575B while producing val_bpb=1.073997, beating best). Same role-split (q/k/v at 0.095, attn.proj at 0.110, mlp at 0.115) at a smaller delta above baseline, trading a fraction of the WD differentiation for size headroom.	-0.0002	size_blocked	1.074143		16003685	600.101000	585.300000	1491.000000	apg-reg-0494		Single-literal change from exp_493's attempt: muon_wd_attn_proj 0.120 → 0.110. exp_493 over by 575 B at WD=0.120; +0.015 above 0.095 baseline. 0.110 is +0.015 → +0.025 → 60% of the bump magnitude; expected ~15.99 MB under linear-size-in-WD interpolation. If val_bpb effect is dominated by WD dynamics, gain partially retained; if by final weight distribution shift, gain may diminish. Accept either a keep (smaller Δ than exp_493's −0.000024) or a signal about the effect decomposition. Rebased on exp_475.
503	2026-04-23T09:08:50Z	ttt	491	491	ttt	Reset SGD momentum buffers at TTT chunk boundaries (pop momentum_buffer state before each chunk's epoch loop): each val chunk is distributionally independent, so stale per-chunk gradient direction (μ^4≈0.656 carryover) is noise rather than signal; gives each chunk a clean Nesterov trajectory.	-0.00005	size_blocked	1.074507		16001986	600.049000	564.100000	1472.000000	apg-ttt-0494		Single-site insertion in eval_val_ttt right after the cos_lr LR assignment (line ~1427), before my_seq_s. Pops momentum_buffer from optimizer.state for each ttt_param at chunk start; since SGD re-creates the buffer on next .step(), this effectively zero-initializes momentum per chunk. Zero compute cost (state-dict pop is O(num_params)). Orthogonal to exp_491's scalar-freeze (unchanged here) and complementary to exp_264's fwd/rev alternation (not present in this chain). Prior momentum probes were only magnitude: exp_039 (0.9→0.95) discarded, exp_151 (Nesterov on) kept — reset-between-chunks is a novel axis.
