exp_id	timestamp	specialist	parent_exp	baseline_exp	domain	hypothesis	expected_delta	status	val_bpb	delta_vs_best	artifact_bytes	train_s	eval_s	total_s	job_name	snapshot_path	notes
396	2026-04-23T02:00:11Z	loss	377	377	loss	Half-amplitude convex position-weighted CE pw=0.95+0.1*u² (mean-preserved): preserves the direction of 3 prior keeps (exp_156/176/186) while halving weight-distribution perturbation vs exp_386's exact exp_186 recipe (which size_blocked on current best).	-0.00003	size_blocked	1.074896		16000159	600.096000	768.904000	1478.000000	apg-loss-0389		"exp_186 (0.9+0.2u², 22% p-t-p) historically won by Δ=-0.000062 on older stack but re-introducing verbatim onto exp_377 best (exp_386) hit size_blocked at pre-quant bpb=1.074780. Hypothesis: compression headroom is tight and weight-distribution drift scales with pw amplitude; halve amplitude to 0.95+0.1u² (11% p-t-p) to stay in budget while preserving direction. Edit: single site at the one-liner F.cross_entropy in GPT.forward (reduction=""mean"" → reduction=""none"" + position-weighted mean). Risk: may also size_block if compression drift is non-linear in amplitude."
397	2026-04-23T02:04:44Z	quant	377	377	quant	Per-layer-category GPTQ multiplicative damping: MLP=1.02, attn/embed=1.01 — heterogeneous downward direction after the uniform damping axis saturated (1.02/1.01/1.005 all now measured).	-0.00005	size_blocked	1.074325		16002518	600.014000	760.986000	1470.000000	apg-quan-0391		"Two-site edit. (1) gptq_quantize_weight gains a `damping=1.01` kwarg replacing hardcoded `H.diagonal().mul_(1.01)`. (2) gptq_mixed_quantize chooses damping by classify_param(name): ""mlp"" → 1.02, everything else → 1.01. Rationale: silu^2 MLP activations produce heavy-tailed Hessian diagonals whose high-H columns over-punish error propagation through 1/Hinv[j,j]; stronger multiplicative damping (1.02) preserves more conditioning there. Attention matrices have RMSNorm-gated inputs → well-conditioned H → 1.01 stays optimal. Uniform axis is fully measured: exp_280 (1.02) kept Δ=-0.000054, exp_377 (1.01) kept Δ=-0.000084 = current best, exp_387 (1.005) size_blocked & regressed at 1.074465. Heterogeneity is the only unexplored direction on this axis and exp_301's attempt aborted before reporting. Size risk: very low — stronger damping on MLP produces slightly smoother quantized values → marginally better compression, not worse (format/bit-width unchanged). Expected: small win if MLP Hessian is genuinely where the extra damping benefit came from in exp_280; null if the uniform 1.01 optimum was already bilinear-optimal."
398	2026-04-23T02:05:11Z	arch	377	377	arch	NormFormer-style post-attention RMSNorm before proj in CausalSelfAttention: forces attention-output to unit-RMS before the zero-init projection, tightening proj's int6 quant input range and giving attn_scale a clean magnitude-only gauge.	-0.0005	crash				600.048000	224.952000	937.000000	apg-arch-0392		Single-site edit in CausalSelfAttention.forward (~line 555): inserts `y = F.rms_norm(y, (y.size(-1),))` between the reshape-to-[B,T,dim] and `self.proj(y)`. Applies strictly AFTER the XSA V-subtraction so XSA's geometry in pre-norm space is preserved. Zero new params (no gamma). Rationale: Q/K are RMS-normed; V is not, so attn output magnitude inherits V variance + input scale. Post-norm decouples attn_scale to pure-magnitude knob. Interaction with exp_245 (input-side ln_scale_factor for looped blocks): the INPUT scaling's effect on attn OUTPUT magnitude is masked by post-norm, but exp_245's MLP-input correction is preserved — so net effect on looped-block variance balance is empirical. Orthogonal to q_gain (pre-softmax) and attn_scale (post-proj residual gain). | torch.distributed.elastic.multiprocessing.errors.ChildFailedError: ============================================================ (train_gpt.py:1066 in gptq_quantize_weight)
399	2026-04-23T02:05:15Z	tok	377	377	tok	Add learnable per-vocab additive logit bias (shape=[8192], init=0, applied before logit_softcap) to offload unigram-frequency prior from the GPTQ-int6-quantized tied tok_emb matrix onto a dedicated fp16-passthrough scalar tensor — structurally orthogonal to all prior tok edits (per-FEATURE embed_scale exp_190/267/298, per-feature output_gain exp_260 discarded) since this acts on the V=8192 vocab axis, not the D=512 feature axis.	-0.0008	size_blocked	1.074911		16015896	600.010000	766.990000	1477.000000	apg-tok-0391		Three-site edit. (1) GPT.__init__: adds self.logit_bias = nn.Parameter(torch.zeros(h.vocab_size)) right after embed_scale — 8192 fp32 params. (2) GPT.forward_logits: adds `logits_proj = logits_proj + self.logit_bias.to(logits_proj.dtype)` between the tied-linear projection and the softcap·tanh. Placement BEFORE softcap keeps bias within tanh's bound (softcap=30 ≫ |log p(v)|) so effectively unconstrained at convergence. (3) DistributedAdamWMuonTok.__init__: adds logit_bias to scalar_params (rides scalar_lr + adam_wd alongside embed_scale/skip_weights). Quantization: numel=8192 < 65536 threshold in gptq_mixed_quantize → fp16 passthrough (16KB raw → ~10-14KB brotli-11 on learned non-zero values). Well within ~180KB headroom. Init=0 → step-0 behaviour identical to exp_377 baseline. Expected mechanism: unigram-frequency signal currently has to propagate through int6-quantized tied matrix; a dedicated fp16 bias stores it at full precision and frees the tied matrix's rank for semantic structure. Classic LM bias (GPT-2 decoder head-bias) combined with full-precision advantage over the quantized matrix. Axis history confirms novelty: exp_023 (per-vocab logit bias on exp_017 branch) never ran — harness_abort — so this is the first real test in the post-GPTQ era.
400	2026-04-23T02:08:24Z	curr	377	377	curr	Replace rng.permutation within-shard sequence order with golden-ratio (stride ≈ phi*N, coprime-bumped) low-discrepancy permutation + per-epoch additive shift: consecutive same-shard .pop()s in a batch land ~0.618*N start_inds apart instead of random-clustered, decorrelating content-overlap in stratified batches.	-0.0002	discard	1.076261	+0.002174	15998705	600.005000	757.995000	1469.000000	apg-curr-0391		Single-site edit in ShuffledSequenceLoader._reset_shard. Replaces rng.permutation(num_sequences) with coprime-adjusted multiplicative stride permutation: stride=round(N*0.6180339887498949); bump stride+=1 while gcd(stride,N)!=1. sequence_order=((arange(N)+_phase_epoch[si])*stride)%N. Handles N<=1 gracefully. Orthogonal to exp_142 (Latin-square across epochs) and exp_196 (cross-shard stratification) — acts on within-shard visit spread. Entropy-preserving. Axis history: exp_354 VdC on phases (not kept), exp_390 bit-rev phase_order (eval_budget_overrun); both acted on PHASE axis — this acts on SEQUENCE axis which hasn't been touched.
401	2026-04-23T02:18:47Z	tok	377	377	tok	Add a learnable per-feature additive embed_bias (shape=[embedding_dim], init=0, scalar_params group) applied AFTER the post-tok_emb RMSNorm, giving the input pipeline a full affine (scale+shift) instead of scale-only; orthogonal to embed_scale and distinct from all prior per-vocab (8192-dim) bias attempts that size-blocked.	-0.0002	crash						26.000000	apg-tok-0401		Three-site edit on current best (exp_377). (1) GPT.__init__ after self.embed_scale: adds self.embed_bias = nn.Parameter(torch.zeros(h.embedding_dim, dtype=torch.float32)) — 512 fp32 scalars (~2KB raw, fp16 passthrough → near-zero compressed). (2) forward_logits line 752: changes `x = F.rms_norm(x * self.embed_scale, (D,))` to `x = F.rms_norm(x * self.embed_scale, (D,)) + self.embed_bias.to(x.dtype)` so the bias is a post-norm additive shift — not stripped by rms_norm, unlike a pre-norm offset. (3) Optimizers.__init__ scalar_params list: appends base_model.embed_bias so it lands in the scalar AdamW group (scalar_lr=0.02, adam_wd=0.005). Mechanism: gives the post-tokenizer stream a universal 512-dim directional offset — a context-free feature prior that every token inherits — orthogonal to embed_scale's per-feature multiplicative reweighting (exp_190/267/298 established this axis is valuable). Contrasts with exp_058 (harness_abort, layer_norm replacement) which would have subtracted the mean; here we ADD a learnable shift rather than strip one. Distinct from all prior per-vocab bias attempts (exp_023/146/166/219/249/399 aborted/size_blocked at 8192 dim); at 512 dim the passthrough payload is ~1KB and never trips the size gate. Block 0's attn_norm will renormalize, so the bias affects residual-stream direction but not attn-input RMS — safe under rms_norm downstream. | torch.distributed.elastic.multiprocessing.errors.ChildFailedError: ============================================================ (train_gpt.py:1104 in gptq_mixed_quantize)
402	2026-04-23T02:38:14Z	tok	377	377	tok	Add a learnable per-feature additive embed_bias (shape=[embedding_dim], init=0, scalar_params group) applied AFTER the post-tok_emb RMSNorm, giving the input pipeline a full affine (scale+shift) instead of scale-only; orthogonal to embed_scale and distinct from all prior per-vocab (8192-dim) bias attempts that size-blocked.	-0.0002	crash				600.030000	26.200000	932.000000	apg-tok-0402		Re-submit after rebasing workdir onto exp_377 (prior attempt exp_401 crashed due to a stale workdir divergence that had replaced self.final_norm(x) with F.rms_norm(x*self.final_scale, ...), breaking the hessian-collection hook attached to model.final_norm). Three-site edit on clean exp_377. (1) GPT.__init__ after self.embed_scale: adds self.embed_bias = nn.Parameter(torch.zeros(h.embedding_dim, dtype=torch.float32)) — 512 fp32 scalars, fp16 passthrough → ~1KB. (2) forward_logits: changes `x = F.rms_norm(x * self.embed_scale, (D,))` to `x = F.rms_norm(x * self.embed_scale, (D,)) + self.embed_bias.to(x.dtype)` — post-norm additive shift, not stripped by RMSNorm (since RMSNorm has already executed). (3) Optimizers.__init__ scalar_params: appends base_model.embed_bias (scalar_lr=0.02, adam_wd=0.005). Mechanism: gives every token's post-norm representation a universal 512-dim directional offset — a context-free feature prior — orthogonal to embed_scale's per-feature multiplicative reweighting (the axis proven by exp_190/267/298). Distinct from all prior per-vocab bias attempts (exp_023/146/166/219/249/399 aborted or size-blocked at 8192 dim): the 512-dim version is ~16× smaller in passthrough bytes and never trips the size gate. Block 0's attn_norm/mlp_norm renormalize, so the bias affects residual-stream direction but not attn-input RMS — safe for downstream RMSNorms. Zero interaction with GPTQ/hessian collection (embed_bias has 512 elements < 65536 passthrough threshold). | torch.distributed.elastic.multiprocessing.errors.ChildFailedError: ============================================================ (train_gpt.py:1055 in gptq_quantize_weight)
403	2026-04-23T02:38:27Z	arch	377	377	arch	NormFormer-style MLP sub-LN: insert F.rms_norm after silu²(fc(x)) and before proj so the non-negative, drifting-RMS hidden state enters proj at unit-RMS — decouples proj's int6 dynamic range from fc's output magnitude and gives the late-QAT STE a stable input distribution for proj.	-0.0004	eval_budget_overrun	1.078943			600.062000	601.900000	1500.000000	apg-arch-0401		Single-site edit in MLP.forward: `self.proj(F.silu(self.fc(x)).square())` → `h = F.silu(self.fc(x)).square(); h = F.rms_norm(h, (h.size(-1),)); return self.proj(h)`. Zero new params, zero bytes added to model. Structurally distinct from exp_398's attention-side sub-LN (crashed via flash_attn/XSA interaction): this normalizes a clean non-negative tensor with no rotary/causal/XSA path dependency. Mechanism: silu²·square is non-negative with high per-token RMS variance; forcing unit-RMS into proj (a) tightens proj's effective input distribution so int6 scales aren't wasted on rare large-magnitude tokens, (b) stabilizes the STE branch input distribution when QAT flips on mid-train. mlp_scale (learnable per-feature, post-proj) preserves expressive capacity of residual injection. Compile cost: one extra rms_norm per block per forward — cheap relative to attn+MLP.
404	2026-04-23T02:40:00Z	opt	377	377	opt	Linear-anneal grad_clip_norm in lockstep with LR warmdown: clip = 0.3*(0.5+0.5*lr_scale), so 0.3 at peak LR → 0.1575 at 5% LR floor; keeps outlier-grad magnitude proportional to scheduled LR so tail-phase EMA isn't poisoned by relatively-large clipped outliers.	-0.00020	discard	1.074143	+0.000056	15999647	600.029000	579.900000	1470.000000	apg-opt-0401		"Single-site edit at step_fn grad_clip line (~1518). Prior attempt on this axis (exp_036, ""Cosine-anneal grad_clip_norm 0.3→0.15"") was harness_abort — never actually ran, so the axis is genuinely untouched. Orthogonal to the three existing warmdown-tail stabilizers already in best (min_lr=0.05 floor, mm_blend floor=0.25, Muon momentum cool-to-0.9375). Rationale: with WSD-style 5% LR floor, peak-clipped outlier grads become 20× the scheduled peak update at the floor, and those tail steps dominate EMA-averaged weights (EMA half-life ≈ 4% ≪ warmdown tail ≈ 72%). Keyed to lr_scale so it's automatically time-fractional; no new env vars."
405	2026-04-23T02:40:24Z	loss	377	377	loss	Replace focal γ=0.5 CE reweighting with Bernoulli-variance weighting w=sqrt(p_y*(1-p_y)), mean-preserving: downweights BOTH saturated-easy (memorized) tokens AND near-zero-p_y garbage tokens (rare unicode/URL slugs), concentrating gradient on the learnable middle (p_y≈0.5) where predictions are on the decision boundary.	-0.0005	size_blocked	1.358900		16003968	600.248000	527.200000	1397.000000	apg-loss-0401		"Single-site edit in GPT.forward (~line 798). Structural departure from the monotonic-hardness focal family — focal (exp_291 γ=0.5 kept, exp_144 γ=1 discard, exp_367 γ=0.2 discard) peaks at p_y→0; Bernoulli-variance peaks at p_y=0.5 and is symmetric. Theoretical motivation: per-token Bernoulli std is the uncertainty measure whose gradient produces the largest per-sample p_y shift per unit loss — capacity-efficient for a 36M model where many tokens are either memorized or structurally unpredictable. Mean-preserving keeps LR/Muon schedule anchored. Zero params, zero inference path change (forward_logits untouched), zero byte delta — training-only CE reshape. Risk: if ""hard-but-learnable"" tokens dominate, downweighting them sacrifices signal; if ""easy"" + ""garbage"" tokens dominate the tails, gradient concentration on middle should help."
406	2026-04-23T02:42:19Z	reg	377	377	reg	Split zero-init output projections (attn.proj + mlp.proj) into a third Muon WD group at 0.060 (~63% of muon_wd, ~52% of muon_wd_mlp): relaxes WD on residual-growth path while keeping full decay on high-param input projections.	-0.0003	discard	1.077515	+0.003428	15992774	600.125000	573.900000	1475.000000	apg-reg-0401		Per-role (input vs output projection) WD split, orthogonal to exp_164 (per-type) and exp_141 (per-depth). Both attn.proj and mlp.proj are zero-init — applying full WD fights their norm growth. New env var MUON_WD_PROJ=0.060. Three-site edit: hparam declaration (~9 LOC with rationale), Optimizers.__init__ (.proj. filter above .mlp. branch), Muon param_groups list (added third group dict). Zero new params, pure regrouping. Smoke pack 25KB code-only so no size pressure.
407	2026-04-23T02:42:45Z	meta	377	377	meta	Raise muon_wd_mlp 0.115 → 0.120 (+4.3%): untested UP side of exp_336's kept axis (0.125→0.115 DOWN, Δ=−0.000109); DOWN direction saturated (exp_356 at 0.110 size_blocked); since exp_336 all best-advancing changes have been quant-stage (exp_377 GPTQ damping 1.01), so trained-weight optimum may have drifted.	-0.00005	discard	1.074332	+0.000245	15996570	600.090000	576.200000	1478.000000	apg-meta-0401		Single-literal edit on line 172: MUON_WD_MLP default 0.115 → 0.120. Affects only the MLP-parameter Muon weight-decay group (≠ attention Muon WD=0.095, ≠ embed AdamW WD=0.085, ≠ scalar AdamW WD=0.005). Higher WD on MLP matrices shrinks weight magnitudes → should compress as well or better under GPTQ-int6 + brotli-11, so size_blocked risk is lower than the DOWN side (exp_356 at 0.110 hit size). Rebased workdir from snapshot 377 so baseline = 0.115 matches that snapshot verbatim. Expected delta small (~±0.0002, likely noise-to-small-gain); low-EV but genuinely untested axis direction satisfies anti-anchoring.
408	2026-04-23T02:43:20Z	quant	377	377	quant	Add mild Ledoit-Wolf off-diagonal shrinkage (×0.97, diag preserved) on top of current diag×1.01 damping — denoises finite-sample H off-diagonals whose cross-column error compensation is noisy.	-0.00010	size_blocked	1.074271		16354376	600.037000	575.200000	1475.000000	apg-quan-0401		exp_348 tested off-diag×0.95 on the damping×1.02 base and was a close discard (1.074282); current best (exp_377) is on the lighter damping×1.01 base. Untried combination: milder off-diag×0.97 on top of damping×1.01. Off-diag shrinkage suppresses finite-sample noise from 64-batch calibration H that propagates through Hinv into misdirected cross-column error compensation. Used 0.97 (not 0.95) to stay size-safe: lower damping already raises Q entropy (exp_387 damping 1.005 size_blocked), so aggressive off-diag shrinkage risks size. Four-line in-place block in gptq_quantize_weight: damp diag ×1.01, clone diag, scale whole H ×0.97, restore diag. Size-neutral in code; Q/scale layout unchanged. Risk: size_blocked if off-diag×0.97 still bumps Q entropy past cap; fallback would be ×0.98 or ×0.99.
409	2026-04-23T02:43:25Z	ttt	377	377	ttt	Mean-preserving within-chunk linear TTT-LR ramp-down across epochs (1.3x→0.7x for 4 epochs, integrated mean=1.0): front-loads the step at epoch 0 when the SGD+Nesterov momentum buffer is clean, and tempers epochs 1-3 where same-direction look-ahead amplification on the identical 4 seqs risks overshoot. Isolates schedule-shape from net-LR (exp_295 confounded the two with a non-mean-preserving 1.0→0.25 ramp).	-0.00010	discard	1.074631	+0.000544	15999133	600.072000	580.600000	1472.000000	apg-ttt-0401		Single-site edit in eval_val_ttt inside the per-chunk epoch loop. Replaces the flat cos_lr assignment (set once before the epoch loop) with a per-epoch rescale: ep_scale = 1.0 + 0.3*(1 - 2*ep/(E-1)) giving (1.3, 1.1, 0.9, 0.7) for E=4. Integrated ep_scale over epochs = 1.0, so total integrated LR is identical to the current flat schedule. Cost: zero GPU delta. Mechanism hinges on regime: my_chunk_seqs=32/8=4 per rank, batch_seqs=32, so each epoch is exactly 1 SGD step on the same 4 seqs; Nesterov+0.9 momentum compounds same-direction updates across the 4 steps, and the largest nominal step is safest when momentum velocity is zero (epoch 0) and riskiest when cumulative 3-step Nesterov look-ahead is near peak (epoch 3). Prior art: exp_295 tried the same shape but mean-diminished (mean=0.625) and landed discard with +0.000088 — plausibly beat by its LR deficit; this test controls for that. Fall-through guard for ttt_epochs≤1 keeps ep_scale=1.0.
410	2026-04-23T02:44:01Z	curr	377	377	curr	Double phase-cycling granularity 8→16 in ShuffledSequenceLoader: at 600s the run completes <1 shard-epoch per shard so the latin-square only uses index 0 — world-level sequence-start offsets now span 16 choices (128-token granularity) instead of 8 (256-token), finer token-position diversity in a single-draw regime.	-0.00005	discard	1.076214	+0.002127	15996599	600.131000	576.500000	1474.000000	apg-curr-0401		"Three-literal edit: permutation(8)→permutation(16), % 8→% 16, // 8→// 16 (all in ShuffledSequenceLoader.__init__ and _reset_shard, lines 367/374/376). No model/compression impact (literal number swap). Rationale: exp_142's latin-square keep cycles 8 phases, but in practice each shard sees <1 epoch/run so only phase_order[si][0] is consumed; the effective distribution per shard is ""one random pick from K options."" K=16 gives 16 distinct phase offsets {0,128,...,1920} instead of 8 offsets {0,256,...,1792} — strictly finer, and contains the 8-option set. Across ~96 world shards the per-phase expected occupancy drops from 12 to 6 but the range of distinct offsets doubles. Expected delta near noise (~±0.0001) but a clean probe of the phase-granularity axis which has not been tested since the latin-square was introduced."
411	2026-04-23T02:44:02Z	eval	377	377	eval	Revive exp_264 alternating TTT batch-traversal on current best	-0.00006	size_blocked	1.074539		16001369	600.031000	571.600000	1457.000000	apg-eval-0402		test
