exp_id	timestamp	specialist	parent_exp	baseline_exp	domain	hypothesis	expected_delta	status	val_bpb	delta_vs_best	artifact_bytes	train_s	eval_s	total_s	job_name	snapshot_path	notes
740	2026-04-25T03:42:08Z	opt	596	596	opt	One-event EMA half-blend at warmdown entry: ema_state ← 0.5*ema_state + 0.5*current_weights at the first step where lr_scale<1.0, then EMA continues normally with ema_decay=0.9965.	-0.0003	discard	1.072599	+0.000348	15999537	600.114000	589.700000	1530.000000	apg-opt-0732		Structurally novel single-event discontinuity on the EMA accumulator, applied to main-training. Analogous to exp_588 keep (halve SGD momentum_buffer at TTT chunk boundaries, -0.000727) and exp_700 (halve Muon momentum buffer at warmdown entry, bpb=1.072455 size_blocked) but operates on the running weight average, not optimizer momentum. Concentrates EMA mass on warmdown trajectory: at ema_decay=0.9965 the half-life is ~200 steps, so over a ~1500-step warmdown the post-blend EMA is ~99.5% warmdown-driven instead of ~88% peak-LR-driven. Distinct from exp_730 (continuous ema_decay cool, eval_budget_overrun), exp_544 (continuous ema_decay schedule, size_blocked), and exp_635 (bias-corrected ema_decay, crash) — those modified the smoothing factor; this one applies a one-time amplitude correction. +57 packed code bytes (23296→23353). Edit is two-site: declare _ema_blend_done=False before the loop, conditionally swap ema_decay→0.5 once at first scale<1.0 step.
741	2026-04-25T03:42:51Z	ttt	596	596	ttt	Add Pereyra-style confidence penalty (2e-4 * Σp·log p) to TTT inner CE atop existing z-loss: regularizes output distribution toward higher entropy per step, discouraging over-confident chunk-local memorization while z-loss bounds logit magnitudes.	-0.0003	size_blocked	1.072678		16000742	600.142000	583.900000	1524.000000	apg-ttt-0732		Single-line edit at eval_val_ttt line 1401: append `+ 2e-4 * (F.softmax(_lf,-1) * F.log_softmax(_lf,-1)).sum(-1).mean()` to existing loss expression. The added term is Σp·log p ≤ 0, so positive coefficient with this sign equals -β·H(p) — encourages high entropy via gradient descent. Mechanically distinct from prior probes: z-loss (exp_596, kept) regulates logit magnitude / log-partition; label smoothing (exp_578 size_blocked) modifies targets; focal (exp_666 size_blocked at 1.080) reweights per-token; CP regulates output distribution shape. Coefficient 2e-4 is conservative — literature uses 1e-3 to 1e-2; smaller chosen to compose with z-loss without over-relaxing the per-step gradient. Compute cost: 2 extra softmax-class ops per step (softmax + log_softmax already needed by F.cross_entropy internally; PyTorch doesn't expose those intermediates so we recompute) — ~13 chunks × 16 steps × ~2ms = ~400ms total, well under 600s eval budget margin. Workdir was rebased to exp_596 first to remove stale exp_729 mid-chunk mb damping.
742	2026-04-25T03:47:38Z	loss	596	596	loss	Replace TTT inner-CE z-loss `1e-5 * logsumexp(_lf,-1).pow(2).mean()` with `1e-5 * _lf.amax(-1).pow(2).mean()` — penalize peak logit rather than full log-partition. Mechanism-distinct from all 7 prior z-loss variants (L2/L1/var/anchor=logV/hinge/tail-PW/×2/÷2): max-logit constrains only the dominant mode, leaving tail mass unconstrained, vs lse which mixes peak + diversity-correction. For peaked predictions amax≈lse; for flatter ones lse>amax, so this loosens regularization on TTT positions where the model is genuinely uncertain — matches the intuition that TTT's per-chunk SGD should adapt freely on hard tokens but be stabilized on easy ones.	-0.0001	size_blocked	1.072778		16000242	600.127000	594.600000	1530.000000	apg-loss-0734		1-line edit at L1401, byte-negative (~-10 chars saved), TTT-only effect. Rebased to exp_596 first (workdir had stale exp_733 stack). Confidence medium: untried variant on saturated z-loss axis; expected magnitude similar to original z-loss keep (~0.0002).
743	2026-04-25T03:51:24Z	reg	596	596	reg	Gradient-noise injection (Neelakantan 2015) on scalar AdamW control params: σ=1e-3*lr_scale randn added to grads pre-clip — noise vanishes during warmdown.	-0.0003	size_blocked	1.087875		16015507	600.011000	583.200000	1524.000000	apg-reg-0737		Two-site edit (~7 lines, ~280 chars). Cached _gn_params list = [scalar_params, attn_out_gate_w] from optimizer_scalar groups (~25k params total). σ=1e-3 is conservative; AdamW absorbs noise via v_t second-moment. Distinct from all prior reg noise probes which targeted activations (exp_155/198/302) or weights (exp_271/681/723). Mechanism: explores scalar-param basin without breaking convergence; lr_scale gate ensures clean warmdown crystallization.
744	2026-04-25T03:54:23Z	meta	596	596	meta	"Lower Muon-momentum warmdown blend floor 0.25 to 0.20 (gentle DOWN -20%): exp_324's kept UP probe (0 to 0.25) and subsequent UP probes (0.28, 0.30, 0.35 all size_blocked at improved bpb) leave the DOWN side completely untested. Under z-loss regime late warmdown gradients are already smoother so heavy direction averaging is partly superseded.</hypothesis> <parameter name=""notes"">Single-literal change at line 1484 (mm_blend = max(lr_scale, 0.25) to max(lr_scale, 0.20)) plus comment update. Code +13 bytes, zero new params. Floor=0.20 means deepest warmdown momentum = 0.20*0.99+0.80*0.92 = 0.934 vs 0.9375 baseline; momentum-floor regime engaged in last ~12% of training instead of ~18%. UP-side asymmetry signal: 0.28/0.30/0.35 all size_blocked at improved bpb (1.072581 / 1.072734 / 1.074645 measured at trial-time best), suggesting UP direction wins on bpb but trips byte budget. DOWN should be size-neutral or size-saving (less momentum integration -> less weight drift). Risk: low - single-literal, zero compile-graph or quant-path impact." -0.0001 discard 1.073223 +0.000972 15999061 600.151000 583.300000 1515.000000 apg-meta-0737  
745	2026-04-25T03:55:23Z	tok	596	596	tok	Replace parameter-free RMSNorm final_norm with parameter-free nn.LayerNorm(elementwise_affine=False) feeding tied softmax: zero-mean each token's x before F.linear(x, tok_emb.weight) to cancel spurious x-DC * tok_emb.row-sum contributions to logits. Preserves the GPTQ Hessian forward-hook site (which attaches to self.final_norm).	-0.0003	discard	1.073024	+0.000773	15999598	600.136000	590.300000	1526.000000	apg-tok-0737		Two-line edit: (1) constructor line 670 self.final_norm = RMSNorm() -> nn.LayerNorm(h.model_dim, elementwise_affine=False). (2) no change to forward call site — self.final_norm(x) now invokes parameter-free LayerNorm. Code bytes 23296 -> 23325 (+29). Zero new params (elementwise_affine=False means no gamma/beta). Novel axis: all prior LayerNorm/DC-removal tok trials (exp_380, exp_523, exp_699, exp_551, exp_616) targeted the INPUT side (post-tok_emb gauge-fix or tok_emb rows). OUTPUT side (between trunk output and tied F.linear) has never been tested. First attempt at exp_736 crashed because replacing call site bypassed the GPTQ Hessian hook on model.final_norm; this fix keeps the module reference intact so hooks still fire correctly on LayerNorm output. Mechanism: tied tok_emb rows have non-zero row-sums, so F.linear(x, W) generates a per-vocab logit offset proportional to x.mean * W_row.sum — noise-like unigram-bias riding on x's per-token DC that the model cannot control cleanly. LayerNorm here strips this without touching training-time tok_emb gradients or input-side x0 flow. Risk: DC may encode genuine signal (frequent-token bias) at the final layer; prior input-side DC-removal consistently hurt but that was for residual-stream DC that propagated through every block.
746	2026-04-25T03:57:06Z	eval	596	596	eval	Stack exp_592's Gradient Centralization (zero-mean per-row gradient on 2D+ ttt_params) onto current best exp_596 (TTT z-loss): two parallel-sibling kept eval/loss edits forked from exp_538 that have never been combined — GC corrects gradient direction, z-loss damps logsumexp magnitude, mechanisms are orthogonal.	-0.00015	keep	1.072246	-0.000005	15998317	600.133000	590.900000	1528.000000	apg-eval-0739	snapshots/746_eval	"exp_592 (GC alone, parent 538) val_bpb=1.072439, Δ=-0.000300 over 538. exp_596 (z-loss alone, parent 538) val_bpb=1.072251, Δ=-0.000188 over 592. Combined hypothesis: orthogonal mechanisms partially additive — GC zeroes per-row gradient mean (acts on direction), z-loss adds 1e-5*logsumexp^2 to the inner CE (acts on magnitude/calibration). exp_601 stacked GC+momentum-halving (size_blocked at 1.073494); exp_611 mistakenly claimed ""Keeps exp_592 GC in place"" but its parent was 596 which doesn't have GC, so the literal stack is genuinely untested. +175 source bytes, ~30 packed."
747	2026-04-25T04:03:42Z	quant	596	746	quant	Post-GPTQ closed-form per-row scale refit: replace heuristic s with ALS-optimal per-row s after inner loop. Size-neutral; codes Q untouched.	-0.0002	size_blocked	1.072627		16000891	600.112000	585.000000	1522.000000	apg-quan-0740		exp_020 tried same idea but harness_aborted. Code +408B.
748	2026-04-25T04:04:05Z	curr	596	746	curr	Eval-stride-aligned overlap (stride = seq_len - 64 = 1984): each token sees both a shallow-context view (<64 positions of context) and a deep-context view (>=1984 positions) per shard-epoch, mirroring eval's stride-64 sliding-window scoring distribution at only ~3% redundancy.	-0.0005	size_blocked	1.073537		16002471	600.126000	586.700000	1535.000000	apg-curr-0740		Untouched in 70 prior curr trials — only exp_076 attempted exactly this stride and got harness_abort (never tested). Distinct from exp_047 (stride//2 = 1024, 50% overlap, discard +0.001008) and exp_053 (stride = seq_len, current best) — sweet spot between them. 4-line edit in _reset_shard, +~140 raw code bytes (well within headroom). The overlap is purely positional and additive: per shard-epoch, ~3% of tokens become targets in 2 sequences — once at positions <64 (low context, naturally hard) and once at positions >=1984 (deep context, like every eval-scored token). Aligns gradient distribution with eval scoring distribution without dramatic redundancy.
749	2026-04-25T04:13:38Z	arch	596	746	arch	Per-KV-head data-dependent V-magnitude gate [Hkv=4, W_v=4] zero-init applied right after c_v projection — mechanism-distinct from exp_538 attn_out_gate (post-attn, per-OUTPUT-head) and prior V-modifications (exp_330 static V-gain, exp_597 additive V-bias, V-norm).	-0.0005	size_blocked	1.072789		16003038	600.076000	597.700000	1524.000000	apg-arch-0742		+399 packed code bytes. +176 fp32 params (4 Hkv × 4 W_v × 11 layers). Step-0 transparent (sigmoid(0)*2=1). Routes to scalar AdamW via 'attn_out_gate' substring in CONTROL_TENSOR_NAME_PATTERNS. Distinct from exp_330 (static scalar V-gain, no data dependence) and exp_597 (additive bias, no sigmoid gate).
750	2026-04-25T04:16:57Z	opt	596	746	opt	Decouple Muon momentum warmdown cool target from warmup_start: hard-code 0.93 on the mm_blend cool line, leaving warmup ramp at 0.92.	-0.00015	keep	1.072210	-0.000036	15998714	600.083000	579.200000	1515.000000	apg-opt-0743	snapshots/750_opt	
751	2026-04-25T04:20:08Z	ttt	596	750	ttt	"Damp TTT SGD momentum_buffer by 0.5 ONLY at the first chunk boundary (ci==1) under z-loss regime: surgical port of exp_588 (kept standalone) where uniform damping atop z-loss (exp_607) regressed; chunk-0 builds peak stale velocity at full cos_lr while later boundaries see naturally smaller buildup.</hypothesis> <parameter name=""notes"">Single 3-line conditional after cos_lr update. +8 packed code bytes. Distinct from exp_588 (all boundaries), exp_607 (all + z-loss, regressed), exp_708 (sign-cond reset), exp_656 (tok_emb-only). Hypothesis: chunk-0 to chunk-1 is the dominant stale-velocity transition; later transitions don't need damping because cos_lr decay reduces velocity buildup naturally and z-loss bounds per-step magnitude. If chunk-0to1 dominates 588's gain, partial recovery (~-0.0003); if late chunks contribute, smaller." -0.0003 size_blocked 1.072820  16000251 600.142000 581.500000 1516.000000 apg-ttt-0742  
752	2026-04-25T04:22:21Z	reg	596	750	reg	Eval-TTT inner-loop input-token denoising at p=0.01: replace ~1% of input token IDs with uniform-random IDs during TTT inner training forward only; CE target y stays clean. Score-first scoring untouched.	-0.0005	size_blocked	1.089665		16020195	600.083000	584.200000	1520.000000	apg-reg-0746		Single-line insertion at line 1398 in eval_val_ttt: x = torch.where(rand<0.01, randint(0,8192), x). Mean-preserving discrete corruption — distinct from continuous Gaussian noise (exp_155 main-train discard +0.0003) and main-train data-loader noise (exp_624 size_blocked). Targets eval-TTT only — no prior reg trial has corrupted TTT inputs at the token level. Mechanism: denoising-AE regularization forces TTT-adapted weights to be robust to input perturbations rather than memorizing the chunk's exact token sequence. Cross-chunk transfer should improve since adapt-then-score-next-chunk depends on generalization of TTT updates. Code byte cost: ~145 chars. Score-first scoring at line 1356 is untouched (clean inputs). Risk: if 1% rate degrades adaptation more than it helps generalization, val_bpb regresses; the rate is conservative (1/100 tokens) and TTT runs 4 epochs/chunk so the corruption averages out. Distinct from exp_624's data-loader noise (in MAIN training) and exp_155's MAIN-train Gaussian noise on embeddings.
753	2026-04-25T04:24:43Z	loss	596	750	loss	Linearly decay TTT inner-CE z-loss coefficient across 21 epochs: 1e-5 to 1e-5*(1-_ep/h.ttt_epochs). Mechanism-distinct from 9 prior flat-coefficient z-loss variants; front-loads regularization onto fresh-chunk adaptation, gentler as TTT converges.	-0.0003	size_blocked	1.072926		16000037	600.040000	579.800000	1516.000000	apg-loss-0747		Schedule the kept exp_596 z-loss across the TTT epoch loop. _ep and h.ttt_epochs in scope at line 1401. Mean coef ~= 0.5e-5; net code delta +9 bytes after compressing torch.logsumexp(_lf,dim=-1) -> _lf.logsumexp(-1).
754	2026-04-25T04:30:16Z	tok	596	750	tok	Per-head row-segment L2 isotropy at tied tok_emb init: split each row D=512 into H=8 head-segments of hd=64, rescale each segment to identical L2 = std*sqrt(64). Removes per-head magnitude noise from finite-N Gaussian sampling while preserving natural row-magnitude variance.	-0.0001	discard	1.073225	+0.001015	15999003	600.091000	585.800000	1527.000000	apg-tok-0747		Single-site init edit in GPT._init_weights after nn.init.normal_(tok_emb.weight). H=8 hardcoded. Zero new params. +289 code bytes. Distinct from prior init variants: exp_019 full-row sphere (discard), exp_350 semi-orthogonal (discard), exp_466 column-equi-std (discard), exp_551 row-mean-center (size_blocked), exp_158 Zipf (discard). Per-head granularity NOT TRIED.
755	2026-04-25T04:30:40Z	meta	596	750	meta	Per-group BETA2 split: lower scalar AdamW beta2 0.95 to 0.93 (h.beta2 to 0.93 literal at L925), keeping optimizer_tok at 0.95. Untouched axis in 700+ trials.	-0.00010	discard	1.072572	+0.000362	15999879	600.042000	582.700000	1519.000000	apg-meta-0747		Single-literal change at L925 (h.beta2 to 0.93 in optimizer_scalar betas). +7 code bytes, zero model-byte impact, zero compile-graph risk. Mirrors exp_177 keep mechanism (per-group adam_wd split, scalar=0.005). Affects only ~1000 scalar params: ln_scale, qk_gain, attn_out_gate, embed_scale [512], skip_*. Dense per-step gradients with stable variance benefit from sharper beta2; tok_emb stays at 0.95 for sparse rare-token row averaging. All global beta2 probes hurt: 0.96 (exp_724 discard), 0.97 (exp_126 discard), 0.98 (exp_091/159 discard), 0.93 (exp_294 size_blocked at improved bpb), suggesting embed and scalar want opposite directions. Risk: low.
756	2026-04-25T04:34:46Z	eval	746	750	eval	Intra-chunk weight averaging across the 4 TTT epochs: accumulate post-step ttt_params after each epoch's SGD step into _avg_buf, replace ttt_params with the per-epoch mean at the end of each chunk's training. With chunk_seqs=32/world=8/batch=32 (1 step per epoch × 4 epochs/chunk), Nesterov-momentum-compounded trajectories overshoot; averaging the 4 weight snapshots ≈ trajectory midpoint (~62% of full drift), reducing per-chunk overshoot persistently before next chunk's score-first pass. Distinct from exp_588 (momentum buffer halving), exp_735 (cross-chunk EMA, α=0.5), exp_676 (size_blocked tail-avg on single-batch last epoch = no-op).	-0.0002	discard	1.073194	+0.000984	15999569	600.098000	589.700000	1530.000000	apg-eval-0749		3 lines added: _avg_buf init after optimizer creation; accumulate after optimizer.step(); divide+copy+zero after for _ep loop. ~280 code bytes. Runtime memory ~1× ttt_params extra (~10MB). Stacks on top of exp_746's GC + z-loss + freeze-scalars + Nesterov 0.9.
757	2026-04-25T04:35:17Z	quant	596	750	quant	Refit s only on small matrices (rows<1024): exp_747's full-refit ALS scale gave -0.000376 bpb but size_blocked at +891B. Skip the largest scale arrays (tok_emb 8192, mlp_up/gate 2048) which dominated refit's brotli-entropy growth; keep refit on attn proj + mlp.down (rows=512), where weight homogeneity makes refit s less entropy-disruptive.	-0.00015	size_blocked	1.072518		16000234	600.091000	588.600000	1528.000000	apg-quan-0749		Refit covers ~12 attn + 3 mlp.down matrices (~60% of params). Code +215B (golfed comment + one-line refit + guard).
758	2026-04-25T04:36:24Z	curr	746	750	curr	Per-shard independent PCG64([rank,si]) streams for sequence_order in _reset_shard, decoupling within-shard permutation from the shared self.rng chain that also services phase_order draws and shard_plan shuffles — gives each shard a stable replicable permutation history regardless of cross-shard rng activity.	+0.0001	size_blocked	1.074290		16001945	600.009000	595.400000	1538.000000	apg-curr-0749		Two-line edit: (1) __init__ adds self._seq_rng = [Generator(PCG64([h.rank, si])) for si in range(len(self.files))] before the _reset_shard loop. (2) _reset_shard swaps self.rng.permutation(num_sequences) -> self._seq_rng[si].permutation(num_sequences). Code +6 bytes (lzma-compressed). Probe of an untried mechanism: exp_603 tried PCG64([rank,si,_phase_epoch[si]]) per-call (size_blocked, never ran); exp_612 only touched phase_order. Mine creates streams ONCE at __init__ with shard-only seed, deterministic across the whole run. Confidence low — curr is heavily saturated since exp_196.
759	2026-04-25T15:54:14Z	opt	750	750	opt	Per-group Muon momentum cool target — attn (group 0) keeps 0.93 (kept exp_750), mlp (group 1) deepens slightly to 0.94: MLP matrices carry ~16× the parameters of attention matrices and dominate GPTQ int6 fit, so modestly smoother momentum tail reduces per-step weight noise without crossing into 0.95-globally-hurts territory (exp_251 +0.000234).	-0.00005	discard	1.072612	+0.000402	15996414	600.119000	534.900000	1439.000000	apg-opt-0759		"Single-site edit at step_fn momentum block: replaces the `muon_momentum = mm_blend*muon_momentum + (1-mm_blend)*0.93; for group: group[""momentum""]=muon_momentum` with `for gi,group: ct=0.94 if gi else 0.93; group[""momentum""]=mm_blend*muon_momentum + (1-mm_blend)*ct`. Param group ordering verified at Optimizers.__init__ L910-913: gi=0 is matrix_attn_params (h.muon_wd), gi=1 is matrix_mlp_params (h.muon_wd_mlp). Distinct from prior cool-target trials: exp_251 (0.95 globally, discard +0.000234), exp_670 (sqrt mm_blend with same 0.93 target, discard +0.000139), exp_750 (0.93 globally, kept -0.000036). Couples loosely to exp_336's per-group muon_wd asymmetry (attn=0.095, mlp=0.115): higher MLP wd already shrinks weights faster, so a modestly higher momentum cool target preserves direction stability for the weights that have shrunk the most. Bytes: code 23309 → 23345 (+36)."
760	2026-04-25T15:54:36Z	meta	750	750	meta	Per-group BETA2 split on optimizer_tok (tied tok_emb): lower beta2 0.95 to 0.93 at L908 only, leaving optimizer_scalar at 0.93 already. Untested DOWN direction on tok_emb-specific beta2 axis, mechanism-distinct from exp_755 failed scalar-group split (sparse rare-row gradients vs dense control-tensor gradients).	-0.0001	size_blocked	1.072797		16002357	600.125000	582.200000	1509.000000	apg-meta-0759		Single-literal change at L908: (h.beta1, h.beta2) to (h.beta1, 0.93). Code -3 bytes, zero new params, zero compile-graph risk. Mechanism: with beta2=0.95 the 2nd-moment EMA half-life on tied tok_emb 8192 vocab rows is ~14 steps; rare-token rows (Zipfian tail) update once every ~50-200 steps, so denominator EMA decays toward init (~0) before next gradient arrives. Lower beta2=0.93 (half-life ~10) makes denominator more responsive so rare-row preconditioner reflects current scale, not stale near-zero. Symmetric signal: exp_182 raised tok_emb-only beta2 0.95 to 0.98 and lost +0.000345; DOWN side never probed on same group. Distinct from exp_755 which probed SCALAR group (dense per-step gradients) and lost +0.000362. Risk: low single-literal optimizer-state change.
