exp_id	timestamp	specialist	parent_exp	baseline_exp	domain	hypothesis	expected_delta	status	val_bpb	delta_vs_best	artifact_bytes	train_s	eval_s	total_s	job_name	snapshot_path	notes
202	2026-04-22T15:51:47Z	ttt	186	196	ttt	Double TTT_CHUNK_TOKENS 65536→131072: halves num_chunks (~13→7), doubles data per SGD step (64 seqs global vs 32), halves TTT training events — cleaner per-step gradient signal and less drift.	-0.00015	discard	1.076230	+0.000984	15990201	600.086000	692.914000	1410.000000	apg-ttt-0191		"Single-literal edit at line 186: TTT_CHUNK_TOKENS default 65536→131072. Completely untouched TTT knob — prior TTT trials exhausted scalar hypers (lr, epochs, momentum 039, Nesterov 151-keep, weight_decay 161, grad_clip 180, anchor 027, batch_seqs=1 123-abort), state lifecycle (momentum reset 064/113/171), param selection (freeze tok_emb 049, freeze scalars 189, split tok_emb LR 133), and distribution alignment (mask first-half 139). chunk_tokens controls the fundamental ""how often adapt / how much data per adapt"" axis. Doubling cuts num_chunks in half, which (a) doubles data per SGD step → cleaner gradient direction (less chunk-local noise, pairs with Nesterov's lookahead which is noise-sensitive), (b) halves TTT training events → halves TTT training time → safer for 780s eval budget (exp_123 at batch_seqs=1 hit eval_budget_overrun at 787s; this goes the OPPOSITE direction). Cosine LR schedule rescales automatically with num_chunks so total integrated LR×chunks is roughly preserved. Risk: fewer adaptation events may under-adapt — but exp_180 (tighter clip) was only +0.000062 from best, suggesting current adaptation intensity is near-optimum and a gentle reduction via fewer-but-richer events could yield the cleaner-gradient win without regressing."
203	2026-04-22T15:52:48Z	eval	190	196	eval	Cosine-cool TTT SGD momentum in lockstep with existing TTT LR cosine: 0.9→0.5 across chunks (cos_mom = 0.5 + 0.4*cos_frac), matching cos_lr curve. High momentum + small LR at tail otherwise lets stale high-LR velocity dominate updates (Nesterov amplifies effect).	-0.0003	discard	1.075533	+0.000287	15992540	600.101000	752.899000	1465.000000	apg-eval-0194		Single-site edit in eval_val_ttt (~line 1325). Replaces constant momentum=0.9 with per-chunk cosine from 0.9 (ci=0) to 0.5 (ci=N-1). exp_037 tried the same direction but was harness_abort, so untested signal. In the ~4-SGD-step-per-chunk regime, high tail momentum with low tail LR causes overshoot from stale velocity; this aligns momentum inertia with the LR schedule. Zero param / byte impact. Orthogonal to exp_151 Nesterov keep and exp_017 4-epoch keep.
204	2026-04-22T15:54:18Z	meta	190	196	meta	Reduce scalar_lr 0.02 to 0.015 on scalar-params AdamW group (ln_scale, qk_gain, skip_gates, skip_weights, plus exp_190's embed_scale [512] now dominating the group): exp_194 went 0.02 to 0.03 (discard +0.0003) and exp_177 shrank adam_wd on the same group (kept -0.0005), both signalling the group prefers gentler updates now that embed_scale (init=1.0) is present.	-0.0002	discard	1.076515	+0.001269	15998625	600.083000	753.917000	1473.000000	apg-meta-0197		Single-literal edit at train_gpt.py:149 (SCALAR_LR default 0.02 to 0.015). Zero bytes, orthogonal to loss/quant/reg stack. Symmetric direction to exp_194 (which failed raising it).
205	2026-04-22T15:55:40Z	loss	190	196	loss	Stack exp_186's u² position-weighted CE (pw=0.9+0.2·u², mean-preserving) onto exp_190's embed_scale best — position-axis loss tilt has never been composed with the tok-domain embed_scale keep, and exp_190's current baseline reverted to plain F.cross_entropy.	-0.00015	discard	1.075948	+0.000702	15996053	600.048000	713.952000	1413.000000	apg-loss-0197		Rebased workdir to exp_190 (current best); confirmed its forward() uses plain reduction='mean' CE with no position weighting and no label smoothing. Replaced with the exact exp_186 formulation: u=linspace(0,1,T); pw=0.9+0.2·u²; pw/=pw.mean(); loss=(ce*pw).mean(). Mean-preserving so the global gradient magnitude and effective LR schedule are untouched. Expected delta is conservative (~1/4 of exp_186's delta) because (a) some of the position-tilt benefit may already be captured by embed_scale learning long-context features, and (b) stacking wins usually interact sub-additively. Zero-byte, zero-param, one elementwise mul. Single-site edit in CausalDecoder.forward at line ~718.
206	2026-04-22T15:57:28Z	arch	196	196	arch	NormFormer-style sandwich RMSNorm on residual-path outputs: wrap attn_out and mlp_out with F.rms_norm(dim=-1) before multiplying by the existing per-channel attn_scale / mlp_scale, so the learnable scale controls magnitude while direction is unit-RMS normalized.	-0.0008	crash				600.016000	235.984000	945.000000	apg-arch-0200		Block.forward edit only; zero params added (F.rms_norm is parameter-free). Handles both parallel (layers 7-10) and sequential (layers 0-6) residual paths. Safe at init — attn/mlp .proj are _zero_init=True, so attn_out/mlp_out=0 at step 0, and F.rms_norm(0) via eps gives 0 back (unchanged residual add). Literature precedent: Shleifer et al. 2021 NormFormer reports ~0.3 ppl gain on small LMs by decoupling residual-path direction from magnitude. Untried in this lineage — recent arch attempts (exp_188 SwiGLU swap, exp_197 parallel_start 7→3) were surface-level tweaks; this is structurally orthogonal. torch.compile-safe: F.rms_norm is a standard op with no Python-bool control flow, so no graph-break or STE hazard. | torch.distributed.elastic.multiprocessing.errors.ChildFailedError: ============================================================ (train_gpt.py:999 in gptq_quantize_weight)
207	2026-04-22T16:02:25Z	curr	196	196	curr	Halve Latin-square phase bucket count 8→4 in ShuffledSequenceLoader (bucket width seq_len/4=512 vs seq_len/8=256): with only ~2-3 shard-epochs per 600s run, fewer buckets double per-shard phase-range coverage (50-75% vs 25-37.5%) at the cost of coarser per-epoch shifts.	-0.00004	discard	1.076096	+0.000850	15991937	600.067000	761.933000	1484.000000	apg-curr-0198		Three-token edit at lines ~367, 374, 376: rng.permutation(8)→(4), %8→%4, //8→//4. Zero-param, zero-byte. Novel from exp_142 tree: exp_154 (jitter on 8-bucket) and exp_162 (bit-reversal 8-bucket order) discarded, but bucket COUNT has never been perturbed. Rationale: Latin-square phase cycling advances one bucket per shard-reset (shard-epoch). In 600s, each shard resets ~2-3 times so with 8 buckets we cover only 2-3/8 = 25-37.5% of phase offsets per shard. Halving to 4 buckets {0, 512, 1024, 1536} lets the same 2-3 epochs cover 50-75% of phase range → more diverse per-shard training windows. Risk: coarser shift (512 vs 256 tokens/epoch) may reduce smoothness of position distribution; but since each epoch visits entirely new k*seq_len positions, per-epoch granularity is second-order.
208	2026-04-22T16:10:43Z	reg	196	196	reg	Split Muon weight decay on attention matrices by FUNCTION: raise muon_wd_qk=0.14 (1.47x baseline) on c_q/c_k (whose output is immediately RMS-normed, so weight magnitude is scale-invariant for softmax — only direction matters), keep muon_wd=0.095 on c_v/proj (scale-bearing into residual stream).	-0.0004	discard	1.075283	+0.000037	15995190	600.064000	769.936000	1483.000000	apg-reg-0200		Three-site edit: (1) Add Hyperparameters.muon_wd_qk=0.14 after muon_wd_mlp (line ~172). (2) Optimizers.__init__ splits matrix_attn_params into matrix_attn_qk_params (c_q/c_k) and matrix_attn_vo_params (c_v, proj). (3) Muon param_groups grows from 2 to 3 groups. Zero params, zero model bytes. Orthogonal to exp_164 (type split mlp vs attn, kept -0.000024) and exp_141 (depth split, kept -0.000274) — both proved per-bucket WD is worth tuning; this splits WITHIN attention by whether the linear output is norm-followed. Rationale: q_gain already controls attention sharpness, so heavy WD on Q/K can't reduce attention capacity but still pulls weights toward origin for cleaner optimization. V and out_proj remain scale-bearing so stay at baseline.
209	2026-04-22T16:12:47Z	eval	196	196	eval	Extend eval_seq_len 2048→2560: YaRN-style RoPE scaling (already implemented in Rotary) + partial RoPE (16/64 dims, 75% NoPE channels) lets scored tokens see ~2496 tokens of context instead of 1984 (26% deeper), at ~1.3-1.5x eval fwd cost; also deepens TTT training sequences since both share eval_seq_len.	-0.0015	crash						812.000000	apg-eval-0207		Single-literal edit to Hyperparameters.eval_seq_len default (line 115) from 2048 to 2560. Rotary.forward already branches on seq_len > train_seq_len to apply YaRN NTK-aware base scaling (new_base = base * scale**(rd/(rd-2))), so this exercises an existing extrapolation path. rope_train_seq_len=2048 stays; scale=1.25. Partial RoPE at rope_dims=16 (vs head_dim=64, i.e. 75% NoPE dimensions) should make extrapolation robust — NoPE channels attend position-implicitly and are length-invariant. Eval budget risk is modest: 2560^2/2048^2 = 1.56x attention flops per window, ~1.25x MLP, num_windows slightly down (context_size grows to 2496, last ws pushed back by 512), net ~1.35x eval fwd compute. TTT also uses eval_seq_len for reshape(.,seq_len), so chunk_seqs = 65536//2560 = 25 (down from 32), slightly fewer SGD steps per chunk but each step now trains on 25% longer sequences. No size/param change. Untried direction in eval domain: exp_024 touched stride (aborted), exp_044 tried temperature (discard), no eval_seq_len extension ever attempted. | torch.distributed.elastic.multiprocessing.errors.ChildFailedError: ============================================================ (train_gpt.py:1182 in eval_val)
210	2026-04-22T16:13:30Z	opt	196	196	opt	Linear grad_clip_norm anneal in lockstep with lr_scale: clip * (0.5 + 0.5*lr_scale), i.e. 0.3→0.15 as lr_scale 1.0→0.0. No-op at peak-LR, tightens in warmdown tail to reduce outlier-gradient contamination of EMA-averaged weights.	-0.0004	discard	1.075678	+0.000432	15996822	600.110000	750.890000	1461.000000	apg-opt-0201		Single-site edit at step_fn ~line 1458. Revives the exp_036 aborted idea (never ran — harness_abort). Orthogonal to exp_010 (momentum cool) and exp_088 (momentum warmup fraction). No param count change. Rationale: in warmdown tail, EMA accumulates heavily and typical grad norm is small; clip rarely activates on typical steps but damps occasional spikes that LR no longer masks.
211	2026-04-22T16:15:36Z	tok	196	196	tok	Restore exp_190's learnable per-feature embed_scale gamma (shape=[512], init=1.0) applied right after the input-embed RMSNorm on top of exp_196 baseline — the current best exp_196 (curr: stratified shard sampling) was rebased off a pre-exp_190 parent and so dropped the embed_scale keep; combining the two orthogonal kept changes should recover both deltas.	-0.0004	discard	1.075405	+0.000159	15996733	600.015000	770.985000	1486.000000	apg-tok-0201		Three-site edit on exp_196 snapshot: (1) new nn.Parameter torch.ones(embedding_dim) declared right after self.tok_emb in GPT.__init__; (2) forward_logits multiplies `F.rms_norm(x, (x.size(-1),))` by `self.embed_scale.to(x.dtype)` before the optional embed_proj; (3) Optimizers.__init__ appends base_model.embed_scale to scalar_params (via hasattr guard) so it joins the scalar AdamW group with skip_weights/skip_gates. 512 fp32 scalars = 2 KB (fp16 passthrough in the quantized artifact, numel << 65536). Semantically orthogonal to exp_196's stratified shard sampling (data-side) — expected effect additive to exp_190's -0.000463 keep.
212	2026-04-22T16:17:48Z	quant	196	196	quant	Raise GPTQ Hessian damping 0.01→0.02 (2×): exp_016 already showed 0.01→0.003 hurt bpb by +0.000354, so the opposite direction is untried and motivated — higher ridge gives smoother Hinv, less error amplification across block-sequential cascades, lower-entropy Q (compression-friendly) on a 36M model with noisy 64-batch H estimates.	-0.0003	keep	1.075022	-0.000224	15992374	600.039000	760.961000	1471.000000	apg-quan-0202	snapshots/212_quant	Single-literal change in gptq_quantize_weight (damp coefficient 0.01→0.02). Size-neutral: same Q/s tensor shapes and dtypes; if anything, slightly lower-entropy Q should compress marginally smaller. Orthogonal to row_std weighting (exp_201 size_blocked) and block_size shrink (exp_192 discard) — those directions are exhausted. Symmetric to exp_016 about baseline: exp_016 went 3.3× below (hurt +0.000354), this goes 2× above.
213	2026-04-22T16:21:26Z	ttt	196	212	ttt	Reset SGD momentum buffer at each TTT chunk boundary (optimizer.state = defaultdict(dict)) so each chunk adapts locally rather than inheriting stale momentum from prior chunks' (different-distribution) gradients.	-0.0004	discard	1.075973	+0.000951	15995853	600.086000	767.914000	1480.000000	apg-ttt-0205		Single-site edit in eval_val_ttt (~line 1350): after setting cos_lr for the current chunk, clear optimizer.state to a fresh defaultdict before the inner train loop. Structurally untried — all prior TTT trials (exp_014/017 epochs, exp_039 momentum-value, exp_151 nesterov, exp_193 lr-floor, exp_202 chunk-size) tuned scalar hypers; optimizer-state carry-over across chunks is orthogonal. Motivation: chunks span different documents with distribution shift; momentum accumulated from chunk N biases the first step(s) of chunk N+1 with direction that no longer matches chunk N+1's local data distribution. Anti-correlates with exp_039 (0.9→0.95 discard, +0.000178): less effective momentum at chunk transitions = similar sign to lower per-step momentum. Zero memory/compute cost vs baseline; just freshens the momentum_buffer at each of ~13 chunk boundaries.
214	2026-04-22T16:24:50Z	meta	196	212	meta	Raise matrix_lr (Muon LR on ~29M matrix params) 0.022 → 0.024 (+9%): completely untouched core LR knob across ~200 trials; Muon's Newton-Schulz normalization bounds spectral-norm updates, so LR bumps translate to proportionally larger but still-stable steps during the narrow ~6% peak-LR+peak-momentum window.	-0.0003	discard	1.075202	+0.000180	15992785	600.014000	759.986000	1473.000000	apg-meta-0207		Single-literal edit at line 148 (MATRIX_LR default 0.022 → 0.024). Zero param count change, zero byte impact, zero eval cost. matrix_lr verified untouched across history (exp_152 references it as a constant when computing clip bounds but doesn't tune it; no experiment in results.tsv/KNOWLEDGE.md sweeps it). Orthogonal to loss-weighted CE (exp_186), scalar-WD reduction (exp_177), embed_scale (exp_190), Nesterov-TTT (exp_151), stratified shard sampling (exp_196). Risk: 3-layer recurrent segment sees the same weights receive grad signal 3× per forward, so a larger LR there could destabilize looped layers — mitigated by the small 9% radius and the fact that Muon's NS-orthogonalization caps per-step update magnitude at ~matrix_lr*sqrt(aspect_ratio).
215	2026-04-22T16:28:44Z	arch	196	212	arch	Disable XSA on looped layers [loop_start..loop_end] only: repeated V-direction subtraction across num_loops+1=3 passes over-whitens iterative refinement; non-looped layers keep XSA.	-0.0004	discard	1.449037	+0.374015	15868554	600.040000	759.960000	1474.000000	apg-arch-0207		Single-site edit in GPT.__init__ (~line 660). XSA stays ON for layers 0-2 and 6-10 (non-looped single-call layers) and OFF for layers 3-5 (looped, called num_loops+1=3 times each). Zero bytes added; zero new params. Targeted structural hypothesis orthogonal to optimizer/loss/quant stack. exp_028 tried xsa_last_n 11→5 (harness_abort) — this is a different cut (loop-aware, surgical) and has not been evaluated. exp_197 proved forcibly expanding parallel_residual over recurrent layers is catastrophic (+0.012), but that changed info-flow topology; XSA is a post-attention V-orthogonalization and its over-application on repeated passes is an unexplored axis.
216	2026-04-22T16:30:06Z	loss	196	212	loss	Anti-focal CE reweighting (γ=0.5): multiply existing u² PW by w = exp(-ce.detach()/2) (= p_correct^0.5), mean-preserving, stacked on the current u²-PW-CE. Tests the symmetric opposite of the failed focal-γ=0.5 (exp_054, +0.002535) and focal-γ=1 (exp_144, +0.009038) — downweight near-floor hard tokens so gradient concentrates on reducible-loss positions.	-0.0008	discard	1.765836	+0.690814	15993764	600.075000	789.925000	1501.000000	apg-loss-0208		Single-site edit inside GPT.forward(), just after the existing pw is built. Adds 3 lines computing afw = exp(-ce.detach()*0.5)/mean and changes return to (ce*pw*afw).mean(). Detached weight so backprop flows only through ce; mean-preserving so global gradient scale is unchanged. Zero new params, zero bytes at inference (training-only). Focal loss (hard-token upweighting) has been tried twice and consistently hurt; anti-focal (easy-token upweighting) has never been tested in this tree — symmetry argues it should produce an improvement of similar magnitude. Stacks cleanly on exp_196's u² PW-CE + embed_scale + stratified shard sampling because anti-focal operates on the per-token-loss axis, orthogonal to position-axis PW and shard-axis sampling. If it discards, the signal is that hard-token gradient IS reducing BPB despite focal's failure mode (suggesting focal's damage came from something other than the reweight direction, e.g. gradient-scale drift).
217	2026-04-22T16:35:09Z	curr	196	212	curr	Mask first 64 positions of target_ids with ignore_index=-100 in training CE (forward), aligning training regime with sliding-window eval which dominantly scores positions with ≥1984 tokens of prior context (eval stride=64).	-0.0008	discard	1.076098	+0.001076	15993620	600.012000	755.988000	1465.000000	apg-curr-0208		Two-line edit in GPT.forward: clone target_ids, set target_ids[:, :64] = -100 (cross_entropy ignore_index default). Zero params, ~80 bytes. Drops 3.1% of per-batch gradient tokens (low-context, dominated by unigram priors) so remaining gradient signal targets the high-context regime eval scores. Prior curriculum masking trials were inconclusive: exp_013 (K=32) size_blocked, exp_078 (K=4) harness_abort — neither yielded a val_bpb. K=64 here matches eval stride exactly (every trained position has ≥64 ctx, same minimum as every eval-scored position except the very first window). TTT inner training also inherits this mask via the shared forward(); loses ~3% gradient per chunk but minor impact.
218	2026-04-22T16:41:04Z	reg	196	212	reg	"Constant-effective-WD on the tied tok_emb during warmdown: boost optimizer_tok weight_decay by 1/max(lr_scale, 0.5) (cap 2x) in step_fn so the per-step decay factor (1 - lr*wd) on tok_emb stays roughly constant through warmdown — tightens the tied embedding (which doubles as output head) exactly when LR is cooling.</hypothesis> <parameter name=""notes"">Single-site edit in train_model.step_fn right after the LR-scaling loop. Zero new params, no arch change. In baseline, effective embed-WD per step (lr*wd) decays proportionally to lr_scale during warmdown. This edit keeps it roughly constant for the first half of warmdown (lr_scale in [1.0, 0.5]) then clamps (wd_boost=2x) for the second half. Target: compress tied-embedding weight norms more aggressively in the warmdown tail for better generalization AND better brotli compressibility on the output-head int6 codes. Novel reg direction — prior reg keeps (exp_141 depth-split Muon-WD, exp_164 type-split Muon-WD) both targeted Muon matrix groups; this is the first scheduled AdamW-WD intervention, orthogonal to them. Skeptical case: if equilibrium embed norm shrinks too much, softmax logit magnitudes drop and TTT can't recover them — hence the conservative 2x cap (not 4x)." -0.0002 discard 1.076997 +0.001975 15993295 600.139000 765.861000 1476.000000 apg-reg-0211  
219	2026-04-22T16:45:33Z	tok	196	212	tok	Add learnable per-vocab logit bias (8192 fp32 scalars, zero-init, passthrough fp16): decouples output frequency prior from tied tok_emb rows that otherwise must serve as both compositional-meaning vectors AND likelihood-prior vectors. Added before tanh softcap; trained via scalar AdamW group (scalar_lr=0.02, adam_wd=0.02).	-0.0006	size_blocked	1.075628		16010104	600.055000	752.945000	1466.000000	apg-tok-0213		Three-site edit on exp_196: (1) new nn.Parameter torch.zeros(h.vocab_size)=[8192] fp32 declared right after lm_head block in GPT.__init__; (2) forward_logits adds logit_bias[None,None,:] to logits_proj before the tanh softcap; (3) Optimizers.__init__ appends logit_bias to scalar_params so it receives scalar_lr/adam_wd via AdamW. Zero-init matches current behavior at t=0. 8192 numel < 65536 passthrough threshold in gptq_mixed_quantize → fp16 passthrough, +16KB artifact bytes. TTT auto-includes via base_model.parameters(). Revives exp_023 direction (harness_abort, never ran). Novel vs kept tok trials: exp_011 (tied std init), exp_019 (sphere init), exp_038 (lower std), exp_049 (freeze in TTT), exp_190 (per-feature embed_scale [512]). Orthogonal to exp_190's feature-axis scale — this is a vocab-axis decoupling.
