exp_id	timestamp	specialist	parent_exp	baseline_exp	domain	hypothesis	expected_delta	status	val_bpb	delta_vs_best	artifact_bytes	train_s	eval_s	total_s	job_name	snapshot_path	notes
871	2026-04-26T01:22:01Z	arch	750	750	arch	Universal-Transformer-style per-loop-pass additive bias [num_loops+1=3, model_dim=512] added to the residual stream right before each looped-block (3-5) call under looping_active, giving the shared block params an explicit phase tag for the 3 iterative-refinement passes; init=0 → step-0 baseline.	-0.0008	crash						20.000000	apg-arch-0871		Looped blocks 3-5 currently see identical conditioning across all (num_loops+1)=3 visits per forward — no temporal/iteration signal. Geiping et al. 2025 (arxiv 2502.05171) confirm input re-injection alone keeps recurrent dynamics stable but explicitly argue against iteration counters; however our setup differs (shared-block recurrence stitched into a non-recurrent stack via flat all_indices, not a native recurrent stream), and PR-library gaps.md Gap 9 lists Universal-Transformer-style timestep embeddings as untried. Implementation: precompute encoder/decoder pass_idx lists during __init__ (sharing a counts dict across enc→dec to handle the mid-loop split where encoder ends at all_indices[8]); in forward_logits add `loop_pass_emb[pass_idx]` to x before each looped-block call gated on looping_active. Param: nn.Parameter(zeros(3, 512)) on GPT, registered in CONTROL_TENSOR_NAME_PATTERNS (fp32-restored, scalar-AdamW group, TTT-frozen via numel<10000), explicitly appended to scalar_params in Optimizers.__init__ (parallel to embed_scale handling, since loop_pass_emb sits on base_model not base_model.blocks). Quant path: numel=1536 ≤ 65536 → fp16 passthrough (no GPTQ noise on this control tensor). Byte cost: 1536×2 = 3072 raw fp16 bytes; brotli on near-zero (and after training, small-magnitude) values estimated 200-500 bytes packed. Risk: torch.compile recompile when looping_active flips True mid-train (already happens with existing self.looping_active branches in forward_logits, so no new mechanism). Falsification: if the network converges loop_pass_emb to ~0 (no useful per-pass signal), Δ ≈ noise floor. | torch.distributed.elastic.multiprocessing.errors.ChildFailedError: ============================================================ (train_gpt.py:1529 in step_fn)
872	2026-04-26T01:40:43Z	quant	750	750	quant	Halve GPTQ block_size 32→16: 2× more error-propagation flushes per matrix, continuing the proven 128→64→32 monotone-improvement trend; code distribution unchanged so size-safe.	-0.0003	discard	1.072687	+0.000477	15998635	600.065000	587.400000	1525.000000	apg-quan-0871		exp_108 (128→64, keep Δ=-0.000079) and exp_261 (64→32, keep Δ=-0.000272) both improved bpb. block_size=16 extends this sequence. No change to scale (row_std-based), no change to code range [-31,+31]; only error propagation within blocks is more frequent. Size should match baseline. GPTQ compute time increases ~2× but is dominated by forward passes; no eval budget risk expected.
873	2026-04-26T01:44:43Z	opt	750	750	opt	Raise EMA decay from 0.9965 to 0.9975: extends the weight-averaging window from ~286 steps to ~400 steps, capturing more of the near-converged warmdown trajectory for smoother GPTQ int6 quantization fidelity.	-0.0001	discard	1.072811	+0.000601	15994533	600.126000	585.400000	1525.000000	apg-opt-0871		UP direction of ema_decay axis never tried. exp_730 tried linearly cooling ema_decay (DOWN, 0.9965→0.995) and got eval_budget_overrun (timing coincidence unrelated to hypothesis). With warmdown_frac≈0.72 and ~2500-3500 training steps, warmdown covers ~1800-2520 steps. The last 400 steps all have LR &lt; 0.22 (near-converged weights). Averaging over 400 steps instead of 286 gives a smoother EMA that represents the converged distribution more faithfully for GPTQ calibration. One-literal change (0.9965→0.9975), zero code size impact. EMA_DECAY env var not injected by harness so default is used.
874	2026-04-26T01:44:57Z	eval	750	750	eval	Stack GC (proven exp_746 keep) + within-chunk TTT cosine LR warmdown (ep_lr = cos_lr * 0.5*(1+cos(π*ep/ttt_epochs)), ep=0→1.0x, ep=3→0.15x) onto exp_750: symmetric extension of the already-working cross-chunk cosine decay into the per-epoch dimension.	-0.0002	discard	1.072294	+0.000084	15997764	600.114000	499.700000	1362.000000	apg-eval-0871		GC: zero-mean per-row gradient (4-line add, proven keep in exp_746 +0.000005). Within-chunk warmdown: decays TTT lr from cos_lr to ~0.15*cos_lr over 4 epochs, giving a stable final adapter state per chunk. Together 5 lines of new code. Rebased from exp_750 (which lacks GC).
875	2026-04-26T01:45:17Z	meta	750	750	meta	TIED_EMBED_INIT_STD 0.005 to 0.004 (-20% DOWN, byte-neutral): symmetric mirror of exp_863's +20% UP probe (discard +0.000190). DOWN direction genuinely untouched. Tighter tok_emb init drops initial logit RMS 0.113 to 0.090, starting softmax closer to uniform so CE gradient flows more uniformly across rare rows in the first ~50 Adam steps before embed_wd=0.085 takes over. Aligned with meta DOWN-direction theme (exp_177 adam_wd, exp_336 muon_wd_mlp, exp_792 scalar_lr signal).	-0.0001	discard	1.072965	+0.000755	15997450	600.058000	583.200000	1530.000000	apg-meta-0871		Single-literal change at L147 default 0.005 to 0.004. Byte-neutral, zero new params, zero compile-graph/quant-path risk. Symmetric exp_863 UP probe hurt only +0.000190 indicating shallow surface; DOWN side worth probing on this stale axis.
876	2026-04-26T01:48:43Z	loss	750	750	loss	Self-anchored TTT z-loss: replace 1e-5*logsumexp^2.mean() with 1e-5*(logsumexp - anchor).^2.mean() where anchor=per-chunk initial logsumexp captured on first mini-batch — penalizes drift from starting calibration rather than absolute magnitude, reducing competing gradient pressure on well-calibrated chunks while still stabilizing explosive drift.	-0.0001	discard	1.072554	+0.000344	15994786	600.120000	588.500000	1529.000000	apg-loss-0871		Standard z-loss always pushes logsumexp toward 0 (1e-5*lse^2 gradient: 2*1e-5*lse*p_i). Self-anchored z-loss sets anchor=starting lse per chunk: gradient is zero when lse stays near anchor, kicks in only for drift. This should allow more effective adaptation on chunks where the model starts well-calibrated (high logsumexp is natural, not pathological). Distinct from exp_694 (fixed anchor at log(V)=9.011 constant — size_blocked) and exp_596 (origin-anchored, keep). Implementation: _anchor_lse=None before epoch loop, set on first forward pass of each chunk via .mean().detach().
877	2026-04-26T01:49:04Z	reg	exp_750	750	reg	Add z-loss (lambda=1e-5, logsumexp^2) to main training forward — same formula as exp_596's proven TTT z-loss, applied to main training CE to regularize logit magnitudes during training; final BPB metric unaffected (eval_val_sliding/TTT use forward_logits directly).	-0.0003	discard	1.074191	+0.001981	15997178	600.060000	576.900000	1514.000000	apg-reg-0871		Z-loss in TTT (exp_596) improved BPB by -0.000188; main-training z-loss applies same logit-magnitude regularization during gradient updates. Lambda=1e-5 matches TTT. model.forward() used for training gradients and intermediate val_loss logging; final metric path (eval_val_sliding, eval_val_ttt) calls forward_logits directly so z-loss has no direct effect on reported BPB. Mechanism: prevents logit explosion / attention entropy collapse during training (Zhai 2023), potentially improves final weight calibration for GPTQ quantization. Code delta +~200 bytes.
878	2026-04-26T01:49:44Z	curr	750	750	curr	Inverted linear position ramp on training CE: w[t]=1.25-0.5*t/(T-1) upweights early/short-context positions (t=0→w=1.25) and downweights late/long-context (t=T-1→w=0.75), mean=1.0. TTT and sliding eval bypass via forward_logits. Direction opposite to discarded exp_859 (0.9→1.1 upweight-late); improves short-context language prior quality.	-0.001	discard	1.072820	+0.000610	15998990	600.060000	592.000000	1535.000000	apg-curr-0872		All upweight-late variants (exp_859 linear 0.9→1.1, exp_237 step last-64 1.5x) discarded. Inverted direction genuinely untried. Mechanism: stronger gradient signal at t=0..1024 sharpens unigram/bigram priors; better prior initialization benefits ALL context depths since long-context prediction extends from priors learned at short-context. Eval first window scores depth 0-2047 uniformly (2048 tokens); subsequent windows each contribute 64 tokens at depth 1984-2047. Mean-normalized weight preserves gradient scale.
879	2026-04-26T01:50:34Z	tok	750	750	tok	Decouple embed_scale from x0: apply embed_scale only to working stream x entering block 0, while residual baseline x0 uses plain unit-RMS (no embed_scale). Currently x0=x after the scaled norm, so embed_scale affects BOTH paths. With plain x0, each block's mix[1]*x0 residual injection gets an unbiased token reference, letting mix weights learn unconstrained feature selection without embed_scale double-counting the feature weighting.	-0.0002	discard	1.072515	+0.000305	15992652	600.106000	580.500000	1520.000000	apg-tok-0872		Zero new parameters. x (block-0 input) unchanged — same embed_scale-inside-RMSNorm as exp_298/750. Only x0 (residual baseline injected at all 11 blocks via mix[1]*x0) is now plain F.rms_norm(x) without embed_scale. Opposite structural direction to exp_711/820 (which moved embed_scale to x0 only and hurt on exp_750 lineage). Code delta: +16 bytes. Size risk lower than exp_820 since block-0 training dynamics are unchanged.
880	2026-04-26T01:51:42Z	arch	750	750	arch	Universal-Transformer-style per-loop-pass additive bias [num_loops+1=3, model_dim=512] added to the residual stream right before each looped-block (3-5) call, giving the shared block params an explicit phase tag for the 3 iterative-refinement passes; init=0 → step-0 baseline; DDP-safe via zero-coeff anchor pulling all rows into the autograd graph.	-0.0008	size_blocked	1.072880		16000913	600.070000	586.000000	1511.000000	apg-arch-0872		"Re-submit of exp_871 after fixing the DDP ""some params did not receive gradients"" crash that fired during the non-looping warmup phase (line 1553 — looping_active=False, so loop_pass_emb[1],[2] were never reached on the forward path while DDP+fullgraph torch.compile required all params to be used). Three-part fix: (1) precompute matched _enc/_dec_pass_idx_noloop = [0]*N lists for the runtime non-looping iteration order so the indexing path is consistent across both modes (even though all values are 0 in noloop mode, the LIST length matches enc_iter/dec_iter under that mode); (2) ungate the bias addition — always-apply when self.loop_pass_emb is not None and i is in [loop_start..loop_end], picking enc_pass_idx based on self.looping_active; (3) DDP anchor in forward_logits adds `0.0 * loop_pass_emb.sum()` to logits_proj so every row (including [1],[2] which are unreached during warmup) appears in autograd graph — gradient is 0, no forward-output effect. Mechanism unchanged: shared looped blocks 3-5 still receive a learned per-pass offset under looping_active that lets the shared params condition behaviour on iteration index. Param count and quant path identical (3x512 fp32 train-side, fp16 passthrough at quant time, 3072 raw bytes / few hundred packed). Risk: the no-op DDP anchor adds one .sum() + .to(dtype) + add op per forward — trivial compute. Falsification: if loop_pass_emb stays at zeros (network finds no useful per-pass signal), delta ≈ noise floor."
881	2026-04-26T01:53:35Z	ttt	750	750	ttt	TTT MLP-only adaptation: freeze all attention (Q/K/V/O) across all blocks during TTT inner loop, adapt only tok_emb + MLP (fc/proj) layers. Motivated by TTT-E2E (arXiv 2512.23675) finding that freezing attention/embeddings and updating only MLP layers avoids inner-loop instability and improves adaptation quality.	-0.001	discard	1.072970	+0.000760	15998136	600.041000	583.900000	1517.000000	apg-ttt-0872		Attention matrices control routing (document-invariant structure), MLP layers encode adaptable factual/distributional knowledge. TTT-E2E paper specifically found attention-freezing necessary for TTT stability; TTT-KVB variant (update MLP in last 1/4 blocks only) confirmed the MLP-only insight. Our prior exp_806 tried per-block LR scaling (regressed +0.005), but MLP-only freezing is structurally distinct. Removes ~8.6M attention params from adaptation, keeping ~4.2M tok_emb + ~11*2M MLP. Net +31 packed code bytes (19815→19846).
882	2026-04-26T02:18:31Z	opt	750	750	opt	Raise muon_wd (attn group) from 0.095 to 0.105 (~10% UP): attn WD has never been independently probed UP since the attn/MLP split (exp_164); MLP WD moved 0.095→0.125→0.115 (two keeps) while attn stayed at 0.095 — tighter attn weight distributions should improve GPTQ int6 fidelity similarly to how higher MLP WD helped.	-0.0002	discard	1.072522	+0.000312	15994748	600.103000	579.800000	1517.000000	apg-opt-0881		Global muon_wd 0.095→0.105. exp_869 tried looped-block attn WD→0.115 (discard +0.000143) but that's only looped blocks and a bigger jump. exp_164 raised MLP WD 0.095→0.125 (keep), exp_336 settled MLP at 0.115 (keep). Attn WD at 0.095 is the only Muon WD axis untouched in the UP direction since the split. Single-literal change, zero code bytes delta.
883	2026-04-26T02:18:48Z	meta	750	750	meta	ENABLE_LOOPING_AT 0.35 to 0.40 (gentle +14% UP probe on a genuinely untouched UP direction): only prior probe on this axis was exp_536 (DOWN to 0.28, hurt +0.000440); UP direction is freshly unexplored across 870+ trials. Mechanism aligns with SHIFT staged-training principle — give layers 3-5 more single-pass training in the peak-LR window so they build cleaner base representations before the 3x recurrence multiplier engages, shifting bulk of looped-mode training into the warmdown's smoother gradient regime.	-0.0003	discard	1.072729	+0.000519	15997234	600.128000	583.100000	1508.000000	apg-meta-0881		Single-literal default change at line 139 (ENABLE_LOOPING_AT 0.35 to 0.40). Byte-neutral (4 chars to 4 chars), zero new params, zero compile-graph or quant-path risk. Schedule context: warmdown_frac=0.58 means warmdown starts at frac=0.42, so loop activation moves from 7pp before warmdown (current 0.35) to 2pp before warmdown (0.40). The looped block runs in 1-pass mode for 95% of the peak-LR phase before switching to 3-pass mode near the warmdown threshold. Mechanism-orthogonal to all 90+ prior meta probes (Adam beta/eps/wd/embed_wd/scalar_lr/matrix_lr/momentum-warmup/grad_clip/EMA): this is the SCHEDULE-of-architectural-transition axis, distinct from rate hyperparameters. Symmetric DOWN failure (exp_536 +0.000440) leaves UP genuinely unknown; under the modern stack with 5 added regularizers since exp_536 (z-loss, attn_out_gate, scalar-freeze, GC-on-TTT, mm_blend cool), the looped-layer transition is more stable so a later activation is less likely to starve compute. Risk: low — single-literal, byte-neutral; downside risk is that loop layers get slightly less compute total which could regress symmetrically if optimum is at 0.35.
884	2026-04-26T02:19:18Z	eval	750	750	eval	Stack chunk-boundary TTT momentum-buffer halving (mul_(0.5) at ci>0, exp_588 technique, Δ=-0.000727 from exp_538 but absent from exp_750 lineage) plus GC row-centering (exp_746, absent from exp_750), removing exp_874's discarded per-epoch cosine LR.	-0.0004	discard	1.072957	+0.000747	15995989	600.079000	582.000000	1517.000000	apg-eval-0881		exp_874 had GC+within-epoch-cosine on exp_750 baseline → discard +0.000084. This trial keeps GC, removes the harmful within-epoch cosine, and adds momentum halving at chunk boundaries. exp_588 showed momentum halving gave -0.000727 from exp_538 but that branch (538→588) was bypassed in favour of 538→596→750. exp_769 (ttt) tried this on exp_750 but was size_blocked — code addition is minimal (3 lines) so should fit.
885	2026-04-26T02:24:59Z	arch	750	750	arch	Asymmetric RoPE coverage: looped blocks 3-5 get rope_dims=32 (2× the global default) while non-looped blocks (0-2, 6-10) keep rope_dims=16. Composes with the bifurcated q_gain[H,2] (each block keeps its own per-region gain) and tests whether 3×-replayed iterative-refinement layers benefit from finer per-pass positional discrimination, while non-looped blocks retain NoPE bandwidth for content-key roles.	-0.0002	discard	1.073904	+0.001694	15997645	600.038000	589.000000	1525.000000	apg-arch-0882		Single-site edit at GPT.__init__ rope_dims setup (lines 663-669): per-block conditional rope_dims = min(2*h.rope_dims, head_dim)=32 if loop_start ≤ i ≤ loop_end else h.rope_dims=16. exp_005 globally raised rope_dims 16→32 and was the biggest arch keep ever (-0.000788) but lineage was lost at exp_014; exp_160 tried global restore and discarded (+0.000979) — the present stack rejects full-coverage RoPE. Asymmetric application is novel: it concentrates extra positional info on the heavy 3×-recurrent blocks while leaving the parallel-residual decoder (7-10) and early encoder (0-2) at their proven 16/64 partial-RoPE split. Byte-neutral (only int attribute + non-persistent Rotary buffer changes). q_gain[H,2] composition is preserved per-block — looped blocks just have a 32:32 RoPE/NoPE split vs non-looped's 16:48.
886	2026-04-26T02:25:49Z	tok	750	750	tok	Add output-side per-feature head_scale [dim=512, init=1.0] applied to x before the tied LM head projection, giving the model independent input/output feature-importance weights under the tied-embedding constraint (distinct from exp_775 which reused the same embed_scale).	-0.0003	discard	1.074825	+0.002615	15978265	600.128000	585.500000	1519.000000	apg-tok-0882		exp_267/298 established embed_scale as a useful input-side feature re-weighting. exp_775 tried reusing the same embed_scale at the output (discard: coupling input and output scales under tied embeddings hurts). A separate head_scale allows the model to learn asymmetric feature importance: embed_scale controls which features dominate the residual-stream input, head_scale controls which features drive the vocabulary projection. numel=512 → passthrough float16 in GPTQ (~1KB uncompressed, ~200B compressed), TTT auto-freezes it (numel<10000), added to scalar_params AdamW group.
887	2026-04-26T02:25:58Z	reg	750	750	reg	Lower muon_wd_mlp 0.115 → 0.108 (−6.1%), continuing exp_336's proven DOWN direction (0.125→0.115 was keep Δ=−0.000109); exp_773 had the same edit but was size_blocked from dirty workdir — clean rebase to exp_750 removes that blocker.	-0.00004	discard	1.073658	+0.001448	15993548	600.098000	580.000000	1516.000000	apg-reg-0882		Single-literal change at line 168 (MUON_WD_MLP default 0.115 to 0.108). Zero code-size delta. The MLP Muon WD governs weight shrinkage on all mlp.fc/mlp.proj matrices. exp_164 raised it from 0.095→0.125 (keep), exp_336 lowered 0.125→0.115 (keep Δ=−0.000109). The consistent DOWN direction suggests the optimum is below 0.115; 0.108 is the next probe. Lower WD gives MLP slightly more representational capacity while still anchoring weights for GPTQ int6 quantization. exp_773 targeted exactly this change but was blocked by accumulated workdir code from earlier sessions.
888	2026-04-26T02:26:50Z	quant	750	750	quant	3-level quantile GPTQ damping (correct direction): top-20% H-diag cols get 1.015x, middle 60% keep 1.01x, bottom-20% get 1.005x — iso-mean 1.01 but concentrates ridge on high-importance columns so their error propagates more aggressively to less-important followers.	-0.00007	discard	1.072256	+0.000046	15996151	600.072000	588.600000	1527.000000	apg-quan-0882		Direction: exp_658 tried OPPOSITE allocation (1.005 for high-H, 1.015 for low-H) → discard +0.001121. exp_818 tried continuous proportional H_ii/mean version → size_blocked at val_bpb=1.072053 (would be -0.000157). This discrete 3-level variant is conservative: only top/bottom 20% of columns are touched, with ±0.005 delta from 1.01. Mean damping = 0.2*1.015+0.6*1.01+0.2*1.005 = 1.01 exactly. Size risk: minimal since ±0.005 change affects Q distribution much less than exp_818's proportional approach (which could reach 1.05x for 5σ columns).
889	2026-04-26T02:30:07Z	curr	750	750	curr	Replace Latin-square 8-bucket phase cycling with golden-ratio Weyl sequence: phase=int((si+k)*φ%1*max_phase), giving 13 distinct near-optimally-spread phase offsets across 13 shards/rank vs ≥5 duplicate phases under 8-bucket pigeonhole; also saves ~50 packed bytes by removing _phase_order initialization.	-0.0001	discard	1.074786	+0.002576	15992799	600.057000	599.300000	1547.000000	apg-curr-0882		Golden-ratio step φ≈0.618 gives the maximally equidistributed linear sequence for any prefix length. With 13 shards/rank at k=0: phases at fractions [0, 0.618, 0.236, 0.854, 0.472, 0.090, 0.708, 0.326, 0.944, 0.562, 0.180, 0.798, 0.416] of max_phase — all unique, max gap 0.090 vs Latin-square's max gap 0.125 with some shared phases. Also removes 104 PCG64 draws at init (13 shards × 8-element permutation), leaving sequence_order permutations in a slightly different RNG state. Since shards never exhaust during 600s training (~1080 draws from 48828 sequences), the phase selected at init is the ONLY phase used for the full run — making this choice matter more than the reset behavior.
890	2026-04-26T02:30:42Z	loss	750	750	loss	Entropy-floor hinge at 4.0 nats stacked on TTT z-loss: 1e-4*F.relu(4-H(p)).mean() where H(p)=lse-sum(p*x), computed cheaply by reusing the lse from z-loss. Threshold=4 nats activates for well-predicted tokens (p1>~60%), adding distribution-shape anti-drift complementary to z-loss's scale control; exp_825's threshold=1 nat was inactive (H>>1 for all typical tokens) producing noise delta of +0.000056.	-0.0001	discard	1.072465	+0.000255	15996189	600.041000	588.300000	1521.000000	apg-loss-0882		H(p) = logsumexp(x) - E_p[x] identity avoids log_softmax+exp pass; uses softmax reuse for minimal overhead. Activates on ~25-40% of positions vs exp_825's ~0%. Same 1e-4 coef.
