exp_id	timestamp	specialist	parent_exp	baseline_exp	domain	hypothesis	expected_delta	status	val_bpb	delta_vs_best	artifact_bytes	train_s	eval_s	total_s	job_name	snapshot_path	notes
691	2026-04-25T00:46:03Z	reg	596	596	reg	Freeze tied tok_emb.weight (LM-head basis) during eval-TTT, in addition to the existing exp_491 freeze of control-scalar params (numel<10000). Pre-quant TTT already adapts tok_emb on val with 21 epochs of AdamW; per-chunk SGD updates to the largest tied tensor at eval time waste budget and shift the output distribution per step. Isolating adaptation to the transformer body should reduce drift across chunks and tighten BPB.	-0.0008	discard	1.072736	+0.000485	15997455	600.072000	582.200000	1519.000000	apg-reg-0682		Six-line edit at eval_val_ttt (line ~1327): introduce _emb=base_model.tok_emb.weight and _ok lambda; ttt_params filter and requires_grad_ both gated by _ok. Untouched eval-TTT axis. Distinct from: exp_491 (numel-based scalar freeze, kept), exp_619 (proj-vs-feature TTT LR split, discard), exp_649 (TTT-SGD weight_decay=1e-3, crash). Zero effect on artifact: pre-quant TTT and GPTQ both upstream of this change, so model_bytes match exp_596 envelope. tok_emb has 4M params with sparse per-batch gradient — freezing redirects gradient mass to the dense transformer-body tensors that benefit from chunk-local adaptation.
692	2026-04-25T00:50:13Z	curr	596	596	curr	Prime stride 509 (coprime to seq_len=512 and eval_stride=64) covers all 64 residues mod eval-stride within one phase-epoch. Fix of previous crash.	-0.0006	discard	1.077510	+0.005259	15997780	600.018000	582.500000	1522.000000	apg-curr-0684		Edit line 377: 2017 to 509.
693	2026-04-25T00:55:33Z	meta	596	596	meta	TTT_MOMENTUM 0.9 to 0.88 DOWN probe under z-loss regime	-0.0002	size_blocked	1.072502		16000990	600.113000	585.600000	1523.000000	apg-meta-0687		
694	2026-04-25T00:59:34Z	loss	596	596	loss	Shift TTT z-loss anchor from 0 to log(V)=9.011: replace 1e-5*lse^2.mean() with 1e-5*(lse-9.011)^2.mean(). Untried anchor-shift on the proven exp_596 mechanism.	-0.0002	size_blocked	1.073516		16000164	600.094000	582.900000	1520.000000	apg-loss-0687		Single-line edit at TTT inner CE (line 1401). +13 code bytes. log(V) is canonical lse for uniform softmax; gradient zero in natural regime, concentrates on outliers.
695	2026-04-25T01:04:31Z	arch	596	596	arch	Quad-fold q_gain [H,4] split: extend exp_475 bifurcated [H,2] (RoPE/NoPE) to 4 regions — RoPE high-freq (dims 0-15), RoPE low-freq (dims 16-31), NoPE-1 (dims 32-47), NoPE-2 (dims 48-63). Lets each head sharpen each frequency band independently within partial-RoPE.	-0.00010	eval_budget_overrun	1.074388			600.047000	603.800000	1553.000000	apg-arch-0689		Two-site edit in CausalSelfAttention: (1) line 517 q_gain shape (H,2)→(H,4) same init qk_gain_init=5.25; (2) forward() lines 549-559 replace bifurcated split with 4-fold split via slice/mul/cat. Step-0 identical to exp_475 (all gains uniform 5.25). Extra params: 11 blocks × 8 heads × 2 = 176 fp32 ≈ 704B raw; near-uniform init compresses well via brotli (CONTROL_TENSOR_NAME_PATTERNS already covers q_gain → fp16 passthrough). Code bytes 23386→23581 (+195B). Splits RoPE region by frequency (paired dims 0-15 = high-freq, dims 16-31 = low-freq under base=10000) and NoPE region by feature half — finer-grained Q sharpening within each subspace.
696	2026-04-25T01:07:13Z	eval	596	596	eval	One-shot global temperature calibration on prefix tokens in eval_val_ttt: compute β = clamp(1 - g/h, 0.7, 1.3) ONCE from the first batch's prefix positions (Newton step), then apply this fixed β to all subsequent score-phase logits across all chunks. Reduces exp_687's per-batch cost (eval_budget_overrun) to a single ~10ms calibration while keeping the calibration benefit.	-0.0003	size_blocked	1.073217		16001751	600.044000	588.400000	1527.000000	apg-eval-0689		Insertion before chunk loop: _global_beta=1.0, _beta_calibrated=False. Inside score-first inner loop, compute β only on first batch with non-empty prefix mask, then freeze. Cost ≈ one extra softmax+gather over (~63K, V=8192) ONE TIME (vs 150× for exp_687). The β-scaled logits go to F.cross_entropy. Causally legal: prefix tokens [0,s) are in-context and not part of BPB scoring, so deriving β from prefix and applying to scored tokens [s,wlen) introduces no leakage. Distinct from exp_687 (per-batch) and exp_623 (Laplace eps=1e-4). Code +292 B.
697	2026-04-25T01:07:36Z	quant	596	596	quant	Scope 6-sigma winsorized row_std to attn projections only - retry exp_646's mechanism (val_bpb=1.072235 size_blocked +2325B) at smaller param share (~25%) to fit under 4070B headroom while keeping Q/K/V outlier-feature precision gain	-0.0001	size_blocked	1.073565		16000336	600.064000	595.500000	1537.000000	apg-quan-0689		Two-site edit. gptq_quantize_weight gains optional winsor_sigmas param: when set, per-row clamps W to plus/minus winsor_sigmas times W.std before recomputing std for SDClip scale (rounding still uses unclamped W). gptq_mixed_quantize passes winsor_sigmas=6.0 only for classify_param(name) attn. MLP, embed, other matrices follow baseline. Code +480B (23295 to 23775).
698	2026-04-25T01:09:29Z	ttt	596	596	ttt	"Freeze tok_emb (tied I/O alphabet, ~4.2M params, largest single tensor) during TTT alongside existing control-scalar freeze (exp_491): adapt interior only. Tok_emb gradient is sparse per-chunk, so chunk-local TTT skews vocabulary geometry; freezing it pairs with z-loss (exp_596) - z-loss damps logit magnitude while tok_emb-freeze damps logit direction drift across chunks.</hypothesis> <parameter name=""notes"">Single 3-line edit at eval_val_ttt param filter; tok_emb identified by tensor identity (p is not _te). Code +73 packed bytes (23296 to 23369). Untried granularity: exp_535 tried 2x tok_emb LR (size_blocked), exp_656 tried tok_emb-only mb.mul_(0.5) at chunk boundary (eval_budget_overrun) - both probes hit budget walls. Pure freeze is the lightest intervention. Risk: ~4.2M of ~24.7M trainable-TTT budget removed (about 17%); if tok_emb adaptation was carrying signal, this regresses." -0.0002 discard 1.073693 +0.001442 15999869 600.036000 586.700000 1523.000000 apg-ttt-0690  
699	2026-04-25T01:16:22Z	tok	596	596	tok	"Learnable scalar dc_strip_alpha init=0 softly subtracts per-token feature-mean before embed_scale*RMSNorm: x -= alpha*x.mean(-1). Gradient picks the LayerNorm-vs-RMSNorm interpolation; orthogonal to embed_BIAS attempts (exp_307/486/505) and full LayerNorm (exp_523/058).</hypothesis> <parameter name=""notes"">3-site edit. Init: nn.Parameter(torch.zeros(1)) after embed_scale. Forward: x=x-alpha.to(x.dtype)*x.mean(-1,keepdim=True) before rms_norm. Optim: appended to scalar_params (AdamW wd=0.005). +350 code B; model ~4B. Init=0 = bitwise identical step 0. Frozen during TTT (numel<10000 per exp_491). Independent from line-1497 col-mean gauge." -0.0001 discard 1.077698 +0.005447 15996890 600.135000 594.000000 1532.000000 apg-tok-0692  
700	2026-04-25T01:22:11Z	opt	596	596	opt	Halve Muon momentum buffers ONCE at warmdown entry (first step where lr_scale<1.0): single-event discontinuity decorrelates warmdown updates from peak-LR exploration noise, mirroring exp_588's kept TTT chunk-boundary halving applied to main-training Muon.	-0.0001	size_blocked	1.072455		16002142	600.110000	587.800000	1526.000000	apg-opt-0693		Inserts 8-line one-time event at start of step_fn: when lr_scale first drops below 1.0, multiply all Muon momentum_buffer tensors by 0.5; flag prevents repetition. +137 packed code bytes (23296->23433). Warmup-restore zeros optimizer state, so buffers are populated only by real training pre-warmdown; halving cuts ~500 steps of accumulated direction by 50%, preserving signal while damping high-LR exploration noise. Mirror of exp_588 (ttt, kept Delta=-0.000727). Mechanism orthogonal to schedule-shape Muon-momentum tweaks (exp_324 floor, exp_670 sqrt, exp_615 warmup_start) since those modulate the smooth schedule, this is a one-time discontinuity. Risk: trajectory shift could perturb post-GPTQ+brotli model bytes.
701	2026-04-25T01:24:12Z	reg	596	596	reg	embed_wd 0.085 to 0.082 gentle DOWN -3.5%	-0.0001	discard	1.072514	+0.000263	15997931	600.090000	586.400000	1523.000000	apg-reg-0694		Single-literal at line 169. Untested midpoint between current 0.085 and exp_470 tested 0.080. Under z-loss the tied tok_emb optimal WD may have drifted DOWN.
702	2026-04-25T01:25:28Z	curr	596	596	curr	Eliminate per-shard random sequence permutation in _reset_shard, use deterministic arange. Tests whether per-shard rng.permutation adds anything beyond shard_plan shuffle and Latin-square phase rotation. Byte-negative.	+0.0005	discard	1.075228	+0.002977	15999898	600.059000	583.000000	1518.000000	apg-curr-0694		Also reverts exp_692 stride=509 to self.seq_len. Removes one of three rng sources in the loader.
703	2026-04-25T01:29:37Z	meta	596	596	meta	EMA_DECAY 0.9965 → 0.996 (gentle DOWN probe, untested midpoint between current and exp_274's 0.994 discard): only DOWN probe ever was exp_274 on the much-thinner exp_261 stack (pre z-loss, attn_out_gate, scalar-freeze, GC), which all-UP probes (exp_119/149/184/242/393/447 at 0.998) consistently fail on post-005 lineages — the optimum may have drifted toward narrower averaging now that 4 trajectory-smoothing regularizers stack on top.	-0.0001	discard	1.073288	+0.001037	15998569	600.115000	592.600000	1532.000000	apg-meta-0695		Single literal at line 170 (EMA_DECAY default 0.9965 → 0.996). Code -1 byte (23285 → 23284). Half-life shrinks 198 → 173 steps. EMA changes affect only the final averaged weights consumed by GPTQ + brotli; with z-loss + attn_out_gate + scalar-freeze TTT + GC dampening trajectory variance, the smoothing benefit of wider EMA may have inverted to a small over-averaging cost. Size-neutral on code; model bytes risk is low because final-EMA weights at 0.996 sit slightly closer to actual final training weights (which carry the lowest weight magnitudes due to LR cooling) — should compress comparably or slightly better.
704	2026-04-25T01:31:03Z	loss	596	596	loss	Tail-emphasized linear position-weighting on TTT z-loss term: replace 1e-5*lse².mean() with 1e-5*(lse².reshape(-1,T) * linspace(0.5,1.5,T)).mean(). Mean-preserving (linspace mean=1.0); concentrates logit-partition regularization on end-of-window positions which become the NEXT eval window's stride-64 scoring zone after sliding. Distinct from prior PW experiments which targeted CE not z-loss.	-0.0003	size_blocked	1.072641		16000773	600.129000	583.700000	1521.000000	apg-loss-0695		Single-line edit at TTT inner-loss (line 1401). Code +39B. Mean-preserving linspace(0.5,1.5,T) has exact mean 1.0, so total z-loss regularization budget is identical to exp_596 — only the spatial distribution differs. Mechanism rationale: TTT positions near the end of a 2048-window slide into the next eval window's scored region (stride 64), so tail-emphasizing the z-loss focuses regularization on positions whose lse most directly impacts subsequent val_bpb. Distinct from exp_622 (PW on TTT CE, +0.001451) which reweighted the gradient on hard targets — this only redistributes the regularizer term. Distinct from exp_186 (u² PW on main CE, kept) which is on a different code path. Z-loss term has never been position-weighted in this tree.
705	2026-04-25T01:38:44Z	arch	596	596	arch	Tied MLP-output gate via reuse of attn_out_gate_w with mean-across-heads reduction: zero new params, step-0 transparent (W zero-init → gate=1.0).	-0.0006	eval_budget_overrun	1.072975			600.033000	603.300000	1554.000000	apg-arch-0699		Single-site Block.forward edit: in both parallel and sequential branches, compute mlp_gate = 2*sigmoid(F.linear(x_pre_mlp[..., :12], self.attn.attn_out_gate_w)).mean(dim=-1, keepdim=True) and multiply mlp_out by it. Reuses exp_538's attn_out_gate_w tensor — no new parameters. Mean across H=8 head gates aggregates per-head decisions into per-token scalar. Structurally novel weight-tying in this tree: prior mlp_out_gate variants (exp_577/586 width=4 with NEW params, exp_547/558/568 width=12 with NEW params) all hit either size_blocked or eval_budget_overrun in the 1.072 territory. Reuse path saves bytes (no new gate_w tensor), keeps width=12 (proven exp_538 width). +12 muls/sigmoid/mean per block per token (~30 flops/token/block, marginal eval cost). Risk: eval_budget_overrun (since exp_586 with skip-looped variant overran) and gradient bifurcation on attn_out_gate_w (now sees gradients from both attn-output gating and mlp-output gating).
706	2026-04-25T01:41:46Z	quant	596	596	quant	Mean-preserving 6σ winsor row_std applied to all matrices in GPTQ: same mechanism as exp_646 (raw 6σ measured bpb 1.072235 size_blocked +2325B) but rescaled per-matrix so mean(row_std) is unchanged from baseline — heavy-tail rows tighten, light-tail rows loosen by the same factor, holding mean(s) and mean(|Q|) constant to avoid the global Q-histogram shift that drove exp_646's brotli inflation.	-0.00005	size_blocked	1.073024		16005293	600.102000	583.300000	1520.000000	apg-quan-0699		Single-site edit at gptq_quantize_weight (line 1031). Replaces `row_std = W_orig.std(dim=1)` with: `_rs0=W_orig.std(dim=1); _rs1=W_orig.clamp(min=-6*_rs0.unsq(1), max=6*_rs0.unsq(1)).std(dim=1); row_std=_rs1*(_rs0.mean()/_rs1.mean().clamp_min(1e-10))`. Code +363B. Mean-preserve invariant: matrix-mean(row_std)≡_rs0.mean() exactly, so mean(s)=clip_sigmas*mean(_rs0)/clip_range matches baseline. Brotli compression depends on byte-level histogram regularity — holding the mean fixed should keep compressed output close to baseline (vs exp_646's raw winsor where mean(_rs1) < mean(_rs0) shifted the histogram and cost +2325B). Bpb mechanism preserved: heavy-tail rows still get smaller scale → finer bins on bulk; mean-preserve grows light-tail scales (slight precision loss there) but those rows have low information content vs heavy-tail outliers. Distinct from exp_458 (mean-preserving Hessian-weighted, size_blocked) — different mechanism (winsor on tails vs H-diag weighting on cols) on a much-evolved baseline (596 vs 377). Risk: bpb gain partially offset by light-row precision loss; size cost unknown but mean-preserve invariant should give 5-10× smaller brotli inflation than exp_646's -2325B shortfall.
707	2026-04-25T01:43:00Z	eval	596	596	eval	Per-chunk causal Newton β recalibration: cumulative prefix-token g/h stats updated after every chunk, β = clamp(1 - Σg/Σh, 0.95, 1.05) applied to next chunk's scoring. Differs from exp_696 one-shot global (which hurt by +0.001) by tracking model-drift during TTT with rolling cumulative stats and a tight clamp.	-0.0003	eval_budget_overrun	1.074808			600.112000	603.700000	1540.000000	apg-eval-0699		Score-first legal: prefix tokens of chunk i are un-scored (only used as context for window prediction); Newton stats fit on them at β=1 ref, applied to NEXT chunk's scoring. Cumulative across chunks reduces variance vs per-chunk-isolated. Tight clamp (0.95, 1.05) caps the magnitude of any miscalibration. ~30 lines added; expected +0.001s eval per chunk (negligible vs 110s).
708	2026-04-25T01:46:46Z	ttt	596	596	ttt	Adaptive momentum restart at chunk boundaries (O'Donoghue-Candès): at chunk c≥1's first TTT-SGD step, after backward+all_reduce+clip but before optimizer.step, zero each param's momentum_buffer ONLY when (mb*grad).sum()<0 — i.e., when stale momentum is anti-aligned with fresh chunk gradient. Aligned momentum is preserved as useful signal carryover. Distinct from blanket exp_588 mb.mul_(0.5) (won standalone, regressed under z-loss in exp_607) and from blanket exp_503/253/213 mb.zero_() (all failed): per-parameter selective rather than uniform.	-0.0002	discard	1.073003	+0.000752	15999989	600.091000	588.600000	1530.000000	apg-ttt-0700		Single 5-line insertion in eval_val_ttt between clip_grad_norm and optimizer.step. +80 packed bytes (23369→23449). Mechanism is finer-grained than prior chunk-boundary momentum interventions: only damps params where stale velocity hurts the new gradient direction, preserves params where velocity helps. Should stack with z-loss because z-loss regularizes per-step logit magnitude (orthogonal to chunk-transition velocity hygiene). Risk: forces ~30 GPU syncs per chunk (~30*13≈400 syncs * ~5us = ~2ms total), well under eval budget. If selective-restart hurts (because aligned momentum was actually wrong, e.g. lr-too-high-anyway), expect ~+0.0001 regression. If z-loss-stable inner loop benefits from pruned stale velocity, expect -0.0002 to -0.0004.
709	2026-04-25T01:49:22Z	arch	596	596	arch	Per-loop-iteration learnable residual-stream scale [num_loops+1]=3 (init=1.0) applied once at entry to each block within iteration k; breaks translational symmetry of applying the shared loop segment 3x identically (exp_352 rotation failed; this is amplitude-axis not permutation-axis).	-0.0003	crash						24.000000	apg-arch-0708		Adds GPT.loop_iter_scale=Parameter(ones(3)), precomputes encoder_loop_iters/decoder_loop_iters alongside existing encoder/decoder indices, and inserts `x = x * loop_iter_scale[k]` before block call when looping_active and position is inside the loop segment. Iteration 0 scale multiplies x once before blocks 3,4,5 first pass; iter 1 before 2nd pass; iter 2 before 3rd. Since residual accumulates, iter_scale<1 acts as a learnable residual-decay, allowing each loop iteration to damp old info before applying refinement. 3 fp32 params (12B) via ndim<2 → scalar-AdamW path, fp16 passthrough (numel<=65536). Step-0 transparent (all 1.0). Registered in Optimizers mirror-of-embed_scale. Code +493B. Distinct from exp_306 (output-side init scale) and exp_245 (static ln_scale_factor/sqrt(3)): this is INPUT-side, LEARNABLE, per-iteration. | torch.distributed.elastic.multiprocessing.errors.ChildFailedError: ============================================================ (train_gpt.py:1505 in step_fn)
710	2026-04-25T01:55:52Z	opt	596	596	opt	Increase Muon Newton-Schulz iteration count 5 to 6 (muon_backend_steps): genuinely untuned axis across 700+ trials, only Polar Express coefficient swap (exp_509) probed NS internals. 6 iters gives tighter polar approximation of the orthogonalized update each step, plausibly cleaner weight trajectories that survive int6 GPTQ better.	-0.0003	discard	1.073871	+0.001620	15996179	600.038000	594.600000	1533.000000	apg-opt-0703		Single-literal change (line 151). NS5 polynomial converges quintically, so going 5 to 6 iters reduces approximation error by another order of magnitude. Per-Muon-step cost: +3 BMMs (about +20% NS time). With about 2000 main-train steps and about 4ms Muon time, estimated +1-2s wallclock, well within 600s budget. Code byte delta near zero. Adam Polar Express attempt (exp_509) was size_blocked at bpb=1.074577 with totally different mechanism (per-iter coefficients); this is the orthogonal more-iters-with-same-coeffs axis.
711	2026-04-25T01:57:17Z	tok	596	596	tok	Apply embed_scale ONLY to residual baseline x0 (injected into every block via mix[1]*x0 without pre-norm), leaving working stream x entering block 0 plain unit-RMS (its gauge is washed by block-0 pre-norms anyway). Zero-byte structural reorder of the existing embed_scale parameter.	-0.0001	eval_budget_overrun	1.072075		15999945	600.134000	600.100000	1536.000000	apg-tok-0703		Tok history: gauge-fix has been at three placements: post-norm on x (exp_267 keep), inside-norm on x (exp_298 keep, current best), and at output (exp_541 +0.008 BAD, exp_580/677 size_blocked, exp_669 crash). Gauge ONLY on x0 baseline is untried. Theoretical motive: x0 enters EVERY block additively via resid_mix without pre-norm, so per-feature gauge propagates throughout the network; gauge on x is consumed by block-0's attn_norm/mlp_norm. Single-site, zero-param edit.
712	2026-04-25T02:04:52Z	reg	596	596	reg	"Split attn_out_gate_w (exp_538 zero-init per-head gate, ~1056 params total) out of the scalar AdamW group into its own sub-group with weight_decay=0; other scalars stay at adam_wd=0.005. Untested DOWN direction — prior gate-WD trials exp_550/560/569 were all UP probes that hit size_blocked. Rationale: zero-init params have no WD signal at init; WD only kicks in once the gate learns nonzero values, which fights the gradient signal pulling it toward useful gating magnitudes.</hypothesis> <parameter name=""notes"">Two-site edit. scalar_params list comprehension gains an `and ""attn_out_gate"" not in name` guard; new gate_params list collects matching params; optimizer_scalar now has 2 groups with the gate group setting weight_decay=0.0 explicitly. +45 code bytes, zero new params, no model structure change." -0.0003 size_blocked 1.072590  16002798 600.071000 587.100000 1524.000000 apg-reg-0705  
713	2026-04-25T02:08:54Z	loss	596	596	loss	Halve TTT inner-CE z-loss coefficient 1e-5 to 5e-6 to probe untested DOWN direction on the kept z-loss axis	-0.0001	size_blocked	1.073317		16001875	600.083000	583.900000	1519.000000	apg-loss-0707		
714	2026-04-25T02:12:29Z	meta	596	596	meta	"matrix_lr 0.022 to 0.0225 (+2.3% UP, untested gentle midpoint): exp_325 failed +4.5% UP (0.023) was the closest matrix_lr probe to a keep at +0.000091, while -9% DOWN hurt 6x worse. Stale axis (last probed depth=15) with 6 gradient-dampening regularizers stacked since (z-loss, attn_out_gate, scalar-freeze) so Muon LR optimum should have drifted UP.</hypothesis> <parameter name=""notes"">Single-literal change at line 148 (MATRIX_LR default 0.022 to 0.0225). Zero code/byte delta. +2.3% is HALF the step of exp_325's failed +4.5%.</parameter> </invoke>" -0.00005 eval_budget_overrun 1.074026   600.113000 604.200000 1553.000000 apg-meta-0708  
