exp_id	timestamp	specialist	parent_exp	baseline_exp	domain	hypothesis	expected_delta	status	val_bpb	delta_vs_best	artifact_bytes	train_s	eval_s	total_s	job_name	snapshot_path	notes
342	2026-04-22T22:56:18Z	arch	324	336	arch	Skip-path RMSNorm: F.rms_norm the popped encoder skip to unit RMS BEFORE skip_weights multiplication, decoupling skip_weights (pure per-feature gain) from skip_gates (pure mix fraction).	-0.0004	size_blocked	1.074343		16003633	600.048000	773.952000	1487.000000	apg-arch-0333		Single-site edit in GPT.forward_logits: wrap skips.pop() with F.rms_norm(popped, (popped.size(-1),)) before multiplying by skip_weights[skip_idx]. Applied at up to 8 skip-injection sites when looping_active. Zero params, zero bytes. Structurally distinct from all prior arch RMSNorm trials (V-norm, Q/K/V-norm, sub-LN, NormFormer, sandwich norms) — this is the first F.rms_norm placement on the U-Net skip bypass. Rationale: the encoder skip arrives with unbounded magnitude; skip_weights[:,dim] was previously overloaded with magnitude matching AND per-channel reweighting. RMSNorm strips magnitude so skip_weights (direction) and skip_gates (lerp fraction) become orthogonal. Near-equivalent to baseline at init (skip_weights=1, g=0.5), avoiding cold-start destabilization.
343	2026-04-22T23:00:57Z	reg	324	336	reg	"Exempt per-channel/per-head GAIN params (q_gain=5.25-init, attn_scale/mlp_scale/embed_scale/skip_weights=1.0-init) from adam_wd by splitting the scalar AdamW group into a zero-WD ""gain"" sub-group and a 0.005-WD ""gate"" sub-group (resid_mix, skip_gates)."	-0.0002	discard	1.074568	+0.000397	15998079	600.041000	771.959000	1481.000000	apg-reg-0337		Two-site edit in Optimizers.__init__. (1) Replace flat scalar_params list with a pattern-based split: any param whose name matches q_gain/attn_scale/mlp_scale → gain_params; all others (resid_mix, ln_scale_factor if present) → gate_params. skip_weights and embed_scale appended to gain_params; skip_gates appended to gate_params. (2) optimizer_scalar now has two param-groups: gain_params with weight_decay=0.0, gate_params with weight_decay=h.adam_wd. Novel axis vs exp_141 (depth-targeted muon_wd, keep -0.000274), exp_164 (type-targeted muon_wd_mlp, keep -0.000024), exp_334 (time-anneal muon_wd, size_blocked): targets the *scalar* AdamW group by parameter semantics, not matrix group by depth/type/time. Extends exp_177's proven direction (adam_wd 0.02→0.005, keep -0.000038) — 0.005 is still dragging q_gain (init 5.25) and unit-init per-channel scales uniformly toward 0. Follows NeoX/Megatron no-WD-on-affine-gains convention. Zero new params, zero new env vars, zero byte impact. Risk: losing WD on gains may lead to mild drift in attn_scale/mlp_scale, but these are already counterbalanced by matrix-group muon_wd acting on the same residual pathway.
344	2026-04-22T23:02:44Z	opt	324	336	opt	Raise Muon peak momentum 0.99→0.993: widens effective gradient-averaging window from ~100 to ~143 steps. Parallel axis to exp_088 (ramp speed, -0.001115 keep) and exp_324 (warmdown shape, -0.000202 keep) — the peak value itself is the only momentum knob never tuned.	-0.0005	discard	1.074577	+0.000406	15998945	600.051000	756.949000	1463.000000	apg-opt-0338		"Single-char literal edit at L150: `MUON_MOMENTUM` default 0.99→0.993. Effect on deep-tail momentum floor (mm_blend=0.25 at lr_scale<0.25): 0.25*0.993 + 0.75*0.92 = 0.938 (vs current 0.9375) — practically identical floor, preserving exp_324's win. The change matters in the peak-LR plateau (28% of budget) and during the mm_blend-blended warmdown tail. exp_015 (raise ramp START 0.92→0.94, discard) is a DIFFERENT knob; this raises the END of the ramp. Rationale: every Muon momentum experiment that moves toward ""more effective averaging"" has won (exp_088 faster ramp, exp_010/324 preserve during warmdown); the peak cap at 0.99 is the only direction never probed. If this wins, follow-up can push to 0.995. If it loses, we learn 0.99 is near-optimum."
345	2026-04-22T23:02:47Z	curr	324	336	curr	Latin-square phase count 8→5 (prime, coprime with seq_len=2^11): 3-reset saturation 37.5%→60%, phase spacing 256→410 tokens (adjacent-phase content overlap 88%→80%).	-0.0001	discard	1.075639	+0.001468	15995560	600.017000	761.983000	1471.000000	apg-curr-0338		Three-site edit in ShuffledSequenceLoader: permutation(8)→(5), %8→%5, //8→//5. Novel direction vs exp_326 (8→16 size_blocked, post-run entropy blow-up) and exp_333 (VdC order change discard +0.001673) — this REDUCES phase count rather than increases/reorders. With ~3 resets/shard in 600s budget, dropping K from 8 to 5 changes Latin-square saturation from 3/8 to 3/5 — each shard's accessible sequence-starting positions get better-sampled. Phase positions at multiples of seq_len/5=410 are non-power-of-2-aligned, breaking any spurious alignment with internal 256-token structure. Expected entropy reduction (fewer distinct sequence positions seen) should make trained weights marginally more brotli-compressible, so no size risk. Small expected delta (-0.0001) since phase coverage is a second-order knob on top of exp_142 baseline.
346	2026-04-22T23:04:11Z	meta	336	336	meta	Lower muon_wd 0.095 → 0.087 (−8%) on attention-group Muon WD — symmetric mirror of exp_336's kept muon_wd_mlp 0.125→0.115 (−8%) move, probing the untested gentle DOWN direction on the attention side of the exp_164 type split.	-0.00008	size_blocked	1.075010		16001414	600.102000	779.898000	1488.000000	apg-meta-0338		Single-literal edit at train_gpt.py:166 (MUON_WD default 0.095→0.087). Prior attn-axis moves were too aggressive: exp_149 global −32% discard +0.00235, exp_077 global +21% discard +0.00353, exp_069/142/196/212 various +21-to-+58% QK-targeted raises all discard. A narrow −8% mirrors exp_336's proven mlp move; hypothesis is that attention matrices (smaller param mass, ~8M vs ~20M MLP) are slightly underfit at 0.095 and benefit from the same relative relaxation.
347	2026-04-22T23:08:24Z	ttt	336	336	ttt	Two-group TTT optimizer: scale TTT LR by 1/(num_loops+1)=1/3 for looped blocks [loop_start..loop_end] to compensate the (num_loops+1)x gradient amplification from shared-weight recurrence — equalizes effective per-step update magnitude between looped and non-looped blocks under ~4 SGD steps/chunk.	-0.00025	size_blocked	1.074633		16000726	600.122000	754.878000	1466.000000	apg-ttt-0338		Rationale mirrors two kept experiments on the same recurrence-amplification axis: exp_141 (recurrent muon_wd 1.3x, Δ=-0.000274) and exp_245 (ln_scale/sqrt(num_loops+1) for looped blocks, Δ=-0.000272). Both address the fact that looped blocks accumulate (num_loops+1)=3x more gradient per forward+backward. At TTT time with only ~4 SGD steps/chunk, over-aggressive looped-block updates dominate per-chunk drift. Structurally distinct from discarded exp_337 (full loop-block freeze, size_blocked but val=1.074818 worse than best) — not an exclusion but a principled 1/3 LR correction. Single-site edit in eval_val_ttt: splits ttt_params into nonloop/loop groups with lr_scale=1.0/0.333, cosine LR schedule applies multiplicatively per group. Code size +16 LOC, no training or quantization change, model bytes identical to exp_336 baseline.
348	2026-04-22T23:23:38Z	quant	336	336	quant	Ledoit-Wolf-style GPTQ Hessian off-diagonal shrinkage (×0.95, diag preserved) after exp_280's diag-only ×1.02 damping — targets finite-sample noise in H's off-diagonal entries that propagates through Hinv into cross-column error compensation.	-0.0004	discard	1.074282	+0.000111	15997253	600.058000	758.942000	1471.000000	apg-quan-0343		Single-site edit in gptq_quantize_weight immediately after `H.diagonal().mul_(1.02)`: save H.diag(), multiply entire H by 0.95 (shrinks all entries), restore diag exactly. The 64 calib batches × 2048 tokens ≈ 130K samples estimating a 512² Hessian (~260K unique entries) is moderately under-determined; off-diagonals are the noisiest and directly drive spurious compensation in `W_block[:, j:] -= err * Hinv_block[j, j:]`. Diagonal is untouched so both the existing perm = argsort(H.diag()) ordering and scale calc (row_std/clip_range) are unaffected. Novel axis vs all prior quant trials which only modify H.diagonal() (exp_016/212/280) or GPTQ mechanics (block_size exp_108/261/332, calibration exp_339). Expect near-neutral Q entropy (size), small bpb improvement from stabler Hinv.
349	2026-04-22T23:23:58Z	loss	336	336	loss	Position-weighted CE with convex u^4 (quartic) ramp 0.9 → 1.1, mean-preserving: untested shape-exponent on the proven tail-upweight axis from exp_156 (linear, keep) and exp_186 (u^2, keep), concentrating upweight on the last ~300 positions where sliding-window-stride-64 eval density is highest	-0.00015	discard	1.074706	+0.000535	15999075	600.081000	771.919000	1485.000000	apg-loss-0343		Single-site edit in GPT.forward. Replaces plain mean CE with per-token CE weighted by pw = (0.9 + 0.2 * u^4) / mean(.), u=linspace(0,1,T), mean-preserving so effective LR is unchanged. Axis novelty: exp_156=linear, exp_186=u^2 (both kept); u^4 not probed. At T=2048, first 1700 positions carry ~0.91-0.96, last 200 carry 1.05-1.10. Current base exp_336 dropped position weighting via rebases (186->324->336), so this is a new stacking test — not a dup of 186. Zero params, small code delta, O(T) compute.
350	2026-04-22T23:24:34Z	tok	336	336	tok	Semi-orthogonal init for tied tok_emb.weight (shape [8192, 512]) with gain = tied_embed_init_std * sqrt(vocab_size) ≈ 0.4525 to Frobenius-match prior normal_(std=0.005): the 512 feature columns become orthonormal 8192-dim vocab vectors at t=0, decorrelating the softmax's feature axes before training starts.	-0.0002	discard	1.075715	+0.001544	15999558	600.013000	758.987000	1464.000000	apg-tok-0343		Single-site edit in GPT._init_weights at line 723: replace nn.init.normal_(tok_emb.weight, mean=0.0, std=0.005) with nn.init.orthogonal_(tok_emb.weight, gain=0.005*sqrt(8192)). For [M=8192, N=512] with M>=N, orthogonal_ sets W^T W = gain^2 * I_N, making the N=512 feature columns orthonormal 8192-dim vocab vectors. Gain 0.4525 chosen to keep per-entry variance ≈ g^2/M = 2.5e-5 = (0.005)^2, preserving the block[0] residual-RMS statistics that embed_scale + post-tok_emb RMSNorm are tuned for. Structurally novel vs prior tok experiments: exp_019 (discarded) constrained ROWS to uniform L2 norm; exp_011/038 swept init_std magnitude; exp_032/331 clipped Gaussian tails with trunc_normal_. None decorrelated feature-axis columns. Motivation: the tied softmax output logit_i = <x, tok_emb[i,:]> reads features linearly in the 8192×512 matrix; orthonormal columns mean no two features encode redundant vocabulary directions at t=0, removing decorrelation work that Gaussian init defers to training. Risk: interaction with embed_scale (exp_298 gauge-fix inside rms_norm) or with GPTQ int6 codebook — but init affects only t=0 gradient path, not post-training quantized weights. Zero params, zero size delta.
351	2026-04-22T23:24:56Z	eval	336	336	eval	Halve TTT SGD grad_clip_norm 1.0 → 0.5 (single literal at line 1418) — tighter clip should stabilize the first-chunk TTT updates (raw un-adapted model produces noisy gradients that interact with Nesterov@0.9 momentum and 4 epochs of 32-seq batches) while leaving later-chunk updates effectively unchanged (their grad norms are already well below 0.5 after initial adaptation). Orthogonal axis: prior eval trials tuned ttt_epochs (014/017), Nesterov (151), traversal order (264), anchor (027), but TTT grad-clip is untouched.	-0.0001	discard	1.074460	+0.000289	15997515	600.140000	759.860000	1470.000000	apg-eval-0343		Single-literal edit at line 1418 in eval_val_ttt: torch.nn.utils.clip_grad_norm_(ttt_params, 1.0) → 0.5. Zero code-size delta (one character), zero parameter delta, zero train-path impact — only affects TTT SGD updates during quantized_ttt eval. Risk profile: worst case the tighter clip throttles useful mid-chunk updates and bpb drifts up a tick; best case it removes first-chunk overshoot and stabilizes scoring. Also naturally orthogonal to exp_264's alternate-direction traversal (264) — those decorrelate batch ordering, this decorrelates update magnitude.
352	2026-04-22T23:29:02Z	arch	336	336	arch	Rotated-phase depth recurrence: left-rotate loop_seg by iter_idx (iter 0 [3,4,5], iter 1 [4,5,3], iter 2 [5,3,4]), so each loop block visits each loop-position exactly once across the 3 iterations — breaks translational symmetry of identically-repeated loop calls, zero params, zero bytes, preserves exp_245's 1/sqrt(3) correction exactly.	-0.0003	discard	1.076365	+0.002194	15998899	600.683000	775.317000	1482.000000	apg-arch-0346		Single-site edit in GPT.__init__ at ~L697: replaced `for _ in range(h.num_loops+1): all_indices.extend(loop_seg)` with left-rotated extension `for iter_idx: shift=iter_idx%seg_len; all_indices.extend(loop_seg[shift:]+loop_seg[:shift])`. Unrolled encoder+decoder: was [0,1,2,3,4,5,3,4,5,3,4,5,6..10], now [0,1,2,3,4,5,4,5,3,5,3,4,6..10]; same length 17, same per-block call count (each loop block 3×). Novel axis vs arch tree: exp_245 (input ln_scale damp, keep), exp_306 (output init damp, discard), exp_321 (learnable per-iter scalar, crash) all modified magnitudes; this is the first edit altering the ORDER of loop calls. No back-to-back same-block at iteration boundaries (last-of-iter0=5, first-of-iter1=4; last-of-iter1=3, first-of-iter2=5). Mechanism: baseline recurrence reapplies the same f∘f∘f fixed-point operator; rotation gives each block a different residual-stream neighborhood per call, turning the 3 loop blocks into 3 distinct 3-block compositions (f∘g∘h at iter0, g∘h∘f at iter1, h∘f∘g at iter2) that partially specialize while sharing weights. Preserves exp_245's 1/sqrt(num_loops+1) ln_scale factor exactly (call counts unchanged). Zero byte risk: no new tensors, forward-pass order only.
353	2026-04-22T23:32:04Z	reg	336	336	reg	Split Muon attention WD into sub-buckets by functional role: Q/K (post-proj RMSNormed → only direction matters) stay at muon_wd=0.095, V and attn.proj (content-routing path, structural analog of MLP's fc→proj) get muon_wd_attn_vp=0.115 matching current MLP WD.	-0.00015	discard	1.074605	+0.000434	15997836	600.101000	755.899000	1466.000000	apg-reg-0347		Three-group Muon WD split (was 2). Param routing in Optimizers.__init__: `.mlp.*` → muon_wd_mlp=0.115, `.c_v.` or `.attn.proj.` → muon_wd_attn_vp=0.115 (new), else → muon_wd=0.095. Q/K are F.rms_normed immediately after projection so WD magnitude effects collapse — keep gentle. V+proj carry full content signal, match MLP regularization. Zero new params/bytes of consequence (~400B code delta). Novel axis vs exp_141 (depth-targeted recurrent ×1.3) and exp_164 (attn vs mlp type split). Worst case: attn_vp split is orthogonal to prior axes so a small move of 0.095→0.115 on just V+proj should be low-risk tuning. Rebased onto exp_336 snapshot first.
354	2026-04-22T23:32:16Z	curr	336	336	curr	Replace per-shard random Latin-square phase permutation with a Van der Corput (bit-reversal) low-discrepancy visit order [0,4,2,6,1,5,3,7], rotated per-shard via random initial _phase_epoch offset: at 600s budget shards typically reset 2-3 times, so early-visit phase coverage dominates and random perms can unluckily draw adjacent-phase clusters that waste diversity; vdC guarantees maximal phase spread on every prefix for every shard.	-0.0001	discard	1.075244	+0.001073	15999833	600.041000	752.959000	1461.000000	apg-curr-0347		Two-line edit in ShuffledSequenceLoader.__init__ (L366-367): replace `self._phase_epoch = [0]*N` with `[int(rng.integers(0,8)) for _ in files]` (per-shard random rotation of vdC), and replace `[rng.permutation(8).tolist() ...]` with constant `[[0,4,2,6,1,5,3,7] ...]`. Entropy-neutral: same K=8 bucket set, only the visit order changes → weight compression should track exp_336 (no size_blocked risk, unlike exp_326's K=16 entropy blow-up). Per-batch cross-shard diversity unchanged since initial offsets remain uniform. Novel axis vs exp_345 (K=5 count change, discard) and exp_326 (K=16 count change, size_blocked): this mutates the ORDER, not the COUNT.
355	2026-04-22T23:32:28Z	opt	336	336	opt	Raise Muon-momentum warmdown blend floor 0.25→0.35 (continues exp_324's floor-raising axis: momentum floor 0.9375→0.9455 across the deepest ~24% of training vs ~18% previously, buying more direction averaging on noisy tail grads without touching peak momentum).	-0.00010	size_blocked	1.074645		16001616	600.013000	753.987000	1469.000000	apg-opt-0347		Single-literal edit at train_gpt.py:1497 (0.25→0.35). Axis map: peak 0.99 (exp_344 UP→discard), warmup_start 0.92 (exp_015 UP→discard), floor 0 (exp_324 0→0.25 kept Δ=-0.000202). Only UP direction remaining on floor. With warmdown_frac=0.72, floor activates when lr_scale<0.35 i.e. frac>0.7624 (last ~24% of training, vs current ~18%). Momentum value at clamp: 0.35*0.99+0.65*0.92=0.9455 (vs 0.9375 at floor=0.25, 0.9200 without floor). Well below exp_314 sqrt variant (size_blocked bpb=1.074206). Zero size impact, zero param impact. Expected delta -0.00005 to -0.00015 if trend continues, else small discard.
356	2026-04-22T23:32:37Z	meta	336	336	meta	Half-step continuation of exp_336's winning axis: muon_wd_mlp 0.115 → 0.110 (−4.35%), probing whether MLP-Muon WD optimum is still left of current best without the overshoot risk of another −8% step.	-0.00004	size_blocked	1.074669		16000824	600.099000	748.901000	1459.000000	apg-meta-0347		Single-literal edit at train_gpt.py:172 (MUON_WD_MLP default 0.115→0.110). Rationale: (1) exp_336 [keep, Δ=-0.000109] moved 0.125→0.115 (step=0.010, −8%); halving the step continues the axis with lower overshoot risk. (2) Mirror attempt on attn-side (exp_346 muon_wd 0.095→0.087 at −8%) was size_blocked, so attn-axis is more entropy-sensitive — stay on MLP side which shipped at this magnitude. (3) Other meta axes have been recently saturated: adam_wd 0.005 locked (exp_177), momentum peak 0.99 locked (exp_344 discard at 0.993), momentum_warmup_start 0.92 locked (exp_015 0.94 discard), embed_wd too size-sensitive (exp_041 0.070 size_blocked). (4) No interaction effects to worry about — single float literal.
357	2026-04-22T23:38:47Z	ttt	336	336	ttt	Freeze tied tok_emb.weight during TTT: the tied weight receives antagonistic gradients from both the input-embedding lookup and the output-projection path (F.linear against tok_emb.weight), destabilizing the ~120-step SGD adaptation; freezing isolates TTT updates to transformer blocks + scaling params.	-0.0003	discard	1.074797	+0.000626	15999712	600.077000	756.923000	1464.000000	apg-ttt-0348		Single-site edit in eval_val_ttt: replace `ttt_params = [p for p in base_model.parameters()]` with a named-parameter filter excluding 'tok_emb', set requires_grad_(False) for all then True for ttt_params. Optimizer and clip_grad_norm already operate on ttt_params, so tok_emb is fully frozen. Concrete resurrection of aborted exp_049 (harness_abort, never completed). Motivation: with tie_embeddings=1 the vocab projection is F.linear(x, tok_emb.weight); TTT gradients to tok_emb arrive from both paths and typically oppose each other (pull embedding toward target vs push projection away from distractors). In the 4-epoch × ~30-batch SGD regime with cos_lr decay, this gradient interference is a likely loss-plateau mechanism. Zero size impact (only eval-path code). Risk: if tok_emb updates were the single largest positive contributor in baseline TTT, we lose signal — but previous direction-of-update tests (exp_039 mom 0.9→0.95 discard, exp_017 epochs 3→4 keep) suggest per-param noise reduction matters more than per-param aggressive updates.
358	2026-04-22T23:52:51Z	quant	336	336	quant	Hessian-diag-weighted per-row sigma in GPTQ: replace unweighted W.std(dim=1) with sqrt(mean(W^2 * Hdiag/mean(Hdiag))), mean-rescaled to preserve layer-wide average scale. Aligns per-row quantization scale with the actual E[err^T H err] objective — rows with energy in high-activation columns get more clip headroom, low-H rows get finer resolution. Zero size cost.	-0.00015	size_blocked	1.074899		16060607	600.135000	763.865000	1477.000000	apg-quan-0352		Single-site edit inside gptq_quantize_weight (after the ×1.02 diag damp, before permutation). Saves unpermuted Hdiag, constructs mean-1 column weights _Hwgt, replaces row_std=W.std with sqrt(weighted row-var) rescaled so layer-mean matches plain W.pow(2).mean(). Orthogonal to exp_348 (off-diag shrinkage, discard) and exp_339 (position-weighted calibration, discard): those modify H estimation; this modifies the scale chosen GIVEN H. Exp_280's ×1.02 damping is preserved. Complementary to exp_261's block_size=32 (kept, already in baseline? no — current baseline has block_size=64 default). Principled: under correlation between |W| and Hdiag (typical post-training), plain row_std under-weights scale on rows that most need clip headroom in loss-dominant columns.
