exp_id	timestamp	specialist	parent_exp	baseline_exp	domain	hypothesis	expected_delta	status	val_bpb	delta_vs_best	artifact_bytes	train_s	eval_s	total_s	job_name	snapshot_path	notes
607	2026-04-24T12:52:46Z	ttt	596	596	ttt	"Re-introduce exp_588's SGD momentum_buffer.mul_(0.5) at TTT chunk boundaries on top of exp_596's z-loss. Exp_596's byte-banking trim dropped exp_588's kept mechanism (Δ=-0.000727); re-adding it stacks two orthogonal wins (chunk-boundary momentum attenuation vs per-step logit regularizer).</hypothesis> <parameter name=""notes"">Single 5-line block re-inserted in eval_val_ttt between LR update and seq range. +110 code bytes (23296→23406 packed); exp_596 banked ~3KB via comment trim specifically to make room for additions. Mechanisms are orthogonal: z-loss shapes the inner CE surface per-step; mb.mul_(0.5) attenuates stale cross-chunk velocity. If strictly additive, expect ~1.072251 - 0.0005 ≈ 1.0718; if partially redundant, still ≥ 1.0720. Minimal downside: re-applies a previously kept mechanism on a different (now-z-loss-modified) gradient surface, and the halving is a well-probed 0.5 (exp_588) not the unvalidated 0.3/0.0." -0.0005 discard 1.072613 +0.000362 15999760 600.142000 589.300000 1534.000000 apg-ttt-0599  
608	2026-04-24T12:56:43Z	arch	596	596	arch	Convert per-block ln_scale_factor from a static Python float to a 0-d learnable nn.Parameter (init unchanged: 1/sqrt(layer_idx+1) base × 1/sqrt(num_loops+1) for looped blocks). Each block can now learn its own pre-norm input damping — controls softmax temperature on the attn path and signal magnitude on the MLP path, structurally distinct from per-feature attn_scale/mlp_scale (which act on outputs).	-0.0003	size_blocked	1.073705		16005747	600.107000	582.200000	1503.000000	apg-arch-0600		Three-site edit: (1) Block.__init__ replaces float assignment with nn.Parameter(torch.tensor(..., dtype=fp32)). (2) Block.forward precomputes ls=self.ln_scale_factor.to(dtype=x.dtype) once, replaces three * self.ln_scale_factor sites with * ls. (3) GPT.__init__ recurrence-aware loop adjustment uses with torch.no_grad(): mul_(loop_scale) instead of float multiply-rebind. Step-0 identical to baseline. 11 fp32 scalars total → ndim<2 routes to scalar-AdamW group; numel<10000 auto-freezes during TTT (per exp_491 policy); numel<65536 → fp16 passthrough at quant time → ~22B packed model contribution. Code +332B, ample headroom. Untried axis: prior arch lineage tweaked the FORMULA (exp_245 added recurrence-aware /sqrt(num_loops+1)) but never made it a free parameter. Risk: gradient could collapse layers (push toward 0) or destabilize (unbounded), but the existing per-feature attn_scale/mlp_scale already provide similar capacity without collapse, suggesting the optimizer settles in a well-conditioned regime.
609	2026-04-24T13:03:33Z	reg	596	596	reg	Lower muon_wd 0.095 to 0.093: gentle DOWN probe on attn Muon WD sub-group of exp_164 type-split.	-0.0002	discard	1.073336	+0.001085	15997666	600.093000	591.700000	1528.000000	apg-reg-0601		Single-literal edit at train_gpt.py:166 (MUON_WD default 0.095 to 0.093, same char count, code_bytes 23296 to 23290). Attn sub-group DOWN probes: exp_414 0.0874 discard +0.000192; exp_489 0.088 size_blocked bpb 1.074149 (beat era best 1.074171). UP probe exp_540 0.100 discard +0.000689. Step -2.1% is half prior DOWN magnitudes. Stack moved since exp_489: new attn_out_gate (exp_538), TTT z-loss (exp_596), TTT GC (exp_592), TTT momentum halve (exp_588). Size risk: looser attn WD means slightly larger weight norms so marginally worse brotli compression.
610	2026-04-24T13:04:20Z	meta	596	596	meta	muon_momentum_warmup_fraction 0.22 → 0.23 (+4.5% finer UP probe): exp_515 at +13.6% (0.22→0.25) hurt only +0.000114 vs exp_542 at -9% (0.22→0.20) size_blocked at +0.000599, suggesting asymmetric curvature with optimum at or just above 0.22; 0.23 is the untested gentle UP mid-point.	-0.00005	size_blocked	1.073264		16000833	600.050000	584.100000	1518.000000	apg-meta-0602		Size-identical literal substitution (0.22 and 0.23 both 4 chars); lzma packed actually trimmed 12 bytes. Ramp ends at frac=0.23 vs warmdown-start at frac=0.28, so the peak-momentum (0.99) window is narrower (5pp vs 6pp) — minor trade-off between earlier-reaching-peak vs shorter-peak-window. All prior Muon knobs (momentum 0.99 peak, warmup_start 0.92, warmdown blend floor) tightly optimized, so expected improvement is small and may fall within noise.
611	2026-04-24T13:09:59Z	eval	596	596	eval	Replace global TTT grad-clip_norm=1.0 with per-parameter Adaptive Gradient Clipping (AGC, Brock 2021): clip each weight-matrix grad norm to 0.01*||p||. Keeps exp_592 GC in place; AGC adapts the cap to each layer's scale instead of coupling all layers under one global norm budget.	-0.0005	eval_budget_overrun	1.072728			600.126000	601.700000	1540.000000	apg-eval-0604		Untried axis: clipping GRANULARITY (global vs per-param), distinct from prior tested thresholds (exp_244 0.5 discard, exp_101 2.0 ebo). Global norm clip at 1.0 lets the largest-grad layer squash everyone equally; AGC gives each layer its own trust-ratio cap scaled to ||p||, so stable layers can take bigger relative steps and noisy ones self-limit. Net -336 code bytes from trimming an expanded embed_scale comment, banking headroom against the exp_596 cap (4070B margin). Kept GC (exp_592) above AGC; both act before optimizer.step, order matches Brock 2021 (centralise then clip).
612	2026-04-24T13:16:22Z	curr	596	596	curr	Decouple _phase_order from self.rng stream: seed each shard's 8-phase permutation with a dedicated PCG64([rank, si]) stream instead of consuming 12 shared-rng draws at __init__, leaving self.rng in a fresher state when sequence_order and shard_plan shuffles fire.	-0.0001	size_blocked	1.073358		16001392	600.097000	586.200000	1521.000000	apg-curr-0607		Untried axis: exp_603 seeded sequence_order with dedicated PCG64 streams (size_blocked); no prior trial isolated _phase_order's stream. +12 code bytes only. Semantic: (rank,si)-pair-deterministic phase permutations AND self.rng no longer consumed by 12×permutation(8) before first _reset_shard, so within-shard sequence_order perms start from a 96-draw-fresher PCG64 state. Low expected magnitude but a clean probe of an untested rng-isolation point in the curriculum stack.
613	2026-04-24T13:16:57Z	quant	596	596	quant	"Value-based selective GPTQ multiplicative damping: baseline 1.01x on all H-diag cols (winning exp_377 factor), plus extra +0.01 only on top-20% H-diag quantile sink cols. Novel axis vs exp_290 position-ramp (discard), exp_301/397 per-layer routing, exp_421 low-H floor. Theory: Hinv amplification concentrates on high-H cols, so extra ridge there without over-damping bulk reduces compounding error.</hypothesis> <parameter name=""notes"">Two-line edit in gptq_quantize_weight replacing H.diagonal().mul_(1.01) with hd=H.diagonal(); hd.mul_(1.01+0.01*(hd>=hd.quantile(0.8)).to(hd.dtype)). Factor 1.01 on 80% cols, 1.02 on top-20% (max matches exp_280 kept). Code +232 B. Comparable damping-scalar trials (exp_280/348/377) all produced valid runs." -0.0001 size_blocked 1.072692  16002285 600.100000 586.900000 1531.000000 apg-quan-0607  
614	2026-04-24T13:17:47Z	loss	596	596	loss	Byte-weight the TTT inner-loop CE: replace uniform F.cross_entropy(_lf,y) with weighted mean (_c*_w).sum()/_w.sum() where _w=val_data.base_bytes_lut[y].float(). Aligns TTT gradient with BPB metric (bits-per-byte) — long-byte tokens dominate BPB and now receive proportionally more TTT signal. Z-loss 1e-5 unchanged.	-0.0005	discard	1.123258	+0.051007	15997183	600.068000	586.600000	1524.000000	apg-loss-0607		Current TTT uses uniform per-token CE; eval scores BPB = CE * (token_count/byte_count). A token with 5 bytes contributes 5× more to BPB than a single-byte token but equally to TTT gradient. Byte-weighting directly aligns the TTT optimization with the eval metric. base_bytes_lut is already on device and consulted in the eval scoring path (line 1290, 1371). Only uses base_bytes_lut (not the leading-space correction) for simplicity — captures the dominant byte signal. Weighted-mean form (not sum) preserves loss magnitude so the existing ttt_lr stays in-regime. Z-loss term left on uniform per-token logsumexp mean (it's a calibration regularizer, not metric-aligned). Novel axis: techniques.md's position-weighted exp_186 tried u^2 positional ramp (different axis); no library PR byte-weights CE. gaps.md #5 (frequency-stratified) is tangential.
615	2026-04-24T13:19:50Z	opt	596	596	opt	Raise muon_momentum_warmup_start 0.92→0.93 atop current best (exp_596 loss z-loss): re-probe of exp_585's size_blocked win (bpb=1.072774 before TTT z-loss joined baseline) — now that loss-domain change shifted weight trajectory, 0.93's post-GPTQ/brotli compressibility may fit.	-0.0004	discard	1.072872	+0.000621	15999212	600.149000	581.700000	1520.000000	apg-opt-0608		Single-literal change at line 152 (MUON_MOMENTUM_WARMUP_START default 0.92→0.93). Byte-equivalent in source (both 4 chars). Mechanism: raises warmup ramp start (0.93→0.99 instead of 0.92→0.99 across 22% of budget) AND raises tail momentum floor in warmdown blend: tail μ = 0.25*0.99 + 0.75*0.93 = 0.9450 (vs current 0.9375), i.e. +0.0075 effective tail momentum — widens direction-averaging window on noisy deep-warmdown grads without raising peak. Tree evidence: exp_585 got bpb=1.072774 (Δ=-0.000692 vs then-best 1.073466) but size_blocked; both DOWN probes on this axis regressed (exp_292@0.88 +0.001677, exp_500@0.90 +0.000432). exp_596 baseline (1.072251) added TTT z-loss which changed weight distribution — plausible this re-opens fitting margin. Primary risk: size_block if 0.93-trajectory compresses worse than baseline's 0.92-trajectory.
616	2026-04-24T13:20:08Z	tok	596	596	tok	Column-DC subtraction on tok_emb before GPTQ: compute col_mean (shape [D=512]) of tok_emb.weight, subtract from all rows, run GPTQ on the centered tensor, store col_mean as fp16 passthrough, add back at dequantize. Since the GPTQ activation-Hessian is invariant under row-wise constant shift, the optimization target is unchanged, but per-row std of the centered tensor shrinks when tok_emb has a non-trivial DC direction (typical post-training), giving better int8 grid utilization and more-peaked-at-zero q codes for brotli.	-0.0002	size_blocked	1.072405		16002218	600.131000	581.400000	1522.000000	apg-tok-0608		"Implementation: ~10 new lines across gptq_mixed_quantize (branch on ""tok_emb"" in name to store .cmean and tag meta with ""+ cmean"") and dequantize_mixed (add back cmean fp16→fp32 broadcast). cmean overhead: 512 * 2 = 1024 bytes fp16 raw, compressed to ~500-700B via brotli-11. Novelty: untried in our swarm per tree.tsv grep; distinct from exp_551 (row-mean-center at init) and exp_466 (column-equi-std at init) — this is a post-training, pre-quant transform with reconstruction, not an init perturbation. Risk: net size gain if tok_emb's col_mean is ≈0 (then centering is no-op and we pay 700B for nothing). Upper bound benefit: if col_mean captures an effective ""unigram-prior"" direction, quant error on tok_emb drops."
617	2026-04-24T13:27:20Z	ttt	596	596	ttt	SGLD-style Langevin gradient noise injection in TTT SGD: per-rank Gaussian noise (alpha=cos_lr*0.01) added to grad BEFORE the DDP all_reduce so noise averages /sqrt(8) across ranks (DDP stays sync'd) while contributing ~11% noise/signal to weight updates at peak LR; scales to 0 at last chunk in lockstep with cosine schedule.	-0.0002	size_blocked	1.072628		16002961	600.061000	588.200000	1524.000000	apg-ttt-0609		Mechanism-orthogonal to z-loss (loss-surface bound) and to mb.mul_(0.5) (momentum-trajectory dampener) which exp_607 showed don't compose with z-loss. Gradient noise injection regularizes the OPTIMIZATION PROCESS instead. Adds 3 lines / +38 packed bytes between loss.backward() and the DDP all_reduce. Scope check: gradient-noise-style ideas have been tried in reg/opt domains (exp_104 on Muon updates discard, exp_198/302 on embedding/feature noise discard, exp_033 NEFTune harness_abort) but never on the TTT SGD-Nesterov path — TTT's ~16 SGD steps/chunk with cosine LR is structurally different from main-train Muon. Noise injection BEFORE all_reduce ensures consistency across ranks (averaged noise std reduced by sqrt(8)). cos_lr scaling means late chunks (low LR) get proportionally less noise, preserving the cosine adaptation envelope. Risk: if noise/signal=11% destabilizes inner SGD, regression up to ~+0.0005; if it provides Bayesian regularization without hurting trajectory, gain ~-0.0001 to -0.0005.
618	2026-04-24T13:34:36Z	arch	596	596	arch	Add per-head additive bias to attn_out_gate pre-activation: gate = 2*sigmoid(F.linear(x[:,:,:12], gate_w, gate_b)) with gate_b shape [H=8] zero-init. Gives each head a learnable DC shift of its default gate level (transparent at init), distinct DOF from the weight term because sigmoid is non-linear. Untested axis atop exp_538 kept (attn_out_gate_w only).	-0.00010	size_blocked	1.073518		16001173	600.032000	582.800000	1519.000000	apg-arch-0611		"Two-site edit. (1) CausalSelfAttention.__init__ adds self.attn_out_gate_b = nn.Parameter(torch.zeros(num_heads, dtype=torch.float32)). (2) forward uses F.linear(x[..., :12], gate_w, gate_b) to fuse bias into the existing linear call (no new ops, zero eval-time impact). Param routing: name contains ""attn_out_gate"" substring → scalar AdamW via CONTROL_TENSOR_NAME_PATTERNS; ndim=1 → TTT-frozen via exp_491's numel<10000 gate; numel=8 per block → fp16 passthrough in gptq_mixed_quantize. Byte cost: +204 B code, +176 B raw fp16 params (88 total across 11 blocks), brotli should bring model-bytes delta below ~130 B. Distinct from exp_597 (size_blocked V-bias per-KV-head-dim 256/block, 10× larger) and exp_547/577 (size_blocked/eval_overrun mlp_out_gate which add a new forward op). At init: bias=0 → gate=2*sig(linear(x))=step-0 identical to exp_538; during training, bias shifts the sigmoid midpoint to bias each head toward suppression/amplification independent of DC component of x (which is ~unit-RMS-constrained but not zero-mean per token)."
619	2026-04-24T13:35:58Z	reg	596	596	reg	Split TTT SGD LR by parameter role: zero-init projection matrices (.attn.proj, .mlp.proj) get 0.5x ttt_lr; feature-creating matrices (c_q/c_k/c_v/mlp.fc/tok_emb) keep full ttt_lr. Damps residual-drift on zero-init residual writers across TTT chunks; first TTT LR split by role in this tree.	-0.0002	discard	1.073855	+0.001604	15999877	600.132000	580.000000	1519.000000	apg-reg-0611		Two-site edit in eval_val_ttt. (1) Replace flat ttt_params construction with named-parameter pass splitting by '.proj.' substring into ttt_params_feat (tok_emb, c_q, c_k, c_v, mlp.fc) vs ttt_params_proj (attn.proj, mlp.proj). SGD optimizer takes two param_groups with lr=ttt_lr and 0.5*ttt_lr. (2) Cosine LR update now sets pg[0].lr=cos_lr, pg[1].lr=0.5*cos_lr preserving ratio. ttt_params = feat+proj kept for downstream all_reduce + grad_clip loops. Zero new params; +152 code_bytes (23296→23448). Orthogonal to exp_491 (freeze <10000 scalars), exp_588 (halve momentum_buffer at chunk boundaries, discarded on top of 596), exp_592 (Gradient Centralization on TTT grads). Rationale: attn.proj and mlp.proj are zero-init residual writers that grow from 0 during main training; at TTT they adapt on top of small-magnitude weights where relative perturbations are larger; over-adaptation amplifies residual-stream drift chunk-to-chunk. Feature-creating matrices (c_q/c_k/c_v/mlp.fc) have stable equilibrium norms set by Muon WD, so full LR is appropriate. Risk: may underadapt critical TTT signals; if discard, next probe is ratio=0.75 (gentler).
620	2026-04-24T13:40:20Z	meta	596	596	meta	muon_momentum_warmup_fraction 0.22→0.21 (gentle -4.5% DOWN probe, untested midpoint): z-loss regime (exp_596) makes UP side hurt more (exp_610 0.23 size_blocked at 1.073264 = +0.001013 vs best) than pre-z-loss regime (exp_515 0.25 discard +0.000114), suggesting optimum may have shifted DOWN under z-loss's softer TTT gradient.	-0.0001	size_blocked	1.072649		16000585	600.153000	598.600000	1544.000000	apg-meta-0612		Single-literal same-char-count edit at line 157 (0.22→0.21 both 4 chars). Zero code-byte delta (23293). Untested axis direction: all prior -9% DOWN (exp_542 size_blocked at +0.000599 vs exp_491) and +13.6% UP (exp_515 +0.000114) probes were on pre-z-loss stacks; only +4.5% UP (exp_610) has been tested on exp_596 z-loss stack and it hurt 10× more than on earlier stacks (+0.001013). Gentle -4.5% DOWN is the symmetric untested probe on current regime. Ramp now completes at 126s (21% of 600s budget) instead of 132s, reaching peak momentum 0.99 slightly earlier within peak-LR phase.
621	2026-04-24T13:50:01Z	quant	596	596	quant	"Hybrid mul+add GPTQ H damping H_ii ← 1.005·H_ii + 0.005·mean(H): mean-damping identical to exp_377's 1.01× but redistributes ridge from high-H cols (preserves curvature) toward low-H cols (caps 1/Hinv blow-up) without exp_421's hard-floor discontinuity.</hypothesis> <parameter name=""notes"">Single-site edit at gptq_quantize_weight (line 1023). Before: H.diagonal().mul_(1.01). After: hd=H.diagonal(); mean_hd=hd.mean(); hd.mul_(1.005).add_(0.005*mean_hd). At H_ii=mean effective damping identical to exp_377 (1.01·mean). At H_ii=10·mean: 10.055m vs 10.1m (less over-damping of curvature-rich cols). At H_ii=0.01·mean: 0.015m vs 0.0101m (~49% larger ridge stabilizes Hinv[j,j]=1/d on extreme low-H tail). Mean-damp invariant should hold Q histogram near baseline so brotli size stays under cap — distinguishes from pure 1.005 that size_blocked (exp_387/477/497). Distinct from exp_421 hard min-clamp 1e-2·mean (discard +0.000338): no threshold, soft additive at zero mean-damp shift.</parameter> </invoke>" -0.0001 discard 1.073563 +0.001312 15999651 600.143000 586.400000 1527.000000 apg-quan-0617  
622	2026-04-24T13:50:05Z	loss	596	596	loss	Apply exp_186's u² position-weighted CE (pw=0.9+0.2*u², mean-preserving) to the TTT inner-loop cross-entropy, keeping the z-loss term intact. Aligns TTT per-chunk SGD gradients with the stride-64 eval scoring region (late positions weighted ~22% higher). Distinct from exp_156/186/195/226/236/256 which all applied PW to main-train CE; TTT-inner-loop CE has never been position-weighted despite TTT being the direct adaptation channel to the eval distribution.	-0.0001	discard	1.073702	+0.001451	15997208	600.025000	581.700000	1515.000000	apg-loss-0617		Preserves exp_596's TTT-only z-loss λ=1e-5. Pre-computes _ttt_pw once before chunk loop; negligible runtime overhead. Mean-preserving normalization keeps LR scale identical to uniform CE. Rationale: main-train PW (exp_186 kept Δ=-0.000062) has been saturated on current lineage, but the alignment argument applies even more to TTT since TTT is specifically adapting weights toward the eval distribution. Code: +111 bytes, headroom ample.
623	2026-04-24T13:50:14Z	eval	596	596	eval	Laplace-smoothed TTT scoring NLL with eps 1e-4 caps outlier NLL tail.	-0.0005	discard	1.072749	+0.000498	15999811	600.077000	588.300000	1529.000000	apg-eval-0617		
624	2026-04-24T13:50:47Z	curr	596	596	curr	Input-token noise injection at p=0.005 in ShuffledSequenceLoader (training only; calib_loader overridden to 0): replace ~1 in 200 input tokens with uniform-random vocab IDs (0..8191) just before next_batch returns. Targets y unchanged (standard NLM denoising regularization). Novel axis — no prior trial in our curriculum tree probed input-level augmentation/noise; exp_518 tried token-ID-stratified CE weight (size_blocked) but that was a loss-side intervention, not input perturbation.	-0.0003	size_blocked	1.074117		16008716	600.063000	530.700000	1432.000000	apg-curr-0617		"Implementation: (1) class-level `noise_prob = 0.005` default on ShuffledSequenceLoader. (2) One-line `torch.where(torch.rand_like(x,dtype=fp32)<noise_prob, torch.randint_like(x,8192), x)` just before the `return` in next_batch — unconditional, relies on class attr for gating. (3) `calib_loader.noise_prob = 0.0` override at serialize() so GPTQ Hessians stay clean. +58 raw code bytes vs exp_596 (23296→23354). Motivation: standard input-noise regularization is well-studied in NLM/LM training (BERT-era), improves robustness and acts as a mild regularizer against overfitting noise in the token stream; untouched in our tree. Rate 0.005 is conservative (1 token in 200) to avoid disrupting the fp32→bf16 training dynamics. Risk: tight 16MB cap — recent +12-byte exp_612 hit size_blocked due to model-byte drift, so this is moderately size-risky.</notes> </invoke>"
625	2026-04-24T13:53:14Z	opt	596	596	opt	"Add a brief linear main-LR warmup over the first 2% of the budget (lr_scale = min(frac*50, 1.0)) — untouched across ~620 trials; stack relied on NS spectral bound + grad_clip=0.3 alone to tame cold-Adam / cold-momentum early steps. Expected mild trajectory shift may tighten first ~10 steps and improve GPTQ int6 compressibility.</hypothesis> <parameter name=""notes"">lr_mul now returns min(frac * 50, 1.0) during the pre-warmdown phase instead of a flat 1.0. Warmup completes at frac=0.02 (~12s / ~6-10 real training steps on a 600s budget), before the momentum ramp (frac=0.22) and far before warmdown (frac=0.28); the peak-LR x peak-momentum window is preserved. mm_blend=max(lr_scale,0.25) clamps Muon momentum-floor interaction at small lr_scale so muon_momentum stays at 0.92 through the warmup. Code +9 bytes (23296-&gt;23305); ~490 B model-bytes headroom remains under exp_596's observed 16 MB margin. Risk: trajectory shift may perturb post-GPTQ+brotli size.</parameter> </invoke>" -0.0005 discard 1.076289 +0.004038 15993553 600.086000 580.100000 1517.000000 apg-opt-0617  
626	2026-04-24T13:55:51Z	tok	596	596	tok	test	0	discard	1.072631	+0.000380	15991531	600.006000	583.000000	1525.000000	apg-tok-0618		
