exp_id	timestamp	specialist	parent_exp	baseline_exp	domain	hypothesis	expected_delta	status	val_bpb	delta_vs_best	artifact_bytes	train_s	eval_s	total_s	job_name	snapshot_path	notes
307	2026-04-22T21:15:32Z	tok	298	298	tok	Put a learnable per-feature embed_bias INSIDE the post-tok_emb RMSNorm alongside embed_scale: `F.rms_norm(x*embed_scale + embed_bias, ...)`. At init (b=0) bitwise-identical to exp_298; post-init the bias is gauge-projected onto the unit-RMS sphere so it learns a shared per-feature directional pull orthogonal to embed_scale's gain — crucially distinct from the failed exp_288 (which placed the bias OUTSIDE RMSNorm and broke block-0's unit-RMS invariant, the exact invariant exp_298 proved essential).	-0.00008	discard	1.079959	+0.005477	15995530	600.099000	762.901000	1473.000000	apg-tok-0300		"Three-site edit on exp_298: (1) GPT.__init__ adds self.embed_bias = nn.Parameter(torch.zeros(h.embedding_dim, dtype=torch.float32)) directly after embed_scale; (2) forward_logits replaces `F.rms_norm(x * embed_scale.to(dtype), ...)` with `F.rms_norm(x * embed_scale.to(dtype) + embed_bias.to(dtype), ...)`; (3) optimizer registration appends embed_bias to scalar_params (same AdamW group as embed_scale, scalar_lr=0.02, adam_wd=0.005). Key distinction from exp_288: exp_288 added `+ embed_bias` AFTER `F.rms_norm(x) * embed_scale`, which broke unit-RMS into block 0 and got val_bpb=1.075977 (worse than the 1.074604 best at that time). This puts the bias INSIDE the same rms_norm call as embed_scale, preserving exp_298's gauge-fixing property: whatever b ends up, rms_norm gauge-fixes the OUTPUT rms to 1. The bias contributes only a DIRECTIONAL component (its projection onto the unit-sphere post-norm). Step 0 no-op so zero regression risk. Size: 512 fp32 params = 2KB raw, passthrough-fp16 → 1KB raw, brotli-compressed zeros → <100 bytes. Expected delta conservative (-0.00008) because bias starts zero and must be grown through gradient flow through the rms_norm jacobian. If kept, completes the full ""affine-LayerNorm"" pre-block transform in a single gauge-fixed rms_norm — structurally the cleanest extension of exp_298 in the tok domain."
308	2026-04-22T21:21:01Z	loss	298	298	loss	2-ahead auxiliary CE (alpha=0.05): same causal logits at position t also predict target at t+2 (ProphetNet-style forward-looking supervision). nll1 + 0.05 * nll2. Training-only, zero inference cost, zero new params.	-0.0005	size_blocked	1.088355		16004819	600.092000	773.908000	1487.000000	apg-loss-0303		Structurally novel direction in the loss domain — prior trials exhausted sharpening (focal 291, last-stride 300 → size_blocked) and smoothing (label_smoothing 042, z-loss 009 → discard). Multi-step targets are different: they add gradient signal for 2-ahead marginals without changing logit shape much at the modest alpha=0.05. Compression-safe because main 1-ahead CE dominates (aux is ~1% of total loss at convergence). If it helps, suggests stacking forward-looking supervision with position weighting is a fruitful compound direction.
309	2026-04-22T21:21:11Z	curr	298	298	curr	Mask training CE loss on positions 0..63 of each sequence (slice logits[:,64:] and targets[:,64:] before cross_entropy): val_bpb uses a stride-64 sliding window so every scored token has ≥1984 tokens of context, whereas training currently weights positions 0..63 equally — aligns the training gradient distribution with the eval scoring distribution.	-0.0004	size_blocked	1.075475		16011576	600.106000	791.894000	1502.000000	apg-curr-0303		Single-site edit in GPT.forward. The mask is a hard slice (K=64) matching eval_stride exactly: val windows score only the last 64 positions (context_size=seq_len-eval_stride=1984), so training on positions 0..63 optimizes a regime never evaluated. exp_013 previously probed K=32 but was size-blocked pre-measurement so the mask idea itself is effectively unexplored; the slice approach avoids any per-batch mask allocation so size should be unchanged. Does NOT touch forward_logits or eval paths (line 1288/1367 use logits_fn directly with full-length cross_entropy). TTT training step (line 1407) shares the same forward() so it also benefits from the alignment on val chunks. Drops 3.125% of training loss terms, which should be near-neutral on capacity and positive on distribution alignment.
310	2026-04-22T21:21:20Z	quant	298	298	quant	Saliency-weighted GPTQ column ordering: replace act-order perm=argsort(H.diag()) with perm=argsort(H.diag() * ||W[:,j]||^2) — quantize columns by expected squared output contribution rather than activation-magnitude alone, so high-output-impact columns get clean-buffer quantization and low-impact columns absorb propagated error.	-0.0001	discard	1.074658	+0.000176	15998548	600.099000	765.901000	1476.000000	apg-quan-0303		Single-site edit in gptq_quantize_weight. Ordering refinement untested in the tree (damping/block_size/per-category covered, but column permutation left at classical act-order). Invperm still unwinds the order on return, so saved Q layout is bit-identical to baseline — no compression/size delta expected. Saliency product H[j,j]·||W[:,j]||² is a standard OBS/SqueezeLLM-style importance metric and strictly generalizes the current act-order (reduces to it when ||W[:,j]||² is ~column-uniform).
311	2026-04-22T21:22:26Z	eval	280	298	eval	Defer chunk 0 scoring to the END of the TTT loop so chunk 0 scores with a fully-adapted model instead of zero-TTT benefit — reorder chunk_order to [1,2,...,N-1,0] and re-anchor cos_lr on loop index, preserving score-first invariant (chunk 0 tokens never trained on).	-0.00005	discard	1.074757	+0.000275	15999472	600.006000	747.994000	1454.000000	apg-eval-0305		"Current TTT has a structural asymmetry: chunk 0 is scored before ANY training (0% TTT benefit) while chunk N-1 is scored after training on N-1 chunks (~full benefit). Reordering so chunk 0 scores LAST shifts chunk 0 (~1/160 of tokens at ttt_chunk=65536) from 0% to ~full TTT adaptation. Legality: chunk 0's tokens are never trained on (it becomes the new ""last-scored"" chunk, inheriting the old code's no-train-on-last rule), so score-first invariant holds. The cos_lr schedule is re-anchored on loop INDEX instead of raw chunk id, so chunk 1 now inherits the peak-LR slot; the last trained chunk in the old order (ci=N-2) already had near-zero cos_lr so training now extending through ci=N-1 is near-neutral. Orthogonal to Polyak EMA (exp_297) and all prior TTT-schedule/optimizer tweaks. Expected delta small but positive since chunks 1..N-1 each lose ~1 chunk of preceding training, partially offsetting chunk-0 gain."
312	2026-04-22T21:26:22Z	reg	298	298	reg	"Isolate q_gain into its own AdamW sub-group with weight_decay=0; leave all other scalars at adam_wd=0.005. Prevents the baseline QK-Gain 5.25 from drifting down under decoupled WD pull-toward-zero.</hypothesis> <parameter name=""notes"">Surgical scalar-WD split in Optimizers.__init__. Orthogonal to exp_257 (zero WD on all scalars, catastrophic) and exp_283 (target-decay toward init on all, discard). 88 q_gain scalars." -0.00020 size_blocked 1.074234  16000476 600.148000 762.852000 1484.000000 apg-reg-0305  
313	2026-04-22T21:26:59Z	meta	exp_298	298	meta	Zero out adam_wd 0.005 to 0.0 on scalar AdamW group; continues exp_177's kept direction (0.02 to 0.005, -0.000038) to its endpoint. All params in this group are far from 0, so any WD is a misaligned pull-to-zero prior.	-0.0001	size_blocked	1.074796		16001432	600.153000	755.847000	1468.000000	apg-meta-0305		Single-literal edit at train_gpt.py:165 (ADAM_WD default 0.005 to 0.0). Affects optimizer_scalar only. Completes the exp_177 axis.
314	2026-04-22T21:27:20Z	opt	298	298	opt	Sqrt-shaped Muon momentum cool-down (mm_blend = sqrt(lr_scale)) replaces exp_010's linear-in-lr_scale blend — same peak (0.99) and floor (0.92) but momentum holds higher through the warmdown middle (e.g. at lr_scale=0.1 m=0.942 vs 0.927 linear), preserving gradient-direction averaging when lr is already small.	-0.0005	size_blocked	1.074206		16002745	600.743000	766.257000	1485.000000	apg-opt-0305		"Single-line edit in step_fn (~L1492): `lr_scale` → `lr_scale ** 0.5` in the Muon momentum blend. Peak and floor unchanged; only interpolation shape changes. Orthogonal to exp_303 (sqrt-shaped LR itself, +0.004) — Muon's NS already fixes update MAGNITUDE per step (=lr); LR-shape affects step size while momentum-shape affects direction quality. exp_010 proved linear cool was -0.0001 over constant 0.99; this tests whether a wider cool-down shape recovers more of the ""peak momentum window"" exp_088 (-0.001115) established as load-bearing."
315	2026-04-22T21:37:47Z	ttt	298	298	ttt	Per-group TTT LR dampening on tied tok_emb: split SGD into two param groups with tok_emb at 0.5× cosine-scheduled LR and everything else at 1.0×. Under tie_embeddings tok_emb absorbs gradient from both the input-embed and output-head paths in a single backward, making its effective step larger; exp_049's full-freeze (LR=0) was discard, so this is the gentler middle ground between freeze and full LR.	-0.0003	eval_budget_overrun	1.076420			600.012000	783.988000	1503.000000	apg-ttt-0307		Edit site: eval_val_ttt optimizer construction + cos_lr update loop. Partitions ttt_params into [tok_emb.weight] and [everything else], constructs SGD with two groups having lr=h.ttt_lr*0.5 and lr=h.ttt_lr respectively, shared momentum=0.9 nesterov=True. Per-chunk cos_lr loop multiplies each group's lr by its stored _ttt_lr_mults (0.5, 1.0). Grad-clip is global (all params), preserving existing clipping behavior. ttt_params list still points at all params so all-reduce and clip_grad_norm_ unchanged. Compile graph is unaffected — optimizer lives outside compiled forward. Anti-anchoring note: prior ttt attempts explored schedule tweaks (lookahead, polyak EMA, within-chunk LR decay, alt-order) — this is the first per-parameter-group LR partition during TTT.
316	2026-04-22T21:41:40Z	arch	298	298	arch	test	-0.0001	discard	1.076301	+0.001819	15999299	600.022000	762.978000	1471.000000	apg-arch-0308		
317	2026-04-22T21:44:58Z	tok	298	298	tok	Add a learnable per-vocab logit bias (shape=[vocab_size]=8192, init=0) added INSIDE the softcap to the tied-softmax output, offloading the unigram frequency prior from the residual stream onto a dedicated bias vector.	-0.0008	size_blocked	1.075024		16011544	600.141000	766.859000	1488.000000	apg-tok-0308		Three-site edit on exp_298. (1) GPT.__init__ adds self.logit_bias = nn.Parameter(torch.zeros(h.vocab_size, dtype=torch.float32)) directly after embed_scale. (2) GPT.forward_logits: logits_proj = logits_proj + self.logit_bias.to(logits_proj.dtype) added right before the logit_softcap*tanh; bias is therefore bounded by the same softcap as the rest of the output. (3) Optimizers.__init__: scalar_params.append(base_model.logit_bias) right after the existing embed_scale append, so logit_bias ships in the scalar AdamW group (scalar_lr, adam_wd, eps). At init (b=0) the forward is bitwise identical to exp_298, so the training dynamic only diverges post-warmup. Rationale: with tied embeddings the output softmax classification vectors ARE the embedding rows, forcing the model to encode the unigram prior INTO the residual-stream direction. A shape-[V] output bias is the minimal basis-free parameterization of that prior — it frees the residual stream for context-conditional signal. Structurally orthogonal to every previous tok keep: exp_190/exp_267 added INPUT-side per-feature scales; exp_298 moved the input-side scale INSIDE the post-tok_emb RMSNorm. Output-side and per-VOCAB rather than per-FEATURE is a fresh axis. exp_023 proposed this exact idea but harness_abort'd (never ran on GPU) — unvalidated, not ruled out. Size: 8192 fp32 params, numel < 65536 → fp16 passthrough in gptq_mixed_quantize (16 KB raw, ~8–10 KB brotli after byte-shuffle). Headroom check: size_project shows 15.975 MB slack on code alone; model side adds the 10 KB delta into ~180 KB post-quant headroom. GPTQ path: logit_bias is not a matrix_attn/mlp/tok_emb state_dict entry, so it hits the fp16 passthrough branch cleanly; no lm_head impact because tie_embeddings=True. TTT compatibility: scalar_params is included in optimizer_scalar which is included in TTT optimizers, so logit_bias continues to adapt during TTT chunks — this is a feature, not a bug (unigram prior can drift slightly across domains). Placement INSIDE softcap: ensures bias-driven logits don't bypass the tanh bound; if placed outside, bias could clip other logits to the cap and destabilize scoring. Worst case: bias learns near-zero and we lose ~10 KB to a no-op parameter (harmless). Best case: captures a 1e-3–2e-3 bpb reduction the way log-unigram-prior calibration usually does at small vocab.
318	2026-04-22T21:49:56Z	loss	298	298	loss	Smooth sigmoid eval-aligned position weighting in training CE: pw = 1 + 0.2*sigmoid(12*(u - (T-64)/(T-1))) centered at the eval stride-64 boundary, mean-preserving — same eval-alignment intent as exp_300 but with a smooth transition avoiding the compression-hostile last-64 weight cliff that caused size_blocked.	-0.0002	size_blocked	1.074464		16002799	600.030000	766.970000	1477.000000	apg-loss-0312		Novel direction: prior global ramps (exp_156/176/186, linear/u^2 from 0.9→1.1) ignored eval geometry; hard last-64 masks (exp_300/309) were size_blocked, likely because the weight discontinuity at position T-64 induced non-uniform logit structure that broke brotli compression. Smooth sigmoid (slope=12) transitions over ~128 positions around the boundary, so per-token grad magnitude at position T-64 is only 1.5× that at T-128 rather than 15× (hard step). Zero new params, zero inference cost, mean-preserving (loss scale at init unchanged). Normalization pw/pw.mean() keeps total weight = B*T so (per_tok * pw).mean() equals a weighted mean. pw.repeat(B) broadcasts the T-length pattern across the batch flat layout.
319	2026-04-22T21:51:09Z	quant	298	298	quant	Plain L2-optimal per-row scale refinement post-GPTQ with Q fixed	-0.0003	discard	1.074849	+0.000367	15996696	600.015000	759.985000	1470.000000	apg-quan-0312		L2-optimal per-row scale given Q fixed: s_r = dot(W_r,Q_r)/dot(Q_r,Q_r). Single edit in gptq_quantize_weight. Q bytes/scale layout unchanged.
320	2026-04-22T21:51:43Z	tok	298	298	tok	Mirror exp_298's winning gauge-fixed input-side embed_scale on the output side: add a learnable per-feature output_scale (shape=[model_dim]=512, init=1.0) INSIDE the final RMSNorm, replacing `x = self.final_norm(x)` with `x = F.rms_norm(x * self.output_scale, ...)`.	-0.00010	crash						27.000000	apg-tok-0319		Three-site edit on exp_298. (1) GPT.__init__ adds self.output_scale = nn.Parameter(torch.ones(h.model_dim, dtype=torch.float32)) right after embed_scale. (2) forward_logits replaces `x = self.final_norm(x)` with `x = F.rms_norm(x * self.output_scale.to(x.dtype), (x.size(-1),))`. (3) Optimizers.__init__ appends base_model.output_scale to scalar_params (scalar AdamW group), mirroring embed_scale registration. Mechanistic rationale: exp_298 won by moving embed_scale INSIDE the post-tok_emb RMSNorm (gauge-fix: unit-RMS invariant preserved, only relative per-feature weighting is learnable). Applying the same principle to the output-side final_norm asks whether the trunk benefits from symmetric gauge-fixed per-feature reweighting at both ends. Structurally distinct from exp_260 (output_gain post-head_proj, discarded): that variant had an unbounded absolute-magnitude knob colliding with logit_softcap regulation. Here, rms_norm's unit-RMS output pin means output_scale can ONLY learn feature-axis relative tilt — the gauge-consistent counterpart to exp_298. At init (s=1) forward is bitwise identical to exp_298 (rms_norm(x*1) == rms_norm(x)). Cost: 512 fp32 params (numel ≤ 65536 → fp16 passthrough via gptq_mixed_quantize, ~1 KB raw, ≤0.5 KB brotli; well within exp_298's ~180 KB headroom). TTT picks it up automatically via base_model.parameters(). Risk: final_norm is inside torch.compile; inlining F.rms_norm should compile fine (same function path as exp_298's input-side edit). | torch.distributed.elastic.multiprocessing.errors.ChildFailedError: ============================================================ (train_gpt.py:1093 in gptq_mixed_quantize)
321	2026-04-22T21:52:22Z	arch	298	298	arch	Add (num_loops+1)=3 learnable scalar gains (loop_iter_scale, init=1.0) that multiply each call's residual contribution (attn+mlp additions) per loop-iteration in the depth-recurrent segment [3..5]; at init=1.0 this reproduces exp_245 exactly, while the optimizer gains a free per-iteration knob distinct from exp_245's uniform 1/sqrt(3) input damp.	-0.0004	crash						25.000000	apg-arch-0319		Edits: (1) Block.forward gains optional iter_scale=1.0 arg that scales attn_scale*attn_out + mlp_scale*mlp_out residual additions (both sequential and parallel paths). (2) GPT.__init__ precomputes encoder_iter_idx/decoder_iter_idx Python lists (per-call loop-iteration index; 0 for non-loop calls) and creates loop_iter_scale = nn.Parameter(ones(num_loops+1)) when num_loops>0. (3) forward_logits indexes iter_idx lists inline and passes iter_scale=loop_iter_scale[it-1] for loop calls (it>0), or no arg (float 1.0 default) for non-loop calls. Python-bool branching on self.looping_active and self.loop_iter_scale is None is compile-trace-constant. (4) Optimizers.__init__ appends loop_iter_scale to scalar_params (AdamW, wd=0.005, lr=0.02). TTT sees it automatically (ttt_params = list(model.parameters())). 3 fp32 scalars (~12 B raw, ~0 compressed via scalar passthrough). Novel axis: exp_245 (input-side uniform 1/sqrt(3) damp, kept) and exp_306 (output-side uniform init 1/sqrt(3) damp, discard) have only ever applied a SINGLE scale across all iterations; per-iter differentiation is untried. | torch.distributed.elastic.multiprocessing.errors.ChildFailedError: ============================================================ (train_gpt.py:1537 in step_fn)
322	2026-04-22T21:53:22Z	eval	298	298	eval	Distribution-matched TTT loss: in eval_val_ttt inner SGD, backprop CE only on the last stride=64 positions of each 2048-token training seq (positions with context>=1984), matching the sliding-window eval scoring distribution exactly.	-0.0005	discard	1.086174	+0.011692	15998604	600.102000	757.898000	1468.000000	apg-eval-0315		Single-site edit inside eval_val_ttt training inner loop: replace loss = base_model(x, y) with logits = base_model.forward_logits(x); loss = F.cross_entropy(logits[:, -stride:, :]..., y[:, -stride:]..., reduction=mean). Eval scores only the last stride positions of each window (nll[i, context_size:wlen], context_size=seq_len-stride=1984), so every evaluated token has context in [1984, 2047]. TTT currently sees positions 0..2047 equally. Masking to last-stride aligns TTT gradient distribution to scoring distribution. Risk: higher per-step gradient variance (32x fewer contributing positions); offset by batch_seqs=32 and 8-way DP giving 64*32*8=16k loss tokens per step. Time-neutral. Follow-up K values (128, 256) natural if K=64 helps directionally.
323	2026-04-22T21:58:38Z	reg	298	298	reg	Target-decay toward init (1.0) for embed_scale ONLY via a 2-line post-optimizer correction (add wd_eff*1.0 to undo AdamW's pull-to-0 and retarget it to pull-to-1). embed_scale sits inside a post-tok_emb RMSNorm gauge fix with init=1.0 and a structurally non-zero optimum, so adam_wd=0.005's default pull-to-0 fights its purpose; retargeting preserves WD strength but aims it at the init.	-0.0003	discard	1.074538	+0.000056	15997016	600.047000	764.953000	1478.000000	apg-reg-0315		Surgical alternative to exp_283 (pull-to-init on ALL scalars → discard +0.000064, over-constrained resid_mix[1]=0 and skip_gates=0 whose optima ARE at 0) and exp_312 (q_gain wd=0 via its own AdamW sub-group → size_blocked, likely because sub-group split perturbed whole scalar trajectory). No new params, no sub-group, no trajectory perturbation on other scalars (q_gain keeps its pull-to-0 to counter growth, resid_mix/skip_gates keep their pull-to-0 since 0 is genuinely optimal). Only flips target for one 512-float vector whose optimum is not at zero. Implementation: after optimizers.step(), add `wd_eff * 1.0` where wd_eff = adam_wd * scalar_lr * lr_scale, matching AdamW's just-applied (1 - wd_eff) shrinkage so the net stationary point of the WD term is now 1.0 rather than 0.
324	2026-04-22T22:01:27Z	opt	298	298	opt	Floor Muon-momentum warmdown blend at 0.25 (momentum floor 0.9375 vs 0.92) so the deepest ~18% of training (lr_scale<0.25) averages direction over a wider window — milder variant of exp_314's sqrt-hold (size_blocked at bpb=1.074206) aimed at capturing the hold signal while limiting weight-trajectory drift.	-0.00015	keep	1.074280	-0.000202	15998768	600.123000	757.877000	1468.000000	apg-opt-0315	snapshots/324_opt	Single-line change at train_gpt.py:~1492 in step_fn: `mm_blend = max(lr_scale, 0.25)` replaces the bare `lr_scale` multiplier in the Muon-momentum blend against muon_momentum_warmup_start. No-op during peak/warmup (lr_scale==1); only activates when lr_scale<0.25, raising end-of-training momentum from 0.92 → 0.9375. Delta-trajectory is ~half the magnitude of exp_314's sqrt cool (which blew size at +180KB), so expected artifact size drift is well within the ~180KB headroom.
