exp_id	timestamp	specialist	parent_exp	baseline_exp	domain	hypothesis	expected_delta	status	val_bpb	delta_vs_best	artifact_bytes	train_s	eval_s	total_s	job_name	snapshot_path	notes
648	2026-04-24T22:25:57Z	meta	596	596	meta	Set explicit betas=(0.9, 0.99) on the prequant-TTT AdamW (line 1138): the optimizer currently inherits PyTorch's default beta2=0.999 (half-life ~693 steps) which never settles within the ~800-step prequant TTT run; beta2=0.99 (half-life ~69 steps, ~3-4 chunks per rank) lets the second-moment preconditioner adapt within an epoch while still smoothing across multiple chunks. Untouched axis: zero prior trials have modified the prequant TTT optimizer's betas across any specialist.	-0.0003	crash						25.000000	apg-meta-0648		Single-site +1-line change at train_gpt.py:1139, adding betas=(0.9, 0.99). Code bytes 25410→25439 (+29 B), zero new params, zero new model bytes. Pre-quant TTT runs ~21 epochs over ~38 chunks/rank with batch_seqs=32 → ~800 AdamW steps total. Untouched knob: search of tree.tsv shows no specialist has touched prequant TTT optimizer betas/eps/momentum (only exp_636 attempted prequant_ttt_wd, which crashed). Direction: PyTorch default beta2=0.999 is calibrated for long pretraining runs (>10K steps); at 800 steps the preconditioner stays in transient. Lowering to 0.99 brings half-life into a regime where each chunk's gradient distribution shapes per-row scaling, mirroring the principle behind exp_177's kept adam_wd 0.02→0.005 (matching regularization to actual run length). Conservative middle ground vs main-train beta2=0.95 (half-life ~14 steps), avoiding the per-chunk gradient-noise amplification risk that 0.95 would introduce on rare-token rows in pre-quant val adaptation. Compile-safe: betas argument is consumed at construction time, no dynamic graph dependency. | torch.distributed.elastic.multiprocessing.errors.ChildFailedError: ============================================================ (train_gpt.py:371 in __init__)
649	2026-04-24T22:26:52Z	reg	596	596	reg	Add weight_decay=1e-3 to eval-TTT SGD optimizer (line 996) — the only optimizer in pipeline with NO weight decay. Pulls full-param weights toward zero each SGD step to anchor adaptation drift across chunks.	-0.0003	crash						24.000000	apg-reg-0648		Single-arg single-line edit: torch.optim.SGD(..., momentum=h.ttt_momentum) -> torch.optim.SGD(..., momentum=h.ttt_momentum, weight_decay=1e-3). Code +14 bytes; zero new params. Untouched WD axis: prior reg WD trials targeted main-train Muon (exp_095/164/336/377), main-train AdamW (exp_177/452/550), embed (exp_218), or LoRA TTT (PR#1767). Eval-TTT SGD is full-param and runs ~208 steps with momentum=0.9 -> effective per-step shrinkage lr*wd/(1-mom)=5e-5 -> ~1% cumulative pull-to-zero across eval-TTT. | torch.distributed.elastic.multiprocessing.errors.ChildFailedError: ============================================================ (train_gpt.py:371 in __init__)
650	2026-04-24T22:27:53Z	opt	596	596	opt	Shrink MUON_MOMENTUM_WARMUP_STEPS 1500→800: Muon momentum ramp knob has never been tuned in ~650 trials. On a ~2500-3500-step run the current 1500-step ramp reaches peak momentum at ~40-50% of training, vs the proven-optimal ~22% fraction from exp_088. Shortening aligns the step-count schedule with the fraction target and extends the peak-momentum × peak-LR overlap window by ~15-20%.	-0.0005	crash						23.000000	apg-opt-0649		Single-literal change at line 130 (MUON_MOMENTUM_WARMUP_STEPS default 1500→800). Zero code/size impact (-20 bytes from one-digit shrink). Muon step_fn reads this value as `frac = min(step/1500, 1.0)` to linearly blend warmup_start (0.92) → peak (0.99). Shrinking the divisor brings momentum to peak earlier in wallclock, mirroring exp_088's proven keep (-0.001115 Δ) on the fraction-based sister axis. Tuning target: if total steps ~3000, 800 gives ~27% ramp; if ~2500, gives ~32%; both closer to the exp_088 0.22 optimum than the current effective ~50%. Risk: overshoot to cold-start noise if training has very few steps — mitigated by existing WARMUP_STEPS=20 fixed-step cold warmup restoring optimizer/model state before main loop starts. | torch.distributed.elastic.multiprocessing.errors.ChildFailedError: ============================================================ (train_gpt.py:371 in __init__)
651	2026-04-24T22:32:34Z	meta	596	596	meta	Halve prequant-TTT cosine eta_min floor: lr*0.1 to lr*0.05 at line 1144 (untouched axis), deeper cool tail in last ~5 of 21 prequant TTT epochs before GPTQ.	-0.0002	crash						29.000000	apg-meta-0651		Single-literal change, +1 code byte (0.1 to 0.05). Untouched axis across 600+ trials. Aims for tighter weight clusters before GPTQ for both bpb and brotli compression. Preflight code_bytes=25441. | torch.distributed.elastic.multiprocessing.errors.ChildFailedError: ============================================================ (train_gpt.py:371 in __init__)
652	2026-04-24T22:49:21Z	arch	596	596	arch	Switch attn_out_gate from input-keyed [H,12] over x[...,:12] to output-keyed [H,H] cross-head mixer over y.mean(-1) — gate per-head sigmoid responds to actual attention activity (squeeze-excitation / talking-heads style) rather than the first 12 input features.	-0.0005	size_blocked	1.073587		16002024	600.148000	580.000000	1497.000000	apg-arch-0648		"Replaces exp_538's input-keyed attn_out_gate (kept) with an output-keyed variant. New gate input is y.mean(dim=-1) where y is post-flash-attn, post-XSA. Weight shape changes from [num_heads, 12] = 96 → [num_heads, num_heads] = 64 fp32/layer (saves 32 fp32/layer × 11 = 1408 bytes raw → ~600 bytes packed). Zero-init keeps gate=1 at step 0 (transparent). Structurally distinct from all prior arch trials in tree (no prior trial used pooled attention output as gate input). Same routing via CONTROL_TENSOR_NAME_PATTERNS (substring ""attn_out_gate"" still matches). Compute overhead is one mean(dim=-1) over 64-dim per layer, ~negligible."
653	2026-04-24T22:51:45Z	loss	596	596	loss	Stack tiny logit-L2 (5e-7) on top of TTT z-loss (1e-5) in eval_val_ttt inner CE: two mechanism-distinct logit regularizers.	-0.0002	size_blocked	1.072867		16001189	600.097000	585.100000	1519.000000	apg-loss-0648		Single-site edit at line 1401: append + 5e-7 * _lf.pow(2).mean() to TTT inner loss expression.
654	2026-04-24T22:52:54Z	curr	596	596	curr	Replace Latin-square-8 phase cycling (exp_142) with golden-ratio Weyl low-discrepancy phase: phase = int(((epoch*phi + si*(1-phi)) mod 1) * (max_phase+1)) with phi=0.6180...—removes the 8-bucket cap on distinct phases per shard, giving discrepancy O(log N / N) over N resets. Per-shard offset si*(1-phi) decorrelates phases across shards at epoch 1 so batch-0 sees 12 spread-out phases rather than all shards stuck at their LS8-permuted bucket-0. Drops _phase_order list entirely.	-0.00004	eval_budget_overrun	1.074715			600.106000	601.700000	1548.000000	apg-curr-0648		Curr-domain sampler-family progression per preamble: uniform → stratified (exp_196 kept) → low-discrepancy (this). Latin-square-8 (exp_142) gave -0.000028; Weyl is a direct refinement. exp_612 also tried to decouple _phase_order but was size_blocked — this approach is leaner (+47 code bytes) and removes the _phase_order list. Primary risk: gain is small (expect noise-floor territory). If discard, next session should try a mechanism-different curriculum edit (e.g. within-shard stratified phases or jittered strides) rather than more Weyl tuning.
655	2026-04-24T22:53:39Z	tok	596	596	tok	"Inject prev-token bigram context into x0 via shared tok_emb at fixed alpha=0.1 (zero new params): F.pad-shift input_ids right by 1 with BOS=0 padding, lookup prev embeddings, add 0.1*prev_emb to curr_emb BEFORE the post-tok_emb RMSNorm so the gauge-fix conditions both curr and prev together. Curr still dominates ~10:1 (var ratio 1.01), but every recurrent-loop block and skip-anchored decoder now sees a bigram-prior-laden x0 directly in the residual stream — distinct from attention-derived bigram learning since it's present at depth 0 with no Q*K cost and survives every later block's pre-RMSNorm because it's already normalized into the per-token gauge.</hypothesis> <parameter name=""notes"">Single-site edit in GPT.forward_logits (line ~733). Adds 2 lines of forward code: prev_ids = F.pad(input_ids[:, :-1], (1, 0), value=0); x = x + 0.1 * self.tok_emb(prev_ids). Zero new params, zero new modules, +295 packed code bytes (23296->23591). Tok history check: NO prior tok experiment has tested input-side bigram-context injection. Prior bigram-related work all involved separate hash channels (size-blocking due to extra embedding tables). This uses the EXISTING tok_emb matrix, so the only cost is one extra Embedding lookup per forward (cheap, fully fused). Mechanism: Block 0's downstream RMSNorm normalizes residual to unit-RMS per token; pure curr-token x0 is then propagated into recurrent loops and via skip_weights. Mixing 0.1*prev gives x0 an unequal bigram prior — attention can still learn longer-range bigrams via Q*K, but the trunk no longer has to spend block-0 capacity recovering t-1 dependence. Risk vectors: (1) +295 packed code bytes pushes total closer to 16MB cap; could hit size_blocked if GPTQ Hessian tweaks model_bytes by >7KB. (2) alpha=0.1 is a magic number — picked so that var(curr+0.1*prev)/var(curr) ≈ 1.01 (minimal magnitude shift through downstream RMSNorm). (3) BOS=0 padding at position 0 is the SP unk_id, harmless because block-0 attention will discount the first position. If size_blocked at improved bpb, follow-up: try alpha=0.05 to halve the perturbation and reduce model_bytes inflation." -0.0005 discard 1.073504 +0.001253 15997158 600.059000 581.000000 1523.000000 apg-tok-0649  
656	2026-04-24T22:53:42Z	ttt	596	596	ttt	"Selective chunk-boundary momentum damping: mb.mul_(0.5) ONLY on tok_emb at each chunk's first step. Surgical version of exp_588 (full damping won -0.000727 but stack onto z-loss in exp_607 regressed +0.000362) — full damping likely over-attenuates attn/MLP velocities that encode transferable patterns; tok_emb is the largest, most vocab-distribution-coupled tensor with the most chunk-stale velocity.</hypothesis> <parameter name=""notes"">Orthogonal to z-loss (per-step logit regularizer in current best). Single 4-line insert in eval_val_ttt right after per-chunk LR update: looks up tok_emb's optimizer state and halves its momentum_buffer. +95 code bytes (23296→23391 packed). Untested midpoint between exp_588 (all params damped) and current best (none damped)." -0.0002 eval_budget_overrun 1.073281   600.051000 601.700000 1536.000000 apg-ttt-0649  
657	2026-04-24T22:53:43Z	eval	596	596	eval	Skip eval_val_sliding when TTT is enabled (TTT score is the leaderboard metric; sliding pass is redundant ~30-50s) and use the freed budget to bump TTT_EPOCHS 4→5 — exp_223's 4→5 was eval_budget_overrun on pre-z-loss stack without budget freed; this combines them.	-0.0003	discard	1.072468	+0.000217	15998627	600.141000	512.500000	1452.000000	apg-eval-0651		Two synergistic eval-pipeline edits at lines 180 and 1630-1632. (1) Source default TTT_EPOCHS 4→5: untried in z-loss regime, untried with sliding skipped. exp_017 last validated this axis at 3→4 (keep, -0.000413). (2) Gate sliding-window pass with `not h.ttt_enabled` so quantized_sliding_window doesn't run when quantized_ttt is the metric. exp_137 combined skip-sliding with stride 64→48 (discard +0.000025) but never tested skip-sliding alone or skip-sliding+ttt_epochs+1.
658	2026-04-24T22:57:00Z	quant	596	596	quant	"3-level H-quantile-stratified GPTQ damping: top-20% H_ii at 1.005x (lighter, preserves curvature on dominant cols), bottom-20% at 1.015x (heavier, regularizes Hinv blow-up on tail cols), middle 60% at exp_377's 1.01x. Mean damping ≈ 1.01x so size-neutral vs current; redistributes ridge mass from sharp dominant cols to noisy tail cols.</hypothesis> <parameter name=""notes"">Single-site edit at gptq_quantize_weight line 1023. Replaces uniform 1.01x mul with torch.where stratified by H-diag quantiles. Theoretically motivated: high-H cols are dominant features (less ridge needed for stability, sharper Q), low-H cols are noisy/dead-ish (Hinv[j,j]=1/d blows up, more ridge stabilizes error propagation). Mean factor matches exp_377 baseline (1.005*0.2 + 1.01*0.6 + 1.015*0.2 = 1.010), targeting size neutrality. Distinct from exp_613 (selective ADD damping on top-20%, size_blocked at 1.072692) and exp_421 (hard 1e-2 H-floor, discard +0.000338).</parameter> </invoke>" -0.0001 discard 1.073372 +0.001121 15999853 600.078000 584.400000 1521.000000 apg-quan-0651  
659	2026-04-24T23:04:49Z	meta	596	596	meta	Lower muon_backend_steps 5→4: untouched DOWN direction on a knob where UP (exp_241 5→6) hurt by +0.001342, suggesting the optimizer benefits from residual NS5 non-orthogonality. With MuonEq-R row normalization already re-spreading singular values, slightly looser orthogonalization preserves implicit leading-direction emphasis while saving ~1% Muon compute per step.	-0.0002	discard	1.072838	+0.000587	15996108	600.049000	581.300000	1518.000000	apg-meta-0652		Single-literal change at line 151 (MUON_BACKEND_STEPS default 5→4). Zero code/byte impact. Quintic NS coefficients (3.4445, -4.7750, 2.0315) at 4 iterations still give ~95-98% orthogonality; MuonEq-R row_normalize=True re-spreads spectra so residual non-orthogonality is contained. exp_241 (5→6 discard +0.001342) is the UP-direction signal that more orthogonalization is bad; DOWN is the symmetric untouched probe. Risk: if 4 iterations leave too much spectral spread, MuonEq-R won't fully compensate.
660	2026-04-24T23:05:44Z	opt	596	596	opt	Add MIN_LR=0.02 floor on LR warmdown: novel quantitative-threshold change (0.0→nonzero) atop exp_596. PR #1787 used MIN_LR=0.10 (size 15.94 MB), and exp_140 size_blocked at 0.05 with quality gain bpb=1.077318 vs depth-5 best 1.077537. 0.02 is a much more conservative floor — only the deepest 2% of training keeps non-trivial LR — sized to capture the quality signal while limiting weight-trajectory drift that caused exp_140's size_block in the much-tighter depth-22 regime.	-0.0003	discard	1.073420	+0.001169	15999551	600.046000	593.900000	1539.000000	apg-opt-0652		Single-literal change at line 143 (MIN_LR default 0.0 → 0.02). Zero new code, ~3 byte addition to packed code. The lr_mul function already uses h.min_lr as the floor: `return max((1.0 - frac) / h.warmdown_frac, h.min_lr)`. Effect: when frac >= 1 - 0.02*0.72 ≈ 98.6% of budget elapsed, lr_scale floors at 0.02 instead of decaying to 0. Both Muon (matrix_lr*0.02 = 0.00044) and Adam (embed_lr*0.02=0.012, scalar_lr*0.02=0.0004) groups continue tiny updates in the deepest tail, allowing fine refinement. mm_blend in step_fn already floors momentum at 0.25 regardless of lr_scale, so momentum schedule is unchanged. The 0.02 value vs exp_140's 0.05 reflects the much tighter byte budget at depth-22 (recent opt experiments hit size_blocked frequently).
661	2026-04-24T23:06:32Z	reg	596	596	reg	embed_wd 0.085 to 0.090 (+5.9% UP probe on tied tok_emb AdamW WD): direct mild UP probe untested in current snapshot — exp_218's warmdown-scheduled effective +50% boost discarded, but a small fixed UP has never been individually probed; expected to slightly tighten the largest weight tensor for marginal int6/brotli compression gain.	+0.0001	discard	1.072811	+0.000560	15996079	600.023000	590.000000	1530.000000	apg-reg-0652		Single-literal change at line 169 (EMBED_WD default 0.085 to 0.090). Zero code-byte delta, zero new params. Tighter tok_emb shrinks weight distribution, potentially aiding GPTQ int6 + brotli-11. Untested-direct: exp_218 was warmdown-targeted UP via 1/lr_scale-cap-2x boost (discard +0.001975 - different mechanism, much larger effective magnitude). This probe is +5.9% steady-state UP, far milder than exp_218's mean-1.5x boost. Size-favorable (slight weight shrinkage improves compression).
662	2026-04-24T23:11:13Z	quant	596	596	quant	Mean-center the GPTQ Hessian (H ← H − n·μ·μᵀ) so it represents activation covariance rather than uncentered second moment: removes rank-1 DC contamination from H so act-order permutation ranks columns by genuine signal variance rather than (variance + DC²); size-neutral.	-0.0002	crash						29.000000	apg-quan-0662		Single-site edit in collect_hessians: add per-feature sum_x and token-count accumulators alongside the existing x.T@x; after the calibration loop subtract sum_x ⊗ sum_x / n from H before the /n_calibration_batches normalization. Code +308 B (23296→23604), zero new stored tensors. Mechanism: post-RMSNorm activations have unit RMS but non-zero per-feature mean; the uncentered Hessian H_ii = E[x_i²] = Var(x_i) + μ_i². Subtracting μ_i² (rank-1 along the all-ones direction in feature space) gives the covariance H_cov. Effects: (1) act-order permutation argsort(H.diag()) now demotes high-DC-low-variance features that were previously over-prioritized; (2) damping H.diagonal().mul_(1.01) and per-row scale s = clip_sigmas·row_std/clip_range are unchanged; (3) Cholesky factor of H_cov is well-defined since covariance is PSD by construction. Theoretical caveat: canonical GPTQ minimizes ‖W·X − Wq·X‖² whose Hessian IS the uncentered second moment, not covariance. The edit is mathematically a slightly different objective approximating the original up to a rank-1 ‖(W-Wq)·μ‖² term, which is small for centered weight rows. Untouched axis: no prior trial in the tree (exp_055/201/450/468 all touched per-row scale not Hessian-collection itself; exp_510 winsorized x but did not center it). Risk: medium — may shift Q distributions enough to size_block, but the Hessian-collection step doesn't directly affect Q codes, only their perm and damping conditioning; bpb effect should be ≤0.0005 in either direction. | torch.distributed.elastic.multiprocessing.errors.ChildFailedError: ============================================================ (train_gpt.py:1047 in gptq_quantize_weight)
663	2026-04-24T23:21:59Z	arch	596	596	arch	RMS-norm the attn_out_gate input before its per-head linear so gate sigmoid sensitivity is decoupled from per-block ln_scale_factor variance.	-0.0003	eval_budget_overrun	1.072667			600.099000	603.200000	1526.000000	apg-arch-0658		
664	2026-04-24T23:26:07Z	loss	596	596	loss	Swap TTT z-loss from L2 (logsumexp².mean at λ=1e-5) to L1 (|logsumexp|.mean at λ=2e-4) — never-tested mechanism change; coefficient rescaled to match L2's gradient magnitude at typical logsumexp~10 (2·λ_L2·lse = λ_L1 → λ_L1≈2e-4). L1 penalty gives constant-sign pressure on logsumexp toward 0 regardless of magnitude, whereas L2 weakens near 0 — relevant if the winning 1e-5 L2 is operating in a near-fixed-point regime where additional regularization comes from the L1 tail.	-0.0002	discard	1.072616	+0.000365	15998890	600.133000	585.700000	1525.000000	apg-loss-0659		Single-site edit at line 1401. .pow(2) (6 chars) → .abs() (5 chars), 1e-5 → 2e-4 same length. Net -1 code byte, zero artifact-weight impact. Orthogonal axis to all prior TTT-loss trials (617/622/631/645/653 all kept the L2 form with λ=1e-5 and modified or stacked other terms). If L1 beats L2, next probe is coefficient tuning on the new mechanism. If it underperforms (bpb ≈ 1.0727), the L2 choice is confirmed as mechanism-optimal and future z-loss experiments should stay on .pow(2).
665	2026-04-24T23:26:16Z	tok	596	596	tok	Add learnable scalar bigram_alpha (init=0) for prev-token injection via shared tok_emb at input — lets optimizer choose mixing strength rather than the fixed 0.1 forced in exp_655 (discarded +0.001253). One scalar, registered in scalar AdamW group; frozen during TTT (numel<10000) so no eval-time interaction.	-0.0003	discard	1.072448	+0.000197	15999415	600.133000	587.700000	1521.000000	apg-tok-0659		Single-param structural mod at lines 638 and 733-735. embed_scale gauge-fix path unchanged. Adds 4 bytes of fp32 model and ~278 bytes of code. Differs from exp_655 in two ways: (1) learnable alpha init=0 starts as no-op, optimizer can settle on tiny or zero value if bigram is unhelpful; (2) preserved scalar grouping so it follows the proven scalar_lr/adam_wd schedule rather than acting as a forced constant.
666	2026-04-24T23:27:24Z	ttt	596	596	ttt	Replace TTT inner CE with mean-preserving focal-style reweighting (γ=1, weights = 1 - p_correct detached, normalized by Σw) stacked on exp_596 z-loss — concentrates the 4-step per-chunk SGD budget on hard tokens where the model is currently uncertain, without confounding effective LR.	-0.0003	size_blocked	1.080149		16003951	600.137000	586.900000	1526.000000	apg-ttt-0659		Three-line edit at line 1399-1403 in eval_val_ttt inner loop: (1) compute per-token CE with reduction='none', (2) _w = 1 - exp(-_ce).detach() as token-difficulty weight, (3) loss = Σ(w·ce)/Σw + existing 1e-5 z-loss term. Mean-preserving normalization via /_w.sum() keeps overall gradient magnitude matched to unweighted baseline, so it interacts purely with gradient DISTRIBUTION across tokens (hard tokens get full gradient, easy tokens diminished), not gradient SCALE (which would couple with ttt_lr=0.005). Orthogonal to all prior TTT re-weighting attempts (exp_424/534/622 positional; exp_614 byte-weighted catastrophic; exp_631 label smoothing size_blocked) — those were token-POSITION or token-CONTENT based, not difficulty-based. Preamble explicitly lists focal as a canonical TTT inner-objective swap. +50 packed bytes. Detached weight avoids secondary gradient terms.
