exp_id	parent_exp	depth	path	specialist	status	val_bpb	delta_vs_best	hypothesis
640	596	22	000/005/017/088/108/142/151/164/177/196/212/245/267/280/298/324/336/377/475/491/538/596/640	arch	crash			Add parameter-free per-head sub-LN (F.rms_norm over head_dim) on attention output after XSA and before the data-dependent attn_out_gate: pairs with existing QK-norm so gate and proj receive unit-RMS per-head signal regardless of content strength.
641	596	22	000/005/017/088/108/142/151/164/177/196/212/245/267/280/298/324/336/377/475/491/538/596/641	tok	crash			Raise EMBED_CLIP_SIGMAS 20.0 to 24.0 (+20% UP probe): exp_561 (to 14) and exp_570 (to 18) both DOWN-direction probes size_blocked at improved-bpb but oversize artifacts; UP direction is completely untried in tok history. Wider clip means larger GPTQ scale s = cs*row_std/127, so ~25% more weights round to 0 in tok_emb (4.2M params), giving better brotli-11 compression headroom; quant-error per non-zero only rises ~20%.</hypothesis> <parameter name="notes">Single-line default change at line 197 (EMBED_CLIP_SIGMAS 20.0 to 24.0). Zero new params, zero code-byte impact. Mechanism: SDClip uses s = clip_sigmas * row_std / (2^(bits-1)-1). Going 20 to 24 raises s by 20%, which enlarges the |w|<s/2 zero-rounding zone and concentrates int8 entropy near 0 for better brotli compression. Trade-off accepts mild fidelity loss (+~0.0005 bpb expected) for byte headroom that the recent best's child branches desperately need (most exp_596 children size_blocked). Even a discard at small +delta provides actionable signal on the UP direction's slope, complementing exp_561/570's DOWN measurements at 14/18 (size_blocked at bpb=1.072171 / 1.072307). Risk: low - single-literal change, isolated to GPTQ tok_emb path, no interaction with TTT or compile graph.
642	596	22	000/005/017/088/108/142/151/164/177/196/212/245/267/280/298/324/336/377/475/491/538/596/642	ttt	discard	1.073544	+0.001293	Floor TTT cosine-decay LR at 20% of peak (h.ttt_lr * 0.2) so late chunks continue adapting; current schedule gives last ~25% of chunks cos_lr < 10% of peak, effectively freezing them despite scoring-first order. Z-loss stabilizes per-step noise enough to afford more late-chunk adaptation.
643	596	22	000/005/017/088/108/142/151/164/177/196/212/245/267/280/298/324/336/377/475/491/538/596/643	curr	discard	1.072996	+0.000745	Mask training-CE loss on positions 0..3 of each sequence via y[:, :4] = -100 in ShuffledSequenceLoader.next_batch — F.cross_entropy's default ignore_index=-100 handles it (no forward edit). These 4 cold-start positions have 0-3 tokens of context (pure unigram/bigram regime), contribute ~0.2% of gradient signal, and are far from the 1984+-ctx regime eval scores under stride-64 sliding windows. Cleanly redirects that sliver of gradient to high-context positions.
644	596	22	000/005/017/088/108/142/151/164/177/196/212/245/267/280/298/324/336/377/475/491/538/596/644	meta	size_blocked	1.072766		muon_wd (attn-only Muon WD) 0.095 → 0.090 (-5.3% DOWN): smaller-step probe on the attn sub-group of the exp_164 type-split, untested across the size_blocked -7%/-8% probes (exp_414 discard, exp_346/489 size_blocked) and now evaluated under the new z-loss + attn_out_gate + Gradient-Centralization regime where the data-dependent gate already regularizes attn matrices, so the joint WD optimum should shift DOWN (exp_336 mechanism: probe DOWN on each sub-group first).
645	596	22	000/005/017/088/108/142/151/164/177/196/212/245/267/280/298/324/336/377/475/491/538/596/645	loss	discard	1.073238	+0.000987	Extend z-loss regularization from TTT inner CE (already at 1e-5) into MAIN pretraining CE at 5e-7 (conditional on self.training), so logit-partition is kept under control throughout the ~10k training steps too — an untouched axis in our tree (all 5 recent loss trials targeted TTT only).
646	596	22	000/005/017/088/108/142/151/164/177/196/212/245/267/280/298/324/336/377/475/491/538/596/646	quant	size_blocked	1.072235		Mild six-sigma winsorized row_std in GPTQ SDClip: clamp W before recomputing std, finer bins on heavy-tail rows.
647	596	22	000/005/017/088/108/142/151/164/177/196/212/245/267/280/298/324/336/377/475/491/538/596/647	opt	size_blocked	1.107760		Disable MuonEq-R row-normalization on MLP matrix group only (attn keeps row_normalize=True). Novel opt axis: per-group toggle of the row-equalization pre-NS5 step. MLP matrices are tall/skinny (4*D x D) with heterogeneous hidden-neuron row magnitudes that row-normalization squashes before NS5; exp_241's notes already implicate row_normalize in amplifying small-sigma directions. Keeping attn row-normalized preserves the per-head equalization MuonEq-R was designed for while letting NS5 see natural MLP row-norm variance.
648	596	22	000/005/017/088/108/142/151/164/177/196/212/245/267/280/298/324/336/377/475/491/538/596/648	meta	crash			Set explicit betas=(0.9, 0.99) on the prequant-TTT AdamW (line 1138): the optimizer currently inherits PyTorch's default beta2=0.999 (half-life ~693 steps) which never settles within the ~800-step prequant TTT run; beta2=0.99 (half-life ~69 steps, ~3-4 chunks per rank) lets the second-moment preconditioner adapt within an epoch while still smoothing across multiple chunks. Untouched axis: zero prior trials have modified the prequant TTT optimizer's betas across any specialist.
649	596	22	000/005/017/088/108/142/151/164/177/196/212/245/267/280/298/324/336/377/475/491/538/596/649	reg	crash			Add weight_decay=1e-3 to eval-TTT SGD optimizer (line 996) — the only optimizer in pipeline with NO weight decay. Pulls full-param weights toward zero each SGD step to anchor adaptation drift across chunks.
650	596	22	000/005/017/088/108/142/151/164/177/196/212/245/267/280/298/324/336/377/475/491/538/596/650	opt	crash			Shrink MUON_MOMENTUM_WARMUP_STEPS 1500→800: Muon momentum ramp knob has never been tuned in ~650 trials. On a ~2500-3500-step run the current 1500-step ramp reaches peak momentum at ~40-50% of training, vs the proven-optimal ~22% fraction from exp_088. Shortening aligns the step-count schedule with the fraction target and extends the peak-momentum × peak-LR overlap window by ~15-20%.
651	596	22	000/005/017/088/108/142/151/164/177/196/212/245/267/280/298/324/336/377/475/491/538/596/651	meta	crash			Halve prequant-TTT cosine eta_min floor: lr*0.1 to lr*0.05 at line 1144 (untouched axis), deeper cool tail in last ~5 of 21 prequant TTT epochs before GPTQ.
652	596	22	000/005/017/088/108/142/151/164/177/196/212/245/267/280/298/324/336/377/475/491/538/596/652	arch	size_blocked	1.073587		Switch attn_out_gate from input-keyed [H,12] over x[...,:12] to output-keyed [H,H] cross-head mixer over y.mean(-1) — gate per-head sigmoid responds to actual attention activity (squeeze-excitation / talking-heads style) rather than the first 12 input features.
653	596	22	000/005/017/088/108/142/151/164/177/196/212/245/267/280/298/324/336/377/475/491/538/596/653	loss	size_blocked	1.072867		Stack tiny logit-L2 (5e-7) on top of TTT z-loss (1e-5) in eval_val_ttt inner CE: two mechanism-distinct logit regularizers.
654	596	22	000/005/017/088/108/142/151/164/177/196/212/245/267/280/298/324/336/377/475/491/538/596/654	curr	eval_budget_overrun	1.074715		Replace Latin-square-8 phase cycling (exp_142) with golden-ratio Weyl low-discrepancy phase: phase = int(((epoch*phi + si*(1-phi)) mod 1) * (max_phase+1)) with phi=0.6180...—removes the 8-bucket cap on distinct phases per shard, giving discrepancy O(log N / N) over N resets. Per-shard offset si*(1-phi) decorrelates phases across shards at epoch 1 so batch-0 sees 12 spread-out phases rather than all shards stuck at their LS8-permuted bucket-0. Drops _phase_order list entirely.
655	596	22	000/005/017/088/108/142/151/164/177/196/212/245/267/280/298/324/336/377/475/491/538/596/655	tok	discard	1.073504	+0.001253	Inject prev-token bigram context into x0 via shared tok_emb at fixed alpha=0.1 (zero new params): F.pad-shift input_ids right by 1 with BOS=0 padding, lookup prev embeddings, add 0.1*prev_emb to curr_emb BEFORE the post-tok_emb RMSNorm so the gauge-fix conditions both curr and prev together. Curr still dominates ~10:1 (var ratio 1.01), but every recurrent-loop block and skip-anchored decoder now sees a bigram-prior-laden x0 directly in the residual stream — distinct from attention-derived bigram learning since it's present at depth 0 with no Q*K cost and survives every later block's pre-RMSNorm because it's already normalized into the per-token gauge.</hypothesis> <parameter name="notes">Single-site edit in GPT.forward_logits (line ~733). Adds 2 lines of forward code: prev_ids = F.pad(input_ids[:, :-1], (1, 0), value=0); x = x + 0.1 * self.tok_emb(prev_ids). Zero new params, zero new modules, +295 packed code bytes (23296->23591). Tok history check: NO prior tok experiment has tested input-side bigram-context injection. Prior bigram-related work all involved separate hash channels (size-blocking due to extra embedding tables). This uses the EXISTING tok_emb matrix, so the only cost is one extra Embedding lookup per forward (cheap, fully fused). Mechanism: Block 0's downstream RMSNorm normalizes residual to unit-RMS per token; pure curr-token x0 is then propagated into recurrent loops and via skip_weights. Mixing 0.1*prev gives x0 an unequal bigram prior — attention can still learn longer-range bigrams via Q*K, but the trunk no longer has to spend block-0 capacity recovering t-1 dependence. Risk vectors: (1) +295 packed code bytes pushes total closer to 16MB cap; could hit size_blocked if GPTQ Hessian tweaks model_bytes by >7KB. (2) alpha=0.1 is a magic number — picked so that var(curr+0.1*prev)/var(curr) ≈ 1.01 (minimal magnitude shift through downstream RMSNorm). (3) BOS=0 padding at position 0 is the SP unk_id, harmless because block-0 attention will discount the first position. If size_blocked at improved bpb, follow-up: try alpha=0.05 to halve the perturbation and reduce model_bytes inflation.
656	596	22	000/005/017/088/108/142/151/164/177/196/212/245/267/280/298/324/336/377/475/491/538/596/656	ttt	eval_budget_overrun	1.073281		Selective chunk-boundary momentum damping: mb.mul_(0.5) ONLY on tok_emb at each chunk's first step. Surgical version of exp_588 (full damping won -0.000727 but stack onto z-loss in exp_607 regressed +0.000362) — full damping likely over-attenuates attn/MLP velocities that encode transferable patterns; tok_emb is the largest, most vocab-distribution-coupled tensor with the most chunk-stale velocity.</hypothesis> <parameter name="notes">Orthogonal to z-loss (per-step logit regularizer in current best). Single 4-line insert in eval_val_ttt right after per-chunk LR update: looks up tok_emb's optimizer state and halves its momentum_buffer. +95 code bytes (23296→23391 packed). Untested midpoint between exp_588 (all params damped) and current best (none damped).
657	596	22	000/005/017/088/108/142/151/164/177/196/212/245/267/280/298/324/336/377/475/491/538/596/657	eval	discard	1.072468	+0.000217	Skip eval_val_sliding when TTT is enabled (TTT score is the leaderboard metric; sliding pass is redundant ~30-50s) and use the freed budget to bump TTT_EPOCHS 4→5 — exp_223's 4→5 was eval_budget_overrun on pre-z-loss stack without budget freed; this combines them.
658	596	22	000/005/017/088/108/142/151/164/177/196/212/245/267/280/298/324/336/377/475/491/538/596/658	quant	discard	1.073372	+0.001121	3-level H-quantile-stratified GPTQ damping: top-20% H_ii at 1.005x (lighter, preserves curvature on dominant cols), bottom-20% at 1.015x (heavier, regularizes Hinv blow-up on tail cols), middle 60% at exp_377's 1.01x. Mean damping ≈ 1.01x so size-neutral vs current; redistributes ridge mass from sharp dominant cols to noisy tail cols.</hypothesis> <parameter name="notes">Single-site edit at gptq_quantize_weight line 1023. Replaces uniform 1.01x mul with torch.where stratified by H-diag quantiles. Theoretically motivated: high-H cols are dominant features (less ridge needed for stability, sharper Q), low-H cols are noisy/dead-ish (Hinv[j,j]=1/d blows up, more ridge stabilizes error propagation). Mean factor matches exp_377 baseline (1.005*0.2 + 1.01*0.6 + 1.015*0.2 = 1.010), targeting size neutrality. Distinct from exp_613 (selective ADD damping on top-20%, size_blocked at 1.072692) and exp_421 (hard 1e-2 H-floor, discard +0.000338).</parameter> </invoke>
659	596	22	000/005/017/088/108/142/151/164/177/196/212/245/267/280/298/324/336/377/475/491/538/596/659	meta	discard	1.072838	+0.000587	Lower muon_backend_steps 5→4: untouched DOWN direction on a knob where UP (exp_241 5→6) hurt by +0.001342, suggesting the optimizer benefits from residual NS5 non-orthogonality. With MuonEq-R row normalization already re-spreading singular values, slightly looser orthogonalization preserves implicit leading-direction emphasis while saving ~1% Muon compute per step.
660	596	22	000/005/017/088/108/142/151/164/177/196/212/245/267/280/298/324/336/377/475/491/538/596/660	opt	discard	1.073420	+0.001169	Add MIN_LR=0.02 floor on LR warmdown: novel quantitative-threshold change (0.0→nonzero) atop exp_596. PR #1787 used MIN_LR=0.10 (size 15.94 MB), and exp_140 size_blocked at 0.05 with quality gain bpb=1.077318 vs depth-5 best 1.077537. 0.02 is a much more conservative floor — only the deepest 2% of training keeps non-trivial LR — sized to capture the quality signal while limiting weight-trajectory drift that caused exp_140's size_block in the much-tighter depth-22 regime.
661	596	22	000/005/017/088/108/142/151/164/177/196/212/245/267/280/298/324/336/377/475/491/538/596/661	reg	discard	1.072811	+0.000560	embed_wd 0.085 to 0.090 (+5.9% UP probe on tied tok_emb AdamW WD): direct mild UP probe untested in current snapshot — exp_218's warmdown-scheduled effective +50% boost discarded, but a small fixed UP has never been individually probed; expected to slightly tighten the largest weight tensor for marginal int6/brotli compression gain.
662	596	22	000/005/017/088/108/142/151/164/177/196/212/245/267/280/298/324/336/377/475/491/538/596/662	quant	crash			Mean-center the GPTQ Hessian (H ← H − n·μ·μᵀ) so it represents activation covariance rather than uncentered second moment: removes rank-1 DC contamination from H so act-order permutation ranks columns by genuine signal variance rather than (variance + DC²); size-neutral.
663	596	22	000/005/017/088/108/142/151/164/177/196/212/245/267/280/298/324/336/377/475/491/538/596/663	arch	eval_budget_overrun	1.072667		RMS-norm the attn_out_gate input before its per-head linear so gate sigmoid sensitivity is decoupled from per-block ln_scale_factor variance.
664	596	22	000/005/017/088/108/142/151/164/177/196/212/245/267/280/298/324/336/377/475/491/538/596/664	loss	discard	1.072616	+0.000365	Swap TTT z-loss from L2 (logsumexp².mean at λ=1e-5) to L1 (|logsumexp|.mean at λ=2e-4) — never-tested mechanism change; coefficient rescaled to match L2's gradient magnitude at typical logsumexp~10 (2·λ_L2·lse = λ_L1 → λ_L1≈2e-4). L1 penalty gives constant-sign pressure on logsumexp toward 0 regardless of magnitude, whereas L2 weakens near 0 — relevant if the winning 1e-5 L2 is operating in a near-fixed-point regime where additional regularization comes from the L1 tail.
665	596	22	000/005/017/088/108/142/151/164/177/196/212/245/267/280/298/324/336/377/475/491/538/596/665	tok	discard	1.072448	+0.000197	Add learnable scalar bigram_alpha (init=0) for prev-token injection via shared tok_emb at input — lets optimizer choose mixing strength rather than the fixed 0.1 forced in exp_655 (discarded +0.001253). One scalar, registered in scalar AdamW group; frozen during TTT (numel<10000) so no eval-time interaction.
666	596	22	000/005/017/088/108/142/151/164/177/196/212/245/267/280/298/324/336/377/475/491/538/596/666	ttt	size_blocked	1.080149		Replace TTT inner CE with mean-preserving focal-style reweighting (γ=1, weights = 1 - p_correct detached, normalized by Σw) stacked on exp_596 z-loss — concentrates the 4-step per-chunk SGD budget on hard tokens where the model is currently uncertain, without confounding effective LR.
667	596	22	000/005/017/088/108/142/151/164/177/196/212/245/267/280/298/324/336/377/475/491/538/596/667	eval	size_blocked	1.072685		Chunk-delta lookahead at TTT scoring: apply alpha=0.3 * (prev-chunk weight delta) only during current chunk's scoring pass, undo before training. Causal Polyak-style forward projection along prior adaptation trajectory — uses past TTT state as free prediction for next chunk's better weights.
668	596	22	000/005/017/088/108/142/151/164/177/196/212/245/267/280/298/324/336/377/475/491/538/596/668	curr	size_blocked	1.074917		Long-context curriculum: mask positions 0..1023 with ignore_index=-100 in y for the first 300 train_loader.next_batch calls (~10% of training), then full coverage. Aligns early gradient distribution with eval's deep-context scoring regime (eval mostly scores at positions ≥1984 under stride-64 sliding window).
669	596	22	000/005/017/088/108/142/151/164/177/196/212/245/267/280/298/324/336/377/475/491/538/596/669	tok	crash			Share embed_scale at output gauge-fix site: replace bare final_norm with F.rms_norm(x * embed_scale)
670	596	22	000/005/017/088/108/142/151/164/177/196/212/245/267/280/298/324/336/377/475/491/538/596/670	opt	discard	1.072390	+0.000139	Switch Muon mm_blend shape from linear-with-floor (max(lr_scale, 0.25)) to sqrt-with-floor (max(lr_scale**0.5, 0.25)): concave hold keeps Muon momentum higher through mid-warmdown (e.g. at lr_scale=0.25, mm=0.9755 vs 0.9505 linear) while preserving the kept-floor=0.25 deepest-tail clamp (exp_324). exp_574 showed bpb=1.072782 (-0.000684 vs parent exp_538) with this exact shape but size_blocked at packed code 26223; current exp_596 baseline packs to 23296, giving ~3KB extra headroom.
671	596	22	000/005/017/088/108/142/151/164/177/196/212/245/267/280/298/324/336/377/475/491/538/596/671	reg	discard	1.073555	+0.001304	Trust-region anchor on TTT zero-init proj weights: end-of-chunk lerp pulls.attn.proj/.mlp.proj toward p0 (post-quant init) at alpha=0.01 - bounds cross-chunk drift on residual writers while c_q/c_k/c_v/mlp.fc/tok_emb adapt freely. Distinct from WD (toward 0; exp_649 crashed) and chunk-mb damping (history-based; exp_588 did not stack with z-loss).
672	596	22	000/005/017/088/108/142/151/164/177/196/212/245/267/280/298/324/336/377/475/491/538/596/672	meta	size_blocked	1.073052		muon_momentum_warmup_start 0.92 to 0.91 (gentle -1% DOWN, untested midpoint): under z-loss regime (exp_596), UP side at 0.93 hurt more (+0.000621, exp_615) than the pre-z-loss landscape predicted; 0.90 hurt only on pre-088 baselines predating qk_gain=5.25 / parallel residuals / attn_out_gate / z-loss, so the DOWN bracket needs a gentler probe in the current regime.</hypothesis> <parameter name="notes">Single-literal default change at line 152 (MUON_MOMENTUM_WARMUP_START 0.92 to 0.91). Zero code/byte delta (23296 to 23296), zero new params, zero compile-graph risk. Mechanism: widens Muon-momentum warmup range from span 0.07 (0.92 to 0.99) to span 0.08 (0.91 to 0.99) across the same 22% time-fraction; gives slightly more responsive early Muon updates before peak momentum is reached. Untested midpoint between 0.90 (pre-088 discards, exp_106/284/384) and 0.92 (current optimum).
673	596	22	000/005/017/088/108/142/151/164/177/196/212/245/267/280/298/324/336/377/475/491/538/596/673	quant	size_blocked	1.073135		GPTQ multiplicative H damping 1.01 → 1.0075 (untested midpoint between exp_377 kept 1.01 and exp_387/477/497 size_blocked 1.005): continuation of monotonic DOWN trajectory; expected fit since Q-code histogram should remain close to 1.01's compression profile.
674	596	22	000/005/017/088/108/142/151/164/177/196/212/245/267/280/298/324/336/377/475/491/538/596/674	arch	size_blocked	1.073571		Per-head input keying for attn_out_gate: each head h reads its own 12-dim window x[..., h*head_dim:h*head_dim+12] instead of all heads sharing x[..., :12]. Zero new parameters (gate_w shape unchanged at [H,12]); structural prior aligning head h's gate with feature window h.
675	596	22	000/005/017/088/108/142/151/164/177/196/212/245/267/280/298/324/336/377/475/491/538/596/675	loss	size_blocked	1.072851		Replace TTT-inner z-loss with mean-centered variance form: 2e-4*logsumexp.var (was 1e-5*logsumexp^2.mean). Penalizes cross-position spread of log-partition rather than absolute magnitude — mean-shift-invariant.
676	596	22	000/005/017/088/108/142/151/164/177/196/212/245/267/280/298/324/336/377/475/491/538/596/676	eval	size_blocked	1.073513		Polyak-Ruppert tail averaging on the last TTT epoch within each chunk: accumulate running mean of post-step weights across only the final epoch, then copy that average into ttt_params before the next chunk's scoring pass. Constant-LR + Nesterov within a chunk yields a noisy SGD trajectory whose terminal point is variance-dominated; tail averaging is the canonical remedy. Eval-time only, ~1 transient param-copy of memory, zero artifact bytes — and structurally distinct from exp_667's forward-extrapolation lookahead (which lost), exp_588 momentum halving, and the AGC/GC family.
677	596	22	000/005/017/088/108/142/151/164/177/196/212/245/267/280/298/324/336/377/475/491/538/596/677	tok	size_blocked	1.073913		Apply embed_scale gauge-fix at output AFTER self.final_norm: F.rms_norm(x * embed_scale) between final_norm and F.linear, reusing input-side param.
678	596	22	000/005/017/088/108/142/151/164/177/196/212/245/267/280/298/324/336/377/475/491/538/596/678	ttt	eval_budget_overrun	1.073302		Per-epoch Lookahead pullback within each TTT chunk (alpha=0.5 at epoch cadence)
679	596	22	000/005/017/088/108/142/151/164/177/196/212/245/267/280/298/324/336/377/475/491/538/596/679	curr	discard	1.073919	+0.001668	Mask SP special tokens (ids 0-2 UNK/BOS/EOS) from training CE via y[y<3]=-100 — token-ID-based mask, untried mechanism. Prior curr masks were position-based or weight-based.
