exp_id	parent_exp	depth	path	specialist	status	val_bpb	delta_vs_best	hypothesis
380	336	17	000/005/017/088/108/142/151/164/177/196/212/245/267/280/298/324/336/380	tok	discard	1.076894	+0.002807	Swap F.rms_norm → F.layer_norm at the post-tok_emb / embed_scale gauge-fix site: adds mean-centering alongside variance-normalization, stripping any DC/unigram direction from tok_emb rows before the residual is frozen as x0 and replicated through every decoder via skip_weights.
381	336	17	000/005/017/088/108/142/151/164/177/196/212/245/267/280/298/324/336/381	arch	eval_budget_overrun	1.077273		Recurrence-aware x0-INJECTION correction (orthogonal to exp_245): for looped blocks [3..5], scale the mix[1]*x0 embedding-injection term in Block.forward by 1/(num_loops+1)=1/3 so the per-forward TOTAL x0 contribution of a looped block equals that of a single-call block; exp_245 damps attn/MLP OUTPUTS via ln_scale_factor but leaves the residual-stream x0 injection at 3× magnitude.
382	336	17	000/005/017/088/108/142/151/164/177/196/212/245/267/280/298/324/336/382	ttt	discard	1.074589	+0.000502	Cosine-cool TTT SGD momentum 0.9 to 0.5 in lockstep with cosine LR schedule over chunks.
383	336	17	000/005/017/088/108/142/151/164/177/196/212/245/267/280/298/324/336/383	opt	discard	1.074985	+0.000898	Tighten muon_momentum_warmup_fraction 0.22→0.15: shortens the 0.92→0.99 ramp so peak momentum lands earlier and the peak-momentum × peak-LR coupling window grows from ~6% to ~13% of budget — never-probed DOWN direction on this axis (exp_029 only tested UP to 0.45, harness_abort).
385	336	17	000/005/017/088/108/142/151/164/177/196/212/245/267/280/298/324/336/385	reg	discard	1.074447	+0.000360	Lower muon_wd_qk 0.115 → 0.095 (match attn c_v/proj group): Q/K outputs are RMS-normed before SDPA so row-norms are absorbed, making MLP-matched WD over-regularize direction diversity. Symmetric DOWN test mirroring exp_336's MLP WD win.
337	324	16	000/005/017/088/108/142/151/164/177/196/212/245/267/280/298/324/337	ttt	size_blocked	1.074818		Exclude the looped blocks [loop_start..loop_end] from the TTT optimizer — they are called (num_loops+1)=3 times per forward, so their TTT backward gradient accumulates 3× signal (same recurrence amplification exp_141 and exp_245 compensated); freezing them during TTT focuses adaptation on unique-role layers (blocks 0-2, 6-10) + embedding/norms/scalars and avoids 3×-amplified TTT noise on the shared-weight recurrent core.
338	324	16	000/005/017/088/108/142/151/164/177/196/212/245/267/280/298/324/338	loss	discard	1.076647	+0.002476	Re-enable mild label_smoothing=0.002 on the current exp_324 baseline's plain CE — a midpoint between the known-good old-default 0.003 and the known-worse 0.001 (from exp_042 regression), untested on the current stack (QK-gain 5.25 + embed_scale-inside-RMSNorm + Muon-mom-floor + TTT). Also motivates TTT stability: softer train distribution is a better-conditioned init for per-chunk inner-loop SGD.
339	324	16	000/005/017/088/108/142/151/164/177/196/212/245/267/280/298/324/339	quant	discard	1.074215	+0.000044	Position-weighted Hessian accumulation in GPTQ calibration: scale each token's activation by sqrt(linspace(0.9,1.1,T)) before x.T@x so the Hessian emphasises late-context positions that dominate the stride-64 sliding-window eval — mean-preserving (trace unchanged), size-neutral (calibration only), mirrors exp_176's proven 0.9→1.1 training-CE weighting.
340	324	16	000/005/017/088/108/142/151/164/177/196/212/245/267/280/298/324/340	tok	discard	1.075298	+0.001127	Add output-side per-feature bias output_bias_feat (shape=[embedding_dim]=512, init=0) applied to x via F.linear(x + output_bias_feat, tok_emb.weight) before the tied softmax — structural DUAL of input-side embed_scale and mathematically a rank-1 per-vocab logit bias (W @ b) that captures frequency-prior capacity at 512 params instead of the full 8192-dim vocab_bias that size-blocked exp_023/146/166/219/249/277/317.
341	324	16	000/005/017/088/108/142/151/164/177/196/212/245/267/280/298/324/341	eval	discard	1.075324	+0.001153	Apply T=0.97 logit sharpening at eval_val_ttt scoring site (divide logits by 0.97 before CE); exp_044 showed T=1.05 (smoothing) hurt +0.0026 so optimum lies at T<=1.0, and GPTQ weight noise widens output entropy — mild sharpening should recover calibration. TTT training loss untouched.
342	324	16	000/005/017/088/108/142/151/164/177/196/212/245/267/280/298/324/342	arch	size_blocked	1.074343		Skip-path RMSNorm: F.rms_norm the popped encoder skip to unit RMS BEFORE skip_weights multiplication, decoupling skip_weights (pure per-feature gain) from skip_gates (pure mix fraction).
343	324	16	000/005/017/088/108/142/151/164/177/196/212/245/267/280/298/324/343	reg	discard	1.074568	+0.000397	Exempt per-channel/per-head GAIN params (q_gain=5.25-init, attn_scale/mlp_scale/embed_scale/skip_weights=1.0-init) from adam_wd by splitting the scalar AdamW group into a zero-WD "gain" sub-group and a 0.005-WD "gate" sub-group (resid_mix, skip_gates).
344	324	16	000/005/017/088/108/142/151/164/177/196/212/245/267/280/298/324/344	opt	discard	1.074577	+0.000406	Raise Muon peak momentum 0.99→0.993: widens effective gradient-averaging window from ~100 to ~143 steps. Parallel axis to exp_088 (ramp speed, -0.001115 keep) and exp_324 (warmdown shape, -0.000202 keep) — the peak value itself is the only momentum knob never tuned.
345	324	16	000/005/017/088/108/142/151/164/177/196/212/245/267/280/298/324/345	curr	discard	1.075639	+0.001468	Latin-square phase count 8→5 (prime, coprime with seq_len=2^11): 3-reset saturation 37.5%→60%, phase spacing 256→410 tokens (adjacent-phase content overlap 88%→80%).
325	298	15	000/005/017/088/108/142/151/164/177/196/212/245/267/280/298/325	meta	discard	1.074371	+0.000091	Raise matrix_lr 0.022 → 0.023 (+4.5%): half-step in the less-bad direction on a now-untested axis — exp_214 (0.024, +0.000180) hurt less than exp_224 (0.020, +0.000550), and several kept downstream changes (exp_245/264/280/298) have shifted the regime since the last matrix_lr probe.
326	298	15	000/005/017/088/108/142/151/164/177/196/212/245/267/280/298/326	curr	size_blocked	1.078421		Double Latin-square phase bucket count 8→16 in ShuffledSequenceLoader: finer within-shard phase granularity (128-token spacing vs 256-token) on the initial-phase draw, which is the dominant curr lever since shards don't exhaust in a 600s run. exp_207 tested the opposite direction (8→4) and lost +0.00085; the increase direction is orthogonal and untested.
327	298	15	000/005/017/088/108/142/151/164/177/196/212/245/267/280/298/327	ttt	discard	1.075004	+0.000724	Reset Nesterov SGD momentum buffer at each chunk boundary in eval_val_ttt: zero state['momentum_buffer'] for all ttt_params right after updating cos_lr, before inner epoch loop. Isolates each chunk's adaptation from prior chunks' gradient history (val data is not i.i.d. across chunks, and cosine-decaying LR means stale momentum from chunk 0's high-LR gradients disproportionately biases chunk N's small-LR updates).
328	298	15	000/005/017/088/108/142/151/164/177/196/212/245/267/280/298/328	loss	discard	1.074657	+0.000377	Re-introduce exp_186's proven u^2 convex position-weighted CE (pw = (0.9 + 0.2*u^2) / mean, mean-preserving) onto exp_298 baseline — position weighting was stripped from current best, and u^2 spreads the +0.2 tilt smoothly across all T vs sigmoid/hard-mask variants that concentrate it on ~64–300 tail positions and keep hitting size_blocked by only 0.9–2.8 KB.
329	298	15	000/005/017/088/108/142/151/164/177/196/212/245/267/280/298/329	eval	size_blocked	1.074548		Soft eval-aligned TTT loss: mean-preserving 1.5x upweight on the last stride=64 positions of each TTT training seq, keeping unit weight on the first 1984. Interpolates between current unweighted TTT (alpha=0) and exp_322's hard-mask failure (alpha=infinity, +0.0117 regression).
330	298	15	000/005/017/088/108/142/151/164/177/196/212/245/267/280/298/330	arch	size_blocked	1.075124		Per-KV-head learnable V-gain (shape=[num_kv_heads]=4 per layer, init=1.0) applied right after c_v projection to complete the Q-K-V gain trio: QK-Gain already sharpens attention scores; V-gain decouples attention direction from output magnitude per head, letting heads specialize by how much they read rather than just where.
331	298	15	000/005/017/088/108/142/151/164/177/196/212/245/267/280/298/331	tok	discard	1.075264	+0.000984	Swap tied tok_emb init from nn.init.normal_ to nn.init.trunc_normal_ at ±2σ (PaLM/T5/BLOOM/Llama standard): clips the ~5% of rare-token rows beyond ±2σ=±0.01 that, under tied embeddings, double as outlier softmax classification directions and can create spurious early-grad spikes.</hypothesis> <parameter name="notes">Single-line edit in GPT._init_weights: nn.init.normal_(mean=0, std=0.005) -> nn.init.trunc_normal_(mean=0, std=0.005, a=-0.01, b=0.01). Zero params added, zero bytes delta; model pack approximately exp_298. Mechanistic rationale: with tied embeddings the tok_emb rows ARE the output softmax classifier rows, so the Gaussian tail mass (~5% of 8192 rows beyond ±2σ) creates rare-token classifiers whose initial direction is dominated by the random outlier, forcing the first hundred grad steps to correct artifacts before real signal can be absorbed. Truncating the tails at ±2σ removes the outliers while keeping the bulk of the distribution and its natural per-row variance intact — distinct from exp_019's equi-row-norm sphere init (discarded, +0.001603) which forced EVERY row to identical L2 norm and destroyed natural row-magnitude variation; this keeps in-bulk variance and only removes outliers. First-try attempt at this direction: exp_032 proposed trunc_normal at ±2σ but was harness_abort'd (never reached GPU), so the hypothesis has not been disproven. Zero risk of size_blocked (no param delta) or crash (stdlib nn.init). Standard practice in PaLM/T5/BLOOM/Llama adoption of trunc_normal is specifically to prevent pre-training outlier classifiers under tied embeddings.</notes> </invoke>
332	298	15	000/005/017/088/108/142/151/164/177/196/212/245/267/280/298/332	quant	size_blocked	1.074487		Shrink GPTQ block_size 64 to 16 in gptq_quantize_weight: 4x more Hessian-compensated error-propagation events per matrix than the exp_298 default (which still has block_size=64).
334	298	15	000/005/017/088/108/142/151/164/177/196/212/245/267/280/298/334	reg	size_blocked	1.078942		Time-anneal Muon weight decay: WD=0 for first 15% of budget (exploration), linearly ramp 0→1 from 15% to warmdown-start (42%), then full per-group base WD throughout the warmdown tail — concentrates regularization pressure on the settled-feature + EMA-warmdown regime where overfit risk peaks.
299	280	14	000/005/017/088/108/142/151/164/177/196/212/245/267/280/299	curr	discard	1.076362	+0.001880	Within-shard positional augmentation: replace stride-seq_len grid of start_inds (phase + k*2048) with uniform random integer starts over [phase, num_tokens - seq_len - 1], keeping Latin-square phase and sequence count — scatters doc-boundary splice points at ~50K-token resolution instead of on a 2048-grid, with negligible duplicate risk (~0.04 birthday bound per shard-reset in a 600s run).
300	280	14	000/005/017/088/108/142/151/164/177/196/212/245/267/280/300	loss	size_blocked	1.074929		Eval-aligned last-stride CE weighting: 1.15× boost on the rightmost 64 positions (= eval sliding stride), mean-preserving — concentrates training gradient on the exact positions that contribute NEW logits to val_bpb after window 0.
301	280	14	000/005/017/088/108/142/151/164/177/196/212/245/267/280/301	quant	discard	1.074860	+0.000378	Per-category GPTQ Hessian damping: MLP weights get H_ii *= 1.025 (silu^2 activations, heavy-tailed bimodal diag(H)), attn/embed stay at 1.015 (post-RMSNorm ~Gaussian inputs). Average damping ~1.02 matches exp_280's total mass but redistributes asymmetrically where it matters.</hypothesis> <parameter name="notes">Two-site edit. (1) gptq_quantize_weight adds damping=1.02 param, replaces hard-coded 1.02. (2) gptq_mixed_quantize computes cat=classify_param(name), damp=1.025 if cat=='mlp' else 1.015. Motivation: every quant-damping trial tuned amplitude globally; no one has tried per-layer routing. MLP-proj inputs are silu^2(fc(x)) — non-negative, heavy tail, large diag(H) dynamic range on sink columns where 1/Hinv[j,j] amplifies — benefits from more damping. Attn QKV sees post-RMSNorm ~Gaussian — lighter damping preserves curvature fidelity. Embed (tied head) sees final_norm output → also Gaussian-ish → attn-style. Zero byte overhead.</notes> </invoke>
302	280	14	000/005/017/088/108/142/151/164/177/196/212/245/267/280/302	reg	discard	1.074904	+0.000422	Additive Gaussian feature noise (σ=0.02) on the re-injected x0 anchor path only (training-only), not on the primary residual stream x: noise propagates to every block via resid_mix[1]*x0 but is self-gated by the learned mix[1] (init=0), sidestepping the branch-kill/zero-gate failure mode of exp_040 (MLP hidden dropout) and exp_293 (MLP DropPath).
303	280	14	000/005/017/088/108/142/151/164/177/196/212/245/267/280/303	opt	discard	1.078573	+0.004091	Muon-only sqrt warmdown: apply muon_lr_scale = lr_scale**0.5 to the Muon param group while Adam (tok/head/scalar) groups retain linear warmdown. Rationale: Muon's NS-5 orthogonalization emits unit-SV updates, so group LR ≈ step-norm in weight space; the convex sqrt shape keeps Muon hotter through the tail (at lr_scale=0.1 Muon sees 0.316× vs linear's 0.1×) while Adam groups, whose effective step is raw-grad-dependent, keep the proven linear shape. Momentum cool-during-warmdown is unchanged (still driven by the global linear lr_scale). Zero bytes, zero params, single-site edit in step_fn. Not previously tried: shape changes have only been tested as global (exp_002 cosine keep, exp_043 cosine discard); asymmetric-per-group warmdown is unexplored.
304	280	14	000/005/017/088/108/142/151/164/177/196/212/245/267/280/304	meta	discard	1.075077	+0.000595	Lower adam_eps 1e-8 → 1e-9 (single literal, all three AdamW groups share this): 10× step vs exp_048/exp_105 which both went 1e-10 and failed on size/eval-budget, so the training signal on this axis is genuinely unobserved. Directionally aligned with the 4-of-4 β2-raise discards (exp_068/091/126/159), which say the current stack wants a SHARPER preconditioner, not smoother — smaller eps sharpens the denominator for low-second-moment rows (rare-tail tok_emb, scalar ln_scale/qk_gain/skip_gates).
305	280	14	000/005/017/088/108/142/151/164/177/196/212/245/267/280/305	ttt	discard	1.074995	+0.000513	Lookahead slow-weights pullback at each TTT chunk boundary: initialize slow_params to pre-TTT snapshot, then after every chunk's SGD steps do slow ← slow + 0.5·(live − slow) followed by live ← slow. Structurally distinct from per-step L2 anchor to pre-TTT (exp_276 discard, −0.0003) and hard momentum reset (exp_253/255/263 discard) because (a) it operates on parameters not gradient/momentum, (b) the anchor point drifts cumulatively instead of being fixed to pre-TTT, and (c) the pullback cadence is per-chunk not per-step — so early-chunk adaptation is preserved in slow_params while per-chunk overshoot is halved.
306	280	14	000/005/017/088/108/142/151/164/177/196/212/245/267/280/306	arch	discard	1.074763	+0.000281	Output-side companion to exp_245: scale attn_scale/mlp_scale INIT of looped blocks (layers 3-5) by 1/sqrt(num_loops+1)=1/sqrt(3) so each of the 3 per-pass residual contributions starts at ~58% of a non-looped block — variance-balances the effective-depth-17 residual stream from the OUTPUT side on top of exp_245's INPUT-side ln_scale_factor damping.
311	280	14	000/005/017/088/108/142/151/164/177/196/212/245/267/280/311	eval	discard	1.074757	+0.000275	Defer chunk 0 scoring to the END of the TTT loop so chunk 0 scores with a fully-adapted model instead of zero-TTT benefit — reorder chunk_order to [1,2,...,N-1,0] and re-anchor cos_lr on loop index, preserving score-first invariant (chunk 0 tokens never trained on).
281	267	13	000/005/017/088/108/142/151/164/177/196/212/245/267/281	loss	size_blocked	1.102908		Multi-token-prediction auxiliary CE (DeepSeek-V3 style, α=0.1) reusing the tied output head: at each position t, the same logits are scored against target[t+1] as a 0.1-weighted aux term on top of the main next-token CE. Zero bytes / zero params / train-only (reuses tied tok_emb head, no new projection). Structurally orthogonal to the saturated position-weighted, rare-token, focal, label-smoothing, and entropy-bonus families.
282	267	13	000/005/017/088/108/142/151/164/177/196/212/245/267/282	opt	size_blocked	1.076445		Decouple Muon momentum warmdown-end from warmup-start: add muon_momentum_warmdown_end=0.85 (vs the previous implicit 0.92) so during the 72% warmdown phase, momentum cools 0.99→0.85 instead of 0.99→0.92; extends exp_010's cool-during-warmdown trajectory by another 7 pts, making end-of-run low-LR updates behave more like fine-tune SGD with less stale-direction carryover.
283	267	13	000/005/017/088/108/142/151/164/177/196/212/245/267/283	reg	discard	1.074614	+0.000064	Target-decay on scalar AdamW group: replace decoupled WD's pull-toward-0 with pull-toward-init for q_gain (5.25), attn_scale/mlp_scale/resid_mix[0]/skip_weights/embed_scale (1.0), and zero-init resid_mix[1]/skip_gates (0.0) — preserves exp_177's proven stabilizing drag (adam_wd=0.005) while redirecting it to each param's meaningful attractor.
284	267	13	000/005/017/088/108/142/151/164/177/196/212/245/267/284	meta	discard	1.075351	+0.000801	Widen Muon momentum ramp on its untested side: muon_momentum_warmup_start 0.92→0.90 (symmetric opposite of exp_015's failed 0.92→0.94 narrowing, re-probed under the current post-exp_088 fast-ramp regime).
285	267	13	000/005/017/088/108/142/151/164/177/196/212/245/267/285	ttt	eval_budget_overrun	1.076870		Shrink TTT training micro-batch from 32 to 2 in eval_val_ttt, doubling SGD steps per chunk (4 to 8) and making exp_264 alternating fwd/rev actually permute.
286	267	13	000/005/017/088/108/142/151/164/177/196/212/245/267/286	arch	crash			Sandwich normalisation: RMSNorm the attn and MLP branch OUTPUTS (before attn_scale/mlp_scale) on top of the existing pre-norm inputs — direction-preserving output-magnitude discipline for the effective-depth-17 recurrent residual stream.
288	267	13	000/005/017/088/108/142/151/164/177/196/212/245/267/288	tok	size_blocked	1.075977		Add learnable per-feature embed_bias (shape=[embedding_dim], init=0.0) as the additive companion to exp_267's embed_scale — completes the post-tok_emb pipeline into full affine-LayerNorm form (rms_norm × scale + bias), letting the residual-skip anchor x0 carry a learned absolute-feature offset that survives the first block's pre-norm.
289	267	13	000/005/017/088/108/142/151/164/177/196/212/245/267/289	curr	discard	1.075950	+0.001400	Deranged per-shard phase assignment: replace exp_142's 8-phase latin-square (with K=13 shards per rank, has ~99% prob of same-phase collisions) with a K-bucket derangement - each shard gets a UNIQUE phase index in [0..K-1], spacing shard-starting-offsets at 2048/K=158-token granularity and eliminating within-rank phase duplication.
268	245	12	000/005/017/088/108/142/151/164/177/196/212/245/268	arch	size_blocked	1.077634		Disable XSA on looped blocks [3,4,5] only (pre-loop 0-2 and post-loop 6-10 keep XSA): XSA's V-direction subtraction compounds across the 3 loop passes of each physical block, over-damping attention; loop_seg benefits from standard attention while non-loop layers retain XSA sharpening.
269	245	12	000/005/017/088/108/142/151/164/177/196/212/245/269	curr	discard	1.075853	+0.001249	Per-shard independent reset on exhaustion in ShuffledSequenceLoader.next_batch: when shard si runs dry mid-batch, reset only si (not all shards), preserving remaining-but-unused sequences in the other shards and letting each shard's _phase_epoch advance at its own rate proportional to shard size.
271	245	12	000/005/017/088/108/142/151/164/177/196/212/245/271	reg	discard	1.075244	+0.000640	Per-head multiplicative noise on q_gain (±2% uniform) during training only — mean-preserving DropHead-style reg on attention sharpness, zero-param, zero-byte.
246	212	11	000/005/017/088/108/142/151/164/177/196/212/246	loss	discard	1.078453	+0.003703	Position-decaying label smoothing eps(u) = 0.01*(1-u) across T=2048: smooths early-position targets (inherently high-entropy, no context) while keeping late positions (where sliding-window stride-64 eval scores) sharp. Mean eps ~0.005; zero train/val mismatch at t=T-1.
247	212	11	000/005/017/088/108/142/151/164/177/196/212/247	curr	discard	1.076051	+0.001301	Per-sequence fine-grained positional jitter in [0,32) added to each training start_ind inside ShuffledSequenceLoader._reset_shard: multiplies unique starting positions per shard pass by ~32x on top of the existing 8-phase Latin-square (256-token coarse spacing), without altering sample counts, model params, or artifact size.
248	212	11	000/005/017/088/108/142/151/164/177/196/212/248	reg	discard	1.075116	+0.000366	Split Muon attention WD by projection role: raise WD on V + output projections (c_v + attn.proj) to 0.125, keep Q+K at 0.095. Attention-internal analogue of exp_164.
250	212	11	000/005/017/088/108/142/151/164/177/196/212/250	quant	discard	1.075337	+0.000587	Double GPTQ calibration batches 64→128: halves Hessian estimator variance so H^{-1} error-propagation in the GPTQ inner loop tracks true second-order curvature more precisely.
251	212	11	000/005/017/088/108/142/151/164/177/196/212/251	opt	discard	1.074984	+0.000234	Decouple Muon-momentum warmdown floor from warmup_start and raise it 0.92 to 0.95 (softer lockstep cool during warmdown); exp_109 lowered coupled floor to 0.85 (discard) and exp_200 tried kinked hold-then-drop cool (discard) — shallower smooth-cool direction is untested.
