exp_id	parent_exp	depth	path	specialist	status	val_bpb	delta_vs_best	hypothesis
092	017	3	000/005/017/092	quant	size_blocked	1.075144		Replace per-row std with 1.4826×MAD (Median Absolute Deviation) in GPTQ scale computation — robust dispersion estimator gives finer quantization bins in the bulk for heavy-tailed LLM weight distributions while matching std exactly for Gaussian rows.
102	092	4	000/005/017/092/102	quant	size_blocked	1.075031		Zig-zag encode int8 Q tensors (v→((v<<1)^(v>>7)) as uint8) before torch.save to rescue exp_092's MAD-scale GPTQ (bpb=1.075144 but size_blocked) — lossless signed→unsigned transform converts 2's-complement bimodal byte layout to a unimodal-near-zero distribution that brotli-11's Huffman stage compresses tighter, freeing enough bytes to fit under cap.
093	017	3	000/005/017/093	eval	eval_budget_overrun	1.079477		Apply T=0.97 logit sharpening (divide pre-CE logits by 0.97) in eval_val_ttt scoring — mirror-direction test of exp_044's T=1.05 softening which was +0.002607 worse, indicating the post-GPTQ+TTT distribution is at or below calibration optimum; modest sharpening should pull val_bpb toward it.
095	017	3	000/005/017/095	reg	discard	1.080472	+0.003528	Raise muon_wd 0.095→0.115 (+21%): direct sweep of the never-touched matrix-only weight-decay knob; tighter Linear-weight distributions should aid int6 GPTQ fidelity and add useful regularization pressure where prior forward-path noise (exp_040/050) and scalar-wd (exp_082/087) attempts failed.
096	017	3	000/005/017/096	loss	size_blocked	1.083169		Raise logit_softcap default 30.0→100.0 — effectively removes the tanh output squash for realistic logit magnitudes (|x|≲15 → <1% dampening vs ~4-8% at cap=30) while retaining asymptotic safety; loss-domain's one untouched model-side regularizer, in the direction consistent with the observed "remove regularization, not add" trend (z-loss hurt +0.003, adding 0.001 smoothing hurt +0.002).
097	017	3	000/005/017/097	curr	discard	1.079529	+0.002585	Replace phase+k*seq_len packed start-indices with IID uniform random starts per sequence in ShuffledSequenceLoader._reset_shard: every sampled sequence now begins at an independent random offset, giving each training token a uniformly-random within-sequence context position instead of the packed scheme's single shared phase.
099	017	3	000/005/017/099	tok	size_blocked	1.083399		Apply fixed logit scale multiplier 3.0 to tied-embedding output projection
018	005	2	000/005/018	arch	discard	1.083816	+0.005757	Add learnable per-channel gain to attn_norm and mlp_norm RMSNorms (LLaMA-style weighted RMSNorm) in every Block; final_norm left weightless since it's absorbable into the tied head.
033	exp_017	0	033	reg	harness_abort			NEFTune: inject uniform noise U(-α/√(T·D), α/√(T·D)) with α=5 on post-RMSNorm token embeddings during training only (disabled at TTT); a well-literature-validated regularizer not previously tried in this tree (exp_012 tried token replacement, which is structurally different).
046	exp_017	0	046	arch	eval_budget_overrun	1.085969		Increase depth-recurrence num_loops 2→3: the shared loop segment [3..5] is replayed 4 times instead of 3, growing effective depth from 17 to 20 layers during active-recurrence phase — pure parameter-free capacity via the architecture's core param-golf trick.
087	exp_017	0	087	opt	discard	1.079376	+0.001317	Disable weight decay on scalar control tensors (adam_wd 0.02→0.0): q_gain=5.25, skip_weights, attn_scale, mlp_scale, resid_mix, skip_gates init at meaningful non-zero values — current AdamW coupled-WD compounds to ~80% shrinkage across the run (p *= (1-lr*wd)^steps), actively fighting the gradient. Standard practice (nanoGPT-speedrun, Llama) is no-WD on 1D params; untouched across the entire tree.
149	exp_142	0	149	meta	size_blocked	1.078881		Revive orphaned exp_003 keep on current best lineage: EMA_DECAY 0.9965 to 0.998.
184	exp_177	0	184	meta	discard	1.077653	+0.001795	Restack exp_003's proven EMA_DECAY 0.9965→0.998 (-0.000776 keep) onto current best exp_177: the current chain (exp_000→005→010→088→…→177) never inherited exp_003's EMA widening since it branched through exp_005, so this reapplies a validated orthogonal averaging tweak atop the accumulated optimizer/loss/reg stack.
188	exp_177	0	188	arch	discard	1.083445	+0.007649	Swap Primer-style silu²(fc(x)) MLP for SwiGLU (silu(fc(x))*fc_up(x)), param-neutral via mlp_mult 4.0→2.625 (hidden 2048→1344, 3×512×1344=2.06M ≤ baseline 2×512×2048=2.10M per block, saves ~360K params).
221	exp_212	0	221	quant	discard	1.075690	+0.000668	Per-matrix Hessian-weighted scale refinement after GPTQ: closed-form solve for scalar α minimizing tr((W−αQ·diag(s)) H (W−αQ·diag(s))^T) and fold into per-row fp16 s (size-neutral).
228	exp_212	0	228	reg	discard	1.077086	+0.002064	Within-attention Muon WD split: QK-reader matrices (c_q, c_k) get muon_wd_qk=0.115 (21% boost) while V-reader + attn.proj stay at muon_wd=0.095; orthogonal to exp_164 (attn-vs-mlp type split) and exp_141 (recurrent depth split).
249	exp_212	0	249	tok	size_blocked	1.075315		Add learnable per-vocab output logit bias to tied softmax. Decouples unigram-prior from embedding magnitude. exp_023 proposed but harness-aborted; this is a proper run.
263	exp_245	0	263	meta	discard	1.075632	+0.000908	Raise AdamW BETA1 0.9→0.92 on all AdamW groups (tied tok_emb + scalar params + optional lm_head): a smaller version of exp_136's 0.9→0.95 which size_blocked at bpb=1.077256 but never had its training signal confirmed, and a genuinely untested point between exp_075's failed 0.9→0.8 (discard +0.001267) and the LLM-standard 0.95.
275	exp_264	0	275	ttt	discard	1.074716	+0.000112	Add 30% LR floor to TTT chunk-cosine schedule (cos_lr = ttt_lr · (0.3 + 0.7·cos_ratio)): late chunks (~last 15%) currently train at near-zero LR, leaving the val tail under-adapted; floor preserves peak LR at chunk 0 but keeps late chunks meaningfully learning for next-chunk scoring.
287	exp_267	0	287	eval	discard	1.075276	+0.000726	Intra-chunk linear LR warmup across TTT epochs: ep0 at 0.5*cos_lr → ep3 at 1.0*cos_lr (avg 0.75*cos_lr). Lets SGD momentum carried from previous chunk re-align with new chunk's gradient direction before the larger refinement steps.
294	exp_280	0	294	meta	size_blocked	1.075733		Lower AdamW BETA2 0.95→0.93 on the tok_emb + scalar + head AdamW groups — untested direction after 4 prior raises all hurt (exp_068/091/159 β2=0.98, exp_126 β2=0.97).
313	exp_298	0	313	meta	size_blocked	1.074796		Zero out adam_wd 0.005 to 0.0 on scalar AdamW group; continues exp_177's kept direction (0.02 to 0.005, -0.000038) to its endpoint. All params in this group are far from 0, so any WD is a misaligned pull-to-zero prior.
359	exp_336	0	359	eval	discard	1.074698	+0.000527	Apply T=0.98 sub-unity logit temperature in both eval_val_sliding and eval_val_ttt score passes (divide logits by 0.98 before cross_entropy): opposite-direction probe vs exp_044's T=1.05 failure (+0.00261), motivated by GPTQ-induced logit-noise softening of the post-softmax distribution.
370	exp_336	0	370	curr	size_blocked	1.076629		Hard loss-mask on training positions 0..15 of each sequence (drop CE where context<16 tokens) to align training signal with the sliding-window eval metric (which scores ~98% of tokens at positions ≥1984).
384	exp_336	0	384	meta	discard	1.075066	+0.000979	Lower muon_momentum_warmup_start 0.92→0.90 (DOWN direction, mirror of discarded exp_015 UP): widens the warmup ramp span from 0.07 to 0.09 across the same 22% time-fraction, giving gentler momentum early when gradients are high-variance
386	exp_336	0	386	loss	size_blocked	1.074780		Re-introduce exp_186's convex u^2 position-weighted CE (pw = 0.9 + 0.2*u^2, mean-preserved) onto current best — the kept improvement was inadvertently dropped by exp_190's forward() refactor and has been missing from the best chain since.
387	exp_377	0	387	quant	size_blocked	1.074465		Halve GPTQ multiplicative Hessian damping 1.01→1.005 (scalar-downward continuation of the monotonic winning trajectory exp_280 1.02→exp_377 1.01).
424	exp_377	0	424	ttt	discard	1.074667	+0.000580	Apply mean-preserving linear position-weighted CE (linspace 0.9→1.1) to the TTT inner-SGD loss so gradient upweights long-context positions — the positions that actually score at stride=64.
477	exp_377	0	477	quant	size_blocked	1.074467		Lower GPTQ multiplicative Hessian damping 1.01 → 1.005 (−50% damping strength): continuation of the kept DOWN trajectory 1.02 (exp_280 keep) → 1.01 (exp_377 keep).
877	exp_750	0	877	reg	discard	1.074191	+0.001981	Add z-loss (lambda=1e-5, logsumexp^2) to main training forward — same formula as exp_596's proven TTT z-loss, applied to main training CE to regularize logit magnitudes during training; final BPB metric unaffected (eval_val_sliding/TTT use forward_logits directly).
