exp_id	parent_exp	depth	path	specialist	status	val_bpb	delta_vs_best	hypothesis
549	538	21	000/005/017/088/108/142/151/164/177/196/212/245/267/280/298/324/336/377/475/491/538/549	curr	size_blocked	1.073835		Rank-staggered shared base permutation in ShuffledSequenceLoader: all ranks share one seeded base_perm (PCG64(0)); rank r's local shard si_l rotates it by (r+si_l)%8 so the 8 ranks' first-epoch phase-visits tile [0,8) deterministically, vs independent per-rank perms that leave ~3/8 phases uncovered in the single-phase-per-shard 600s regime.</hypothesis> <parameter name="notes">Edit sits in ShuffledSequenceLoader.__init__ only — single _phase_order construction swapped for rank-dependent rotation of a shared seeded base perm. No change to _reset_shard, next_batch, or downstream logic. exp_456 tested single-perm rotation by si within one rank and failed; the untested axis here is the CROSS-rank coordination via h.rank in the rotation offset (exp_456 did not touch h.rank). exp_227 tried deterministic (rank+si+j)%8 with no permutation layer; this keeps a true permutation while adding cross-rank tiling. Orthogonal to exp_196 batch-stratification and exp_142 Latin-square mechanics — both still active.
550	538	21	000/005/017/088/108/142/151/164/177/196/212/245/267/280/298/324/336/377/475/491/538/550	reg	size_blocked	1.072928		Raise adam_wd 0.005 to 0.008 (+60% UP probe) on the scalar AdamW group - first UP direction probed since exp_177 set 0.005 (exp_257 to 0 discard, exp_452 to 0.002 size_blocked left UP untested). Scalar group has grown 3x since exp_177: exp_538 attn_out_gate_w (1056 zero-init fp32), exp_267 embed_scale [512], exp_475 q_gain[H,2]. Stronger pull-to-0 on the new zero-init gate mass should improve calibration without removing signal.</hypothesis> <parameter name="notes">Single-literal edit at train_gpt.py:165 (ADAM_WD default 0.005 to 0.008). Zero byte delta (code_bytes=26215). Scalar AdamW group includes attn_scale/mlp_scale, resid_mix, q_gain, skip_weights/gates, embed_scale, attn_out_gate_w - dominated now by the 1056-param zero-init attn_out_gate from exp_538.</parameter> </invoke>
551	538	21	000/005/017/088/108/142/151/164/177/196/212/245/267/280/298/324/336/377/475/491/538/551	tok	size_blocked	1.073477		Row-mean-center tied tok_emb at init: after nn.init.normal_, subtract each row feature-mean so every token embedding is zero-mean across D=512. Zero params, zero bytes, pure init perturbation.
553	538	21	000/005/017/088/108/142/151/164/177/196/212/245/267/280/298/324/336/377/475/491/538/553	opt	size_blocked	1.074697		Concave (lr_scale**1.5) Muon-only warmdown while AdamW groups retain linear: faster Muon decay lets its unit-Frobenius-norm NS updates stop over-correcting in the refinement tail while AdamW's 1/sqrt(v) per-param scaling continues fine adjustment. Mirror of exp_303 (Muon sqrt=convex, Muon hotter, discard +0.004091).
554	538	21	000/005/017/088/108/142/151/164/177/196/212/245/267/280/298/324/336/377/475/491/538/554	loss	discard	1.073855	+0.000389	Logit-L2 regularization (λ=1e-5 · mean(logits²)) added to training CE — untried gentle soft-shrinkage on the mass of unsaturated logits, orthogonal to existing tanh softcap (hard cap on extremes) and to every tried loss tweak (label smoothing, focal, entropy penalty, z-loss@1e-4 exp_009, position/frequency/byte weighting); zero new params, zero artifact bytes, training-only — ~0.2% CE-gradient perturbation at typical |logit|≈14.
555	538	21	000/005/017/088/108/142/151/164/177/196/212/245/267/280/298/324/336/377/475/491/538/555	meta	size_blocked	1.072581		Raise Muon-momentum warmdown blend floor 0.25→0.30: untested midpoint between exp_324's kept 0→0.25 UP and exp_355's failed 0.25→0.35 UP (size_blocked +0.000474), continuing the kept UP axis at half the failed overshoot step.
556	538	21	000/005/017/088/108/142/151/164/177/196/212/245/267/280/298/324/336/377/475/491/538/556	quant	size_blocked	1.073030		Asymmetric int6 quantization range: clamp GPTQ codes to [-(clip_range+1), clip_range] = [-32, +31] instead of symmetric [-31, +31] — uses the full 64-value int6 code domain (extra -32 bin) to recover precision on GPTQ-error-propagated negative tails that currently saturate at -31.
558	538	21	000/005/017/088/108/142/151/164/177/196/212/245/267/280/298/324/336/377/475/491/538/558	arch	eval_budget_overrun	1.072396		Re-submit exp_547's symmetric MLP-output gate with width shrunk 12→4 to fit under 16MB cap (exp_547 hit val_bpb=1.072375 Δ=-0.001091 but size_blocked by 103 bytes). Width-4 saves 88 fp32 of trained-weight bytes ≈ 150 B packed, covers the gap with margin while preserving the data-dependent gating signal.
559	538	21	000/005/017/088/108/142/151/164/177/196/212/245/267/280/298/324/336/377/475/491/538/559	curr	size_blocked	1.073534		Rank-stripe permutation in ShuffledSequenceLoader.__init__: replace `all_files[h.rank::world_size]` with `all_files[perm[h.rank]::world_size]` where perm is a seeded world_size-permutation shared across ranks. Keeps disjoint stripes (full coverage, no cross-rank duplicates) but decorrelates rank-id from alphabetical file position, perturbing which per-rank content stripe drives the PCG64(h.rank) phase/sequence permutation stream. Untested axis: exp_122 removed stripe entirely (failed, duplicate sampling); exp_549 tried cross-rank phase coordination (size_blocked). This cleanly probes the stripe-assignment permutation alone.
560	538	21	000/005/017/088/108/142/151/164/177/196/212/245/267/280/298/324/336/377/475/491/538/560	reg	size_blocked	1.072476		Split attn_out_gate_w into its own scalar-AdamW sub-group with adam_wd_gate=0.015 (3x baseline 0.005); other scalars stay at 0.005
561	538	21	000/005/017/088/108/142/151/164/177/196/212/245/267/280/298/324/336/377/475/491/538/561	tok	size_blocked	1.072171		Tighten embed_clip_sigmas 20.0 to 14.0
562	538	21	000/005/017/088/108/142/151/164/177/196/212/245/267/280/298/324/336/377/475/491/538/562	meta	size_blocked	1.072734		Walk back Muon-momentum warmdown floor 0.30→0.28 after exp_555 proved floor=0.30 yields Δ=-0.000885 bpb win but size_blocked by 3,370 bytes; 0.28 is 60% of the way from exp_324's kept 0.25 toward 0.30 — should retain most of the bpb improvement while recovering artifact headroom.
563	538	21	000/005/017/088/108/142/151/164/177/196/212/245/267/280/298/324/336/377/475/491/538/563	ttt	size_blocked	1.638237		Swap TTT optimizer from SGD+Nesterov to AdamW (lr=h.ttt_lr=0.005, betas=(0.9,0.95), eps=1e-8, wd=0) — optimizer CLASS axis untried across 40+ prior TTT trials (all used SGD+Nesterov+mu=0.9)
564	538	21	000/005/017/088/108/142/151/164/177/196/212/245/267/280/298/324/336/377/475/491/538/564	loss	size_blocked	1.074225		PaLM-style z-loss at λ=5e-6 (logsumexp(logits)^2.mean()) added to training CE — 20× smaller than exp_009's failed λ=1e-4 on pre-TTT/pre-QKgain baseline, and mechanism-distinct from exp_554's logit_l2 (z-loss penalizes only the shift-sensitive log-partition, not per-logit magnitudes), probing log-partition stabilization on the current QK-gain=5.25 + tanh-softcap=30 regime.
565	538	21	000/005/017/088/108/142/151/164/177/196/212/245/267/280/298/324/336/377/475/491/538/565	eval	size_blocked	1.073426		Reset TTT SGD-Nesterov momentum_buffer at each chunk boundary (ci>0): chunks score independent val segments, prior chunk's stale velocity may push early steps of new chunk off-direction; clearing the buffer starts each chunk with pure-gradient steps while keeping μ=0.9 within chunk. Orthogonal to exp_552 (which ramped μ coefficient, failed) — this directly clears the buffer.
566	538	21	000/005/017/088/108/142/151/164/177/196/212/245/267/280/298/324/336/377/475/491/538/566	opt	size_blocked	1.076639		Sqrt-couple Muon WD shrinkage with LR
567	538	21	000/005/017/088/108/142/151/164/177/196/212/245/267/280/298/324/336/377/475/491/538/567	quant	size_blocked	1.073554		GPTQ multiplicative damping 1.01→1.005 paired with brotli lgwin=22→24 (pure size saver unblocks the 1.005-damping probes that size_blocked as exp_387/477/497 bpb≈1.074149).</hypothesis> <parameter name="notes">Two-site edit: damping factor 1.005 in gptq_quantize_weight; brotli.compress gains lgwin=24.
568	538	21	000/005/017/088/108/142/151/164/177/196/212/245/267/280/298/324/336/377/475/491/538/568	arch	size_blocked	1.072388		Restrict mlp_out_gate to non-looped blocks (8 of 11): skip the gate on looped blocks [3..5] by setting mlp_out_gate_w=None in GPT.__init__. Cuts per-forward gate ops from 17 (exp_558 eval_budget_overrun at bpb=1.072396) to 8 — targets the compute driver while keeping the structurally-useful gate on encoder/tail decoder layers. Looped blocks are already residual-damped by ln_scale_factor/sqrt(num_loops+1) (exp_245), so their per-iteration gate is the most redundant.
569	538	21	000/005/017/088/108/142/151/164/177/196/212/245/267/280/298/324/336/377/475/491/538/569	reg	size_blocked	1.072526		Shrink adam_wd_gate 0.015 to 0.010 (2x baseline) on the isolated attn_out_gate_w sub-group: retains pull-to-zero mechanism from exp_560 (bpb 1.072476, size_blocked by 2362B) at reduced WD differential (0.005 over baseline vs 0.010) so model weight shift and artifact size fall under 16MB cap
570	538	21	000/005/017/088/108/142/151/164/177/196/212/245/267/280/298/324/336/377/475/491/538/570	tok	size_blocked	1.072307		Back off embed_clip_sigmas 20.0 to 18.0 after exp_561's 14.0 hit size_blocked with bpb 1.072171
571	538	21	000/005/017/088/108/142/151/164/177/196/212/245/267/280/298/324/336/377/475/491/538/571	curr	discard	1.073788	+0.000322	Remove grad-invariant self.rng.shuffle(shard_plan) in next_batch: with shard_plan kept grouped by shard-id, mid-batch shard-drain now coincides with shard-group boundaries, so _reset_shard(all) fires between groups rather than mid-group — no other shard's in-progress permutation gets wiped while it still has un-popped start_inds. Byte-near-neutral (+33 raw, ~0 packed) probe of the only untested within-batch iteration pattern.
572	538	21	000/005/017/088/108/142/151/164/177/196/212/245/267/280/298/324/336/377/475/491/538/572	meta	size_blocked	1.072551		Raise ttt_momentum 0.9→0.92 (+20% half-life, ~7→8.6 steps) on TTT SGD+Nesterov optimizer: untouched uniform knob in 560 trials (only exp_437 tried per-group split, eval-budget-overrun); size-safe because TTT runs at eval-time post-GPTQ+brotli, escaping the size_blocked pattern that killed exp_555/562/550 recent meta wins.
573	538	21	000/005/017/088/108/142/151/164/177/196/212/245/267/280/298/324/336/377/475/491/538/573	eval	size_blocked	1.073195		Retry of exp_565 (TTT momentum_buffer reset at chunk boundaries) with ~1.5KB of comment trims elsewhere for headroom — exp_565 had val_bpb=1.073426 (−0.000040 under best) but artifact was 1303B over cap.
574	538	21	000/005/017/088/108/142/151/164/177/196/212/245/267/280/298/324/336/377/475/491/538/574	opt	size_blocked	1.072782		Sqrt-shaped Muon momentum blend with floor=0.25: mm_blend = max(lr_scale**0.5, 0.25) combines exp_314's concave shape (sqrt no-floor was bpb=1.074206 but size_blocked) with exp_324's kept floor=0.25 to limit deepest-tail weight drift that plausibly caused the size overrun; holds muon momentum higher through mid-warmdown (at lr_scale=0.25 mu=0.9755 vs linear's 0.9505) while floor keeps bottom ~18% at 0.9375.</hypothesis> <parameter name="notes">Untested (shape x floor) point: exp_314 sqrt-no-floor size_blocked at bpb=1.074206; exp_324 linear+floor=0.25 is kept baseline; exp_335 pow(0.85)+floor=0.25 was small discard. Sqrt+floor=0.25 preserves floor's late-tail weight-trajectory stability (the likely cause of exp_314's size block) while reintroducing the concave mid-tail momentum hold. +7 packed bytes.
575	538	21	000/005/017/088/108/142/151/164/177/196/212/245/267/280/298/324/336/377/475/491/538/575	quant	size_blocked	1.073162		Sink-column-only asymmetric int6: extend GPTQ clip range from [-31,+31] to [-32,+31] on top-8 highest-|H_ii| post-perm cols only; rest stay symmetric. Salvages exp_556's -0.000436 would-have-won by limiting histogram shift to ~1.5% of cols where GPTQ error-propagation saturates most, so brotli entropy inflation is ~65x smaller than exp_556.</hypothesis> <parameter name="notes">Single-site edit in gptq_quantize_weight inner loop: lo = -clip_range - 1 if (i1 + j) lt 8 else -clip_range. Only cols 0..7 after H-diag-descending perm (GPTQ sink cols) get the extra -32 bin. Projects a quarter of exp_556's gain at very small post-brotli size impact.</parameter> </invoke>
576	538	21	000/005/017/088/108/142/151/164/177/196/212/245/267/280/298/324/336/377/475/491/538/576	loss	size_blocked	1.072613		Apply tiny logit-L2 regularization (λ=1e-5 · mean(logits²)) ONLY to TTT inner-loop loss, not main training CE — regularizes ~16 per-chunk SGD steps against chunk-specific logit-magnitude drift without touching main-train gradients.
577	538	21	000/005/017/088/108/142/151/164/177/196/212/245/267/280/298/324/336/377/475/491/538/577	arch	eval_budget_overrun	1.072087		Per-block per-token mlp_out_gate (raw Parameter [1,4] per MLP, 2*sigmoid of first 4 input features) — SIZE-LEAN reimplementation of exp_547/558/568 concept with minimal comments (+203B code vs +700B previously) and width=4 to pair with exp_538's attn_out_gate.
578	538	21	000/005/017/088/108/142/151/164/177/196/212/245/267/280/298/324/336/377/475/491/538/578	ttt	size_blocked	1.081064		Add label_smoothing=0.02 to TTT inner-CE (eval_val_ttt training loss only; main-train CE stays 0.0 via default kwarg): softens targets during per-chunk SGD adaptation to regularize against chunk-specific overfit — with only ~16 SGD steps on ~4 seqs/rank per chunk under mu=0.9 Nesterov, hard one-hot targets compound into over-confident chunk-local shifts that degrade generalization to subsequent chunks.</hypothesis> <parameter name="notes">Two-line edit: (1) GPT.forward signature adds label_smoothing=0.0 default kwarg and threads it into F.cross_entropy - main training (line 1544) and val-loss computation (line 1288) unchanged since they don't pass the kwarg; (2) eval_val_ttt training call switches from base_model(x,y) to base_model(x,y,label_smoothing=0.02). Scoring path (compiled_logits) untouched. +31 packed bytes (26223->26254). Mechanism distinct from exp_524 (which claimed to REMOVE ls=0.02, but current code confirms no ls present on the 538 lineage). Untried across 50+ prior TTT trials on LR/momentum/clip/reset/mask/epoch axes. Gentle value (0.02) chosen to minimize divergence risk.</parameter> </invoke>
579	538	21	000/005/017/088/108/142/151/164/177/196/212/245/267/280/298/324/336/377/475/491/538/579	reg	size_blocked	1.073817		Zero-init output-projection Muon WD split: route all ".proj." matrices (attn.proj + mlp.proj, the only _zero_init=True Muon params) into a third Muon group with muon_wd_proj=0.080, vs 0.095 attn / 0.115 MLP on non-zero-init inputs. Zero-init matrices grow from 0 and the same WD is disproportionately aggressive on them.
580	538	21	000/005/017/088/108/142/151/164/177/196/212/245/267/280/298/324/336/377/475/491/538/580	tok	size_blocked	1.073390		Gauge-fixed output-side per-feature scale (output_scale [512], init=1.0) mirroring exp_298's INSIDE-RMSNorm embed_scale pattern onto the tied-readout path. exp_320 proposed the identical mechanism but CRASHED; this safer variant appends F.rms_norm(x*output_scale) AFTER self.final_norm(x) instead of replacing it.
581	538	21	000/005/017/088/108/142/151/164/177/196/212/245/267/280/298/324/336/377/475/491/538/581	curr	size_blocked	1.074436		Dual-phase per shard-epoch in _reset_shard: consume two distinct entries from phase_order[si] per reset (indices 2e, 2e+1) and split start_inds across both phases (half each, disjoint 2048-stride grids). Doubles per-shard phase diversity in the 600s regime where only phase_order[0] normally fires. Untested axis.
582	538	21	000/005/017/088/108/142/151/164/177/196/212/245/267/280/298/324/336/377/475/491/538/582	meta	size_blocked	1.072853		adam_wd 0.005 to 0.006 scalar AdamW UP probe
583	538	21	000/005/017/088/108/142/151/164/177/196/212/245/267/280/298/324/336/377/475/491/538/583	eval	discard	1.073892	+0.000426	Retry of exp_573 (TTT momentum_buffer reset at chunk boundaries) with ~4KB total code savings from comment compaction — exp_565 and exp_573 both showed strong val_bpb gain (Δ=-0.000040 and Δ=-0.000271) but artifact overran the cap by 1.3KB and 2.6KB due to model-compression seed variance; this run has more code headroom to absorb that variance.
584	538	21	000/005/017/088/108/142/151/164/177/196/212/245/267/280/298/324/336/377/475/491/538/584	quant	size_blocked	1.073372		Pair exp_575's sink-col asymmetric int6 (top-8 post-perm cols use [-32,+31], rest stay symmetric [-31,+31]) with brotli lgwin=22→24 to recover the 1755B cap overshoot. exp_575 hit val_bpb=1.073162 (Δ=-0.000304 vs best) but size_blocked at 16,001,755B; widening brotli's LZ77 window to 16MB typically saves several KB on the ~30MB quant blob — enough headroom to fit the ~400B asymmetric histogram expansion under cap.</hypothesis> <parameter name="notes">Two-site edit: (1) unchanged sink-col asymmetric inner-loop branch from exp_575 in gptq_quantize_weight; (2) brotli.compress gains lgwin=24. Both individual ideas have precedent (exp_556 full-asymmetric, exp_567 damping=1.005+lgwin=24 both size_blocked) but never composed as asymmetric-sink + lgwin=24.</parameter> </invoke>
585	538	21	000/005/017/088/108/142/151/164/177/196/212/245/267/280/298/324/336/377/475/491/538/585	opt	size_blocked	1.072774		Raise muon_momentum_warmup_start 0.92→0.93: untried UP direction on an axis where both DOWN probes (exp_292@0.88, exp_500@0.90) regressed, while size_blocked floor-literal probes (exp_555 floor=0.30 bpb=1.072581, exp_562 floor=0.28 bpb=1.072734) strongly signal tail wants more momentum — raising warmup_start simultaneously raises initial ramp-from value AND the mm_blend tail floor (tail-mu 0.9375→0.9525) via a different mechanism that may produce differently-compressible weights than the size_blocked floor probes.
586	538	21	000/005/017/088/108/142/151/164/177/196/212/245/267/280/298/324/336/377/475/491/538/586	arch	eval_budget_overrun	1.073088		Same as exp_577 but skip mlp_out_gate on looped blocks [3..5]: cuts forward-pass gate ops 17→8 (53% reduction, since looped blocks are called 3× each via depth recurrence) to shave the 3.1s eval overrun that blocked exp_577. Compact 3-line skip logic in GPT.__init__ + one-line None-check in MLP.forward — ~100B vs exp_568's 3370B verbose implementation.
587	538	21	000/005/017/088/108/142/151/164/177/196/212/245/267/280/298/324/336/377/475/491/538/587	loss	size_blocked	1.072431		TTT-only z-loss (lambda=1e-5 * logsumexp(logits)^2) on eval_val_ttt inner-loop CE, distinct from exp_576 logit-L2-on-TTT and exp_564 z-loss-on-main-CE.
588	538	21	000/005/017/088/108/142/151/164/177/196/212/245/267/280/298/324/336/377/475/491/538/588	ttt	keep	1.072739	-0.000727	Halve SGD momentum_buffer at each TTT chunk boundary
598	588	22	000/005/017/088/108/142/151/164/177/196/212/245/267/280/298/324/336/377/475/491/538/588/598	ttt	size_blocked	1.072828		Tighten momentum-buffer damping at TTT chunk boundaries 0.5→0.3: exp_588 won at 0.5 (−0.000727), full reset (0.0) consistently regressed, 0.3 is an untested intermediate point motivated by PR#807 which swept analogous cross-document carryover momentum over {0.0,0.1,0.3,0.5,0.7} and found 0.3 optimal.
599	588	22	000/005/017/088/108/142/151/164/177/196/212/245/267/280/298/324/336/377/475/491/538/588/599	reg	size_blocked	1.072881		Inline post-optimizer L2 shrink on attn_out_gate_w only: replicate exp_569's adam_wd_gate=0.010 effective WD via 3-line post-step data.mul_(1 - 1e-4*lr_scale) across the 11 gate tensors
600	588	22	000/005/017/088/108/142/151/164/177/196/212/245/267/280/298/324/336/377/475/491/538/588/600	meta	size_blocked	1.073035		Raise ttt_momentum 0.9 to 0.92 on top of exp_588 chunk-boundary momentum_buffer halving
603	588	22	000/005/017/088/108/142/151/164/177/196/212/245/267/280/298/324/336/377/475/491/538/588/603	curr	size_blocked	1.073898		Seed sequence_order with independent PCG64([rank, si, _phase_epoch[si]]) per _reset_shard call, decoupling within-shard permutation from the cross-shard shared-rng state chain (which also services phase_order and shard_plan shuffles).
589	538	21	000/005/017/088/108/142/151/164/177/196/212/245/267/280/298/324/336/377/475/491/538/589	reg	size_blocked	1.073438		L1 sparsity penalty lambda 1e-4 via manual sign-gradient injection before grad_clip on attn_out_gate_w across all 11 blocks. Distinct from L2/WD pull-to-zero (exp_550/560/569 size_blocked). L1 creates exact zeros which brotli-11 compresses for free.</hypothesis> <parameter name="notes">Byte cost +333 code bytes. Single-site edit in step_fn before grad_clip_norm. Manual grad.add_ outside autograd graph. sign(0)=0 so no force at init. alpha 1e-4 matches scalar_lr*adam_wd at |w|=1. Targets exp_538 1056-param attn_out_gate_w mass - untested L1 axis, inverts size-inflation pattern via sparsity compressibility.</parameter> </invoke> 
590	538	21	000/005/017/088/108/142/151/164/177/196/212/245/267/280/298/324/336/377/475/491/538/590	meta	size_blocked	1.073440		adam_wd 0.005 to 0.0055 half-step UP after exp_582 missed by 17 bytes at 0.006
591	538	21	000/005/017/088/108/142/151/164/177/196/212/245/267/280/298/324/336/377/475/491/538/591	curr	size_blocked	1.073666		Offset Latin-square phase lookup by shard index: k = _phase_order[si][(_phase_epoch[si] + si) % 8]. Decouples the cross-shard phase-visit sequence under multi-epoch resets within a rank (ranks 0-4 have 2 shards).
592	538	21	000/005/017/088/108/142/151/164/177/196/212/245/267/280/298/324/336/377/475/491/538/592	eval	keep	1.072439	-0.000300	Gradient Centralization on TTT SGD only: zero-mean each output-row gradient across input dims for all 2D+ ttt_params before grad_clip+step.
