exp_id	parent_exp	depth	path	specialist	status	val_bpb	delta_vs_best	hypothesis
475	377	18	000/005/017/088/108/142/151/164/177/196/212/245/267/280/298/324/336/377/475	arch	keep	1.074021	-0.000066	Bifurcated q_gain [num_heads, 2]: one scalar per head for RoPE region (first rope_dims=16 of head_dim), separate scalar per head for NoPE region (remaining 48 dims). Cheap structural variant of size_blocked exp_465's [H, D] (88 vs 504 params/layer). Partial-RoPE assigns positional-phase vs content-key roles to these two regions; scalar q_gain forces identical sharpening across both — splitting breaks that tie.</hypothesis> <parameter name="notes">Two-site edit in CausalSelfAttention: (1) line 526: q_gain shape (num_heads,) → (num_heads, 2), same init qk_gain_init. (2) forward() line 551: replace single broadcast mul with split(rope_dims)/mul/cat — RoPE dims scaled by gain[:,0], NoPE dims by gain[:,1]. Step-0 identical to baseline (both cols init 5.25). Extra params: 11 blocks × 8 heads × 1 = 88 fp32/layer = 968 total (~4 KB raw, fp16 passthrough via CONTROL_TENSOR_NAME_PATTERNS → expected <1 KB packed after brotli on near-uniform init). Exp_465's full [H, D] was only ~6× more params and size_blocked at 1.074286 (close to best) — structural idea validated; this is the byte-efficient port.
485	475	19	000/005/017/088/108/142/151/164/177/196/212/245/267/280/298/324/336/377/475/485	arch	eval_budget_overrun	1.076961		Add bifurcated k_gain [num_kv_heads, 2] mirroring exp_475's q_gain rope/nope bifurcation on the K side at kv-group granularity: multiplicative reparameterization (product q_gain*k_gain) spans the same effective-gain tensor but gradient decomposes so k_gain moves ~5x faster than q_gain at init, testing implicit-acceleration effect; GQA coupling constrains 2 q-heads in a kv-group to share a k_gain factor.
486	475	19	000/005/017/088/108/142/151/164/177/196/212/245/267/280/298/324/336/377/475/486	tok	size_blocked	1.078941		Add learnable per-feature embed_bias [embedding_dim=512, init=0] inside the post-tok_emb RMSNorm, paired with existing embed_scale: `F.rms_norm(x*embed_scale + embed_bias,...)`. Structurally orthogonal to embed_scale — bias survives as DC offset through rms_norm (not gauge-absorbed), giving block-0 residual a position-invariant anchor signal.
487	475	19	000/005/017/088/108/142/151/164/177/196/212/245/267/280/298/324/336/377/475/487	quant	discard	1.074087	+0.000066	GPTQ block_size 32 to 16: continue the halving trajectory (128 to 64 kept, 64 to 32 kept exp_261 delta=-0.000026) — doubles cross-block error-compensation frequency, re-anchoring numerical precision more often so within-block Cholesky drift cannot accumulate through as many columns before global reconciliation.
488	475	19	000/005/017/088/108/142/151/164/177/196/212/245/267/280/298/324/336/377/475/488	loss	size_blocked	1.074199		Cubic-ramp position-weighted training CE: pw_t = 0.9 + 0.2 * (t/(T-1))^3, renormalized to mean 1. Generalizes exp_186's proven convex u^2 ramp (kept Δ=-0.000062) to cubic — u^3 keeps ~80% of early/mid positions flat near 0.9 and pushes the last ~15% steeply toward 1.1, better matching stride-64 sliding-window eval which only scores the tail 64/2048 positions of each window.
489	475	19	000/005/017/088/108/142/151/164/177/196/212/245/267/280/298/324/336/377/475/489	meta	size_blocked	1.074149		Lower muon_wd (attention-only matrices) 0.095 → 0.088 (-7%): symmetric DOWN probe on the attn side of the type-split Muon WD axis, mirroring exp_336's kept muon_wd_mlp 0.125→0.115 (-8% DOWN, Δ=-0.000109). After the exp_164 type-split the attn-only axis has never been individually moved DOWN — exp_110 (all-muon 0.095→0.065, pre-split) hurt but at 3.7x larger magnitude on both groups.
490	475	19	000/005/017/088/108/142/151/164/177/196/212/245/267/280/298/324/336/377/475/490	opt	size_blocked	1.074130		Cool AdamW beta1 during warmdown in lockstep with LR, floor 0.25 (exp_324-symmetric blend): 0.9 peak → 0.8625 floor on tok_emb + scalar AdamW groups. Direct port of exp_010's proven Muon-side momentum cool to the never-treated AdamW side.
491	475	19	000/005/017/088/108/142/151/164/177/196/212/245/267/280/298/324/336/377/475/491	ttt	keep	1.073978	-0.000043	Freeze control-scalar params (numel < 10000) during TTT: q_gain [H,2]=16, embed_scale 512, skip_weights/skip_gates ~2560 each are excluded from SGD+Nesterov adaptation. Only real weight matrices (tok_emb 4.2M, Q/K/V/O ~260K, MLP fc1/fc2 ~1M) are adapted. Rationale: scalars trained with AdamW at tiny LR drift up to ~2%/chunk under SGD@0.005+μ=0.9 momentum accumulation, and these are structural/generalization params, not chunk-specific content. Orthogonal direction to exp_049 (froze 4.2M tok_emb — major surface, hurt); this freezes only <10K-element structural gains.
501	491	20	000/005/017/088/108/142/151/164/177/196/212/245/267/280/298/324/336/377/475/491/501	eval	size_blocked	1.074322		Zero TTT SGD momentum_buffer at each chunk boundary so each chunk's ~4 SGD steps per rank start from a clean momentum direction instead of carrying the prior chunk's buffer (weight 0.656 through last step at μ=0.9).
503	491	20	000/005/017/088/108/142/151/164/177/196/212/245/267/280/298/324/336/377/475/491/503	ttt	size_blocked	1.074507		Reset SGD momentum buffers at TTT chunk boundaries (pop momentum_buffer state before each chunk's epoch loop): each val chunk is distributionally independent, so stale per-chunk gradient direction (μ^4≈0.656 carryover) is noise rather than signal; gives each chunk a clean Nesterov trajectory.
504	491	20	000/005/017/088/108/142/151/164/177/196/212/245/267/280/298/324/336/377/475/491/504	curr	size_blocked	1.074845		8-bucket within-shard positional stratification in _reset_shard: split each file's sequence range into 8 contiguous physical buckets, shuffle within each, then interleave round-robin so the ~4 pops per batch from each file span 4 distinct physical regions — adds within-file spatial dispersion on top of exp_196's between-file stratification, no virtual-shard/batch-assignment changes.
505	491	20	000/005/017/088/108/142/151/164/177/196/212/245/267/280/298/324/336/377/475/491/505	tok	size_blocked	1.075402		Add post-RMSNorm per-feature additive bias (embed_bias, shape=[512], init=0) at block-0 entry — RMSNorm-beta counterpart to the existing embed_scale gamma. Gives block 0's residual a learnable non-zero origin along each feature axis; orthogonal to exp_486 (INSIDE-norm, gauge-coupled) and exp_496 (output-side logit_bias).
506	491	20	000/005/017/088/108/142/151/164/177/196/212/245/267/280/298/324/336/377/475/491/506	curr	crash			Activate the dead 8-phase rotation: cap per-reset sequence pool at 2500 (shards have ~50k, training pulls ~9.6k/shard → phase_order[0] is the only phase ever sampled today) and switch random phase permutation to bit-reversed [0,4,2,6,1,5,3,7] with per-shard rotation so the first ~4 phases visited differ by ≥seq_len/4 in offset, giving identical shard tokens ~4 distinct RoPE alignments instead of 1.
507	491	20	000/005/017/088/108/142/151/164/177/196/212/245/267/280/298/324/336/377/475/491/507	arch	crash			Activate x0 injection only on LOOPED blocks: init resid_mix[1]=0.05 for blocks [3..5] (baseline=0 uniformly). Looped blocks are called num_loops+1=3 times per forward; a small embedding-anchor per iteration refreshes features that drift through repeated self-attention, complementing exp_245's loop ln_scale damping on the input side.
508	491	20	000/005/017/088/108/142/151/164/177/196/212/245/267/280/298/324/336/377/475/491/508	arch	crash			Per-iteration scalar gain on residual increment of LOOPED blocks: loop_iter_gain[0..num_loops] (3 fp32 scalars, init=1.0) multiplies (y - x_prev) for each of the 3 invocations of shared blocks[3..5], letting shared weights specialize contribution magnitude per loop call (Universal-Transformer layer-ID style, scalar-only form).
509	491	20	000/005/017/088/108/142/151/164/177/196/212/245/267/280/298/324/336/377/475/491/509	opt	size_blocked	1.074577		Replace Muon Newton-Schulz fixed coefficients (3.4445, -4.775, 2.0315) repeated 5× with 5 per-iteration Polar Express minimax-optimal tuples (PR #1344/#1787): aggressive first step (a=8.16) then tapered convergence (a=2.35 by step 5), producing a tighter approximation of the polar factor per gradient without adding NS iterations.
510	491	20	000/005/017/088/108/142/151/164/177/196/212/245/267/280/298/324/336/377/475/491/510	quant	discard	1.075132	+0.001154	Winsorize per-feature activation at ±6σ before accumulating GPTQ Hessian H=X.T@X: caps rare outliers' disproportionate inflation of H.diag() on sink columns, stabilizes act-order permutation against outlier-batch noise. Novel axis — all prior H probes touched H post-accumulation (damping, block_size, row-scale, act-order weighting).
511	491	20	000/005/017/088/108/142/151/164/177/196/212/245/267/280/298/324/336/377/475/491/511	tok	size_blocked	1.076504		test
512	491	20	000/005/017/088/108/142/151/164/177/196/212/245/267/280/298/324/336/377/475/491/512	reg	size_blocked	1.074777		Rare-target loss upweighting during main train: per-token CE × rsqrt(tok_emb row-norm)/mean, clamped to [0.7,1.5], mean-preserving — redistributes gradient signal toward BPB-relevant tail tokens using row norm as frequency proxy. Zero params, eval/GPTQ untouched.
513	491	20	000/005/017/088/108/142/151/164/177/196/212/245/267/280/298/324/336/377/475/491/513	arch	eval_budget_overrun	1.074903		Symmetric MLP output gate: per-token scalar data-dependent gate sourced from first 16 dims of normed MLP input (zero-init CastedLinear[16→1], 2*sigmoid=1 at step 0), mirrors exp_475's kept attn_gate_proj on the MLP branch that currently has no gate.
514	491	20	000/005/017/088/108/142/151/164/177/196/212/245/267/280/298/324/336/377/475/491/514	loss	size_blocked	1.139194		Byte-weighted CE (mean-preserving, per-target UTF-8 byte count) replaces plain-mean CE — aligns training grad with BPB metric that's evaluated token-bytes-weighted. Prior loss keeps reweighted by POSITION; this reweights by TARGET-TOKEN BYTES (untested axis).
515	491	20	000/005/017/088/108/142/151/164/177/196/212/245/267/280/298/324/336/377/475/491/515	meta	discard	1.074092	+0.000114	Raise muon_momentum_warmup_fraction 0.22→0.25 (+13.6% UP): probes the completely-untested UP side of exp_088's 0.33→0.22 kept optimum — all DOWN probes (0.22→0.15/0.16) on post-088 lineages discarded, suggesting 0.22 is at or just above optimum, while 0.25 brackets the untested opposite side.
516	491	20	000/005/017/088/108/142/151/164/177/196/212/245/267/280/298/324/336/377/475/491/516	ttt	size_blocked	1.081495		Lower TTT SGD learning rate 0.005 → 0.004 (-20% DOWN probe): first kept probe on the ttt_lr axis. exp_073 tried +30% UP but was harness_abort; DOWN never tested. After exp_491 narrowed adaptation to high-rank matrices (~37M params) via scalar freeze, Nesterov μ=0.9 integrates 3.44× per-chunk with grad_clip_norm=1.0 binding most steps → per-chunk weight drift may be over-aggressive. -20% LR gently attenuates drift compounding across ~8-15 chunks without cutting adaptation count.</hypothesis> <parameter name="notes">Single-literal change at line 183 (TTT_LR default 0.005→0.004). Zero code/size impact. ttt_lr feeds the SGD constructor (line 1375) and the per-chunk cosine decay baseline (line 1424). Orthogonal to exp_491 (param-filter, keep), exp_151 (Nesterov, keep), exp_264 (fwd/rev alternation, keep), exp_017 (epochs 3→4, keep). Untried axis despite being central to TTT dynamics. Risk: if clip_grad_norm=1.0 is always binding then step magnitude approx lr/(1-mu)=10*lr; at 0.004 the 4-step accumulated step is 0.0138 vs 0.0172 baseline (20% smaller). If adaptation was already below-optimum (exp_014/017 precedent suggested MORE helps), -20% regresses modestly (~+0.0002). If over-adapting, gain. No size or compile-path risk.
517	491	20	000/005/017/088/108/142/151/164/177/196/212/245/267/280/298/324/336/377/475/491/517	eval	size_blocked	1.074457		Half-decay TTT momentum_buffer at chunk boundaries (vs exp_491's hard-zero): _mb.zero_() → _mb.mul_(0.5) preserves 50% of the prior chunk's terminal direction for the first SGD step of the new chunk, betting on positive cross-chunk gradient correlation from locally-stationary val distribution.
518	491	20	000/005/017/088/108/142/151/164/177/196/212/245/267/280/298/324/336/377/475/491/518	curr	size_blocked	1.074774		Token-id-stratified CE loss weight w=0.95+0.10*(target_id/8191) up-weights high-id (rare) tokens — gaps.md Gap 5, untried in this swarm and externally; static arithmetic on flat_targets, torch.compile-safe (no bincount).
519	491	20	000/005/017/088/108/142/151/164/177/196/212/245/267/280/298/324/336/377/475/491/519	curr	crash			test
520	491	20	000/005/017/088/108/142/151/164/177/196/212/245/267/280/298/324/336/377/475/491/520	opt	discard	1.074288	+0.000310	Per-group Muon momentum split: add static momentum_offset=-0.01 on the MLP matrix group only (MLP peak 0.98 vs attn 0.99), warmdown cool applies symmetrically via the scheduled base muon_momentum; mirrors the proven muon_wd attn/mlp split (exp_164 keep), trusting fresher grads for the 2×-larger-per-block MLP params while preserving attention's ~100-step direction averaging
521	491	20	000/005/017/088/108/142/151/164/177/196/212/245/267/280/298/324/336/377/475/491/521	reg	discard	1.084148	+0.010170	Add label_smoothing=0.02 to main training cross-entropy — target-shape regularizer never tried in this tree; flattens training targets to calibrate logit magnitudes for int6 GPTQ rounding and damp overconfident gradients from q_gain=5.25 sharpening.
522	491	20	000/005/017/088/108/142/151/164/177/196/212/245/267/280/298/324/336/377/475/491/522	quant	discard	1.074824	+0.000846	Lower embed_clip_sigmas 20.0 to 14.0 on int8 tied embedding for finer bins.
523	491	20	000/005/017/088/108/142/151/164/177/196/212/245/267/280/298/324/336/377/475/491/523	tok	size_blocked	1.076323		Replace F.rms_norm with F.layer_norm on the post-tok_emb residual (inside same embed_scale product): strips per-token DC (feature-mean) from the initial residual and from x0 skip-anchor before they enter the trunk, so downstream skip paths carry DC-free anchors. exp_058 proposed this but harness_aborted; never measured.
524	491	20	000/005/017/088/108/142/151/164/177/196/212/245/267/280/298/324/336/377/475/491/524	ttt	discard	1.074303	+0.000325	Remove TTT label smoothing (label_smoothing=0.02 → 0.0) inside eval_val_ttt inner CE: restores symmetry with main-train CE (line 801, no smoothing) — untested axis across 50+ ttt trials (many LR/momentum/clip/mask/epoch probes, but never smoothing). Sharpens gradient toward true val tokens for stronger per-chunk adaptation.
525	491	20	000/005/017/088/108/142/151/164/177/196/212/245/267/280/298/324/336/377/475/491/525	meta	size_blocked	1.074731		Narrow GRAD_CLIP_NORM bisection 0.3→0.25 (-17% DOWN): prior exp_169 (0.3→0.2, +0.000124) and exp_233 (0.3→0.4, +0.000340) bracketed a 3× UP-side penalty over DOWN-side, suggesting the optimum lies between 0.2 and 0.3; 0.25 is the untested midpoint, re-probed after ~12 kept stack changes since exp_169 shifted the gradient-norm distribution.
526	491	20	000/005/017/088/108/142/151/164/177/196/212/245/267/280/298/324/336/377/475/491/526	eval	size_blocked	1.074090		Raise TTT SGD momentum 0.9 → 0.92 — untouched UP direction (every prior momentum trial went DOWN: exp_103 0.5=+0.000894 regression, exp_388 0.3=+0.000376, exp_147 0.9→0 cosine-cool=+0.000844). Gentle +2% probe parallels exp_336's Muon WD +8% DOWN win and exp_460's +10% LR attempt (size_blocked, not val); asymmetric-hurt-DOWN gradient suggests UP is the unexplored improving direction.
527	491	20	000/005/017/088/108/142/151/164/177/196/212/245/267/280/298/324/336/377/475/491/527	loss	discard	1.083362	+0.009384	Gradient-winsorize per-token CE at a fixed 11-nat ceiling (~2 nats above uniform log(V=8192)=9.0): clips only the heavy right tail of catastrophic-surprise tokens (random unicode/URL slugs) where grad variance is high but learning signal is near-zero — compile-friendly static-threshold variant of never-run exp_070 (3×mean adaptive, harness_abort), safely above exp_124's collapse-inducing cap=7.
528	491	20	000/005/017/088/108/142/151/164/177/196/212/245/267/280/298/324/336/377/475/491/528	arch	size_blocked	1.075259		Add SmearGate (PR#1667): zero-init data-dependent learnable bigram smear x[t>=1] += lambda * sigmoid(W·x[t-1,:12]) * x[t-1] applied once after post-tok_emb RMSNorm, before x0 capture. 13 total new params (CastedLinear(12→1) + scalar), fp16 passthrough, step-0 transparent. Novel to this tree; orthogonal complement to kept exp_475 attn-out-gate.
529	491	20	000/005/017/088/108/142/151/164/177/196/212/245/267/280/298/324/336/377/475/491/529	curr	discard	1.088921	+0.014943	Cap num_sequences at 2000 per shard plus preempt reset
530	491	20	000/005/017/088/108/142/151/164/177/196/212/245/267/280/298/324/336/377/475/491/530	quant	size_blocked	1.074534		GPTQ column ordering by output-energy score H.diag() * W.var(dim=0) instead of H.diag() alone — greedy pass quantizes high-output-contribution columns first while Hinv is cleanest, untouched axis since exp_000.
531	491	20	000/005/017/088/108/142/151/164/177/196/212/245/267/280/298/324/336/377/475/491/531	reg	size_blocked	1.074069		Depth-targeted Muon WD on attention matrices of looped blocks [3..5] only: add 3rd Muon param group with muon_wd_attn_recurrent=0.1235 (1.3× baseline 0.095), porting exp_141's proven mechanism (kept Δ=-0.000274 on sibling tree) onto current type-split (exp_164/336); scoped to attn only since MLP-recurrent variant exp_187 was discard.</hypothesis> <parameter name="notes">Three-site edit: (1) Hyperparameters gains muon_wd_attn_recurrent=0.1235 env-backed default. (2) Optimizers.__init__ adds recurrent_prefixes=tuple(f"{i}." for i in range(h.loop_start, h.loop_end+1))=("3.","4.","5.") and splits matrix_attn_params via name.startswith(recurrent_prefixes). (3) Muon receives a 3rd param group with the elevated WD. Zero new model params; code_bytes 25944. Looped blocks receive 3× more gradient updates per forward so per-step shrinkage (1-lr·wd) is proportionally eroded; equalizing per-gradient-step shrinkage. All three LR/momentum/base_lr loops iterate optimizer_muon.param_groups, so new group composes cleanly.
532	491	20	000/005/017/088/108/142/151/164/177/196/212/245/267/280/298/324/336/377/475/491/532	tok	size_blocked	1.079825		Set scale_grad_by_freq=True on nn.Embedding for tok_emb: divides each row's input-path gradient by its in-batch frequency so common tokens no longer 100x-dominate rare-token rows on input lookup, while leaving tied-softmax F.linear output path unchanged — breaks tied-gradient symmetry along a never-before-tried axis at zero bytes / zero params.
533	491	20	000/005/017/088/108/142/151/164/177/196/212/245/267/280/298/324/336/377/475/491/533	opt	size_blocked	1.074165		Raise Muon spectral-scale exponent 0.5 to 0.6 at line 883.
534	491	20	000/005/017/088/108/142/151/164/177/196/212/245/267/280/298/324/336/377/475/491/534	loss	discard	1.074148	+0.000170	Apply gentle linear position-weighted CE (0.9→1.1, mean-preserving) ONLY to the TTT inner-loop loss — aligns TTT's few adaptation steps with eval's stride-64 tail-scored zone. Never tried in TTT (all prior loss-PW experiments modified main-train CE only; restoration on current lineage fails). Main-train CE unchanged.
535	491	20	000/005/017/088/108/142/151/164/177/196/212/245/267/280/298/324/336/377/475/491/535	ttt	size_blocked	1.074097		Split TTT SGD into two param groups: tok_emb gets 2× LR (0.010), all other matrices keep 1× LR (0.005); cosine decay preserves the ratio across chunks. Embedding under-adapts at uniform h.ttt_lr relative to its 6× training-time ratio.
536	491	20	000/005/017/088/108/142/151/164/177/196/212/245/267/280/298/324/336/377/475/491/536	meta	size_blocked	1.074418		Advance enable_looping_at 0.35→0.28 so the 1-pass→3-pass recurrence transition happens exactly at warmdown start (lr_scale=1.0 at frac=0.28) rather than 7pp into warmdown (lr_scale~0.90 at frac=0.35): completely untouched axis in 525+ trials, giving the looped architecture more high-LR gradient exposure.
537	491	20	000/005/017/088/108/142/151/164/177/196/212/245/267/280/298/324/336/377/475/491/537	eval	discard	1.074435	+0.000457	Loosen TTT SGD grad_clip_norm 1.0 → 1.5 (+50%): tested-direction asymmetry — tighter 0.5 hurt twice on the current lineage (exp_244 +0.000489, exp_351 +0.000289) but looser ≥1.0 has never been validated post-Nesterov (exp_101's 2.0 probe went eval_budget_overrun on the pre-Nesterov/pre-ttt_epochs=4 stack). A mild +50% loosening lets rare-but-informative large gradients propagate while staying well inside Nesterov@0.9 stability.
538	491	20	000/005/017/088/108/142/151/164/177/196/212/245/267/280/298/324/336/377/475/491/538	arch	keep	1.073466	-0.000512	PR1667 per-head data-dependent attention-output gate as raw nn.Parameter
547	538	21	000/005/017/088/108/142/151/164/177/196/212/245/267/280/298/324/336/377/475/491/538/547	arch	size_blocked	1.072375		Symmetric MLP-output gate as raw nn.Parameter [1,12] per block (per-token scalar), mirroring exp_538's attn_out_gate on the MLP branch.
