exp_id	parent_exp	depth	path	specialist	status	val_bpb	delta_vs_best	hypothesis
252	212	11	000/005/017/088/108/142/151/164/177/196/212/252	meta	discard	1.075804	+0.001054	Lower tied_embed_lr 0.03 to 0.026 on tied tok_emb AdamW group.
253	212	11	000/005/017/088/108/142/151/164/177/196/212/253	ttt	discard	1.075445	+0.000695	Reset SGD momentum_buffer at each TTT chunk boundary so stale velocity from chunk (i-1) — scaled by prior cos_lr — doesn't contaminate chunk i's first steps under a different LR; each chunk's ~16 SGD steps start from clean velocity.
255	212	11	000/005/017/088/108/142/151/164/177/196/212/255	eval	discard	1.075633	+0.000883	Reset TTT SGD momentum buffer at the start of each chunk's training phase: stale momentum from earlier high-LR chunks pushes updates in directions misaligned with the cosine LR decay in late low-LR chunks, effectively overriding the schedule.
213	196	10	000/005/017/088/108/142/151/164/177/196/213	ttt	discard	1.075973	+0.000951	Reset SGD momentum buffer at each TTT chunk boundary (optimizer.state = defaultdict(dict)) so each chunk adapts locally rather than inheriting stale momentum from prior chunks' (different-distribution) gradients.
214	196	10	000/005/017/088/108/142/151/164/177/196/214	meta	discard	1.075202	+0.000180	Raise matrix_lr (Muon LR on ~29M matrix params) 0.022 → 0.024 (+9%): completely untouched core LR knob across ~200 trials; Muon's Newton-Schulz normalization bounds spectral-norm updates, so LR bumps translate to proportionally larger but still-stable steps during the narrow ~6% peak-LR+peak-momentum window.
215	196	10	000/005/017/088/108/142/151/164/177/196/215	arch	discard	1.449037	+0.374015	Disable XSA on looped layers [loop_start..loop_end] only: repeated V-direction subtraction across num_loops+1=3 passes over-whitens iterative refinement; non-looped layers keep XSA.
216	196	10	000/005/017/088/108/142/151/164/177/196/216	loss	discard	1.765836	+0.690814	Anti-focal CE reweighting (γ=0.5): multiply existing u² PW by w = exp(-ce.detach()/2) (= p_correct^0.5), mean-preserving, stacked on the current u²-PW-CE. Tests the symmetric opposite of the failed focal-γ=0.5 (exp_054, +0.002535) and focal-γ=1 (exp_144, +0.009038) — downweight near-floor hard tokens so gradient concentrates on reducible-loss positions.
217	196	10	000/005/017/088/108/142/151/164/177/196/217	curr	discard	1.076098	+0.001076	Mask first 64 positions of target_ids with ignore_index=-100 in training CE (forward), aligning training regime with sliding-window eval which dominantly scores positions with ≥1984 tokens of prior context (eval stride=64).
218	196	10	000/005/017/088/108/142/151/164/177/196/218	reg	discard	1.076997	+0.001975	Constant-effective-WD on the tied tok_emb during warmdown: boost optimizer_tok weight_decay by 1/max(lr_scale, 0.5) (cap 2x) in step_fn so the per-step decay factor (1 - lr*wd) on tok_emb stays roughly constant through warmdown — tightens the tied embedding (which doubles as output head) exactly when LR is cooling.</hypothesis> <parameter name="notes">Single-site edit in train_model.step_fn right after the LR-scaling loop. Zero new params, no arch change. In baseline, effective embed-WD per step (lr*wd) decays proportionally to lr_scale during warmdown. This edit keeps it roughly constant for the first half of warmdown (lr_scale in [1.0, 0.5]) then clamps (wd_boost=2x) for the second half. Target: compress tied-embedding weight norms more aggressively in the warmdown tail for better generalization AND better brotli compressibility on the output-head int6 codes. Novel reg direction — prior reg keeps (exp_141 depth-split Muon-WD, exp_164 type-split Muon-WD) both targeted Muon matrix groups; this is the first scheduled AdamW-WD intervention, orthogonal to them. Skeptical case: if equilibrium embed norm shrinks too much, softmax logit magnitudes drop and TTT can't recover them — hence the conservative 2x cap (not 4x).
219	196	10	000/005/017/088/108/142/151/164/177/196/219	tok	size_blocked	1.075628		Add learnable per-vocab logit bias (8192 fp32 scalars, zero-init, passthrough fp16): decouples output frequency prior from tied tok_emb rows that otherwise must serve as both compositional-meaning vectors AND likelihood-prior vectors. Added before tanh softcap; trained via scalar AdamW group (scalar_lr=0.02, adam_wd=0.02).
220	196	10	000/005/017/088/108/142/151/164/177/196/220	opt	discard	1.075928	+0.000906	Shorten warmdown_frac 0.72→0.65: reclaim 7% of budget (42s) as peak-LR learning — extends the peak-momentum×peak-LR overlap window from 36s to 78s (exp_088's proven-valuable regime), while 390s warmdown tail still gives ~15 EMA half-lives for convergence.
222	196	10	000/005/017/088/108/142/151/164/177/196/222	eval	discard	1.083241	+0.008219	Label-smoothing ε=0.02 applied ONLY to TTT-training CE (scoring + main training unchanged): regularizes the per-chunk 4-epoch SGD updates against overconfident chunk-specific n-gram memorization that would bias subsequent-chunk scoring.
178	164	8	000/005/017/088/108/142/151/164/178	arch	discard	1.077666	+0.001808	Restrict XSA to the decoder half only: xsa_last_n 11→6 (apply Exclusive-Self-Attention exactly to layers 5..10 = num_decoder_layers). XSA subtracts each head's V-direction from its output (an anti-self regularizer); on encoder layers this may damage feature construction while on decoder layers it productively forces attention onto other positions. exp_028 tried xsa_last_n=5 but was harness_aborted (never tested); 6 is the clean encoder/decoder cut aligned with num_encoder_layers=11//2=5.
179	164	8	000/005/017/088/108/142/151/164/179	tok	discard	1.076012	+0.000154	Soft row-L2 cap at tied tok_emb init: after nn.init.normal_, shrink only the outlier ~5% of rows whose L2 norm exceeds 1.15×expected_norm (=1.15·std·sqrt(d)) down to exactly that cap; the other ~95% of rows keep their natural Gaussian row-norm variation — preserves the log-unigram prior exp_019's strict sphere init destroyed, while killing the long tail that drives per-row int8 quant scales and early-training gradient noise.
180	164	8	000/005/017/088/108/142/151/164/180	ttt	discard	1.075920	+0.000062	Tighten TTT per-step grad clip 1.0→0.5: pairs with exp_151's Nesterov (kept) by capping outlier lookahead-amplified updates on anomalous val chunks while keeping clip 1.67x training's 0.3.
181	164	8	000/005/017/088/108/142/151/164/181	eval	eval_budget_overrun	1.078248		Halve eval_stride 64→32: doubles scoring-window density so every scored token gets avg 2031.5 context tokens (up from 2015.5, +0.79%), applied uniformly to both quantized_sliding_window and quantized_ttt scoring passes.
182	164	8	000/005/017/088/108/142/151/164/182	opt	discard	1.076203	+0.000345	Raise AdamW beta2 0.95→0.98 for the tok_emb optimizer only (largest Adam-managed tensor, 4.2M params, Zipfian heavy-tailed grads under tied embeddings) — more stable second-moment denominator on rare-token directions; scalar/head groups keep 0.95.
183	164	8	000/005/017/088/108/142/151/164/183	quant	size_blocked	1.075490		Per-module GPTQ clip_sigmas: tighten attn matrices (c_q/c_k/c_v/attn.proj) to 12.0 while keeping MLP/other at 12.85. Captures the bpb win of exp_165 (size_blocked at global 12.0) while limiting the entropy hit to ~27% of matrix params so size stays under 16MB.
185	164	8	000/005/017/088/108/142/151/164/185	curr	discard	1.076896	+0.001038	Per-sequence ±64-token start_ind jitter in ShuffledSequenceLoader._reset_shard decorrelates training windows from the strict phase+k*seq_len grid that persists in 600s runs (where _reset_shard only fires once per shard), matching eval's stride-64 sliding-window resolution without incurring exp_047's overlap penalty.
187	164	8	000/005/017/088/108/142/151/164/187	reg	discard	1.075962	+0.000166	Depth-targeted MLP Muon WD: loop-segment MLPs (layers 3-5, used 3x/forward) at muon_wd_mlp_recurrent=0.155, non-loop MLPs at 0.125
165	151	7	000/005/017/088/108/142/151/165	quant	size_blocked	1.075267		Pair brotli lgwin=22→24 (max 16 MB compression window vs default 4 MB) with modest matrix_clip_sigmas 12.85→12.0 tightening — the larger window captures cross-matrix redundancy in the ~27 MB quant dict to fund finer GPTQ int6 resolution without exceeding the 16 MB cap.
152	142	6	000/005/017/088/108/142/152	opt	discard	1.076593	+0.000302	Exclude Muon matrix params from global grad_clip_norm — Newton-Schulz already bounds per-layer Muon update spectrum, so global L2 clipping couples Muon grads to sparse tok_emb/lm_head outliers and damps them unnecessarily; clip only Adam-managed (tok_emb + lm_head + scalar/control) params at the same 0.3 threshold.
153	142	6	000/005/017/088/108/142/153	quant	size_blocked	1.073723		Tighten matrix_clip_sigmas 12.85→10.5 — direct SDClip scale tightening (18% smaller quant scale → finer int6 resolution for bulk Gaussian weights) without the aggressive per-row MinMSE that size-blocked exp_145/exp_004/exp_008.
154	142	6	000/005/017/088/108/142/154	curr	discard	1.076974	+0.000683	Add uniform intra-bucket jitter to exp_142's Latin-square phase cycling: each reset samples jitter∈[0,bucket_width) on top of the bucket offset so repeat visits to the same bucket k land on a DIFFERENT actual phase. Preserves Latin-square coverage guarantee at bucket granularity while extending phase coverage from 8 discrete points to continuous over [0,max_phase).
155	142	6	000/005/017/088/108/142/155	reg	discard	1.076571	+0.000280	Continuous input-embedding Gaussian noise σ=0.015 added to post-RMSNorm x in forward_logits, train-only via self.training gate — a smoother alternative to exp_040's failed MLP hidden dropout and exp_012's size-blocked discrete token-replacement.
156	142	6	000/005/017/088/108/142/156	loss	keep	1.076091	-0.000200	Gentle position-weighted CE (linspace 0.9→1.1 across T=2048, mean-preserving): aligns training gradient with eval's stride-64 scored regime [1984,2047] by a 20% amplitude tilt toward late positions, structurally distinct from prior per-token (exp_144 focal), target-side (exp_042 smoothing), and symmetric (exp_009 z-loss) loss trials.
166	156	7	000/005/017/088/108/142/156/166	tok	size_blocked	1.076200		Add a learnable per-vocab output bias (8192 fp32 scalars) applied AFTER logit softcap: logits = softcap*tanh(F.linear(x, tok_emb.weight)/softcap) + out_bias, zero-init, in scalar_params optimizer group. Decouples the log-unigram/marginal-frequency prior from tied tok_emb rows so embedding geometry specializes on token direction rather than absorbing both direction + frequency scale.
167	156	7	000/005/017/088/108/142/156/167	loss	discard	1.076534	+0.000467	Eval-stride-aligned sigmoid position weight: mean-preserving S-curve centered at t=T-64 with slope 1/16 and amplitude 0.3, concentrating the gradient tilt at the exact eval-stride boundary (bulk ≈0.99, tail peaks ≈1.29) instead of exp_156's uniform linspace(0.9,1.1) spread.
168	156	7	000/005/017/088/108/142/156/168	eval	discard	1.076108	+0.000041	Pure sliding-window semantics: first window (ws=0) now scores only positions [context_size:wlen] like all subsequent windows, eliminating low-context warmup tokens (positions 0..1983) from val_bpb so every scored token has uniform >=1984-token context (HF-style perplexity convention).
169	156	7	000/005/017/088/108/142/156/169	meta	discard	1.076191	+0.000124	Tighten grad_clip_norm 0.3→0.2 (−33%): the 3-layer recurrent segment 3×-amplifies gradient norms in loop layers so the current 0.3 clip attenuates them proportionally less than non-recurrent layers — tighter clipping complements exp_141's recurrent-WD hike on the gradient side.
170	156	7	000/005/017/088/108/142/156/170	arch	discard	1.078970	+0.002903	Fatter heads: num_heads 8→4, num_kv_heads 4→2 (head_dim 64→128, param-neutral), rope_dims 32→64 to preserve exp_005's 50% partial-RoPE coverage under the new head size.
171	156	7	000/005/017/088/108/142/156/171	ttt	discard	1.076511	+0.000444	Reset SGD momentum buffers at each TTT chunk boundary (clear optimizer.state['momentum_buffer'] after setting cos_lr): each chunk is a distinct text region, and with only ~8-16 SGD steps/chunk at momentum=0.9 the tail velocity from the previous chunk biases the early updates of the new chunk.
172	156	7	000/005/017/088/108/142/156/172	opt	discard	1.076401	+0.000334	Ramp Muon weight_decay 1.0x->1.3x linearly with warmdown (lr_scale 1->0): compensates for lr*wd effective-decay collapse in the tail and drives Muon matrices toward smaller magnitudes for better int6 GPTQ fit — mirrors exp_141's 1.3x muon_wd hike but applied globally as a time-fractional schedule.</hypothesis> <parameter name="notes">Single-site insertion (~7 lines) in step_fn between Muon momentum cool and the lr_scale loop. No new env var. Sets muon_wd_cur = h.muon_wd * (1.0 + (1.0-lr_scale)*0.3) every step and writes it into optimizer_muon.param_groups. Rationale: Muon's per-step decay p*=(1-lr*wd) naturally drops as lr->0 during warmdown, so the regularization strength collapses just when int6 GPTQ quantization error (which scales with weight magnitude) matters most for val_bpb. exp_141 (reg, kept at delta=-0.000274) already proved 1.3x muon_wd helps on recurrent blocks; extending the proven magnitude as a time-fractional schedule across ALL Muon matrices. Distinct from exp_163 (beta1 cool, discarded delta=+0.000146) since wd acts on weight magnitudes, not gradient moments, and targets quantization error directly. Active only during warmdown (lr_scale<1.0); peak phase unchanged.
174	156	7	000/005/017/088/108/142/156/174	curr	discard	1.076214	+0.000147	Round-robin stratified shard sampling in next_batch (with per-batch random rotation offset) replaces weighted-random independent per-slot draws, eliminating per-batch shard-composition multinomial variance (~50% CoV with 12 shards × 48 slots).
157	142	6	000/005/017/088/108/142/157	eval	discard	1.077622	+0.001531	Temperature sharpening T=0.97 on scoring logits in eval_val_ttt (divide logits by 0.97 before CE) — opposite direction of exp_044 (T=1.05 worsened +0.00261), motivated by GPTQ int6 weight noise flattening the output distribution.
158	142	6	000/005/017/088/108/142/158	tok	discard	1.077884	+0.001793	Zipf-weighted row-magnitude init for tied tok_emb: after normal_ init, multiply row i by 1/sqrt(1 + i/1024) so rare high-ID tokens start with smaller norms. Tied embeddings feed F.linear for output logits (row-norm-sensitive), so rare-token logits start small → low-confidence uniform prior for rares at t=0, matching BPB's objective.
159	142	6	000/005/017/088/108/142/159	meta	discard	1.076664	+0.000573	Bump Adam beta2 0.95→0.98: tied embedding (4.2M params) sees sparse per-row gradients; longer 2nd-moment half-life (~35 vs ~14 steps) stabilizes Adam's preconditioner for long-tail vocab rows.
160	142	6	000/005/017/088/108/142/160	arch	discard	1.077070	+0.000979	Restore orphaned exp_005 win: rope_dims 16→32 (50% partial RoPE). exp_005 proved -0.000788 on the older stack but the change was lost at exp_014 when a sibling specialist rebased from a pre-exp_005 ancestor; every subsequent keep (including current best exp_142) inherits rope_dims=16.
143	108	5	000/005/017/088/108/143	arch	discard	1.078249	+0.001686	Init resid_mix[1] (x0/embedding injection scale) from 0.0→0.05 per-layer: give every block a weak embedding-bypass channel from step 0 so gradient has informative signal immediately; with 3-layer recurrence (layers 3-5 called 3x) every loop pass sees x0 re-injected consistently from the start.
144	108	5	000/005/017/088/108/144	loss	discard	1.085601	+0.009038	Focal-style (γ=1) per-token CE reweighting, mean-normalized: w=(1-p_correct) under no_grad, then normalized so focal_w.mean()=1 to preserve overall gradient magnitude (LR schedule stays calibrated). Redirects gradient budget from saturated easy tokens (common function words, trailing punctuation) toward content tokens where ~36M-param capacity is information-limited.
145	108	5	000/005/017/088/108/145	quant	size_blocked	1.069273		Replace GPTQ per-row σ-based SDClip scale (clip_sigmas*row_std/clip_range) with max-abs scale (row.abs().amax()/clip_range): uses full int6/int8 range for every row with zero clipping, ~3× finer quantization bins on non-outlier rows where current clip_sigmas=12.85σ wastes ~70% of int6 range.
146	108	5	000/005/017/088/108/146	tok	eval_budget_overrun	1.076864		Add a learnable 8192-dim output logit bias applied AFTER the tanh softcap: frees tied tok_emb rows from encoding unigram frequency via their norms (unconstrained log-prior shifts live in the bias), moving that capacity to directional/semantic content while the softcap still bounds the inner-product term.
147	108	5	000/005/017/088/108/147	eval	discard	1.077407	+0.000844	Cosine-cool TTT SGD momentum 0.9→0 across chunks in lockstep with the existing cos_lr schedule, so late low-LR chunks effectively do vanilla SGD and the momentum buffer can't carry stale early-chunk grads into the precision-adaptation tail.
148	108	5	000/005/017/088/108/148	opt	discard	1.077537	+0.000974	Shrink warmdown_frac 0.72→0.60 to expand the peak-LR+peak-momentum window 6%→18% of training — frac=[0.22,0.40] at peak-LR+peak-momentum instead of only [0.22,0.28], tripling the window exp_088 opened by shrinking Muon momentum warmup 0.33→0.22.
109	088	4	000/005/017/088/109	opt	discard	1.079184	+0.002319	Decouple muon_momentum_warmdown_end (0.85) from muon_momentum_warmup_start (0.92): exp_010 cools Muon momentum 0.99→warmup_start during warmdown, locking the warmdown floor to 0.92. Lowering the floor to 0.85 makes deep-warmdown steps less momentum-dragged (fresher per-step gradient), letting the EMA averager (decay 0.9965, half-life ~200 steps) do more of the smoothing across the 72% warmdown tail — a Polyak-Ruppert shift of averaging from intra-step momentum to cross-step EMA.
110	088	4	000/005/017/088/110	meta	discard	1.079212	+0.002347	Lower muon_wd 0.095→0.065 (~32% reduction, nanoGPT-speedrun-aligned): untouched knob on ~28M Muon-managed matrix params. Under exp_088's earlier-peak momentum ramp (0.99 reached before frac=0.28), the smoothed gradient buffer makes decoupled weight-decay more-effective per step, so the baseline 0.095 likely overshoots — less WD should recover generalization headroom in the warmdown tail without destabilizing peak-LR training.
111	088	4	000/005/017/088/111	loss	size_blocked	1.091049		Poly-1 loss with eps=-1.0 (L = CE + eps*(1-p_t)) — gradient on target logit scales by (1-p_t), acting as focal-γ=1 hard-example mining; directs training signal toward structurally hard tokens where an underfit 36M model has slack.
112	088	4	000/005/017/088/112	curr	discard	1.079458	+0.002593	Stratified (low-discrepancy) within-shard start indices: partition [0, max_start] into num_sequences equal bins, draw one uniform start per bin, then shuffle — gives minimum-spacing ≈ seq_len with no bin-collisions, sitting between packed (zero in-bin variance) and IID (Poisson clumping).
113	088	4	000/005/017/088/113	ttt	discard	1.077680	+0.000815	Reset SGD momentum buffer at each TTT chunk boundary — stale momentum direction from prior chunk's gradients is distributionally misaligned with new chunk's text, and with ~4 SGD steps/chunk at momentum=0.9 the prior chunk's first-step gradient still carries 66% weight into the new chunk's first step.
114	088	4	000/005/017/088/114	arch	size_blocked	1.089296		Extend partial-RoPE coverage rope_dims 32→48 (75% of head_dim=64, leaving 16 dims NoPE): continues exp_005's kept trajectory (16→32, Δ=-0.000788) at zero parameter cost, giving attention more positional signal while retaining some NoPE dims for position-invariant semantic matching.
116	088	4	000/005/017/088/116	tok	discard	1.080352	+0.003487	Introduce a learnable scalar logit_gain (init=1.0) multiplied into logits pre-softcap so the scalar-optimizer group can grow output magnitude without pulling on embed_wd=0.085 which compresses tied tok_emb rows for input regularization.
117	088	4	000/005/017/088/117	eval	discard	1.079705	+0.002840	Sharpen scoring logits with T=0.95 (divide by 0.95) in eval_val_ttt score-first pass only; counters GPTQ int6 noise that flattens logit distribution. exp_044 showed T=1.05 smoothing HURT by +0.0026 — the opposite direction is untested.
118	088	4	000/005/017/088/118	reg	discard	1.077259	+0.000394	Targeted Muon weight-decay hike on c_q/c_k projections only (muon_wd_qk=0.15 vs global muon_wd=0.095); attention sharpness is already handled by learnable q_gain=5.25, so containing Q,K magnitudes specifically regularizes attention without shrinking V/O or MLP capacity — orthogonal to the global muon_wd=0.115 hike in exp_095 that hurt everything uniformly.
089	017	3	000/005/017/089	ttt	eval_budget_overrun	1.079803		Reset TTT SGD momentum buffers at chunk boundaries (not across): each val chunk is a non-stationary distribution, so velocity from chunk i opposes chunk i+1's gradient; momentum still accumulates across the 4 inner epochs on the same chunk.
090	017	3	000/005/017/090	arch	crash			Add Sub-LN (post-attention and post-MLP RMSNorm, no-affine) inside Block.forward: decouples direction from magnitude so attn_scale/mlp_scale purely control amplitude while F.rms_norm bounds residual-stream growth, especially valuable under 3-layer recurrence where blocks 3-5 are reused 3x.
091	017	3	000/005/017/091	meta	discard	1.078984	+0.002040	Raise Adam beta2 0.95→0.98 (canonical LLM default): 2nd-moment EMA half-life grows ~14→~34 steps, smoothing the preconditioner denominator for tied tok_emb (4.2M params) and scalar groups without touching Muon; unexplored static tweak (only cosine-scheduled beta2 was tried in exp_021→crash; sibling exp_075 tightening beta1→0.8 hurt +0.0013, so lengthening beta2 is the symmetric unexplored direction).
