exp_id	parent_exp	depth	path	specialist	status	val_bpb	delta_vs_best	hypothesis
889	750	23	000/005/017/088/108/142/151/164/177/196/212/245/267/280/298/324/336/377/475/491/538/596/750/889	curr	discard	1.074786	+0.002576	Replace Latin-square 8-bucket phase cycling with golden-ratio Weyl sequence: phase=int((si+k)*φ%1*max_phase), giving 13 distinct near-optimally-spread phase offsets across 13 shards/rank vs ≥5 duplicate phases under 8-bucket pigeonhole; also saves ~50 packed bytes by removing _phase_order initialization.
890	750	23	000/005/017/088/108/142/151/164/177/196/212/245/267/280/298/324/336/377/475/491/538/596/750/890	loss	discard	1.072465	+0.000255	Entropy-floor hinge at 4.0 nats stacked on TTT z-loss: 1e-4*F.relu(4-H(p)).mean() where H(p)=lse-sum(p*x), computed cheaply by reusing the lse from z-loss. Threshold=4 nats activates for well-predicted tokens (p1>~60%), adding distribution-shape anti-drift complementary to z-loss's scale control; exp_825's threshold=1 nat was inactive (H>>1 for all typical tokens) producing noise delta of +0.000056.
891	750	23	000/005/017/088/108/142/151/164/177/196/212/245/267/280/298/324/336/377/475/491/538/596/750/891	ttt	eval_budget_overrun	1.072598		Re-introduce exp_588's TTT chunk-boundary momentum_buffer halving (mb.mul_(0.5) for ci>0): proven Δ=-0.000727 at exp_538 baseline, lost when lineage forked exp_596 from exp_538 instead of exp_588.
892	750	23	000/005/017/088/108/142/151/164/177/196/212/245/267/280/298/324/336/377/475/491/538/596/750/892	opt	discard	1.072896	+0.000686	Shorten warmdown_frac from 0.72 to 0.67: expands the stable peak-LR+peak-momentum window from 6% to 11% of the 600s budget (frac 0.22→0.33 vs 0.22→0.28), giving ~155 more steps at full LR for the undertrained model to explore before refinement begins. Linear decay shape preserved unchanged.
893	750	23	000/005/017/088/108/142/151/164/177/196/212/245/267/280/298/324/336/377/475/491/538/596/750/893	meta	discard	1.072999	+0.000789	ADAM_EPS 1e-8 → 2e-8 (2× UP gentle midpoint between current 1e-8 and exp_802's 1e-7 size_blocked-at-improved-bpb 1.072196): half-step retry of the strongest recent meta UP signal at minimal-step to ease the size cap.
894	750	23	000/005/017/088/108/142/151/164/177/196/212/245/267/280/298/324/336/377/475/491/538/596/750/894	quant	discard	1.072365	+0.000155	Continuous proportional H damping (exp_818's formula: hd *= 1+0.01*hd/mean(hd), mean=1.01) paired with brotli lgwin=24 (16MB LZ77 window vs default 4MB) to recover the artifact headroom that exp_818 lost when size_blocked.
895	750	23	000/005/017/088/108/142/151/164/177/196/212/245/267/280/298/324/336/377/475/491/538/596/750/895	eval	discard	1.072261	+0.000051	Raise TTT gradient clip threshold 1.0→2.0: exp_244 showed tighter clip (0.5) hurt BPB by +0.000489, implying the 1.0 clip is actively binding; allowing larger per-step gradient magnitudes should enable more aggressive TTT adaptation.
896	750	23	000/005/017/088/108/142/151/164/177/196/212/245/267/280/298/324/336/377/475/491/538/596/750/896	arch	size_blocked	1.072806		Switch attn-output gate input from x[..., :12] (pre-attn input) to v.reshape(...,-1)[..., :12] (V projection slice): VGA-style value-state gating per arxiv 2510.09017, byte-neutral (gate_w shape [H=8, W=12] unchanged), single-line forward edit.
897	750	23	000/005/017/088/108/142/151/164/177/196/212/245/267/280/298/324/336/377/475/491/538/596/750/897	reg	discard	1.073045	+0.000835	Zero WD on attn_out_gate_w: split 88 zero-init per-head sigmoid gate params out of scalar AdamW group into their own sub-group with weight_decay=0.0, letting gradient signal grow them to their true optimum without pull-toward-zero opposition.
898	750	23	000/005/017/088/108/142/151/164/177/196/212/245/267/280/298/324/336/377/475/491/538/596/750/898	tok	size_blocked	1.073582		Add output-side gauge-fixed out_scale [dim=512, init=1.0] applied INSIDE final_norm (F.rms_norm(x * out_scale,...)), symmetric with the kept input-side embed_scale. Unlike exp_886's failed head_scale (outside norm, absorbable into tok_emb), inside-norm acts directionally and cannot be collapsed into tok_emb.weight learning.
899	750	23	000/005/017/088/108/142/151/164/177/196/212/245/267/280/298/324/336/377/475/491/538/596/750/899	curr	discard	1.073384	+0.001174	Port exp_186's u² position-weighted CE (pw=0.9+0.2*u², normalized to mean 1.0) onto exp_750 baseline: up-weights high-context late positions by ~14% vs early positions, aligning training gradient with stride-64 sliding-window eval; this technique was kept twice on the exp_164 branch (Δ=−0.000171+−0.000062) but was never applied to the current main lineage (exp_142→exp_196→...→exp_750).
900	750	23	000/005/017/088/108/142/151/164/177/196/212/245/267/280/298/324/336/377/475/491/538/596/750/900	ttt	discard	1.072974	+0.000764	Alternate TTT batch-traversal order across per-chunk epochs (fwd on even, rev on odd): decorrelates SGD gradient directions across the 4 inner epochs, replicating exp_264's proven Δ=-0.000084 keep on a baseline that lacked Nesterov/z-loss — now applying it to exp_750 where it has never been tried.
751	596	22	000/005/017/088/108/142/151/164/177/196/212/245/267/280/298/324/336/377/475/491/538/596/751	ttt	size_blocked	1.072820		Damp TTT SGD momentum_buffer by 0.5 ONLY at the first chunk boundary (ci==1) under z-loss regime: surgical port of exp_588 (kept standalone) where uniform damping atop z-loss (exp_607) regressed; chunk-0 builds peak stale velocity at full cos_lr while later boundaries see naturally smaller buildup.</hypothesis> <parameter name="notes">Single 3-line conditional after cos_lr update. +8 packed code bytes. Distinct from exp_588 (all boundaries), exp_607 (all + z-loss, regressed), exp_708 (sign-cond reset), exp_656 (tok_emb-only). Hypothesis: chunk-0 to chunk-1 is the dominant stale-velocity transition; later transitions don't need damping because cos_lr decay reduces velocity buildup naturally and z-loss bounds per-step magnitude. If chunk-0to1 dominates 588's gain, partial recovery (~-0.0003); if late chunks contribute, smaller.
752	596	22	000/005/017/088/108/142/151/164/177/196/212/245/267/280/298/324/336/377/475/491/538/596/752	reg	size_blocked	1.089665		Eval-TTT inner-loop input-token denoising at p=0.01: replace ~1% of input token IDs with uniform-random IDs during TTT inner training forward only; CE target y stays clean. Score-first scoring untouched.
753	596	22	000/005/017/088/108/142/151/164/177/196/212/245/267/280/298/324/336/377/475/491/538/596/753	loss	size_blocked	1.072926		Linearly decay TTT inner-CE z-loss coefficient across 21 epochs: 1e-5 to 1e-5*(1-_ep/h.ttt_epochs). Mechanism-distinct from 9 prior flat-coefficient z-loss variants; front-loads regularization onto fresh-chunk adaptation, gentler as TTT converges.
754	596	22	000/005/017/088/108/142/151/164/177/196/212/245/267/280/298/324/336/377/475/491/538/596/754	tok	discard	1.073225	+0.001015	Per-head row-segment L2 isotropy at tied tok_emb init: split each row D=512 into H=8 head-segments of hd=64, rescale each segment to identical L2 = std*sqrt(64). Removes per-head magnitude noise from finite-N Gaussian sampling while preserving natural row-magnitude variance.
755	596	22	000/005/017/088/108/142/151/164/177/196/212/245/267/280/298/324/336/377/475/491/538/596/755	meta	discard	1.072572	+0.000362	Per-group BETA2 split: lower scalar AdamW beta2 0.95 to 0.93 (h.beta2 to 0.93 literal at L925), keeping optimizer_tok at 0.95. Untouched axis in 700+ trials.
757	596	22	000/005/017/088/108/142/151/164/177/196/212/245/267/280/298/324/336/377/475/491/538/596/757	quant	size_blocked	1.072518		Refit s only on small matrices (rows<1024): exp_747's full-refit ALS scale gave -0.000376 bpb but size_blocked at +891B. Skip the largest scale arrays (tok_emb 8192, mlp_up/gate 2048) which dominated refit's brotli-entropy growth; keep refit on attn proj + mlp.down (rows=512), where weight homogeneity makes refit s less entropy-disruptive.
597	538	21	000/005/017/088/108/142/151/164/177/196/212/245/267/280/298/324/336/377/475/491/538/597	arch	size_blocked	1.073373		Zero-init per-KV-head-dim additive V-bias (1D param num_kv_heads*head_dim=256 fp32/block, routes to scalar-AdamW via ndim&lt;2 + TTT-freeze via numel&lt;10000): adds a learnable position-invariant content prior to V after c_v projection, acting as a structural &quot;attention sink&quot; contribution since softmax weights sum to 1. Additive (not scale) — mechanism-distinct from exp_330's failed per-KV-head multiplicative V-gain (size_blocked, 1.075124) and exp_538's multiplicative post-attn per-head gate.
605	538	21	000/005/017/088/108/142/151/164/177/196/212/245/267/280/298/324/336/377/475/491/538/605	opt	discard	1.072380	+0.000129	Re-submit exp_595's Muon mm_blend floor 0.25→0.27 (bpb=1.072548 size_blocked by 1,859 B) with ~2,393 B of extra comment trim to clear the 16 MB cap; same weight trajectory as exp_595 should now fit.</hypothesis> <parameter name="notes">exp_595 produced val_bpb=1.072548 (-0.000918 vs best) but the 16.00 MB artifact exceeded the cap by 1,859 bytes. This submit keeps the identical optimizer change (mm_blend = max(lr_scale, 0.27)) and only trims additional verbose comment blocks: module docstring (lines 1-14), attention-backend header + SDPA fallback docstring, muon_momentum_warmup_fraction rationale (lines 153-156), muon_wd_mlp rationale (lines 167-171), TTT section header (lines 176-181), smoke-test gate note (lines 225-228), GPTQ signal-proportional damping rationale (lines 1059-1065), and TTT scalar-freeze rationale (lines 1363-1373). Pack went 26223 → 23830 B (-2393), giving ~534 B safety margin over exp_595's 1859 B overrun. Model trajectory should be bitwise identical since only comments changed; only risk is GPTQ seed variance drifting model_bytes upward.</parameter> </invoke>
539	491	20	000/005/017/088/108/142/151/164/177/196/212/245/267/280/298/324/336/377/475/491/539	curr	size_blocked	1.097696		Lower per-shard num_sequences cap 2000 to 1500 in _reset_shard for guaranteed full 8-phase coverage
540	491	20	000/005/017/088/108/142/151/164/177/196/212/245/267/280/298/324/336/377/475/491/540	reg	discard	1.074155	+0.000689	Raise muon_wd (attention matrices only) 0.095 to 0.100 (+5.3% UP): first UP probe on the attn sub-group after the exp_164 type-split. DOWN probes (exp_414 -8% +0.000192, exp_489 -7% size_blocked 1.074149) both failed, leaving UP untested. Small step avoids exp_095's +21% blowup; tightens attn weight norms (GPTQ/brotli-favorable).
541	491	20	000/005/017/088/108/142/151/164/177/196/212/245/267/280/298/324/336/377/475/491/541	tok	discard	1.081574	+0.008108	Reuse existing embed_scale on the OUTPUT path of the tied softmax: F.linear(x * embed_scale, tok_emb.weight). Zero new params — makes the 512-wide per-feature gain symmetric across the tied tok_emb.weight's two roles (input basis re-weight + output classifier basis re-weight).
542	491	20	000/005/017/088/108/142/151/164/177/196/212/245/267/280/298/324/336/377/475/491/542	meta	size_blocked	1.074770		Lower muon_momentum_warmup_fraction 0.22 to 0.20 (−9% DOWN): untested gentle-DOWN gap in exp_088's proven faster-ramp direction; prior DOWN probes (0.22 to 0.15/0.16 on older lineages) over-shot, UP probe (exp_515 0.22 to 0.25 discard +0.000114) hurt slightly — optimum may sit at 0.20 under current post-491 stack.
543	491	20	000/005/017/088/108/142/151/164/177/196/212/245/267/280/298/324/336/377/475/491/543	loss	size_blocked	1.075515		Frequency-stratified per-class CE weight via F.cross_entropy(weight=linspace(0.9,1.1,V)) — upweights rare tokens (high id = rare in SP8192 freq-sorted vocab). Uses PyTorch's built-in weighted reduction='mean' which divides by sum(w[y]) for exact mean-preservation — first clean probe of this axis (exp_518/512 were both size_blocked, exp_272 crashed).
544	491	20	000/005/017/088/108/142/151/164/177/196/212/245/267/280/298/324/336/377/475/491/544	opt	size_blocked	1.074789		Schedule ema_decay in lockstep with LR warmdown: 0.9965 at peak-LR, rising to 0.998 as scale to 0. Weight-space analog of exp_010/exp_324 (cool Muon momentum during warmdown). exp_393 static 0.998 regressed +0.001989; schedule confines 0.998 to tail only.
545	491	20	000/005/017/088/108/142/151/164/177/196/212/245/267/280/298/324/336/377/475/491/545	quant	size_blocked	1.074166		Switch GPTQ quantization scale from per-row (W.std(dim=1)) to per-column (W.std(dim=0)): one fp16 scale per INPUT feature instead of per OUTPUT row. Natively aligned with the Hessian-weighted objective (quadratic in the col/input axis) and shrinks tok_emb scale vector from 16 KB → 1 KB (per-row was 8192 fp16, per-col is 512 fp16) — a novel untried axis in the quant tree.
546	491	20	000/005/017/088/108/142/151/164/177/196/212/245/267/280/298/324/336/377/475/491/546	ttt	size_blocked	1.073963		Intra-chunk per-epoch momentum ramp [0.70, 0.83, 0.90, 0.95] on TTT SGD-Nesterov: ep0 low-μ dilutes prior chunk's stale momentum carry-in, later epochs high-μ smooths fresh-chunk grad noise
548	491	20	000/005/017/088/108/142/151/164/177/196/212/245/267/280/298/324/336/377/475/491/548	eval	size_blocked	1.074048		Loop-equalized TTT LR: looped blocks [3..5] are invoked (num_loops+1)=3× per forward so receive 3× gradient magnitude — scale their TTT SGD base LR by 1/sqrt(num_loops+1)≈0.577 (matching the existing ln_scale_factor variance-balance on those exact blocks) so per-step weight-space drift equalizes across physical layers; untried physical-index LR split (prior exp_133/315/357 matrix-TYPE splits all hurt)
552	491	20	000/005/017/088/108/142/151/164/177/196/212/245/267/280/298/324/336/377/475/491/552	ttt	discard	1.073937	+0.000471	Intra-chunk per-epoch momentum ramp [0.70, 0.83, 0.90, 0.95] on TTT SGD-Nesterov (compacted retry of exp_546 which val_bpb=1.073963 but size_blocked by 394 B over-cap)
557	491	20	000/005/017/088/108/142/151/164/177/196/212/245/267/280/298/324/336/377/475/491/557	eval	discard	1.074059	+0.000593	Loop-equalized TTT LR (compact): same edit as exp_548 (split TTT SGD into two param groups, scale looped-block LR by 1/sqrt(num_loops+1)) with 255-byte comment/code trim to recover cap headroom; exp_548 packed 81B over (size_blocked) despite val_bpb=1.074048 i.e. −0.000070 vs current best, so the quality signal is real and the only barrier is packing margin
492	475	19	000/005/017/088/108/142/151/164/177/196/212/245/267/280/298/324/336/377/475/492	eval	discard	1.074537	+0.000559	Score-aligned TTT position weights step w_head=0.9 context w_tail=4.1 scored region mean-preserving
493	475	19	000/005/017/088/108/142/151/164/177/196/212/245/267/280/298/324/336/377/475/493	reg	size_blocked	1.073997		Intra-attn Muon WD split: attn.proj (zero-init residual writer) raised 0.095→0.120 while c_q/c_k/c_v stay at 0.095. Mirrors exp_164's kept UP move on mlp-type (0.115 vs 0.095) but scoped within attn; size-safe mirror of exp_483 (which LOWERED mlp.proj WD and size_blocked).
494	475	19	000/005/017/088/108/142/151/164/177/196/212/245/267/280/298/324/336/377/475/494	arch	eval_budget_overrun	1.077725		Region-split QK RMSNorm: apply F.rms_norm independently to the RoPE region (first rope_dims=16) and NoPE region (remaining 48 dims) of Q and K, instead of a single joint norm across the whole head_dim. Mirrors exp_475's bifurcated q_gain structure at the normalization layer and removes the implicit coupling where a 16-dim region competes with a 48-dim region for a shared RMS budget.
495	475	19	000/005/017/088/108/142/151/164/177/196/212/245/267/280/298/324/336/377/475/495	curr	size_blocked	1.074967		Half-shard stratification: extend exp_196's largest-remainder per-batch quotas from K=num_files=12 to K=24 virtual shards by splitting each file's sequence range into first/second position-half bins, balancing intra-file position coverage per batch.
496	475	19	000/005/017/088/108/142/151/164/177/196/212/245/267/280/298/324/336/377/475/496	tok	size_blocked	1.074772		Add learnable per-vocab logit_bias to tied-softmax logits before softcap to encode a frequency prior.
497	475	19	000/005/017/088/108/142/151/164/177/196/212/245/267/280/298/324/336/377/475/497	quant	size_blocked	1.074149		Continue GPTQ multiplicative Hessian damping downward trajectory 1.01→1.005 (halve again): exp_280's 1.02 kept (-0.000054), exp_377's 1.01 kept (-0.000084) — each halving improved; at 0.5% damping more true Hessian curvature is preserved for error-propagation while still ridge-regularising high-H columns.
498	475	19	000/005/017/088/108/142/151/164/177/196/212/245/267/280/298/324/336/377/475/498	loss	size_blocked	1.075042		Gentle focal loss (γ=0.25, mean-preserving) replacing plain CE: fw=(1-p_t)^0.25 with detached p_t, normalized to mean 1, so hard tokens contribute more gradient while overall loss/LR scale is unchanged — principled Lin+ 2017 technique, never tried in this tree, orthogonal axis to position-weighting family
499	475	19	000/005/017/088/108/142/151/164/177/196/212/245/267/280/298/324/336/377/475/499	meta	size_blocked	1.074759		Raise tied-embedding Adam weight decay embed_wd 0.085 → 0.095 (+11.8% UP): symmetric probe against exp_041's DOWN attempt (0.085→0.07, size_blocked at bpb=1.078695). UP on embedding WD shrinks row norms → tighter GPTQ int8 codes and better brotli compression on the ~15 MB dominant embedding payload, while also regularizing the tied input/output matrix that serves dual roles.
500	475	19	000/005/017/088/108/142/151/164/177/196/212/245/267/280/298/324/336/377/475/500	opt	discard	1.074410	+0.000432	Lower muon_momentum_warmup_start default 0.92 to 0.90
502	475	19	000/005/017/088/108/142/151/164/177/196/212/245/267/280/298/324/336/377/475/502	reg	size_blocked	1.074143		Shrink exp_493's attn.proj Muon WD bump 0.120→0.110 to fit under 16MB (exp_493 was size_blocked by just 575B while producing val_bpb=1.073997, beating best). Same role-split (q/k/v at 0.095, attn.proj at 0.110, mlp at 0.115) at a smaller delta above baseline, trading a fraction of the WD differentiation for size headroom.
476	377	18	000/005/017/088/108/142/151/164/177/196/212/245/267/280/298/324/336/377/476	tok	size_blocked	1.076035		Feature-level F.dropout(p=0.02) on tok_emb output during training only, applied between the embedding lookup and the post-lookup RMSNorm (gauge-fix site): regularizes the INPUT use of the tied-embedding matrix (sparse lookup, more overfit-prone than the dense tied readout) without perturbing the output-tied gradient path. p=0.02 is 2.5x gentler than exp_040's failed MLP-hidden p=0.05 and at a structurally upstream site. Zero params, zero bytes.
478	377	18	000/005/017/088/108/142/151/164/177/196/212/245/267/280/298/324/336/377/478	loss	size_blocked	1.088749		Multi-Token Prediction auxiliary CE (α=0.05): add a small-weight CE term on target[t+1] (two-steps-ahead token) alongside the standard next-token CE, forcing the rep at t to encode near-future signal. Training-only, same tied head, zero new params.
479	377	18	000/005/017/088/108/142/151/164/177/196/212/245/267/280/298/324/336/377/479	meta	size_blocked	1.074650		Lower adam_wd 0.005→0.002 (2.5× further DOWN) on scalar-params AdamW group — direct continuation of exp_177's proven DOWN direction (0.02→0.005, Δ=−0.000038).
480	377	18	000/005/017/088/108/142/151/164/177/196/212/245/267/280/298/324/336/377/480	ttt	size_blocked	1.074829		Per-chunk Nesterov momentum-buffer reset in eval_val_ttt: zero state['momentum_buffer'] for all TTT params at each chunk boundary so inherited stale direction from early high-LR chunks on different-distribution data doesn't leak into late low-LR chunks; keeps proven within-chunk μ=0.9 Nesterov smoothing (exp_151) while discarding inter-chunk carry-over (orthogonal lever from exp_472's gradual μ cooling 0.9→0.5, which discarded).
481	377	18	000/005/017/088/108/142/151/164/177/196/212/245/267/280/298/324/336/377/481	opt	discard	1.074416	+0.000395	Raise peak Muon momentum 0.99 to 0.992: untried PEAK momentum axis
482	377	18	000/005/017/088/108/142/151/164/177/196/212/245/267/280/298/324/336/377/482	eval	discard	1.074559	+0.000538	Floor TTT cosine LR at 0.1×ttt_lr instead of decaying to 0 (mirrors exp_324's Muon-momentum warmdown-floor win on opt side): keeps late chunks doing small-LR adaptation so the last ~20% of chunks still contribute gradient before scoring their successors.
483	377	18	000/005/017/088/108/142/151/164/177/196/212/245/267/280/298/324/336/377/483	reg	size_blocked	1.074832		Intra-MLP Muon WD split: mlp.fc stays at muon_wd_mlp=0.115 (feature-creating, silu²-squashed), mlp.proj drops to muon_wd_mlp_proj=0.095 to match attn's WD — structural parity between the two zero-init residual-writers (attn.proj + mlp.proj) while preserving firm WD on the feature-creating path.
484	377	18	000/005/017/088/108/142/151/164/177/196/212/245/267/280/298/324/336/377/484	curr	discard	1.075692	+0.001671	Replace within-shard random permutation with a golden-ratio LCG order (stride≈0.618·N, coprime with N, per-epoch random offset): deterministic low-discrepancy sequence ordering, untried permutation-STRUCTURE axis orthogonal to exp_474's block-B=8 (locality) and exp_047's half-stride (overlap).
378	336	17	000/005/017/088/108/142/151/164/177/196/212/245/267/280/298/324/336/378	eval	discard	1.075124	+0.001037	Apply logit temperature T=0.97 (3% sharpening, divide logits by 0.97) inside eval_val_ttt scoring pass only — symmetric opposite of exp_044 (T=1.05 softening → Δ=+0.002607) on the hypothesis that GPTQ-int6 flattens output distributions and optimal T<1.
379	336	17	000/005/017/088/108/142/151/164/177/196/212/245/267/280/298/324/336/379	curr	size_blocked	1.076365		Alternate Weyl multiplier across shard-epochs (golden φ⁻¹≈0.618 on even epochs, silver √2−1≈0.414 on odd) in _reset_shard to decorrelate consecutive-epoch within-shard visit orders: both irrationals give valid low-discrepancy sequences, and silver ≠ 1−golden so the two orders are structurally different (not just reverses).
