exp_id	parent_exp	depth	path	specialist	status	val_bpb	delta_vs_best	hypothesis
075	017	3	000/005/017/075	opt	discard	1.079326	+0.001267	Lower AdamW beta1 0.9→0.8 (nanoGPT-speedrun default) for tok_emb/lm_head/scalar optimizers — faster first-moment tracking (~5-step vs ~10-step EMA of gradients) better matches the compact ~1800-step 600s budget where loss-landscape curvature changes rapidly; Muon is untouched.
076	017	3	000/005/017/076	curr	harness_abort			Train-eval stride alignment: reduce training-sample stride from seq_len to seq_len-eval_stride (2048→1984) so each 64-token overlap region is seen once at deep context (pos ≥1984) and once at shallow context (pos ≤63) — mirroring eval's sliding-window-64 scoring pattern, at only ~3% token duplication vs exp_047's 50%.
077	017	3	000/005/017/077	reg	harness_abort			Raise muon_wd 0.095 to 0.115 (+21%) to shrink matrix weights more aggressively: tighter L2 equilibrium both sharpens int6 quantization (smaller weights, less clip-sigma error) and provides gentle regularization on the most-redundant param bucket — an unexplored WD direction after exp_041's embed_wd cut went size_blocked and all prior reg attempts (dropout/noise) hurt this under-fit model</hypothesis> <parameter name="notes">Single-line constant change: Hyperparameters.muon_wd default 0.095 to 0.115 (line 163). All 5 prior reg trials were dropout/noise (040 MLP-drop +0.0098 bad; 050 resid-drop +0.0022 bad; 012 token-noise size_blocked; 033 NEFTune crash; 062 adam_wd=0 crash) — confirms under-fit regime where signal-removing regularizers hurt. WD-bump on matrix params is the orthogonal direction: shrinks weights (size-safe vs exp_041's LOWER embed_wd, size_blocked) and tightens the int6 quant distribution without removing training signal. Muon applies p.data.mul_(1 - lr*wd) so shrinkage naturally scales with the cosine LR warmdown; only the equilibrium weight-norm shifts.
078	017	3	000/005/017/078	curr	harness_abort			Mask CE loss on first 4 training positions (where context is &lt;4 tokens and gradient is context-starved/noisy) via ignore_index=-100 applied inside ShuffledSequenceLoader; TTT/eval unaffected since they bypass this loader
079	017	3	000/005/017/079	arch	harness_abort			Initialize resid_mix[1] from 0.0 to 0.1 so every block gets a direct embedding-stream injection from step 0.
080	017	3	000/005/017/080	loss	harness_abort			Add deep-supervision auxiliary CE (α=0.1) from the encoder→decoder boundary tap via tied tok_emb — zero-byte, training-only gradient shortcut to the encoder stack.
081	017	3	000/005/017/081	tok	harness_abort			Raise tied_embed_lr 0.03→0.038 (+27%): first trial to tune this completely-unexplored tok knob. exp_069 (raise embed_wd→+0.003 worse) and exp_041 (lower embed_wd→size_blocked) together triangulate the tied matrix at a tight optimum where constraint hurts but slack size-blocks — raising LR lets the dual-role tied matrix develop more discriminative output-head rows via gradient pull while AdamW's LR-coupled WD proportionally tightens shrinkage per step, keeping row-entropy bounded.
082	017	3	000/005/017/082	reg	harness_abort			Lower adam_wd 0.02 to 0.008 (-60%) on the scalar-param optimizer: q_gain (init 5.25), attn_scale/mlp_scale (init 1.0), resid_mix[0] (init 1.0), skip_gates all have non-zero structural initializations that zero-anchored weight decay actively corrupts.
083	017	3	000/005/017/083	meta	harness_abort			Apply exp_003's proven EMA decay 0.9965→0.998 to the exp_017 branch: exp_003 kept Δ=-0.000776 on the baseline path but was never combined with exp_005's rope_dims=32 lineage that exp_017 descends from — pairing two independent kept wins.
084	017	3	000/005/017/084	ttt	harness_abort			Within-chunk linear LR decay across TTT epochs (1.25x→0.75x, mean-preserving): front-loads the largest step on epoch 0 when the gradient is freshest w.r.t. chunk data, then polishes with smaller steps to reduce chunk-level overfitting at epoch 4.
085	017	3	000/005/017/085	eval	harness_abort			Reduce eval sliding-window stride 64→48: each scored token gets +8 avg context tokens (2024.5 vs 2016.5), boosting prediction quality at modest (1.33×) extra eval compute.
086	017	3	000/005/017/086	quant	harness_abort			Lower matrix_clip_sigmas 12.85→10.0: int6 step size shrinks ~22% (0.204σ→0.159σ per level), reducing round-to-nearest error on the bulk of weights while clipping only >10σ tails GPTQ can partially compensate; Q distribution also concentrates so byte-shuffle brotli packs tighter (size-safe).
088	017	3	000/005/017/088	opt	keep	1.076944	-0.001115	Shrink muon_momentum_warmup_fraction 0.33→0.22 so Muon momentum reaches peak 0.99 BEFORE warmdown begins at frac=0.28, giving the peak-LR phase a real peak-momentum window instead of still-ramping momentum colliding with exp_010's cool-during-warmdown coupling.
094	088	4	000/005/017/088/094	opt	discard	1.077966	+0.001022	Lower Muon peak momentum from 0.99 to 0.97.
098	088	4	000/005/017/088/098	arch	discard	1.078843	+0.001899	Remove the three unconditional F.rms_norm post-norms on attn_out/mlp_out in Block.forward (NormFormer OFF): learnable per-channel attn_scale/mlp_scale plus the next block's pre-RMSNorm make the unit-RMS constraint redundant, and freeing the output magnitude lets scales modulate across a wider dynamic range.
100	088	4	000/005/017/088/100	meta	discard	1.078989	+0.002045	Re-apply exp_003's kept EMA decay 0.9965→0.998 on top of exp_088 — sibling-branch winner (-0.000776 in isolation) never combined with the current best lineage.
101	088	4	000/005/017/088/101	ttt	eval_budget_overrun	1.078598		Loosen TTT gradient clip norm 1.0→2.0 to pass more signal through on informative chunks; with ttt_epochs=4, mom=0.9, ttt_lr=0.005 giving tightly-bounded per-step moves, 1.0 was likely over-constraining rare-but-useful large-gradient updates.
103	088	4	000/005/017/088/103	eval	discard	1.077838	+0.000894	Lower TTT SGD momentum 0.9→0.5: with only ~4 SGD steps per val chunk, mom=0.9 carries ~60% stale velocity from previous chunks' heterogeneous gradients; lower momentum lets each chunk's adaptation track its own distribution more locally.
104	088	4	000/005/017/088/104	reg	discard	1.080328	+0.003384	Inject LR-coupled gaussian noise (σ=0.003*lr_scale) into the post-Newton-Schulz Muon update — classical Neelakantan 2015 gradient-noise regularizer applied to the orthogonalized matrix update, auto-decaying to 0 through the 72% warmdown tail.
105	088	4	000/005/017/088/105	opt	eval_budget_overrun	1.079099		Lower adam_eps 1e-8 → 1e-10 (nanoGPT-speedrun canonical): smaller preconditioner denominator gives proportionally larger effective updates for low-second-moment parameters — most pronounced for rare-tail tok_emb rows under AdamW.
106	088	4	000/005/017/088/106	meta	discard	1.078567	+0.001623	Lower muon_momentum_warmup_start 0.92→0.90 on exp_088 baseline: widens the Muon momentum ramp range from 7pt (0.92→0.99) to 9pt (0.90→0.99) inside the compressed 22% warmup window, giving noisier/more-responsive early updates; mirror test of exp_015 (0.92→0.94 discard +0.00181, whose post-hoc signal was that Muon benefits from responsive early momentum).
107	088	4	000/005/017/088/107	arch	size_blocked	1.088497		All-parallel residual (PARALLEL_RESIDUAL_START 7→0): every block runs attn and MLP in parallel off the same pre-residual input (GPT-J/PaLM style) instead of the hybrid where only layers 7-10 are parallel.
108	088	4	000/005/017/088/108	quant	keep	1.076865	-0.000079	Shrink GPTQ block_size 128→64 for finer error propagation (2× more error-update events per matrix, each with a better-conditioned 64×64 Hinv block) — theory says lower quantization error at zero entropy/size cost since scales remain per-row and int6 code distribution is unchanged.
115	108	5	000/005/017/088/108/115	quant	discard	1.077062	+0.000197	Shrink GPTQ block_size 64→32 on exp_108: monotonic extension of the confirmed 128→64 winning direction — 2× more error-propagation events per matrix (16 vs 8 for 512-col weights) with smaller better-conditioned 32×32 Hinv sub-blocks.
119	108	5	000/005/017/088/108/119	meta	discard	1.080676	+0.003811	Revive exp_003's proven EMA_DECAY 0.9965→0.998 on exp_108's lineage — the exp_088/108 sub-tree forks from exp_005, bypassing exp_003's kept change, so 0.998 is absent from current baseline.
120	108	5	000/005/017/088/108/120	opt	discard	1.156336	+0.079471	Disable Nesterov look-ahead in Muon: with momentum=0.99 + MuonEq-R row-norm, Nesterov's g+0.99*buf quantity is ~99% momentum-dominated, so NS orthogonalizes a doubly-amplified momentum vector; vanilla momentum orthogonalizes the true EMA-smoothed gradient (buf) for a cleaner rotation-consistent update.
121	108	5	000/005/017/088/108/121	arch	discard	1.077588	+0.000723	Re-apply exp_005's kept rope_dims 16 to 32 on the exp_108 snapshot which still carries rope_dims=16, compounding exp_005's proven gain with the later quant wins.
122	108	5	000/005/017/088/108/122	curr	discard	1.078255	+0.001390	Remove per-rank shard stripe (all_files[rank::world_size] → all_files): every rank now samples from the full shard pool, widening per-rank shard-origin diversity ~world_size× and eliminating the systematic per-rank topic/style bias; per-rank PCG64(rank) seeding keeps independent sampling.
123	108	5	000/005/017/088/108/123	ttt	eval_budget_overrun	1.078876		Shrink TTT training mini-batch 32→1 (scoring stays at 32): with chunk=65536/seq_len=2048/world=8 there are only ~4 seqs per rank per chunk, so batch_seqs=32 collapses to ONE optimizer step per epoch — shrinking to 1 gives 4× more SGD updates per chunk (16 vs 4) at identical FLOPs, enabling actual per-chunk convergence.
124	108	5	000/005/017/088/108/124	loss	discard	1.299998	+0.223133	Fixed-cap per-token CE winsorization at 7.0 nats: torch.clamp(ce, max=7.0).mean() zeros gradient from the extreme tail (~0.1-1% of tokens at steady state) to damp SGD variance from structurally unpredictable tokens (encoding garbage, random URL slugs).
125	108	5	000/005/017/088/108/125	quant	discard	1.077204	+0.000339	GPTQ column ordering: importance-weighted (||W[:,c]||² · H_cc) descending instead of pure activation-order (H_cc), better ranking columns by their contribution to output variance under the GPTQ quadratic loss.
126	108	5	000/005/017/088/108/126	meta	discard	1.077164	+0.000299	BETA2 0.95→0.97 for the two AdamW groups (tied tok_emb + scalars: QK-gains, LN scales, skip gates/weights) — extends second-moment EMA half-life ~14→22 steps, an untouched knob across 120+ prior trials.
127	108	5	000/005/017/088/108/127	eval	eval_budget_overrun	1.078945		Halve TTT_CHUNK_TOKENS 65536→32768 to double TTT adaptation granularity: ~2× as many score-then-train chunks over the val sequence, so each score-first pass runs on a model adapted on more recent context (closer spatial locality between adaptation data and scored tokens). Total SGD step count is ~constant (num_chunks doubles, chunk_seqs halves), but update/scoring cadence is 2× finer.
128	108	5	000/005/017/088/108/128	opt	discard	1.077328	+0.000463	Shrink muon_momentum_warmup_fraction 0.22→0.15: extends the peak-LR+peak-momentum window from 6% to 13% of training (frac 0.15→0.28), pushing exp_088's proven direction (0.33→0.22 kept Δ=-0.001115) further.
129	108	5	000/005/017/088/108/129	reg	discard	1.077242	+0.000377	Denoising-style input-embedding Gaussian noise (std=0.005) on hidden state only, during training mode; x0 long-range residual stays clean so the network learns to denoise back toward the unperturbed embedding reference.
130	108	5	000/005/017/088/108/130	tok	discard	1.076932	+0.000067	Switch tied tok_emb init from normal_ to trunc_normal_ at ±2σ (PaLM/T5/BLOOM standard): same std=0.005 but clips outliers that force wider GPTQ per-row scales and bias rare-vocab initial directions that barely move in a <1-epoch run.
131	108	5	000/005/017/088/108/131	curr	discard	1.078442	+0.001577	Replace tiled-phase-plus-permutation sequence starts in ShuffledSequenceLoader._reset_shard with fully-random per-sequence uniform starts: same num-sequences per shard epoch, but each sequence gets an independent start anywhere in [0, num_tokens-seq_len-1] instead of phase+k*seq_len — removes per-epoch phase-lock so start-offset coverage is decorrelated across samples.</hypothesis> <parameter name="notes">Prior curr tile-overlap experiments (exp_047 halved stride discard +0.001; exp_025 //4 stride abort) tested deterministic OVERLAPPING tiling. This is different — still ~non-overlapping in expectation (expected overlap per shard ≈ seq_len*num_seq/num_tokens ≈ 2048*24k/50M ≈ 1 span), but each sample's start is independent of the shard's epoch-phase. Distinct from exp_122 (shard-stripe removal) which touched the shard SET per rank. Single 6-line mutation in _reset_shard; size-neutral (code 21.9KB).
132	108	5	000/005/017/088/108/132	loss	discard	1.077189	+0.000324	Confidence penalty (entropy bonus) β=0.003: loss = CE − 0.003·H(p) smooths output distributions for robustness to GPTQ int6 weight noise at eval.
133	108	5	000/005/017/088/108/133	ttt	discard	1.077340	+0.000475	Split TTT SGD into two param groups giving tied tok_emb a 3x LR multiplier.
134	108	5	000/005/017/088/108/134	arch	discard	1.077810	+0.000945	Shift parallel_residual_start 7→9, flipping layers 7,8 from parallel to sequential residual (only final 2 layers stay parallel); sequential residual lets MLP see attn output (more expressive), and reduces the parallel-residual count that exp_107 showed bloats compressed bytes.
135	108	5	000/005/017/088/108/135	quant	discard	1.077165	+0.000300	Per-category GPTQ block_size: 32 for attention projections (c_q/c_k/c_v/c_o), keep 64 for MLP and tok_emb — targets attention's channel-outliers with finer error-propagation granularity while leaving MLP's already-tuned block_size alone.
136	108	5	000/005/017/088/108/136	meta	size_blocked	1.077256		Raise AdamW BETA1 0.9→0.95 on the two AdamW groups (tied tok_emb + scalar control tensors): the remaining unexplored corner of the (BETA1, BETA2) landscape after exp_075 (BETA1↓0.8, discard +0.0013), exp_126 (BETA2↑0.97, discard +0.0003) and exp_091 (BETA2↑0.98, discard +0.0020) all hurt.</hypothesis> <parameter name="notes">Single-literal default change at train_gpt.py:159 (BETA1 0.9→0.95). Size-neutral, compile-safe. Affects optimizer_tok (tied tok_emb ~4.2M sparsely-updated rows benefit from ~14-step vs ~7-step first-moment EMA) and optimizer_scalar (~100 control tensors: qk_gain, attn_scales, skip_weights/gates, LN scales). Does NOT affect Muon (matrix_params in blocks, uses momentum not betas). Canonical Chinchilla/PaLM/Gemma uses (0.9, 0.95); all three neighbor tweaks in the beta plane hurt, so raising BETA1 is the symmetric untried direction.
137	108	5	000/005/017/088/108/137	eval	discard	1.076890	+0.000025	Reduce eval_stride 64→48 (per-scored-token avg context 2015.5→2023.5 tokens, +33% scoring windows) and skip quantized_sliding_window when TTT is enabled (TTT is primary metric; sliding is only the fallback regex) to reclaim the added TTT-scoring cost.
138	108	5	000/005/017/088/108/138	opt	discard	1.077945	+0.001080	Raise Muon peak momentum 0.99→0.995 (untested UP direction; exp_094 tested 0.99→0.97 DOWN and was worse). MuonEq-R row-norm makes orthogonalized update magnitude-invariant, so higher momentum only lengthens effective gradient-history window (~100→~200 steps). Warmdown cool still pulls momentum back to 0.92, so tail refinement unchanged; peak-LR exploration gets wider basin integration.
139	108	5	000/005/017/088/108/139	ttt	discard	1.077871	+0.001006	Mask the first half (positions 0..1023) of each TTT training sequence via ignore_index=-100 so TTT gradient comes only from high-context positions, aligning it with the eval distribution where scored tokens always have >=1984 tokens of context.
140	108	5	000/005/017/088/108/140	meta	size_blocked	1.077318		Raise min_lr 0.0→0.05 to floor the linear warmdown LR at 5% of peak in the final ~3.6% of training, preserving late-training refinement into the EMA tail (half-life ~200 steps under decay=0.9965) — completely untouched knob in 140 trials.
141	108	5	000/005/017/088/108/141	reg	keep	1.076591	-0.000274	Targeted Muon weight-decay hike (muon_wd_recurrent=0.1235, 1.3x muon_wd) on recurrent-segment blocks [loop_start..loop_end] only, since these are traversed (num_loops+1)=3x per forward and receive ~3x more gradient signal per step than non-recurrent blocks — equalizing shrinkage-per-gradient-step is a structurally-motivated split never tried in this tree.
142	108	5	000/005/017/088/108/142	curr	keep	1.076563	-0.000028	Latin-square deterministic phase cycling in ShuffledSequenceLoader: per-shard, cycle through 8 evenly-spaced phase buckets in a random per-shard order, replacing the per-shard-epoch uniform-random phase choice — reduces phase-coverage variance when a shard only gets 1-3 epochs within the 600s budget.
150	142	6	000/005/017/088/108/142/150	arch	discard	1.078499	+0.001936	Add V-norm (F.rms_norm on v over head_dim) symmetric with existing Q/K-norm in CausalSelfAttention.forward: bounds attention-output magnitude independent of V-row outliers, completing the Q/K/V normalization triad (Kimi-K2/Qwen3 style).
151	142	6	000/005/017/088/108/142/151	ttt	keep	1.076291	-0.000272	Enable Nesterov momentum on the TTT SGD optimizer (nesterov=True) so the ~16 SGD steps/chunk lookahead the next-step gradient, giving effectively near-second-order dynamics in this extremely-low-step regime where classical-momentum staleness dominates.
161	151	7	000/005/017/088/108/142/151/161	ttt	discard	1.076620	+0.000529	Add weight_decay=1e-4 to the TTT SGD(Nesterov) optimizer so the L2 pull dampens Nesterov-amplified cumulative drift across ~176 SGD steps (11 chunks × 16 steps), preventing late-chunk divergence without an explicit weight anchor.
162	151	7	000/005/017/088/108/142/151/162	curr	discard	1.077682	+0.001591	Replace exp_142's independent per-shard random 8-bucket permutations with a deterministic bit-reversal order [0,4,2,6,1,5,3,7] offset by shard index (si%8) — low-discrepancy guarantees within-shard (first k visits maximally span phase space) and guaranteed cross-shard coverage at any epoch index.
163	151	7	000/005/017/088/108/142/151/163	opt	discard	1.076237	+0.000146	Cosine-symmetric linear cool of AdamW beta1 0.9→0.8 during LR warmdown (lockstep with lr_scale), on tok_emb + scalar AdamW groups. Mirrors exp_010's winning Muon momentum cool — low-LR tail has lower gradient noise, so tightening first-moment EMA window (~10→~5 steps) tracks refined signal instead of dragging in stale peak-phase momentum. Unlike exp_075 (static beta1=0.8, discarded +0.00127) this preserves beta1=0.9 during peak-LR and only contracts in warmdown; unlike exp_021 (beta2 cool, harness_abort) it targets the first moment which dominates update direction.
164	151	7	000/005/017/088/108/142/151/164	reg	keep	1.076067	-0.000024	Split Muon weight decay by parameter TYPE: keep muon_wd=0.095 on attention matrices, raise to 0.125 (1.32x) on MLP matrices only — MLPs are 2.7× the attention-matrix mass and the dominant overfit risk.
173	164	8	000/005/017/088/108/142/151/164/173	reg	discard	1.076098	+0.000031	Further split Muon attention WD: Q/K projections get 0.125 (match MLP), V + attn.proj stay at muon_wd=0.095. Q/K have RMS-norm post-projection so their weight norms don't drive score magnitude — aggressive WD is cheap directional regularization.
175	164	8	000/005/017/088/108/142/151/164/175	quant	size_blocked	1.075442		Tighten GPTQ matrix_clip_sigmas 12.85→12.5 (halfway toward exp_165's 12.0): finer int6 resolution on ~29M matrix params, isolated without exp_165's lgwin=24 change that pushed bytes over the 16MB cap.
176	164	8	000/005/017/088/108/142/151/164/176	loss	keep	1.075896	-0.000171	Stack exp_156's gentle position-weighted CE (linspace 0.9→1.1, mean-preserving) onto exp_164 (current best, reg-branch split-Muon-WD) — two orthogonal wins (loss shape vs per-group optimizer WD) should combine additively since exp_164 was rooted on a different branch that did not include the position-weight.
186	176	9	000/005/017/088/108/142/151/164/176/186	loss	keep	1.075796	-0.000062	Replace exp_176's linear position-weighted CE with a convex (u^2) ramp: pw = 0.9 + 0.2*u^2 normalized to mean 1.0 — same ~0.2 peak-to-floor range, but concentrates more gradient mass on tail positions (matching stride-64 sliding-window eval) without the sharp-boundary failure mode that sank exp_167's sigmoid variant.
195	186	10	000/005/017/088/108/142/151/164/176/186/195	loss	discard	1.075940	+0.000607	Extend exp_186's winning position-weighted-CE trend (linear → u² → u⁴): replace pw = 0.9 + 0.2·u² with pw = 0.9 + 0.2·u⁴ (mean-preserving), concentrating more gradient mass in the last ~25% of positions aligned with the stride-64 eval zone.
197	186	10	000/005/017/088/108/142/151/164/176/186/197	arch	discard	1.087216	+0.011970	Extend parallel residual into the looped block: parallel_residual_start 7→3 makes layers 3-10 GPT-J-parallel (attn+MLP both read x_in), removing the arbitrary attn→MLP order bias that sequential residual bakes into each of the 3 re-invocations of the shared loop block (layers 3-5).
198	186	10	000/005/017/088/108/142/151/164/176/186/198	reg	discard	1.075691	+0.000445	Post-embed Gaussian noise (σ=0.02) on the main stream during training only — x0 residual injection stays clean so noise doesn't propagate permanently; disabled during TTT to keep its ~16 SGD steps/chunk deterministic. Structurally orthogonal to every Muon-WD-split trial (exp_141/164/187) and distinct from exp_040's catastrophic MLP activation dropout because it regularizes input features, not signal-path activations.
202	186	10	000/005/017/088/108/142/151/164/176/186/202	ttt	discard	1.076230	+0.000984	Double TTT_CHUNK_TOKENS 65536→131072: halves num_chunks (~13→7), doubles data per SGD step (64 seqs global vs 32), halves TTT training events — cleaner per-step gradient signal and less drift.
