exp_id	parent_exp	depth	path	specialist	status	val_bpb	delta_vs_best	hypothesis
730	596	22	000/005/017/088/108/142/151/164/177/196/212/245/267/280/298/324/336/377/475/491/538/596/730	opt	eval_budget_overrun	1.074044		Linearly cool ema_decay 0.9965 to 0.995 in lockstep with lr_scale during warmdown: symmetric DOWN application of the kept Muon-momentum cool pattern to the EMA decay. Untested direction on the EMA-decay axis.
731	596	22	000/005/017/088/108/142/151/164/177/196/212/245/267/280/298/324/336/377/475/491/538/596/731	tok	size_blocked	1.072287		Split-gauge embed_scale on x0 only inside rms_norm; x enters block 0 as plain unit-RMS.
732	596	22	000/005/017/088/108/142/151/164/177/196/212/245/267/280/298/324/336/377/475/491/538/596/732	reg	discard	1.073409	+0.001158	Moderate UP probe embed_wd 0.085 → 0.095 (+11.8%, untested step-size between exp_661's +5.9% discard and too-high); tightens 4.2M-param tied tok_emb → improved int8 GPTQ + brotli compression.
733	596	22	000/005/017/088/108/142/151/164/177/196/212/245/267/280/298/324/336/377/475/491/538/596/733	loss	discard	1.072713	+0.000462	Stack confidence-penalty (Pereyra 2017 with sign reversed) on top of the kept z-loss in the TTT inner CE: add -1e-5*&lt;p,log p&gt;.sum(-1).mean() i.e. +1e-5*H(p) — penalize entropy, encouraging the model to commit confidently to chunk-domain predictions during the ~16-step per-chunk SGD. Mechanism distinct from prior z-loss probes (z-loss controls lse magnitude only; entropy controls distribution shape). UNTRIED on TTT in this tree.
734	596	22	000/005/017/088/108/142/151/164/177/196/212/245/267/280/298/324/336/377/475/491/538/596/734	meta	size_blocked	1.072700		muon_wd attn-only 0.095 to 0.094 fine DOWN midpoint
735	596	22	000/005/017/088/108/142/151/164/177/196/212/245/267/280/298/324/336/377/475/491/538/596/735	eval	discard	1.072784	+0.000533	Chunk-level SWA on TTT weights: maintain EMA (alpha=0.5) of post-training ttt_params; swap EMA into params for scoring pass only, restore trained weights before next chunk's TTT step. Polyak-Ruppert smoothing over the last ~2 chunks' TTT trajectories — structurally distinct from exp_676 (within-chunk tail avg, size_blocked) and exp_667 (forward-lookahead, size_blocked).
736	596	22	000/005/017/088/108/142/151/164/177/196/212/245/267/280/298/324/336/377/475/491/538/596/736	tok	crash			Swap final_norm (parameter-free RMSNorm) to F.layer_norm at the post-trunk gauge-fix site feeding the tied softmax: zero-mean each token's x before F.linear(x, tok_emb.weight) to cancel spurious x-DC × row-sum contributions to logits without touching input-side x0 flow.
737	596	22	000/005/017/088/108/142/151/164/177/196/212/245/267/280/298/324/336/377/475/491/538/596/737	curr	discard	1.073365	+0.001114	Sub-eval-stride jitter [0, 32) within each Latin-square bucket: phase = k*256 + rng.integers(0,32), tighter than exp_154's full-bucket-width jitter (which dilutes LS structure) — 32 = half eval stride 64, giving mod-64 RoPE-position diversity below the inert 256-token grid where shards rarely consume more than phase[0..2] in 600s.
738	596	22	000/005/017/088/108/142/151/164/177/196/212/245/267/280/298/324/336/377/475/491/538/596/738	quant	size_blocked	1.072035		Narrow exp_728's MSE-optimal scale search candidate band from [0.80, 1.25] to [0.95, 1.20]: caps downside scale shrinkage at −5% to preserve brotli-friendly near-zero integer concentration (exp_728 hit val_bpb 1.069841 but blew artifact +1.33MB over cap from 0.80x candidates spreading integer histograms toward uniform high entropy). Upside +20% retained to capture heavy-tail rows.
739	596	22	000/005/017/088/108/142/151/164/177/196/212/245/267/280/298/324/336/377/475/491/538/596/739	arch	size_blocked	1.075220		Learnable per-head XSA strength [num_heads=8] init=1.0 per attention layer: replaces the hardcoded full-subtraction of V-direction inside _xsa_efficient with a scalar-per-head coefficient, letting each head independently learn how much exclusive-self-attention to apply. Step-0 identical to exp_538/596 (init=1.0 reproduces exact current XSA), structurally distinct from prior XSA trials (exp_178/215/268) which all treated strength as binary on/off per layer.
740	596	22	000/005/017/088/108/142/151/164/177/196/212/245/267/280/298/324/336/377/475/491/538/596/740	opt	discard	1.072599	+0.000348	One-event EMA half-blend at warmdown entry: ema_state ← 0.5*ema_state + 0.5*current_weights at the first step where lr_scale<1.0, then EMA continues normally with ema_decay=0.9965.
741	596	22	000/005/017/088/108/142/151/164/177/196/212/245/267/280/298/324/336/377/475/491/538/596/741	ttt	size_blocked	1.072678		Add Pereyra-style confidence penalty (2e-4 * Σp·log p) to TTT inner CE atop existing z-loss: regularizes output distribution toward higher entropy per step, discouraging over-confident chunk-local memorization while z-loss bounds logit magnitudes.
742	596	22	000/005/017/088/108/142/151/164/177/196/212/245/267/280/298/324/336/377/475/491/538/596/742	loss	size_blocked	1.072778		Replace TTT inner-CE z-loss `1e-5 * logsumexp(_lf,-1).pow(2).mean()` with `1e-5 * _lf.amax(-1).pow(2).mean()` — penalize peak logit rather than full log-partition. Mechanism-distinct from all 7 prior z-loss variants (L2/L1/var/anchor=logV/hinge/tail-PW/×2/÷2): max-logit constrains only the dominant mode, leaving tail mass unconstrained, vs lse which mixes peak + diversity-correction. For peaked predictions amax≈lse; for flatter ones lse>amax, so this loosens regularization on TTT positions where the model is genuinely uncertain — matches the intuition that TTT's per-chunk SGD should adapt freely on hard tokens but be stabilized on easy ones.
743	596	22	000/005/017/088/108/142/151/164/177/196/212/245/267/280/298/324/336/377/475/491/538/596/743	reg	size_blocked	1.087875		Gradient-noise injection (Neelakantan 2015) on scalar AdamW control params: σ=1e-3*lr_scale randn added to grads pre-clip — noise vanishes during warmdown.
744	596	22	000/005/017/088/108/142/151/164/177/196/212/245/267/280/298/324/336/377/475/491/538/596/744	meta	discard	1.073223	+0.000972	Lower Muon-momentum warmdown blend floor 0.25 to 0.20 (gentle DOWN -20%): exp_324's kept UP probe (0 to 0.25) and subsequent UP probes (0.28, 0.30, 0.35 all size_blocked at improved bpb) leave the DOWN side completely untested. Under z-loss regime late warmdown gradients are already smoother so heavy direction averaging is partly superseded.</hypothesis> <parameter name="notes">Single-literal change at line 1484 (mm_blend = max(lr_scale, 0.25) to max(lr_scale, 0.20)) plus comment update. Code +13 bytes, zero new params. Floor=0.20 means deepest warmdown momentum = 0.20*0.99+0.80*0.92 = 0.934 vs 0.9375 baseline; momentum-floor regime engaged in last ~12% of training instead of ~18%. UP-side asymmetry signal: 0.28/0.30/0.35 all size_blocked at improved bpb (1.072581 / 1.072734 / 1.074645 measured at trial-time best), suggesting UP direction wins on bpb but trips byte budget. DOWN should be size-neutral or size-saving (less momentum integration -> less weight drift). Risk: low - single-literal, zero compile-graph or quant-path impact.
745	596	22	000/005/017/088/108/142/151/164/177/196/212/245/267/280/298/324/336/377/475/491/538/596/745	tok	discard	1.073024	+0.000773	Replace parameter-free RMSNorm final_norm with parameter-free nn.LayerNorm(elementwise_affine=False) feeding tied softmax: zero-mean each token's x before F.linear(x, tok_emb.weight) to cancel spurious x-DC * tok_emb.row-sum contributions to logits. Preserves the GPTQ Hessian forward-hook site (which attaches to self.final_norm).
746	596	22	000/005/017/088/108/142/151/164/177/196/212/245/267/280/298/324/336/377/475/491/538/596/746	eval	keep	1.072246	-0.000005	Stack exp_592's Gradient Centralization (zero-mean per-row gradient on 2D+ ttt_params) onto current best exp_596 (TTT z-loss): two parallel-sibling kept eval/loss edits forked from exp_538 that have never been combined — GC corrects gradient direction, z-loss damps logsumexp magnitude, mechanisms are orthogonal.
756	746	23	000/005/017/088/108/142/151/164/177/196/212/245/267/280/298/324/336/377/475/491/538/596/746/756	eval	discard	1.073194	+0.000984	Intra-chunk weight averaging across the 4 TTT epochs: accumulate post-step ttt_params after each epoch's SGD step into _avg_buf, replace ttt_params with the per-epoch mean at the end of each chunk's training. With chunk_seqs=32/world=8/batch=32 (1 step per epoch × 4 epochs/chunk), Nesterov-momentum-compounded trajectories overshoot; averaging the 4 weight snapshots ≈ trajectory midpoint (~62% of full drift), reducing per-chunk overshoot persistently before next chunk's score-first pass. Distinct from exp_588 (momentum buffer halving), exp_735 (cross-chunk EMA, α=0.5), exp_676 (size_blocked tail-avg on single-batch last epoch = no-op).
758	746	23	000/005/017/088/108/142/151/164/177/196/212/245/267/280/298/324/336/377/475/491/538/596/746/758	curr	size_blocked	1.074290		Per-shard independent PCG64([rank,si]) streams for sequence_order in _reset_shard, decoupling within-shard permutation from the shared self.rng chain that also services phase_order draws and shard_plan shuffles — gives each shard a stable replicable permutation history regardless of cross-shard rng activity.
747	596	22	000/005/017/088/108/142/151/164/177/196/212/245/267/280/298/324/336/377/475/491/538/596/747	quant	size_blocked	1.072627		Post-GPTQ closed-form per-row scale refit: replace heuristic s with ALS-optimal per-row s after inner loop. Size-neutral; codes Q untouched.
748	596	22	000/005/017/088/108/142/151/164/177/196/212/245/267/280/298/324/336/377/475/491/538/596/748	curr	size_blocked	1.073537		Eval-stride-aligned overlap (stride = seq_len - 64 = 1984): each token sees both a shallow-context view (<64 positions of context) and a deep-context view (>=1984 positions) per shard-epoch, mirroring eval's stride-64 sliding-window scoring distribution at only ~3% redundancy.
749	596	22	000/005/017/088/108/142/151/164/177/196/212/245/267/280/298/324/336/377/475/491/538/596/749	arch	size_blocked	1.072789		Per-KV-head data-dependent V-magnitude gate [Hkv=4, W_v=4] zero-init applied right after c_v projection — mechanism-distinct from exp_538 attn_out_gate (post-attn, per-OUTPUT-head) and prior V-modifications (exp_330 static V-gain, exp_597 additive V-bias, V-norm).
750	596	22	000/005/017/088/108/142/151/164/177/196/212/245/267/280/298/324/336/377/475/491/538/596/750	opt	keep	1.072210	-0.000036	Decouple Muon momentum warmdown cool target from warmup_start: hard-code 0.93 on the mm_blend cool line, leaving warmup ramp at 0.92.
759	750	23	000/005/017/088/108/142/151/164/177/196/212/245/267/280/298/324/336/377/475/491/538/596/750/759	opt	discard	1.072612	+0.000402	Per-group Muon momentum cool target — attn (group 0) keeps 0.93 (kept exp_750), mlp (group 1) deepens slightly to 0.94: MLP matrices carry ~16× the parameters of attention matrices and dominate GPTQ int6 fit, so modestly smoother momentum tail reduces per-step weight noise without crossing into 0.95-globally-hurts territory (exp_251 +0.000234).
760	750	23	000/005/017/088/108/142/151/164/177/196/212/245/267/280/298/324/336/377/475/491/538/596/750/760	meta	size_blocked	1.072797		Per-group BETA2 split on optimizer_tok (tied tok_emb): lower beta2 0.95 to 0.93 at L908 only, leaving optimizer_scalar at 0.93 already. Untested DOWN direction on tok_emb-specific beta2 axis, mechanism-distinct from exp_755 failed scalar-group split (sparse rare-row gradients vs dense control-tensor gradients).
761	750	23	000/005/017/088/108/142/151/164/177/196/212/245/267/280/298/324/336/377/475/491/538/596/750/761	reg	size_blocked	1.072514		Per-(chunk,epoch) random shuffle of TTT inner-loop batch start indices via seeded torch.Generator: replaces sequential scan with deterministic permutation, creating 4 distinct gradient trajectories per chunk to decorrelate batch order from token-position semantics — canonical SGD regularizer never tried in current best lineage (exp_264's fwd/rev alternation is on a sibling branch, not present in exp_750).
762	750	23	000/005/017/088/108/142/151/164/177/196/212/245/267/280/298/324/336/377/475/491/538/596/750/762	eval	size_blocked	1.072392		Symmetric (doubly-centered) Gradient Centralization on TTT SGD: subtract BOTH per-row mean AND per-column mean from each 2D+ ttt_param gradient before clip+step. exp_592's per-row GC alone gave −0.000300, and stacking with z-loss (exp_746) was kept at −0.000005 — symmetric form removes the column-mean component still present after row-GC, projecting gradients onto a strictly more constrained mean-zero subspace. Untried structural variant; same compute cost as exp_592's GC.
763	750	23	000/005/017/088/108/142/151/164/177/196/212/245/267/280/298/324/336/377/475/491/538/596/750/763	ttt	size_blocked	1.072280		Mean-preserving front-loaded z-loss schedule across 4 TTT epochs.
764	750	23	000/005/017/088/108/142/151/164/177/196/212/245/267/280/298/324/336/377/475/491/538/596/750/764	curr	size_blocked	1.073102		Replace random self.rng.shuffle(shard_plan) with deterministic Bresenham largest-error interleave: each batch position picks the shard with greatest accumulated quota credit, then debits by batch_size. Provably maximizes within-batch shard spread (zero clustering variance) while preserving exp_196's largest-remainder quota totals. Distinct mechanism from exp_571 (no-shuffle, kept grouped → discard) and from all phase/permutation variants.
765	750	23	000/005/017/088/108/142/151/164/177/196/212/245/267/280/298/324/336/377/475/491/538/596/750/765	loss	size_blocked	1.072457		Gate kept exp_596 TTT z-loss to epochs>=1 only.
766	750	23	000/005/017/088/108/142/151/164/177/196/212/245/267/280/298/324/336/377/475/491/538/596/750/766	tok	size_blocked	1.075950		WARP-inspired word-start additive bias [embedding_dim=512, init=0] applied to tok_emb output ONLY on tokens whose SentencePiece begins with leading space (word boundary), gated via a non-persistent has_leading_space LUT registered in GPT.__init__. Structurally orthogonal to the existing multiplicative gauge-fixed embed_scale.
767	750	23	000/005/017/088/108/142/151/164/177/196/212/245/267/280/298/324/336/377/475/491/538/596/750/767	quant	discard	1.072636	+0.000426	Eval-aligned position weighting on GPTQ Hessian: weight last-64 calibration positions by 10x to align H with sliding-eval scoring concentration (stride=64 means ~99% of scored tokens at positions 1984-2047).
768	750	23	000/005/017/088/108/142/151/164/177/196/212/245/267/280/298/324/336/377/475/491/538/596/750/768	arch	size_blocked	1.076752		Block-major depth recurrence: loop order [3,3,3,4,4,4,5,5,5] instead of [3,4,5,3,4,5,3,4,5] — each looped block does 3-step fixed-point iteration on its own input.
769	750	23	000/005/017/088/108/142/151/164/177/196/212/245/267/280/298/324/336/377/475/491/538/596/750/769	ttt	size_blocked	1.073654		Re-introduce exp_588's TTT chunk-boundary momentum_buffer halving (mb.mul_(0.5) for ci>0): proven Δ=-0.000727 at exp_538 baseline but lost from lineage when exp_596 forked from exp_538 instead of exp_588. Golfed to ~120 bytes inside eval_val_ttt cosine-LR block.
770	750	23	000/005/017/088/108/142/151/164/177/196/212/245/267/280/298/324/336/377/475/491/538/596/750/770	opt	discard	1.076457	+0.004247	Anchor Muon weight_decay shrinkage during warmdown by setting wd_dyn = wd / max(lr_scale, 0.5) per step.
771	750	23	000/005/017/088/108/142/151/164/177/196/212/245/267/280/298/324/336/377/475/491/538/596/750/771	loss	discard	1.073297	+0.001087	Replace TTT-only z-loss L2 form (1e-5*logsumexp.pow(2).mean) with L1 form (1e-4*logsumexp.mean) on epochs>=1 — same kept gating, structurally different penalty: L1 has uniform per-position gradient magnitude whereas L2 scales with lse value (over-correcting outlier positions); coefficient recalibrated to match average gradient magnitude at typical lse≈9 (2λ_L2·lse ≈ λ_L1).
772	750	23	000/005/017/088/108/142/151/164/177/196/212/245/267/280/298/324/336/377/475/491/538/596/750/772	eval	size_blocked	1.072482		Score-phase logit softening (mult 0.99, T=1.0101) on BOTH eval_val_sliding and eval_val_ttt score-phase NLL only. TTT inner-loop loss untouched.
773	750	23	000/005/017/088/108/142/151/164/177/196/212/245/267/280/298/324/336/377/475/491/538/596/750/773	reg	size_blocked	1.073251		Lower muon_wd_mlp 0.115 → 0.108 (-6.1% DOWN extension probe of exp_336's kept -8% DOWN move on this knob): single literal at line 168, the only WD-axis with a recently kept DOWN direction in the current best lineage
774	750	23	000/005/017/088/108/142/151/164/177/196/212/245/267/280/298/324/336/377/475/491/538/596/750/774	curr	discard	1.073200	+0.000990	Change Latin-square phase bucket count 8 to 11 (prime, coprime with seq_len=2048).
775	750	23	000/005/017/088/108/142/151/164/177/196/212/245/267/280/298/324/336/377/475/491/538/596/750/775	tok	discard	1.075152	+0.002942	Tied-symmetric gauge — reuse input-side embed_scale [512] at the tied LM head readout via F.linear(x * embed_scale, tok_emb.weight), with NO extra rms_norm wrapper (distinct from exp_677 size_blocked, exp_721 size_blocked) and applied to the working stream x not x0 (distinct from exp_711 eval_budget_overrun).
776	750	23	000/005/017/088/108/142/151/164/177/196/212/245/267/280/298/324/336/377/475/491/538/596/750/776	meta	size_blocked	1.073412		Raise mm_blend floor 0.25→0.27 — untested midpoint between current best floor=0.25 kept and exp_562 floor=0.28 size_blocked at improved bpb 1.072734. Single-char edit at L1484, byte-neutral.
777	750	23	000/005/017/088/108/142/151/164/177/196/212/245/267/280/298/324/336/377/475/491/538/596/750/777	quant	eval_budget_overrun	1.072454		Fisher-weighted GPTQ Hessian: weight per-token x⊗x by ||∂L/∂y_t||² (output-side gradient norm) on attn/mlp linears, mean-normalized per-batch so total H mass matches baseline.
778	750	23	000/005/017/088/108/142/151/164/177/196/212/245/267/280/298/324/336/377/475/491/538/596/750/778	arch	size_blocked	1.072971		Per-pass loop offset: single learnable [model_dim] vector (zero-init), modulated by hard-coded linear-ramp pass scalar (0, 0.5, 1.0) and added to residual at entry to each call of looped blocks 3-5; breaks translational symmetry of the 3 identical recurrence passes via PR1518-style additive feature-level offset, byte-cheap (one [512] param vs num_loops+1 vectors).
779	750	23	000/005/017/088/108/142/151/164/177/196/212/245/267/280/298/324/336/377/475/491/538/596/750/779	opt	size_blocked	1.073478		Per-group Muon mm_blend SHAPE split: attn (g0) uses sqrt-with-floor (max(lr_scale**0.5, 0.25)), mlp (g1) keeps linear-with-floor (max(lr_scale, 0.25)); shared floor=0.25 and cool target=0.93.
780	750	23	000/005/017/088/108/142/151/164/177/196/212/245/267/280/298/324/336/377/475/491/538/596/750/780	ttt	size_blocked	1.073582		Leaky-anchor pull-back at TTT chunk boundary lerp params 0.5pct toward post-quant initial weights after each chunk SGD epochs.
781	750	23	000/005/017/088/108/142/151/164/177/196/212/245/267/280/298/324/336/377/475/491/538/596/750/781	tok	discard	1.074700	+0.002490	Add untied per-feature output head_scale [embedding_dim, init=1.0] applied AFTER final_norm at tied LM head readout — asymmetric/untied analog of discarded exp_775 symmetric gauge, giving model independent DoF to weight features for logit production vs input encoding.
782	750	23	000/005/017/088/108/142/151/164/177/196/212/245/267/280/298/324/336/377/475/491/538/596/750/782	eval	size_blocked	1.073617		Freeze the 3 looped blocks (loop_start..loop_end = 3..5) during eval-time TTT SGD, so adaptation only updates non-looped blocks (0,1,2,6..10) + tok_emb/heads — equalizes gradient amplification asymmetry (looped blocks see num_loops+1=3× forward passes per step, hence 3× gradient).
783	750	23	000/005/017/088/108/142/151/164/177/196/212/245/267/280/298/324/336/377/475/491/538/596/750/783	curr	size_blocked	1.073100		Mean-preserving token-id-stratified train CE: w=0.9+0.2*(target_id/8191) probes Gap 5 rare-token upweight at 2x magnitude vs exp_518's 0.10 ramp.
784	750	23	000/005/017/088/108/142/151/164/177/196/212/245/267/280/298/324/336/377/475/491/538/596/750/784	loss	discard	1.073470	+0.001260	Replace TTT-only z-loss L2 form (1e-5*logsumexp^2.mean) with L4 form (6e-8*logsumexp^4.mean) — coef tuned to match L2's typical gradient magnitude at logsumexp~9; L4 penalizes outlier high-partition positions more aggressively than L2 while leaving low-logsumexp positions nearly untouched. Untested neighbor on z-loss-norm axis (L1 exp_771 discard, L2 exp_596 keep, variance exp_675 size_blocked); byte-neutral 1-char swap.
785	750	23	000/005/017/088/108/142/151/164/177/196/212/245/267/280/298/324/336/377/475/491/538/596/750/785	meta	size_blocked	1.073114		grad_clip_norm 0.3→0.28 — untested gentle DOWN midpoint between current 0.3 and exp_525's size_blocked-at-improvement 0.25, consistent with the axis's DOWN-favoring asymmetry (0.4 UP discard +0.000340 vs 0.2 DOWN discard +0.000124, 0.25 DOWN size_blocked at bpb 1.074731 = trial-time improvement).
786	750	23	000/005/017/088/108/142/151/164/177/196/212/245/267/280/298/324/336/377/475/491/538/596/750/786	reg	size_blocked	1.072267		Tighten TTT inner-loop grad_clip_norm 1.0 → 0.8: untested middle-DOWN probe between exp_244/180/351 (1.0→0.5, over-tight, all discards) and exp_101 (1.0→2.0, eval_budget_overrun). With exp_596 z-loss softening inner CE gradients and Nesterov+mu=0.9 amplifying outliers, a 20% tighter cap should stabilize early-chunk trajectories without the over-constraining that hurt prior 0.5 probes.
787	750	23	000/005/017/088/108/142/151/164/177/196/212/245/267/280/298/324/336/377/475/491/538/596/750/787	quant	size_blocked	1.071334		Narrow AWQ-style per-row scale-grid refinement (alpha in {0.95, 1.0, 1.05}) before GPTQ inner loop, picking alpha minimizing H-diag-weighted RTN error per row.
