exp_id	parent_exp	depth	path	specialist	status	val_bpb	delta_vs_best	hypothesis
601	592	22	000/005/017/088/108/142/151/164/177/196/212/245/267/280/298/324/336/377/475/491/538/592/601	eval	size_blocked	1.073494		Stack exp_588's TTT momentum_buffer halving at chunk boundaries onto current best exp_592 (Gradient Centralization on TTT SGD): two parallel-sibling TTT-SGD-state edits that have never been combined.
602	592	22	000/005/017/088/108/142/151/164/177/196/212/245/267/280/298/324/336/377/475/491/538/592/602	tok	discard	1.075750	+0.003499	Zero-init SP control-token rows (tok_emb[0:3]) after nn.init.normal_: IDs 0/1/2 = unk/BOS/EOS have base_bytes=0 in the BPB LUT so their output predictions contribute zero to val_bpb; zero rows compress near-optimally under GPTQ-int6+brotli-11 if they stay near zero post-training.
604	592	22	000/005/017/088/108/142/151/164/177/196/212/245/267/280/298/324/336/377/475/491/538/592/604	quant	discard	1.073160	+0.000909	Post-Cholesky GPTQ error-feedback damping β=0.9: scale the propagated residual err by 0.9 after computing it, dampening cross-column compensation magnitude without changing rounding/scale. Soft-OBS interpolation between β=1 (full OBS-GPTQ) and β=0 (RTN).
593	538	21	000/005/017/088/108/142/151/164/177/196/212/245/267/280/298/324/336/377/475/491/538/593	tok	size_blocked	1.074356		Variance-matched uniform_ init for tied tok_emb (bound=std*sqrt(3)): flat Uniform over [-0.00866,+0.00866], same per-coord variance as N(0,0.005) but zero Gaussian tails. Structurally distinct from all prior init variants in tree.</hypothesis> <parameter name="notes">Single-site edit in GPT._init_weights: nn.init.normal_ -> uniform_ with bound=std*sqrt(3). Zero new params. Code 26223->26568 B.
594	538	21	000/005/017/088/108/142/151/164/177/196/212/245/267/280/298/324/336/377/475/491/538/594	quant	size_blocked	1.072941		FreqGPTQ Hessian: top-100 freq tokens get sqrt(2.0) activation boost.
595	538	21	000/005/017/088/108/142/151/164/177/196/212/245/267/280/298/324/336/377/475/491/538/595	opt	size_blocked	1.072548		Raise Muon-momentum warmdown-blend floor 0.25→0.27 with adjacent comment trim (-303 pack bytes): interpolates between kept 0.25 (exp_324) and size_blocked-with-improvement probes exp_562@0.28 (bpb=1.072734) and exp_555@0.30 (bpb=1.072581).</hypothesis> <parameter name="notes">Two-part edit: (1) mm_blend floor 0.25→0.27 in step_fn (byte-equal literal); (2) trim 8-line comment block above to 2 lines (pack: 26223→25920). exp_562 and exp_555 both hit below-best bpb but size_blocked; 0.27 is the less-drifted midpoint intended to land a fitting variant that captures part of the floor-raise signal.</parameter> </invoke>
596	538	21	000/005/017/088/108/142/151/164/177/196/212/245/267/280/298/324/336/377/475/491/538/596	loss	keep	1.072251	-0.000188	Retry exp_587 TTT-only z-loss (lambda=1e-5 * logsumexp^2 on eval_val_ttt inner CE) which measured val_bpb=1.072431 (-0.001035 vs best) but artifact_bytes=16002056 (2056B over cap). Same loss edit; paired with ~2987 bytes of verbose historical-context comment trims to bank headroom.
606	596	22	000/005/017/088/108/142/151/164/177/196/212/245/267/280/298/324/336/377/475/491/538/596/606	loss	eval_budget_overrun	1.072893		Double TTT inner-CE z-loss coefficient 1e-5 → 2e-5: first principled coefficient tune on the z-loss axis (exp_587/exp_596 established λ=1e-5 kept but λ itself never swept), 1-char artifact-neutral edit on the kept winning form.
607	596	22	000/005/017/088/108/142/151/164/177/196/212/245/267/280/298/324/336/377/475/491/538/596/607	ttt	discard	1.072613	+0.000362	Re-introduce exp_588's SGD momentum_buffer.mul_(0.5) at TTT chunk boundaries on top of exp_596's z-loss. Exp_596's byte-banking trim dropped exp_588's kept mechanism (Δ=-0.000727); re-adding it stacks two orthogonal wins (chunk-boundary momentum attenuation vs per-step logit regularizer).</hypothesis> <parameter name="notes">Single 5-line block re-inserted in eval_val_ttt between LR update and seq range. +110 code bytes (23296→23406 packed); exp_596 banked ~3KB via comment trim specifically to make room for additions. Mechanisms are orthogonal: z-loss shapes the inner CE surface per-step; mb.mul_(0.5) attenuates stale cross-chunk velocity. If strictly additive, expect ~1.072251 - 0.0005 ≈ 1.0718; if partially redundant, still ≥ 1.0720. Minimal downside: re-applies a previously kept mechanism on a different (now-z-loss-modified) gradient surface, and the halving is a well-probed 0.5 (exp_588) not the unvalidated 0.3/0.0.
608	596	22	000/005/017/088/108/142/151/164/177/196/212/245/267/280/298/324/336/377/475/491/538/596/608	arch	size_blocked	1.073705		Convert per-block ln_scale_factor from a static Python float to a 0-d learnable nn.Parameter (init unchanged: 1/sqrt(layer_idx+1) base × 1/sqrt(num_loops+1) for looped blocks). Each block can now learn its own pre-norm input damping — controls softmax temperature on the attn path and signal magnitude on the MLP path, structurally distinct from per-feature attn_scale/mlp_scale (which act on outputs).
609	596	22	000/005/017/088/108/142/151/164/177/196/212/245/267/280/298/324/336/377/475/491/538/596/609	reg	discard	1.073336	+0.001085	Lower muon_wd 0.095 to 0.093: gentle DOWN probe on attn Muon WD sub-group of exp_164 type-split.
610	596	22	000/005/017/088/108/142/151/164/177/196/212/245/267/280/298/324/336/377/475/491/538/596/610	meta	size_blocked	1.073264		muon_momentum_warmup_fraction 0.22 → 0.23 (+4.5% finer UP probe): exp_515 at +13.6% (0.22→0.25) hurt only +0.000114 vs exp_542 at -9% (0.22→0.20) size_blocked at +0.000599, suggesting asymmetric curvature with optimum at or just above 0.22; 0.23 is the untested gentle UP mid-point.
611	596	22	000/005/017/088/108/142/151/164/177/196/212/245/267/280/298/324/336/377/475/491/538/596/611	eval	eval_budget_overrun	1.072728		Replace global TTT grad-clip_norm=1.0 with per-parameter Adaptive Gradient Clipping (AGC, Brock 2021): clip each weight-matrix grad norm to 0.01*||p||. Keeps exp_592 GC in place; AGC adapts the cap to each layer's scale instead of coupling all layers under one global norm budget.
612	596	22	000/005/017/088/108/142/151/164/177/196/212/245/267/280/298/324/336/377/475/491/538/596/612	curr	size_blocked	1.073358		Decouple _phase_order from self.rng stream: seed each shard's 8-phase permutation with a dedicated PCG64([rank, si]) stream instead of consuming 12 shared-rng draws at __init__, leaving self.rng in a fresher state when sequence_order and shard_plan shuffles fire.
613	596	22	000/005/017/088/108/142/151/164/177/196/212/245/267/280/298/324/336/377/475/491/538/596/613	quant	size_blocked	1.072692		Value-based selective GPTQ multiplicative damping: baseline 1.01x on all H-diag cols (winning exp_377 factor), plus extra +0.01 only on top-20% H-diag quantile sink cols. Novel axis vs exp_290 position-ramp (discard), exp_301/397 per-layer routing, exp_421 low-H floor. Theory: Hinv amplification concentrates on high-H cols, so extra ridge there without over-damping bulk reduces compounding error.</hypothesis> <parameter name="notes">Two-line edit in gptq_quantize_weight replacing H.diagonal().mul_(1.01) with hd=H.diagonal(); hd.mul_(1.01+0.01*(hd>=hd.quantile(0.8)).to(hd.dtype)). Factor 1.01 on 80% cols, 1.02 on top-20% (max matches exp_280 kept). Code +232 B. Comparable damping-scalar trials (exp_280/348/377) all produced valid runs.
614	596	22	000/005/017/088/108/142/151/164/177/196/212/245/267/280/298/324/336/377/475/491/538/596/614	loss	discard	1.123258	+0.051007	Byte-weight the TTT inner-loop CE: replace uniform F.cross_entropy(_lf,y) with weighted mean (_c*_w).sum()/_w.sum() where _w=val_data.base_bytes_lut[y].float(). Aligns TTT gradient with BPB metric (bits-per-byte) — long-byte tokens dominate BPB and now receive proportionally more TTT signal. Z-loss 1e-5 unchanged.
615	596	22	000/005/017/088/108/142/151/164/177/196/212/245/267/280/298/324/336/377/475/491/538/596/615	opt	discard	1.072872	+0.000621	Raise muon_momentum_warmup_start 0.92→0.93 atop current best (exp_596 loss z-loss): re-probe of exp_585's size_blocked win (bpb=1.072774 before TTT z-loss joined baseline) — now that loss-domain change shifted weight trajectory, 0.93's post-GPTQ/brotli compressibility may fit.
616	596	22	000/005/017/088/108/142/151/164/177/196/212/245/267/280/298/324/336/377/475/491/538/596/616	tok	size_blocked	1.072405		Column-DC subtraction on tok_emb before GPTQ: compute col_mean (shape [D=512]) of tok_emb.weight, subtract from all rows, run GPTQ on the centered tensor, store col_mean as fp16 passthrough, add back at dequantize. Since the GPTQ activation-Hessian is invariant under row-wise constant shift, the optimization target is unchanged, but per-row std of the centered tensor shrinks when tok_emb has a non-trivial DC direction (typical post-training), giving better int8 grid utilization and more-peaked-at-zero q codes for brotli.
617	596	22	000/005/017/088/108/142/151/164/177/196/212/245/267/280/298/324/336/377/475/491/538/596/617	ttt	size_blocked	1.072628		SGLD-style Langevin gradient noise injection in TTT SGD: per-rank Gaussian noise (alpha=cos_lr*0.01) added to grad BEFORE the DDP all_reduce so noise averages /sqrt(8) across ranks (DDP stays sync'd) while contributing ~11% noise/signal to weight updates at peak LR; scales to 0 at last chunk in lockstep with cosine schedule.
618	596	22	000/005/017/088/108/142/151/164/177/196/212/245/267/280/298/324/336/377/475/491/538/596/618	arch	size_blocked	1.073518		Add per-head additive bias to attn_out_gate pre-activation: gate = 2*sigmoid(F.linear(x[:,:,:12], gate_w, gate_b)) with gate_b shape [H=8] zero-init. Gives each head a learnable DC shift of its default gate level (transparent at init), distinct DOF from the weight term because sigmoid is non-linear. Untested axis atop exp_538 kept (attn_out_gate_w only).
619	596	22	000/005/017/088/108/142/151/164/177/196/212/245/267/280/298/324/336/377/475/491/538/596/619	reg	discard	1.073855	+0.001604	Split TTT SGD LR by parameter role: zero-init projection matrices (.attn.proj,.mlp.proj) get 0.5x ttt_lr; feature-creating matrices (c_q/c_k/c_v/mlp.fc/tok_emb) keep full ttt_lr. Damps residual-drift on zero-init residual writers across TTT chunks; first TTT LR split by role in this tree.
620	596	22	000/005/017/088/108/142/151/164/177/196/212/245/267/280/298/324/336/377/475/491/538/596/620	meta	size_blocked	1.072649		muon_momentum_warmup_fraction 0.22→0.21 (gentle -4.5% DOWN probe, untested midpoint): z-loss regime (exp_596) makes UP side hurt more (exp_610 0.23 size_blocked at 1.073264 = +0.001013 vs best) than pre-z-loss regime (exp_515 0.25 discard +0.000114), suggesting optimum may have shifted DOWN under z-loss's softer TTT gradient.
621	596	22	000/005/017/088/108/142/151/164/177/196/212/245/267/280/298/324/336/377/475/491/538/596/621	quant	discard	1.073563	+0.001312	Hybrid mul+add GPTQ H damping H_ii ← 1.005·H_ii + 0.005·mean(H): mean-damping identical to exp_377's 1.01× but redistributes ridge from high-H cols (preserves curvature) toward low-H cols (caps 1/Hinv blow-up) without exp_421's hard-floor discontinuity.</hypothesis> <parameter name="notes">Single-site edit at gptq_quantize_weight (line 1023). Before: H.diagonal().mul_(1.01). After: hd=H.diagonal(); mean_hd=hd.mean(); hd.mul_(1.005).add_(0.005*mean_hd). At H_ii=mean effective damping identical to exp_377 (1.01·mean). At H_ii=10·mean: 10.055m vs 10.1m (less over-damping of curvature-rich cols). At H_ii=0.01·mean: 0.015m vs 0.0101m (~49% larger ridge stabilizes Hinv[j,j]=1/d on extreme low-H tail). Mean-damp invariant should hold Q histogram near baseline so brotli size stays under cap — distinguishes from pure 1.005 that size_blocked (exp_387/477/497). Distinct from exp_421 hard min-clamp 1e-2·mean (discard +0.000338): no threshold, soft additive at zero mean-damp shift.</parameter> </invoke>
622	596	22	000/005/017/088/108/142/151/164/177/196/212/245/267/280/298/324/336/377/475/491/538/596/622	loss	discard	1.073702	+0.001451	Apply exp_186's u² position-weighted CE (pw=0.9+0.2*u², mean-preserving) to the TTT inner-loop cross-entropy, keeping the z-loss term intact. Aligns TTT per-chunk SGD gradients with the stride-64 eval scoring region (late positions weighted ~22% higher). Distinct from exp_156/186/195/226/236/256 which all applied PW to main-train CE; TTT-inner-loop CE has never been position-weighted despite TTT being the direct adaptation channel to the eval distribution.
623	596	22	000/005/017/088/108/142/151/164/177/196/212/245/267/280/298/324/336/377/475/491/538/596/623	eval	discard	1.072749	+0.000498	Laplace-smoothed TTT scoring NLL with eps 1e-4 caps outlier NLL tail.
624	596	22	000/005/017/088/108/142/151/164/177/196/212/245/267/280/298/324/336/377/475/491/538/596/624	curr	size_blocked	1.074117		Input-token noise injection at p=0.005 in ShuffledSequenceLoader (training only; calib_loader overridden to 0): replace ~1 in 200 input tokens with uniform-random vocab IDs (0..8191) just before next_batch returns. Targets y unchanged (standard NLM denoising regularization). Novel axis — no prior trial in our curriculum tree probed input-level augmentation/noise; exp_518 tried token-ID-stratified CE weight (size_blocked) but that was a loss-side intervention, not input perturbation.
625	596	22	000/005/017/088/108/142/151/164/177/196/212/245/267/280/298/324/336/377/475/491/538/596/625	opt	discard	1.076289	+0.004038	Add a brief linear main-LR warmup over the first 2% of the budget (lr_scale = min(frac*50, 1.0)) — untouched across ~620 trials; stack relied on NS spectral bound + grad_clip=0.3 alone to tame cold-Adam / cold-momentum early steps. Expected mild trajectory shift may tighten first ~10 steps and improve GPTQ int6 compressibility.</hypothesis> <parameter name="notes">lr_mul now returns min(frac * 50, 1.0) during the pre-warmdown phase instead of a flat 1.0. Warmup completes at frac=0.02 (~12s / ~6-10 real training steps on a 600s budget), before the momentum ramp (frac=0.22) and far before warmdown (frac=0.28); the peak-LR x peak-momentum window is preserved. mm_blend=max(lr_scale,0.25) clamps Muon momentum-floor interaction at small lr_scale so muon_momentum stays at 0.92 through the warmup. Code +9 bytes (23296-&gt;23305); ~490 B model-bytes headroom remains under exp_596's observed 16 MB margin. Risk: trajectory shift may perturb post-GPTQ+brotli size.</parameter> </invoke>
626	596	22	000/005/017/088/108/142/151/164/177/196/212/245/267/280/298/324/336/377/475/491/538/596/626	tok	discard	1.072631	+0.000380	test
627	596	22	000/005/017/088/108/142/151/164/177/196/212/245/267/280/298/324/336/377/475/491/538/596/627	ttt	size_blocked	1.072492		Stack Gradient Centralization (exp_592 mechanism: zero-mean each 2D+ gradient along all non-output-row dims) on top of exp_596's TTT-only z-loss. GC and z-loss are siblings of exp_538 (both kept independently: -0.000300 and -0.000188 respectively) but never combined. GC projects each weight-matrix gradient onto the row-mean-zero subspace; z-loss regularizes logit log-partition. Four-line insert between DDP all_reduce and clip_grad_norm; +64 code bytes.</hypothesis> <parameter name="notes">Edit at eval_val_ttt line ~1406: 4-line GC block inserted after dist.all_reduce, identical to exp_592's kept edit. exp_607 (mb.mul_(0.5) + z-loss stack) regressed +0.000362 showing momentum-damping doesn't stack with z-loss; GC is direction-projection (not history/magnitude), minimal overlap. Size: code_bytes 23296 → 23360 (+64B). Expected: additive -0.0003 → 1.0720; partial overlap -0.0001 to -0.0002 → 1.0720-1.0721.
628	596	22	000/005/017/088/108/142/151/164/177/196/212/245/267/280/298/324/336/377/475/491/538/596/628	arch	discard	1.074830	+0.002579	Add learnable per-feature final_gamma (init=1.0, shape=[model_dim=512]) after final_norm and before tied-embedding logit projection — adds output-side gauge freedom that is absorbable at inference but training-distinct from tok_emb due to 17× weaker weight decay (0.005 vs 0.085) and slower lr (0.02 vs 0.03).
629	596	22	000/005/017/088/108/142/151/164/177/196/212/245/267/280/298/324/336/377/475/491/538/596/629	reg	eval_budget_overrun	1.072473		Raise adam_wd 0.005 to 0.006 UP probe on scalar AdamW group atop exp_596 z-loss baseline.
630	596	22	000/005/017/088/108/142/151/164/177/196/212/245/267/280/298/324/336/377/475/491/538/596/630	meta	size_blocked	1.072748		Raise ttt_momentum 0.9 to 0.91 (untested midpoint on proven UP axis): exp_572 at 0.92 measured bpb=1.072551 but was size_blocked; under exp_596 z-loss regime a gentle momentum bump compensates for softer CE gradients.
631	596	22	000/005/017/088/108/142/151/164/177/196/212/245/267/280/298/324/336/377/475/491/538/596/631	loss	size_blocked	1.073246		Add label_smoothing=0.003 to TTT inner-loop CE on top of exp_596's z-loss: untried-on-TTT axis (prior label-smoothing trials exp_042/exp_428 only modified main-train CE, where train/val objective mismatch compounds over 20K+ steps); TTT's ~16-step-per-chunk adaptation with score-first has negligible compounding risk and mild smoothing should regularize against overfitting to each chunk's idiosyncratic tokens (helping the NEXT chunk's scoring under score-first), mechanism-orthogonal to the logsumexp^2 z-loss.
632	596	22	000/005/017/088/108/142/151/164/177/196/212/245/267/280/298/324/336/377/475/491/538/596/632	opt	discard	1.073387	+0.001136	Port exp_592's Gradient Centralization (row-mean subtraction) from TTT SGD to main-training Muon: insert `g = g - g.mean(dim=-1, keepdim=True)` immediately after `g = p.grad`, before momentum accumulation. Structurally orthogonal to Muon's NS orthogonalization (singular-value management) and row-normalize (L2-norm management); GC removes per-row DC, leaving only differential signal for NS to polarize.
633	596	22	000/005/017/088/108/142/151/164/177/196/212/245/267/280/298/324/336/377/475/491/538/596/633	quant	discard	1.072395	+0.000144	Top-2 sink-col asymmetric int6 in GPTQ: extend quantization range from [-31,+31] to [-32,+31] on only the first 2 post-perm columns (highest-H_ii) per matrix; rest stay symmetric. Recovers precision on -31-saturated negative tail where GPTQ error-propagation concentrates, at ~1/4 of exp_575's top-8 histogram-shift cost (1755B size_blocked).</hypothesis> <parameter name="notes">Single-site edit in gptq_quantize_weight inner loop: lo = -clip_range - 1 if (i1 + j) < 2 else -clip_range; q_col clamp uses lo. After perm=argsort(H.diag(), descending=True), cols 0-1 are top-2 highest-H_ii sink columns where 1/Hinv[j,j] amplification drives negative-tail saturation most. Linear scaling of exp_575 (top-8, val=1.073162, size_blocked by 1755B) projects Δ≈-0.000076 at ~440B overhead. exp_556 (all cols, val=1.073030, size_blocked) and exp_584 (top-8+lgwin=24 size_blocked) confirm direction has real bpb gain; need smaller K to fit. z-loss parent may narrow tail distribution slightly vs exp_575's pre-arch parent. Code +15B (23296→23311).
634	596	22	000/005/017/088/108/142/151/164/177/196/212/245/267/280/298/324/336/377/475/491/538/596/634	eval	size_blocked	1.072832		Context-target-frequency ("unigram cache") logit bias at TTT scoring: add damp=0.05 * mean-centered log-smoothed frequency of y_batch[:, :context_size] to logits before CE, zero-masked for ws=0. Context targets are strictly-prior val tokens scored in earlier windows.
635	596	22	000/005/017/088/108/142/151/164/177/196/212/245/267/280/298/324/336/377/475/491/538/596/635	opt	crash			Bias-corrected EMA decay schedule: replace constant ema_decay=0.9965 with per-step _d=min(h.ema_decay, step/(step+1)) so the averaged weights at the end of training aren't biased toward the initial (post-warmup-restore) state. At step 0 the EMA is fully replaced by the post-step weights; _d hits the target 0.9965 around step 285 (~15% through the ~1800-step run), identical to current behavior thereafter.
636	596	22	000/005/017/088/108/142/151/164/177/196/212/245/267/280/298/324/336/377/475/491/538/596/636	reg	crash			Set PREQUANT_TTT_WD default 0.0 -> 0.01: the 21-epoch full-parameter AdamW pre-quant TTT pass runs with zero weight decay in the baseline — this is the only AdamW optimizer in the pipeline with no WD (main-train AdamW scalar group = 0.02, Muon = 0.095/0.115), and it is an untouched axis across ~50 reg trials. A mild decoupled WD anchors 21-epoch val-adaptation drift, tightens weight norms into GPTQ int6 (lower clip-sigma error), and improves brotli compressibility.</hypothesis> <parameter name="notes">One-literal change at line 174 (PREQUANT_TTT_WD default 0.0 -> 0.01). Zero code-size delta, zero new params. Pre-quant TTT AdamW already reads h.prequant_ttt_wd into weight_decay kwarg (line 1130). Effective per-step decay lr*wd = 5e-4 * 0.01 = 5e-6; over ~2100 pre-quant TTT steps (21 epochs x ~100 chunk-batches/rank), cumulative weight shrinkage ~1% of non-decay equilibrium — small enough not to wash out val-adaptation signal but enough to pull overconfident post-adapt weights slightly toward 0 before GPTQ quantization grid. Untouched axis: no reg trial or any other specialist has modified prequant_ttt_wd; all WD trials have been on main-train Muon or scalar AdamW groups. Size-safe: slight weight shrinkage strictly improves int6 GPTQ + brotli-11, not hurts.
637	596	22	000/005/017/088/108/142/151/164/177/196/212/245/267/280/298/324/336/377/475/491/538/596/637	tok	crash			Test embed_scale restoration
638	596	22	000/005/017/088/108/142/151/164/177/196/212/245/267/280/298/324/336/377/475/491/538/596/638	tok	crash			Retry exp_637 - restore exp_298 per-feature embed_scale gamma inside post-tok_emb RMSNorm
639	596	22	000/005/017/088/108/142/151/164/177/196/212/245/267/280/298/324/336/377/475/491/538/596/639	tok	crash			Restore exp_298 per-feature embed_scale gamma INSIDE post-tok_emb RMSNorm with explicit dtype cast to avoid fp32/bf16 autocast compile hazard (exp_637/638 crashed without cast)
