exp_id	parent_exp	depth	path	specialist	status	val_bpb	delta_vs_best	hypothesis
680	596	22	000/005/017/088/108/142/151/164/177/196/212/245/267/280/298/324/336/377/475/491/538/596/680	opt	discard	1.072956	+0.000705	Muon-only LR floor at 0.04 in deep warmdown tail keeps matrix updates active for GPTQ fidelity while AdamW groups fully decay.
681	596	22	000/005/017/088/108/142/151/164/177/196/212/245/267/280/298/324/336/377/475/491/538/596/681	reg	discard	1.075081	+0.002830	Bernoulli per-token-per-head dropout (p=0.05) on attn_out_gate output during training only — Stochastic-DropHead applied at the gate output that exp_538 introduced. Distinct from exp_293's destructive MLP-branch DropPath since gate dropout zeros only ~0.4 of 8 heads per token in expectation, mean-preserving via F.dropout's auto 1/(1-p) scaling.
682	596	22	000/005/017/088/108/142/151/164/177/196/212/245/267/280/298/324/336/377/475/491/538/596/682	curr	crash			Prime-coprime stride 2017 in within-shard packing aligns training position mod-64 with eval stride-64 grid.
683	596	22	000/005/017/088/108/142/151/164/177/196/212/245/267/280/298/324/336/377/475/491/538/596/683	meta	size_blocked	1.072882		muon_wd_mlp 0.115 to 0.117 (+1.7% UP gentle midpoint, byte-neutral): untested between baseline and exp_407's +4.3% UP (discard +0.000245); stack accumulated 4 regularizers (z-loss, attn_out_gate, scalar-freeze TTT, GPTQ damping) since exp_336 set 0.115, so MLP-WD optimum may have drifted slightly UP, and UP is cap-friendly amid recent meta size_blocks.
684	596	22	000/005/017/088/108/142/151/164/177/196/212/245/267/280/298/324/336/377/475/491/538/596/684	arch	discard	1.072894	+0.000643	Replace 2*sigmoid(z) with 1+tanh(z) for attn_out_gate saturation: same [0,2] range and step-0 transparency, but local gradient at z=0 is 1.0 vs 0.5 — accelerates gate_w learning by 2× early in training without changing the gate's expressive envelope.
685	596	22	000/005/017/088/108/142/151/164/177/196/212/245/267/280/298/324/336/377/475/491/538/596/685	quant	discard	1.072713	+0.000462	GPTQ Hessian off-diagonal correlation cap |H_ij|<=0.95*sqrt(H_ii*H_jj) applied after the kept 1.01x diag damping and before Cholesky: clamps only off-diagonal entries that violate the |corr|<=0.95 PSD envelope, distinct from exp_348's uniform 0.95x shrinkage; diagonal preserved exactly so damping is unchanged.
686	596	22	000/005/017/088/108/142/151/164/177/196/212/245/267/280/298/324/336/377/475/491/538/596/686	loss	discard	1.073463	+0.001212	Add PaLM-style main-training z-loss (coef 5e-7 * logsumexp^2.mean) to the CE in CausalGPT.forward, mirroring the proven exp_596 TTT-only z-loss mechanism on the main-train code path with a 20x smaller coefficient (main train has ~3000 steps vs TTT's 21 epochs).
687	596	22	000/005/017/088/108/142/151/164/177/196/212/245/267/280/298/324/336/377/475/491/538/596/687	eval	eval_budget_overrun	1.074048		Per-batch closed-form Newton-step temperature calibration on prefix (in-context, not scored) tokens in eval_val_ttt's score-first phase: fit β=1/τ analytically by computing Σ(E_p[z]-z_y) and Σ Var_p(z) at β=1 over prefix positions, take one Newton step β*=1-g/h clamped to [0.7,1.3], multiply logits by β* before scoring. Corrects post-GPTQ logit miscalibration using only legal in-context labels.
688	596	22	000/005/017/088/108/142/151/164/177/196/212/245/267/280/298/324/336/377/475/491/538/596/688	ttt	discard	1.072551	+0.000300	Within-chunk monotone-UP per-epoch LR ramp (0.7, 0.9, 1.1, 1.3, mean=1.0) on TTT SGD-Nesterov: untried sign on LR-shape axis. Prior monotone-DOWNs (exp_295 1.0->0.25, exp_409 1.3->0.7) both discarded. Opposite hypothesis: prior-chunk velocity most stale at epoch 0 (consistent with exp_588 chunk-start momentum halving keep), so UNDER-step ep0 and OVER-step ep3 when intra-chunk Nesterov velocity is most aligned.
689	596	22	000/005/017/088/108/142/151/164/177/196/212/245/267/280/298/324/336/377/475/491/538/596/689	tok	discard	1.078128	+0.005877	Test
690	596	22	000/005/017/088/108/142/151/164/177/196/212/245/267/280/298/324/336/377/475/491/538/596/690	opt	size_blocked	1.073504		Lift Muon momentum buffer from bf16 to fp32 (zeros(dtype=float32) + g.float() in mul_/add_) for cleaner long-EMA accumulation under momentum=0.99: bf16's 7-bit mantissa accumulates biased rounding error across ~2000+ mul-add steps, fp32's 23-bit mantissa preserves direction precision, yielding cleaner weight trajectories and tighter GPTQ int6 fit.
691	596	22	000/005/017/088/108/142/151/164/177/196/212/245/267/280/298/324/336/377/475/491/538/596/691	reg	discard	1.072736	+0.000485	Freeze tied tok_emb.weight (LM-head basis) during eval-TTT, in addition to the existing exp_491 freeze of control-scalar params (numel<10000). Pre-quant TTT already adapts tok_emb on val with 21 epochs of AdamW; per-chunk SGD updates to the largest tied tensor at eval time waste budget and shift the output distribution per step. Isolating adaptation to the transformer body should reduce drift across chunks and tighten BPB.
692	596	22	000/005/017/088/108/142/151/164/177/196/212/245/267/280/298/324/336/377/475/491/538/596/692	curr	discard	1.077510	+0.005259	Prime stride 509 (coprime to seq_len=512 and eval_stride=64) covers all 64 residues mod eval-stride within one phase-epoch. Fix of previous crash.
693	596	22	000/005/017/088/108/142/151/164/177/196/212/245/267/280/298/324/336/377/475/491/538/596/693	meta	size_blocked	1.072502		TTT_MOMENTUM 0.9 to 0.88 DOWN probe under z-loss regime
694	596	22	000/005/017/088/108/142/151/164/177/196/212/245/267/280/298/324/336/377/475/491/538/596/694	loss	size_blocked	1.073516		Shift TTT z-loss anchor from 0 to log(V)=9.011: replace 1e-5*lse^2.mean() with 1e-5*(lse-9.011)^2.mean(). Untried anchor-shift on the proven exp_596 mechanism.
695	596	22	000/005/017/088/108/142/151/164/177/196/212/245/267/280/298/324/336/377/475/491/538/596/695	arch	eval_budget_overrun	1.074388		Quad-fold q_gain [H,4] split: extend exp_475 bifurcated [H,2] (RoPE/NoPE) to 4 regions — RoPE high-freq (dims 0-15), RoPE low-freq (dims 16-31), NoPE-1 (dims 32-47), NoPE-2 (dims 48-63). Lets each head sharpen each frequency band independently within partial-RoPE.
696	596	22	000/005/017/088/108/142/151/164/177/196/212/245/267/280/298/324/336/377/475/491/538/596/696	eval	size_blocked	1.073217		One-shot global temperature calibration on prefix tokens in eval_val_ttt: compute β = clamp(1 - g/h, 0.7, 1.3) ONCE from the first batch's prefix positions (Newton step), then apply this fixed β to all subsequent score-phase logits across all chunks. Reduces exp_687's per-batch cost (eval_budget_overrun) to a single ~10ms calibration while keeping the calibration benefit.
697	596	22	000/005/017/088/108/142/151/164/177/196/212/245/267/280/298/324/336/377/475/491/538/596/697	quant	size_blocked	1.073565		Scope 6-sigma winsorized row_std to attn projections only - retry exp_646's mechanism (val_bpb=1.072235 size_blocked +2325B) at smaller param share (~25%) to fit under 4070B headroom while keeping Q/K/V outlier-feature precision gain
698	596	22	000/005/017/088/108/142/151/164/177/196/212/245/267/280/298/324/336/377/475/491/538/596/698	ttt	discard	1.073693	+0.001442	Freeze tok_emb (tied I/O alphabet, ~4.2M params, largest single tensor) during TTT alongside existing control-scalar freeze (exp_491): adapt interior only. Tok_emb gradient is sparse per-chunk, so chunk-local TTT skews vocabulary geometry; freezing it pairs with z-loss (exp_596) - z-loss damps logit magnitude while tok_emb-freeze damps logit direction drift across chunks.</hypothesis> <parameter name="notes">Single 3-line edit at eval_val_ttt param filter; tok_emb identified by tensor identity (p is not _te). Code +73 packed bytes (23296 to 23369). Untried granularity: exp_535 tried 2x tok_emb LR (size_blocked), exp_656 tried tok_emb-only mb.mul_(0.5) at chunk boundary (eval_budget_overrun) - both probes hit budget walls. Pure freeze is the lightest intervention. Risk: ~4.2M of ~24.7M trainable-TTT budget removed (about 17%); if tok_emb adaptation was carrying signal, this regresses.
699	596	22	000/005/017/088/108/142/151/164/177/196/212/245/267/280/298/324/336/377/475/491/538/596/699	tok	discard	1.077698	+0.005447	Learnable scalar dc_strip_alpha init=0 softly subtracts per-token feature-mean before embed_scale*RMSNorm: x -= alpha*x.mean(-1). Gradient picks the LayerNorm-vs-RMSNorm interpolation; orthogonal to embed_BIAS attempts (exp_307/486/505) and full LayerNorm (exp_523/058).</hypothesis> <parameter name="notes">3-site edit. Init: nn.Parameter(torch.zeros(1)) after embed_scale. Forward: x=x-alpha.to(x.dtype)*x.mean(-1,keepdim=True) before rms_norm. Optim: appended to scalar_params (AdamW wd=0.005). +350 code B; model ~4B. Init=0 = bitwise identical step 0. Frozen during TTT (numel<10000 per exp_491). Independent from line-1497 col-mean gauge.
700	596	22	000/005/017/088/108/142/151/164/177/196/212/245/267/280/298/324/336/377/475/491/538/596/700	opt	size_blocked	1.072455		Halve Muon momentum buffers ONCE at warmdown entry (first step where lr_scale<1.0): single-event discontinuity decorrelates warmdown updates from peak-LR exploration noise, mirroring exp_588's kept TTT chunk-boundary halving applied to main-training Muon.
701	596	22	000/005/017/088/108/142/151/164/177/196/212/245/267/280/298/324/336/377/475/491/538/596/701	reg	discard	1.072514	+0.000263	embed_wd 0.085 to 0.082 gentle DOWN -3.5%
702	596	22	000/005/017/088/108/142/151/164/177/196/212/245/267/280/298/324/336/377/475/491/538/596/702	curr	discard	1.075228	+0.002977	Eliminate per-shard random sequence permutation in _reset_shard, use deterministic arange. Tests whether per-shard rng.permutation adds anything beyond shard_plan shuffle and Latin-square phase rotation. Byte-negative.
703	596	22	000/005/017/088/108/142/151/164/177/196/212/245/267/280/298/324/336/377/475/491/538/596/703	meta	discard	1.073288	+0.001037	EMA_DECAY 0.9965 → 0.996 (gentle DOWN probe, untested midpoint between current and exp_274's 0.994 discard): only DOWN probe ever was exp_274 on the much-thinner exp_261 stack (pre z-loss, attn_out_gate, scalar-freeze, GC), which all-UP probes (exp_119/149/184/242/393/447 at 0.998) consistently fail on post-005 lineages — the optimum may have drifted toward narrower averaging now that 4 trajectory-smoothing regularizers stack on top.
704	596	22	000/005/017/088/108/142/151/164/177/196/212/245/267/280/298/324/336/377/475/491/538/596/704	loss	size_blocked	1.072641		Tail-emphasized linear position-weighting on TTT z-loss term: replace 1e-5*lse².mean() with 1e-5*(lse².reshape(-1,T) * linspace(0.5,1.5,T)).mean(). Mean-preserving (linspace mean=1.0); concentrates logit-partition regularization on end-of-window positions which become the NEXT eval window's stride-64 scoring zone after sliding. Distinct from prior PW experiments which targeted CE not z-loss.
705	596	22	000/005/017/088/108/142/151/164/177/196/212/245/267/280/298/324/336/377/475/491/538/596/705	arch	eval_budget_overrun	1.072975		Tied MLP-output gate via reuse of attn_out_gate_w with mean-across-heads reduction: zero new params, step-0 transparent (W zero-init → gate=1.0).
706	596	22	000/005/017/088/108/142/151/164/177/196/212/245/267/280/298/324/336/377/475/491/538/596/706	quant	size_blocked	1.073024		Mean-preserving 6σ winsor row_std applied to all matrices in GPTQ: same mechanism as exp_646 (raw 6σ measured bpb 1.072235 size_blocked +2325B) but rescaled per-matrix so mean(row_std) is unchanged from baseline — heavy-tail rows tighten, light-tail rows loosen by the same factor, holding mean(s) and mean(|Q|) constant to avoid the global Q-histogram shift that drove exp_646's brotli inflation.
707	596	22	000/005/017/088/108/142/151/164/177/196/212/245/267/280/298/324/336/377/475/491/538/596/707	eval	eval_budget_overrun	1.074808		Per-chunk causal Newton β recalibration: cumulative prefix-token g/h stats updated after every chunk, β = clamp(1 - Σg/Σh, 0.95, 1.05) applied to next chunk's scoring. Differs from exp_696 one-shot global (which hurt by +0.001) by tracking model-drift during TTT with rolling cumulative stats and a tight clamp.
708	596	22	000/005/017/088/108/142/151/164/177/196/212/245/267/280/298/324/336/377/475/491/538/596/708	ttt	discard	1.073003	+0.000752	Adaptive momentum restart at chunk boundaries (O'Donoghue-Candès): at chunk c≥1's first TTT-SGD step, after backward+all_reduce+clip but before optimizer.step, zero each param's momentum_buffer ONLY when (mb*grad).sum()<0 — i.e., when stale momentum is anti-aligned with fresh chunk gradient. Aligned momentum is preserved as useful signal carryover. Distinct from blanket exp_588 mb.mul_(0.5) (won standalone, regressed under z-loss in exp_607) and from blanket exp_503/253/213 mb.zero_() (all failed): per-parameter selective rather than uniform.
709	596	22	000/005/017/088/108/142/151/164/177/196/212/245/267/280/298/324/336/377/475/491/538/596/709	arch	crash			Per-loop-iteration learnable residual-stream scale [num_loops+1]=3 (init=1.0) applied once at entry to each block within iteration k; breaks translational symmetry of applying the shared loop segment 3x identically (exp_352 rotation failed; this is amplitude-axis not permutation-axis).
710	596	22	000/005/017/088/108/142/151/164/177/196/212/245/267/280/298/324/336/377/475/491/538/596/710	opt	discard	1.073871	+0.001620	Increase Muon Newton-Schulz iteration count 5 to 6 (muon_backend_steps): genuinely untuned axis across 700+ trials, only Polar Express coefficient swap (exp_509) probed NS internals. 6 iters gives tighter polar approximation of the orthogonalized update each step, plausibly cleaner weight trajectories that survive int6 GPTQ better.
711	596	22	000/005/017/088/108/142/151/164/177/196/212/245/267/280/298/324/336/377/475/491/538/596/711	tok	eval_budget_overrun	1.072075		Apply embed_scale ONLY to residual baseline x0 (injected into every block via mix[1]*x0 without pre-norm), leaving working stream x entering block 0 plain unit-RMS (its gauge is washed by block-0 pre-norms anyway). Zero-byte structural reorder of the existing embed_scale parameter.
712	596	22	000/005/017/088/108/142/151/164/177/196/212/245/267/280/298/324/336/377/475/491/538/596/712	reg	size_blocked	1.072590		Split attn_out_gate_w (exp_538 zero-init per-head gate, ~1056 params total) out of the scalar AdamW group into its own sub-group with weight_decay=0; other scalars stay at adam_wd=0.005. Untested DOWN direction — prior gate-WD trials exp_550/560/569 were all UP probes that hit size_blocked. Rationale: zero-init params have no WD signal at init; WD only kicks in once the gate learns nonzero values, which fights the gradient signal pulling it toward useful gating magnitudes.</hypothesis> <parameter name="notes">Two-site edit. scalar_params list comprehension gains an `and "attn_out_gate" not in name` guard; new gate_params list collects matching params; optimizer_scalar now has 2 groups with the gate group setting weight_decay=0.0 explicitly. +45 code bytes, zero new params, no model structure change.
713	596	22	000/005/017/088/108/142/151/164/177/196/212/245/267/280/298/324/336/377/475/491/538/596/713	loss	size_blocked	1.073317		Halve TTT inner-CE z-loss coefficient 1e-5 to 5e-6 to probe untested DOWN direction on the kept z-loss axis
714	596	22	000/005/017/088/108/142/151/164/177/196/212/245/267/280/298/324/336/377/475/491/538/596/714	meta	eval_budget_overrun	1.074026		matrix_lr 0.022 to 0.0225 (+2.3% UP, untested gentle midpoint): exp_325 failed +4.5% UP (0.023) was the closest matrix_lr probe to a keep at +0.000091, while -9% DOWN hurt 6x worse. Stale axis (last probed depth=15) with 6 gradient-dampening regularizers stacked since (z-loss, attn_out_gate, scalar-freeze) so Muon LR optimum should have drifted UP.</hypothesis> <parameter name="notes">Single-literal change at line 148 (MATRIX_LR default 0.022 to 0.0225). Zero code/byte delta. +2.3% is HALF the step of exp_325's failed +4.5%.</parameter> </invoke>
715	596	22	000/005/017/088/108/142/151/164/177/196/212/245/267/280/298/324/336/377/475/491/538/596/715	curr	discard	1.075485	+0.003234	Train-eval stride alignment: packing stride 2048 to 1984 so overlap-region tokens appear at both deep and shallow context. Revives exp_076 mechanism which harness_aborted.
716	596	22	000/005/017/088/108/142/151/164/177/196/212/245/267/280/298/324/336/377/475/491/538/596/716	arch	size_blocked	1.073128		Per-loop-iteration learnable residual-stream scale [num_loops+1]=3 (init=1.0) applied once at entry to each block within iteration k; breaks translational symmetry of applying the shared loop segment 3x identically. Retry of exp_709 crash with DDP ghost-touch fix.
717	596	22	000/005/017/088/108/142/151/164/177/196/212/245/267/280/298/324/336/377/475/491/538/596/717	eval	eval_budget_overrun	1.074822		Per-vocab Newton logit-bias correction in parallel to existing scalar β Newton: incremental [V] bias updated per chunk from prefix-only g/h stats, clamped to [-0.05,0.05], applied to scoring as ((logits+_b)*β). New orthogonal calibration axis to scalar β.
718	596	22	000/005/017/088/108/142/151/164/177/196/212/245/267/280/298/324/336/377/475/491/538/596/718	opt	discard	1.072912	+0.000661	Decrease Muon Newton-Schulz iteration count 5 to 4 (muon_backend_steps): exp_710 just showed 5 to 6 hit train_budget at 600.0s exactly with +0.001620 regression, indicating the regime is speed-bound. Going 4 iters trades ~one order of polar-approx precision for about 20% faster Muon steps and a proportional gain in training-step count.
719	596	22	000/005/017/088/108/142/151/164/177/196/212/245/267/280/298/324/336/377/475/491/538/596/719	ttt	discard	1.073799	+0.001548	Per-chunk Lookahead slow-weights (Zhang 2019, α=0.5): clone TTT params at start; after each chunk's adaptation, slow.lerp_(fast,0.5); fast.copy_(slow). Untested at chunk cadence (exp_678 was per-epoch and busted eval budget). Mechanically distinct from momentum manipulation (exp_588/607) — operates on weight-space directly. Composes orthogonally with z-loss (per-step logit regularizer) by damping cumulative cross-chunk weight drift.
720	596	22	000/005/017/088/108/142/151/164/177/196/212/245/267/280/298/324/336/377/475/491/538/596/720	quant	size_blocked	1.072278		Walsh-Hadamard pre-rotation along input axis for MLP-only GPTQ matrices
721	596	22	000/005/017/088/108/142/151/164/177/196/212/245/267/280/298/324/336/377/475/491/538/596/721	tok	size_blocked	1.072255		Dual-site embed_scale stacking exp_298 and exp_711 mechanisms with zero new params.
722	596	22	000/005/017/088/108/142/151/164/177/196/212/245/267/280/298/324/336/377/475/491/538/596/722	loss	size_blocked	1.073042		Replace TTT inner-loop L2 z-loss with rectified hinge form: 1e-5 * F.relu(logsumexp - 7.0).pow(2).mean() — concentrates partition-function regularization only on positions with lse > 7 (over-confident drift), leaves softer/uniform-ish positions unconstrained for faster per-chunk TTT adaptation. Mechanism-distinct from prior z-loss probes (L1 exp_664 discard, variance exp_675 size_blocked, anchor-at-log(V) exp_694 size_blocked, tail-PW exp_704 size_blocked, halve/double coef discard).
723	596	22	000/005/017/088/108/142/151/164/177/196/212/245/267/280/298/324/336/377/475/491/538/596/723	reg	size_blocked	1.072818		Multiplicative uniform noise eps=0.03 on attn_out_gate output training-only
724	596	22	000/005/017/088/108/142/151/164/177/196/212/245/267/280/298/324/336/377/475/491/538/596/724	meta	discard	1.072689	+0.000438	BETA2 0.95 to 0.96 untested midpoint between current and exp_126 0.97 UP probe that measured +0.000299 on depth-5 stack
725	596	22	000/005/017/088/108/142/151/164/177/196/212/245/267/280/298/324/336/377/475/491/538/596/725	curr	discard	1.074574	+0.002323	CUTMIX-LM token splice: p=0.05 per-sample, splice tail x[split:]/y[split-1:] from another batch sample at random split in [64, seq_len-64), injecting synthetic topic-switch events at long-context positions — novel curr axis (cross-sample content mixing untried; exp_624 did per-token random noise, not cross-sample splicing).
726	596	22	000/005/017/088/108/142/151/164/177/196/212/245/267/280/298/324/336/377/475/491/538/596/726	eval	eval_budget_overrun	1.075273		EMA decay 0.9 on the TTT-scoring Newton β accumulators (_g_acc, _h_acc): _g_acc = 0.9*_g_acc + _g_chunk (same for _h_acc). Current code uses uniform cumulative sums, which means chunk 1's stats weight equally with chunk 250's stats even though the TTT-adapted model has drifted substantially; EMA lets β track the adapted model's current residual imbalance.
727	596	22	000/005/017/088/108/142/151/164/177/196/212/245/267/280/298/324/336/377/475/491/538/596/727	arch	size_blocked	1.073438		Self-keyed attn-output gate: source gate input from post-attention output y[..., :W_g] (per-head, each head sees its own output) instead of shared pre-attention input x[..., :W_g]; squeeze-excitation style, no param/size change vs exp_538.
728	596	22	000/005/017/088/108/142/151/164/177/196/212/245/267/280/298/324/336/377/475/491/538/596/728	quant	size_blocked	1.069841		Replace fixed 12.85σ-based GPTQ per-row scale heuristic with AWQ-style MSE-optimal scale grid search: pick per row the multiplicative candidate in {0.80, 0.90, 1.00, 1.10, 1.25} that minimizes round-MSE on permuted weights. Storage unchanged (fp16 per row); adapts scale to each row's real tail distribution rather than assuming Gaussian.
729	596	22	000/005/017/088/108/142/151/164/177/196/212/245/267/280/298/324/336/377/475/491/538/596/729	ttt	size_blocked	1.073067		Mid-chunk TTT SGD momentum buffer damping: at epoch 2 of 4 within each chunk multiply each ttt param momentum buffer by 0.7
