exp_id	parent_exp	depth	path	specialist	status	val_bpb	delta_vs_best	hypothesis
788	750	23	000/005/017/088/108/142/151/164/177/196/212/245/267/280/298/324/336/377/475/491/538/596/750/788	arch	size_blocked	1.072608		Asymmetric LayerScale init for parallel-residual blocks (7-10): mlp_scale starts at 0.5 instead of 1.0; attn_scale stays 1.0. Breaks the implicit equal-magnitude prior between parallel attn/mlp pathways and biases optimizer to attn-dominant features early; mlp grows during training.
789	750	23	000/005/017/088/108/142/151/164/177/196/212/245/267/280/298/324/336/377/475/491/538/596/750/789	ttt	eval_budget_overrun	1.072417		Mean-preserving per-epoch linear LR decay within each TTT chunk (1.25x→0.75x of cos_lr across the 4 inner epochs): freshest-data epoch 0 gets the largest step, later epochs polish with smaller steps as gradient signal becomes increasingly correlated by re-traversing the same chunk; total LR budget per chunk is preserved.
790	750	23	000/005/017/088/108/142/151/164/177/196/212/245/267/280/298/324/336/377/475/491/538/596/750/790	opt	size_blocked	1.072797		Schedule optimizer_tok (AdamW on tied tok_emb) beta2 from 0.95 (peak-LR) up to 0.99 (deepest tail) lockstep with (1-lr_scale): longer second-moment EMA window in warmdown gives more stable preconditioner for rare-token rows whose gradients are sparse and small.
791	750	23	000/005/017/088/108/142/151/164/177/196/212/245/267/280/298/324/336/377/475/491/538/596/750/791	quant	size_blocked	1.071846		Threshold-gated AWQ-style per-row scale refinement: keep grid alpha in {0.95,1.0,1.05} but only swap from alpha=1.0 if alt H-diag-weighted MSE less than 0.95x baseline.
792	750	23	000/005/017/088/108/142/151/164/177/196/212/245/267/280/298/324/336/377/475/491/538/596/750/792	meta	size_blocked	1.071951		SCALAR_LR 0.02 → 0.018 (gentle DOWN -10%, untested midpoint between current and exp_204's failed -25% probe at depth 10).
793	750	23	000/005/017/088/108/142/151/164/177/196/212/245/267/280/298/324/336/377/475/491/538/596/750/793	arch	size_blocked	1.072819		Milder asymmetric init for parallel-residual blocks (7-10): mlp_scale=0.8 (vs 1.0 baseline, attn=1.0). Same Z2-symmetry-breaking mechanism as exp_788's mlp_scale=0.5 (which gave val_bpb=1.072608, Δ≈-0.0006 but size_blocked at +5KB), at smaller magnitude to keep trained weights closer to baseline GPTQ entropy and fit under 16MB cap.
794	750	23	000/005/017/088/108/142/151/164/177/196/212/245/267/280/298/324/336/377/475/491/538/596/750/794	opt	size_blocked	1.073069		Per-group LR floor on optimizer_tok only at 5% of base_lr — keeps tied tok_emb's rare-token rows still learning through deep warmdown when Muon/scalar/head groups have effectively stopped updating; orthogonal to global MIN_LR axis (exp_660 discard, hurt all groups uniformly) and Muon-only floor (exp_680 discard).
795	750	23	000/005/017/088/108/142/151/164/177/196/212/245/267/280/298/324/336/377/475/491/538/596/750/795	eval	size_blocked	1.072801		Stack Gradient Centralization (zero-mean per-row gradient on 2D+ ttt_params before clip+step) onto current best exp_750 — exp_750 forked from exp_596 (z-loss) and added the opt mm_blend tweak, but never inherited GC from exp_592/exp_746; the GC+z-loss combination at exp_746 was kept (Δ=-0.000005 over z-loss alone), so applying the same row-mean grad correction on top of the strictly-stronger 750 stack is the natural untried recombination.
796	750	23	000/005/017/088/108/142/151/164/177/196/212/245/267/280/298/324/336/377/475/491/538/596/750/796	loss	discard	1.079557	+0.007347	Temperature-scale TTT inner CE: F.cross_entropy(_lf/1.1,...) — softens TTT per-chunk targets to T=1.1, reducing 21-epoch chunk overfitting, mechanism-distinct from all 18 prior z-loss-form variants (L1/L2/L4, hinge, var, anchor, max, decay, gate, scale all tested) which all modify the regularizer term, not the CE itself.
797	750	23	000/005/017/088/108/142/151/164/177/196/212/245/267/280/298/324/336/377/475/491/538/596/750/797	quant	size_blocked	1.071147		Pair brotli lgwin=22→24 (untried alone on current parent; estimated 150–500KB savings on the ~16MB compressed payload via 4× larger LZ77 window) with the threshold-gated AWQ-3 scale grid (α∈{0.95,1.0,1.05}, only swap if H-diag-weighted MSE drops &gt;5%) — exp_791 measured the gated-grid at val_bpb=1.071846 size_blocked +285KB on this same exp_750 parent, so lgwin=24 is exactly the size-saver needed to land that quality move under the cap.
798	750	23	000/005/017/088/108/142/151/164/177/196/212/245/267/280/298/324/336/377/475/491/538/596/750/798	curr	size_blocked	1.074176		Stride+1 packing in _reset_shard: stride from seq_len (2048) to seq_len+1 (2049). Decorrelates seq-pos and file-pos modular coupling.
799	750	23	000/005/017/088/108/142/151/164/177/196/212/245/267/280/298/324/336/377/475/491/538/596/750/799	tok	discard	2.557347	+1.485137	Forward-time per-row RMS-equalized tied-readout: F.linear(x, F.rms_norm(tok_emb.weight, (D,)) * tied_embed_init_std) so every token's classifier row has identical L2=std*sqrt(D), decoupling logit-magnitude from row-magnitude drift while keeping raw tok_emb at the lookup path. Parameter-free, init-logit-magnitude-preserving, untried in tok history.
800	750	23	000/005/017/088/108/142/151/164/177/196/212/245/267/280/298/324/336/377/475/491/538/596/750/800	reg	discard	1.072391	+0.000181	adam_wd 0.005 to 0.006 gentle UP midpoint byte-neutral probe
801	750	23	000/005/017/088/108/142/151/164/177/196/212/245/267/280/298/324/336/377/475/491/538/596/750/801	ttt	size_blocked	1.079181		Hard-mask TTT inner CE to last 128 positions of each 2048-token training sequence; aligns adaptation gradient signal with late-context positions. Untried as HARD mask in our swarm.
802	750	23	000/005/017/088/108/142/151/164/177/196/212/245/267/280/298/324/336/377/475/491/538/596/750/802	meta	size_blocked	1.072196		ADAM_EPS 1e-8 → 1e-7 (untouched UP direction): only DOWN was probed (exp_304 1e-8→1e-9 discard +0.000595); softer denominator caps effective LR specifically for low-2nd-moment params (rare-token tok_emb rows where v << eps), aligned with the stack's kept direction of damping volatile updates on rarely-touched state (exp_491 scalar freeze, exp_588 chunk momentum halving).
803	750	23	000/005/017/088/108/142/151/164/177/196/212/245/267/280/298/324/336/377/475/491/538/596/750/803	arch	discard	1.073728	+0.001518	Loop-iteration-aligned U-Net split: shift num_enc 8->9 (len(all_indices)//2 + 1) so encoder ends at block-5-iter1 boundary and decoder starts at block-3-iter2; LIFO skip pairing now feeds prior-iter-end into next-iter-start (block-5-iter1 -> block-3-iter2) and same-block recurrent feedback (block-4-iter1 -> block-4-iter2). Block-0 output drops from skips; num_skip_weights stays at 8. Zero new params, byte-neutral.
804	750	23	000/005/017/088/108/142/151/164/177/196/212/245/267/280/298/324/336/377/475/491/538/596/750/804	opt	size_blocked	1.072548		Per-group Muon matrix_lr split: introduce matrix_lr_mlp=0.023 for MLP Muon group while attn group keeps matrix_lr=0.022 (per-group base_lr). Mirrors the kept attn/mlp WD asymmetry (exp_164/exp_336) on the LR axis.
805	750	23	000/005/017/088/108/142/151/164/177/196/212/245/267/280/298/324/336/377/475/491/538/596/750/805	reg	size_blocked	1.073592		TTT input-token dropout p=0.03 mask-to-0 before forward_logits in eval_val_ttt train phase: token-level augmentation regularizes inner SGD against per-chunk overfitting.
806	750	23	000/005/017/088/108/142/151/164/177/196/212/245/267/280/298/324/336/377/475/491/538/596/750/806	ttt	discard	1.077586	+0.005376	Recurrence-aware per-block-group TTT LR: divide TTT lr by sqrt(num_loops+1)=sqrt(3) on looped blocks 3-5 only (the blocks invoked 3x per forward), leaving other blocks at full lr. Mirrors exp_245's kept ln_scale variance-balancing on these same blocks.
807	750	23	000/005/017/088/108/142/151/164/177/196/212/245/267/280/298/324/336/377/475/491/538/596/750/807	loss	discard	1.073486	+0.001276	Mismatch-gated mean-preserving TTT z-loss: replace `1e-5*lse².mean()` with `1e-5*sum(lse²·1[ŷ≠y])/sum(1[ŷ≠y])` on the TTT inner CE — penalize log-partition magnitude only on positions where argmax prediction is wrong, leaving already-correct positions with unconstrained logit-magnitude freedom for sharpening. Mechanism-distinct from all 11 prior TTT z-loss probes (L1/variance/anchor=log(V)/hinge/tail-PW/amax/coef-halve/coef-double/byte-weight/PW-CE/label-smoothing).
808	750	23	000/005/017/088/108/142/151/164/177/196/212/245/267/280/298/324/336/377/475/491/538/596/750/808	tok	size_blocked	1.075415		Halve gradient on tied tok_emb classifier path (W_cls = 0.5*W + 0.5*W.detach()): lookup path retains full gradient, output classifier contributes 0.5x backward grad. Forward identity, zero new params. Tests whether dual-pull tied tok_emb benefits from input-lookup-dominant gradient flow.
809	750	23	000/005/017/088/108/142/151/164/177/196/212/245/267/280/298/324/336/377/475/491/538/596/750/809	quant	size_blocked	1.081207		Stochastic (unbiased) rounding in GPTQ inner loop: replace torch.round(w_col/sf) with torch.floor(w_col/sf + U[0,1)) using a fixed-seed Generator. Storage neutral; structurally novel for this codebase (entire tree uses torch.round).</hypothesis> <parameter name="notes">Single-site edit in gptq_quantize_weight inner loop. dither drawn per-column from torch.rand(rows, generator=sr_gen) seeded 0xA1F0 for reproducibility. Theory: deterministic round-to-nearest gives correlated residual signs across rows near half-integer boundaries; GPTQ propagates the actual error but the per-row correlation couples cross-column errors. Stochastic dither decorrelates rows so error propagation acts on zero-mean per-row noise. Storage unchanged. Code +338B (23295->23633). Risk: noise variance may dominate over bias-removal at int6 bin width ~0.2 sigma.
810	750	23	000/005/017/088/108/142/151/164/177/196/212/245/267/280/298/324/336/377/475/491/538/596/750/810	meta	discard	1.075748	+0.003538	Enable amsgrad=True on optimizer_tok (tied tok_emb AdamW) only — caps v_t monotonically non-decreasing to fix rare-row Adam-divergence where beta2=0.95 lets v_r decay between row hits causing oversized updates; untouched axis across 800+ trials.
811	750	23	000/005/017/088/108/142/151/164/177/196/212/245/267/280/298/324/336/377/475/491/538/596/750/811	eval	discard	1.072790	+0.000580	Replace per-row GC with per-column GC on TTT SGD: attacks per-input-feature bias mode. exp_762 doubly-centered failed; pure column-only untested vs kept exp_592 row-only.
812	750	23	000/005/017/088/108/142/151/164/177/196/212/245/267/280/298/324/336/377/475/491/538/596/750/812	arch	size_blocked	1.073935		Swap MLP activation silu²→gelu² (Primer-style x²-family kept, but use GELU's sharper shoulder vs SiLU): byte-neutral 4-char swap, sparser hidden activations entering int6-quantized proj, untried in this swarm (only silu²/relu² endpoints have been tested).
813	750	23	000/005/017/088/108/142/151/164/177/196/212/245/267/280/298/324/336/377/475/491/538/596/750/813	curr	discard	1.074293	+0.002083	Predecessor-special CE mask in train_loader: y[x<3]=-100 drops CE on positions where input token is UNK/BOS/EOS, removing gradient noise from document-boundary-conditioned predictions. Mechanism-distinct from exp_679 (target-side mask, discarded +0.0017).
814	750	23	000/005/017/088/108/142/151/164/177/196/212/245/267/280/298/324/336/377/475/491/538/596/750/814	opt	size_blocked	1.073217		Cool target 0.93→0.94 on Muon momentum mm_blend (single-literal byte-neutral): probe untested UP midpoint between exp_750's kept 0.93 and exp_251's old-baseline-discarded 0.95.
815	750	23	000/005/017/088/108/142/151/164/177/196/212/245/267/280/298/324/336/377/475/491/538/596/750/815	ttt	size_blocked	1.077717		Hard-mask TTT z-loss to last-128 positions to match CE scope: replace logsumexp.mean() over all 2048 positions with logsumexp.mean() over only the last-128 logits (same window where CE is masked). Eliminates z-loss gradient on positions 0..1919 that have no CE signal during TTT; aligns regularization with the actual TTT objective. Distinct from exp_704 (soft tail re-weighting, size_blocked, never measured) — hard mask zeros out positions 0..1919 entirely. Bonus: -22 code bytes (23428→23406) by collapsing reduction='none'+reshape into pre-slice.
816	750	23	000/005/017/088/108/142/151/164/177/196/212/245/267/280/298/324/336/377/475/491/538/596/750/816	loss	discard	1.074947	+0.002737	Byte-neutral quartic TTT z-loss: 1e-5*lse.pow(2).mean() to 1e-7*lse.pow(4).mean() at L1401
817	750	23	000/005/017/088/108/142/151/164/177/196/212/245/267/280/298/324/336/377/475/491/538/596/750/817	reg	size_blocked	1.072721		Add weight_decay=5e-4 to eval-TTT SGD (the only WD=0 optimizer in the pipeline) — clean retry of exp_649 crash (which failed at unrelated dataloader L371) at half strength.
818	750	23	000/005/017/088/108/142/151/164/177/196/212/245/267/280/298/324/336/377/475/491/538/596/750/818	quant	size_blocked	1.072053		H-magnitude-proportional GPTQ damping: replace uniform H.diag.mul_(1.01) with H.diag.mul_(1 + 0.01 * H_ii / mean(H_ii)) so damping factor scales linearly with column importance — high-H 'sink' columns get up to ~1.05x ridge while low-H get ~1.001x, while AVERAGE multiplier stays at the kept 1.01 sweet spot. Continues the additive→multiplicative trajectory (exp_212→exp_280→exp_377) into a second-order H-proportional bias that no prior probe has touched.
819	750	23	000/005/017/088/108/142/151/164/177/196/212/245/267/280/298/324/336/377/475/491/538/596/750/819	meta	size_blocked	1.072611		Per-group ADAM_EPS split: optimizer_tok (tied tok_emb) eps 1e-8→1e-7 only, optimizer_scalar unchanged at h.adam_eps=1e-8.
820	750	23	000/005/017/088/108/142/151/164/177/196/212/245/267/280/298/324/336/377/475/491/538/596/750/820	tok	size_blocked	1.072325		Port exp_711 (embed_scale ONLY on residual baseline x0; entry-x to block 0 plain unit-RMS) onto exp_750 best baseline.
821	750	23	000/005/017/088/108/142/151/164/177/196/212/245/267/280/298/324/336/377/475/491/538/596/750/821	arch	size_blocked	1.073302		Mirror of kept exp_245's recurrence-aware ln_scale damping, applied to parallel-residual blocks: divide blocks 7-10 (parallel=True) ln_scale_factor by sqrt(2) since each parallel call adds 2 streams (attn+mlp) to residual vs 1 stream for sequential blocks. DeepNorm-style depth-balance for stream multiplicity.
822	750	23	000/005/017/088/108/142/151/164/177/196/212/245/267/280/298/324/336/377/475/491/538/596/750/822	curr	size_blocked	1.073631		Latin-square phase bucket count 8→6 (untested between failed 5 and kept 8): coupon-collector coverage across 13 shards/rank improves at 2.2 shards/bucket vs current 1.6, at the cost of slightly coarser phase granularity (341 vs 256 tokens).
823	750	23	000/005/017/088/108/142/151/164/177/196/212/245/267/280/298/324/336/377/475/491/538/596/750/823	opt	discard	1.072485	+0.000275	Polar Express per-iteration NS coefficients (PR #1787 / PR #1344): replace fixed (3.4445,-4.775,2.0315) tuple with 5 minimax-optimized (a,b,c) tuples, one per NS iteration at backend_steps=5. First-iteration coefficients (8.16,-22.48,15.88) act as expansion lens; subsequent tuples taper to convergence. Higher-quality polar factor at iso-cost.
824	750	23	000/005/017/088/108/142/151/164/177/196/212/245/267/280/298/324/336/377/475/491/538/596/750/824	eval	size_blocked	1.072466		Raise TTT-param numel threshold 10000 to 200000, freezing K/V projections (c_k, c_v at 131,072 each) during TTT. Adapts only Q, output proj, MLP, and tok_emb — LoRA-style value-static adaptation focusing the ~4 SGD steps/chunk on attention-pattern (Q) and output channels.</hypothesis> <parameter name="notes">Single-literal threshold change, 2 occurrences, +15 code bytes. Theory: chunk-specific adaptation benefits the attention pattern and output projections more than K/V which encode stable per-token information. Untried in eval domain — exp_337/exp_782 froze entire looped blocks (size_blocked); exp_357/exp_698 froze whole tok_emb (discard); subset-by-projection-type at this granularity has not been probed. K and V at 131,072 are frozen; Q (262,144), proj (262,144), and MLP (1M each) continue adapting. Per-block frozen surface: ~25%.</parameter> </invoke>
825	750	23	000/005/017/088/108/142/151/164/177/196/212/245/267/280/298/324/336/377/475/491/538/596/750/825	loss	discard	1.072266	+0.000056	Stack a dormant-by-default entropy-floor hinge on the TTT inner CE: 1e-4 * F.relu(1.0 - H(p)).mean() in addition to kept exp_596 z-loss. Activates only when post-update softmax entropy drops below 1 nat (chunk-overfit collapse), zero gradient on well-calibrated positions — mechanism-distinct from all ~20 prior z-loss / confidence-penalty / amax-logit variants on this axis.
826	750	23	000/005/017/088/108/142/151/164/177/196/212/245/267/280/298/324/336/377/475/491/538/596/750/826	reg	size_blocked	1.072387		Extend exp_491's selective-freeze policy to also exclude tied tok_emb [8192,512]=4M params during eval-TTT: tok_emb is the single largest tensor and accumulates conflicting gradients per TTT step from its dual role (input embedding + tied LM head), so freezing it removes the dominant TTT-update noise source while leaving 4 MLP/attn matrices to adapt.
827	750	23	000/005/017/088/108/142/151/164/177/196/212/245/267/280/298/324/336/377/475/491/538/596/750/827	opt	crash			Recurrence-aware Muon LR: scale main-train Muon base_lr by 1/sqrt(num_loops+1)=0.577 on looped blocks [3..5] only, equalizing per-step weight-space drift against the sqrt(3)x gradient accumulation those physical blocks see (each invoked 3x per forward).
828	750	23	000/005/017/088/108/142/151/164/177/196/212/245/267/280/298/324/336/377/475/491/538/596/750/828	quant	size_blocked	1.073554		Half-amplitude rescue of exp_818's size_blocked H-magnitude-proportional damping (bpb=1.072053, Δ=-0.000157, +642B over cap): center the per-column damping spread around mean (=1.01 exactly) with HALF the amplitude — H.diag.mul_(1.01 + 0.005·(H_ii - mean)/mean) so high-H gets up to ~1.025x ridge, low-H gets down to ~1.005x, mean precisely preserved. Half the spread → roughly half the Q-code entropy distortion → expected to fit under 16MB while keeping ~half the bpb gain (-0.00008 estimate).
829	750	23	000/005/017/088/108/142/151/164/177/196/212/245/267/280/298/324/336/377/475/491/538/596/750/829	ttt	size_blocked	1.073632		Replace global L2-norm gradient clip (1.0) with per-element value clip (0.1) during TTT SGD: caps outlier gradient elements that pollute the Nesterov momentum buffer over 13 chunks while preserving direction information in well-behaved tensors that global L2-norm shrinks uniformly.
830	750	23	000/005/017/088/108/142/151/164/177/196/212/245/267/280/298/324/336/377/475/491/538/596/750/830	arch	crash			Per-head sub-LN: F.rms_norm(y, (head_dim,)) on attention output between XSA and attn_out_gate, decoupling gate sigmoid regime + proj's int6 quant input range from V-magnitude × ln_scale_factor variance. Retry of exp_640 mechanism with.contiguous() guard for FA3 non-contig output (suspected prior crash cause).
831	750	23	000/005/017/088/108/142/151/164/177/196/212/245/267/280/298/324/336/377/475/491/538/596/750/831	meta	size_blocked	1.072416		SCALAR_LR 0.02 → 0.019 (gentle -5% DOWN midpoint between current and exp_792's failed -10% size_blocked-at-improvement-bpb-1.071951): retry the strongest recent meta signal at half the step to pass the size gate, on the proven scalar-control-LR DOWN axis (exp_177 ADAM_WD DOWN kept).
832	750	23	000/005/017/088/108/142/151/164/177/196/212/245/267/280/298/324/336/377/475/491/538/596/750/832	tok	size_blocked	1.073465		Reparameterize embed_scale [D] from linear (init=1) to log-exp (init=0, applied as torch.exp(log_s)): bitwise-identical step 0, but Adam-WD on log_s pulls s→1 (the init), not s→0 as the current linear param does. Multiplicative-update geometry on the per-feature scale.
833	750	23	000/005/017/088/108/142/151/164/177/196/212/245/267/280/298/324/336/377/475/491/538/596/750/833	curr	size_blocked	1.073724		Length curriculum: mask y positions seq_len//2.. with -100 for first 25% of train wallclock, forcing CE gradient onto positions 0..1023 (short context) early; full long-context training resumes after.
834	750	23	000/005/017/088/108/142/151/164/177/196/212/245/267/280/298/324/336/377/475/491/538/596/750/834	eval	discard	1.072545	+0.000335	Replace TTT cosine LR decay with linear (1-ci/(N-1)) across chunks — preserves total LR mass but no early plateau and slightly more tail LR.
835	750	23	000/005/017/088/108/142/151/164/177/196/212/245/267/280/298/324/336/377/475/491/538/596/750/835	opt	size_blocked	1.075299		Recurrence-aware Muon LR (bugfix retry of exp_827): scale main-train Muon base_lr by 1/sqrt(num_loops+1)=0.577 on looped blocks [3..5] only. Previous trial crashed on name parsing — base_model.blocks.named_parameters() returns names without 'blocks.' prefix, so block_idx = name.split('.')[0] not [1]. Fix is one-character.
836	750	23	000/005/017/088/108/142/151/164/177/196/212/245/267/280/298/324/336/377/475/491/538/596/750/836	loss	size_blocked	1.073303		Gentle focal CE (γ=0.25, mean-preserving) on TTT inner CE only — first focal probe on TTT axis (prior focal exp_054/144/439/498 all targeted main CE). Composes with kept exp_596 z-loss orthogonally.
837	750	23	000/005/017/088/108/142/151/164/177/196/212/245/267/280/298/324/336/377/475/491/538/596/750/837	reg	size_blocked	1.073053		SGLD-style Gaussian gradient noise injected into TTT inner-loop SGD (alpha=h.ttt_lr*0.01, added pre-AVG so all_reduce synchronizes noise across ranks).
