exp_id	parent_exp	depth	path	specialist	status	val_bpb	delta_vs_best	hypothesis
177	164	8	000/005/017/088/108/142/151/164/177	meta	keep	1.075858	-0.000038	Reduce adam_wd 0.02→0.005 (4×) on scalar-params-only AdamW group: ln_scale (init=1.0), qk_gain (init=5.25), skip_gates, skip_weights all live far from 0 so WD's pull-to-zero fights their natural operating point — at scalar_lr=0.02 and ~4000 steps the effective shrink factor is non-trivial (~exp(-1.6)≈0.20 without gradient compensation), meaning grads spend budget counteracting a misaligned prior.
189	177	9	000/005/017/088/108/142/151/164/177/189	ttt	discard	1.075927	+0.000131	Freeze scalar/norm parameters (p.ndim<=1: ln_scale, qk_gain, skip_gates, skip_weights) during TTT — matrices still adapt fully but the ~30K sensitive scalar params (in exp_177's ADAM_WD=0.005 group) are held fixed to avoid chunk-local over-calibration from SGD+Nesterov over ~60 steps.
190	177	9	000/005/017/088/108/142/151/164/177/190	tok	keep	1.075333	-0.000463	Add a learnable per-feature gamma vector (embed_scale, shape=[512], init=1.0) applied right after the input-embed RMSNorm, decoupling per-feature entry magnitudes from the tied tok_emb row statistics that are shared with the logit projection.
199	190	10	000/005/017/088/108/142/151/164/177/190/199	tok	discard	1.077814	+0.002568	Add a symmetric learnable per-feature head_scale (shape=[512], init=1.0) applied to x right before the tied F.linear(x, tok_emb.weight) projection — mirrors exp_190's embed_scale on the output side and decouples output logit weighting from input embed weighting (both paths use the same tied tok_emb matrix).
200	190	10	000/005/017/088/108/142/151/164/177/190/200	opt	discard	1.075849	+0.000603	Delay Muon momentum cool-down to the last half of warmdown: hold peak momentum 0.99 for lr_scale∈[0.5, 1.0], then cool 0.99→0.92 as lr_scale goes 0.5→0 (cool_factor = min(1.0, 2.0 * lr_scale)); peak-momentum time grows from 28% to 64% of budget.
201	190	10	000/005/017/088/108/142/151/164/177/190/201	quant	size_blocked	1.075951		Replace uniform per-row std with Hessian-diagonal-weighted per-row RMS when setting GPTQ clip scale: rows whose weight mass sits on high-activation-variance columns get proportionally tighter scales, size-neutral.
203	190	10	000/005/017/088/108/142/151/164/177/190/203	eval	discard	1.075533	+0.000287	Cosine-cool TTT SGD momentum in lockstep with existing TTT LR cosine: 0.9→0.5 across chunks (cos_mom = 0.5 + 0.4*cos_frac), matching cos_lr curve. High momentum + small LR at tail otherwise lets stale high-LR velocity dominate updates (Nesterov amplifies effect).
204	190	10	000/005/017/088/108/142/151/164/177/190/204	meta	discard	1.076515	+0.001269	Reduce scalar_lr 0.02 to 0.015 on scalar-params AdamW group (ln_scale, qk_gain, skip_gates, skip_weights, plus exp_190's embed_scale [512] now dominating the group): exp_194 went 0.02 to 0.03 (discard +0.0003) and exp_177 shrank adam_wd on the same group (kept -0.0005), both signalling the group prefers gentler updates now that embed_scale (init=1.0) is present.
205	190	10	000/005/017/088/108/142/151/164/177/190/205	loss	discard	1.075948	+0.000702	Stack exp_186's u² position-weighted CE (pw=0.9+0.2·u², mean-preserving) onto exp_190's embed_scale best — position-axis loss tilt has never been composed with the tok-domain embed_scale keep, and exp_190's current baseline reverted to plain F.cross_entropy.
191	177	9	000/005/017/088/108/142/151/164/177/191	opt	discard	1.075885	+0.000552	Shrink muon_momentum_warmup_fraction 0.22→0.16: continues exp_088's proven "faster momentum ramp" direction (kept, -0.001115). With warmdown beginning at frac=0.28, this doubles the at-peak-momentum plateau from 6% (0.22→0.28) to 12% (0.16→0.28) of the 600s budget, giving Muon more full-0.99-momentum convergence while LR is still at peak before exp_010's cosine cool-down kicks in during warmdown.
192	177	9	000/005/017/088/108/142/151/164/177/192	quant	discard	1.075979	+0.000646	Shrink GPTQ block_size 64 to 32 in gptq_quantize_weight: doubles Hessian-compensated error-propagation events per matrix, continuing exp_108's kept 128-to-64 trend. Size-neutral (identical Q codes and fp16 scales).
193	177	9	000/005/017/088/108/142/151/164/177/193	eval	discard	1.075752	+0.000419	Raise TTT cosine LR floor from 0 to 0.1×ttt_lr: late chunks (last ~20% where cos≈-1→0) currently receive effectively-zero TTT updates, starving later-chunk scoring. The new curve decays from 1.0 at ci=0 to 0.1 at ci=N-1, keeping a gentle drip of adaptation through the tail.
194	177	9	000/005/017/088/108/142/151/164/177/194	meta	discard	1.079175	+0.003842	Raise scalar_lr 0.02 to 0.03 on scalar-params AdamW group (ln_scale, qk_gain, skip_gates, skip_weights).
196	177	9	000/005/017/088/108/142/151/164/177/196	curr	keep	1.075246	-0.000087	Stratified per-batch shard sampling in ShuffledSequenceLoader.next_batch (largest-remainder method): replace multinomial rng.choice(p=remaining/total) with a deterministic quota assignment per batch — floor(B*remaining_s/total) per shard, leftover slots to largest-fractional-part shards. Caps within-batch shard-count variance from multinomial std≈1.9 (B=48,K=12) to ≤1, tightening the gradient estimator when FineWeb shards have distinct crawl-batch content distributions. Time-averaged shard coverage unchanged.
206	196	10	000/005/017/088/108/142/151/164/177/196/206	arch	crash			NormFormer-style sandwich RMSNorm on residual-path outputs: wrap attn_out and mlp_out with F.rms_norm(dim=-1) before multiplying by the existing per-channel attn_scale / mlp_scale, so the learnable scale controls magnitude while direction is unit-RMS normalized.
207	196	10	000/005/017/088/108/142/151/164/177/196/207	curr	discard	1.076096	+0.000850	Halve Latin-square phase bucket count 8→4 in ShuffledSequenceLoader (bucket width seq_len/4=512 vs seq_len/8=256): with only ~2-3 shard-epochs per 600s run, fewer buckets double per-shard phase-range coverage (50-75% vs 25-37.5%) at the cost of coarser per-epoch shifts.
208	196	10	000/005/017/088/108/142/151/164/177/196/208	reg	discard	1.075283	+0.000037	Split Muon weight decay on attention matrices by FUNCTION: raise muon_wd_qk=0.14 (1.47x baseline) on c_q/c_k (whose output is immediately RMS-normed, so weight magnitude is scale-invariant for softmax — only direction matters), keep muon_wd=0.095 on c_v/proj (scale-bearing into residual stream).
209	196	10	000/005/017/088/108/142/151/164/177/196/209	eval	crash			Extend eval_seq_len 2048→2560: YaRN-style RoPE scaling (already implemented in Rotary) + partial RoPE (16/64 dims, 75% NoPE channels) lets scored tokens see ~2496 tokens of context instead of 1984 (26% deeper), at ~1.3-1.5x eval fwd cost; also deepens TTT training sequences since both share eval_seq_len.
210	196	10	000/005/017/088/108/142/151/164/177/196/210	opt	discard	1.075678	+0.000432	Linear grad_clip_norm anneal in lockstep with lr_scale: clip * (0.5 + 0.5*lr_scale), i.e. 0.3→0.15 as lr_scale 1.0→0.0. No-op at peak-LR, tightens in warmdown tail to reduce outlier-gradient contamination of EMA-averaged weights.
211	196	10	000/005/017/088/108/142/151/164/177/196/211	tok	discard	1.075405	+0.000159	Restore exp_190's learnable per-feature embed_scale gamma (shape=[512], init=1.0) applied right after the input-embed RMSNorm on top of exp_196 baseline — the current best exp_196 (curr: stratified shard sampling) was rebased off a pre-exp_190 parent and so dropped the embed_scale keep; combining the two orthogonal kept changes should recover both deltas.
212	196	10	000/005/017/088/108/142/151/164/177/196/212	quant	keep	1.075022	-0.000224	Raise GPTQ Hessian damping 0.01→0.02 (2×): exp_016 already showed 0.01→0.003 hurt bpb by +0.000354, so the opposite direction is untried and motivated — higher ridge gives smoother Hinv, less error amplification across block-sequential cascades, lower-entropy Q (compression-friendly) on a 36M model with noisy 64-batch H estimates.
223	212	11	000/005/017/088/108/142/151/164/177/196/212/223	ttt	eval_budget_overrun	1.077336		Increase TTT epochs per chunk 4→5: direct extrapolation of the only twice-validated TTT axis (exp_014 Δ=-0.000278 and exp_017 Δ=-0.000413 both kept 3→4); with Nesterov (exp_151) + cos_lr decay already in place, the added 5th epoch runs at the lowest LR per chunk and should provide modest additional per-chunk refinement without destabilizing earlier-epoch-dominated updates.
224	212	11	000/005/017/088/108/142/151/164/177/196/212/224	meta	discard	1.075572	+0.000550	Lower matrix_lr 0.022→0.020 (−9%): exp_214 showed +9% (0.022→0.024) hurt by +0.000180, so the untried opposite direction probes whether the Muon LR optimum actually sits below 0.022 (adam_wd has already been halved post-exp_177, so the effective regularization landscape has shifted since matrix_lr was last tuned).
225	212	11	000/005/017/088/108/142/151/164/177/196/212/225	arch	discard	1.363735	+0.288713	Swap MLP activation from SiLU² to Primer-canonical ReLU²: F.silu(fc(x)).square() → F.relu(fc(x)).square(). Primer (So et al., 2021) proved ReLU² beats every alternative for small LM, and it is the nanoGPT-speedrun default — current code's SiLU² is an uninvestigated deviation.
226	212	11	000/005/017/088/108/142/151/164/177/196/212/226	loss	eval_budget_overrun	1.075661		Restore exp_186's u² position-weighted CE (pw = 0.9 + 0.2·u², mean-preserving over T=2048) on top of exp_212; the proven PW keep (Δ=-0.000062) was dropped from the current best lineage at exp_190→exp_196→exp_212, and the quantization-axis exp_212 change is orthogonal to training gradient shape.
227	212	11	000/005/017/088/108/142/151/164/177/196/212/227	curr	discard	1.077588	+0.002566	Cross-rank+cross-shard Latin-square phase coordination: replace per-(rank,shard) random permutation(8) with deterministic phase[(rank,si)][j]=(rank+si+j) mod 8, so first-epoch phase offsets tile [0,8) uniformly across the rank x shard grid instead of multinomial-colliding, giving max starting-offset diversity in the first shard-epoch where most of the short run lives.
229	212	11	000/005/017/088/108/142/151/164/177/196/212/229	tok	discard	1.078914	+0.003892	Add a single learnable scalar logit_temp (init=1.0) inside the output softcap: softcap*tanh(logit_temp*logits/softcap). Direct output-side analog of the existing learnable qk_gain=5.25; lets the tied tok_emb decouple output logit sharpness from input embedding magnitude at ~0 byte cost.
230	212	11	000/005/017/088/108/142/151/164/177/196/212/230	opt	discard	1.075233	+0.000211	Cosine-anneal grad_clip_norm from 0.3 at peak to 0.15 at end of warmdown (C¹-smooth via 0.5*(1 + 0.5*(1 - cos(pi*lr_scale)))), lockstep with LR — revival of never-run exp_036, targets outlier-gradient contamination of the EMA tail where low-LR updates are dominated by averaging.
231	212	11	000/005/017/088/108/142/151/164/177/196/212/231	quant	discard	1.075302	+0.000280	Continue damp trajectory: GPTQ Hessian damp coefficient 0.02→0.03 (1.5×). exp_212 showed 0.01→0.02 helped by -0.000224; exp_016 showed 0.01→0.003 hurt by +0.000354. This tests whether the optimum is past 0.02 or bracketed between 0.02 and 0.03.
232	212	11	000/005/017/088/108/142/151/164/177/196/212/232	ttt	discard	1.075520	+0.000498	Reset SGD momentum buffer at each TTT chunk boundary: stale Nesterov momentum from the prior chunk's text distribution drags the first SGD step of the next chunk, and cosine-decayed per-chunk LR amplifies this drag at late chunks (LR shrinks while momentum magnitude does not).
233	212	11	000/005/017/088/108/142/151/164/177/196/212/233	meta	discard	1.075362	+0.000340	Loosen grad_clip_norm 0.3→0.4 (+33%): exp_169 tested the −33% side (0.3→0.2, discard +0.000124); the +33% side is completely untried. The 3-loop recurrence amplifies loop-layer gradient norms, so a slightly looser clip preserves informative updates during the peak-LR × peak-momentum window without risking the kind of clip-induced saturation a tighter value showed.
234	212	11	000/005/017/088/108/142/151/164/177/196/212/234	eval	eval_budget_overrun	1.077738		Halve ttt_chunk_tokens 65536 to 32768: doubles score-train boundaries and total TTT SGD steps while keeping total SGD-token exposure constant; finer-grained Nesterov-momentum trajectory.
235	212	11	000/005/017/088/108/142/151/164/177/196/212/235	arch	discard	1.078327	+0.003305	Full QKV-norm: add F.rms_norm on V in CausalSelfAttention.forward (symmetric with existing Q/K norm). Decouples attn output magnitude from input scale, makes XSA's internal F.normalize(v) a near no-op, and narrows V's dynamic range for GPTQ int6 calibration of self.proj. Especially valuable under 3-layer recurrence where V is re-projected repeatedly.
236	212	11	000/005/017/088/108/142/151/164/177/196/212/236	loss	discard	1.075623	+0.000601	Steeper u² position-weighted CE: pw = 0.8 + 0.4·u² (ratio 1.5, mean-preserving) vs current 0.9 + 0.2·u² (ratio 1.22). Probes the untested "PW coefficient strength" axis — exp_156 (linear 1.22) and exp_186 (u² 1.22) both kept, but no ratio > 1.22 has run (exp_034 at 3.0 was aborted).
237	212	11	000/005/017/088/108/142/151/164/177/196/212/237	curr	discard	1.075052	+0.000030	Eval-aligned step-function position weighting on training CE: upweight the last 64 positions' loss by 1.5x (mean-preserving), matching exactly the stride-64 sliding-window regime the evaluator scores. Targets eval's scoring distribution — every eval-scored token sits in positions [T-64, T) with 1984-2047 tokens of context — without the smooth-ramp compute overhead or off-target early-position weighting of exp_186's u² scheme.
238	212	11	000/005/017/088/108/142/151/164/177/196/212/238	reg	discard	1.077681	+0.002659	LR-coupled Muon weight-decay boost during warmdown: multiply per-group weight_decay by 1/max(lr_scale, 0.667) (cap 1.5x) in step_fn so inside Muon's p *= (1 - lr*wd) update the effective per-step decay lr*wd_eff stays ~constant over lr_scale in [0.667, 1] instead of collapsing toward 0 with the 72% warmdown tail — schedule-targeted regularization orthogonal to exp_141 (depth-targeted) and exp_164 (type-targeted).</hypothesis> <parameter name="notes">Three-line insertion in step_fn after the existing per-optimizer lr-scale loop (~line 1457). Computes muon_wd_boost = 1/max(lr_scale, 0.667) and writes it into both Muon param groups (attn wd=h.muon_wd=0.095, mlp wd=h.muon_wd_mlp=0.125). Zero new params, zero hyperparam adds, ~600 code bytes. Muon.step already reads group.get('weight_decay', 0.0) fresh each step (~line 838), so dynamic updates compose cleanly. Not inside torch.compile (step_fn is eager). Warmup passes with lr_scale=1.0 → boost=1.0 → no effect. Cap 0.667 (1.5x) chosen gentler than exp_218's 2x cap for tok_emb — matrix params may be more sensitive given exp_187's regression at muon_wd_mlp*1.24 on recurrent layers. Reg-domain context: first SCHEDULE-targeted Muon WD trial. exp_218 applied the same idea to tok_emb with unclear outcome (TSV row mangled). Total integrated added decay during warmdown ~ +0.15x equivalent uniform boost — lighter than exp_141's +0.30x. Risk: over-tightening matrix params in the deep tail where EMA is pulling the model stationary; lr_scale-floor cap mitigates by letting wd_boost taper below 0.667. Size preflight: code_bytes=23126; model structure unchanged.
239	212	11	000/005/017/088/108/142/151/164/177/196/212/239	tok	discard	1.075186	+0.000164	Re-apply exp_190's per-feature embed_scale gamma (nn.Parameter shape=[embedding_dim], init=1.0) right after the pre-backbone rms_norm of the embedding output, registered in the scalar AdamW group. exp_212's best branch diverged before exp_190 and does NOT contain embed_scale (verified by grep on the snapshot) — this is a stacking test of a proven −0.000463 change onto a branch that never inherited it.
240	212	11	000/005/017/088/108/142/151/164/177/196/212/240	quant	discard	1.075152	+0.000130	Shrink GPTQ block_size 64→32: direct continuation of exp_108's winning direction (128→64, Δ=-0.000079); 2× more error-propagation events per matrix (every 32 cols vs every 64), finer Hessian-aware residual redistribution. Untried with a real run (exp_035 was 128→32 but harness_aborted).
241	212	11	000/005/017/088/108/142/151/164/177/196/212/241	opt	discard	1.076364	+0.001342	Raise Muon Newton-Schulz iteration count 5→6 (muon_backend_steps): never mutated in ~230 trials; the one truly untouched knob inside the Muon algorithm proper. With MuonEq-R row-normalize amplifying small-sigma directions, 5 NS5-quintic iters leave residual non-orthogonality on tall/skinny matrices; an extra iteration pushes orthogonality ~99% to ~99.8% so the sqrt(aspect) spectral-bound rescale in Muon.step aligns more consistently across matrix shapes.
242	212	11	000/005/017/088/108/142/151/164/177/196/212/242	meta	discard	1.077065	+0.002043	Re-apply exp_003's proven winning ema_decay 0.9965→0.998 on top of exp_212: the 0.998 change was kept at Δ=-0.000776 from baseline but was lost when exp_005 (arch-rope) branched from exp_000 rather than exp_003, and it has never been retested on any subsequent best. Widens EMA half-life ~200→~346 steps, capturing more of the 72% warmdown tail.
243	212	11	000/005/017/088/108/142/151/164/177/196/212/243	ttt	discard	1.075514	+0.000492	Replace TTT across-chunk cosine LR decay (1.0→0.0) with linear decay (1.0→0.5) so late chunks actually adapt: at num_chunks=13, cosine sends ci=10/11 to 6.7%/1.7% of ttt_lr (near-zero adaptation for ~15-20% of eval compute); linear keeps them at 58%/54%, reclaiming late-chunk SGD as real adaptation on the val distribution.
244	212	11	000/005/017/088/108/142/151/164/177/196/212/244	eval	discard	1.075511	+0.000489	Tighten TTT gradient clip 1.0 to 0.5
245	212	11	000/005/017/088/108/142/151/164/177/196/212/245	arch	keep	1.074750	-0.000272	Recurrence-aware ln_scale correction: divide ln_scale_factor by sqrt(num_loops+1)=sqrt(3) for looped blocks 3-5 (called 3× per forward pass), equalizing their total residual contribution against single-call layers; zero new params, zero byte impact.
254	245	12	000/005/017/088/108/142/151/164/177/196/212/245/254	arch	discard	1.075543	+0.000793	Parallel-residual ln_scale correction: divide ln_scale_factor by sqrt(2) for parallel blocks 7 to 10, a sibling of exp_245 loop-aware correction on a non-overlapping block range.
256	245	12	000/005/017/088/108/142/151/164/177/196/212/245/256	loss	discard	1.075332	+0.000582	Restore exp_186's proven u² position-weighted CE (pw=0.9+0.2·u², mean-preserving) on the exp_245 lineage: the PW keep (Δ=-0.000062 on exp_176) was dropped at exp_190→exp_196→exp_212→exp_245, and exp_226's attempt to restore on exp_212 hit eval_budget_overrun (infra, not measurement).
257	245	12	000/005/017/088/108/142/151/164/177/196/212/245/257	reg	discard	1.075685	+0.000935	Set adam_wd 0.005 to 0.0 on scalar AdamW group, removing WD on control params whose optima are nonzero.
258	245	12	000/005/017/088/108/142/151/164/177/196/212/245/258	arch	crash			Learnable scalar MLP-attn coupling β (init=0) in parallel blocks: inside blocks 7-10, feed β*attn_out into mlp_norm's input (mlp_in = x_in + β*attn_out). At init β=0 exactly recovers PaLM-style parallel block (zero regression risk); training can drift β>0 to restore partial sequential-block expressiveness without collapsing parallel residuals. Orthogonal to exp_245 (loop ln_scale) and exp_254 (static parallel ln_scale, discarded — that was a damper, this is a cross-path conditioner). Adds 11 scalar params (~44 bytes fp32), zero compute bump at init.
259	245	12	000/005/017/088/108/142/151/164/177/196/212/245/259	curr	discard	1.075711	+0.000961	Cross-shard anti-correlated phase cycles: replace per-shard independent permutation(8) with a shared base permutation shifted by shard-index mod 8, so concurrent shards always use distinct phases (eliminating the ~12.5% phase-collision probability per pair) and batches spanning multiple shards see maximally diverse positional offsets.
260	245	12	000/005/017/088/108/142/151/164/177/196/212/245/260	tok	discard	1.076893	+0.002143	Add output-side per-feature readout gain (shape=[embedding_dim], init=1.0) applied right before the tied F.linear softmax after final_norm/head_proj. Structurally distinct from exp_190's input-side embed_scale (which is not on the exp_245 branch): the input gamma modulates the residual stream as it enters, the output gain modulates logit computation — breaks hard-tied symmetry in an orthogonal direction.
261	245	12	000/005/017/088/108/142/151/164/177/196/212/245/261	quant	keep	1.074724	-0.000026	Shrink GPTQ block_size 64→32 (halve from exp_108's winning 128→64): doubles cross-block Hessian-aware error-propagation events per weight matrix from 8 to 16, moves GPTQ closer to exact Optimal-Brain-Surgeon per-column updates without changing quantization codes/scales distribution (zero brotli entropy impact, zero size risk).
270	261	13	000/005/017/088/108/142/151/164/177/196/212/245/261/270	quant	discard	1.074759	+0.000155	Raise GPTQ Hessian damping 0.02→0.03 (1.5× from exp_212's winning 0.01→0.02 bump): monotonic improvement from the known 0.003→0.01→0.02 sweep suggests the Hessian ridge is still under-regularized at 0.02, so a cautious next step probes where the peak lies without overshooting.
273	261	13	000/005/017/088/108/142/151/164/177/196/212/245/261/273	opt	discard	1.075858	+0.001254	Add Gradient Centralization (Yong et al., 2020) inside Muon: subtract per-row mean of 2D grads (each output neuron's grad zero-mean over input dim) before the momentum buffer update — removes mean-direction bias that LayerNorm would null out in the next forward anyway.
274	261	13	000/005/017/088/108/142/151/164/177/196/212/245/261/274	meta	discard	1.075086	+0.000482	Narrow EMA averaging window: EMA_DECAY 0.9965 to 0.994 (effective horizon 286 to 167 steps). Every attempt to RAISE ema_decay back to exp_003's kept 0.998 failed on newer baselines (exp_119, 149, 184, 242); the narrower direction is the only untested side of this axis.
