exp_id	parent_exp	depth	path	specialist	status	val_bpb	delta_vs_best	hypothesis
262	245	12	000/005/017/088/108/142/151/164/177/196/212/245/262	opt	size_blocked	1.075224		Cool Adam beta2 (0.95→0.90) during LR warmdown in lockstep with lr_scale on the two AdamW groups (tok_emb + scalar), mirroring exp_010's proven Muon-momentum cool — faster 2nd-moment adaptation in the low-LR tail lets preconditioning track recent gradient variance on rare-signal directions.
264	245	12	000/005/017/088/108/142/151/164/177/196/212/245/264	ttt	keep	1.074640	-0.000084	Alternate TTT batch-traversal order across per-chunk epochs (fwd, rev, fwd, rev): decorrelates SGD+momentum noise across epochs and smooths both epoch- and chunk-boundary transitions (chunk i's last batch ends spatially near chunk i+1's first batch under even ttt_epochs=4).
272	264	13	000/005/017/088/108/142/151/164/177/196/212/245/264/272	loss	crash			In-batch rare-token CE boost (mean-preserving): weight = 1 + 0.1/occurrences then normalized to mean 1, so targets appearing once in a microbatch get 1.10× gradient and common ones ~1.0×. Frequency-based reweighting is orthogonal to the CE-based focal family (exp_054/144 discard) and to position-weighted CE (saturated on current lineage).
276	264	13	000/005/017/088/108/142/151/164/177/196/212/245/264/276	eval	discard	1.074722	+0.000118	Add weak L2 anchor (coef 5e-4) on TTT SGD, pulling params back toward pre-TTT snapshot each step: regularizes cross-chunk drift without a hard reset (exp_255: discard) or across-chunk momentum cosine-cool (exp_265: discard).
265	245	12	000/005/017/088/108/142/151/164/177/196/212/245/265	eval	discard	1.074880	+0.000240	Cosine-cool TTT SGD momentum 0.9→0.5 in lockstep with existing cos_lr across chunks, so late low-LR chunks shed the stale direction carried from early high-LR chunks without a hard per-chunk reset.
266	245	12	000/005/017/088/108/142/151/164/177/196/212/245/266	loss	discard	1.076043	+0.001403	Selective (confidence-gated) entropy bonus: loss = CE - 0.005·mean(H * [ce<0.5]), applying the entropy-flattening pressure only on positions the model has already learned (p_correct>0.6), leaving hard-token gradient untouched — exp_132's blanket β=0.003 entropy bonus discarded because it degraded learning on hard tokens.
267	245	12	000/005/017/088/108/142/151/164/177/196/212/245/267	tok	keep	1.074604	-0.000036	Port exp_190's proven per-feature input-side embed_scale (shape=[embedding_dim], init=1.0) onto the exp_245 baseline — applied after the post-lookup F.rms_norm and before embed_proj, registered in the scalar AdamW group.
277	267	13	000/005/017/088/108/142/151/164/177/196/212/245/267/277	tok	size_blocked	1.074768		Add per-vocab input gain (learnable shape=[vocab_size], init=1.0) applied after rms_norm at embedding lookup (NOT at tied head) — breaks tied-embedding symmetry along the vocab axis, orthogonal to exp_267's embed_scale (which breaks it along the feature axis).
278	267	13	000/005/017/088/108/142/151/164/177/196/212/245/267/278	arch	size_blocked	1.074949		Add per-head attention-OUTPUT gain (o_gain, shape=[num_heads], init=1.0) applied to attention output before proj — symmetric to the existing q_gain input-side scalar that already ships in the 1.0810 SOTA (QK-Gain 5.25). Gives the scalar-AdamW group (low wd, fused Adam) a direct channel to modulate each head's output magnitude, complementing Muon's update on proj's input rows.
279	267	13	000/005/017/088/108/142/151/164/177/196/212/245/267/279	curr	discard	1.077376	+0.002772	Replace exp_142's 8-phase latin-square in ShuffledSequenceLoader with a golden-ratio Weyl (Kronecker) low-discrepancy phase sequence: phase_u(j, si) = (j*phi + si*phi^2) mod 1, phi=(sqrt(5)-1)/2. Eliminates the 5-of-13 shard phase collisions per reset-epoch in the 8-phase scheme, gives continuous (not 256-token-grid) phase placement, and fills phase space with O(log j / j) star-discrepancy.
280	267	13	000/005/017/088/108/142/151/164/177/196/212/245/267/280	quant	keep	1.074550	-0.000054	Replace flat additive Hessian damping (0.02·mean(diag)) with signal-proportional multiplicative damping (H_ii *= 1.02): preserves column-conditioning structure and specifically raises Hinv[j,j] on high-activation 'sink' columns, which reduces GPTQ error-propagation magnitude where it matters most.
290	280	14	000/005/017/088/108/142/151/164/177/196/212/245/267/280/290	quant	discard	1.074835	+0.000285	Progressive tail-damping in GPTQ: apply linear 1.0→1.02 multiplicative ramp on H.diagonal in processing order (after permutation), on top of exp_280's uniform 1.02 pre-perm damping — later columns accumulate GPTQ error and their Cholesky diagonal d=Hinv[j,j] amplifies err=(w-q·s)/d, so extra damping only at the tail tames amplification without over-damping well-conditioned early columns.
291	280	14	000/005/017/088/108/142/151/164/177/196/212/245/267/280/291	loss	size_blocked	1.077423		Replace plain CE with mean-preserving focal CE (γ=0.5): weight each token by (1-p_t)^0.5 / mean((1-p_t)^0.5), detached. Confidence-conditioned per-token reweighting is structurally orthogonal to prior position-weighted / rare-token / z-loss attempts; redirects gradient mass from saturated easy tokens to hard tokens without changing overall loss magnitude at init.
292	280	14	000/005/017/088/108/142/151/164/177/196/212/245/267/280/292	opt	discard	1.076227	+0.001677	Lower muon_momentum_warmup_start 0.92→0.88 (DOWN direction; exp_015 only tested UP 0.92→0.94 which was discard +0.00181): widens the ramp range from 7pts to 11pts so early training trusts fresh gradients more before momentum buffer accumulates peak-LR history, and the linear-interp schedule still reaches peak 0.99 at the same 22% mark.
293	280	14	000/005/017/088/108/142/151/164/177/196/212/245/267/280/293	reg	discard	1.076386	+0.001836	Branch-level DropPath on MLP only, p=0.04, time-gated to peak-LR phase (lr_scale==1.0): keeps the noise-averaging warmdown/EMA tail completely clean while injecting coarse stochasticity during the high-LR learning phase.
295	280	14	000/005/017/088/108/142/151/164/177/196/212/245/267/280/295	ttt	discard	1.074728	+0.000178	Within-chunk linear LR decay across TTT epochs (ep_scale: 1.0→0.75→0.5→0.25 for 4 epochs, replacing the current constant cos_lr per chunk): with my_chunk_seqs≈4 per rank and batch_seqs=32 the inner loop re-trains 4 epochs on the SAME 4 seqs, so β=0.9 Nesterov compounds same-direction gradients and risks overshoot by epoch 3. Scaling lr down across epochs dampens this while keeping the epoch-0 peak step size for fast initial adaptation.
296	280	14	000/005/017/088/108/142/151/164/177/196/212/245/267/280/296	arch	size_blocked	1.077493		V-norm: add F.rms_norm on V per-head in CausalSelfAttention.forward, symmetric to existing Q/K rms_norm — Q/K normalization controls score magnitude, V-norm controls attention-output magnitude, tightening residual-stream variance and helping GPTQ int6 quantization.
297	280	14	000/005/017/088/108/142/151/164/177/196/212/245/267/280/297	eval	discard	1.074816	+0.000266	Polyak-averaged weights for TTT scoring pass (alpha=0.5 EMA of post-training theta), applied only to chunks ci>=1 while training continues on raw theta — smooths Nesterov mom=0.9 SGD trajectory oscillations at scoring time.
298	280	14	000/005/017/088/108/142/151/164/177/196/212/245/267/280/298	tok	keep	1.074482	-0.000068	Move embed_scale INSIDE the post-tok_emb RMSNorm: replace `F.rms_norm(x) * embed_scale` with `F.rms_norm(x * embed_scale)`. Pre-norm (gauge-fixed) per-feature weighting — residual entering block 0 always has unit-RMS so embed_scale's gradient projects onto the tangent plane and can only learn RELATIVE feature weights (no global-magnitude gauge degeneracy). Removes redundancy with block-0 pre-RMSNorm which currently washes out the post-norm gain on the attn/MLP path.
307	298	15	000/005/017/088/108/142/151/164/177/196/212/245/267/280/298/307	tok	discard	1.079959	+0.005477	Put a learnable per-feature embed_bias INSIDE the post-tok_emb RMSNorm alongside embed_scale: `F.rms_norm(x*embed_scale + embed_bias,...)`. At init (b=0) bitwise-identical to exp_298; post-init the bias is gauge-projected onto the unit-RMS sphere so it learns a shared per-feature directional pull orthogonal to embed_scale's gain — crucially distinct from the failed exp_288 (which placed the bias OUTSIDE RMSNorm and broke block-0's unit-RMS invariant, the exact invariant exp_298 proved essential).
308	298	15	000/005/017/088/108/142/151/164/177/196/212/245/267/280/298/308	loss	size_blocked	1.088355		2-ahead auxiliary CE (alpha=0.05): same causal logits at position t also predict target at t+2 (ProphetNet-style forward-looking supervision). nll1 + 0.05 * nll2. Training-only, zero inference cost, zero new params.
309	298	15	000/005/017/088/108/142/151/164/177/196/212/245/267/280/298/309	curr	size_blocked	1.075475		Mask training CE loss on positions 0..63 of each sequence (slice logits[:,64:] and targets[:,64:] before cross_entropy): val_bpb uses a stride-64 sliding window so every scored token has ≥1984 tokens of context, whereas training currently weights positions 0..63 equally — aligns the training gradient distribution with the eval scoring distribution.
310	298	15	000/005/017/088/108/142/151/164/177/196/212/245/267/280/298/310	quant	discard	1.074658	+0.000176	Saliency-weighted GPTQ column ordering: replace act-order perm=argsort(H.diag()) with perm=argsort(H.diag() * ||W[:,j]||^2) — quantize columns by expected squared output contribution rather than activation-magnitude alone, so high-output-impact columns get clean-buffer quantization and low-impact columns absorb propagated error.
312	298	15	000/005/017/088/108/142/151/164/177/196/212/245/267/280/298/312	reg	size_blocked	1.074234		Isolate q_gain into its own AdamW sub-group with weight_decay=0; leave all other scalars at adam_wd=0.005. Prevents the baseline QK-Gain 5.25 from drifting down under decoupled WD pull-toward-zero.</hypothesis> <parameter name="notes">Surgical scalar-WD split in Optimizers.__init__. Orthogonal to exp_257 (zero WD on all scalars, catastrophic) and exp_283 (target-decay toward init on all, discard). 88 q_gain scalars.
314	298	15	000/005/017/088/108/142/151/164/177/196/212/245/267/280/298/314	opt	size_blocked	1.074206		Sqrt-shaped Muon momentum cool-down (mm_blend = sqrt(lr_scale)) replaces exp_010's linear-in-lr_scale blend — same peak (0.99) and floor (0.92) but momentum holds higher through the warmdown middle (e.g. at lr_scale=0.1 m=0.942 vs 0.927 linear), preserving gradient-direction averaging when lr is already small.
315	298	15	000/005/017/088/108/142/151/164/177/196/212/245/267/280/298/315	ttt	eval_budget_overrun	1.076420		Per-group TTT LR dampening on tied tok_emb: split SGD into two param groups with tok_emb at 0.5× cosine-scheduled LR and everything else at 1.0×. Under tie_embeddings tok_emb absorbs gradient from both the input-embed and output-head paths in a single backward, making its effective step larger; exp_049's full-freeze (LR=0) was discard, so this is the gentler middle ground between freeze and full LR.
316	298	15	000/005/017/088/108/142/151/164/177/196/212/245/267/280/298/316	arch	discard	1.076301	+0.001819	test
317	298	15	000/005/017/088/108/142/151/164/177/196/212/245/267/280/298/317	tok	size_blocked	1.075024		Add a learnable per-vocab logit bias (shape=[vocab_size]=8192, init=0) added INSIDE the softcap to the tied-softmax output, offloading the unigram frequency prior from the residual stream onto a dedicated bias vector.
318	298	15	000/005/017/088/108/142/151/164/177/196/212/245/267/280/298/318	loss	size_blocked	1.074464		Smooth sigmoid eval-aligned position weighting in training CE: pw = 1 + 0.2*sigmoid(12*(u - (T-64)/(T-1))) centered at the eval stride-64 boundary, mean-preserving — same eval-alignment intent as exp_300 but with a smooth transition avoiding the compression-hostile last-64 weight cliff that caused size_blocked.
319	298	15	000/005/017/088/108/142/151/164/177/196/212/245/267/280/298/319	quant	discard	1.074849	+0.000367	Plain L2-optimal per-row scale refinement post-GPTQ with Q fixed
320	298	15	000/005/017/088/108/142/151/164/177/196/212/245/267/280/298/320	tok	crash			Mirror exp_298's winning gauge-fixed input-side embed_scale on the output side: add a learnable per-feature output_scale (shape=[model_dim]=512, init=1.0) INSIDE the final RMSNorm, replacing `x = self.final_norm(x)` with `x = F.rms_norm(x * self.output_scale,...)`.
321	298	15	000/005/017/088/108/142/151/164/177/196/212/245/267/280/298/321	arch	crash			Add (num_loops+1)=3 learnable scalar gains (loop_iter_scale, init=1.0) that multiply each call's residual contribution (attn+mlp additions) per loop-iteration in the depth-recurrent segment [3..5]; at init=1.0 this reproduces exp_245 exactly, while the optimizer gains a free per-iteration knob distinct from exp_245's uniform 1/sqrt(3) input damp.
322	298	15	000/005/017/088/108/142/151/164/177/196/212/245/267/280/298/322	eval	discard	1.086174	+0.011692	Distribution-matched TTT loss: in eval_val_ttt inner SGD, backprop CE only on the last stride=64 positions of each 2048-token training seq (positions with context>=1984), matching the sliding-window eval scoring distribution exactly.
323	298	15	000/005/017/088/108/142/151/164/177/196/212/245/267/280/298/323	reg	discard	1.074538	+0.000056	Target-decay toward init (1.0) for embed_scale ONLY via a 2-line post-optimizer correction (add wd_eff*1.0 to undo AdamW's pull-to-0 and retarget it to pull-to-1). embed_scale sits inside a post-tok_emb RMSNorm gauge fix with init=1.0 and a structurally non-zero optimum, so adam_wd=0.005's default pull-to-0 fights its purpose; retargeting preserves WD strength but aims it at the init.
324	298	15	000/005/017/088/108/142/151/164/177/196/212/245/267/280/298/324	opt	keep	1.074280	-0.000202	Floor Muon-momentum warmdown blend at 0.25 (momentum floor 0.9375 vs 0.92) so the deepest ~18% of training (lr_scale<0.25) averages direction over a wider window — milder variant of exp_314's sqrt-hold (size_blocked at bpb=1.074206) aimed at capturing the hold signal while limiting weight-trajectory drift.
333	324	16	000/005/017/088/108/142/151/164/177/196/212/245/267/280/298/324/333	curr	discard	1.075953	+0.001673	Replace random-permutation 8-phase Latin-square with Van der Corput base-2 (bit-reversed) order [0,4,2,6,1,5,3,7] plus per-shard random rotation: low-discrepancy at every prefix length 1..8, so the 2-5 phases each shard actually visits in 600s are guaranteed evenly spread rather than randomly clusterable.
335	324	16	000/005/017/088/108/142/151/164/177/196/212/245/267/280/298/324/335	opt	discard	1.074354	+0.000074	Power-shape Muon momentum blend: replace max(lr_scale, 0.25) with max(lr_scale**0.85, 0.25) — preserves exp_324's deep-tail floor while holding momentum slightly higher through mid-warmdown to recover part of exp_314's sqrt-blend bpb benefit (1.074206, size_blocked) without tripping size.
336	324	16	000/005/017/088/108/142/151/164/177/196/212/245/267/280/298/324/336	meta	keep	1.074171	-0.000109	Lower muon_wd_mlp 0.125 → 0.115 (−8%) on MLP-only Muon WD group: probes the untested DOWN direction on the split-by-type axis established by exp_164's keep (0.095→0.125 on MLPs).
346	336	17	000/005/017/088/108/142/151/164/177/196/212/245/267/280/298/324/336/346	meta	size_blocked	1.075010		Lower muon_wd 0.095 → 0.087 (−8%) on attention-group Muon WD — symmetric mirror of exp_336's kept muon_wd_mlp 0.125→0.115 (−8%) move, probing the untested gentle DOWN direction on the attention side of the exp_164 type split.
347	336	17	000/005/017/088/108/142/151/164/177/196/212/245/267/280/298/324/336/347	ttt	size_blocked	1.074633		Two-group TTT optimizer: scale TTT LR by 1/(num_loops+1)=1/3 for looped blocks [loop_start..loop_end] to compensate the (num_loops+1)x gradient amplification from shared-weight recurrence — equalizes effective per-step update magnitude between looped and non-looped blocks under ~4 SGD steps/chunk.
348	336	17	000/005/017/088/108/142/151/164/177/196/212/245/267/280/298/324/336/348	quant	discard	1.074282	+0.000111	Ledoit-Wolf-style GPTQ Hessian off-diagonal shrinkage (×0.95, diag preserved) after exp_280's diag-only ×1.02 damping — targets finite-sample noise in H's off-diagonal entries that propagates through Hinv into cross-column error compensation.
349	336	17	000/005/017/088/108/142/151/164/177/196/212/245/267/280/298/324/336/349	loss	discard	1.074706	+0.000535	Position-weighted CE with convex u^4 (quartic) ramp 0.9 → 1.1, mean-preserving: untested shape-exponent on the proven tail-upweight axis from exp_156 (linear, keep) and exp_186 (u^2, keep), concentrating upweight on the last ~300 positions where sliding-window-stride-64 eval density is highest
350	336	17	000/005/017/088/108/142/151/164/177/196/212/245/267/280/298/324/336/350	tok	discard	1.075715	+0.001544	Semi-orthogonal init for tied tok_emb.weight (shape [8192, 512]) with gain = tied_embed_init_std * sqrt(vocab_size) ≈ 0.4525 to Frobenius-match prior normal_(std=0.005): the 512 feature columns become orthonormal 8192-dim vocab vectors at t=0, decorrelating the softmax's feature axes before training starts.
351	336	17	000/005/017/088/108/142/151/164/177/196/212/245/267/280/298/324/336/351	eval	discard	1.074460	+0.000289	Halve TTT SGD grad_clip_norm 1.0 → 0.5 (single literal at line 1418) — tighter clip should stabilize the first-chunk TTT updates (raw un-adapted model produces noisy gradients that interact with Nesterov@0.9 momentum and 4 epochs of 32-seq batches) while leaving later-chunk updates effectively unchanged (their grad norms are already well below 0.5 after initial adaptation). Orthogonal axis: prior eval trials tuned ttt_epochs (014/017), Nesterov (151), traversal order (264), anchor (027), but TTT grad-clip is untouched.
352	336	17	000/005/017/088/108/142/151/164/177/196/212/245/267/280/298/324/336/352	arch	discard	1.076365	+0.002194	Rotated-phase depth recurrence: left-rotate loop_seg by iter_idx (iter 0 [3,4,5], iter 1 [4,5,3], iter 2 [5,3,4]), so each loop block visits each loop-position exactly once across the 3 iterations — breaks translational symmetry of identically-repeated loop calls, zero params, zero bytes, preserves exp_245's 1/sqrt(3) correction exactly.
353	336	17	000/005/017/088/108/142/151/164/177/196/212/245/267/280/298/324/336/353	reg	discard	1.074605	+0.000434	Split Muon attention WD into sub-buckets by functional role: Q/K (post-proj RMSNormed → only direction matters) stay at muon_wd=0.095, V and attn.proj (content-routing path, structural analog of MLP's fc→proj) get muon_wd_attn_vp=0.115 matching current MLP WD.
354	336	17	000/005/017/088/108/142/151/164/177/196/212/245/267/280/298/324/336/354	curr	discard	1.075244	+0.001073	Replace per-shard random Latin-square phase permutation with a Van der Corput (bit-reversal) low-discrepancy visit order [0,4,2,6,1,5,3,7], rotated per-shard via random initial _phase_epoch offset: at 600s budget shards typically reset 2-3 times, so early-visit phase coverage dominates and random perms can unluckily draw adjacent-phase clusters that waste diversity; vdC guarantees maximal phase spread on every prefix for every shard.
355	336	17	000/005/017/088/108/142/151/164/177/196/212/245/267/280/298/324/336/355	opt	size_blocked	1.074645		Raise Muon-momentum warmdown blend floor 0.25→0.35 (continues exp_324's floor-raising axis: momentum floor 0.9375→0.9455 across the deepest ~24% of training vs ~18% previously, buying more direction averaging on noisy tail grads without touching peak momentum).
356	336	17	000/005/017/088/108/142/151/164/177/196/212/245/267/280/298/324/336/356	meta	size_blocked	1.074669		Half-step continuation of exp_336's winning axis: muon_wd_mlp 0.115 → 0.110 (−4.35%), probing whether MLP-Muon WD optimum is still left of current best without the overshoot risk of another −8% step.
357	336	17	000/005/017/088/108/142/151/164/177/196/212/245/267/280/298/324/336/357	ttt	discard	1.074797	+0.000626	Freeze tied tok_emb.weight during TTT: the tied weight receives antagonistic gradients from both the input-embedding lookup and the output-projection path (F.linear against tok_emb.weight), destabilizing the ~120-step SGD adaptation; freezing isolates TTT updates to transformer blocks + scaling params.
358	336	17	000/005/017/088/108/142/151/164/177/196/212/245/267/280/298/324/336/358	quant	size_blocked	1.074899		Hessian-diag-weighted per-row sigma in GPTQ: replace unweighted W.std(dim=1) with sqrt(mean(W^2 * Hdiag/mean(Hdiag))), mean-rescaled to preserve layer-wide average scale. Aligns per-row quantization scale with the actual E[err^T H err] objective — rows with energy in high-activation columns get more clip headroom, low-H rows get finer resolution. Zero size cost.
360	336	17	000/005/017/088/108/142/151/164/177/196/212/245/267/280/298/324/336/360	loss	size_blocked	1.074727		Concave (sqrt / u^0.5) position-weighted CE, mean-preserving 0.9 → 1.1 — probes the untested concave side of the shape-exponent family on the exp_336 baseline (linear, u^2 kept; u^4 discarded).
361	336	17	000/005/017/088/108/142/151/164/177/196/212/245/267/280/298/324/336/361	tok	size_blocked	1.075949		Add a learnable per-feature embed_bias (shape=[512], init=0.0) applied POST-RMSNorm, as the additive complement to exp_298's gauge-fixed multiplicative embed_scale (inside-RMSNorm).
362	336	17	000/005/017/088/108/142/151/164/177/196/212/245/267/280/298/324/336/362	opt	discard	1.074613	+0.000442	Linearly cool grad_clip_norm with warmdown LR (0.3 at peak → 0.15 at end, via lr_scale-proportional clip_scale=0.5+0.5*lr_scale), so the noisy low-LR tail updates get tighter clipping before they pollute the EMA state
