exp_id	parent_exp	depth	path	specialist	status	val_bpb	delta_vs_best	hypothesis
838	750	23	000/005/017/088/108/142/151/164/177/196/212/245/267/280/298/324/336/377/475/491/538/596/750/838	quant	size_blocked	1.071830		Tight 3-point per-row GPTQ scale grid {0.96, 1.0, 1.04} on top of current best — partial rescue of exp_728 (5-point {.8,.9,1,1.1,1.25} won val_bpb 1.069841 but size_blocked); tight 4 percent grid limits per-row Q histogram divergence so brotli stays under 16MB cap while still capturing tail-asymmetry signal that fixed clip_sigmas misses.
839	750	23	000/005/017/088/108/142/151/164/177/196/212/245/267/280/298/324/336/377/475/491/538/596/750/839	ttt	size_blocked	1.073632		Re-add exp_588's chunk-boundary momentum_buffer halving (mb.mul_(0.5) for ci>0) onto the new exp_750 baseline, banked by trimming the eval_val_ttt docstring + cosine comment for byte-negative net (-155 packed code bytes)
840	750	23	000/005/017/088/108/142/151/164/177/196/212/245/267/280/298/324/336/377/475/491/538/596/750/840	opt	discard	1.075173	+0.002963	Replace fixed Newton-Schulz coefficients (3.4445,-4.775,2.0315) with 5 per-iteration minimax-optimal Polar Express tuples (ported from PR#1792/PR#1344): first step uses aggressive (8.16,-22.48,15.88) to rapidly reduce error, subsequent steps use gentler corrections — produces a higher-quality Muon polar factor per gradient step.
841	750	23	000/005/017/088/108/142/151/164/177/196/212/245/267/280/298/324/336/377/475/491/538/596/750/841	tok	eval_budget_overrun	1.076039		Add learnable per-feature bias [embedding_dim=512, init=0] after the embed-RMSNorm, completing the affine transform (scale already learned via embed_scale); zero-init preserves step-0 equivalence, costs ~1 KB in artifact (float16 passthrough).
842	750	23	000/005/017/088/108/142/151/164/177/196/212/245/267/280/298/324/336/377/475/491/538/596/750/842	quant	size_blocked	1.076450		FreqGPTQ: weight GPTQ Hessian by sqrt(token_frequency/mean_freq) so high-frequency tokens (which dominate BPB) get proportionally higher error-correction priority during quantization.
843	750	23	000/005/017/088/108/142/151/164/177/196/212/245/267/280/298/324/336/377/475/491/538/596/750/843	arch	eval_budget_overrun	1.075364		In parallel-residual blocks (7-10), MLP branch reads pre-mix x while attn keeps reading x_in: asymmetric input routing concentrates x0-anchor through attn only.
844	750	23	000/005/017/088/108/142/151/164/177/196/212/245/267/280/298/324/336/377/475/491/538/596/750/844	reg	discard	1.082079	+0.009869	Stochastic depth with linear schedule (max_p=0.05 at last layer): randomly replace a block's output with its input during training, using a per-block tensor mask (fullgraph-compile safe), forcing ensemble-like subnetwork diversity across the 11 blocks and 3× recurrent loop calls.
845	750	23	000/005/017/088/108/142/151/164/177/196/212/245/267/280/298/324/336/377/475/491/538/596/750/845	meta	discard	1.074837	+0.002627	Per-group ADAM_EPS split: raise scalar-group AdamW eps 1e-8 to 1e-7 only, leave optimizer_tok at h.adam_eps. Inverse of exp_819 (tok-only raise, hurt).
846	750	23	000/005/017/088/108/142/151/164/177/196/212/245/267/280/298/324/336/377/475/491/538/596/750/846	ttt	discard	1.074403	+0.002193	Add Gradient Centralization to TTT SGD: zero-mean each 2D+ parameter gradient across input dims after DDP all_reduce and before clip_grad_norm. GC won Δ=−0.000300 on exp_538 (exp_592) and Δ=−0.000005 on exp_592 (exp_746), but was never applied to exp_750's branch (previous attempt exp_627 was size_blocked at ~23K packed bytes; current workdir is 19,856 packed bytes with +52B headroom).
847	750	23	000/005/017/088/108/142/151/164/177/196/212/245/267/280/298/324/336/377/475/491/538/596/750/847	eval	discard	1.074369	+0.002159	Fuse all_reduce loop with per-row Gradient Centralization (g.sub_(g.mean(1,True)) for 2D TTT params) in a single compact loop — equivalent to exp_592's GC that gave Δ=-0.000300 on exp_538, now applied to exp_750 baseline; uses dim==2 shorthand to stay within size budget (+34 packed bytes vs exp_795's larger per-row GC that size_blocked).
848	750	23	000/005/017/088/108/142/151/164/177/196/212/245/267/280/298/324/336/377/475/491/538/596/750/848	loss	discard	1.109208	+0.036998	Byte-weighted TTT CE (via val_data.base_bytes_lut + has_leading_space correction, normalized to mean=1) aligns TTT adaptation gradient with BPB metric: multi-byte subword tokens get proportionally more loss weight, matching how they contribute more to bits-per-byte evaluation. Composes with kept z-loss (exp_596). Adapted from PR #731's byte-weighted TTT technique.
849	750	23	000/005/017/088/108/142/151/164/177/196/212/245/267/280/298/324/336/377/475/491/538/596/750/849	curr	discard	1.074681	+0.002471	Replace per-shard _phase_epoch+_phase_order lists with a single global phase counter: all shard resets share one permuted sequence, guaranteeing all 8 Latin-square phases are covered in the first 8 resets (vs. only ~6.6 expected with independent per-shard permutations across 13 shards/rank).
850	750	23	000/005/017/088/108/142/151/164/177/196/212/245/267/280/298/324/336/377/475/491/538/596/750/850	opt	discard	1.076416	+0.004206	Replace linear LR warmdown with cosine shape: same 0→0 LR range and same total LR integral (0.5), but cosine holds LR ~14% higher at mid-warmdown and descends more smoothly — better EMA trajectory throughout the 72% warmdown phase.
851	750	23	000/005/017/088/108/142/151/164/177/196/212/245/267/280/298/324/336/377/475/491/538/596/750/851	tok	discard	1.076551	+0.004341	Add output-side per-feature embed_scale_out [512, init=1.0] multiplied onto x just before the tied LM-head F.linear, providing independent feature gating for the decoder side distinct from the input-side embed_scale (exp_267/298 kept). Also removes the harmful embed_bias from exp_841 (eval_budget_overrun).
852	750	23	000/005/017/088/108/142/151/164/177/196/212/245/267/280/298/324/336/377/475/491/538/596/750/852	meta	discard	1.075101	+0.002891	TIED_EMBED_LR 0.03 → 0.028 (gentle DOWN -6.7%): half-step retry of exp_252's failed -13.3% probe (depth 12, +0.001054) under the post-538/596/750 regime where 4 added regularizers (z-loss, attn_out_gate, scalar-freeze, mm_blend cool) have shifted the dominant 4.2M tied tok_emb's LR optimum DOWN, aligned with the recent meta DOWN-direction theme (exp_177 adam_wd, exp_336 muon_wd_mlp, exp_792 scalar_lr signal).
853	750	23	000/005/017/088/108/142/151/164/177/196/212/245/267/280/298/324/336/377/475/491/538/596/750/853	quant	discard	1.074783	+0.002573	Split GPTQ clip sigmas by layer type: MLP matrices use 15.0σ (wider, preserves outlier weights) while attention matrices keep current 12.85σ — MLP layers have heavier-tailed weight distributions post-training; uniform 12.85σ clips them too aggressively.
854	750	23	000/005/017/088/108/142/151/164/177/196/212/245/267/280/298/324/336/377/475/491/538/596/750/854	arch	eval_budget_overrun	1.074421		Q-only region-split RMSNorm: normalize Q's RoPE region [...,:rope_dims=16] and NoPE region [...,rope_dims:] independently before RoPE+q_gain, while K keeps joint norm. Pairs structurally with kept exp_475 bifurcated q_gain[H,2] which currently amplifies a jointly-normalized Q where the dominant region's RMS shrinks the other's. K stays joint since q_gain only operates on Q.
855	750	23	000/005/017/088/108/142/151/164/177/196/212/245/267/280/298/324/336/377/475/491/538/596/750/855	loss	discard	1.079554	+0.007344	Add label_smoothing=0.02 to training CE: reduces overconfidence during training, mild regularization, and may improve GPTQ quantization quality by keeping logit scale better-calibrated.
856	750	23	000/005/017/088/108/142/151/164/177/196/212/245/267/280/298/324/336/377/475/491/538/596/750/856	ttt	discard	1.074941	+0.002731	Cosine-decay TTT SGD momentum over chunks (0.9→0.45, floored at 0.5×ttt_momentum) mirroring existing cosine LR decay — early chunks retain high momentum for smooth gradient direction, late chunks use lower momentum for responsive local adaptation; also removes exp_846's GC which caused +0.002 regression.
857	750	23	000/005/017/088/108/142/151/164/177/196/212/245/267/280/298/324/336/377/475/491/538/596/750/857	reg	discard	1.082208	+0.009998	Muon WD taper: linearly reduce Muon weight_decay from 1.0× to 0.5× during training fraction 0.70→1.00, so late warmdown adapts at a relaxed WD that lets weights settle at their true optimum rather than being pulled toward zero when gradient signal is already tiny.
858	750	23	000/005/017/088/108/142/151/164/177/196/212/245/267/280/298/324/336/377/475/491/538/596/750/858	eval	eval_budget_overrun	1.073728		Halve TTT chunk size 65536→32768: doubles adaptation granularity (finer local specialization per 32K-token segment), increases proportion of tokens scored from an adapted model (~98%→~99%), and gives a more gradual cosine LR decay across chunks — all at zero extra compute since total training steps are unchanged.
859	750	23	000/005/017/088/108/142/151/164/177/196/212/245/267/280/298/324/336/377/475/491/538/596/750/859	curr	discard	1.074366	+0.002156	Gentle linear position-weight 0.9→1.1 on training CE loss (model.forward only; TTT and sliding eval bypass to forward_logits unaffected): upweights high-context positions aligned with stride-64 eval where ≥1984 context tokens are scored.
860	750	23	000/005/017/088/108/142/151/164/177/196/212/245/267/280/298/324/336/377/475/491/538/596/750/860	tok	size_blocked	1.074181		Add learnable per-feature additive bias (embed_bias [512], init=0) after the embedding RMSNorm, completing the LayerNorm affine pair (γ=embed_scale inside norm + β=embed_bias after norm), allowing the model to learn a token-independent baseline activation per feature.
861	750	23	000/005/017/088/108/142/151/164/177/196/212/245/267/280/298/324/336/377/475/491/538/596/750/861	curr	crash			Dynamic batch-size curriculum: half-batch (393K tokens) during the pre-warmdown phase (first 28% of wallclock = 168s), full-batch (786K) during warmdown — aligns batch noise with LR: high-LR exploration phase gets ~2x more gradient steps, warmdown gets precise signal.
862	750	23	000/005/017/088/108/142/151/164/177/196/212/245/267/280/298/324/336/377/475/491/538/596/750/862	opt	size_blocked	1.115030		Disable Nesterov lookahead on Muon during warmdown (set nesterov=False when lr_scale<1.0): near convergence Nesterov overshoots by adding mu*buf on top of the gradient, while pure heavy-ball is more conservative and settles into flatter minima that quantize better under GPTQ int6.
863	750	23	000/005/017/088/108/142/151/164/177/196/212/245/267/280/298/324/336/377/475/491/538/596/750/863	meta	discard	1.072400	+0.000190	TIED_EMBED_INIT_STD 0.005 → 0.006 (+20% UP, byte-neutral): genuinely untouched axis across 850+ trials. Sets std of tied tok_emb (4.2M params) which serves both input embedding AND output readout. With WARMUP_STEPS=20 fixed and the modern stack stacking 5 added regularizers (z-loss, attn_out_gate, scalar-freeze, GC, mm_blend cool), init magnitude shapes the first ~50 steps' Adam-warmup before regularizers can act; tied path init logit RMS rises from 0.113 to 0.136, modest discriminative signal.
864	750	23	000/005/017/088/108/142/151/164/177/196/212/245/267/280/298/324/336/377/475/491/538/596/750/864	quant	discard	1.074517	+0.002307	Frequency-weighted GPTQ Hessian: pre-scan calibration batches to count token frequencies, then up-weight top-100 most-frequent tokens by sqrt(2) in Hessian accumulation (H += (x*w)^T @ (x*w)), biasing GPTQ error minimization toward tokens that dominate average BPB.
865	750	23	000/005/017/088/108/142/151/164/177/196/212/245/267/280/298/324/336/377/475/491/538/596/750/865	arch	eval_budget_overrun	1.074554		k_gain[Hkv,2] init=1.0 mirrors exp_475 q_gain[H,2] on K side
866	750	23	000/005/017/088/108/142/151/164/177/196/212/245/267/280/298/324/336/377/475/491/538/596/750/866	ttt	discard	1.078642	+0.006432	Focal loss (γ=2) for TTT inner objective: replace CE with per-token reweighted loss (_ce * (1-exp(-_ce))^2).mean() so adaptation concentrates on document-specific hard tokens rather than uniformly across easy+hard tokens.
867	750	23	000/005/017/088/108/142/151/164/177/196/212/245/267/280/298/324/336/377/475/491/538/596/750/867	loss	discard	1.072324	+0.000114	Ramp TTT z-loss coefficient linearly from 2.5e-6 (epoch 0) to 1e-5 (epoch 3) via `1e-5*(_ep+1)/h.ttt_epochs`: epoch 0 gets 4× less constraint allowing max adaptation freedom, while final epoch retains the full 1e-5 stabilization; average regularization drops to 6.25e-6 vs current 10e-6.
868	750	23	000/005/017/088/108/142/151/164/177/196/212/245/267/280/298/324/336/377/475/491/538/596/750/868	eval	eval_budget_overrun	1.075093		Cosine-decay TTT z-loss coefficient (1e-5→0 over chunks): cold early chunks get full logsumexp^2 regularization to stabilize logit magnitude, while late adapted chunks get near-zero z-loss so confident sharp predictions aren't penalized by stale regularization.
869	750	23	000/005/017/088/108/142/151/164/177/196/212/245/267/280/298/324/336/377/475/491/538/596/750/869	reg	discard	1.072353	+0.000143	Split looped-block attn WD into third Muon group: blocks [loop_start=3..loop_end=5] get muon_wd_loop=0.115 (matching MLP WD) vs base attn 0.095, since these blocks are called 3× per forward and receive proportionally more gradient signal (exp_141 principle, never folded into main lineage).
870	750	23	000/005/017/088/108/142/151/164/177/196/212/245/267/280/298/324/336/377/475/491/538/596/750/870	arch	crash			ResFormer Value Residual Learning (arXiv 2410.17897, ACL 2025): per-layer learnable scalar λ blends current V with V_0 from layer 0 attention; init=0 → step-0 identical to baseline. Threaded through Block/Attention forward via v0 tuple-return.
871	750	23	000/005/017/088/108/142/151/164/177/196/212/245/267/280/298/324/336/377/475/491/538/596/750/871	arch	crash			Universal-Transformer-style per-loop-pass additive bias [num_loops+1=3, model_dim=512] added to the residual stream right before each looped-block (3-5) call under looping_active, giving the shared block params an explicit phase tag for the 3 iterative-refinement passes; init=0 → step-0 baseline.
872	750	23	000/005/017/088/108/142/151/164/177/196/212/245/267/280/298/324/336/377/475/491/538/596/750/872	quant	discard	1.072687	+0.000477	Halve GPTQ block_size 32→16: 2× more error-propagation flushes per matrix, continuing the proven 128→64→32 monotone-improvement trend; code distribution unchanged so size-safe.
873	750	23	000/005/017/088/108/142/151/164/177/196/212/245/267/280/298/324/336/377/475/491/538/596/750/873	opt	discard	1.072811	+0.000601	Raise EMA decay from 0.9965 to 0.9975: extends the weight-averaging window from ~286 steps to ~400 steps, capturing more of the near-converged warmdown trajectory for smoother GPTQ int6 quantization fidelity.
874	750	23	000/005/017/088/108/142/151/164/177/196/212/245/267/280/298/324/336/377/475/491/538/596/750/874	eval	discard	1.072294	+0.000084	Stack GC (proven exp_746 keep) + within-chunk TTT cosine LR warmdown (ep_lr = cos_lr * 0.5*(1+cos(π*ep/ttt_epochs)), ep=0→1.0x, ep=3→0.15x) onto exp_750: symmetric extension of the already-working cross-chunk cosine decay into the per-epoch dimension.
875	750	23	000/005/017/088/108/142/151/164/177/196/212/245/267/280/298/324/336/377/475/491/538/596/750/875	meta	discard	1.072965	+0.000755	TIED_EMBED_INIT_STD 0.005 to 0.004 (-20% DOWN, byte-neutral): symmetric mirror of exp_863's +20% UP probe (discard +0.000190). DOWN direction genuinely untouched. Tighter tok_emb init drops initial logit RMS 0.113 to 0.090, starting softmax closer to uniform so CE gradient flows more uniformly across rare rows in the first ~50 Adam steps before embed_wd=0.085 takes over. Aligned with meta DOWN-direction theme (exp_177 adam_wd, exp_336 muon_wd_mlp, exp_792 scalar_lr signal).
876	750	23	000/005/017/088/108/142/151/164/177/196/212/245/267/280/298/324/336/377/475/491/538/596/750/876	loss	discard	1.072554	+0.000344	Self-anchored TTT z-loss: replace 1e-5*logsumexp^2.mean() with 1e-5*(logsumexp - anchor).^2.mean() where anchor=per-chunk initial logsumexp captured on first mini-batch — penalizes drift from starting calibration rather than absolute magnitude, reducing competing gradient pressure on well-calibrated chunks while still stabilizing explosive drift.
878	750	23	000/005/017/088/108/142/151/164/177/196/212/245/267/280/298/324/336/377/475/491/538/596/750/878	curr	discard	1.072820	+0.000610	Inverted linear position ramp on training CE: w[t]=1.25-0.5*t/(T-1) upweights early/short-context positions (t=0→w=1.25) and downweights late/long-context (t=T-1→w=0.75), mean=1.0. TTT and sliding eval bypass via forward_logits. Direction opposite to discarded exp_859 (0.9→1.1 upweight-late); improves short-context language prior quality.
879	750	23	000/005/017/088/108/142/151/164/177/196/212/245/267/280/298/324/336/377/475/491/538/596/750/879	tok	discard	1.072515	+0.000305	Decouple embed_scale from x0: apply embed_scale only to working stream x entering block 0, while residual baseline x0 uses plain unit-RMS (no embed_scale). Currently x0=x after the scaled norm, so embed_scale affects BOTH paths. With plain x0, each block's mix[1]*x0 residual injection gets an unbiased token reference, letting mix weights learn unconstrained feature selection without embed_scale double-counting the feature weighting.
880	750	23	000/005/017/088/108/142/151/164/177/196/212/245/267/280/298/324/336/377/475/491/538/596/750/880	arch	size_blocked	1.072880		Universal-Transformer-style per-loop-pass additive bias [num_loops+1=3, model_dim=512] added to the residual stream right before each looped-block (3-5) call, giving the shared block params an explicit phase tag for the 3 iterative-refinement passes; init=0 → step-0 baseline; DDP-safe via zero-coeff anchor pulling all rows into the autograd graph.
881	750	23	000/005/017/088/108/142/151/164/177/196/212/245/267/280/298/324/336/377/475/491/538/596/750/881	ttt	discard	1.072970	+0.000760	TTT MLP-only adaptation: freeze all attention (Q/K/V/O) across all blocks during TTT inner loop, adapt only tok_emb + MLP (fc/proj) layers. Motivated by TTT-E2E (arXiv 2512.23675) finding that freezing attention/embeddings and updating only MLP layers avoids inner-loop instability and improves adaptation quality.
882	750	23	000/005/017/088/108/142/151/164/177/196/212/245/267/280/298/324/336/377/475/491/538/596/750/882	opt	discard	1.072522	+0.000312	Raise muon_wd (attn group) from 0.095 to 0.105 (~10% UP): attn WD has never been independently probed UP since the attn/MLP split (exp_164); MLP WD moved 0.095→0.125→0.115 (two keeps) while attn stayed at 0.095 — tighter attn weight distributions should improve GPTQ int6 fidelity similarly to how higher MLP WD helped.
883	750	23	000/005/017/088/108/142/151/164/177/196/212/245/267/280/298/324/336/377/475/491/538/596/750/883	meta	discard	1.072729	+0.000519	ENABLE_LOOPING_AT 0.35 to 0.40 (gentle +14% UP probe on a genuinely untouched UP direction): only prior probe on this axis was exp_536 (DOWN to 0.28, hurt +0.000440); UP direction is freshly unexplored across 870+ trials. Mechanism aligns with SHIFT staged-training principle — give layers 3-5 more single-pass training in the peak-LR window so they build cleaner base representations before the 3x recurrence multiplier engages, shifting bulk of looped-mode training into the warmdown's smoother gradient regime.
884	750	23	000/005/017/088/108/142/151/164/177/196/212/245/267/280/298/324/336/377/475/491/538/596/750/884	eval	discard	1.072957	+0.000747	Stack chunk-boundary TTT momentum-buffer halving (mul_(0.5) at ci>0, exp_588 technique, Δ=-0.000727 from exp_538 but absent from exp_750 lineage) plus GC row-centering (exp_746, absent from exp_750), removing exp_874's discarded per-epoch cosine LR.
885	750	23	000/005/017/088/108/142/151/164/177/196/212/245/267/280/298/324/336/377/475/491/538/596/750/885	arch	discard	1.073904	+0.001694	Asymmetric RoPE coverage: looped blocks 3-5 get rope_dims=32 (2× the global default) while non-looped blocks (0-2, 6-10) keep rope_dims=16. Composes with the bifurcated q_gain[H,2] (each block keeps its own per-region gain) and tests whether 3×-replayed iterative-refinement layers benefit from finer per-pass positional discrimination, while non-looped blocks retain NoPE bandwidth for content-key roles.
886	750	23	000/005/017/088/108/142/151/164/177/196/212/245/267/280/298/324/336/377/475/491/538/596/750/886	tok	discard	1.074825	+0.002615	Add output-side per-feature head_scale [dim=512, init=1.0] applied to x before the tied LM head projection, giving the model independent input/output feature-importance weights under the tied-embedding constraint (distinct from exp_775 which reused the same embed_scale).
887	750	23	000/005/017/088/108/142/151/164/177/196/212/245/267/280/298/324/336/377/475/491/538/596/750/887	reg	discard	1.073658	+0.001448	Lower muon_wd_mlp 0.115 → 0.108 (−6.1%), continuing exp_336's proven DOWN direction (0.125→0.115 was keep Δ=−0.000109); exp_773 had the same edit but was size_blocked from dirty workdir — clean rebase to exp_750 removes that blocker.
888	750	23	000/005/017/088/108/142/151/164/177/196/212/245/267/280/298/324/336/377/475/491/538/596/750/888	quant	discard	1.072256	+0.000046	3-level quantile GPTQ damping (correct direction): top-20% H-diag cols get 1.015x, middle 60% keep 1.01x, bottom-20% get 1.005x — iso-mean 1.01 but concentrates ridge on high-importance columns so their error propagates more aggressively to less-important followers.
