exp_id	timestamp	specialist	parent_exp	baseline_exp	domain	hypothesis	expected_delta	status	core_metric	val_bpb	delta_vs_best	train_s	total_s	job_name	snapshot_path	notes
073	2026-04-29T04:54:10Z	opt	025	025	opt	Reduce --matrix-lr from 0.02 to 0.016 (-20%) on clean exp_025 base (window=L, ratio=130, 0.2241). exp_054 tested the UP direction (0.025, -0.0083 worse) but the DOWN direction is unexplored. At ratio=130 (~27K steps with 65% warmdown = 17.7K decay steps), a more conservative Muon base LR may reduce overshooting during the long warmdown phase. Pure flag change, no vendor edits.	-0.003	discard	0.211900	0.782066	-0.012200	4678.608010	4678.608010	nc-opt-0069		All tried opt directions on exp_025 have been discards. exp_054 showed higher matrix-lr (0.025) hurts by -0.0083. This tests the symmetric lower direction (0.016) which has not been explored. If the optimizer is symmetric around 0.02, expect ~-0.004. If 0.02 is above optimum for ratio=130's long warmdown, could see a small gain. Rebased cleanly to exp_025 (beta2=0.9, ns_steps=5, no other vendor changes).
074	2026-04-29T05:30:06Z	data	025	025	data	Clean ratio 130→140 (+7.7% training tokens) from a rebased exp_025 baseline. All prior ratio=140 trials (exp_035: 0.2208) ran from dirty workdirs with accumulated code changes; this is the first clean data-domain test of more tokens on top of the best known config.	+0.005	discard	0.215300	0.782409	-0.008800	5062.828987	5062.828987	nc-data-0070		Rebased cleanly to exp_025 (undoes exp_069 staggered-shard changes in dataloader.py). Only edit: TRAIN_ARGS '--target-param-data-ratio' '130'→'140'. No vendor code changes. Research confirms best-fit BOS-aligned packing already optimal (Amazon Science: best-fit packing +15-17% vs concatenation). Estimated wall ~84 min (6 min buffer vs 90-min cap). The 7.7% token increase continues the improvement trend: ratio=100→130 gave +0.0212 delta.
075	2026-04-29T05:41:32Z	sched	025	025	sched	Couple WD decay to LR warmdown: hold WD constant at peak during warmup+stable phase, then cosine 1→0 only during the warmdown period. Vs current cosine-over-all-training which halves WD by step 35% of training (warmdown start). Stronger regularization during high-LR stable phase; same final WD=0.	+0.003	discard	0.206500	0.787543	-0.017600	4673.302210	4673.302210	nc-sche-0071		Single function change: get_weight_decay in base_train.py. Current: weight_decay_scaled * 0.5 * (1 + cos(pi*it/num_iterations)) → decays from step 0. New: constant at weight_decay_scaled until warmdown_start = (1-warmdown_ratio)*num_iterations, then cosine to 0 over warmdown. At ratio=130 (~27K steps, warmdown_ratio=0.65): stable phase runs ~9506 steps where WD is now 0.28 vs decaying 0.28→0.183 under old schedule. Evidence: exp_057 (constant WD=0.28 throughout)=-0.037 shows WD must go to zero; this variant still does. exp_025 (cosine over all)=0.2241 baseline. LR-coupled WD decay is principled: regularization most needed when LR is highest (stable phase), least needed during convergence (warmdown).
076	2026-04-29T06:10:37Z	sys	025	025	sys	Remove BF16 cast before Polar Express in muon_step_fused: FP32 param gradients were being quantized to BF16 (7 mantissa bits) before orthogonalization and the subsequent weight update. Keeping everything in FP32 gives more accurate Muon updates. Overhead is <0.5% of step time.	+0.003	discard	0.210700	0.783538	-0.013400	4714.488556	4714.488556	nc-sys-0073		Rebased cleanly to exp_025. Single change: muon_step_fused optim.py line 117 — `X = g.bfloat16() if COMPUTE_DTYPE == torch.bfloat16 else g` → `X = g.float()`. In our setup, linear-layer gradients accumulate in FP32 (autograd casts BF16 matmul grad back to FP32 when accumulating into FP32 param.grad). The original bf16 cast before Polar Express discarded 16 mantissa bits of precision, biasing the orthogonalized update direction and all downstream variance-reduction/weight-update steps. With g staying FP32, lr/wd scalars also stay FP32 (lr_t.to(g.dtype)), making the full optimizer update numerically cleaner. The Polar Express matmuls on GPU run via TF32 so overhead vs BF16 is ~2× for those small stacked-param matmuls (<0.5% of total step wall time at d12 scale).
077	2026-04-29T06:11:44Z	arch	025	025	arch	Change --head-dim from 128→96 on exp_025 base (window=L, ratio=130): n_head=8 (768/96), max attention logit 1.44×√96≈14.1 just below softcap=15 (minimal compression vs baseline 16.3>15). Unexplored sweet spot between head-dim=64/12heads (exp_063, 0.2179) and head-dim=128/6heads (baseline, 0.2241).	-0.003	discard	0.196100	0.782849	-0.028000	4799.154250	4799.154250	nc-arch-0073		Pure flag change: --head-dim 128→96. With aspect-ratio=64 and depth=12, base_dim=768; model_dim=((768+96-1)//96)*96=768 (unchanged). n_head=768//96=8, n_kv_head=8 (no GQA, fully determined by build_model_meta). QK vectors have L2=√96, so max logit=1.44*√96≈14.1 — just below softcap=15. exp_063 (64-dim, 12 heads) gave 0.2179 (-0.006); 96-dim (8 heads) interpolates between the two. Monotone head-count trend would predict ~0.2220 for 8 heads. Rebased cleanly to exp_025 (undoes exp_072 learnable-RMSNorm changes).
078	2026-04-29T06:21:11Z	opt	025	025	opt	Reduce NorMuon beta2 from 0.9 → 0.80 on clean exp_025 base (window=L, ratio=130): exp_068 showed 0.90 > 0.95 (slower-adapting hurt by -0.0034), so trying the opposite direction — faster variance adaptation. Lower beta2 means per-neuron step-size normalization converges in ~5 steps vs ~10, reducing early-training bias in the second moment estimate.	+0.003	discard	0.203400	0.783488	-0.020700	4804.546028	4804.546028	nc-opt-0074		Single-file change: gpt.py setup_optimizer Muon groups beta2=0.9→0.80. Rebased cleanly to exp_025 (matrix-lr=0.02, ratio=130, BF16). Motivation: exp_068 (beta2=0.95) was closest opt trial to baseline at -0.0034; the 0.90>0.95 ordering suggests more-adaptive second moment is better, not worse. 0.80 pushes further in that direction — tighter effective window (~5 steps), faster convergence of variance normalization. Risk: more step-size noise across batches during steady state.
079	2026-04-29T16:15:03Z	opt	025	025	opt	Move ve_gate weights from Muon to AdamW (lr=0.2, matching smear_gate): ve_gate.weight (6×12, 432 params total across 6 layers) was inadvertently swept into matrix_params via list(self.transformer.h.parameters()), getting Muon's polar-express orthogonalization — inappropriate for tiny gating matrices. AdamW gives per-element adaptivity better suited to learning near-zero sigmoid gates; effective LR rises from ~0.028 (Muon) to 0.2 (AdamW), enabling faster gate adaptation. Consistent with smear_gate treatment.	+0.004	discard	0.200900	0.783397	-0.023200	4824.754179	4824.754179	nc-opt-0079		Rebased cleanly to exp_025 (beta2=0.9, matrix-lr=0.02, ratio=130, window=L). Single change: in setup_optimizer(), extract ve_gate params from matrix_params using id-based filtering, add dedicated AdamW group with lr=0.2, betas=(0.8,0.95), eps=1e-10, wd=0.0. Updated assert to include ve_gate_params. No changes to optimizer mechanics, schedule, or architecture.
080	2026-04-29T16:15:13Z	sched	025	025	sched	Increase --warmdown-ratio from 0.65→0.70 on exp_025 base (window=L, ratio=130, 0.2241): exp_042 showed reducing warmdown to 0.40 was very harmful (-0.022), meaning the decay phase is critical. Testing the unexplored opposite direction: 5% more warmdown (17,727→19,091 steps) for more gradual LR decay, at the cost of ~1,364 fewer stable peak-LR steps. Total compute unchanged (ratio=130 fixed).	+0.002	discard	0.220300	0.783430	-0.003800	4839.540017	4839.540017	nc-sche-0079		Pure flag change: --warmdown-ratio 0.65→0.70. Warmdown starts at step ~8,182 (30% of ~27,272) instead of 9,546 (35%). All other args unchanged from exp_025. The long warmdown has been the most critical schedule feature; extending it slightly tests if we are still on the improving side of the warmdown-ratio curve or past it.
081	2026-04-29T16:21:00Z	data	025	025	data	Halve best-fit buffer_size from 1000→500 on clean exp_025 base (window=L, ratio=130): exp_056 (buffer=2000) hurt badly (−0.025), suggesting larger buffers create excessive length-clustering that harms gradient diversity. Smaller buffer preserves more temporal data locality and reduces O(n) Python scan overhead per position fill.	+0.003	discard	0.201900	0.784464	-0.022200	4826.076254	4826.076254	nc-data-0079		Clean rebase to exp_025. Single change: buffer_size default 1000→500 in tokenizing_distributed_data_loader_with_state_bos_bestfit. Tested pattern: buffer=2000 (exp_056) scored 0.1990 (−0.025 vs 0.2241 baseline), buffer=4000+sort (exp_043) scored 0.2041. Only direction not tested: buffer &lt; 1000. If larger=worse, smaller might be better. Buffer=500 still provides 500 docs (~128K tokens of choices at avg 256 tok/doc) for adequate packing quality while reducing length-cluster correlation.
082	2026-04-29T16:23:44Z	arch	025	025	arch	Peri-LN: add post-norm to each sublayer output in Block.forward — x = x + norm(f(norm(x))) instead of x = x + f(norm(x)). Zero new parameters, bounds each block's residual contribution. Used in Gemma-3 (arXiv:2502.02732).	+0.005	discard	0.210300	0.784613	-0.013800	4846.078840	4846.078840	nc-arch-0079		Peri-LN (Peripheral Layer Normalization) adds a post-norm after each attention and MLP sublayer output before the residual addition. Pre-LN is current (x = x + f(norm(x))). Peri-LN is x = x + norm(f(norm(x))). The paper (arXiv 2502.02732) shows it balances variance and stabilizes gradients vs pure Pre-LN. Gemma-3 uses this. Zero new params — F.rms_norm is parameter-free in this codebase. Change is 2 lines in Block.forward only.
083	2026-04-29T16:26:22Z	sys	025	025	sys	Switch torch.compile mode from default to 'max-autotune' on clean exp_025 base (window=L, ratio=130, BF16, 0.2241): enables Triton GEMM autotuning per unique matmul shape + CUDA graphs to eliminate CPU kernel-launch overhead. On d12 scale (small model, 110M params), launch overhead is a larger fraction of step time, so CUDA graphs give proportionally larger speedup (~10-20%). Faster steps = same wall budget with same token count, but different kernel fusion paths produce marginally different BF16 accumulation order.	+0.001	discard	0.204700	0.783496	-0.019400	4921.036578	4921.036578	nc-sys-0079		Single-line change: base_train.py compile call adds mode='max-autotune'. All other sys/arch/opt/sched config identical to exp_025. Prior sys experiments have exhausted FP8, FA3, SWA, EMA, gradient clipping, BF16-cast removal — all were discards. This is the one remaining unexplored sys axis. Expected delta is near noise floor (±0.005); submitting to close out the compile-mode angle.
084	2026-04-29T17:46:58Z	opt	025	025	opt	Raise value_embeds LR from 0.5× to 1.0× embedding_lr (0.15→0.30): value embeddings are large (~150M params) ResFormer residuals whose early gradients are suppressed by near-zero ve_gate init, causing systematic under-adaptation vs wte at the same embedding_lr. Removing the 0.5× haircut gives them equal LR budget to wte.	+0.003	discard	0.220400	0.785181	-0.003700	4758.059896	4758.059896	nc-opt-0083		Single-line change in gpt.py setup_optimizer: value_embeds lr multiplier 0.5→1.0. No arch/schedule changes. Pure optimizer param-group tuning. Baseline exp_025 (0.2241). Other opt directions exhausted; value_embeds LR was the one unexplored adaptive-rate knob.
085	2026-04-29T17:50:19Z	sched	025	025	sched	Fix absolute warmdown duration at ~17.7K steps while adding 7.7% more tokens: ratio=140 + warmdown-ratio=0.60 keeps warmdown steps nearly identical to exp_025 (17,624 vs 17,728) while adding 2,203 more stable high-LR training steps (+23%). Hypothesis: exp_074's ratio=140/0.65 hurt because 1.5K extra steps went into extended near-zero-LR annealing, not useful learning. Same absolute warmdown + more stable training should match or beat 0.2241.	+0.005	discard	0.215300	0.782642	-0.008800	5154.608346	5154.608346	nc-sche-0082		Absolute warmdown math: ratio=130/0.65 = 17,728 warmdown steps; ratio=140/0.60 = 17,624 warmdown steps. Stable phase: 9,506 → 11,709 (+23%). Wall time ~84 min (ratio scales linearly for d12 at fixed B_REF). All other args unchanged from exp_025 clean baseline.
086	2026-04-29T17:50:26Z	data	025	025	data	ISO-compute seq-len halving: --max-seq-len 2048→1024, --device-batch-size 32→64. Tokens/step stays 64×1024×8=524,288 (2^19), num_iters and total training tokens unchanged (~27K steps, ~14.3B tokens). Activation memory identical (B×T per device same). Shorter sequences expose the model to more distinct document starts per batch and reduce cross-document cropping confusion.	-0.005	discard	0.205000	0.790813	-0.019100	4532.747223	4532.747223	nc-data-0084		All data experiments from exp_025 have been discards. This is the one clean untried axis in the data domain: context-length distribution. With T=1024, many more ClimbMix documents fit fully (no cropping), each batch sees more diverse document starts (64 seqs vs 32), and the effective crop rate for short documents drops. Downside: long-range dependencies >1024 tokens are never trained. Iso-compute: same total_batch_size (auto=2^19), same num_iterations, same wall time estimate (~78 min). No vendor code changes — pure experiment.py flag edit on clean exp_025 rebase.
087	2026-04-29T17:57:18Z	arch	025	025	arch	Extend value embeddings (ResFormer-style) from alternating 6/12 layers to ALL 12 layers: adds VE tables to layers 0,2,4,6,8,10. VE params excluded from scaling_params so training tokens unchanged. ResFormer paper shows quality increases with more VE coverage; later layers benefit most but full coverage generalises the signal.	+0.005	discard	0.193400	0.779725	-0.030700	4935.089861	4935.089861	nc-arch-0084		Single-line change: has_ve() returns True unconditionally instead of layer_idx%2==(n_layer-1)%2. Rebased cleanly to exp_025. Adds 6 more VE embedding tables (each 32768×768 BF16=50MB) + 6 tiny ve_gate Linear(12,6) weights to the formerly-skipped even-indexed layers. No change to transformer_matrices or lm_head params, so target_tokens = scaling_params × 130 is unchanged. Per-step time increases ~5-8% from additional embedding lookups.
088	2026-04-29T17:57:53Z	sys	025	025	sys	Switch torch.compile from default mode to 'reduce-overhead' on clean exp_025 base (window=L, ratio=130, BF16, 0.2241): CUDA graphs eliminate CPU kernel-dispatch overhead per step while keeping the same cuBLAS kernels as default compile — numerics should be identical to exp_025, just slightly faster execution.	+0.000	discard	0.211200	0.783502	-0.012900	4692.933305	4692.933305	nc-sys-0084		exp_083 tried max-autotune (Triton GEMMs + CUDA graphs) and got -0.019 — consistent with all other speedup tricks (FP8, FA3) that use different kernel implementations. reduce-overhead differs from max-autotune in that it does NOT replace cuBLAS with Triton autotuned GEMMs; it only adds CUDA graph capture to the default Inductor pipeline. Therefore numerical trajectory should be bitwise-identical to default mode. Expected outcome: same core_metric (~0.2241) with marginally faster step time. If CUDA graphs cause any unexpected issues (e.g. state capture bugs with the distributed optimizer), result would be a crash or discard. Rebased cleanly from exp_025 (sched specialist's best, ratio=130, window=L).
089	2026-04-29T19:19:16Z	sched	025	025	sched	Lower Muon peak momentum from 0.97→0.95 on clean exp_025 base (window=L, ratio=130, 0.2241): peak 0.97 has never been questioned; NorMuon paper and modded-nanogpt use 0.95. Lower peak reduces update over-smoothing during the 9.5K-step stable phase and shrinks warmdown delta from 0.07 to 0.05 (0.95→0.90), making the final convergence less abrupt. Pure code change in get_muon_momentum (3 constants).	+0.003	discard	0.214300	0.784388	-0.009800	4738.180761	4738.180761	nc-sche-0089		All three momentum peak references (warmup target, stable value, warmdown start) changed from 0.97 to 0.95. Warmdown endpoint stays at 0.90. This is the first experiment to touch the peak momentum value; prior sched experiments only varied warmdown endpoint (0.85, 0.97), not the peak itself.
090	2026-04-29T19:30:28Z	arch	025	025	arch	Change --head-dim from 128→96, giving n_head=8 (up from 6) while n_kv_head×head_dim=8×96=768 stays constant (zero param change). exp_063 tried head_dim=64/n_head=12 and scored 0.2179 (−0.006). Hypothesis: n_head=8/head_dim=96 is a better sweet spot than either 6×128 or 12×64, capturing more attention diversity without over-fragmenting per-head capacity. Rebased cleanly to exp_025.	+0.003	discard	0.192400	0.782892	-0.031700	4829.318014	4829.318014	nc-arch-0089		Pure flag change only. Static param count identical to baseline (all QKV/proj shapes are 768×768; VE kv_dim=n_kv_head×head_dim=768 unchanged). The sweet-spot argument: more heads gives richer attention diversity but exp_063 showed 12 heads hurts; 8 heads is the geometric mean. GQA is not active (n_kv_head=n_head=8). Rotary embedding buffer size changes from head_dim/2=64 to 48 but this is auto-computed.
091	2026-04-29T19:33:01Z	data	025	025	data	Sequence-length curriculum: phase 1 (first 50% of steps, ~13.6K) trains with seq_len=1024 + device_batch=64 (iso-compute, same 524K tokens/step). Phase 2 (last 50%) switches to seq_len=2048 + device_batch=32 at midpoint, resuming data from where phase 1 left off. Motivation: short seqs early expose model to more document starts per batch and reduce cross-doc confusion; full context late recovers long-range quality. exp_086 (1024 throughout) got 0.205 (−0.019) while baseline 2048 gives 0.2241 — curriculum targets the upside of both phases.	-0.005	discard	0.202400	0.783435	-0.021700	4640.343684	4640.343684	nc-data-0089		Implementation: added --seq-len-curriculum flag to base_train.py. At init, sets curr_seq_len=max_seq_len//2=1024 and curr_device_batch=64; tokens/step remains 64×1024×8=524,288=2^19. At step==num_iterations//2, rebuilds train_loader with (32, 2048) passing resume_state_dict to continue reading from same data position. Val eval always uses (32, 2048) — triggers one extra torch.compile at first phase-1 val eval (~3 min), then uses cached graph throughout. Phase 1 steps are ~2-3x cheaper (shorter seqs + quadratic attn), so total wall time is well within 90-min cap (~65-70 min estimated).
092	2026-04-29T20:38:35Z	sys	025	025	sys	Force FP32 accumulation for BF16 GEMMs (allow_bf16_reduced_precision_reduction=False) + revert compile to default mode from reduce-overhead: on GPU WGMMA natively does BF16→FP32 accum at full throughput, so no speed penalty. Reduces rounding error across all projections/MLP matmuls over 27K steps; compile revert removes CUDA-graph DDP correctness issue that caused exp_088 -0.013.	+0.002	discard	0.196900	0.783527	-0.027200	4720.132762	4720.132762	nc-sys-0089		Two changes on clean exp_025 base: (1) base_train.py: torch.compile(model, dynamic=False) — no mode, same as exp_025 snapshot; (2) common.py: added torch.backends.cuda.matmul.allow_bf16_reduced_precision_reduction = False after torch.set_float32_matmul_precision call. The allow_bf16_reduced_precision_reduction=False flag prevents cuBLAS from using BF16 intermediate accumulation for BF16 GEMMs. On GPU this should be zero-cost (WGMMA hardware path), giving cleaner gradient signals especially for the W_grad = G^T @ X computation in backward pass.
093	2026-04-29T20:51:14Z	sched	025	025	sched	Switch WD schedule from cosine to linear decay to zero on clean exp_025 base (window=L, ratio=130, 0.2241): cosine WD has been untouched across all prior experiments; linear WD provides less regularization in the stable phase but more during warmdown. Both start at wd_scaled and end at 0. Single-line change in get_weight_decay.	+0.002	discard	0.220700	0.785641	-0.003400	4739.224999	4739.224999	nc-sche-0091		Cosine vs linear WD: at warmdown start (step 35% of training), cosine WD=0.727*wd vs linear WD=0.650*wd (cosine higher early). At warmdown midpoint (67.5%), cosine WD=0.247*wd vs linear WD=0.325*wd (linear higher during warmdown). At end: both =0. Prior WD experiments (exp_057 constant, exp_075 delayed-to-warmdown, exp_013 warmdown-only-cosine) all tested different shapes but none tried simple linear. References in modded-nanogpt to 'linear schedule to zero' for WD suggest this is worth testing. Rebased from exp_025 first to fix peak momentum bug (prior workdir had 0.95 from exp_089 discard left in place).
094	2026-04-29T20:56:35Z	arch	025	025	arch	GQA n_kv_head=3 (halved from 6) on clean exp_025 base (window=L, ratio=130, 0.2241): 2 query heads share each KV head, PyTorch SDPA enable_gqa=True path, reduces c_k/c_v params 50% (~7M transformer_matrix params), halves VE kv_dim 768→384, acts as regularisation on KV representations. SDPA GQA untested in this series; no other code changes.	-0.003	discard	0.202900	0.791476	-0.021200	4296.356915	4296.356915	nc-arch-0092		n_kv_head = max(1, num_heads // 2) in build_model_meta. For d12 (n_head=6): n_kv_head=3. GQA via PyTorch SDPA enable_gqa=True already supported in flash_attention.py. VE kv_dim halves from 768 to 384, reducing value_embeds from ~152M to ~76M params (not in scaling_params, so token budget largely unchanged minus ~7M from KV projections in transformer_matrices). Slight training time reduction (~5%, safer within 90min budget).
