exp_id	timestamp	specialist	parent_exp	baseline_exp	domain	hypothesis	expected_delta	status	core_metric	val_bpb	delta_vs_best	train_s	total_s	job_name	snapshot_path	notes
026	2026-04-28T08:48:17Z	arch	020	025	arch	Enable value embeddings (ResFormer-style) on ALL 12 layers instead of alternating 6. has_ve() now returns True unconditionally, doubling VE coverage with negligible compute overhead: matmul FLOPs and training iterations are unchanged (VE params excluded from scaling_params), only embedding lookups add cost. Gives every layer direct access to token-level residuals, potentially alleviating attention concentration in odd layers that previously lacked VEs.	+0.008	discard	0.205800	0.783600	-0.018300	3768.851951	3768.851951	nc-arch-0024		ResFormer (arxiv 2410.17897, ACL 2025) shows value residuals help maintain token information in deeper layers. Current alternating pattern was a memory trade-off; 12 VE tables at kv_dim=384 adds ~150MB per rank, well within GPU 80GB budget. All 12 blocks now get ve_gate (Linear(12,3)) and an embedding table (vocab_size×384), covered by the existing optimizer parameter groups. Training horizon and step cost unchanged vs exp_020.
027	2026-04-28T08:52:35Z	opt	020	025	opt	Rebase to ratio=100 (longer training), revert Muon LR formula to asymmetric (fix exp_023's harmful symmetric change), and increase NorMuon beta2 from exp_020's 0.9 to 0.95 for smoother per-neuron variance adaptation over the ~20k-step training horizon at ratio=100.	+0.002	discard	0.203600	0.787457	-0.020500	3690.674732	3690.674732	nc-opt-0024		Three changes vs current workdir: (1) experiment.py ratio 12→100 (match exp_020 long-training config), (2) optim.py: revert both MuonAdamW and DistMuonAdamW LR scaling from symmetric (max/min)^0.5 back to asymmetric max(1, rows/cols)^0.5 — exp_023 tested symmetric and scored 0.1523 vs exp_020's 0.2029, confirming asymmetric is better, (3) gpt.py: NorMuon beta2 0.85→0.95 — exp_020 used 0.9, exp_003 tested 0.9→0.95 at ratio=12 and saw only -0.002 (within noise); at ratio=100 with ~20k steps the 20-step EMA window (beta2=0.95) vs 10-step (0.9) may reduce noise in per-neuron scale estimates across the long training horizon.
028	2026-04-28T08:55:07Z	data	020	025	data	Increase target-param-data-ratio from 100→130 on top of exp_020's window=L base: 30% more training tokens, estimated ~78 min wall (exp_020 at ratio=100 finished in ~60 min).	+0.01	discard	0.214600	0.783530	-0.009500	4821.896324	4821.896324	nc-data-0023		exp_020 (window=L, ratio=100) took ~60 min and scored 0.2029. Val_bpb still declines at end of training so more steps should help. ratio=130 adds 30% more unique ClimbMix tokens (~18900→~24570 steps). Timing: 60min * (130/100) = 78min, safely under 90-min cap. Only change vs exp_020: ratio 100→130.
029	2026-04-28T10:06:14Z	sys	024	025	sys	Push ratio 130→150 (+15% tokens) by freeing wall budget via: (a) device-batch-size 32→64 reducing grad_accum 2→1 (~2-4% throughput gain), (b) disabling mid-training BPB evals (eval-every=-1), (c) skipping ~7 mid-training CORE evals (core-metric-every=99999, final CORE still fires at last_step=True). Explicit total-batch-size=1048576 avoids divisibility assert.	+0.008	discard	0.202100		-0.022000	4379.195427	4379.195427	nc-sys-0027		exp_024 train_s=4809s=80.1min at ratio=130. Linear scaling gives ratio=150 at ~92min; saved eval/grad_accum overhead (~5-8min) brings it within 90min cap. LR/WD scaling unchanged (total_batch_size=1M same as exp_024 auto-value). val_bpb will be None (eval disabled, acceptable for scoring).
030	2026-04-28T10:13:37Z	sched	025	025	sched	Align LR warmup with Muon momentum warmup: increase --warmup-steps from 40 to 400. At ratio=130 (~27,274 steps), 40-step warmup is only 0.15% of training (was 1.6% at ratio=12). Steps 40-400 currently have full LR but still-ramping Muon momentum (0.85→0.97 over hardcoded 400 steps) — a 360-step LR/momentum mismatch. Setting warmup=400 aligns both, provides standard ~1.5% warmup, and should reduce early-training instability from mismatched optimizer state.	+0.003	discard	0.192400	0.784352	-0.031700	4756.274802	4756.274802	nc-sche-0027		Single flag change: --warmup-steps 40→400. No code edits. The Muon momentum schedule in get_muon_momentum() has a hardcoded 400-step ramp from 0.85→0.97. At ratio=130 (27k steps), the LR was hitting 100% at step 40 while momentum was still at 0.93 — mismatch for 360 steps. Aligning warmup to 400 steps means LR and momentum ramp together. All other hyperparameters unchanged (warmdown-ratio=0.65, final-lr-frac=0.05, target-param-data-ratio=130, window=L).
031	2026-04-28T10:27:02Z	arch	025	025	arch	Add learnable U-net skip connection from layer n//4=3 to layer 3n//4=9 (unet_lambda, zero-init=no-op at start). Inspired by modded-nanogpt's block-3→block-9 U-net pattern: gives late layers direct access to early-middle features. Adds 1 scalar parameter trained with AdamW.	+0.005	discard	0.202100	0.784013	-0.022000	4776.170423	4776.170423	nc-arch-0029		Rebased to exp_025 (0.2241) — reverts exp_026's harmful all-VE change. Only arch change: add self.unet_lambda (init=0) and inject x_unet (output of block 3) into block 9's pre-block input. All other architecture identical to exp_025. Motivated by modded-nanogpt's U-net residuals showing blocks 3→6 style skips improve quality. Zero init makes this strictly risk-free at start; model can learn to ignore it (lambda→0) if not useful.
032	2026-04-28T10:31:06Z	data	025	025	data	Push --target-param-data-ratio from 130→155 (+19% tokens) and disable --eval-every (reclaims ~7 min of val_bpb overhead for actual training). Rebased on exp_025. Est. ~84 min wall: 73 min training + 3 min compile + 8 min CORE evals.	+0.010	discard	0.204700		-0.019400	4882.551285	4882.551285	nc-data-0029		Training longer is consistently beneficial at d12 scale (400B dataset, only ~4% seen at ratio=155). Val_bpb eval was consuming ~7 min of the 90-min wall budget without affecting training quality or CORE metric scoring. By disabling it (--eval-every -1), 19% more tokens (ratio 130→155) fits within the budget. Log-linear extrapolation from the ratio=100→130 improvement (+0.0212) predicts +0.010–0.015 for ratio=130→155.
033	2026-04-28T10:36:35Z	opt	025	025	opt	On top of exp_025 config (ratio=130, Muon beta2=0.9): increase --unembedding-lr from 0.008 to 0.010 (+25%). The lm_head (768→32768) has been at 0.008 since baseline; at 27k steps the internal representations are well-trained and a slightly higher LR for the vocabulary projection may improve calibration without instability.	+0.003	discard	0.202700	0.783534	-0.021400	4715.751717	4715.751717	nc-opt-0029		Two edits from current opt workdir: (1) gpt.py: reverted Muon beta2 0.95→0.9 (matching exp_025 baseline). (2) experiment.py: ratio 100→130 and unembedding-lr 0.008→0.010. Net diff vs exp_025: only unembedding-lr changes (0.008→0.010). This is the first explicit test of unembedding-lr in the experiment history.
034	2026-04-28T11:39:35Z	sys	024	025	sys	Disable mid-training evals (eval-every=-1, core-metric-every=99999) to reclaim ~17 min of overhead, then use that budget to push ratio 130→170 (+31% tokens). exp_029 revealed auto batch=524K for d12; without evals, ratio=150 at batch=524K costs ~73 min; ratio=170 estimated ~85 min total (final CORE at last_step still fires via last_step=True).	+0.012	discard	0.210500		-0.013600	5178.580932	5178.580932	nc-sys-0030		exp_029 (batch=1M, ratio=150, no evals) ran 73 min. Same FLOP budget at batch=524K = same wall. Implies exp_024's 80 min includes ~17 min eval overhead (63 BPB + 8 mid-CORE evals). With evals off: pure_train(ratio=170) = 4379*170/150 = 4963s + ~100s final CORE = ~85 min, 5 min under cap. LR/WD unchanged (batch_lr_scale=1.0 at auto batch=524K).
035	2026-04-28T11:46:35Z	sched	025	025	sched	Push --target-param-data-ratio from 130→140 (+7.7% more tokens) on top of exp_025 baseline: revert exp_030's broken warmup-steps=400 back to 40, and extend training. Timing: ~86 min estimated (ratio=130 ran ~80 min in exp_024). Linear token-scaling suggests ~+0.005 core_metric improvement.	+0.005	discard	0.220800	0.782532	-0.003300	5082.395729	5082.395729	nc-sche-0031		Two changes vs current workdir (both return to or build on exp_025 state): (1) warmup-steps 400→40 (reverting exp_030's discard; exp_025 used 40), (2) target-param-data-ratio 130→140. The ratio increase is the actual hypothesis. exp_029 (sys) tried ratio=150 but also changed device-batch-size (confound); this trial cleanly tests ratio=140 with the correct exp_025 settings. Batch size stays at 2^19=524,288 (d12 D_REF==target_tokens so B_opt=B_REF regardless of ratio). num_iterations scales to ~29,371 steps. Warmdown stays at 65% (17,728→19,091 warmdown steps). WD cosine schedule and Muon momentum unchanged.
036	2026-04-28T12:00:38Z	arch	025	025	arch	Replace hardcoded QK scale 1.2 with learnable per-layer per-head qk_scales (12×6=72 scalars, init=1.2): different layers and heads learn their optimal attention temperature. Starting at 1.2 makes early training identical to baseline; model discovers better sharpness per head/layer over training.	+0.005	discard	0.200000	0.783645	-0.024100	4832.036069	4832.036069	nc-arch-0034		Research (Selective Attention, adaptive temperature papers) shows per-head temperature scaling improves LM performance. The hardcoded 1.2 was a TODO in the code; making it learnable is low-risk (starts identical, 72 negligible extra scalars in AdamW smear_params group at lr=0.2). qk_scales[i] is passed through Block.forward to CausalSelfAttention.forward and broadcast over (B,T,n_head,head_dim). num_scaling_params and estimate_flops updated to exclude qk_scales from matmul param count.
037	2026-04-28T12:05:59Z	opt	025	025	opt	Add MuonEq pre-orthogonalization equilibration (arXiv:2603.28254): row-normalize tall/square matrices and column-normalize wide matrices before polar express, equalizing neuron/feature contributions. Also revert --unembedding-lr 0.010→0.008 (exp_033's change was harmful, -0.021). Net change vs exp_025: MuonEq equilibration in muon_step_fused.	+0.007	discard	0.202900	0.783811	-0.021200	4705.242033	4705.242033	nc-opt-0034		MuonEq paper (2603.28254) shows row/column equilibration of momentum before orthogonalization reduces condition number of the input to polar express, improving the quality of the orthogonal approximation. On 130M LLaMA2-class model: 19.56 vs 20.52 validation perplexity (Muon). Current impl: R variant for tall/square (shape[-2] >= shape[-1]), C variant for wide. Applied inside muon_step_fused between Nesterov and polar express. unembedding_lr reverted to 0.008 to clean up exp_033 contamination.
038	2026-04-28T12:13:33Z	data	025	025	data	Sorted-buffer best-fit packing: replace O(n) linear scan over buffer_size=1000 with O(log n) bisect over buffer_size=10000. 10× larger doc pool dramatically reduces document cropping (~35%→~10%), yielding more complete (BOS-to-end) training documents per batch. Same ratio=130, eval-every=250 as exp_025; wall time unchanged.	+0.007	discard	0.188600	0.771044	-0.035500	4789.549553	4789.549553	nc-data-0034		Rebased to exp_025. Only change: dataloader.py. doc_buffer is now a sorted list of (doc_len, counter, doc) tuples; refill_buffer uses insort(); best-fit uses bisect_left(doc_buffer, (remaining+1,)). Crop happens at pop(0) (shortest). buffer_size default 1000→10000. O(log n) lookup makes the 10x buffer essentially free in CPU time. More complete documents → better contextualized training tokens at no additional compute.
039	2026-04-28T14:58:17Z	sys	025	025	sys	Enable FP8 tensorwise matmuls (--fp8) on top of exp_025 base (window=L, ratio=130, BF16 baseline 0.2241). Prior exp_004 failed at ratio=12 (early chaotic training); at ratio=130 the model is in the stable warmdown regime where FP8 quantization noise should be less disruptive. the configured GPU environment has native FP8 support (GPU) — torch._scaled_mm routes there directly for ~1.2x matmul speedup.	-0.005	preflight_crash								"infrastructure sync failure: Command '['ssh', '[internal host]', 'mkdir -p -- ""[internal path]""']' timed out after 60 seconds"
040	2026-04-28T14:59:24Z	sys	025	025	sys	Enable FP8 tensorwise matmuls (--fp8) on top of exp_025 base (window=L, ratio=130, BF16 baseline 0.2241). Prior exp_004 failed at ratio=12 (early chaotic training); at ratio=130 the model is in the stable warmdown regime where FP8 quantization noise should be less disruptive. the configured GPU environment has native FP8 support (GPU) — torch._scaled_mm routes there directly for ~1.2x matmul speedup.	-0.005	preflight_crash								"infrastructure sync failure: Command '['ssh', '[internal host]', 'mkdir -p -- ""[internal path]""']' timed out after 60 seconds"
041	2026-04-28T15:00:35Z	sys	025	025	sys	Enable FP8 tensorwise matmuls (--fp8) on top of exp_025 base (window=L, ratio=130, BF16 baseline 0.2241). Prior exp_004 failed at ratio=12 (early chaotic training); at ratio=130 the model is in the stable warmdown regime where FP8 quantization noise should be less disruptive. the configured GPU environment has native FP8 support (GPU) — torch._scaled_mm routes there directly for ~1.2x matmul speedup.	-0.005	preflight_crash								"infrastructure sync failure: Command '['ssh', '[internal host]', 'mkdir -p -- ""[internal path]""']' timed out after 60 seconds"
042	2026-04-28T19:02:02Z	sched	025	025	sched	Reduce --warmdown-ratio from 0.65→0.40 on exp_025 base (window=L, ratio=130): at 27K steps, current 65% warmdown leaves only 35% of steps at peak LR; 40% warmdown doubles the stable peak-LR phase (9,506→16,324 steps) while keeping a 10,900-step decay. Total compute unchanged.	+0.005	discard	0.202600	0.784758	-0.021500	4674.378946	4674.378946	nc-sche-0042		The warmdown-ratio=0.65 was originally tuned for short ratio=12 runs (~839 stable steps). At ratio=130 it creates an extreme imbalance: 65% of training is in LR decay. WSD framework and 'Straight to Zero' D2Z literature both indicate the stable plateau is the productive learning phase. Reducing to 0.40 gives a much more balanced 60/40 stable/decay split, more consistent with standard WSD practice. No code changes — pure CLI flag. Muon momentum and WD schedules are anchored to warmdown_start so they adjust automatically.
043	2026-04-28T19:03:57Z	data	025	025	data	Numpy sorted-buffer best-fit packing (buffer_size=4000, insort/bisect) on exp_025 config (window=L, ratio=130): replace Python lists + O(n) scan + torch.tensor() with numpy int64 arrays + O(log n) bisect + torch.from_numpy(), 4x larger buffer for better packing quality.	+0.004	discard	0.204100	0.775079	-0.020000	4643.633726	4643.633726	nc-data-0042		exp_038 (Python lists, buffer_size=10000) regressed -0.035 due to ~196MB Python int object heap per rank causing GC/ref-count pressure. This version uses numpy int64 arrays (GC-invisible, outside Python object heap) at buffer_size=4000 — same memory footprint as exp_025's 1000 Python lists but 4x larger doc pool. torch.from_numpy() shares memory with no copy, ~100x faster than torch.tensor(python_list). Sorted buffer allows O(log n) bisect to find the best-fitting document. Larger pool should reduce the ~35% crop rate (exp_025 docstring), meaning more complete documents and less cross-document noise per training token.
044	2026-04-28T19:05:07Z	arch	025	025	arch	Add per-head attention output gate (attn_gate): sigmoid(Linear(x[:12], n_head)) applied element-wise to each head's output before c_proj. Allows dynamic per-token per-head importance weighting. Init: uniform(0, 0.02) → sigmoid≈0.505 (near-neutral). Param cost negligible (72/layer × 12 = 864 total). On top of exp_025 (window=L, ratio=130, 0.2241).	+0.005	discard	0.207100	0.782893	-0.017000	4786.714760	4786.714760	nc-arch-0042		Rebased to exp_025. Single arch change: attn_gate added to CausalSelfAttention. Init with uniform(0,0.02) so sigmoid starts at ~0.505. Since c_proj is zero-init, attention output is ~0 at step 0 regardless, so gate is effectively dormant at init and activates gradually as c_proj learns. The gate enables the model to suppress attention sink heads per-token and allows head specialisation — a technique seen in modded-nanogpt speedruns. All other experiment.py TRAIN_ARGS identical to exp_025 (window=L, ratio=130, warmup=40, warmdown=0.65).
045	2026-04-28T19:06:33Z	opt	025	025	opt	Increase NorMuon beta2 from 0.9→0.95 on exp_025 base (window=L, ratio=130): the NorMuon paper (arXiv:2510.05491) uses (β1,β2)=(0.95,0.95); the 20-step EMA window should give smoother variance estimates vs the 10-step window of exp_025 across the 27K-step / 17.7K-step warmdown run.	+0.004	discard	0.202400	0.783426	-0.021700	4727.555328	4727.555328	nc-opt-0042		Single change: gpt.py setup_optimizer Muon groups beta2=0.9→0.95. All other settings identical to exp_025 (window=L, ratio=130, matrix_lr=0.02, etc.). NorMuon paper recommended value; exp_027 tested this confounded with other changes; this is the clean isolated test.
046	2026-04-28T19:16:25Z	sys	025	025	sys	Push --target-param-data-ratio from 130→145 on top of exp_025 base (window=L, BF16, 0.2241): 11.5% more training tokens. exp_035 (ratio=140) gave 0.2208 — only −0.003 from 0.2241, within the ~0.005 noise floor, so true optimum may be in the 130-145 range. Cut eval-every 250→500 to save ~8 min eval overhead; total wall estimated ~79-82 min. Same BF16 recipe, no vendor changes.	+0.002	discard	0.200600	0.781972	-0.023500	5038.424628	5038.424628	nc-sys-0042		Training time breakdown at ratio=145: ~70 min compute + ~8.5 min val_bpb evals (at 500-step cadence) = ~79 min. CORE metric still evaluated every 2000 steps and at last_step. No FP8 to avoid quality degradation risk. The -0.003 gap of exp_035 vs exp_025 is within noise, making ratio=145 worth probing.
047	2026-04-28T20:04:53Z	sched	025	025	sched	Replace linear LR warmdown with cosine warmdown in get_lr_multiplier: same warmdown-ratio=0.65 and final-lr-frac=0.05 but cosine shape. At ratio=130 (~27K steps), warmdown covers 17.7K steps (65%); cosine maintains higher LR in the early-mid warmdown then drops steeply near the end, giving the optimizer more gradient budget at moderate LR before final refinement.	+0.005	discard	0.156900	0.846954	-0.067200	745.275588	745.275588	nc-sche-0047		Single function change: get_lr_multiplier warmdown branch changed from linear `progress * 1.0 + (1 - progress) * final_lr_frac` to cosine `final_lr_frac + (1 - final_lr_frac) * 0.5 * (1 + cos(pi * (1 - progress)))`. No TRAIN_ARGS changes; all flags identical to exp_025 (window=L, ratio=130, warmup=40, warmdown-ratio=0.65, final-lr-frac=0.05). Cosine warmdown is standard in recent LLM training (MiniCPM, Llama). At the 25% warmdown mark, cosine LR≈0.86 vs linear≈0.76; cosine holds higher LR for longer then drops faster near end.
048	2026-04-28T21:18:10Z	arch	025	025	arch	Replace relu² MLP with SwiGLU (iso-param: d_ff=8/3×768=2048, combined c_fc 768→4096 split gate+val, c_proj 2048→768; 3×768×2048=2×768×3072). Modern LLMs (Llama, PaLM) show SwiGLU beats relu² for training quality, especially at longer horizons — at ratio=130 the gating mechanism has more steps to specialise.	+0.005	discard	0.200300	0.783024	-0.023800	4909.748551	4909.748551	nc-arch-0047		exp_017 tried SwiGLU at ratio=12 and got +0.002 (noise floor). At ratio=130 (10x more training) the gating expressiveness should yield a more pronounced improvement. Param count identical: 3*768*2048 = 2*768*3072 = 4,718,592 per MLP layer. Init unchanged (same s=sqrt(3)/sqrt(768) scale for c_fc, zeros for c_proj).
049	2026-04-28T21:19:54Z	opt	025	025	opt	Add 2 cubic NS polishing iterations (ns_steps 5→7) after Polar Express: append (1.5, -0.5, 0) twice to polar_express_coeffs. The cubic NS f(s)=1.5s-0.5s³ has fixed point s=1 with derivative=0 (quadratic convergence), refining PE's output singular values (~0.5-1.5) to within ~0.01 of 1. Scale-neutral change (only affects update direction orthogonality, not magnitude).	+0.002	discard	0.202800	0.783228	-0.021300	4729.398363	4729.398363	nc-opt-0047		Rebase to exp_025 first (workdir had stale SSSL/ratio=12 from baseline). Muon PE with 5 iters leaves singular values in ~Uniform(0.5,1.5); two extra cubic NS polishing steps bring them to ~0.99, producing more precisely orthogonal update directions. Cubic NS has quadratic convergence near s=1 vs PE's designed-for-full-range iterations. PE compute is ~0.2% of total step time so 2 extra iters add negligible wall overhead.
050	2026-04-28T21:23:13Z	data	025	025	data	Per-epoch shard shuffle for epoch 2+ on exp_025 base (window=L, ratio=130): at ratio=130 training needs ~14B tokens but ~169 shards only provide ~10.3B, so epoch 2 covers ~37% of training. Without shuffle, epoch 2 replays shard_00000→shard_00168 in the same order as epoch 1, biasing late-training gradients toward early-dataset content. The fix: shuffle shard order with a deterministic per-epoch seed (same across all 8 DDP ranks). Epoch 1 is untouched—identical to exp_025.	+0.003	discard	0.204600	0.783559	-0.019500	4731.813522	4731.813522	nc-data-0047		Minimal, safe change: only affects epoch 2+ (the last ~37% of training at ratio=130). No change to buffer_size, packing algorithm, TRAIN_ARGS, or any other parameter. The shuffle uses random.Random(epoch * 100003) — same across all 8 ranks so gradient consistency is preserved. If the environment has more shards than ~169, epoch 2 may not occur at all, making this a pure no-op (risk-free). If it does cycle, documents in the second pass appear in a different order, improving generalization.
