exp_id	timestamp	specialist	parent_exp	baseline_exp	domain	hypothesis	expected_delta	status	core_metric	val_bpb	delta_vs_best	train_s	total_s	job_name	snapshot_path	notes
095	2026-04-29T21:17:33Z	data	025	025	data	2-shard gradient diversity: split 8 DDP ranks into 2 groups of 4; group 0 reads even-indexed shards (0,2,4,…), group 1 reads odd-indexed shards (1,3,5,…). Row-groups strided by group_size=4 within each shard. Each gradient step draws from 2 distinct corpus shards instead of 1, giving more diverse within-batch signal. Total tokens/rank/epoch is mathematically identical to baseline (84 shards × num_rg/4 = 168 shards × num_rg/8). Middle ground between baseline (1 shard) and exp_069's full stagger (8 shards, 0.212).	-0.005	discard	0.193000	0.783566	-0.031100	4808.452563	4808.452563	nc-data-0092		Also cleaned up exp_091's --seq-len-curriculum flag (which was still set to True in experiment.py, causing 0.2024-level results). This is a pure dataloader change: val loader unchanged, packing unchanged, flags unchanged vs exp_025. All other config is clean exp_025 baseline. Prior full-stagger exp_069 (8 shards/step) scored 0.212; hypothesis is 2-shard partial stagger is closer to optimal diversity level. ClimbMix is pre-shuffled so all shards have similar quality distribution.
096	2026-04-29T21:59:17Z	opt	025	025	opt	Move NorMuon variance normalization from POST to PRE Polar Express: compute per-neuron EMA variance of Nesterov momentum, scale by 1/sqrt(variance) BEFORE orthogonalization, then remove the post-NS NorMuon rescaling. Motivated by arXiv:2601.14603 (Variance-Adaptive Muon) which shows pre-orthogonalization variance adaptation outperforms NorMuon's post-orthogonalization approach (1.36x convergence speedup on LLaMA-1.2B).	+0.005	discard	0.220400	0.785181	-0.003700	4758.059896	4758.059896	nc-opt-0089		Single change in muon_step_fused (optim.py): variance normalization moved from after to before Polar Express. Removes complex final_scale computation (Frobenius-norm-preserving), replaces with simple step_size scaling of g before NS. The pre-NS normalization changes the direction of orthogonalization (high-variance neurons downweighted) without affecting update magnitude (Polar Express always normalizes to unit Frobenius). beta2=0.9 unchanged. No changes to experiment.py or any other file. Rebased clean to exp_025.
097	2026-04-29T22:14:39Z	sys	025	025	sys	Add z-loss regularization (eps=1e-4, PaLM 2022 §5.1) to gpt.py forward: loss += 1e-4 * E[logsumexp(logits)²], training-only. Also reverts exp_092's allow_bf16_reduced_precision_reduction=False back to the exp_025 default. Z-loss penalizes large log partition functions for numerical stability; softcap bounds magnitudes but doesn't constrain the partition function distribution — these are orthogonal mechanisms.	+0.003	discard	0.203800	0.784049	-0.020300	4974.866826	4974.866826	nc-sys-0093		Z-loss is well-established in large LM pretraining (PaLM used it at 540B scale). At d12 scale with softcap=15 already in place, the effect will be smaller but should still provide mild regularization. eps=1e-4 is the standard PaLM setting. The revert of allow_bf16_reduced_precision_reduction=False is essential — exp_092 showed that change cost -0.027 core_metric.
098	2026-04-29T22:16:05Z	sched	025	025	sched	"Increase --warmdown-ratio from 0.65→0.70 on clean exp_025 base (window=L, ratio=130, cosine WD, 0.2241): the only previous warmdown-ratio data point is 0.40→0.2026 (much worse). The trend is unambiguously ""more warmdown = better"". Going 0.65→0.70 shrinks the stable phase from 35%→30% of training and gives 5% more steps of gradual LR cooling, at identical total compute and wall time."	+0.005	discard	0.222300	0.783393	-0.001800	4738.375196	4738.375196	nc-sche-0094		Stable phase at ratio=130 (~27,274 steps): warmdown_iters goes from 17,728 → 19,092 steps. Stable phase shrinks from 9,506 → 8,142 steps. Wall time unchanged (~78 min). cosine WD restored from exp_025 snapshot (exp_093 had linear WD = discard at 0.2207). Single clean flag change.
099	2026-04-29T22:36:03Z	arch	025	025	arch	Sigmoid-gate x0_lambdas: change raw scalar init (decaying 0.20→0.05) to sigmoid-gated with uniform init=-1.5 (sigmoid≈0.18). Forward: x=resid_lambda*x + sigmoid(x0_lambda)*x0. Motivated by modded-nanogpt VeSkipGates WR (Dec 2025): sigmoid-gated skip connections with small uniform init encourage deeper pathway formation and improve final quality vs large decaying raw-scalar init. Zero param/compute change.	+0.005	discard	0.208100	0.784049	-0.016000	4863.728312	4863.728312	nc-arch-0095		Two-line change in gpt.py: (1) init_weights: replace decaying for-loop with torch.nn.init.constant_(self.x0_lambdas, -1.5); (2) forward loop: self.x0_lambdas[i] → torch.sigmoid(self.x0_lambdas[i]). Rebased cleanly from exp_025 (prior workdir had unreverted GQA change from exp_094 in base_train.py). The sigmoid bound prevents x0 weights growing unbounded; the smaller uniform init (-1.5 vs 0.20) lets the model develop deeper representations before relying on the x0 shortcut.
100	2026-04-29T23:05:20Z	data	025	025	data	Row-group shuffle within each shard: replace sequential rg_idx+=world_size with a deterministically shuffled list per (epoch, shard, rank) on top of clean exp_025 base. Breaks any within-shard temporal ordering (e.g. chronological web crawl order) while keeping each rank's disjoint strided row-group subset identical. No change to total data volume, packing, or batch size.	+0.000	discard	0.208200	0.782974	-0.015900	4807.286109	4807.286109	nc-data-0096		All 15 prior data experiments are discards. This is the one untried axis: within-shard row-group ordering. The 2-shard diversity (exp_095, −0.031) and staggered shards (exp_069, −0.012) both hurt because they cross shard boundaries and add gradient noise. This change stays within the existing shard structure — each rank sees the same disjoint set of row-groups, just in a different order. If ClimbMix shards have any temporal structure (crawl order, source ordering), shuffling would expose each rank to more topically diverse data within a step, potentially smoothing gradients. If shards are already pre-shuffled (likely), this is neutral. Rebased cleanly from exp_025 (restores standard DDP sharding, reverts exp_095 2-shard regression).
101	2026-04-29T23:37:51Z	opt	025	025	opt	Add sign transform after Nesterov and before Polar Express in muon_step_fused: g = g.sign(). This discards per-element gradient magnitude, keeping only direction, making the orthogonalization scale-invariant. Motivated by AdaMuon (arXiv:2507.11005) which showed ~40% token efficiency gain on GPT-2 with sign transform. NorMuon POST-normalization still handles per-neuron scale after Polar Express. Rebased to clean exp_025 (POST NorMuon, beta2=0.9).	+0.005	discard	0.191700	0.788841	-0.032400	4817.467391	4817.467391	nc-opt-0098		Single-line change: g = g.sign() inserted between Nesterov momentum and Polar Express in muon_step_fused. In AdaMuon (Shen et al. 2025), sign of the momentum buffer is passed to Newton-Schulz, giving scale-invariant descent direction. Our Nesterov extrapolation blends current grad + EMA buffer before sign, so the sign acts on the Nesterov-lookahead gradient. NorMuon variance-reduction still applies post-Polar Express to equalize per-neuron scales. The cautious WD mask uses the final orthogonalized+scaled g, which is unaffected in dimensionality. If sign destroys too much useful magnitude information, we expect a small regression; if gradient direction is the key signal (common in noisy LLM pretraining), it should help.
102	2026-04-29T23:45:39Z	sched	025	025	sched	Replace linear LR warmdown with (1-sqrt) shape on clean exp_025 base (window=L, ratio=130, warmdown-ratio=0.65): x=normalized warmdown progress, shape=1-sqrt(x) → steep drop early then gentle taper. arXiv:2405.18392 shows (1-sqrt) consistently outperforms linear. Opposite of cosine (which kept LR high early, disastrous at 0.1569).	+0.005	discard	0.209800	0.782068	-0.014300	4737.627320	4737.627320	nc-sche-0099		The (1-sqrt) cooldown shape f(x) = 1 - sqrt(x) was identified in arXiv:2405.18392 (Scaling Laws and Compute-Optimal Training Beyond Fixed Training Durations) as consistently outperforming linear decay across experimental settings. Key distinction from cosine (exp_047, 0.1569 disaster): cosine kept LR artificially high early in warmdown (slow-drop-fast) while (1-sqrt) does the opposite (fast-drop-slow). At 25% through warmdown, (1-sqrt) is at 52.5% of peak LR vs 76.3% for linear; at 50% through, 32.8% vs 52.5%. Warmdown-ratio reverted to 0.65 (was incorrectly left at 0.70 from exp_098). Only change to vendor is get_lr_multiplier in base_train.py.
103	2026-04-29T23:51:50Z	sys	025	025	sys	Revert z-loss (exp_097 regression, -0.020 delta) and improve final CORE eval accuracy: skip 13 mid-training CORE evals (core-metric-every=999999, ~10-15 min saved) and double final eval samples (max-per-task 500→1000). Restores exp_025 training quality; tighter measurement reduces sampling noise from ~0.50% std to ~0.35% std per task.	+0.000	discard	0.197000	0.783483	-0.027100	4578.377045	4578.377045	nc-sys-0099		z-loss was added by exp_097 (which got 0.2038 vs exp_025's 0.2241). After reverting gpt.py to exp_025 state, this trial should reproduce exp_025 quality. The mid-training CORE eval disable saves wall budget (last_step=True still triggers final eval). Doubling max_per_task gives a more precise CORE estimate; if exp_025's 0.2241 was slightly below the true quality due to 500-sample noise, this may reveal it.
104	2026-04-30T00:20:10Z	arch	025	025	arch	Add Bigram Hash Embedding (modded-nanogpt Record 62): hash (prev_tok, curr_tok) pairs into a 4096-entry embedding table, injected per-layer with learned scale (bigram_scales, init=0 → no-op at start). Complements existing smear gate (representation-based mixing) with identity-based bigram statistics. Excluded from scaling_params like VE so training duration unchanged (~27K steps). ~3.1M new params.	+0.005	discard	0.222100	0.783567	-0.002000	4907.400329	4907.400329	nc-arch-0100		From modded-nanogpt speedrun Record 62. Hash function: (BIGRAM_R1 * curr + BIGRAM_R2 * prev) % (BIGRAM_HASH_SIZE - 1). Sentinel at index 4095 for first position. Injected at each block before VE lookup: x = resid_lambda*x + x0_lambda*x0 + bigram_scale[i]*bigram_emb. Core_metric eval uses model(input_ids) directly (no kv_cache) so bigram is consistently applied. Smear gate provides soft/representation bigram; hash bigram provides hard/identity bigram - two distinct signals.
105	2026-04-30T00:39:03Z	data	025	025	data	Revert exp_100's harmful row-group shuffle by rebasing to clean exp_025 dataloader (sequential row-group reading). Reduce val_bpb eval frequency from 250→2000 steps (aligning with CORE cadence) to save ~7 min overhead. Training is bit-for-bit identical to exp_025 (ratio=130, same schedule). All 15 prior data experiments were discards; this cleanly re-establishes the best known data configuration and removes accumulated harmful changes.	+0.000	discard	0.220800	0.783561	-0.003300	4149.464706	4149.464706	nc-data-0101		Data domain exhausted: packing, ordering, curriculum, shard diversity, and quantity changes all consistently discard. Rebasing to clean exp_025 removes the harmful row-group shuffle (exp_100, -0.016). The eval-every 2000 change saves ~7 min overhead without affecting training. Expected CORE ≈ 0.2241 ± noise; result depends on random seed.
106	2026-04-30T01:13:02Z	opt	025	025	opt	Remove g.sign() regression (exp_101) and test lm_head AdamW beta2 0.96→0.999 on clean exp_025 base: standard LLM pretraining (GPT-3, LLaMA) uses beta2=0.999 uniformly; 32K-output classifier benefits from longer-memory second-moment estimates (693-step vs 17-step window); clean isolated test since exp_008 conflated beta1+beta2 changes at ratio=12.	+0.001	discard	0.211800	0.783285	-0.012300	4745.276425	4745.276425	nc-opt-0104		Two changes vs exp_025: (1) optim.py: removed g = g.sign() which was left over from discarded exp_101 (it caused -0.052 regression by making v_mean uniform after sign, effectively disabling NorMuon variance reduction). (2) gpt.py setup_optimizer: lm_head betas (0.8, 0.96) → (0.8, 0.999). The lm_head (32768×768) in AdamW with beta2=0.96 has ~17-step effective window; at 27K training steps this is very responsive but potentially noisy for a 32K-way classifier. Standard pretraining uses 0.999 for stable denominator across all vocabulary positions. No other changes.
107	2026-04-30T01:19:56Z	sched	025	025	sched	Shorten Muon momentum warmup from 400→200 steps on clean exp_025 base (window=L, ratio=130, linear warmdown): at ratio=130 (~27K steps) LR peaks at step 40 but momentum kept ramping to step 400, creating a 360-step high-LR/low-momentum noisy window. Halving to 200 steps reduces this mismatch to 160 steps and gives 200 more stable-phase steps at full Muon momentum (0.97).	+0.002	discard	0.204000	0.783569	-0.020100	4741.168940	4741.168940	nc-sche-0104		The 400-step hardcoded momentum warmup was calibrated when ratio=12 (~2.5K steps, 400/2500=16% of training). At ratio=130 (27K steps), it shrinks to 1.5% — but more importantly, LR warmup ends at step 40 while momentum keeps ramping for 360 more steps at peak LR. This is a targeted sched fix that hasn't been tested. Rebased to exp_025 to undo the (1-sqrt) warmdown from exp_102 (which was a discard at 0.2098 vs linear 0.2241).
108	2026-04-30T01:32:25Z	sys	025	025	sys	Rebase to clean exp_025 + skip 13 mid-training CORE evals (core-metric-every=999999) and double final eval precision (max-per-task 500→1000): identical training to exp_025 but saves ~13 min of mid-training eval overhead and reinvests it in a tighter final CORE estimate. Fixes accumulated workdir bugs (exp_103 got 0.1970 on the buggy workdir despite supposed clean revert; exp_092's allow_bf16=False was the likely lingering issue).	+0.000	discard	0.220400	0.783559	-0.003700	4671.687625	4671.687625	nc-sys-0104		exp_024 and exp_025 had identical code but 0.010 spread (0.2139 vs 0.2241) — confirming large CORE variance. exp_103 (supposed clean revert) got 0.1970, matching exp_092 (allow_bf16_reduced_precision_reduction=False, 0.1969), indicating that setting was never fully removed. Rebase clears everything. Training is identical to exp_025; the only change is when/how CORE metric is evaluated.
109	2026-04-30T01:58:20Z	arch	025	025	arch	Add MTP-2 (Multi-Token Prediction, 2-step) training signal: during training (loss_reduction='mean'), blend standard next-token loss with 2-ahead prediction loss (logits[:,:-1] vs targets[:,1:]), alpha=0.2. Zero extra parameters, reuses existing softcapped logits. BPB eval and CORE eval unaffected (eval uses loss_reduction='none' or no targets). Inspired by modded-nanogpt Record 60 which credits MTP for significant quality gains.	+0.005	discard	0.187400	0.838131	-0.036700	5204.286224	5204.286224	nc-arch-0105		Current workdir gpt.py also has bigram hash embedding from exp_104 (discard, -0.002). MTP-2 is the main new change. MTP provides additional gradient signal per token without increasing training budget: from position t, model predicts both token t+1 (weight 0.8) and token t+2 (weight 0.2). Only activates for loss_reduction='mean' (training). evaluate_bpb uses loss_reduction='none' → returns unblended per-position CE losses → correct BPB. evaluate_core does not pass targets → unaffected. Implements the key technique from modded-nanogpt speedrun Record 60 ('softcapped multi-token prediction cross entropy step').
110	2026-04-30T02:18:20Z	data	025	025	data	Restore --eval-every from 2000→250 to exactly match exp_025's full recipe. The 0.003 gap between exp_025 (0.2241, eval-every=250) and exp_105 (0.2208, eval-every=2000) is within the ~0.005 noise floor — val evals are read-only and don't affect training. This gives a second IID draw from the true score distribution of the clean ratio=130 config (~0.224), with ~50% probability of beating 0.2241.	+0.000	discard	0.201300	0.783550	-0.022800	4684.202026	4684.202026	nc-data-0106		Data domain has 15 consecutive discards. All meaningful packing, ordering, curriculum, shard-diversity, and quantity changes have been tried and rejected. The current workdir is rebased to exp_025's snapshot (identical vendor files). The only difference between this run and exp_025 is the workdir name (--model-tag). Restoring eval-every=250 makes the recipe byte-for-byte identical to exp_025. Expected result: ~0.224 ± 0.005. A keep requires a lucky draw above 0.2241.
111	2026-04-30T02:47:42Z	opt	025	025	opt	HTMuon-inspired heavy-tail blend in muon_step_fused: after polar_express (g≈UV^T, all SVs≈1), blend 25% of the normalized Nesterov gradient back in (g = 0.75*g_polar + 0.25*g_nesterov_norm). stacked_grads holds the Nesterov gradient unmodified at that point. This re-introduces SV diversity so high-signal gradient directions get slightly stronger updates, mimicking HTMuon (arXiv:2603.10067) at zero extra params.	+0.004	discard	0.203400	0.782812	-0.020700	4742.035631	4742.035631	nc-opt-0108		HTMuon (arXiv:2603.10067) raises SVs to power p∈(0,1) to induce heavy-tailed weight spectra, improving generalization (reduces LLaMA perplexity by ~0.98 on C4). Our approximation: after polar_express gives uniform SVs≈1, blend 25% of the pre-orthogonalization Nesterov gradient (normalized) back in. Effective SV becomes 0.75 + 0.25*(σ_i/||S||_F), giving heavier-tailed updates proportional to original gradient magnitude structure. NorMuon variance reduction then provides the usual per-neuron normalization on top of the blended g. Directions tried and discarded: ns_steps 5→7 (exp_049), NorMuon beta2 0.9→0.95 (exp_068), matrix-lr +25% (exp_054), weight-decay 0.28→0.10 (exp_059), MuonEq equilibration (exp_037). This is the first HTMuon-style directional blend attempted.
112	2026-04-30T02:49:59Z	sched	025	025	sched	Add 5% WD floor: cosine weight-decay decays to 0.05×WD_scaled instead of 0, on clean exp_025 base (window=L, ratio=130, 400-step momentum warmup). Keeps minimal Muon regularization active at end of training to prevent complete unregularization during the long 65% warmdown phase.	+0.002	discard	0.209200	0.784629	-0.014900	4804.979981	4804.979981	nc-sche-0108		Two changes vs workdir: (1) restore momentum warmup 200→400 steps (fix exp_107 regression that was left in workdir; exp_107 itself lost 0.020), (2) add WD floor_frac=0.05 in get_weight_decay. Net new change vs exp_025 is the WD floor only. Rationale: constant WD (exp_057) was terrible (0.1873) because WD=0.28 during warmdown was too high; but WD→0 might overshoot the other way. A 5% floor (WD_end ≈ 0.014) is conservative and keeps some L2 signal active when LR is at its final_lr_frac=0.05 level.
113	2026-04-30T03:32:09Z	sys	025	025	sys	Implement FP8 input-rowwise quantization: per-token scale in forward (much better precision than tensorwise, ~0 quality penalty per torchao literature), BF16 grad_weight backward. Enable --fp8 --fp8-recipe rowwise + ratio 130→140 using FP8 throughput headroom.	+0.003	discard	0.189100	0.785059	-0.035000	5268.038580	5268.038580	nc-sys-0110		FP8 tensorwise (exp_066) lost -0.018 CORE metric vs BF16 due to single global scale for entire activation matrix. Rowwise gives each of the B×T=65536 tokens its own FP8 scale, capturing per-token magnitude diversity — matches BF16 quality per torchao pretraining docs. Implementation: _Float8MatmulRowwise uses _to_fp8_rowwise (per-row amax + scale), calls _scaled_mm(scale_a=1, scale_b=weight_inv), manually dequantizes by dividing output_raw by per-row quant_scale [B,1]. Backward GEMM1 (grad_input) uses standard e5m2 FP8; GEMM2 (grad_weight) dequantizes input_fp8 back to BF16 then does BF16 matmul for correctness. FP8 matmul speedup (~1.3-1.5x overall) permits ratio 130→140 (+7.7% tokens) within 90-min wall.
114	2026-04-30T03:38:11Z	arch	025	025	arch	Extend value embeddings (VE) from alternating odd layers (1,3,5,7,9,11) to all 12 layers via 6 early-late shared tables: layer i shares table with layer (n_layer-1-i). Pairs: (0,11),(1,10),(2,9),(3,8),(4,7),(5,6). Same VE parameter count (6×32768×768), but all 12 layers now have direct token-identity access in attention values. Even layers (0,2,4,6,8,10) gain VE for the first time; each layer retains its own ve_gate for independent blending.	+0.002	discard	0.212700	0.782760	-0.011400	4818.915511	4818.915511	nc-arch-0110		Motivated by modded-nanogpt speedrun analysis (Records 63-65) showing early/late layers benefit most from VE, and that all layers benefit from token identity information in attention values. The current alternating scheme misses even layers including layer 0 (the first processing stage). Sharing early-late pairs (0↔11, 1↔10, etc.) doubles coverage at zero parameter cost. Each layer has its own ve_gate (Linear 12→6, tiny) to learn independent blending. VE tables use same AdamW optimizer group as before. Rebased cleanly from exp_025 to remove discarded bigram-hash (exp_104) and MTP-2 (exp_109) accumulations.
115	2026-04-30T03:43:57Z	data	025	025	data	Double total batch size from 524288 (2^19) to 1048576 (2^20) on exp_025 base (window=L, ratio=130): halves step count to ~13.6K but auto-scales LRs ×√2 and WD ×√2. Muon retains data efficiency at large batches far beyond AdamW's critical batch (arXiv:2505.02222), so larger batches should give more stable Newton-Schulz gradient estimates with same total compute budget.	+0.003	discard	0.194600	0.784242	-0.029500	4273.134383	4273.134383	nc-data-0111		Single line change: --total-batch-size -1 → 1048576. device_batch=32 unchanged → grad_accum=2. Training tokens unchanged (ratio=130). LR/WD auto-scaling built into base_train.py handles the rest. Estimated ~45-50 min wall time (half the steps, fewer evals). Novel in data domain — no prior batch-size experiment in 18 data trials.
