exp_id	timestamp	specialist	parent_exp	baseline_exp	domain	hypothesis	expected_delta	status	core_metric	val_bpb	delta_vs_best	train_s	total_s	job_name	snapshot_path	notes
000	2026-04-28T05:24:48Z	baseline			baseline	calibrated baseline (1 trial, avg=0.161800)	0	baseline	0.161800							d12 miniseries baseline reference (NANOCHAT_BASE_DIR pre-baked)
001	2026-04-28T05:50:52Z	sched	000	000	sched	Couple weight decay to LR multiplier (WD ∝ LR) instead of independent cosine-to-zero decay, maintaining T_epoch = B/(η·λ·D) consistency throughout training.	+0.005	discard	0.159600	0.846935	-0.002200	746.111188	746.111188	nc-sche-0001		Current cosine WD: decays from weight_decay_scaled → 0 over full training, meaning WD is already at ~79% of peak when warmdown starts (during constant-LR phase) and reaches 0 while LR is still at 5% (final_lr_frac). New LR-coupled WD: WD = weight_decay_scaled * get_lr_multiplier(it), so WD holds at full strength during constant-LR phase, then decays proportionally with LR to weight_decay_scaled * 0.05 at the end. Theoretically justified by T_epoch framework already cited in base_train.py (arxiv 2405.13698): η·λ = constant requires WD ∝ LR.
002	2026-04-28T05:52:14Z	arch	000	000	arch	Replace relu^2 MLP (4x, hidden=3072) with SwiGLU (8/3x, hidden=2048) — parameter-neutral swap using SiLU-gated MLP, same init scheme.	+0.008	discard	0.159700	0.846528	-0.002100	762.732428	762.732428	nc-arch-0001		For n_embd=768, 8/3*768=2048 exactly, so 3*768*2048 == 2*768*3072 == 4,718,592 params per MLP block. Gate proj initialized same as up-proj (0.4x uniform std). SwiGLU is the standard modern LLM MLP activation (LLaMA, Mistral, PaLM) and is expected to improve sample efficiency over relu^2 at the same parameter budget.
003	2026-04-28T05:53:28Z	opt	000	000	opt	Increase Muon NorMuon variance-reduction beta2 from 0.9 to 0.95, matching the NorMuon paper recommendation for smoother per-neuron adaptive rates.	+0.003	discard	0.159900	0.845735	-0.001900	747.405179	747.405179	nc-opt-0001		NorMuon (arxiv 2510.05491) consistently uses beta2=0.95 across all scales (124M, 350M, 1.1B, 5.4B). The current nanochat uses beta2=0.9. Higher beta2 gives smoother per-neuron second-moment estimates, reducing noise in the adaptive scaling. Change is in gpt.py setup_optimizer: Muon group beta2 0.9→0.95. No schedule changes (sched domain untouched).
004	2026-04-28T05:53:59Z	sys	000	000	sys	Enable FP8 training (--fp8 flag) to use cuBLAS FP8 tensorwise dynamic scaling on GPU; same training steps as BF16 baseline, ~1.3-1.5x faster per step, d12 dims (≥768) all above the 128-filter threshold so all eligible layers convert.	+0.003	discard	0.144400	0.848517	-0.017400	775.447665	775.447665	nc-sys-0001		Custom fp8.py uses tensorwise dynamic scaling (one scale per tensor per forward/backward). All d12 Linear layers have min_dim=768 >> 128 threshold so 100% of eligible layers are converted. FP8 forward uses use_fast_accum=True (standard practice), backward uses False (precise gradients). Speedrun LEADERBOARD.md Run 2 shows FP8 gave 4.3% wall-clock improvement on d26; for d12 the relative benefit should be similar or better due to smaller model size dominating the per-step time.
005	2026-04-28T05:54:10Z	data	000	000	data	Recover ~35% discarded tail tokens in BOS-bestfit packing: when cropping a document to fill a row, prepend BOS to the tail and return it to the buffer instead of discarding it, giving the model more unique training text per compute step.	+0.008	discard	0.156100	0.851273	-0.005700	752.080534	752.080534	nc-data-0001		Current BOS-bestfit packing discards ~35% of tokens when cropping the shortest document to fill remaining row space. The tail [BOS + doc[remaining:]] is coherent text and valid training signal. By appending it back to the doc_buffer, we recover nearly all wasted tokens. This increases the diversity of unique text seen per training step without changing compute budget or architecture. Buffer dynamics: tails are shorter than average docs so the best-fit check picks them up efficiently; the buffer stays bounded at ~buffer_size=1000. Risk: the tail starts mid-document after an artificial BOS, which slightly misrepresents document structure, but the quality tradeoff is expected to be outweighed by the ~35% more unique data.
006	2026-04-28T06:09:07Z	sched	000	000	sched	Cosine LR warmdown (replaces linear) + revert WD to cosine decay: cosine warmdown spends more time near peak LR early (≈0.86 vs 0.76 at 75% through warmdown), while reverting exp_001's harmful WD∝LR back to cosine-to-zero decay.	+0.003	discard	0.160500	0.846960	-0.001300	752.168517	752.168517	nc-sche-0006		Two schedule changes: (1) get_lr_multiplier warmdown phase changed from linear interpolation to cosine curve: final + (1-final)*0.5*(1-cos(pi*progress)), same endpoints/ratio but spends more iters at higher LR. (2) get_weight_decay reverted from WD∝LR (exp_001, discarded at 0.1596) back to cosine decay: weight_decay_scaled * 0.5 * (1 + cos(pi*it/num_iterations)). Muon momentum schedule unchanged.
007	2026-04-28T06:12:57Z	sys	000	000	sys	Switch --window-pattern from SSSL to L: with PyTorch SDPA (no FA3 on environment), any sliding-window mask forces the slow math backend; only is_causal=True (enabled by L) uses the Flash SDPA kernel. 9/12 SSSL layers were on math backend; L puts all 12 on Flash (~3-5x faster attention). Also reverts FP8 (exp_004 degraded quality by -0.017). More context per step may improve convergence quality too.	+0.005	keep	0.169500	0.844967	+0.007700	541.766792	541.766792	nc-sys-0006	snapshots/007_sys	SDPA backend constraint confirmed by PyTorch docs: custom attn_mask (bool or float) disables both Flash and mem_efficient backends, forcing math fallback. Only is_causal=True without mask enables Flash path. SSSL S-layers (window=512, Tq=2048: window&lt;Tq branch) build explicit bool masks → math backend. L-layers (window=2048 &gt;= Tq=2048 branch) use is_causal=True → Flash backend. With SSSL: 9/12 layers on math, 3/12 on Flash. With L: 12/12 on Flash. Speedup in attention should be ~3x, potentially allowing the same wall budget to process more tokens in future iterations. Also: full context slightly improves each attention step quality vs 512-token sliding window.
008	2026-04-28T06:13:14Z	opt	000	007	opt	Revert Muon NorMuon beta2 to 0.9 (undo discarded exp_003) + raise lm_head AdamW betas from (0.8, 0.96) to (0.9, 0.99) for more stable variance tracking on the 32768-dim unembedding layer.	+0.003	discard	0.149700	0.846313	-0.019800	754.159987	754.159987	nc-opt-0006		exp_003 set Muon beta2=0.95 but was discarded (-0.0019); reverting to baseline 0.9. Key new change: lm_head AdamW beta2 from 0.96 → 0.99 (timescale 25 → 100 steps) and beta1 from 0.8 → 0.9. The lm_head maps to 32768-dim vocabulary; with beta2=0.96 the variance estimate adapts too quickly for a large vocab output projection. Beta2=0.99 (standard for output layers in LLM training) should give more stable per-token learning rate estimates and better calibration on CORE metric tasks.
009	2026-04-28T06:14:34Z	arch	000	007	arch	Revert MLP to relu^2 (4x, relu(x).square()) from failed SwiGLU exp_002; restore full-scale c_fc init; increase logit softcap 15→20 (nanochat LOG confirms 20 optimal at d24).	+0.002	discard	0.153100	0.847835	-0.016400	740.946087	740.946087	nc-arch-0006		exp_002 replaced relu^2 with SwiGLU and was discarded. This trial restores relu^2 and adds softcap=20 per the March 2026 LOG entry ('Quick experiment to tune logit softcap on d24 scale... 20 was the best'). The baseline has softcap=15 (unchanged by exp_002). The init_weights docstring specifies c_fc as uniform(std=1/sqrt(n_embd)) = full s; exp_002 incorrectly used 0.4x for both c_fc and c_gate in SwiGLU. Two independent confirmed signals support this combo.
010	2026-04-28T06:28:49Z	sched	000	007	sched	Shorten warmdown from 65% to 20% of training (research-backed: optimal WSD decay phase should be brief) + revert LR warmdown to linear (D2Z): spend 80% of compute at peak LR instead of 35%.	+0.008	discard	0.157000	0.852154	-0.012500	752.906463	752.906463	nc-sche-0010		"arxiv 2602.06797: in hard-task regime, optimal WSD schedule ""maintains the largest admissible LR for most of training and decays only near the end, with the decay phase occupying a vanishing fraction of the horizon."" arxiv 2502.15938: linear D2Z consistently outperforms cosine decay. Current warmdown_ratio=0.65 means only 35% of training at peak LR — dramatically suboptimal. Changing to 0.20 gives 80% constant + 20% linear warmdown. Momentum schedule adapts automatically (stays at 0.97 longer). WD cosine schedule unchanged (naturally low during short warmdown, which is fine)."
011	2026-04-28T06:31:43Z	opt	007	007	opt	Adopt window-pattern=L (matching exp_007 best), revert lm_head betas to (0.8,0.96) (undo exp_008's harmful change), and fix x0_lambdas betas from (0.96,0.95) to (0.9,0.99): the original beta1>beta2 caused effective-LR to spike ~5.6x at step 1, destabilizing x0 blending in early training.	+0.008	discard	0.135000	0.845775	-0.034500	515.592560	515.592560	nc-opt-0010		Three-part change: (1) experiment.py window-pattern SSSL->L to get Flash SDPA backend on all layers (same as exp_007); (2) revert lm_head AdamW betas from exp_008's bad (0.9,0.99) back to baseline (0.8,0.96); (3) new opt change: x0_lambdas betas from anomalous (0.96,0.95) to standard (0.9,0.99). For (3): with beta1=0.96>beta2=0.95, bias_correction ratio sqrt(bias2)/bias1 starts at ~5.6x at step 1 and only normalizes after ~100 steps, causing large effective-LR spikes on x0_lambda values (which control per-layer x0-blending strength, init 0.05-0.20). Standard (0.9,0.99) has sqrt(bias2)/bias1 = 1.0 at step 1 and settles gracefully.
012	2026-04-28T06:35:15Z	arch	007	007	arch	Switch head-dim 128→64 (6 heads→12 heads, FLOP/param-neutral): more attention head diversity at 110M scale, matching GPT-2's head structure. Also aligns workdir to exp_007 state (window-pattern L, softcap 15, 0.4x c_fc init).	+0.003	discard	0.153800	0.845872	-0.015700	552.956049	552.956049	nc-arch-0010		head_dim=64 → n_head=12, n_kv_head=12. QKV param counts unchanged (768*768 per proj); value_embeds kv_dim=12*64=768 (same total). Smear gate and ve_gate channels unchanged. Rotary uses 32 cos/sin pairs (vs 64). exp_009 bad changes (softcap=20, full c_fc init, SSSL) reverted.
013	2026-04-28T06:45:29Z	sched	007	007	sched	Delay Muon WD decay to warmdown phase only: keep WD constant at WD_scaled during warmup+constant-LR, then cosine-decay to 0 during warmdown. Current cosine-over-all-training loses ~27% WD before warmdown even starts; this gives full regularization while LR is at peak, then relaxes WD together with LR during warmdown.	+0.003	discard	0.160600	0.845994	-0.008900	543.010660	543.010660	nc-sche-0012		Also rebases: reverts exp_010's --warmdown-ratio 0.20 back to 0.65 (baseline), and sets --window-pattern L (from exp_007). The sole new sched change is the delayed WD schedule in get_weight_decay(). Comparison is vs exp_007 (0.1695) which already had window-pattern=L + 65% warmdown.
014	2026-04-28T06:51:55Z	opt	007	007	opt	Revert x0_lambdas betas (0.9,0.99)→(0.96,0.95) to fix exp_011's -0.035 regression; also zero resid_lambdas weight_decay (was 0.05, decaying residual-scale factors toward 0 by ~25% over training).	+0.035	discard	0.162800	0.845160	-0.006700	541.595185	541.595185	nc-opt-0013		exp_007 snapshot shows x0_params had betas=(0.96,0.95) with comment 'higher beta1 for x0'. exp_011 changed these to (0.9,0.99) calling it a 'fix', causing core_metric to drop from 0.1695→0.135 (-0.0345). Reverting restores the baseline. Additional change: resid_lambdas weight_decay 0.05→0.0. At peak LR=0.005, WD rate is 0.00025/step; over ~2000 steps with average LR~0.5 that amounts to ~25% decay toward zero for resid_lambdas (initialized at 1.05–1.15). These are residual-stream scale factors and should not be regularized toward zero.
015	2026-04-28T06:55:24Z	arch	007	007	arch	Parallel residuals (PaLM-style): share pre-norm and add attn + MLP simultaneously instead of sequentially. Also reverts head_dim 64→128 (undoes discarded exp_012). Saves one RMSNorm per block, both sublayers see the same normalized input for cleaner gradient flow; c_proj zero-init keeps training start identical to sequential.	+0.004	discard	0.166000	0.855092	-0.003500	534.400374	534.400374	nc-arch-0013		Block.forward changed from two sequential pre-norm sublayers to one shared norm + simultaneous addition: normed_x = norm(x); x = x + attn(normed_x,...) + mlp(normed_x). Parameter count unchanged (same weight matrices). PaLM paper shows this works at scale; at 12 layers the key question is whether gradient flow improvement outweighs the loss of within-block sequential information refinement. experiment.py: --head-dim restored to 128 (6 heads) from 64 (12 heads) that exp_012 discarded.
016	2026-04-28T07:01:30Z	sched	007	007	sched	Revert WD to cosine-over-all (undo exp_013's harmful constant+warmdown-cosine) + hold Muon momentum constant at 0.97 during warmdown (no 0.97→0.90 decay): LR already decays 65% of training; simultaneous momentum decay reduces gradient history, adding noise when smooth convergence is needed.	+0.003	discard	0.163100	0.846013	-0.006400	542.589439	542.589439	nc-sche-0014		Two coordinated changes: (1) get_weight_decay reverted to baseline: weight_decay_scaled * 0.5 * (1 + cos(π*it/num_iterations)) — cosine decay over full training horizon, same as exp_007 which scored 0.1695. (2) get_muon_momentum: removed warmdown branch — momentum warms 0.85→0.97 over 400 steps then stays at 0.97 for all remaining training (including the 65% warmdown phase). Previously momentum decayed 0.97→0.90 during warmdown. Theoretical backing: during LR warmdown, lower momentum means each update relies more on the current (noisier) gradient rather than accumulated gradient direction. With LR already decaying to 5% of peak, keeping momentum high (0.97) should give smoother, more consistent parameter updates as LR decreases. experiment.py unchanged (window-pattern L from exp_007 baseline).
017	2026-04-28T07:09:12Z	arch	007	007	arch	Replace relu² MLP with SwiGLU (8/3 × hidden = 2048, same params as 4 × 768 relu²) on top of exp_007 base (sequential pre-norm, window-pattern=L). SwiGLU is dominant in modern LLMs; exp_002 tried it on SSSL (slow math backend) and got -0.002, but with L pattern all attention is on fast Flash SDPA so training dynamics differ.	+0.003	discard	0.164100	0.846357	-0.005400	554.509079	554.509079	nc-arch-0016		MLP param count identical: 3×768×2048 = 2×768×3072 = 4,718,592 per block. Block.forward reverted from exp_015's parallel residuals back to sequential pre-norm matching exp_007. init_weights updated to initialize c_gate weight at 0.4× scale alongside c_fc.
018	2026-04-28T07:15:35Z	opt	007	007	opt	Restore resid_lambdas WD=0.05 (exp_014 wrongly zeroed it; exp_007 best had 0.05) + reduce Muon NorMuon beta2 0.9→0.85 for faster variance adaptation during the long warmdown phase	+0.003	discard	0.156400	0.844954	-0.013100	541.183504	541.183504	nc-opt-0017		Two-part change: (1) resid_lambdas WD revert: exp_014 set WD=0.0 claiming 'decaying toward 0 hurts' but exp_014 scored 0.1628 vs exp_007's 0.1695 with WD=0.05, confirming WD=0.05 is better. Restoring it puts us back at exp_007 optimizer baseline. (2) NorMuon beta2=0.85 (vs 0.9 baseline): exp_003 tried 0.95 (more smoothing) and got -0.0019; trying the opposite direction (less smoothing, faster adaptation to changing variance) which hasn't been tested. With 65% warmdown, gradient statistics change rapidly and faster adaptation may help.
019	2026-04-28T07:16:57Z	sched	007	007	sched	True D2Z: reduce final-lr-frac from 0.05 to 0.0 — linear decay all the way to zero LR, backed by arxiv 2502.15938 showing D2Z consistently achieves lower loss than leaving a residual fraction at the end.	+0.003	discard	0.155800	0.845315	-0.013700	532.478242	532.478242	nc-sche-0017		Rebased to exp_007 (window-pattern=L, momentum 0.97→0.90 during warmdown, cosine WD). Only change: --final-lr-frac 0.05 → 0.0. The baseline get_lr_multiplier computes: progress * 1.0 + (1-progress) * final_lr_frac. With final_lr_frac=0 this simplifies to pure linear decay: LR = progress (1.0 at warmdown start → 0.0 at end). arxiv 2502.15938 proves this is optimal for a given token budget vs any residual-keeping variant.
020	2026-04-28T07:19:31Z	sys	007	007	sys	Exploit window=L speedup: increase --target-param-data-ratio from 12 to 100, training 8x more tokens within the 90 min wall budget. exp_007 (ratio=12, window=L) finished in only 9 min; scaling to ratio=100 gives ~60 min total — well within budget. More training tokens (8x Chinchilla) directly improves CORE metric.	+0.020	keep	0.202900	0.787406	+0.033400	3693.777823	3693.777823	nc-sys-0010	snapshots/020_sys	Auto-batch-size will scale to 2^20=1M tokens/step (batch_ratio=1M/524K=2, grad_accum=2). LR scales by sqrt(2)~1.41x automatically. WD scales down for longer run. Estimated training time: 421s * (100/12) ~ 3508s + 120s compile + ~700s extra eval = ~4330s ~ 72 min. Safe.
021	2026-04-28T07:31:35Z	data	000	020	data	Train 7.5x longer (target-param-data-ratio 12→90) to fill the ~80-min available compute budget; model used only ~6% of ClimbMix at ratio=12 and val_bpb was still dropping rapidly at end. Also reverts exp_005's harmful tail-recovery packing.	+0.05	discard	0.187200	0.789994	-0.015700	4834.963375	4834.963375	nc-data-0006		Exp_005 log shows training took only 8.96min (total wall 12.5min) for 2520 steps at ratio=12. At ratio=90 (~18900 steps), estimated ~80min total wall — well within 90-min cap. Val_bpb was still declining at step 2520 (0.874→0.851 in last 520 steps). ClimbMix-400B: model had only seen ~6% of unique training parquet data at ratio=12; ratio=90 covers ~45% with zero data repetition. Power-law extrapolation suggests val_bpb ~0.70 at step 18900 vs 0.851 at step 2520.
022	2026-04-28T07:33:12Z	arch	007	020	arch	GQA 2:1: reduce n_kv_head from 6→3 (num_heads//2) while keeping n_head=6. SDPA already handles GQA via enable_gqa=True. Forces 3 query-heads to share each KV-head (regularization), shrinks c_k/c_v ~7M params (→6% fewer training tokens, faster run), and reduces value_embed tables from kv_dim=768→384 (large VRAM saving).	+0.002	discard	0.141000	0.855195	-0.061900	510.994575	510.994575	nc-arch-0021		GQA is widely adopted in modern LLMs (LLaMA-3, Gemma, Mistral) for both inference efficiency and training regularization. At d12 scale with n_head=6, 2:1 GQA gives 2 query heads per KV group. The SDPA fallback path already correctly sets enable_gqa=True when q.size(1)!=k.size(1). Value embeddings automatically shrink (kv_dim=3*128=384 vs 768), saving ~100M embedding params from VRAM. Change is a single line in build_model_meta. Baseline gpt.py (relu^2 MLP) restored via rebase to exp_007.
023	2026-04-28T07:37:23Z	opt	007	020	opt	Fix asymmetric Muon LR scaling: wide matrices (MLP c_proj 768×3072) got only 1× LR while tall matrices (c_fc 3072×768) got 2×; change to (max_dim/min_dim)^0.5 for all shapes, equalising per-element update magnitude across Q/K/V/O (sq), c_fc (tall), and c_proj (wide).	+0.004	discard	0.152300	0.845211	-0.050600	531.620092	531.620092	nc-opt-0021		After polar-express orthogonalisation, the per-element Frobenius magnitude for an (m,n) matrix is proportional to 1/sqrt(max(m,n)). The symmetric formula (max/min)^0.5 compensates identically for tall and wide matrices. The old formula max(1.0, rows/cols)^0.5 only compensated tall matrices, leaving MLP c_proj (768×3072, 28M params = 1/3 of transformer matrices) trained at ~2× lower effective per-element LR. NorMuon variance reduction normalises within each shape group but not between groups, so the inter-shape asymmetry persists through to the parameter update.
024	2026-04-28T08:41:37Z	sys	020	020	sys	Push ratio from 100→130 (30% more tokens), using remaining wall budget. exp_020 (ratio=100) ran in 61 min; ratio=130 estimated ~80 min, within the 90 min cap. Continuing to exploit the efficient window=L Flash-SDPA path for maximum CORE metric improvement.	+0.005	keep	0.213900	0.783523	+0.011000	4808.915381	4808.915381	nc-sys-0021	snapshots/024_sys	batch_size stays at 2^20=1M (ratio=130 still predicts ~1.2M which rounds to 1M). grad_accum=2. Estimated train_s: 3693*(130/100)=4801s~80min. With 10min buffer for variance/eval overhead.
025	2026-04-28T08:44:49Z	sched	020	024	sched	Push --target-param-data-ratio from 100→130 on top of exp_020 (window=L, ratio=100, 0.2029): 30% more training tokens within the 90-min budget. For d12 D_REF==target_tokens so batch size stays 2^19; num_iterations scales linearly to ~27,274 steps. Estimated wall ~78 min (safe). More tokens should directly improve CORE metric further along the still-improving loss curve.	+0.010	keep	0.224100	0.783477	+0.010200	4760.853630	4760.853630	nc-sche-0021	snapshots/025_sched	Only change from exp_020: --target-param-data-ratio 100→130. All schedules (warmdown-ratio=0.65, warmup-steps=40, final-lr-frac=0.05, cosine WD, momentum warmup 400 steps) unchanged. Timing estimate: ratio scales linearly at fixed batch size (D_REF==target_tokens for d12), so 130/100 × 60 min ≈ 78 min total (plus 3 extra CORE evals at 2000-step cadence).
