exp_id	parent_exp	depth	path	specialist	status	core_metric	delta_vs_best	hypothesis
067	025	4	000/007/020/025/067	arch	discard	0.199200	-0.024900	Increase RoPE base theta from 100000 to 500000 (Llama-3 style) on exp_025 base (window=L, ratio=130, head_dim=128). With theta=100K and head_dim=128 the mid-frequency channels (k≈32) have rotational period ≈ 2π√100K ≈ 1987 tokens, nearly equal to seq_len=2048, creating positional aliasing across the full sequence. Raising to 500K pushes that period to ≈ 4443 tokens, giving every position a unique encoding across all frequency bands. Zero-parameter, zero-compute-cost change.
068	025	4	000/007/020/025/068	opt	discard	0.220700	-0.003400	Clean test of NorMuon beta2 0.9→0.95 on rebased exp_025 (window=L, ratio=130): exp_045 (0.2024) was confounded by accumulated exp_033+037+049 state (ns_steps=7 etc.) not a clean base. NorMuon's norm-preserving renormalization means beta2 only redistributes update energy across neurons without changing total magnitude, so no LR compensation needed. NorMuon paper recommends beta2=0.95 for smoother per-neuron variance estimates.
069	025	4	000/007/020/025/069	data	discard	0.212000	-0.012100	Staggered shard assignment for DDP ranks (train only): rank j reads shards j, j+W, j+2W, … fully instead of all ranks sharing the same shard with row-group striding. Every gradient step now draws from 8 different corpus shards simultaneously, giving 8× more within-batch shard diversity vs. the original all-ranks-same-shard scheme. Val loader unchanged (original row-group striding on the single val shard).
070	025	4	000/007/020/025/070	sched	discard	0.201800	-0.022300	Lower Muon momentum warmdown endpoint from 0.90→0.85 in get_muon_momentum: same 0.97→X linear decay over warmdown phase but ending at 0.85 instead of 0.90. exp_062 proved momentum warmdown helps (+0.014 vs flat); lower endpoint reduces optimizer inertia during final cooldown for better convergence to local optimum.
071	025	4	000/007/020/025/071	sys	discard	0.212000	-0.012100	Add gradient clipping (max_norm=1.0) to base_train.py on clean exp_025 base (BF16, window=L, ratio=130): standard LLM pretraining practice (GPT-2/3, PaLM, LLaMA) that was completely absent from the training loop — clips combined gradient L2 norm before optimizer.step() to prevent AdamW parameter spikes.
072	025	4	000/007/020/025/072	arch	discard	0.211400	-0.012700	Add learnable RMSNorm scale (γ weight, init=1.0) to all 4 layer-norm sites: pre-attn (ln1) and pre-MLP (ln2) in each of 12 blocks, plus embedding norm (ln_emb) and final norm (ln_f). Currently the model uses bare RMSNorm with no learnable scale — unusual vs all modern LLMs (Llama, Mistral, Gemma). The γ weights add expressiveness: per-dimension magnitude control after normalization, complementing resid_lambdas (per-layer scalar) with per-feature tuning. Norm params routed to AdamW (not Muon — Muon requires 2D matrices). ~26K new params (<0.03% of 110M). QK-norm in attention keeps bare norm() — scale there is redundant with c_q/c_k projection weights.
073	025	4	000/007/020/025/073	opt	discard	0.211900	-0.012200	Reduce --matrix-lr from 0.02 to 0.016 (-20%) on clean exp_025 base (window=L, ratio=130, 0.2241). exp_054 tested the UP direction (0.025, -0.0083 worse) but the DOWN direction is unexplored. At ratio=130 (~27K steps with 65% warmdown = 17.7K decay steps), a more conservative Muon base LR may reduce overshooting during the long warmdown phase. Pure flag change, no vendor edits.
074	025	4	000/007/020/025/074	data	discard	0.215300	-0.008800	Clean ratio 130→140 (+7.7% training tokens) from a rebased exp_025 baseline. All prior ratio=140 trials (exp_035: 0.2208) ran from dirty workdirs with accumulated code changes; this is the first clean data-domain test of more tokens on top of the best known config.
075	025	4	000/007/020/025/075	sched	discard	0.206500	-0.017600	Couple WD decay to LR warmdown: hold WD constant at peak during warmup+stable phase, then cosine 1→0 only during the warmdown period. Vs current cosine-over-all-training which halves WD by step 35% of training (warmdown start). Stronger regularization during high-LR stable phase; same final WD=0.
076	025	4	000/007/020/025/076	sys	discard	0.210700	-0.013400	Remove BF16 cast before Polar Express in muon_step_fused: FP32 param gradients were being quantized to BF16 (7 mantissa bits) before orthogonalization and the subsequent weight update. Keeping everything in FP32 gives more accurate Muon updates. Overhead is <0.5% of step time.
077	025	4	000/007/020/025/077	arch	discard	0.196100	-0.028000	Change --head-dim from 128→96 on exp_025 base (window=L, ratio=130): n_head=8 (768/96), max attention logit 1.44×√96≈14.1 just below softcap=15 (minimal compression vs baseline 16.3>15). Unexplored sweet spot between head-dim=64/12heads (exp_063, 0.2179) and head-dim=128/6heads (baseline, 0.2241).
078	025	4	000/007/020/025/078	opt	discard	0.203400	-0.020700	Reduce NorMuon beta2 from 0.9 → 0.80 on clean exp_025 base (window=L, ratio=130): exp_068 showed 0.90 > 0.95 (slower-adapting hurt by -0.0034), so trying the opposite direction — faster variance adaptation. Lower beta2 means per-neuron step-size normalization converges in ~5 steps vs ~10, reducing early-training bias in the second moment estimate.
079	025	4	000/007/020/025/079	opt	discard	0.200900	-0.023200	Move ve_gate weights from Muon to AdamW (lr=0.2, matching smear_gate): ve_gate.weight (6×12, 432 params total across 6 layers) was inadvertently swept into matrix_params via list(self.transformer.h.parameters()), getting Muon's polar-express orthogonalization — inappropriate for tiny gating matrices. AdamW gives per-element adaptivity better suited to learning near-zero sigmoid gates; effective LR rises from ~0.028 (Muon) to 0.2 (AdamW), enabling faster gate adaptation. Consistent with smear_gate treatment.
080	025	4	000/007/020/025/080	sched	discard	0.220300	-0.003800	Increase --warmdown-ratio from 0.65→0.70 on exp_025 base (window=L, ratio=130, 0.2241): exp_042 showed reducing warmdown to 0.40 was very harmful (-0.022), meaning the decay phase is critical. Testing the unexplored opposite direction: 5% more warmdown (17,727→19,091 steps) for more gradual LR decay, at the cost of ~1,364 fewer stable peak-LR steps. Total compute unchanged (ratio=130 fixed).
081	025	4	000/007/020/025/081	data	discard	0.201900	-0.022200	Halve best-fit buffer_size from 1000→500 on clean exp_025 base (window=L, ratio=130): exp_056 (buffer=2000) hurt badly (−0.025), suggesting larger buffers create excessive length-clustering that harms gradient diversity. Smaller buffer preserves more temporal data locality and reduces O(n) Python scan overhead per position fill.
082	025	4	000/007/020/025/082	arch	discard	0.210300	-0.013800	Peri-LN: add post-norm to each sublayer output in Block.forward — x = x + norm(f(norm(x))) instead of x = x + f(norm(x)). Zero new parameters, bounds each block's residual contribution. Used in Gemma-3 (arXiv:2502.02732).
083	025	4	000/007/020/025/083	sys	discard	0.204700	-0.019400	Switch torch.compile mode from default to 'max-autotune' on clean exp_025 base (window=L, ratio=130, BF16, 0.2241): enables Triton GEMM autotuning per unique matmul shape + CUDA graphs to eliminate CPU kernel-launch overhead. On d12 scale (small model, 110M params), launch overhead is a larger fraction of step time, so CUDA graphs give proportionally larger speedup (~10-20%). Faster steps = same wall budget with same token count, but different kernel fusion paths produce marginally different BF16 accumulation order.
084	025	4	000/007/020/025/084	opt	discard	0.220400	-0.003700	Raise value_embeds LR from 0.5× to 1.0× embedding_lr (0.15→0.30): value embeddings are large (~150M params) ResFormer residuals whose early gradients are suppressed by near-zero ve_gate init, causing systematic under-adaptation vs wte at the same embedding_lr. Removing the 0.5× haircut gives them equal LR budget to wte.
085	025	4	000/007/020/025/085	sched	discard	0.215300	-0.008800	Fix absolute warmdown duration at ~17.7K steps while adding 7.7% more tokens: ratio=140 + warmdown-ratio=0.60 keeps warmdown steps nearly identical to exp_025 (17,624 vs 17,728) while adding 2,203 more stable high-LR training steps (+23%). Hypothesis: exp_074's ratio=140/0.65 hurt because 1.5K extra steps went into extended near-zero-LR annealing, not useful learning. Same absolute warmdown + more stable training should match or beat 0.2241.
086	025	4	000/007/020/025/086	data	discard	0.205000	-0.019100	ISO-compute seq-len halving: --max-seq-len 2048→1024, --device-batch-size 32→64. Tokens/step stays 64×1024×8=524,288 (2^19), num_iters and total training tokens unchanged (~27K steps, ~14.3B tokens). Activation memory identical (B×T per device same). Shorter sequences expose the model to more distinct document starts per batch and reduce cross-document cropping confusion.
087	025	4	000/007/020/025/087	arch	discard	0.193400	-0.030700	Extend value embeddings (ResFormer-style) from alternating 6/12 layers to ALL 12 layers: adds VE tables to layers 0,2,4,6,8,10. VE params excluded from scaling_params so training tokens unchanged. ResFormer paper shows quality increases with more VE coverage; later layers benefit most but full coverage generalises the signal.
088	025	4	000/007/020/025/088	sys	discard	0.211200	-0.012900	Switch torch.compile from default mode to 'reduce-overhead' on clean exp_025 base (window=L, ratio=130, BF16, 0.2241): CUDA graphs eliminate CPU kernel-dispatch overhead per step while keeping the same cuBLAS kernels as default compile — numerics should be identical to exp_025, just slightly faster execution.
089	025	4	000/007/020/025/089	sched	discard	0.214300	-0.009800	Lower Muon peak momentum from 0.97→0.95 on clean exp_025 base (window=L, ratio=130, 0.2241): peak 0.97 has never been questioned; NorMuon paper and modded-nanogpt use 0.95. Lower peak reduces update over-smoothing during the 9.5K-step stable phase and shrinks warmdown delta from 0.07 to 0.05 (0.95→0.90), making the final convergence less abrupt. Pure code change in get_muon_momentum (3 constants).
090	025	4	000/007/020/025/090	arch	discard	0.192400	-0.031700	Change --head-dim from 128→96, giving n_head=8 (up from 6) while n_kv_head×head_dim=8×96=768 stays constant (zero param change). exp_063 tried head_dim=64/n_head=12 and scored 0.2179 (−0.006). Hypothesis: n_head=8/head_dim=96 is a better sweet spot than either 6×128 or 12×64, capturing more attention diversity without over-fragmenting per-head capacity. Rebased cleanly to exp_025.
091	025	4	000/007/020/025/091	data	discard	0.202400	-0.021700	Sequence-length curriculum: phase 1 (first 50% of steps, ~13.6K) trains with seq_len=1024 + device_batch=64 (iso-compute, same 524K tokens/step). Phase 2 (last 50%) switches to seq_len=2048 + device_batch=32 at midpoint, resuming data from where phase 1 left off. Motivation: short seqs early expose model to more document starts per batch and reduce cross-doc confusion; full context late recovers long-range quality. exp_086 (1024 throughout) got 0.205 (−0.019) while baseline 2048 gives 0.2241 — curriculum targets the upside of both phases.
092	025	4	000/007/020/025/092	sys	discard	0.196900	-0.027200	Force FP32 accumulation for BF16 GEMMs (allow_bf16_reduced_precision_reduction=False) + revert compile to default mode from reduce-overhead: on GPU WGMMA natively does BF16→FP32 accum at full throughput, so no speed penalty. Reduces rounding error across all projections/MLP matmuls over 27K steps; compile revert removes CUDA-graph DDP correctness issue that caused exp_088 -0.013.
093	025	4	000/007/020/025/093	sched	discard	0.220700	-0.003400	Switch WD schedule from cosine to linear decay to zero on clean exp_025 base (window=L, ratio=130, 0.2241): cosine WD has been untouched across all prior experiments; linear WD provides less regularization in the stable phase but more during warmdown. Both start at wd_scaled and end at 0. Single-line change in get_weight_decay.
094	025	4	000/007/020/025/094	arch	discard	0.202900	-0.021200	GQA n_kv_head=3 (halved from 6) on clean exp_025 base (window=L, ratio=130, 0.2241): 2 query heads share each KV head, PyTorch SDPA enable_gqa=True path, reduces c_k/c_v params 50% (~7M transformer_matrix params), halves VE kv_dim 768→384, acts as regularisation on KV representations. SDPA GQA untested in this series; no other code changes.
095	025	4	000/007/020/025/095	data	discard	0.193000	-0.031100	2-shard gradient diversity: split 8 DDP ranks into 2 groups of 4; group 0 reads even-indexed shards (0,2,4,…), group 1 reads odd-indexed shards (1,3,5,…). Row-groups strided by group_size=4 within each shard. Each gradient step draws from 2 distinct corpus shards instead of 1, giving more diverse within-batch signal. Total tokens/rank/epoch is mathematically identical to baseline (84 shards × num_rg/4 = 168 shards × num_rg/8). Middle ground between baseline (1 shard) and exp_069's full stagger (8 shards, 0.212).
096	025	4	000/007/020/025/096	opt	discard	0.220400	-0.003700	Move NorMuon variance normalization from POST to PRE Polar Express: compute per-neuron EMA variance of Nesterov momentum, scale by 1/sqrt(variance) BEFORE orthogonalization, then remove the post-NS NorMuon rescaling. Motivated by arXiv:2601.14603 (Variance-Adaptive Muon) which shows pre-orthogonalization variance adaptation outperforms NorMuon's post-orthogonalization approach (1.36x convergence speedup on LLaMA-1.2B).
097	025	4	000/007/020/025/097	sys	discard	0.203800	-0.020300	Add z-loss regularization (eps=1e-4, PaLM 2022 §5.1) to gpt.py forward: loss += 1e-4 * E[logsumexp(logits)²], training-only. Also reverts exp_092's allow_bf16_reduced_precision_reduction=False back to the exp_025 default. Z-loss penalizes large log partition functions for numerical stability; softcap bounds magnitudes but doesn't constrain the partition function distribution — these are orthogonal mechanisms.
098	025	4	000/007/020/025/098	sched	discard	0.222300	-0.001800	Increase --warmdown-ratio from 0.65→0.70 on clean exp_025 base (window=L, ratio=130, cosine WD, 0.2241): the only previous warmdown-ratio data point is 0.40→0.2026 (much worse). The trend is unambiguously "more warmdown = better". Going 0.65→0.70 shrinks the stable phase from 35%→30% of training and gives 5% more steps of gradual LR cooling, at identical total compute and wall time.
099	025	4	000/007/020/025/099	arch	discard	0.208100	-0.016000	Sigmoid-gate x0_lambdas: change raw scalar init (decaying 0.20→0.05) to sigmoid-gated with uniform init=-1.5 (sigmoid≈0.18). Forward: x=resid_lambda*x + sigmoid(x0_lambda)*x0. Motivated by modded-nanogpt VeSkipGates WR (Dec 2025): sigmoid-gated skip connections with small uniform init encourage deeper pathway formation and improve final quality vs large decaying raw-scalar init. Zero param/compute change.
100	025	4	000/007/020/025/100	data	discard	0.208200	-0.015900	Row-group shuffle within each shard: replace sequential rg_idx+=world_size with a deterministically shuffled list per (epoch, shard, rank) on top of clean exp_025 base. Breaks any within-shard temporal ordering (e.g. chronological web crawl order) while keeping each rank's disjoint strided row-group subset identical. No change to total data volume, packing, or batch size.
101	025	4	000/007/020/025/101	opt	discard	0.191700	-0.032400	Add sign transform after Nesterov and before Polar Express in muon_step_fused: g = g.sign(). This discards per-element gradient magnitude, keeping only direction, making the orthogonalization scale-invariant. Motivated by AdaMuon (arXiv:2507.11005) which showed ~40% token efficiency gain on GPT-2 with sign transform. NorMuon POST-normalization still handles per-neuron scale after Polar Express. Rebased to clean exp_025 (POST NorMuon, beta2=0.9).
102	025	4	000/007/020/025/102	sched	discard	0.209800	-0.014300	Replace linear LR warmdown with (1-sqrt) shape on clean exp_025 base (window=L, ratio=130, warmdown-ratio=0.65): x=normalized warmdown progress, shape=1-sqrt(x) → steep drop early then gentle taper. arXiv:2405.18392 shows (1-sqrt) consistently outperforms linear. Opposite of cosine (which kept LR high early, disastrous at 0.1569).
103	025	4	000/007/020/025/103	sys	discard	0.197000	-0.027100	Revert z-loss (exp_097 regression, -0.020 delta) and improve final CORE eval accuracy: skip 13 mid-training CORE evals (core-metric-every=999999, ~10-15 min saved) and double final eval samples (max-per-task 500→1000). Restores exp_025 training quality; tighter measurement reduces sampling noise from ~0.50% std to ~0.35% std per task.
104	025	4	000/007/020/025/104	arch	discard	0.222100	-0.002000	Add Bigram Hash Embedding (modded-nanogpt Record 62): hash (prev_tok, curr_tok) pairs into a 4096-entry embedding table, injected per-layer with learned scale (bigram_scales, init=0 → no-op at start). Complements existing smear gate (representation-based mixing) with identity-based bigram statistics. Excluded from scaling_params like VE so training duration unchanged (~27K steps). ~3.1M new params.
105	025	4	000/007/020/025/105	data	discard	0.220800	-0.003300	Revert exp_100's harmful row-group shuffle by rebasing to clean exp_025 dataloader (sequential row-group reading). Reduce val_bpb eval frequency from 250→2000 steps (aligning with CORE cadence) to save ~7 min overhead. Training is bit-for-bit identical to exp_025 (ratio=130, same schedule). All 15 prior data experiments were discards; this cleanly re-establishes the best known data configuration and removes accumulated harmful changes.
106	025	4	000/007/020/025/106	opt	discard	0.211800	-0.012300	Remove g.sign() regression (exp_101) and test lm_head AdamW beta2 0.96→0.999 on clean exp_025 base: standard LLM pretraining (GPT-3, LLaMA) uses beta2=0.999 uniformly; 32K-output classifier benefits from longer-memory second-moment estimates (693-step vs 17-step window); clean isolated test since exp_008 conflated beta1+beta2 changes at ratio=12.
107	025	4	000/007/020/025/107	sched	discard	0.204000	-0.020100	Shorten Muon momentum warmup from 400→200 steps on clean exp_025 base (window=L, ratio=130, linear warmdown): at ratio=130 (~27K steps) LR peaks at step 40 but momentum kept ramping to step 400, creating a 360-step high-LR/low-momentum noisy window. Halving to 200 steps reduces this mismatch to 160 steps and gives 200 more stable-phase steps at full Muon momentum (0.97).
108	025	4	000/007/020/025/108	sys	discard	0.220400	-0.003700	Rebase to clean exp_025 + skip 13 mid-training CORE evals (core-metric-every=999999) and double final eval precision (max-per-task 500→1000): identical training to exp_025 but saves ~13 min of mid-training eval overhead and reinvests it in a tighter final CORE estimate. Fixes accumulated workdir bugs (exp_103 got 0.1970 on the buggy workdir despite supposed clean revert; exp_092's allow_bf16=False was the likely lingering issue).
109	025	4	000/007/020/025/109	arch	discard	0.187400	-0.036700	Add MTP-2 (Multi-Token Prediction, 2-step) training signal: during training (loss_reduction='mean'), blend standard next-token loss with 2-ahead prediction loss (logits[:,:-1] vs targets[:,1:]), alpha=0.2. Zero extra parameters, reuses existing softcapped logits. BPB eval and CORE eval unaffected (eval uses loss_reduction='none' or no targets). Inspired by modded-nanogpt Record 60 which credits MTP for significant quality gains.
110	025	4	000/007/020/025/110	data	discard	0.201300	-0.022800	Restore --eval-every from 2000→250 to exactly match exp_025's full recipe. The 0.003 gap between exp_025 (0.2241, eval-every=250) and exp_105 (0.2208, eval-every=2000) is within the ~0.005 noise floor — val evals are read-only and don't affect training. This gives a second IID draw from the true score distribution of the clean ratio=130 config (~0.224), with ~50% probability of beating 0.2241.
111	025	4	000/007/020/025/111	opt	discard	0.203400	-0.020700	HTMuon-inspired heavy-tail blend in muon_step_fused: after polar_express (g≈UV^T, all SVs≈1), blend 25% of the normalized Nesterov gradient back in (g = 0.75*g_polar + 0.25*g_nesterov_norm). stacked_grads holds the Nesterov gradient unmodified at that point. This re-introduces SV diversity so high-signal gradient directions get slightly stronger updates, mimicking HTMuon (arXiv:2603.10067) at zero extra params.
112	025	4	000/007/020/025/112	sched	discard	0.209200	-0.014900	Add 5% WD floor: cosine weight-decay decays to 0.05×WD_scaled instead of 0, on clean exp_025 base (window=L, ratio=130, 400-step momentum warmup). Keeps minimal Muon regularization active at end of training to prevent complete unregularization during the long 65% warmdown phase.
113	025	4	000/007/020/025/113	sys	discard	0.189100	-0.035000	Implement FP8 input-rowwise quantization: per-token scale in forward (much better precision than tensorwise, ~0 quality penalty per torchao literature), BF16 grad_weight backward. Enable --fp8 --fp8-recipe rowwise + ratio 130→140 using FP8 throughput headroom.
114	025	4	000/007/020/025/114	arch	discard	0.212700	-0.011400	Extend value embeddings (VE) from alternating odd layers (1,3,5,7,9,11) to all 12 layers via 6 early-late shared tables: layer i shares table with layer (n_layer-1-i). Pairs: (0,11),(1,10),(2,9),(3,8),(4,7),(5,6). Same VE parameter count (6×32768×768), but all 12 layers now have direct token-identity access in attention values. Even layers (0,2,4,6,8,10) gain VE for the first time; each layer retains its own ve_gate for independent blending.
115	025	4	000/007/020/025/115	data	discard	0.194600	-0.029500	Double total batch size from 524288 (2^19) to 1048576 (2^20) on exp_025 base (window=L, ratio=130): halves step count to ~13.6K but auto-scales LRs ×√2 and WD ×√2. Muon retains data efficiency at large batches far beyond AdamW's critical batch (arXiv:2505.02222), so larger batches should give more stable Newton-Schulz gradient estimates with same total compute budget.
