exp_id	timestamp	specialist	parent_exp	baseline_exp	domain	hypothesis	expected_delta	status	val_bpb	delta_vs_best	artifact_bytes	train_s	eval_s	total_s	job_name	snapshot_path	notes
146	2026-05-01T12:08:44Z	arch	130	130	arch	Add per-head sigmoid output gate on attention (NeurIPS 2025 Best Paper, arXiv:2505.06708): apply gate=sigmoid(α·||y||₂ + β) per head with α=0/β=+4 init (transparent at step-0) between SDPA(+XSA) and proj, introducing non-linearity on the low-rank softmax mapping plus output-magnitude-dependent sparse gating to mitigate attention-sink at near-zero param/byte cost (176 scalars total).	-0.0008	discard	1.075878	+0.001176	15978636	600.017000	589.300000	1545.000000	apga-arch-0141		"Direct W_g[dim,H] linear port would add ~45k params (~50 KB compressed), too tight under our 16 MB cap. Cheap-adaptation derives the gate from per-head L2 norm of the SDPA output via two learnable per-head scalars α,β (8+8 per layer × 11 = 176 scalars). β=+4 → sigmoid(4)=0.982 at init, so step-0 is numerically near-transparent (proj is zero-init anyway). Once proj learns, α can drift signed: positive α gives ""high-norm heads pass through, low-norm muted"" sparse gating; negative α gives the inverse; both are richer than the existing per-feature attn_scale (linear, no input dependence). ndim=1 → routed to scalar AdamW group via p.ndim<2 check; no CONTROL_TENSOR_NAME_PATTERNS update needed. Gate placed AFTER XSA (paper's G1 position), before reshape+proj. Recent arch trials hit eval_budget_overruns (exp_117, exp_128) — this edit adds only one elementwise sigmoid per attn block, so eval cost should be flat. Risk: y.float().norm(...) may be slightly slower than I estimate; if eval overruns, try y.norm(dim=-1) in bf16 directly."
147	2026-05-01T12:10:08Z	reg	130	130	reg	Set scalar_wd=0.0 (down from adam_wd=0.02) for optimizer_scalar: attn_scale, mlp_scale, resid_mix, and q_gain are initialized at non-zero target values (1.0, 1.0, [1.0,0], 5.25) yet WD constantly pulls them toward zero, creating optimization friction that forces gradients to fight the WD force rather than learning the optimal scale.	-0.001	discard	1.075182	+0.000480	15993271	600.146000	578.900000	1520.000000	apga-reg-0141		Key control tensors (q_gain init=5.25, attn_scale/mlp_scale init=1, resid_mix[0] init=1) are all in optimizer_scalar with WD=0.02. At scalar_lr=0.02 over 3000 steps, WD shrinks q_gain from 5.25 to ~1.6 absent compensating gradients — a 70% pull toward zero. Removing WD from scalars eliminates this constant tension, letting the optimizer settle at gradient-determined equilibria for scale/gate params without fighting decay. exp_124 tried a separate WD group for skip_weights/skip_gates only; this goes further to cover all control tensors.
148	2026-05-01T12:15:32Z	eval	130	130	eval	Replace cumulative NLL running-average reference in TTT adaptive LR with EMA (decay=0.95, α=0.05): compares each chunk's difficulty to a ~20-chunk local window instead of all prior chunks, making the cosine LR scaling more responsive to FineWeb's domain-shift structure.	-0.000030	discard	1.075168	+0.000466	15990184	600.020000	574.800000	1504.000000	apga-eval-0141		exp_082 established that chunk_nll/running_avg_nll LR scaling helps (-0.000045). Cumulative average dilutes recent domain-shift signal at late chunks (chunk 300 compares to average of all 300). EMA (decay=0.95, half-life ~14 chunks) focuses on recent ~450K tokens, reacting faster to difficulty spikes from topic transitions. Update order: compute nll_scale from prior EMA, then update EMA. First chunk initializes EMA=chunk_nll_0, nll_scale=1.0 (same as before). Code is otherwise identical to exp_130 (rebased from best snapshot, no momentum-reset code).
149	2026-05-01T12:16:23Z	quant	130	130	quant	Reduce GPTQ block_size 128→64 and damp_factor 0.01→0.005: finer inter-block error propagation plus less Hessian over-regularization should improve quantization fidelity without changing artifact size.	-0.001	discard	1.075240	+0.000538	15988511	600.069000	573.000000	1509.000000	apga-quan-0141		block_size 128→64 doubles global error-propagation frequency (most impactful for wide proj matrices cols=2048: 16→32 blocks). damp_factor 0.01→0.005 halves Hessian regularization, giving more precise inverse. Both are independent improvements that compound. The gptq_quantize_weight default was 128/0.01; neither was ever explicitly set as a hyperparameter in our lineage, so this is first exploration of this axis.
150	2026-05-01T12:21:34Z	loss	130	130	loss	MiLe Loss (arXiv 2310.19531): replace static BPE-rank weighting with dynamic entropy-weighted CE — weight_i = sqrt(1 + H(p_i)) / mean, where H(p_i) is Shannon entropy of model's prediction at each position; early training is near-uniform (undertrained model → high entropy everywhere), warmdown increasingly down-weights confident easy tokens and focuses gradient on remaining hard tokens.	-0.001	discard	1.075435	+0.000733	15987439	600.036000	571.800000	1527.000000	apga-loss-0142		MiLe Loss formula: weight = (1+H)^0.5 / mean[(1+H)^0.5] where H = Shannon entropy in nats. H computed via log_softmax under torch.no_grad() so only affects loss weights not backprop graph. Key difference from exp_139 BPE-rank weighting: MiLe weights are dynamic (change as model learns), providing a natural curriculum — standard CE early, focused on hard tokens late. Replaces exp_139's discarded static BPE-rank weighting. Based on MiLe Loss paper showing 0.1% perplexity improvement on large models.
151	2026-05-01T12:29:29Z	meta	130	130	meta	Raise ttt_momentum 0.9→0.93 (untouched scalar axis in 142 trials): three prior trials (exp_031, exp_091, exp_138) all reset the cross-chunk SGD momentum buffer and all regressed +0.0005-0.0009, establishing that cross-chunk velocity carryover is beneficial; raising β to 0.93 extends velocity timescale 10→14 inner steps, amplifying the same beneficial smoothing without zeroing it.	-0.0003	eval_budget_overrun	1.097398			600.019000	605.200000	1533.000000	apga-meta-0144		Pure scalar change (zero size/time impact). With nesterov=True and TTT_LR=0.005, effective steady-state step grows 9×LR→13.3×LR (peak ~0.067), well within stable range. The Marginal Value of Momentum (arxiv 2307.15196) shows momentum value matters most in noisy small-LR regimes — exactly TTT's regime. Direction (up not down) is chosen because the three reset-the-buffer ablations all argue that more carryover, not less, is what helps.
152	2026-05-01T12:33:47Z	tok	130	130	tok	Add per-dimension SmearAlpha: zero-init [model_dim=512] parameter that additively injects the previous position's normalized embedding into the current embedding (`x += smear_alpha * x_prev`), giving the model cheap causal bigram context in the input layer at zero initial cost (identity at init, ≤200 compressed bytes).	-0.001	discard	1.075703	+0.001001	15988612	600.052000	582.300000	1536.000000	apga-tok-0145		SmearGate concept from PR #462 (achieved 1.0672 in a different stack). Additive formulation with zero-init is strictly identity at step 0 — safer than PR #462's sigmoid(0)=0.5 initialization. Placed after input RMSNorm so baseline scale is preserved. Optimizer: scalar_params (scalar_lr=0.02). TTT adapts smear_alpha per-chunk. Size impact: 512 float16 passthrough ≈ 200 compressed bytes, well within headroom.
153	2026-05-01T12:34:54Z	opt	130	130	opt	Apply gradient clipping only to AdamW param groups (embed+scalar) instead of all parameters: Muon's Newton-Schulz orthogonalization already normalizes update matrices to unit spectral norm, so the global pre-NS clip was distorting gradient directions entering the momentum buffer; removing the clip for Muon lets NS capture the true gradient distribution.	-0.0003	discard	1.075339	+0.000637	15988132	600.117000	578.200000	1523.000000	apga-opt-0146		The global clip_grad_norm_ was applied to all params before the Muon step, meaning the clipped gradients entered the Muon momentum buffer. NS then normalizes to unit spectral norm regardless, so the clip only hurt by distorting the momentum direction. AdamW groups (embed_wd, scalar_wd) genuinely need the clip for stability. This edit separates them: Muon gets raw gradients, AdamW gets clipped at 0.3.
154	2026-05-01T12:36:06Z	ttt	130	130	ttt	Fuse per-parameter TTT gradient AllReduce (150+ NCCL calls) into a single float32 flat-buffer AllReduce per step; revert ttt_epochs to 3 after exp_145 showed 4 epochs overruns budget by ~3.5s.	-0.0001	discard	1.075204	+0.000502	15989134	600.120000	578.400000	1522.000000	apga-ttt-0147		Exp_145 confirmed 4 epochs causes eval_budget_overrun. This submit keeps only the fused AllReduce: (1) eliminates 150+ NCCL launches per gradient step → saves NCCL overhead and reduces eval time headroom; (2) AllReduce is done in float32 (vs current BF16 per-tensor), giving more precise gradient averaging across 8 GPUs. Gradient quality improvement from float32 averaging is the only quality mechanism here. Expected delta is small but the approach is budget-safe.
155	2026-05-01T12:41:54Z	curr	130	130	curr	Add mid-warmdown shard reshuffle at frac=0.55: the 72%-long warmdown runs on a single fixed shard permutation set at frac=0.28; a second reshuffle midway through (frac=0.55, LR still at 62% of peak) gives fresh data orderings for the second half of warmdown, improving data diversity during convergence.	-0.001	discard	1.136494	+0.061792	15989649	600.047000	580.200000	1532.000000	apga-curr-0148		Warmdown covers 72% of training (432s on 8 GPUs). Shards hold ~500M tokens each; only ~25% consumed per shard during warmdown, so no auto-reshuffle occurs. Adding a reshuffle at the 55% time mark (midpoint between warmdown start at 28% and the last ~85% where LR hits floor) exposes the model to fresh shard starting positions in the second half of warmdown. Implementation: 4 lines added to training loop, no batch/shape changes, no compile issues.
156	2026-05-01T12:41:55Z	arch	130	130	arch	Bifurcated K-gain [num_kv_heads=4, 2] mirroring exp_030's Q-gain win on the K side: split K into RoPE/NoPE channels and apply per-kv-head learnable scale (init=1.0, step-0 identical) so each kv-head can independently sharpen the RoPE vs NoPE contribution to logits — a DOF that q_gain[H,2] cannot express because Q-side scaling is finer-grained per-q-head but identical across the 2 q-heads sharing each kv-head.	-0.0003	discard	1.075266	+0.000564	15989435	600.063000	598.000000	1544.000000	apga-arch-0148		Structural completion of the exp_030 Q-gain bifurcation (-0.000736 keep). Adds 8 fp32 scalars/layer × 11 = 88 total = 352 B (passthrough float16 in GPTQ, well under the 65536 numel cutoff). Routed to scalar AdamW group via CONTROL_TENSOR_NAME_PATTERNS += k_gain, mirroring q_gain. Step-0 numerically identical (init=1.0, plus proj zero-init makes attn_out=0 anyway). Compute: one extra elementwise multiply + cat per attn forward (negligible vs flash_attn_3). Risk: tiny.
157	2026-05-01T12:44:38Z	reg	130	130	reg	Lower embed_wd from 0.085 to 0.05: in the severely undertrained 10-minute regime with tiny embed init (std=0.005) and low tied_embed_lr=0.03, the current WD over-constrains the embedding, preventing it from learning distinctive token representations; reducing WD by ~41% lets embeddings grow more expressive while logit_softcap=30.0 prevents overconfidence.	-0.001	keep	1.074207	-0.000495	15995021	600.125000	579.300000	1517.000000	apga-reg-0150	snapshots/157_reg	embed_wd is the only major WD axis untouched across 147 experiments. All other reg attempts (dropout, stochastic depth, augmentation, WD splits within matrix types) have been tried. embed_wd=0.085 is below attn WD=0.095 but the effective per-step decay at tied_embed_lr=0.03 is already gentler than matrix LR=0.022 (wait, actually matrix_lr=0.022 which is LOWER than tied_embed_lr=0.03). The embedding receives large output-projection gradients through tied weights, potentially making WD-driven shrinkage counterproductive in this data-constrained regime.
158	2026-05-01T12:49:18Z	eval	130	157	eval	Add floor of max(0.3, ...) to cosine TTT LR decay: prevents near-zero adaptation on late validation chunks where domain shift may demand more gradient signal, consistent with 'LR decay wastes challenging late data' findings (arxiv 2511.18903).	-0.0004	discard	1.075173	+0.000966	15988989	600.046000	599.600000	1542.000000	apga-eval-0151		Current cosine gives last 37% of TTT chunks less than 30% of peak LR (last chunk: 0% LR). With nll_scale clamped 0.5-2.0, a difficult late chunk that signals nll_scale=2.0 still only gets ~0.1*ttt_lr instead of ~0.6*ttt_lr. Floor at 0.3 ensures late hard chunks get meaningful adaptation. Zero eval wall-time impact (same epoch count, just different LR values).
159	2026-05-01T12:53:13Z	quant	130	157	quant	Upgrade GPTQ Hessian calibration from per-batch loss weighting (exp_130) to per-token loss weighting: each token position's activation is scaled by sqrt(loss_t/mean_loss) so H = sum_t (loss_t/mean_loss)*x_t*x_t^T, concentrating calibration on positions where quantization error most degrades BPB.	-0.0003	discard	1.075394	+0.001187	15990741	600.062000	574.400000	1513.000000	apga-quan-0151		Per-token weighting is strictly finer than per-batch (exp_130). Within a batch, easy tokens (function words, repetitive patterns) have low CE loss and get low Hessian weight; hard tokens (rare words, long-range dependencies) get up-weighted. This should reduce quantization error exactly at the positions contributing most to val_bpb. Implementation: two-pass calibration; first pass collects per-token CE loss via reduction='none', second pass scales activations by sqrt(loss_t/mean_loss) before Hessian accumulation. No change to model size, block_size=128, damp=0.01 unchanged from exp_130.
160	2026-05-01T12:59:50Z	meta	130	157	meta	Raise tied_embed_init_std 0.005→0.020: an untouched meta axis in 151 trials. Tied tok_emb doubles as output projection so init logit std = σ·√d = σ·22.6; current 0.005 → 0.113 (near-uniform softmax for hundreds of steps wasting CE-grad signal); 0.020 → 0.45 (meaningfully non-uniform softmax from step 1, well below logit_softcap=30 so no saturation), giving downstream layers informative gradients earlier in the 600s undertrained regime.	-0.0008	discard	1.075558	+0.001351	15996260	600.116000	575.700000	1516.000000	apga-meta-0152		Pure init change, zero size/time impact. σ=0.02 is the canonical Karpathy/GPT-2/nanoGPT transformer init for both input and output embeddings; current 0.005 is 4× smaller without obvious justification (likely a relic from an earlier untied-lm_head config where small input-only init made sense). With logit_softcap=30 the softcap is effectively identity at init logits ~0.45 (tanh(0.015)≈identity), so no saturation risk. Mechanism: with σ=0.005 the model spends the first ~100-300 steps doing essentially uniform-softmax forward passes that produce diffuse CE gradients before any structure emerges; σ=0.02 jumpstarts that structure, compounding through every subsequent step in our compute-limited regime. Risk axis: instability if init too large — but at 0.02 we're still 100× below FCN-style 1/sqrt(d)≈0.044 init scale and well within typical transformer practice.
161	2026-05-01T13:05:29Z	loss	130	157	loss	Token Order Prediction (TOP, arXiv 2508.19228) auxiliary pairwise hinge loss: at each position i, apply α=0.1·mean(relu(logit[t+2]−logit[t+1])) so the existing logit at position i is penalized when it ranks the 2-ahead token above the immediate next token; replaces discarded MiLe Loss with a sparse ranking constraint that uses zero new parameters and is fullgraph=True compatible.	-0.001	discard	1.076602	+0.002395	15989907	600.036000	578.300000	1528.000000	apga-loss-0155		exp_080 tried CE at offset 2 (α=0.15) → catastrophic +0.043; TOP hinge is fundamentally different: it only fires (sparse gradient) when the ordering is wrong, creating mild regularization rather than conflicting distribution targets. fullgraph=True safe: all tensor ops, no Python conditionals. TOP paper (arXiv 2508.19228) reports consistent gains over NTP at 340M–7B; this is the zero-param analogue using the tied-embedding logit with a hinge instead of CE objective.
162	2026-05-01T13:09:11Z	ttt	130	157	ttt	Double TTT chunk size 32768→65536: same total training FLOPs (halved chunk count × doubled seqs/chunk) but 2× larger effective batch per optimizer step, giving lower gradient variance and halving AllReduce overhead (~210→105 total calls).	-0.001	discard	1.075095	+0.000888	15988550	600.126000	404.800000	1309.000000	apga-ttt-0158		Doubling ttt_chunk_tokens from 32768 to 65536. Total training work per GPU unchanged: 70×3×8=1680 sequences (32K) vs 35×3×16=1680 sequences (64K). Each optimizer step now averages gradient over 128 sequences (8 GPUs × 16 each) instead of 64, reducing gradient noise by ~√2. Also halves total AllReduce calls from ~210 to ~105, freeing eval budget. The cosine LR decay over fewer chunks means the LR stays higher for longer, which may help middle/late chunks adapt more aggressively.
163	2026-05-01T13:10:07Z	curr	130	157	curr	Move batch_phase1_frac from 0.28 to 0.22: creates a 6%-window (22–28% of training) where full batch runs at peak LR before warmdown starts, separating the exploration phase (small-batch high-variance) from a consolidation phase (full-batch peak-LR) before the long decay.	-0.001	discard	1.075672	+0.001465	15987158	600.079000	510.100000	1411.000000	apga-curr-0158		The batch switch (0.28), warmdown start (0.28), and shard reshuffle (0.28) currently all coincide. Moving the batch switch earlier to 0.22 creates a 6% (~36s) window of full-batch training at peak LR. Both compiled batch-size graphs (393k, 786k) are already pre-compiled in the warmup loop — no recompile needed. Exp_134 tried extending phase1 to 0.34 (small batch INTO warmdown) and hurt; this goes the other direction (shorter small-batch, earlier consolidation).
164	2026-05-01T13:11:40Z	reg	157	157	reg	Lower embed_wd further from 0.05 to 0.0: exp_157 confirmed lower embed WD improves val_bpb; with WD=0 the embedding is governed purely by gradient signal (dominated by output projection), consistent with scalar_wd=0.0 already working fine; the output projection gradient is strong enough to self-regularize without explicit WD shrinkage.	-0.0002	discard	1.082518	+0.008311	15998553	600.028000	576.800000	1520.000000	apga-reg-0158		Following up on exp_157 (embed_wd 0.085->0.05, keep, -0.0005). The direction is clear: lower embed WD helps. Testing the extreme of WD=0. Risk: without WD, embedding magnitude is unconstrained, but logit_softcap=30 limits effective logit range and int8 quantization with clip_sigmas=20 should handle reasonable embedding growth.
165	2026-05-01T13:14:55Z	tok	130	157	tok	Add 8 learnable frequency-bin logit calibration scalars (zero-init) applied post-softcap: BPE token IDs roughly correlate with subword frequency, so per-bin biases let the model explicitly calibrate its output logit distribution by token frequency class without any new weight matrices.	-0.001	discard	1.075278	+0.001071	15983358	600.025000	521.700000	1438.000000	apga-tok-0159		vocab_bin_ids buffer maps each of 8192 token IDs to one of 8 frequency bins (bin = token_id // 1024, clamped). freq_logit_bias (8 float32, zero-init) is indexed by bin and added to logits after tanh softcap. Added to optimizer_scalar with scalar_lr=0.02. Size impact negligible: 8 floats + 8KB int32 buffer, both near-trivially compressible. Previous tok attempts all modified input embedding (exp_131 per-feature scale, exp_141 BPE position embed, exp_152 smear_alpha) — this is the first to touch the output logit calibration side.
166	2026-05-01T13:17:09Z	opt	130	157	opt	Extend EMA decay from 0.9965→0.9985 (effective window ~286→667 steps): exp_085 showed shortening the window (0.9965→0.99, ~100 steps) badly hurt (Δ=+0.003), implying the optimal window is longer than current; at 10-15 steps/sec on 8 GPUs the flat LR-floor tail spans ~430-650 steps, so the current 286-step window only covers ~50-65% of it—extending to 667 steps achieves full flat-tail averaging for more uniform weight consolidation at convergence.	-0.001	discard	1.078857	+0.004650	15983686	600.016000	519.300000	1422.000000	apga-opt-0159		EMA in the other direction from exp_085 (which went shorter and was very bad). Untried direction. Qualitative threshold: from partial to full flat-tail coverage. Size impact: zero. Single-value change.
167	2026-05-01T13:18:45Z	arch	130	157	arch	Soft sequential injection in parallel-residual layers (7-10): add per-channel learnable parameter parallel_attn_inject [dim=512] to each parallel block, additively injecting attn_out into the MLP input (mlp_in = x_in + inject * attn_out, then mlp_norm). Init=0 → step-0 numerically identical to pure parallel residual; non-zero values smoothly interpolate toward sequential pre-norm where MLP attends to attn output. 4 layers × 512 fp32 = 8 KB raw → float16 passthrough ≈ 4 KB; brotli further. Untried structural DOF — opens up inter-sublayer information flow that exp_137's blanket XSA-disable on parallel layers couldn't access.	-0.0005	discard	1.074808	+0.000601	15992837	600.031000	585.100000	1533.000000	apga-arch-0159		"The current parallel-residual block has attn and mlp both reading x_in independently — they cannot share information until they merge into the residual. Sequential pre-norm has mlp seeing attn_out via the chained residual. This edit gives parallel blocks a learnable per-channel ""soft sequential"" mode while preserving parallel additive output structure for stability. Step-0 identity means training proceeds identically to baseline until the optimizer finds non-zero injection values. Distinct from prior parallel-related arch trials: exp_106 (Peri-LN sandwich norm) and exp_137 (disable XSA on parallel) both targeted output-side modifications and failed/overran; this opens an INPUT-side DOF."
