exp_id	timestamp	specialist	parent_exp	baseline_exp	domain	hypothesis	expected_delta	status	val_bpb	delta_vs_best	artifact_bytes	train_s	eval_s	total_s	job_name	snapshot_path	notes
101	2026-05-01T09:39:51Z	ttt	092	092	ttt	Replace standard CE with focal CE (γ=2) in TTT adaptation step: down-weight tokens the model predicts confidently (focal_w=(1-p_t)^2 ≈ 0) and concentrate gradient signal on hard tokens that inflate BPB most, making each TTT step more efficient per chunk.	-0.002	discard	1.090955	+0.014558	15988759	600.046000	576.000000	1486.000000	apga-ttt-0096		Focal loss γ=2 is the standard choice from RetinaNet. In TTT context: easy tokens (p_t≈1) get near-zero gradient weight, hard tokens (p_t≈0) get full weight. This concentrates the limited per-chunk adaptation budget on the tokens the model struggles with. Score phase unchanged (still standard CE). Backward still through full model (same topology as exp_092). Only the loss weighting changes.
102	2026-05-01T09:41:24Z	tok	082	092	tok	Pre-norm bigram injection: add previous token's raw embedding (scaled by learnable scalar bigram_alpha, zero-init) to the current token embedding BEFORE RMSNorm, so the normalized direction encodes (prev, cur) bigram pair geometry — differs from exp_068's post-norm normalized-prev injection by baking the bigram signal into the normalized direction itself.	-0.001	discard	1.077486	+0.001089	15992969	600.049000	569.500000	1485.000000	apga-tok-0097		Rebase to exp_082. Added bigram_alpha (scalar, zeros init) to GPT model, applied as x = x + alpha*prev_x before F.rms_norm. prev_x = F.pad(x[:,:-1,:], (0,0,1,0)) is causally correct. bigram_alpha added to scalar_params in Optimizers so it is trained at scalar_lr=0.02 with adam_wd=0.02. This is the pre-norm variant of bigram mixing (exp_068 tried post-norm normalized-prev, was discarded). Zero parameter size overhead (1 scalar = 2 bytes float16). Zero eval time overhead.
103	2026-05-01T09:43:58Z	opt	092	092	opt	Extend warmdown_frac from 0.72→0.76: with min_lr=0.15 floor both schedules reach the floor at ~533s, but the shallower linear slope gives the EMA more time accumulating near-converged weights, better matching the hard-task WSD regime where longer decay fractions are optimal.	-0.0002	discard	1.076644	+0.000247	15994091	600.134000	569.100000	1477.000000	apga-opt-0097		warmdown_frac 0.72→0.76 shifts peak-phase from 168s to 144s (-24s), adds 24s more to the smooth linear decay. Floor is still hit at ~532s (3s earlier than current 535s), floor duration 68s vs 65s. The decay slope shallows from 0.85/432=0.00197/s to 0.85/456=0.00186/s, giving slightly lower LR throughout decay which should reduce gradient noise during EMA accumulation. Nobody in the opt lineage has explicitly touched warmdown_frac.
104	2026-05-01T09:47:19Z	loss	092	092	loss	Revert exp_094's catastrophic per_token.clamp(max=5.0) and replace with F.cross_entropy label_smoothing=0.01: at vocab=8192 the clamp silenced all gradients at init (ln(8192)≈9>>5), and ε=0.01 micro-smoothing may marginally improve post-GPTQ calibration without measurable gradient distortion.	-0.001	discard	1.082974	+0.006577	15962747	600.021000	588.200000	1491.000000	apga-loss-0098		Previous label smoothing (exp_056, regression) was at unknown larger coefficient. ε=0.01 with V=8192 shifts non-target probability by only 1.2e-6 per token, making the gradient signal nearly identical to plain CE while forcing slightly softer output distributions that may be more robust to int6 quantization noise.
105	2026-05-01T09:48:49Z	reg	092	092	reg	Split Muon WD within attention block by functional role: Q/K routing matrices get muon_wd_qk=0.075 (lower, needs more optimization freedom), V/O content matrices get muon_wd_vo=0.110 (higher, functions like MLP projection); analogous to the successful attn/MLP WD split (exp_013) but applied within attn itself.	-0.0002	discard	1.077090	+0.000693	15991416	600.111000	567.100000	1474.000000	apga-reg-0098		Q/K determine attention routing patterns (interacts with RoPE, more structured); V/O extract and project content (functionally closer to MLP). Average attn WD=(0.075+0.110)/2=0.0925≈unchanged from 0.095. 3 Muon param groups instead of 2. WD tweaks for loop-blocks (exp_047/087) failed due to positional not functional grouping; this functional split is more analogous to the working attn/MLP split.
106	2026-05-01T09:53:47Z	arch	092	092	arch	Peri-LN (ICLR 2025, arxiv 2502.02732): add a parameter-free RMSNorm to each sublayer's OUTPUT before the residual add — sandwich-style y = x + scale * RMSNorm(Module(RMSNorm(x))) — bounding per-sublayer contribution magnitude in both sequential (layers 0-6) and parallel-residual (layers 7-10) modes.	-0.0008	eval_budget_overrun	1.079394			600.034000	603.600000	1557.000000	apga-arch-0099		Targets the depth-amplification pain point: blocks 3-5 are looped (num_loops+1)=3× per forward pass, so unbounded sublayer outputs compound across loop iterations. Peri-LN caps each invocation's residual contribution. Zero params added (F.rms_norm is parameter-free); attn_scale/mlp_scale [dim] already serve as post-norm gamma. Step-0 preserved (proj zero-init → attn_out=0 → RMSNorm(0)=0). bf16 default eps (~7.8e-3) damps the small-input transition smoothly. Untried in our swarm history (no prior post-sublayer norm trial in tree.tsv). Should not trigger eval_budget_overrun like exp_097/exp_088: ~34 RMSNorm ops are negligible vs SDPA/MLP cost. Stability hedge: if attn_scale=1 init proves too aggressive given RMSNorm's RMS≈1 cap, follow-up could halve attn_scale/mlp_scale init.
107	2026-05-01T09:57:44Z	meta	092	092	meta	Raise scalar_lr 0.02→0.03 (50% bump) on the AdamW group containing the bifurcated q_gain[H,2] (exp_030's biggest +Δ), attn_scale/mlp_scale, resid_mix, and skip_gates — an entirely untouched meta knob currently identical to matrix_lr=0.022, while modern muP/normalized-transformer recipes give scalar gains materially higher LR than matrices because they are few-parameter and need fast convergence in our undertrained 600s regime.	-0.0003	discard	1.077492	+0.001095	15991124	600.032000	563.300000	1474.000000	apga-meta-0100		Untouched axis verified via tree.tsv grep across all 99 trials. Risk: AdamW 2nd-moment normalization bounds step size; adam_wd=0.02 decoupled WD scales with LR but effective WD step (~0.0009) stays in healthy regime. If +0.0003 to +0.001 we'll know scalar group needs slower (not faster) LR; either result is informative for the unexplored per-group LR axis.
108	2026-05-01T09:59:30Z	quant	092	092	quant	Split GPTQ clip sigmas: attention layers (c_q/c_k/c_v/proj) use attn_clip_sigmas=10.0 vs uniform 12.85, giving a finer int6 quantization grid for attn weights (few outliers beyond 10σ) while MLP layers keep 12.85 to preserve their wider-tail outliers.	-0.0004	size_blocked	1.075575		16353133	600.085000	571.700000	1492.000000	apga-quan-0100		Exp_096 applied this same change to exp_075 and got bpb=1.076026 (Δ≈-0.000557 vs its parent) but was size_blocked. Applied here to exp_092 whose differently-trained weights may compress differently. Code overhead is minimal (25 bytes extra after LZMA).
109	2026-05-01T10:01:03Z	curr	092	092	curr	Dynamic small→large batch schedule: use half-size batch (393k tokens) for the pre-warmdown phase (0–28% of training), then switch to full batch (786k tokens) at warmdown start; pre-compile both shapes during warmup to avoid mid-training recompile, yielding ~25% more optimizer steps early when critical batch size is small.	-0.001	keep	1.074752	-0.001645	15989904	600.071000	567.700000	1510.000000	apga-curr-0100	snapshots/109_curr	Motivated by CBS paper (arxiv 2505.23971): critical batch size starts near 0 and grows during training, so small batches are fully efficient early on. Half batch (393k) at GPU speeds would give ~2100 steps in first 168s instead of ~1333, then 2880 steps in remaining 432s at full batch (warmdown phase). Total ~5000 steps vs ~4000 baseline (+25%). Both shapes pre-compiled in warmup (free cost). batch_phase1_frac=0.28 matches warmdown start (1-0.72=0.28).
110	2026-05-01T10:14:43Z	opt	092	109	opt	Switch warmdown LR shape from linear to sqrt: replace (1-frac)/warmdown_frac with sqrt((1-frac)/warmdown_frac), keeping LR higher through most of warmdown (e.g. at 50% through: 0.707 vs 0.5) and deferring the min_lr floor hit from ~535s to ~590s, giving more training time at productive learning rates.	-0.001	discard	1.082969	+0.008217	15985257	600.133000	568.900000	1483.000000	apga-opt-0106		"sqrt((1-frac)/warmdown_frac) is the ""1-sqrt"" decay shape from WSD literature that outperforms linear in hard-task pretraining regimes (arxiv 2602.06797, 2511.18903). With warmdown_frac=0.72, min_lr=0.15: linear hits floor at 535s (leaving 65s frozen at 0.15), sqrt hits floor at 590s (only 10s frozen). More productive updates through the full budget."
111	2026-05-01T10:15:41Z	eval	092	109	eval	Halve TTT chunk size from 32K to 16K tokens: 2× more adaptation events with the same total budget, making nll_scale more responsive to FineWeb's domain-shift structure; the cosine LR schedule normalizes by num_chunks so per-token LR envelope is identical.	-0.0002	eval_budget_overrun	1.094737			600.020000	603.900000	1522.000000	apga-eval-0106		Each rank adapts on 1 seq/chunk (vs 2 with 32K), same total gradient steps. More chunk boundaries means faster nll_scale reaction to local difficulty shifts. Rebased cleanly to exp_092 (removing discarded per-layer LR multipliers from exp_100).
112	2026-05-01T10:15:51Z	tok	092	109	tok	"Add learnable logit_bias [vocab_size=8192] zero-init vector, added inside the softcap before tanh, to give the model a dedicated unigram-prior channel disentangled from the tied embedding's semantic role (per ""A Natural Bias for Language Generation Models"", ACL 2023)."	-0.001	size_blocked	1.077888		16006715	600.155000	576.800000	1487.000000	apga-tok-0106		logit_bias has numel=8192 <= 65536 so it passes through as float16 (16KB uncompressed, ~4-8KB brotli-compressed). Added to scalar_params (scalar_lr=0.02, adam_wd=0.02) so it gets full LR scheduling. Zero-init preserves step-0 identical to baseline. During TTT, it's in ttt_params (all parameters) and gets adapted per-chunk. Mechanism: tied embedding must simultaneously encode semantic similarity (for attention) and unigram frequency (for output). logit_bias separates these, letting the embedding focus on semantic content while logit_bias learns the per-token unigram prior. The ACL 2023 paper shows this improves learning efficiency and final performance by disentangling strong frequency effects.
113	2026-05-01T10:21:57Z	reg	092	109	reg	Raise V/O WD to match MLP (muon_wd_vo 0.110→0.115) and restore Q/K WD to attn baseline (muon_wd_qk 0.075→0.095): V/O matrices perform content extraction like MLP and should share MLP-level regularization, while Q/K routing matrices keep baseline WD.	-0.001	discard	1.076799	+0.002047	15988912	600.063000	578.900000	1492.000000	apga-reg-0107		4-way WD split (from exp_105 structure): Q/K=0.095 (routing, baseline attn WD), V/O=0.115 (content, matches MLP), MLP=0.115. exp_105 tried Q/K=0.075/V/O=0.110 and discarded. This variant restores Q/K to baseline (exp_105 showed lower Q/K WD hurts) and raises V/O to MLP level (clean functional partition: routing vs content matrices).
114	2026-05-01T10:23:32Z	ttt	092	109	ttt	Replace Nesterov-SGD TTT inner optimizer with Muon-style updates: NS5-orthogonalized gradient (using existing zeropower_via_newtonschulz5 in bfloat16 to reuse compiled graph) + Nesterov momentum buffer carried across chunks; LR scaled by 0.25× to match SGD update magnitude. Motivated by LaCT (arxiv 2505.23884) showing Muon consistently outperforms SGD momentum for chunk-wise TTT.	-0.001	eval_budget_overrun	1.094988			600.052000	603.600000	1516.000000	apga-ttt-0107		NS5 on GPU for 512×512 matrices takes ~0.4μs each — negligible overhead. bfloat16 input to NS5 reuses the compiled graph from Muon training path. 0.25× LR scaling chosen so Muon update magnitude ≈ SGD update magnitude (NS5 normalizes gradient to unit spectral norm, so raw effective step is ~4× larger than SGD at same lr). Momentum buffers initialized as float32 for precision; convert to bf16 just before NS5. Carries momentum across chunk boundaries (sequential learning). Skips NS5 for 1D params (norms, gates) and tiny 2D params (q_gain [8,2]) — uses L2-normalized gradient there instead.
115	2026-05-01T10:24:13Z	curr	109	109	curr	Three-phase batch schedule (quarter→half→full): add phase-0 with quarter-batch (196k tokens, 12 seqs/GPU) for the first 10% of training (0–60s), then phase-1 half-batch (28%) and full-batch (28–100%) as before; pre-compile the quarter-batch graph during warmup so no mid-training recompile overhead.	-0.0008	crash						960.000000	apga-curr-0110		CBS paper shows critical batch size starts near zero and grows rapidly early in training. Exp_109's 2-phase (half→full at 28%) yielded +0.0016 by concentrating more optimizer steps in the first 28% of training. Adding a quarter-batch phase-0 (0–10%) gives ~4x more optimizer steps vs full batch in the very first 60s when CBS is smallest. The additional warmup compilation pass is free from the 600s training budget since t0 starts after warmup. batch_phase0_tokens=196608=786432/4, batch_phase0_frac=0.10. | torch.distributed.elastic.multiprocessing.errors.ChildFailedError: ============================================================ (train_gpt.py:1170 in eval_val)
116	2026-05-01T10:26:58Z	meta	092	109	meta	Lower embed_wd 0.085→0.05 on current best 092: exp_083 showed -0.000150 improvement over its parent (064) with this exact change but lost a sibling race to 082 by +0.000009 (pure noise); current best 092 inherits 082's embed_wd=0.085, so combining is genuinely untested. Mechanism (per arxiv 2603.26663) — tied tok_emb/lm_head behaves as output projection because output gradients dominate early; in our 600s undertrained regime WD=0.085 over-regularizes a still-converging output map. Independent of 082/092's TTT-side improvements.	-0.00015	discard	1.076336	+0.001584	15995726	600.126000	569.400000	1483.000000	apga-meta-0110		Untouched on current best lineage. exp_083 (parent=064) val_bpb=1.076547 vs 064's 1.076697 → consistent direction. Power Lines (2505.13738) + Weight Tying Biases (2603.26663) both predict lower WD optimum for tied embed in undertrained regime.
117	2026-05-01T10:27:22Z	arch	092	109	arch	Depth-recurrence-aware q_gain: promote per-head bifurcated q_gain from [H,2] to [num_iters,H,2] so each of the 3 calls per loop layer (3,4,5) gets its own RoPE/NoPE channel scale, threaded as a Python int kwarg through forward (zero compute, ~352 fp32 params, step-0 numerically identical to current).	-0.0003	eval_budget_overrun	1.079552			600.031000	603.500000	1559.000000	apga-arch-0109		Extends exp_030's bifurcation win (Δ=-0.000736) along the depth-recurrence axis. Loop layers 3-5 currently share one q_gain across iterations; this lets iter 0/1/2 differentiate (early=mixing, late=refinement). Uniform shape across all blocks for state-dict simplicity; non-loop blocks always use slot 0. iter_idx is Python int → torch.compile inlines as constant per call site (forward_logits for-loop is statically unrolled). q_gain matched by CONTROL_TENSOR_NAME_PATTERNS so fp32-restore still routes correctly with new ndim=3 shape; never quantized (not CastedLinear). Risk: extra slot-1/slot-2 only see gradient when looping_active=True (post enable_looping_at fraction); too few steps may leave them near init.
118	2026-05-01T10:27:32Z	loss	092	109	loss	Reverse-position gentle CE weighting (1.1→0.9 linspace, mean=1.0): early sequence positions get 10% more gradient weight and late positions 10% less — the opposite direction from exp_057 (which tried 0.75→1.25) — to emphasise context-independent document-structure signal at sequence starts.	-0.0005	discard	1.077888	+0.003136	15989734	600.077000	581.000000	1498.000000	apga-loss-0110		Exp_057 tried up-weighting late positions (0.75→1.25) and hurt by +0.0015. The opposite direction (1.1→0.9, gentler at ±10%) has not been tried. Rationale: early-position predictions are harder (less context) but encode fundamental document-level statistics; giving them slightly more gradient may improve generalisation across all positions. All other loss modifications have failed; this is the one structural direction that remains unexplored.
119	2026-05-01T10:29:21Z	quant	092	109	quant	Post-GPTQ Hessian-weighted optimal scale refinement: after SDClip GPTQ returns (Q, s_heuristic), recompute per-row scale as s_opt[r] = sum_j(H_jj * Q[r,j] * W[r,j]) / sum_j(H_jj * Q[r,j]^2), minimizing the Hessian-weighted reconstruction error for the given Q values. Zero artifact size impact since Q shape and s dtype/shape are unchanged.	-0.0002	discard	1.078361	+0.003609	15987887	600.058000	569.700000	1486.000000	apga-quan-0110		The GPTQ heuristic scale (clip_sigmas * row_std / clip_range) is set before error propagation and doesn't adapt to the final quantized Q values. The closed-form H-weighted optimal scale minimizes the actual reconstruction error for each row given the final Q. H is cloned inside gptq_quantize_weight so hessians[name] is intact for refinement. No size impact - same Q int8 tensor, same s float16 tensor shape.
120	2026-05-01T10:41:18Z	curr	109	109	curr	Three-phase batch schedule (quarter→half→full) v2: phase-0 quarter-batch (196k tokens) for first 10% of training, phase-1 half-batch (393k) for 10–28%, phase-2 full-batch (786k) from 28%; quarter-batch graph compiles naturally at step 0 (all 8 GPUs simultaneously, no NCCL risk) removing the 4th warmup pass that caused v1 crash.	-0.0007	crash						643.000000	apga-curr-0120		v1 (exp_115) crashed at eval_val line 1170 with total_s=960s, indicating the extra warmup compilation pass (~60s overhead) was destabilizing eval. Fix: remove phase0 warmup pass entirely; instead the quarter-batch shape compiles at training step 0 when all 8 DDP ranks arrive simultaneously (safe). Half-batch and full-batch shapes are still pre-compiled in warmup as before. | torch.distributed.elastic.multiprocessing.errors.ChildFailedError: ============================================================ (train_gpt.py:1170 in eval_val)
121	2026-05-01T10:47:36Z	tok	092	109	tok	Learnable logit_bias with 512 frequency buckets (vocab_size//16, zero-init), expanded via repeat_interleave(16) and added inside the softcap — gives a coarse unigram-prior channel disentangled from the tied embedding, while fitting within the artifact budget (~875 compressed bytes vs 14KB for the full-vocab version).	-0.0005	discard	1.077580	+0.002828	15992066	600.404000	580.100000	1508.000000	apga-tok-0113		exp_112 (same idea, full vocab_size=8192) was size_blocked by 6,715 bytes — the 16KB float16 passthrough compressed to ~14KB. Reducing to 512 buckets (16 tokens/bucket, consecutive token IDs) shrinks the float16 passthrough to 1024 bytes (~875 bytes compressed), saving ~13KB and leaving ~6KB headroom. Bucket resolution is coarse but consecutive BPE token IDs have rough frequency correlation (lower IDs tend to be more common). The 512-level frequency prior still disentangles high-frequency from low-frequency token groups, allowing the tied embedding to focus on semantic similarity.
122	2026-05-01T10:49:50Z	opt	109	109	opt	Raise AdamW β₂ from 0.95→0.99 at warmdown start for tok_emb and scalar optimizer groups: stable second-moment estimates let the LR schedule—not gradient magnitude fluctuations—control step size during warmdown (arxiv 2508.01483: consistent improvements with higher β₂ during WSD cooldown).	-0.001	discard	1.074945	+0.000193	15989124	600.148000	576.400000	1519.000000	apga-opt-0115		Abrupt switch: when elapsed_frac >= 1-warmdown_frac (i.e. t>=168s), set beta2=0.99 for optimizer_tok and optimizer_scalar. Muon unchanged (first-moment-only, no beta2). Only activates once per training run via the _g['betas'][1] != h.beta2_warmdown guard. beta2_warmdown=0.99 vs base beta2=0.95.
123	2026-05-01T10:51:53Z	ttt	092	109	ttt	Fix eval_budget_overrun from exp_114 by replacing compiled zeropower_via_newtonschulz5 with non-compiled inline _ttt_ns5 (3 steps, eager) in the TTT Muon update, eliminating torch.compile recompilation overhead (~8-10s) that caused the 3.6s budget overrun.	-0.001	eval_budget_overrun	1.095095			600.028000	603.000000	1514.000000	apga-ttt-0116		exp_114 eval_budget_overrun at 603.6s (only 3.6s over). Root cause: @torch.compile on zeropower_via_newtonschulz5 triggered recompilation when called from TTT path (different call site from training Muon). Raw NS5 computation for all matrices across all TTT steps is ~2-4s total (negligible on GPU). Non-compiled eager version avoids all recompilation overhead; 3 steps instead of 5 is a further safety margin. Core hypothesis unchanged: Muon-style orthogonalized gradient updates (per LaCT arxiv 2505.23884) should outperform Nesterov SGD for chunk-wise TTT.
124	2026-05-01T10:56:06Z	reg	109	109	reg	Give skip_weights and skip_gates their own AdamW param group with weight_decay=0.0 (freed from adam_wd=0.02): WD was decaying these critical skip-connection parameters by ~80% over training (scalar_lr×adam_wd per step over ~4000 steps ≈ e^-1.6 factor), forcing the optimizer to constantly fight WD just to maintain useful skip magnitudes.	-0.001	discard	1.077178	+0.002426	15992913	600.033000	567.500000	1481.000000	apga-reg-0120		exp_067 appeared to try WD=0 for skip params but actually kept skip_weight in the adam_wd=0.02 group (the WD=0 group was for 'pure norm/bias params' which don't exist in this model - RMSNorm has no learnable params). This is genuinely the first experiment giving skip_weights/skip_gates WD=0. skip_weights initialized at ones(num_skip_weights, dim), WD=0.02 was pulling them toward zero, gradient had to compensate. Without WD tension the skip connections should converge faster to their optimal magnitudes.
