exp_id	timestamp	specialist	parent_exp	baseline_exp	domain	hypothesis	expected_delta	status	val_bpb	delta_vs_best	artifact_bytes	train_s	eval_s	total_s	job_name	snapshot_path	notes
125	2026-05-01T10:57:44Z	meta	109	109	meta	Lower muon_momentum_warmup_start 0.92 to 0.85 (canonical Modded-NanoGPT value): untouched in 116 trials despite peak and fraction being tuned; lower start means first ~10% of training has Muon updates 50% closer to on-policy gradient (1-0.85=0.15 vs 1-0.92=0.08), giving better basin selection in the highly-plastic 600s undertrained regime, then ramps to preserved peak 0.99 over the same 0.33 fraction.	-0.0005	discard	1.078438	+0.003686	15995455	600.130000	573.800000	1482.000000	apga-meta-0120		Untouched axis verified via tree.tsv grep across 116 trials. Peak (muon_momentum=0.99) tested via exp_044 lowering=discard, so peak stays. Ramp fraction tested via exp_064 keep (0.45) but reverted at exp_082; exp_093 retried=discard, so fraction stays at 0.33. Start value is the only un-swept knob. Modded-NanoGPT canonical (Keller Jordan, Muon-LLM arxiv 2502.16982) uses start=0.85 with peak=0.95; we keep our high peak but adopt canonical start. Mechanism: momentum=0.85 gives ~6.7-step effective averaging at start vs ~12.5 at 0.92, closer to single-step on-policy gradient when loss landscape is most plastic. Single-line change.
126	2026-05-01T10:58:02Z	curr	109	109	curr	Extend half-batch phase from 28% to 38% of training: keep 2-phase schedule (half→full) but with transition at 38% instead of 28%, giving 10% more of training (60s) with more optimizer steps while LR is still at 88% of peak.	-0.0004	crash						574.000000	apga-curr-0121		CBS theory (arxiv 2505.23971) and Fast Catch-Up Late Switching (2602.14208) suggest optimal batch size grows monotonically through training. Exp_109 switches at frac=0.28 (warmdown start). At frac=0.38, LR is still 88% of peak, so half-batch (more optimizer steps at near-peak LR) is still beneficial. Removed quarter-batch phase (batch_phase0_frac=0.0) to avoid 3-shape compiled graph issues that caused crashes in exp_115/120. Phase-0 logic is present but dormant. | torch.distributed.elastic.multiprocessing.errors.ChildFailedError: ============================================================ (train_gpt.py:1170 in eval_val)
127	2026-05-01T10:58:03Z	loss	109	109	loss	Add PaLM-style z-loss (1e-4 * mean(logsumexp(logits)^2)) to the CE loss: penalizes the log-partition function magnitude, keeping logit scale well-conditioned and reducing the effective weight singular-value range needed — improving GPTQ int6 quantization fidelity.	-0.002	discard	1.077136	+0.002384	15980802	600.104000	571.600000	1524.000000	apga-loss-0120		z-loss from PaLM (Chowdhery et al. 2022). With logit_softcap=30, logsumexp is bounded ~[0,39]; z_loss adds at most ~0.15 nats early in training, settling to ~0.01 nats in steady state. The gradient pushes weight matrices toward lower spectral norm, which is exactly what GPTQ benefits from (less quantization error when weights don't need large singular values to produce confident logits). Rebased from exp_109; no position weighting residue.
128	2026-05-01T11:01:37Z	arch	109	109	arch	Switch MLP activation from LeakyReLU(slope=0.5).square() to ReLU.square() (PrimerEZ / Haziza 2025 srelu): zero the negative tail entirely instead of leaking 0.25·z², inducing activation sparsity that may regularize the undertrained MLP. One-character edit (negative_slope 0.5→0.0 equivalent); identical shapes / dtypes / compile-graph topology / param count, so eval budget is unaffected.	-0.001	eval_budget_overrun	1.081711			600.119000	603.200000	1554.000000	apga-arch-0120		Genuinely untried in our tree — no arch trial has touched the activation. Loss case (Δ ≥ 0) is informative because it confirms the LeakyReLU(0.5) slope was deliberately tuned for grad-flow in our undertrained regime; win case validates that PrimerEZ's sparsity claim transfers to small-LM scale. Lowest-risk arch edit available given saturation + recent eval_budget_overrun pattern from any param/graph change (exp_106 Peri-LN, exp_117 q_gain[num_iters,H,2], exp_088 SWA all overran from compile-side cost). Sources: arxiv 2109.08668 (Primer), Haziza/FAIR 2025 srelu sparsity post.
129	2026-05-01T11:05:24Z	eval	109	109	eval	Tighten TTT gradient clip from 1.0 to 0.5: motivated by the LaCT paper (arXiv:2505.23884) finding that sequential gradient accumulation in TTT causes magnitude explosion; halving the clip norm reduces per-step parameter drift, preventing overfitting to each chunk while matching the tighter 0.3 clip used during training.	-0.0002	eval_budget_overrun	1.094911			600.115000	603.400000	1517.000000	apga-eval-0120		Training clip is 0.3, TTT was 1.0 (3.3x looser). Nesterov momentum=0.9 carries velocity across 500+ chunks. Tighter clip reduces accumulation. Novel to tree (no prior TTT grad clip experiment). LaCT paper 2025 specifically identifies gradient explosion as the core TTT stability problem.
130	2026-05-01T11:06:15Z	quant	109	109	quant	Loss-weighted GPTQ Hessian calibration: two-pass approach computes per-batch CE loss then re-accumulates Hessian with each batch weighted by its normalized loss, biasing GPTQ error compensation toward sequences where the model is most uncertain (highest BPB contribution).	-0.001	keep	1.074702	-0.000050	15990545	600.015000	509.900000	1407.000000	apga-quan-0121	snapshots/130_quant	Two-pass: pass-1 runs n_calibration_batches forward passes to get per-batch CE loss (no hooks), pass-2 re-forwards stored batches with Hessian accumulation multiplied by alpha=norm_loss_weight (hooks use addmm_ with alpha=batch_weight[0] mutable container). Weights normalized to sum to n_calibration_batches so the final /n_calibration_batches normalization stays compatible. Zero model size impact. ~2x forward-pass cost for Hessian collection (additional ~5-10s, within eval budget).
131	2026-05-01T11:18:35Z	tok	109	130	tok	Add learnable per-feature input embedding scale [model_dim=512], ones-init, applied after functional RMSNorm on token embeddings; decouples per-dimension input sensitivity from the tied output projection and lets the model emphasize useful embedding directions without adding vocab-sized params.	-0.0005	discard	1.075106	+0.000404	15990196	600.077000	567.600000	1511.000000	apga-tok-0124		Current functional F.rms_norm(x,(x.size(-1),)) has no learnable weights. Adding embed_scale=[512] initialized to ones gives the model per-feature amplification/suppression at the input stage. With tied embeddings (same matrix for input+output), input and output use the embedding vectors in different roles; a scale separates these. embed_scale is added to scalar_params group (AdamW scalar_lr=0.02, adam_wd=0.02). Cost: ~2KB float32, compresses to ~100 bytes (all-ones). Previous tok experiments: bigram injection (exp_102, discard) and logit_bias/buckets (exp_112/121, discard/size_blocked). This is a different structural change targeting input normalization.
132	2026-05-01T11:20:35Z	opt	109	130	opt	Delay LR warmdown start from 28% to 35% (warmdown_frac 0.72→0.65): with exp_109's batch curriculum, batch switches from half→full at exactly t=28%=warmdown start, so the model never sees full-batch training at peak LR; separating the transitions by 7% (~42s) lets the optimizer exploit stable full-batch gradients before entering convergence mode.	-0.002	discard	1.075453	+0.000751	15982969	600.042000	576.800000	1519.000000	apga-opt-0124		warmdown_frac 0.72→0.65. Area-under-LR-curve increases from 0.648 to 0.682 (+5%). The batch switch (batch_phase1_frac=0.28) and warmdown start (1-warmdown_frac) currently coincide at t=28%; the fast-catch-up effect (arxiv 2602.14208) suggests the model needs peak-LR time with the larger batch to adapt before LR decay begins. min_lr floor phase length stays nearly the same (~9.75% vs 10.8%).
133	2026-05-01T11:22:41Z	ttt	109	130	ttt	Restore exp_092's validated TTT improvements onto exp_109: add nesterov=True to TTT SGD and recurrence-block gradient equalization (rescale blocks 3-5 grad by 1/(num_loops+1)=1/3 after backward), which were lost when the curr specialist built exp_109 from exp_092's snapshot without carrying forward these TTT gains.	-0.00014	discard	1.075218	+0.000516	15989164	600.019000	574.000000	1520.000000	apga-ttt-0125		exp_082→exp_092 (on similar baseline without batch scheduling) gained Δ=-0.000141 from exactly these two changes. exp_109 uses plain SGD(momentum=0.9) with no gradient equalization. Adding nesterov=True corrects the lookahead step; equalization fixes the 3× gradient accumulation bias in loop blocks 3-5 (num_loops=2 → scale=1/3). No change to model arch or size — pure TTT improvement. These are the same code patterns from the ttt workdir's exp_092 keepfile.
134	2026-05-01T11:25:44Z	curr	109	130	curr	Extend half-batch phase from 28% to 34% of training: transition stays below enable_looping_at=0.35 so looping always activates with the pre-compiled full-batch shape, avoiding the uncompiled [half-batch+looping] shape that caused exp_126's crash.	-0.0003	discard	1.074871	+0.000169	15986432	600.121000	566.700000	1507.000000	apga-curr-0128		Root bug in exp_115/120/126: batch_phase1_frac > enable_looping_at (0.35) caused half-batch+looping to be used at frac=0.35 — an uncompiled shape not pre-warmed in warmup. Fix: batch_phase1_frac=0.34 < 0.35, so looping activates only after full-batch is active (pre-compiled). Extends the half-batch optimizer-step advantage by 6% of training (~36 more seconds of 2x update density). LR at frac=0.34 is still 91% of peak.
135	2026-05-01T11:28:29Z	meta	109	130	meta	Lower adam_eps 1e-8→1e-10: untouched in 127 trials. With tied tok_emb (vocab=8192), per-row gradients for moderately-rare tokens are ~1e-5 to 1e-4, so v~1e-10 to 1e-8 is comparable to eps=1e-8 — the eps floor suppresses Adam's adaptive normalization on long-tail vocab rows. Lowering to 1e-10 lets sqrt(v) dominate even for rows with grad above ~1e-6, restoring per-row effective LR for the rare-token rows that disproportionately impact BPB.	-0.0005	discard	1.078411	+0.003709	15991669	600.023000	593.500000	1505.000000	apga-meta-0129		"Per Zack Nado's ""ε, A Nuisance No More"": smaller eps preserves useful low-curvature directions; ""exponential decay schedule from initial values to near-zero is recommended"". Affects both AdamW groups (optimizer_tok and optimizer_scalar share h.adam_eps). Scalar group impact is minimal (grads O(1), v dominates eps already). The mechanism is concentrated on tok_emb rare-token rows. Conservative magnitude (4 orders down from 1e-8 to 1e-10, not 1e-15) to avoid numerical instability while clearing the eps-bottleneck regime for moderately rare tokens."
136	2026-05-01T11:34:28Z	reg	109	130	reg	Token-level data augmentation: randomly replace 1% of input tokens with uniform-random vocab tokens during training, forcing the model to use broader context rather than relying on immediate-predecessor copying, potentially improving robustness to small perturbations analogous to GPTQ quantization noise.	-0.001	discard	1.080165	+0.005463	15999193	600.151000	569.400000	1483.000000	apga-reg-0131		Novel in this run: stochastic depth (exp_036, +0.009), MLP dropout (exp_095, +0.005), label smoothing (exp_056, +0.045) all hurt. WD tweaks exhausted. Token masking is applied only to x (input), not y (target), so the supervision signal is unaffected. Disabled at eval/TTT/quantization (those code paths don't go through step_fn). Rate=0.01 means ~20 tokens corrupted per 2048-token sequence.
137	2026-05-01T11:35:24Z	arch	109	130	arch	Disable XSA on parallel-residual decoder layers (7-10): XSA's self-V-projection subtraction is an inductive bias against degenerate attention-output redundancy in the *sequential* pre-norm residual stream; in the GPT-J-style parallel-residual topology (layers 7-10) attn and MLP both write into x_in independently rather than chained, so XSA's residual-stream rationale is absent. Compute-negative (saves 4 normalize+reduction passes/forward → buys eval-budget headroom against the 600s cap that the prior 5 arch trials kept overrunning); step-0 bit-identical because proj._zero_init=True forces attn_out=0.	-0.0010	discard	1.075722	+0.001020	15986100	600.060000	553.400000	1493.000000	apga-arch-0131		Single-loop-bound edit in GPT.__init__ XSA enablement: range cap from h.num_layers to h.parallel_residual_start (=7). Pure config change; no graph-topology mutation, no new params, no kernel swap. compute-NEGATIVE (4 fewer XSA calls per fwd). Specifically targets the eval_budget_overrun pattern (exp_106/097/088/117/128 all overran). XSA stays on layers 0..6 (encoder + 3-layer recurrence), where the looped traversal (3× per forward of layers 3-5) is exactly where the XSA self-subtraction inductive bias is most useful (prevents redundant self-correction across loop iterations). Layers 7-10 (parallel-residual) free to use full self-attention.
138	2026-05-01T11:39:06Z	eval	109	130	eval	Reset SGD momentum buffer between TTT chunks: FineWeb validation spans diverse topics across consecutive 32K-token chunks, so stale inter-chunk velocity from chunk k misguides the first few gradient steps of chunk k+1; zeroing the buffer before each chunk preserves within-chunk momentum accumulation while eliminating cross-chunk contamination.	-0.001	discard	1.075567	+0.000865	15986754	600.010000	575.800000	1525.000000	apga-eval-0131		Zero-cost change (just zeros momentum_buffer tensors). The SGD optimizer is constructed once and Nesterov momentum accumulates across all ~500 chunks; with ttt_epochs=2 and ~4 sequences/rank, each chunk runs ~8 gradient steps, so at the end of a chunk the velocity magnitude ≈ 1/(1-0.9)=10 steps of accumulated gradient. This stale velocity from potentially unrelated content bleeds into chunk k+1 early steps. Resetting removes inter-chunk interference without affecting eval wall time.
139	2026-05-01T11:41:21Z	loss	109	130	loss	BPE-rank frequency-stratified loss weighting: up-weight rare tokens (higher vocab IDs) by up to 15% using normalized BPE rank as a frequency proxy (weight = 1 + 0.15 * rank, mean=1), compensating for their systematic underrepresentation in training batches vs their equal per-occurrence contribution to BPB.	-0.001	discard	1.075567	+0.000865	15988512	600.038000	598.200000	1552.000000	apga-loss-0131		BPE vocab sorts tokens by merge frequency: low IDs = common, high IDs = rare. Rare tokens appear less per batch but contribute equally to BPB. Gentle up-weighting (α=0.15, max ratio 1.15) keeps the modification mild enough to not hurt common-token learning while giving rare tokens slightly more gradient signal. Contrast with exp_040 (byte-weighted TTT, discard) which was eval-only; this is a training-time modification using token-ID rank rather than actual byte counts.
140	2026-05-01T11:42:02Z	quant	130	130	quant	Combined frequency+loss Hessian weighting: extend exp_130's loss-weighted calibration by also scaling activations for the top-100 most-frequent tokens by sqrt(2), so the Hessian simultaneously emphasizes high-uncertainty batches (loss weight) and frequent tokens (freq weight), two complementary orthogonal signals for GPTQ error compensation.	-0.001	discard	1.074992	+0.000290	15989204	600.056000	571.900000	1516.000000	apga-quan-0131		Exp_002 showed freq-only weighting gave -1.8 mBPB on baseline but +0.54 mBPB regression on later lineage (exp_081). Exp_130 showed loss-only weighting gave -0.05 mBPB. The combination applies batch-level loss weight AND token-level freq^2 weight in H=sum(w_batch * (x*fw)^T(x*fw)). The top-100 frequent token activations get 2x Hessian contribution (sqrt(2)^2). This is novel — neither tried on current best lineage. Size risk is low since it only changes calibration weighting, not scale distributions.
141	2026-05-01T11:54:47Z	tok	130	130	tok	Add within-word BPE position embeddings: zero-init nn.Embedding(8, 512) injected after input RMSNorm using a causal cummax scan over SP8192 word-start flags (persistent=False LUT, not in artifact), giving the model explicit intra-word token position without future leakage.	-0.001	discard	1.076029	+0.001327	15997275	600.140000	546.900000	1458.000000	apga-tok-0136		The SP8192 tokenizer splits words into BPE subwords; position-within-word (0=first subword, 1=second, ...) is causal information the model must currently re-learn from attention patterns. The cummax trick over word-start flags (tokens with leading '▁') computes within-word position in O(T) with no loops. LUT is persistent=False so only 8x512=4096 float16 params (~4KB brotli-compressed) go into the artifact. word_pos_emb.weight trained with tied_embed_lr=0.03 via AdamW alongside tok_emb.
142	2026-05-01T11:58:10Z	meta	130	130	meta	Raise tied_embed_lr 0.03→0.04 (an axis untouched in 135 trials): with tied embeddings the tok_emb param receives output-projection (softmax-side) gradients which dominate the input-embedding gradients — currently the tied_embed_lr/matrix_lr ratio of 1.36 is closer to μP-style than to the √d≈22.6 ratio recommended by arxiv 2506.15025 for large-vocab models, so a +33% bump samples the theoretically-favored direction while staying small-radius (still 15× below the untied default of 0.6).	-0.0005	discard	1.078510	+0.003808	15995463	600.113000	577.600000	1490.000000	apga-meta-0136		"Untouched axis. exp_122 (opt) showed tok_emb group is sensitive to β2 raises (variance-smoothing change, lost), but a peak-LR change is mechanistically different. With min_lr=0.15 floor and 72% warmdown, late-training updates remain substantial, so peak embed LR has real leverage. If win, follow up with 0.045/0.05; if loss, direction is ""lower"" (try 0.025/0.02)."
143	2026-05-01T12:00:01Z	opt	130	130	opt	Implement Muon-VS (Variance-Adaptive Muon, arxiv 2601.14603): add per-element variance scaling of the Nesterov momentum before Newton-Schulz orthogonalization using the existing muon_beta2=0.95 EMA buffer, dampening high-variance gradient directions and amplifying low-variance ones for more efficient orthogonal updates.	-0.001	size_blocked	1.075118		16002535	600.080000	577.100000	1523.000000	apga-opt-0136		Muon-VS from arxiv 2601.14603 (Jan 2026) shows 1.36x speedup on LLaMA-1.2B for same compute. Mechanism: before orthogonalization, element-wise scale gradient by 1/sqrt(running_var) — equivalent to Adam's adaptive step in the Muon direction space. Uses existing unused muon_beta2=0.95 hyperparameter. Applied after Nesterov momentum, before row_normalize and Newton-Schulz. var_buf stored in float32 for precision. Changes: (1) Muon.__init__ accepts muon_beta2, (2) Muon.step() maintains var_buf + vs_step per parameter and applies variance scaling, (3) Optimizers passes h.muon_beta2.
144	2026-05-01T12:05:32Z	curr	130	130	curr	Hard-token loss weighting: replace uniform CE mean with per-token loss-proportional weights (w = per_tok / mean_per_tok, detached), computing mean(per_tok²)/mean(per_tok) — upweights hard tokens ~proportionally to their difficulty, concentrating gradient on positions where the model errs most.	-0.001	discard	1.136397	+0.061695	15989600	600.012000	574.100000	1523.000000	apga-curr-0139		α=2 focal-style weighting without extra hyperparameter. For median loss ≈3 nats, easy tokens (loss=0.5) get weight 0.17x, hard tokens (loss=4.0) get 1.33x — ~8x differential. Fully fullgraph-compatible (all fixed-shape ops, detach stops gradient through weights). Only changes the training forward path; eval/TTT code uses its own cross_entropy calls unchanged.
145	2026-05-01T12:08:07Z	ttt	130	130	ttt	Fuse per-parameter TTT gradient AllReduce (150+ individual NCCL calls) into a single float32 flat-buffer AllReduce per step to eliminate kernel-launch overhead (~15ms/step → ~14s saved), then use the freed eval budget to add a 4th TTT epoch (ttt_epochs 3→4, +33% adaptation per chunk at ~1ms cost).	-0.0003	eval_budget_overrun	1.093126			600.035000	603.500000	1549.000000	apga-ttt-0139		Two compound changes: (1) Replace the per-parameter `for p in ttt_params: dist.all_reduce(p.grad)` loop with a pre-allocated float32 flat buffer + single dist.all_reduce, reducing NCCL launch overhead from ~150 launches/step to 1 launch/step. On 8 GPUs NVLink, each NCCL launch has ~50-100us overhead; 150 launches x 3 steps x 305 chunks = ~14-28s saved. (2) Use that freed budget to run 4 TTT epochs instead of 3; the extra epoch gives the Nesterov SGD another pass over each chunk's 4 sequences per rank. These synergize: fused allreduce makes each training step cheaper, allowing the extra epoch without overrun risk.
