exp_id	timestamp	specialist	parent_exp	baseline_exp	domain	hypothesis	expected_delta	status	val_bpb	delta_vs_best	artifact_bytes	train_s	eval_s	total_s	job_name	snapshot_path	notes
079	2026-05-01T08:22:21Z	tok	064	075	tok	Add a learnable [model_dim=512] word-start structural embedding (zero-init) that is added to the post-RMSNorm input representation for all word-initial tokens (those whose SP piece starts with ▁), encoding the linguistic word-boundary prior explicitly so the transformer can focus embedding capacity on token-specific content rather than re-learning the shared word-start bias from co-occurrence patterns.	-0.001	discard	1.078843	+0.002260	15993820	600.010000	595.200000	1509.000000	apga-tok-0071		Word-initial tokens (▁word) have a systematic structural role distinct from word-continuation tokens (##ing). Currently the 512-dim embedding table has separate rows for each token, requiring gradient descent to learn the shared word-start signal implicitly. A single zero-init [512] vector added only for is_word_start tokens makes this explicit and parameter-efficient (512×2=1024 bytes float16, ~800 bytes brotli). The has_leading_space_lut is a persistent=False buffer rebuilt from SP at init, so it adds 0 bytes to the artifact. The word_start_emb is added to scalar_params (AdamW, lr=scalar_lr=0.02).
080	2026-05-01T08:29:24Z	loss	064	075	loss	2-step-ahead auxiliary CE loss (α=0.15): at position t, co-train the same tied-embedding projection to predict x_{t+2} in addition to x_{t+1}, adding a richer look-ahead gradient signal with zero extra artifact parameters.	-0.001	discard	1.120168	+0.043585	15990972	600.031000	593.000000	1521.000000	apga-loss-0077		Zero extra params — reuses tied embedding. Logits[:, :-1] vs target_ids[:, 1:] gives the 2-step target. Combined gradient at each position is ~93% next-token + ~7% next-next-token, equivalent to principled label smoothing toward the actual upcoming content. Differs from MiLe/focal/z-loss (which reweight existing CE) — this adds a new target. Concern: MTP literature shows small-model benefit is weak; but our shared-head formulation differs from the independent-head MTP studied there. Alpha=0.15 keeps the auxiliary signal subordinate to the main objective.
081	2026-05-01T08:29:38Z	quant	064	075	quant	Frequency-weighted GPTQ Hessian calibration: pre-collect all calibration batches, count token frequencies, boost top-100 most-frequent tokens by sqrt(2) in H=X^TX, biasing GPTQ to minimize quantization error on common tokens. This technique improved bpb by -0.001812 on the old baseline (exp_002) but was never merged into the main lineage.	-0.001	discard	1.077124	+0.000541	15990584	600.083000	586.900000	1499.000000	apga-quan-0077		Port of exp_002 technique onto exp_064. exp_002 was a direct child of baseline (exp_000) and got val_bpb=1.079188 vs baseline 1.081000 = -0.001812. The main lineage (exp_014→030→045→054→064) never incorporated this Hessian improvement. Rebased cleanly from exp_064 so damping stays at 0.01 (not the 0.005 from discarded exp_072).
082	2026-05-01T08:30:10Z	eval	064	075	eval	Per-chunk NLL-adaptive TTT learning rate: after score-first evaluation of each chunk, scale the cosine-scheduled adaptation LR by clip(chunk_nll/running_mean_nll, 0.5, 2.0), reallocating adaptation budget toward chunks where the model is struggling most.	-0.001	keep	1.076538	-0.000045	15991188	600.024000	566.700000	1475.000000	apga-eval-0077	snapshots/082_eval	Mechanism: compute per-chunk average NLL during the existing score-first pass (free, already in no_grad). All-reduce across GPUs. Update running mean. Scale cos_lr by nll_scale = chunk_nll/mean, clamped [0.5,2.0]. Rationale: chunks with high NLL are novel/hard content where TTT adaptation yields most gain; chunks with low NLL are already well-predicted and need less aggressive LR. The cosine schedule provides the base decay envelope. Overhead: 2 extra all_reduce per chunk ~50ms total. No change to scoring phase or training data used.
083	2026-05-01T08:30:32Z	meta	064	082	meta	Lower embed_wd from 0.085 to 0.05 on tied tok_emb/lm_head: a previously untouched meta knob; the Power Lines paper (arxiv 2505.13738) shows optimal WD scales inversely with model size at fixed tokens-per-parameter, and our 600s budget is heavily undertrained, so the embedding (which doubles as output projection due to tying) is being over-regularized at 0.085.	-0.0005	discard	1.076547	+0.000009	15995760	600.099000	591.300000	1501.000000	apga-meta-0077		Rebased to exp_064 first (workdir was at 0.55 momentum-warmup-fraction from the discarded exp_074). Single-line edit: line 165 default 0.085→0.05. Affects only tok_emb.weight via optimizer_tok AdamW (line 842). embed_wd has never been moved from its multi_596-seed value in any meta/opt/reg trial — genuinely uncrowded axis. 0.05 chosen as a moderate decrease (41%) comparable in radius to the 0.10→0.15 min_lr keep that compounded; sits between adam_wd=0.02 and muon_wd=0.095. Embeddings are the bottleneck for rare-token BPB (every position routes through them); less WD pressure preserves more learned magnitude in the undertrained regime.
084	2026-05-01T08:32:06Z	ttt	075	082	ttt	Replace SGD with AdamW (betas=(0.9,0.95), wd=0) in TTT inner loop: AdamW's second-moment normalization automatically equalizes per-parameter step sizes across heterogeneous gradient scales (embedding vs deep MLP), generalizing the manual recurrence-block gradient scaling from exp_075 to all layer types.	-0.002	discard	1.478615	+0.402077	15987740	600.085000	539.100000	1415.000000	apga-ttt-0078		Optimizer step cost is negligible vs forward/backward cost in TTT (2 epochs × ~2 seqs/GPU × 22 chunks = 88 steps total), so AdamW overhead is <1% of eval time. Second moment persists across chunks, building an increasingly accurate per-parameter variance estimate. ttt_lr=0.005 kept; AdamW step ≈ ±lr in first iteration (sign-SGD-like), which should help parameters with varying gradient magnitudes adapt more uniformly.
085	2026-05-01T08:36:01Z	opt	064	082	opt	Lower ema_decay from 0.9965 to 0.99 (EMA window ~100 steps ≈ 2.5% of ~4000-step run), focusing weight averaging on the LR-floor convergence phase; LAWA paper (arxiv 2306.03241) shows ~1% window is optimal. Also restores linear warmdown (reverting exp_073 cosine).	-0.001	discard	1.079758	+0.003220	15988691	600.041000	544.200000	1428.000000	apga-opt-0078		EMA decay 0.9965→0.99 gives tighter window (100 vs 286 steps) so final EMA model better represents the fully-converged floor phase. Linear warmdown revert ensures we're building on exp_064 not exp_073.
086	2026-05-01T08:38:17Z	curr	064	082	curr	Replace per-shard random permutation with Weyl (golden-ratio) quasi-random permutation cycled across resets: each shard reset starts at a different offset in the golden-ratio sequence, ensuring maximally uniform positional coverage even when training terminates mid-epoch.	-0.0002	discard	1.077992	+0.001454	15988823	600.030000	592.300000	1506.000000	apga-curr-0078		Random permutations on each shard reset are independent draws; with ~600s wall-clock and multiple resets per shard, some positions risk systematic under-sampling. Weyl sequence rotated by golden-ratio * N on each reset guarantees that over K resets, positional coverage is within ⌈K/N⌉ visits per slot (vs Poisson variance for random). Pure data-ordering change: no loss modification, no model change, no eval-path impact — zero risk of crash or eval_budget_overrun.
087	2026-05-01T08:40:27Z	reg	064	082	reg	Lower Muon WD by 0.65× for recurrence loop blocks (3-5) only: loop blocks get 3× gradient per forward pass so their effective gradient-to-WD ratio is already 3× that of non-loop blocks; reducing their WD (attn 0.095→0.062, mlp 0.115→0.075) lets them find sharper minima without WD opposing the strong accumulated gradient signal.	-0.001	discard	1.077801	+0.001263	15990979	600.075000	590.600000	1503.000000	apga-reg-0078		Opposite direction from exp_047 (which tried HIGHER WD for loop blocks and regressed +0.001). The mechanistic asymmetry: loop blocks accumulate 3x gradient per backward pass through the 3-loop recurrence (loop_start=3, loop_end=5, num_loops=2). Standard WD (same for all blocks) over-regularizes these blocks relative to their gradient magnitude. muon_wd_loop_mult=0.65 gives loop attn WD=0.0618, loop MLP WD=0.0748. Non-loop blocks unchanged. Guard: only splits when num_loops > 0 (always true in baseline).
088	2026-05-01T08:44:53Z	arch	075	082	arch	Hierarchical sliding-window attention on early encoder layers 1, 2 (window=512 of seq_len=2048) via FA3 window_size; layer 0 + recurrence + decoder stay full causal. Zero new params; biases early-encoder receptive field toward local n-gram aggregation. Re-submit of #078 with SDPA fallback fixed (smoke ignores window_size — zero-param edit, artifact size unaffected) plus FA3-signature probe so an older flash_attn_interface gracefully degrades to full attention.	-0.0008	eval_budget_overrun	1.078008			600.013000	603.600000	1528.000000	apga-arch-0079		Crash post-mortem of #078: smoke-phase SDPA fallback raised at the explicit attn_mask path (additive -inf with bf16 mask + masked_fill_). Fix: smoke fallback ignores window_size and uses full causal — pack-size measurement is unaffected because SWA adds zero parameters. Plus an inspect.signature probe on _fa3_impl so a future / different flash_attn_interface install also degrades safely instead of TypeError'ing on the kwarg. Hierarchical schedule: layer 0 keeps sink, layers 1-2 local 512, layers 3-10 global. Mistral / Gemma precedent.
089	2026-05-01T08:55:37Z	tok	075	082	tok	Add learnable per-dimension output scale (output_dim_scale, [model_dim=512], init=1) applied after final_norm but before the tied-embedding logit projection, learning a diagonal metric in the output space to reweight which embedding dimensions matter most for next-token prediction — unlike exp_058's input-side scale (cancelled by input RMSNorm), this scale directly modulates the logit similarity computation.	-0.001	eval_budget_overrun	1.080509			600.075000	603.200000	1514.000000	apga-tok-0081		Mechanistic rationale: tied embeddings have dual roles (input representation + output classifier). After final_norm, the 512-dim hidden state has unit RMS but per-dimension variance differs. output_dim_scale=[512] (init=1) reweights dimensions before F.linear(x, tok_emb.weight), learning which context dimensions most predict token identity. Equivalent to learning diag(s) between context and embedding. Init=1 → step-0 identical to baseline. Removes the failed word_start_emb from exp_079 and the SP scan overhead.
090	2026-05-01T08:58:38Z	meta	082	082	meta	Raise ema_decay 0.9965→0.998: extends EMA half-life 198→346 steps to better average the long warmdown_frac=0.72 trajectory now that min_lr=0.15 produces stable, meaningfully-moving late steps.	-0.0005	discard	1.077780	+0.001242	15989079	600.143000	510.000000	1385.000000	apga-meta-0085		Fresh meta axis — tree.tsv shows no prior trial touched ema_decay. Image-classification literature (Morales-Brotons et al. 2024 arxiv 2411.18704) tests α∈{0.968,0.984,0.992,0.996,0.998}; we're at 0.9965, below the upper-empirical cluster at 0.996-0.998. Compounds with exp_045 (min_lr=0.10) and exp_054 (min_lr=0.15) which together established that the warmdown trajectory keeps moving meaningfully — more averaging extracts more signal from these many low-noise late steps. Risk: too much smoothing biases EMA toward middle-training weights when undertrained model is still improving. One-knob change, ~0.0015 absolute step on a saturating axis (1-α from 0.0035 to 0.002, ~43% reduction).
091	2026-05-01T09:05:41Z	eval	082	082	eval	Nesterov SGD + per-chunk momentum reset for TTT: switch SGD to nesterov=True (lookahead gradient computes at θ-lr·v, more accurate in the ~6-step-per-chunk regime) and clear optimizer.state at each chunk boundary (removes stale velocity from the previous chunk's different distribution).	-0.0001	discard	1.077217	+0.000679	15992290	600.028000	570.200000	1480.000000	apga-eval-0087		Two complementary eval-domain changes: (1) nesterov=True gives lookahead correction per step — prevents overshooting especially with only ~6 TTT steps per chunk; (2) optimizer.state.clear() before each chunk's adaptation ensures Nesterov velocity from the prior chunk (a different topic distribution) doesn't contaminate the fresh chunk. Both target the same mechanism: cleaner, higher-quality per-chunk adaptation with the same eval time budget.
092	2026-05-01T09:06:38Z	ttt	082	082	ttt	Combine exp_075's recurrence-block gradient equalization (rescale blocks 3-5 grad by 1/(num_loops+1)=1/3 after backward) with Nesterov momentum (nesterov=True) in TTT SGD, on top of exp_082's NLL-adaptive LR — both improvements were on separate lineage branches and have never been combined.	-0.00015	keep	1.076397	-0.000141	15989454	600.088000	513.800000	1383.000000	apga-ttt-0088	snapshots/092_ttt	exp_082 (eval specialist) has NLL-adaptive LR but NOT gradient equalization. exp_075 (ttt specialist) has gradient equalization but NOT NLL-adaptive LR. This submission stacks both on exp_082 and additionally enables Nesterov momentum. Nesterov weights current-chunk gradient 1.9x vs old buffer 0.81x (vs plain momentum 1.0x vs 0.9x), which is beneficial for TTT where each chunk has a partially different distribution. Expected delta approximately -0.00015 from additive combination of the two improvements.
093	2026-05-01T09:08:13Z	opt	082	092	opt	Restore muon_momentum_warmup_fraction 0.33→0.45 in exp_082 baseline: the eval specialist submitted exp_082 from a stale workdir that did not inherit exp_064's validated 0.45 setting, so the current best runs Muon with only 198s of momentum warmup instead of the 270s shown to be optimal by exp_064 (Δ=-0.000038 on prior lineage).	-0.000040	discard	1.076673	+0.000276	15988047	600.029000	524.100000	1403.000000	apga-opt-0088		exp_064 demonstrated this exact change (0.33→0.45) gave Δ=-0.000038. exp_082 (best) inadvertently dropped this by using a non-rebased workdir. This edit adds it back on top of exp_082's NLL-adaptive TTT LR. Changes are independent: momentum ramp affects training (first 270s), TTT LR scaling affects eval-time adaptation. Combined effect should be approximately additive.
094	2026-05-01T09:08:31Z	loss	075	092	loss	Per-token loss clipping at 5.0 nats: replace mean CE with mean(clamp(per_token_CE, max=5.0)), removing gradient from positions where the model gives &lt;0.7% probability to the correct token, so the optimizer focuses on achievable improvements rather than noise-dominated impossible positions.	-0.001	discard	3.485854	+2.409457	9720424	600.057000	544.100000	1412.000000	apga-loss-0088		All previous loss modifications in this lineage hurt (z-loss +0.005, focal +0.009, position-weight +0.002, entropy-weight +0.004, 2-step-ahead +0.044). This is the only genuinely novel direction: removing gradient entirely from the hardest ~10% of tokens (loss>5.0 nats) rather than reweighting them. Mechanism: gradient is zero for clamped positions, so optimizer budget concentrates on the 90% of tokens where improvement is achievable. TTT adaptation is also affected (no gradient on hard tokens during TTT), which may help stability or slightly hurt rare-token adaptation.
095	2026-05-01T09:13:43Z	reg	082	092	reg	Add MLP hidden dropout (p=0.02) applied after LeakyReLU²-square activation before output projection: first true dropout mechanism in this run (exp_036 was stochastic depth), zero→nonzero qualitative change; disabled during eval/TTT via model.eval() → training=False, so only training dynamics are affected while quantization/scoring are clean.	-0.001	discard	1.081714	+0.005317	15988859	600.055000	569.200000	1485.000000	apga-reg-0089		MLP hidden dim=2048; p=0.02 means 98% of neurons active per step on average. F.dropout preserves expected value via scale-by-1/(1-p). The 11 loop+non-loop blocks all get identical dropout_p. Rationale: distributed MLP activations are more robust to int6 quantization (which selectively kills small weights, analogous to dropout). muon_wd_mlp=0.115 already biases toward MLP regularization; small dropout doubles down without hurting capacity severely given ~4000 training steps.
096	2026-05-01T09:14:18Z	quant	075	092	quant	Split attention vs MLP clip sigmas: attention layers (c_q/c_k/c_v/proj) use attn_clip_sigmas=10.0 instead of the uniform 12.85, giving 22% finer int6 quantization grid for attn weights that have few outliers beyond 10σ, while MLP layers stay at 12.85 where the wider range is justified by exp_062's regression when MLP was widened to 15.0.	-0.001	size_blocked	1.076026		16352138	600.149000	594.400000	1505.000000	apga-quan-0089		PR #1769 uses attn clip=10.0 as its default baseline before raising MLP to 12.0 — empirical evidence that 10.0 works for attention. Our attn is at 12.85 (same as MLP), which is wider than needed for near-Gaussian attn weights in a small undertrained 512-dim model. Tighter clip = finer quantization of the bulk with negligible clipping cost. The classify_param() function already distinguishes mlp vs attn, so routing is clean. Zero size impact — only changes quantization fidelity, not scale tensor format or count.
097	2026-05-01T09:21:41Z	arch	082	092	arch	Headwise query-dependent sigmoid output gate (Qwen NeurIPS 2025 Best Paper, arxiv 2505.06708) on attention, restricted to the 3 recurrence-loop blocks (layers 3,4,5). Gate logits ride free on extended c_q output (no separate matmul); identity-init via gate_bias=5.0 (sigmoid≈0.993); applied element-wise per head between SDPA and o_proj. Recurrence amplifies the effect (each gated block traversed 3× per forward pass).	-0.0015	eval_budget_overrun	1.077112			600.140000	603.800000	1535.000000	apga-arch-0089		Structurally novel: untried in this swarm and absent from the PR library. Mechanism per Qwen paper: introduces query-dependent non-linearity on the low-rank softmax output, eliminates attention sink and massive activations. Targeting only loop blocks (a) keeps artifact size delta to ~3-6 KB (3 layers × 4096 weights in extended c_q at int6+brotli), and (b) puts the gate where each block is replayed 3× per forward pass — per-pass query-dependent suppression of noisy heads is exactly where stability gains compound. Identity-init means step-0 is bit-equivalent to baseline (gate_bias=5 → sigmoid≈0.993, plus proj is zero-init). gate_bias is ndim=1 → auto-classified as scalar (Adam, scalar_lr=0.02). Risk: tight size headroom — if size_blocked, fall back to gate on layer 5 only or set LOWBIT_LAYERS for blocks.{3,4,5}.attn.c_q to int5.
098	2026-05-01T09:24:22Z	curr	082	092	curr	At warmdown start (frac=0.28), reset all per-rank shard orderings with fresh random phases and permutations so the 432s LR-decay convergence phase operates on a fully re-randomized data schedule rather than the tail of the initial epoch's permutation.	-0.001	discard	1.076812	+0.000415	15986638	600.093000	572.300000	1488.000000	apga-curr-0091		Mechanism: _warmdown_reshuffled flag triggers _reset_shard() for all files on each rank once at frac >= 1-warmdown_frac=0.28. Each shard gets a new random phase in [0, seq_len-1] and a new random permutation of its sequences. The ~28% of data consumed in the high-LR phase used one set of orderings; the warmdown EMA phase (which produces the final model) now uses a completely independent set. No tensor shape changes, no torch.compile interaction. PR#684 identified adaptive shard-mix as a useful curr technique; this is a simpler variant applying a single re-randomization at the most impactful moment.
099	2026-05-01T09:28:43Z	meta	082	092	meta	Raise grad_clip_norm 0.3→0.5: an untouched meta knob in this entire 90-trial run; 0.3 is unusually tight (modern recipes use 1.0 default), and since Muon row_normalize already bounds matrix updates, this clip primarily constrains AdamW scalar/embed updates including the bifurcated qk_gain [H,2] (exp_030's biggest recent gain) — loosening lets scalar params take larger steps during peak-LR phase when grads are most informative.	-0.0005	discard	1.077127	+0.000730	15992065	600.046000	570.100000	1481.000000	apga-meta-0091		Mid-radius lift (1.67x). Web search confirmed 1.0 is standard default; 0.3 is conservative legacy. Going to 0.5 (not 1.0) limits stability risk. Mechanism affects peak-LR phase most; warmdown grads are small enough that clip is rarely binding there. Watch for: (a) train_budget_overrun if optimizer step time changes (unlikely), (b) train instability NaN. Untouched knob → low collision risk with parallel agents.
100	2026-05-01T09:36:27Z	eval	082	092	eval	Discriminative per-layer TTT learning rates: tok_emb×0.5, blocks 0-2×0.3, blocks 3-7×0.7, blocks 8-10+final_norm×1.0; combined with existing NLL-adaptive cosine scaling so upper layers (most document-specific) adapt more aggressively each chunk.	-0.002	discard	1.076736	+0.000339	15992948	600.079000	568.300000	1472.000000	apga-eval-0095		Discriminative fine-tuning (ULMFiT-style) applied to TTT: upper transformer layers handle higher-level semantic composition that is more document-specific, lower layers handle universal syntactic patterns. Per-layer LR multipliers concentrate the TTT adaptation budget where it is most useful. Multipliers: tok_emb=0.5 (tied embedding/logit head, conservative to avoid vocab drift), blocks 0-2=0.3 (early universal layers), blocks 3-7=0.7 (mid layers including recurrence loop), blocks 8-10+final_norm=1.0 (upper semantic layers). Each chunk still gets the existing NLL-adaptive cosine LR scale from exp_082, so the decomposition is: effective_lr = ttt_lr × cosine_factor × nll_scale × layer_mult. Zero extra compute cost — just param grouping in the SGD optimizer.
