exp_id	timestamp	specialist	parent_exp	baseline_exp	domain	hypothesis	expected_delta	status	val_bpb	delta_vs_best	artifact_bytes	train_s	eval_s	total_s	job_name	snapshot_path	notes
168	2026-05-01T13:30:17Z	eval	157	157	eval	Double TTT chunk size from 32K to 64K tokens: same total TTT compute (half as many gradient steps, each with 2× the sequences per rank), but more coherent per-chunk gradient signal and half the chunk-level AllReduce overhead. Hypothesis: fewer but larger-batch gradient steps improve TTT convergence vs noisier 16-seq steps at 32K.	-0.001	discard	1.074608	+0.000401	15994929	600.076000	457.600000	1414.000000	apga-eval-0161		ttt_chunk_tokens: 32768 → 65536. With val_tokens≈2M, this gives ~30 chunks (vs ~60). Each chunk: 32 seqs total, 4 per rank. Per step compute doubles but steps halve → same wall time. No other changes. Rebased from exp_157 (current best, no 0.3 LR floor).
169	2026-05-01T13:31:18Z	meta	157	157	meta	Raise AdamW BETA1 from 0.9 to 0.95 — the only major AdamW hyperparameter untouched in 161 trials. The KellerJordan/modded-nanogpt 320-experiment sweep at d20 found x0_beta1=0.96 optimal vs the legacy 0.9 default; we adopt a conservative 0.95 step toward that finding. Mechanism: longer momentum half-life (10→20 steps) better averages the asymmetric gradient pattern on tied tok_emb (sparse rare-token input grads + dense output-projection grads), and smooths the bifurcated q_gain[H,2] / scalar group whose per-batch gradients fluctuate with token mix; the recently-kept embed_wd reduction (0.085→0.05, exp_157) reduced one source of effective regularization on tok_emb, so additional momentum-side smoothing fills the gap without raising the LR axis itself.	-0.0005	discard	1.076420	+0.002213	15993252	600.067000	572.900000	1512.000000	apga-meta-0161		Pure scalar change in the BETA1 default at line 158, zero size/time impact. Affects all three AdamW groups (tok_emb, scalar, head=None dead). The 320-trial modded-nanoGPT sweep is at d=1280 vs our d=512, so the 0.96 optimum may not transfer exactly; 0.95 is a conservative step. Risk: if rare-token sparse grads need MORE responsiveness (not more smoothing), this regresses; would then suggest LOWER beta1 next.
170	2026-05-01T13:34:07Z	quant	157	157	quant	Replace fixed sigma-based row scale (12.85*std/63) with per-row MSE-optimal percentile selection: try 5 clip percentiles [0.999, 0.9995, 0.9999, 0.99999, 1.0] per row and pick the one minimizing reconstruction MSE, giving ~4x finer quantization grid for the bulk of weights vs current near-no-clipping approach.	-0.001	size_blocked	1.066262		24897125	600.005000	518.600000	1422.000000	apga-quan-0162		Inspired by OpenAI's GPTQ-lite (2026-03-22 parameter golf record) which uses percentile-based scale search. Current 12.85*sigma gives essentially no clipping (quantile~1.0), which wastes bit precision. At perc=0.999 the quantization step shrinks ~4x, greatly reducing MSE for on-distribution weights. Works for both matrix (int6, clip_range=63) and embed (int8, clip_range=127) quantization. The clip_sigmas parameter is now effectively unused but kept for API compatibility.
171	2026-05-01T13:34:45Z	tok	157	157	tok	Add per-dimension causal bigram mixing (bigram_mix=[model_dim=512], zero-init): shifts embeddings right-by-1 and element-wise mixes the previous token's embedding into the current before RMSNorm, enriching x0 with bigram context that propagates through all 4 decoder layers via resid_mix injection — near-zero artifact cost (~1KB passthrough float16).	-0.001	crash						26.000000	apga-tok-0168		bigram_mix is [D=512] zero-init → identity at step 0, grows gradually during training. Gradients flow both from the current position and as context for the next position, creating a dual-role signal for the embedding. x0 enriched with bigram info reaches every decoder block (layers 7-10) via resid_mix. Added to scalar_params optimizer (scalar_lr=0.02, adam_wd=0.02). numel=512 ≤ 65536 → GPTQ passthrough as float16 (~1KB artifact overhead). | torch.distributed.elastic.multiprocessing.errors.ChildFailedError: ============================================================ (train_gpt.py:77 in flash_attn_3_func)
172	2026-05-01T13:37:50Z	loss	157	157	loss	Replace failed TOP hinge loss with z-loss (α=1e-4 × mean(log²Σexp(logits))): removes exp_161's harmful auxiliary and adds PaLM/T5-style partition-function regularization that sharpens predictions throughout training without any scheduling.	-0.001	discard	1.077376	+0.003169	15978843	600.147000	572.600000	1523.000000	apga-loss-0163		Z-loss penalizes large log-partition-function values, encouraging the model to concentrate probability mass on fewer tokens. With logit_softcap=30.0 and V=8192, log(Z)≈9 at init so z_loss≈0.0081 (0.09% of main CE ~9 nats) — negligible but persistent. As model improves, sharper distributions reduce log(Z) naturally. The coefficient 1e-4 matches PaLM (Chowdhery et al. 2022). Removes all lines from failed exp_161 TOP loss and replaces with 2-line z-loss.
173	2026-05-01T13:50:00Z	reg	157	157	reg	Stochastic depth with linear depth scaling (max_rate=0.1): layer i drops its full residual delta with prob i/10 × 0.1, forcing each layer to independently develop useful representations rather than co-adapting with neighbors; scaled by 1/keep_prob to preserve expected residual magnitude during training.	-0.001	discard	1.083402	+0.009195	15988778	600.105000	547.600000	1456.000000	apga-reg-0166		Rebased to exp_157 (embed_wd=0.05). DropPath applied to (x_out - x_in) delta after full block computation, per-sample Bernoulli mask, inverse-probability scaling. Layer 0: 0% drop; layer 10: 10% drop. No new parameters. Recurrence layers 3-5 each independently sample a mask per loop iteration.
174	2026-05-01T13:56:17Z	curr	157	157	curr	Quarter-batch phase 1 (196k tokens, 12 seqs/GPU) for 0–28% of training: same 2-shape compilation pattern as exp_109 (no 3-shape crash risk), but delivers 4× more optimizer steps at peak LR vs full batch instead of 2×, maximizing exploration before warmdown convergence.	-0.001	discard	1.074228	+0.000021	15987353	600.061000	584.900000	1530.000000	apga-curr-0167		exp_109 (half-batch) gave -0.001645; mechanism appears to be more optimizer steps at high LR. Quarter-batch doubles the step count again (4x vs baseline) while staying within the safe 2-shape compilation window. 3-phase attempts crashed due to 3 compiled shapes; this stays at 2. Potential risk: 12 seqs/GPU may be too noisy for Muon's gradient orthogonalization.
175	2026-05-01T13:57:20Z	ttt	130	157	ttt	Replace standard CE with focal loss (γ=2) in TTT inner training loop: focal_w=(1-p_t)^2 up-weights hard tokens (domain-specific vocabulary the model currently mispredicts) and suppresses easy tokens, concentrating adaptation signal where it matters most.	-0.001	discard	1.087726	+0.013519	15988678	600.034000	578.200000	1520.000000	apga-ttt-0167		Focal loss for TTT: the TTT training objective changes from standard CE to FL(p_t)=-(1-p_t)^2*log(p_t). The focal weight is treated as constant (computed under no_grad), so the backward pass only flows through log_softmax → correct token log-prob. Hard tokens (domain-specific jargon, rare words, unusual constructions) have low p_t and receive near-unit focal weight, driving most of the gradient. Common tokens already predicted near-perfectly have focal_w≈0. This better aligns TTT adaptation with where the model actually needs improvement: domain-specific patterns in the validation data rather than common tokens it already handles well. Zero eval-time cost (same computation structure). Uses forward_logits() for the forward pass instead of model(x,y) to allow custom loss computation.
176	2026-05-01T13:57:55Z	opt	157	157	opt	Muon momentum cooldown 0.99→0.95 after warmup: once the momentum warmup completes at 33% of training, linearly decay Muon momentum from 0.99 to 0.95 over the remaining 67%, reducing momentum inertia during the convergence phase so NS-orthogonalized updates track local gradients more precisely during warmdown.	-0.001	keep	1.073142	-0.001065	15991464	600.067000	511.100000	1411.000000	apga-opt-0168	snapshots/176_opt	Momentum cooldown is a genuinely untried axis in 17 opt experiments. All previous schedule changes (cosine, sqrt, sqrt warmdown shapes, EMA window, warmdown timing, β₂ changes) left the Muon momentum fixed at 0.99 post-warmup. The 72% warmdown phase trains with consistently high Muon momentum (high inertia) while LR is falling — decaying momentum alongside LR follows the WSD literature insight that the convergence phase benefits from more local gradient responsiveness. muon_momentum_end=0.95 chosen as a moderate target (above warmup_start=0.92, meaningfully below peak 0.99).
177	2026-05-01T14:01:11Z	arch	157	176	arch	RWKV-V5+ token shift on attention input: per-channel learnable lerp between RMSNormed activations and their 1-step causal shift, applied in every Block. mu init=0 → step-0 identical; gives each layer absolute prev-token info as a structural complement to RoPE's relative-position bias on Q/K, and looped layers 3-5 apply the shift 3× per forward on an evolving residual to expand effective receptive field at no extra compute.	-0.0008	eval_budget_overrun	1.076976			600.368000	603.400000	1563.000000	apga-arch-0168		Adds nn.Parameter token_shift_mu [dim=512] per Block (11 total = 5632 fp32 → fp16 passthrough = 11 KB raw, ~3-6 KB brotli). Forward: x_attn_in = x_normed + mu * (F.pad(x_normed[:,:-1,:], (0,0,1,0)) - x_normed). All ops are static-shape elementwise/F.pad → torch.compile fullgraph safe; FA3 unaffected (only its input changes). Untried in arch history (closest precedents — exp_167 sequential injection, exp_106 PeriLN, exp_146 head gate — all add params at the wrong axis: between sublayers or on outputs; this acts on the input axis, mixing across the time dimension). Risk: minor compute add (~0.5% of one block's ops), but no kernel call so should not push eval over budget like exp_106/088.
178	2026-05-01T14:03:11Z	tok	157	176	tok	Add per-dimension causal bigram mixing (bigram_mix=[512], zero-init): uses F.pad to shift embeddings right-by-1, then adds bigram_mix.to(dtype) * prev before RMSNorm, enriching x0 with bigram context that propagates through all decoder layers via resid_mix — ~1KB artifact cost.	-0.001	discard	1.075296	+0.002154	15993367	600.117000	579.800000	1525.000000	apga-tok-0172		Fixed crash from exp_171: prev version used torch.cat + bare bigram_mix*prev which failed with dtype mismatch (float32 param vs bfloat16 activations under autocast). Now uses F.pad(x[:,:-1], (0,0,1,0)) for compile-friendlier causal shift and bigram_mix.to(dtype=x.dtype) to match activation dtype. Pattern mirrors how resid_mix uses .to(dtype=x.dtype) in Block.forward.
179	2026-05-01T14:03:48Z	meta	157	176	meta	"Lower enable_looping_at 0.35→0.28 to align loop activation with the batch-switch transition: an UNTOUCHED meta axis in 170 trials. Currently the 7% gap (0.28–0.35) trains a ""full-batch + no-looping"" graph that is NEVER used at eval (eval uses looped graph 3), so those steps train a config the model is never deployed in. Aligning eliminates the wasteful intermediate phase, giving 7% more wallclock (~42s) to eval-config training. Both transitions now happen on the same step but graph 3 (full-batch+looping) is already precompiled in warmup so there is zero recompile cost. Mechanically supported by Sparse Growing Transformer (arxiv 2603.23998) ""progressively extends recurrence"" framing — the deep variant gets more time to converge in the regime it will be evaluated in."	-0.0005	discard	1.076099	+0.002957	15994149	600.023000	583.800000	1539.000000	apga-meta-0172		"Pure constant change line 141: ENABLE_LOOPING_AT default 0.35→0.28. Zero size impact, zero per-step compute change. Constraint check: enable_looping_at >= batch_phase1_frac (0.28) holds (now exact equality), so no new graph shape is introduced at runtime. Warmup still precompiles all three graphs (small-batch+no-loop, full-batch+no-loop, full-batch+loop); graph 2 simply becomes unused at runtime. Risk: minimal — same edge-case as exp_134 noted (""looping always activates with the pre-compiled full-batch shape"")."
180	2026-05-01T14:08:51Z	eval	157	176	eval	Switch TTT optimizer from SGD+momentum to AdamW(betas=(0.0,0.9), weight_decay=0): beta1=0 eliminates stale cross-chunk momentum while beta2=0.9 builds per-parameter variance estimates across chunks, giving SignSGD-like normalization in early chunk steps — handles heterogeneous quantization error across layers better than flat SGD LR.	-0.001	discard	1.549940	+0.476798	15994361	600.073000	403.900000	1303.000000	apga-eval-0173		Current SGD with momentum=0.9 accumulates gradient direction across chunks; with only 3 epochs/chunk and 30 chunks, the cross-chunk momentum may introduce stale direction from prior different-content chunks. AdamW with beta1=0 makes each chunk's gradient step purely based on current chunk's gradient (no momentum carryover), while beta2=0.9 accumulates a per-parameter variance estimate that normalizes for quantization-induced gradient magnitude differences across layers. The cosine LR schedule and NLL-adaptive scaling remain unchanged. In early steps of each chunk, step ≈ lr * sign(grad) (SignSGD behavior), providing equal normalized adaptation to all parameters regardless of quantization error scale.
181	2026-05-01T14:18:45Z	loss	157	176	loss	Remove exp_172's harmful z-loss and add label smoothing ε=0.02: z-loss at 1e-4 penalizes the log-partition function regardless of correctness (exp_127, exp_172 both hurt), while label_smoothing=0.02 only softens the hard-target gradient by 2% — a clean test from exp_157's baseline since exp_104's ε=0.01 result was confounded by simultaneously reverting a catastrophic per-token clamp.	+0.001	discard	1.084269	+0.011127	15958672	600.115000	569.000000	1518.000000	apga-loss-0174		Current workdir inherited z-loss from exp_172 (discard, +0.003 BPB). Edit: replace z-loss with F.cross_entropy(..., label_smoothing=0.02). With V=8192, each non-target token gets prob += 0.02/8192 ≈ 0.0000024, a very mild softening. Mechanistically different from z-loss: z-loss pushes ALL logit magnitudes down, label smoothing only reduces the correct-class gradient by (1-0.02)=0.98x while adding tiny signal to wrong classes. Risk: if same entropy-increasing mechanism as z-loss → discard ~1.075-1.076; if neutral → matches exp_157 ~1.074207.
182	2026-05-01T14:19:55Z	quant	157	176	quant	MSE-optimal percentile scale selection (exp_170 approach) for all layers, plus int5 for MLP down-projection layers: keeps the ~0.008 BPB quality gain from finer quantization grids on attention/mlp-fc (int6-percentile) while switching mlp.proj to int5-percentile (still 2.5× finer than original sigma=12.85 scheme) to reduce brotli artifact size and clear the 16 MB cap.	-0.005	size_blocked	1.067220		23492040	600.140000	590.100000	1540.000000	apga-quan-0174		exp_170 had the same percentile code but was size_blocked because quantized values span the full [-31,31] range uniformly (higher entropy → worse brotli). Switching mlp.proj to int5 (values in [-15,15], 31 distinct levels) recovers brotli headroom. Quality loss on proj layers is partial: int5+percentile scale ≈ 0.25σ/15 per step, still 2.5× finer than original sigma=12.85 (0.25σ/31 ratio). Expected: better than exp_157 (1.074207) but worse than exp_170 (1.066262 size_blocked).
183	2026-05-01T14:22:49Z	reg	157	176	reg	Split zero-init output projections (attn.proj + mlp.proj) into a dedicated Muon group with muon_wd_proj=0.05, down from 0.095/0.115: zero-init params must grow from zero during training and high WD continuously resists that growth — same mechanism as exp_157's embed_wd reduction for tiny-init embeddings.	-0.0004	discard	1.084735	+0.011593	15994071	600.119000	518.700000	1428.000000	apga-reg-0177		attn.proj and mlp.proj both have _zero_init=True. Currently lumped with orthogonally-initialized QKV (WD=0.095) and fc (WD=0.115). New muon_wd_proj=0.05 matches the winning embed_wd level. No change to architecture, LR, or other groups. Increases Muon param groups from 2 to 4.
184	2026-05-01T14:23:22Z	opt	176	176	opt	Muon momentum cooldown 0.99→0.90 (deeper): extend exp_176's winning cooldown endpoint from 0.95 to 0.90, reducing Muon's effective window from ~20 to ~10 steps by end of training for even more precise gradient tracking during late warmdown convergence.	-0.0005	discard	1.074140	+0.000998	15987671	600.025000	521.500000	1426.000000	apga-opt-0177		exp_176 showed 0.99→0.95 cooldown gives Δ=-0.001065 (keep). Testing whether deeper cooldown to 0.90 further helps. Mechanism: at β=0.90 the momentum buffer has a ~10-step effective window, making Muon nearly gradient-descent-like at end of training. In Muon, NS orthogonalization already provides noise reduction, so low momentum mainly affects direction consistency vs. responsiveness tradeoff. Risk: too-low momentum destabilizes final convergence.
185	2026-05-01T14:33:02Z	meta	176	176	meta	Raise AdamW BETA2 from 0.95 to 0.98 — untouched in 179 trials (only beta1 tested at exp_169, adam_eps at exp_135). Current beta1=beta2=0.95 collapses m and v EMA half-lives to ~14 steps, defeating Adam's variance-adaptation purpose; restoring m << v separation (v half-life ~35 steps) gives more stable per-row effective LR on tied tok_emb (8192×512) and on the AdamW scalar group (q_gain[H,2], attn_scale, mlp_scale, resid_mix, skip_gates) especially across the 72% warmdown. Backed by the Fantastic Pretraining Optimizers paper (arxiv 2509.02046) using beta2=0.98 as 130M baseline.	-0.0008	discard	1.075725	+0.002583	15994947	600.022000	513.200000	1414.000000	apga-meta-0180		Single-character default change (0.95 → 0.98). Zero size impact, zero per-step compute change. Affects all three AdamW optimizer groups (optimizer_tok, optimizer_scalar, plus per-layer scalar group). Token-half-life perspective: at 786k tokens/step, β₂=0.95 gives ~11M token half-life vs β₂=0.98 gives ~27M tokens, the latter aligning with canonical recipe proportions (5-10% of total ~550M training tokens). Distinct from exp_135 (lower eps amplifies v sensitivity) and exp_169 (beta1 tweak) — those adjacent axes were tested independently.
186	2026-05-01T14:39:39Z	arch	176	176	arch	V-RMSNorm symmetric to existing Q/K norm (HybridNorm 2503.04598, 2025): add F.rms_norm to V after c_v projection so QKV are all unit-norm per head. Parameter-free, single extra rms_norm over Hkv=4 vs Q's Hk=8.	-0.0008	eval_budget_overrun	1.073352			600.010000	600.600000	1550.000000	apga-arch-0181		Single-line edit; zero new params; eval cost about half a Q-norm; well below the 2-norm-per-block budget that tripped exp_106. Backed by HybridNorm 2025 ablations.
187	2026-05-01T14:39:40Z	tok	176	176	tok	Add learnable output_shift [model_dim=512] zero-init, applied to x before the logit projection: F.linear(x+shift, W) = raw_logits + W@shift, giving a per-token logit bias via the embedding rows at only 512 params (2KB) to learn frequency priors explicitly without the 32KB cost of [vocab_size] bias.	-0.001	discard	1.073312	+0.000170	15991809	600.093000	582.900000	1530.000000	apga-tok-0181		Motivation: tied embeddings must serve dual input/output roles; an explicit [dim]-dim output shift provides a fast-converging frequency calibration channel that decouples the semantic and frequency-prior learning in the embedding matrix. At zero-init, step-0 is numerically identical to baseline. Gradient for output_shift = W.T @ grad_logits, which is the mean embedding-weighted prediction error — converges quickly to frequency corrections. Size-safe: only adds 2KB before brotli vs 8.5KB headroom from exp_176 (15991464 bytes).
188	2026-05-01T14:44:39Z	curr	157	176	curr	Stratified shard sampling: replace proportional-remaining shard selection with round-robin via shuffled shard permutation each batch step, guaranteeing all shards contribute equally to every batch (vs proportional which statistically skips ~12% of shards per step with 12 shards and 24 seqs).	-0.0007	discard	1.073911	+0.000769	15991583	600.078000	528.400000	1440.000000	apga-curr-0182		The old-stack domain notes say Latin-square/stratified kept TWICE. Proportional sampling with n_shards=12 and batch_size=24 gives each shard ~2.0±1.3 seqs per step with ~12% chance of any shard being unsampled. Round-robin forces exactly 2 seqs per shard per step. The shuffled shard_perm is regenerated each batch call so there is no fixed ordering artifact. Fallback to proportional if a shard is exhausted (effectively dead code in 600s training where no shard is fully consumed). Also improves GPTQ calibration diversity since calibration also calls next_batch.
189	2026-05-01T14:46:00Z	ttt	157	176	ttt	Add SLOT-style logit-bias correction to TTT scoring: a [vocab_size=8192] float32 bias is zero-initialized, analytically updated each chunk via the CE gradient (model_pred_freq - target_freq, LR=0.5) using already-computed forward-pass logits (no extra backward), then applied at scoring of subsequent chunks — captures token-frequency distribution shift complementary to weight-level TTT adaptation.	-0.001	discard	1.074228	+0.001086	15994503	600.059000	595.100000	1544.000000	apga-ttt-0182		Logit-bias SLOT-style correction added purely at scoring time. The analytical gradient (softmax - one_hot_avg) is computed from already-computed scoring logits, costing ~0.5s extra eval. Logit bias carries over across chunks (no reset), accumulating a global frequency correction as val proceeds. Adaptation loop unchanged.
