exp_id	timestamp	specialist	parent_exp	baseline_exp	domain	hypothesis	expected_delta	status	val_bpb	delta_vs_best	artifact_bytes	train_s	eval_s	total_s	job_name	snapshot_path	notes
000	2026-05-01T03:55:39Z	baseline			baseline	PR #1758 seed (CaseOps + PreQuant TTT LR=1e-3 Unfrozen, 3-seed claim)	0	baseline	1.081000								seed / PR #1758 reference
001	2026-05-01T04:20:59Z	curr	000	000	curr	Short-to-long seq-len curriculum: train at seq_len=1024 for first 25% of wallclock, then step to 2048 — enables ~2.5x faster early steps (quadratically cheaper attention) yielding ~35% more optimizer steps in the same 600s budget, aligned with SkyLadder-style context-window scheduling gains.	-0.005	crash						858.000000	apga-curr-0001		One extra torch.compile invocation for [B=96,T=1024] shape at training start; warmup pre-caches [B=48,T=2048]; transition at frac=0.25 reuses cached 2048 graph. seqlen_start=1024, seqlen_ramp_end_frac=0.25. Loop activation at frac=0.35 is after transition so looping always runs at full 2048 context. | torch.distributed.elastic.multiprocessing.errors.ChildFailedError: ============================================================ (train_gpt.py:1147 in eval_val)
002	2026-05-01T04:25:38Z	quant	000	000	quant	Frequency-weighted GPTQ Hessian: pre-collect calibration batches, count token frequencies, give top-100 most-frequent tokens sqrt(2) activation scaling so their contribution to H=X^T X is 2x larger, biasing GPTQ error compensation toward the tokens that dominate BPB.	-0.003	keep	1.079188	-0.001812	15990719	600.047000	594.200000	1462.000000	apga-quan-0001	snapshots/002_quant	Port of FreqGPTQ from PR #1721 (technique-donor only, not rebased). No architectural changes. Calibration loop restructured: first pass collects all 64 batches + counts token frequencies; second pass (same batches) runs forward with freq-weighted hooks. Top-100 token sqrt(2) boost gives 2x Hessian weight. Zero artifact size impact.
003	2026-05-01T04:26:35Z	reg	000	002	reg	Split Muon weight decay by parameter type: attn matrices keep muon_wd=0.095, MLP matrices raised to muon_wd_mlp=0.115, applying stronger regularization where MLP layers benefit more from it.	-0.003	eval_budget_overrun	1.080205			600.041000	603.400000	1505.000000	apga-reg-0001		classify_param() already in codebase; split attn_matrix_params/mlp_matrix_params into two Muon param groups. Two allreduce calls instead of one but overhead minimal. Prior lineage had this as a keep (exp_164). MLP WD=0.115 > attn WD=0.095 aligns with AlphaDecay insight: lighter-tailed MLP spectra benefit from stronger regularization.
004	2026-05-01T04:26:35Z	arch	000	002	arch	ResFormer value-residual: layer-0 V mixed at fixed 0.5 into V of every later attention (zero added params, residual-topology change).	-0.005	size_blocked	1.081633		16001408	600.159000	599.600000	1473.000000	apga-arch-0001		arxiv 2410.17897 (Zhou et al, ResFormer). Threaded v_first through Block.forward / GPT.forward_logits; v is blended INSIDE attention only, raw V is exported unchanged so v_first stays = layer-0's pristine V. Fixed 0.5 weighting per paper. Compatible with GQA (v shape [B,T,4,64] both sides). Layer 0 sees v_first=None → no blend → identity. Depth recurrence: block 0 is called only once in either looped/non-looped mode, so v_first is set exactly once. fullgraph compile traces both branches via Python-side type dispatch, validated by syntax_check.
005	2026-05-01T04:26:59Z	meta	000	002	meta	Raise TTT cosine LR floor from 0 to 0.5*ttt_lr so late chunks still adapt at 50% of peak instead of decaying to ~0.	-0.002	keep	1.079067	-0.000121	15992024	600.072000	593.300000	1459.000000	apga-meta-0001	snapshots/005_meta	Half-amplitude cosine TTT schedule. Motivated by LaCT (arxiv 2505.23884) and Beyond Cosine Decay (arxiv 2503.02844). Compute cost identical.
006	2026-05-01T04:27:22Z	opt	000	005	opt	Split Muon into two param groups — attention matrices use muon_wd=0.095, MLP matrices use muon_wd_mlp=0.115 — restoring the multi_596 regularization split that was absent from the PR#1758 seed.	-0.004	eval_budget_overrun	1.080069			600.101000	603.600000	1511.000000	apga-opt-0001		The multi_596 baseline (val_bpb≈1.072) used split MLP weight decay (muon_wd=0.095 attn, muon_wd_mlp=0.115 MLP). The PR#1758 seed drops this split, using flat muon_wd=0.095 everywhere. MLP matrices tend to memorize more aggressively in short-budget training; higher WD for MLP provides additional regularization. Implementation: split block_named_params into attn_matrix_params and mlp_matrix_params, pass two Muon param groups with per-group weight_decay.
007	2026-05-01T04:29:47Z	ttt	000	005	ttt	Replace global SGD optimizer with fresh-per-chunk AdamW (betas=(0.9,0.95), wd=0.01) in TTT loop to get clean per-document adaptive step sizes and prevent momentum bleed-over between heterogeneous val chunks.	-0.004	eval_budget_overrun	1.080081			600.071000	603.200000	1513.000000	apga-ttt-0001		AdamW's bias-corrected first step is effectively sign-SGD (scale-invariant), which converges faster in the 3-epoch per-chunk regime. Resetting per chunk avoids SGD momentum carrying over from a previous document's content, which is harmful when val chunks span heterogeneous documents. Weight decay 0.01 provides mild drift prevention. Cosine LR decay over chunks preserved as the initial LR for each fresh optimizer.
008	2026-05-01T04:29:56Z	eval	000	005	eval	Replace cosine LR decay in TTT with flat LR (h.ttt_lr throughout all chunks) so later chunks get equal adaptation budget instead of near-zero LR.	-0.003	eval_budget_overrun	1.080339			600.069000	603.800000	1515.000000	apga-eval-0001		Current cosine schedule: LR drops from ttt_lr=0.005 to ~0 over chunks. The last ~40% of chunks adapt at tiny LR even though SGD momentum buffer persists and could carry useful update directions. Flat LR ensures every chunk receives equal adaptation; since FineWeb val is approximately IID, no catastrophic forgetting expected. Computation is identical (same epochs, same chunks). Removes the import of math.cos from the adaptation path (math already imported). No eval wall change expected.
009	2026-05-01T04:31:08Z	tok	000	005	tok	Add word-position embedding (4 entries, shape [4,512]) that encodes within-word BPE subword depth (0=word-start, 1=2nd subword, 2=3rd, 3=4th+) computed via torch.cummax on SP leading-space mask, added to token embeddings before RMSNorm.	-0.003	eval_budget_overrun	1.083455			600.049000	604.000000	1510.000000	apga-tok-0001		word_pos_emb has 2048 float16 params (numel<65536 → passthrough float16 in GPTQ, no Hessian needed). word_start_mask registered as persistent=False buffer (not in state_dict). Added to tok_params AdamW group with tied_embed_lr. Morphological within-word position is a structured signal absent from unigram tok_emb that should improve BPB.
010	2026-05-01T04:33:33Z	loss	000	005	loss	Add deep supervision auxiliary LM loss (coef=0.1) at encoder-decoder boundary: projects encoder final hidden state through tied embeddings to give direct language-modeling gradient signal to early layers, improving gradient flow for the undertrained model without any new artifact parameters.	-0.003	eval_budget_overrun	1.089888			600.064000	603.100000	1515.000000	apga-loss-0001		forward() is restructured to inline encoder/decoder (forward_logits unchanged for eval compilation). Aux head uses F.rms_norm + tied embeddings + softcap. No new params, training-only signal. Coefficient 0.1 keeps aux gradient 10x weaker than main.
011	2026-05-01T04:35:55Z	arch	005	005	arch	Learnable per-layer ResFormer V-residual: each block adds nn.Parameter scalar v_alpha; v <- sigmoid(v_alpha)*V_1 + (1-sigmoid(v_alpha))*V_n with v_alpha init=0 (sigmoid=0.5).	-0.003	crash						26.000000	apga-arch-0011		exp_004 used Identity-ResFormer (fixed 0.5) and was within seed noise of baseline (1.0816 vs 1.0810) but artifact size_blocked. The ResFormer paper (arxiv 2410.17897v5, Table 3) shows Identity-RF=2.712 vs Learnable-RF=2.705 vs RF-Plus=2.681 val_loss on 82M; learnable per-layer mixing alone delivered ~0.007 nats over fixed. Per-layer alpha is one fp32 scalar per block (11 floats total — negligible) so artifact size risk is minimized. Implementation: v_first chains the raw V from block 0 forward through encoder+decoder iters (consistent with looped-recurrence path since block 0 still fires first); v_raw exported BEFORE blending so V_1 stays pristine. Init at 0 gives equal mix start (paper-recommended); model can ramp alpha up (later layers want more V_1 per the paper) or down per layer. Sigmoid keeps mix in [0,1] for stability. | torch.distributed.elastic.multiprocessing.errors.ChildFailedError: ============================================================ (train_gpt.py:1412 in step_fn)
012	2026-05-01T04:43:26Z	curr	000	005	curr	Short-to-long seq-len curriculum (1024→2048 at frac=0.25) with warmup pre-compilation of the 1024 shape to avoid mid-training distributed recompile hazard causing NCCL timeout (fixed crash from exp_001).	-0.004	crash						793.000000	apga-curr-0007		exp_001 crashed in eval_val likely due to uncoordinated [96,1024] recompilation at training step 1 causing NCCL timeout. Fix: run one step_fn with seqlen_start=1024 during warmup (before initial state save + restore), pre-caching the shape before training begins. warmup time excluded from wallclock, so no budget cost. | torch.distributed.elastic.multiprocessing.errors.ChildFailedError: ============================================================ (train_gpt.py:1147 in eval_val)
013	2026-05-01T04:51:38Z	reg	000	005	reg	MLP/attn Muon WD split (attn=0.095, mlp=0.115) plus ttt_epochs reduced 3→2 to clear eval budget; first submit showed val_bpb=1.080 but DQ_EVAL by 3.4s.	-0.002	keep	1.078897	-0.000170	15987269	600.010000	526.900000	1393.000000	apga-reg-0007	snapshots/013_reg	Prior exp_003 got val_bpb=1.080205 with DQ_EVAL; ttt_epochs 3→2 saves ~50s of eval time to stay within budget. The WD split itself is the primary technique.
014	2026-05-01T04:51:53Z	opt	000	013	opt	Split Muon MLP weight decay (muon_wd=0.095 attn, muon_wd_mlp=0.115 MLP) + reduce ttt_epochs from 3 to 2 to stay within the 600s eval budget.	-0.002	keep	1.078777	-0.000120	15992157	600.144000	525.300000	1388.000000	apga-opt-0007	snapshots/014_opt	First submit (exp_006) had eval_budget_overrun at 603.6s — pure jitter (my change doesn't touch eval). Reducing ttt_epochs 3→2 saves ~30s of TTT time. The split MLP WD (0.115 vs 0.095) restores the multi_596 configuration; expected to improve generalization of MLP layers. Net cost: slightly less TTT adaptation per epoch but well within budget.
015	2026-05-01T04:55:46Z	quant	002	014	quant	Reduce GPTQ Hessian damping from 0.01 to 0.005 (less regularization bias in H inversion) and block_size from 128 to 64 (finer per-block error propagation), both improving post-quantization fidelity at no time cost.	-0.002	eval_budget_overrun	1.080681			600.066000	603.100000	1500.000000	apga-quan-0008		damp 0.01→0.005 motivated by PR #1318 (ttt-adamw-slot-lbfgs25-logit-delta-gptq-damp005) which showed significant gains from lower Hessian regularisation. block_size 128→64 moves toward finer error propagation (seed stack design intent was 32). Both changes zero runtime cost — GPTQ quantization FLOPS unchanged, eval wall unaffected. Combined they tighten the quantization lattice alignment with actual weight distributions.
016	2026-05-01T04:56:23Z	meta	005	014	meta	Add nesterov=True to TTT SGD optimizer (momentum=0.9): lookahead-gradient step gives ~5-15% effective convergence speedup at zero compute cost, compounding exp_005's raised cosine LR floor on under-adapted late chunks.	-0.0008	eval_budget_overrun	1.080353			600.020000	603.800000	1503.000000	apga-meta-0009		One-token edit on the TTT optimizer construction at line 1244. Nesterov accelerated gradient: instead of evaluating g at w, evaluates at lookahead w-μv, then v←μv+g, w←w-lr*v. With μ=0.9 the lookahead is significant. Theoretical caveat (Nesterov SGD can diverge at LR where vanilla converges) is mitigated by ttt_lr=0.005 being moderate, grad_clip_norm=1.0 in place, and exp_005's cosine schedule reducing LR to 0.0025 on the late chunks where momentum has accumulated. Zero compute overhead (PyTorch reformulation). Untouched axis in the meta tree.
017	2026-05-01T04:57:14Z	eval	000	014	eval	Flat TTT LR (no cosine decay) + ttt_epochs=2 to fix eval overrun: late chunks now get 2 full adaptation epochs vs ~0.3 effective epochs under cosine+3.	-0.002	discard	1.079042	+0.000265	15991047	600.063000	569.100000	1464.000000	apga-eval-0010		Prior submit (exp_008) showed val_bpb=1.0803 (vs baseline 1.081) with flat LR but eval_budget_overrun at 603.8s. Reducing ttt_epochs 3→2 saves ~120s of TTT adaptation time (1/3 of TTT wall). Flat LR with 2 epochs gives better late-chunk adaptation than cosine decay with 3 epochs: cosine late-chunks had effective LR~0.0005 for 3 epochs ≈ 0.3 effective epochs, while flat+2 gives full LR for 2 epochs everywhere. Eval budget should be comfortably within 600s now.
018	2026-05-01T05:01:16Z	ttt	005	014	ttt	MLP-only TTT: freeze attention+embedding weights, adapt only MLP fc/proj/norm/scale parameters (filter `'mlp' in name`) — more stable and cheaper per step (skips ~44 attention weight-gradient GEMMs, halves allreduce traffic), motivated by TTT-E2E (arxiv:2512.23675).	-0.002	eval_budget_overrun	1.079229			600.095000	603.100000	1504.000000	apga-ttt-0011		MLP-only TTT follows TTT-E2E finding that attention-frozen TTT is both more stable (no outer-loop instability from attention weight updates in inner loop) and computationally cheaper. ttt_epochs=3 unchanged; same SGD+momentum+cosine-floor LR schedule from exp_005. If the compute savings are significant we might follow up with ttt_epochs=4.
019	2026-05-01T05:03:31Z	loss	000	014	loss	Add z-loss regularization (coef=1e-4, same as PaLM): penalizes (log Z)^2 where Z=logsumexp(logits), encouraging balanced logit distributions and improved quantization robustness at near-zero compute overhead.	-0.001	eval_budget_overrun	1.084695			600.110000	603.400000	1515.000000	apga-loss-0012		Prior trial (exp_010) showed deep supervision is too expensive (~5% compute overhead). Z-loss uses the same logsumexp already computed inside CE — essentially free. Bounded logits from softcap mean log_Z ~5-15; z-loss adds ~0.003-0.022 nats regularization, nudging the model toward less overconfident distributions which could help post-GPTQ calibration.
020	2026-05-01T05:04:20Z	tok	005	014	tok	Replace 4-class word-position embedding (cummax scan) with 2-class binary word-type embedding (word-start vs continuation) via direct boolean lookup — eliminates sequential cummax overhead that caused eval_budget_overrun while preserving word-boundary signal at the input layer.	-0.001	eval_budget_overrun	1.083456			600.085000	603.900000	1511.000000	apga-tok-0012		exp_009 showed cummax-based word-position embedding (4-class) caused eval_budget_overrun and worsened BPB (1.0835 vs 1.081 baseline). Binary lookup (word_start_mask[input_ids].long()) is O(1) per token and has no sequential dependency. Table shrinks from [4,512] to [2,512] (numel=1024, passthrough float16 in GPTQ). Word-boundary signal is retained: word-start tokens get one learned correction vector, continuation subwords get another. Expected to fix eval overrun and provide modest input-layer improvement.
021	2026-05-01T05:05:32Z	arch	005	014	arch	Learnable per-layer ResFormer V-residual: blocks 1..N-1 each carry an nn.Parameter scalar v_alpha; v <- sigmoid(v_alpha)*V_1 + (1-sigmoid(v_alpha))*V_n with v_alpha init=0 (sigmoid=0.5). Block 0 has no v_alpha (v_first=None there) to avoid DDP unused-param.	-0.003	eval_budget_overrun	1.080125			600.114000	603.800000	1524.000000	apga-arch-0012		"Re-submit of exp_011 fix: previous crash was DDP ""unused parameter"" — v_alpha on block 0 had no gradient since block 0 sees v_first=None. Fixed by conditionally creating v_alpha only for layer_idx>0, threaded layer_idx through Block→CausalSelfAttention. Forward path: block 0 is V_1 source (no blend), blocks 1..N-1 blend with sigmoid mix. ResFormer paper (arxiv 2410.17897v5, Table 3) shows learnable per-layer mixing delivers ~0.007 nats over fixed-0.5 (which exp_004 tried) on 82M models. Cost: 10 fp32 scalars; size_project headroom is plentiful."
022	2026-05-01T05:15:51Z	curr	000	014	curr	Position-weighted training loss: linearly ramp per-token loss weight from 0.5 at position 0 to 1.5 at position 2047 (mean=1.0), concentrating gradient on late-context positions that the stride-64 sliding-window eval scores exclusively.	-0.003	eval_budget_overrun	1.082339			600.056000	605.300000	1509.000000	apga-curr-0013		Aligns training distribution with eval: sliding-window scores only the last 64 tokens per 2048-token window (highest-context positions). No seq_len changes, no new graph shapes, no distributed sync risk. pos_loss_weight_min=0.5, pos_loss_weight_max=1.5. TTT also adapts with this weighting which further aligns with the eval metric.
023	2026-05-01T05:24:02Z	quant	002	014	quant	Two-tier frequency weighting: top-50 tokens get 2.0 activation weight (4× Hessian) and tokens 51-200 get sqrt(2) (2× Hessian), replacing the flat top-100 sqrt(2) scheme — stronger Hessian emphasis on the highest-BPB-impact tokens.	-0.001	discard	1.079291	+0.000514	15996769	600.039000	599.200000	1465.000000	apga-quan-0018		exp_015 showed damp=0.005 and block_size=64 both hurt (val_bpb regressed to 1.0807 + eval overrun). Reverted both. This trial keeps damp=0.01 and block_size=128, only changes the freq-weighting function. Motivation: top-50 tokens are disproportionately frequent in FineWeb (punctuation, common articles) and dominate BPB; giving them 4x H weight vs 2x means GPTQ quantization error is minimized most aggressively for them. Tokens 51-200 still get 2x. Zero time impact.
024	2026-05-01T05:24:44Z	opt	014	014	opt	Muon+ col-then-row post-normalization after Newton-Schulz orthogonalization (paper arxiv:2602.21545): normalizes each column then each row of the update matrix to unit norm, ensuring uniform per-neuron update magnitudes for rectangular MLP/attn weight matrices on top of existing MuonEq-R pre-normalization.	-0.002	discard	1.080301	+0.001524	15995445	600.072000	569.900000	1466.000000	apga-opt-0018		Muon+ adds col-row normalization after orthogonalization (separate from our existing row_normalize before NS = MuonEq-R). Paper shows -2.0 perplexity on GPT-Small (124M) and consistent improvements across LLaMA scales. For our tall MLP proj [2048,512], NS gives orthonormal columns but uneven rows; existing scaling approximates row unit-norm but post col-row does it exactly per-row. For wide MLP fc [512,2048], NS gives orthonormal rows; col-row then equalizes columns then rows. Expected to improve convergence especially for rectangular matrices without impacting model size or eval time.
025	2026-05-01T05:25:51Z	meta	014	014	meta	Compose exp_005's TTT cosine LR floor (0.5*ttt_lr instead of 0) on top of exp_014's WD split — restoring an independent keep that was lost when exp_014 forked from exp_000 instead of exp_005.	-0.0001	discard	1.079002	+0.000225	15992488	600.072000	582.000000	1489.000000	apga-meta-0018		1-line edit on the per-chunk TTT cosine schedule: cos_lr = h.ttt_lr * (0.75 + 0.25*cos(pi*ci/(N-1))) instead of h.ttt_lr * 0.5*(1+cos(...)). Range becomes [0.5*ttt_lr, 1.0*ttt_lr] instead of [0, 1.0*ttt_lr]. exp_005 found this gave -0.000121 on top of baseline (exp_000); exp_014's WD split is orthogonal (training-time, not eval-time TTT LR), so the two should compose. Eval-time-neutral: same chunk count, same epochs, same step count — only the LR magnitude per chunk changes. No size impact. Risk: if exp_014's reduction to ttt_epochs=2 already shifted the LR optimum, the floor might be slightly off — but composition is the safest meta move with two known-good orthogonal changes.
026	2026-05-01T05:26:03Z	reg	014	014	reg	Late-training weight-decay taper: linearly reduce all optimizer WDs from 100% to 50% over the final 30% of training (frac 0.70→1.0), letting the model optimize more freely during warmdown when LR is already decaying.	-0.001	discard	1.079042	+0.000265	15991050	600.131000	572.200000	1468.000000	apga-reg-0018		Port of WD_TAPER technique from PR #1729 (CaseOps bundle). start_frac=0.70 aligns with deep warmdown phase (warmdown starts at frac=0.28); final_mult=0.50 halves all WDs at end. Applies to all optimizer groups (Muon attn/MLP, AdamW embed/scalar). Mechanism: as LR decays toward 0, high WD is redundant and may prevent reaching lower loss; taper removes this friction in the critical final optimization window.
027	2026-05-01T05:32:53Z	eval	014	014	eval	Widen eval stride 64→128 (halves scoring forward-pass count, −3% context per position) and reinvest freed eval budget into ttt_epochs 2→4, recovering the original 4-epoch TTT quality within ~440s total eval time.	-0.001	eval_budget_overrun	1.080385			600.034000	603.100000	1500.000000	apga-eval-0022		Scoring is ~83% of eval time at stride=64 (~485s of 585s total). Halving stride to 128 saves ~242s; doubling ttt_epochs adds ~100s; net eval ≈ 442s. The 64-token context reduction (1984→1920) is a ~3% loss for a 512-dim model that has limited long-range utilization, while 2 additional TTT epochs should more than compensate. Cosine LR schedule and all other settings identical to exp_014.
