exp_id	parent_exp	depth	path	specialist	status	val_bpb	delta_vs_best	hypothesis
000		0	000	baseline	baseline	1.081000		PR #1758 seed (CaseOps + PreQuant TTT LR=1e-3 Unfrozen, 3-seed claim)
001	000	1	000/001	curr	crash			Short-to-long seq-len curriculum: train at seq_len=1024 for first 25% of wallclock, then step to 2048 — enables ~2.5x faster early steps (quadratically cheaper attention) yielding ~35% more optimizer steps in the same 600s budget, aligned with SkyLadder-style context-window scheduling gains.
002	000	1	000/002	quant	keep	1.079188	-0.001812	Frequency-weighted GPTQ Hessian: pre-collect calibration batches, count token frequencies, give top-100 most-frequent tokens sqrt(2) activation scaling so their contribution to H=X^T X is 2x larger, biasing GPTQ error compensation toward the tokens that dominate BPB.
015	002	2	000/002/015	quant	eval_budget_overrun	1.080681		Reduce GPTQ Hessian damping from 0.01 to 0.005 (less regularization bias in H inversion) and block_size from 128 to 64 (finer per-block error propagation), both improving post-quantization fidelity at no time cost.
023	002	2	000/002/023	quant	discard	1.079291	+0.000514	Two-tier frequency weighting: top-50 tokens get 2.0 activation weight (4× Hessian) and tokens 51-200 get sqrt(2) (2× Hessian), replacing the flat top-100 sqrt(2) scheme — stronger Hessian emphasis on the highest-BPB-impact tokens.
003	000	1	000/003	reg	eval_budget_overrun	1.080205		Split Muon weight decay by parameter type: attn matrices keep muon_wd=0.095, MLP matrices raised to muon_wd_mlp=0.115, applying stronger regularization where MLP layers benefit more from it.
004	000	1	000/004	arch	size_blocked	1.081633		ResFormer value-residual: layer-0 V mixed at fixed 0.5 into V of every later attention (zero added params, residual-topology change).
005	000	1	000/005	meta	keep	1.079067	-0.000121	Raise TTT cosine LR floor from 0 to 0.5*ttt_lr so late chunks still adapt at 50% of peak instead of decaying to ~0.
011	005	2	000/005/011	arch	crash			Learnable per-layer ResFormer V-residual: each block adds nn.Parameter scalar v_alpha; v <- sigmoid(v_alpha)*V_1 + (1-sigmoid(v_alpha))*V_n with v_alpha init=0 (sigmoid=0.5).
016	005	2	000/005/016	meta	eval_budget_overrun	1.080353		Add nesterov=True to TTT SGD optimizer (momentum=0.9): lookahead-gradient step gives ~5-15% effective convergence speedup at zero compute cost, compounding exp_005's raised cosine LR floor on under-adapted late chunks.
018	005	2	000/005/018	ttt	eval_budget_overrun	1.079229		MLP-only TTT: freeze attention+embedding weights, adapt only MLP fc/proj/norm/scale parameters (filter `'mlp' in name`) — more stable and cheaper per step (skips ~44 attention weight-gradient GEMMs, halves allreduce traffic), motivated by TTT-E2E (arxiv:2512.23675).
020	005	2	000/005/020	tok	eval_budget_overrun	1.083456		Replace 4-class word-position embedding (cummax scan) with 2-class binary word-type embedding (word-start vs continuation) via direct boolean lookup — eliminates sequential cummax overhead that caused eval_budget_overrun while preserving word-boundary signal at the input layer.
021	005	2	000/005/021	arch	eval_budget_overrun	1.080125		Learnable per-layer ResFormer V-residual: blocks 1..N-1 each carry an nn.Parameter scalar v_alpha; v <- sigmoid(v_alpha)*V_1 + (1-sigmoid(v_alpha))*V_n with v_alpha init=0 (sigmoid=0.5). Block 0 has no v_alpha (v_first=None there) to avoid DDP unused-param.
028	005	2	000/005/028	tok	eval_budget_overrun	1.083203		Cache word_start_mask at module level so the second deserialize() call (for TTT) skips the SPM vocab scan, saving ~4-5s of eval init overhead that caused the eval_budget_overrun.
038	005	2	000/005/038	tok	eval_budget_overrun	1.080768		Add per-feature embedding layer-scale (embed_norm_scale, [512], init=0) applied as x*(1+scale) after embedding RMSNorm — a fast-converging handle on per-dimension amplification that complements the slow 8192×512 tok_emb matrix.
006	000	1	000/006	opt	eval_budget_overrun	1.080069		Split Muon into two param groups — attention matrices use muon_wd=0.095, MLP matrices use muon_wd_mlp=0.115 — restoring the multi_596 regularization split that was absent from the PR#1758 seed.
007	000	1	000/007	ttt	eval_budget_overrun	1.080081		Replace global SGD optimizer with fresh-per-chunk AdamW (betas=(0.9,0.95), wd=0.01) in TTT loop to get clean per-document adaptive step sizes and prevent momentum bleed-over between heterogeneous val chunks.
008	000	1	000/008	eval	eval_budget_overrun	1.080339		Replace cosine LR decay in TTT with flat LR (h.ttt_lr throughout all chunks) so later chunks get equal adaptation budget instead of near-zero LR.
009	000	1	000/009	tok	eval_budget_overrun	1.083455		Add word-position embedding (4 entries, shape [4,512]) that encodes within-word BPE subword depth (0=word-start, 1=2nd subword, 2=3rd, 3=4th+) computed via torch.cummax on SP leading-space mask, added to token embeddings before RMSNorm.
010	000	1	000/010	loss	eval_budget_overrun	1.089888		Add deep supervision auxiliary LM loss (coef=0.1) at encoder-decoder boundary: projects encoder final hidden state through tied embeddings to give direct language-modeling gradient signal to early layers, improving gradient flow for the undertrained model without any new artifact parameters.
012	000	1	000/012	curr	crash			Short-to-long seq-len curriculum (1024→2048 at frac=0.25) with warmup pre-compilation of the 1024 shape to avoid mid-training distributed recompile hazard causing NCCL timeout (fixed crash from exp_001).
013	000	1	000/013	reg	keep	1.078897	-0.000170	MLP/attn Muon WD split (attn=0.095, mlp=0.115) plus ttt_epochs reduced 3→2 to clear eval budget; first submit showed val_bpb=1.080 but DQ_EVAL by 3.4s.
014	000	1	000/014	opt	keep	1.078777	-0.000120	Split Muon MLP weight decay (muon_wd=0.095 attn, muon_wd_mlp=0.115 MLP) + reduce ttt_epochs from 3 to 2 to stay within the 600s eval budget.
024	014	2	000/014/024	opt	discard	1.080301	+0.001524	Muon+ col-then-row post-normalization after Newton-Schulz orthogonalization (paper arxiv:2602.21545): normalizes each column then each row of the update matrix to unit norm, ensuring uniform per-neuron update magnitudes for rectangular MLP/attn weight matrices on top of existing MuonEq-R pre-normalization.
025	014	2	000/014/025	meta	discard	1.079002	+0.000225	Compose exp_005's TTT cosine LR floor (0.5*ttt_lr instead of 0) on top of exp_014's WD split — restoring an independent keep that was lost when exp_014 forked from exp_000 instead of exp_005.
026	014	2	000/014/026	reg	discard	1.079042	+0.000265	Late-training weight-decay taper: linearly reduce all optimizer WDs from 100% to 50% over the final 30% of training (frac 0.70→1.0), letting the model optimize more freely during warmdown when LR is already decaying.
027	014	2	000/014/027	eval	eval_budget_overrun	1.080385		Widen eval stride 64→128 (halves scoring forward-pass count, −3% context per position) and reinvest freed eval budget into ttt_epochs 2→4, recovering the original 4-epoch TTT quality within ~440s total eval time.
029	014	2	000/014/029	loss	discard	1.087752	+0.008975	Focal loss (γ=1.0) with per-batch normalization: replace CE mean with (1-p_t)/mean(1-p_t) * nll, redistributing gradient budget toward hard tokens while keeping average loss scale equal to CE.
030	014	2	000/014/030	arch	keep	1.078041	-0.000736	Bifurcate per-head q_gain into [H, 2]: col-0 scales the RoPE-rotated head-dim slice (positional channel), col-1 scales the NoPE pass-through slice (content channel). Both columns init at qk_gain_init=5.25 so step-0 is bit-equivalent to baseline.
039	030	3	000/014/030/039	arch	discard	1.079435	+0.001394	Hybrid RoPE/NoPE layer pattern: late-decoder blocks 6, 8, 10 set rope_dims=0 (skip rotation entirely → NoPE), creating an alternating NoPE/RoPE stripe through the deep decoder; looped blocks 3-5 keep partial-RoPE for stable positional recurrence. Per Yang et al. 2025 (2501.18795) NoPE layers naturally specialize for long-range content retrieval while RoPE layers handle local recency; mixing them outperforms uniform partial-RoPE.
041	030	3	000/014/030/041	ttt	eval_budget_overrun	1.078062		Per-layer TTT LR scaling: blocks 0–10 get LR scaled from 0.25× to 1.75× of ttt_lr (linear by depth), non-block params (embeddings, norms) keep 1.0×, cosine decay applied proportionally per group.
043	030	3	000/014/030/043	quant	discard	1.078324	+0.000283	Reduce GPTQ error-propagation block_size from 128 to 32, giving 4× more frequent Hinv correction flushes and lower accumulated quantization error, with zero artifact-size impact (per-row scales are block_size-independent).
044	030	3	000/014/030/044	meta	discard	1.078795	+0.000754	Lower peak Muon momentum from 0.99 to 0.95 (canonical modded-nanogpt value): velocity timescale shortens from ~e^(-step/100) to e^(-step/20), giving late-warmdown steps more on-policy recent-gradient signal instead of stale accumulated velocity over the long 72% cosine warmdown.
045	030	3	000/014/030/045	opt	keep	1.076881	-0.001160	Set min_lr=0.10 so the linear warmdown LR floor is 10% of peak (not 0), preventing completely frozen-gradient final steps and letting the EMA capture meaningful training signal through end of 600s budget.
053	045	4	000/014/030/045/053	opt	keep	1.076789	-0.000092	Raise min_lr from 0.10 to 0.15: extends the LR floor phase from ~43s to ~64s of training, keeping Muon updates at 15% of peak in the final warmdown stretch.
065	053	5	000/014/030/045/053/065	opt	discard	1.077044	+0.000347	Replace fixed Newton-Schulz coefficients (3.4445, -4.775, 2.0315) with Polar Express per-iteration minimax-optimized coefficients (ICLR 2026), which converge to the polar factor ~2x faster in the same 5 NS steps, giving Muon higher-quality gradient orthogonalization throughout training.
054	045	4	000/014/030/045/054	meta	keep	1.076735	-0.000054	Raise warmdown LR floor min_lr=0.10→0.15: exp_045 just established that a non-zero floor compounds well in our undertrained 600s regime (Δ=-0.001160 going from 0.0→0.10), but the curve was tested only at one point — testing 0.15 brackets which side of the peak we're on, with priors that Cerebras D2Z (arxiv 2502.15938) claims zero floor is generally optimal for under-trained models so the curve must peak then decline.
064	054	5	000/014/030/045/054/064	meta	keep	1.076697	-0.000038	Raise muon_momentum_warmup_fraction 0.33→0.45: extends momentum ramp from 198s to 270s, keeping Muon momentum closer to start (0.92) longer so on-policy gradient signal dominates during early warmdown (warmdown starts at 168s, so 102s of overlap where LR is decaying AND momentum is still ramping — the fine-tuning sweet spot).
073	064	6	000/014/030/045/054/064/073	opt	discard	1.077564	+0.000867	Replace linear LR warmdown with cosine warmdown (min_lr=0.15 floor preserved): with linear decay LR hits the floor at frac≈0.892 (~64s before end), wasting learning signal; cosine decay stays above the floor until frac=1.0 exactly, keeping LR higher throughout warmdown for more gradient signal while converging to the same min_lr endpoint.
074	064	6	000/014/030/045/054/064/074	meta	discard	1.077571	+0.000874	Raise muon_momentum_warmup_fraction 0.45→0.55: extend Muon momentum ramp 270s→330s, increasing warmdown-overlap-with-ramping-momentum from 102s→162s — pushes the same axis exp_064 just kept (0.20 discard, 0.45 keep, longer-ramp-is-better trend).
077	064	6	000/014/030/045/054/064/077	reg	discard	2.727815	+1.651232	Add weight_decay=0.1 to TTT SGD optimizer: regularizes chunk-to-chunk weight drift, preventing early-chunk over-adaptation from degrading later-chunk predictions.
079	064	6	000/014/030/045/054/064/079	tok	discard	1.078843	+0.002260	Add a learnable [model_dim=512] word-start structural embedding (zero-init) that is added to the post-RMSNorm input representation for all word-initial tokens (those whose SP piece starts with ▁), encoding the linguistic word-boundary prior explicitly so the transformer can focus embedding capacity on token-specific content rather than re-learning the shared word-start bias from co-occurrence patterns.
080	064	6	000/014/030/045/054/064/080	loss	discard	1.120168	+0.043585	2-step-ahead auxiliary CE loss (α=0.15): at position t, co-train the same tied-embedding projection to predict x_{t+2} in addition to x_{t+1}, adding a richer look-ahead gradient signal with zero extra artifact parameters.
081	064	6	000/014/030/045/054/064/081	quant	discard	1.077124	+0.000541	Frequency-weighted GPTQ Hessian calibration: pre-collect all calibration batches, count token frequencies, boost top-100 most-frequent tokens by sqrt(2) in H=X^TX, biasing GPTQ to minimize quantization error on common tokens. This technique improved bpb by -0.001812 on the old baseline (exp_002) but was never merged into the main lineage.
082	064	6	000/014/030/045/054/064/082	eval	keep	1.076538	-0.000045	Per-chunk NLL-adaptive TTT learning rate: after score-first evaluation of each chunk, scale the cosine-scheduled adaptation LR by clip(chunk_nll/running_mean_nll, 0.5, 2.0), reallocating adaptation budget toward chunks where the model is struggling most.
090	082	7	000/014/030/045/054/064/082/090	meta	discard	1.077780	+0.001242	Raise ema_decay 0.9965→0.998: extends EMA half-life 198→346 steps to better average the long warmdown_frac=0.72 trajectory now that min_lr=0.15 produces stable, meaningfully-moving late steps.
091	082	7	000/014/030/045/054/064/082/091	eval	discard	1.077217	+0.000679	Nesterov SGD + per-chunk momentum reset for TTT: switch SGD to nesterov=True (lookahead gradient computes at θ-lr·v, more accurate in the ~6-step-per-chunk regime) and clear optimizer.state at each chunk boundary (removes stale velocity from the previous chunk's different distribution).
092	082	7	000/014/030/045/054/064/082/092	ttt	keep	1.076397	-0.000141	Combine exp_075's recurrence-block gradient equalization (rescale blocks 3-5 grad by 1/(num_loops+1)=1/3 after backward) with Nesterov momentum (nesterov=True) in TTT SGD, on top of exp_082's NLL-adaptive LR — both improvements were on separate lineage branches and have never been combined.
101	092	8	000/014/030/045/054/064/082/092/101	ttt	discard	1.090955	+0.014558	Replace standard CE with focal CE (γ=2) in TTT adaptation step: down-weight tokens the model predicts confidently (focal_w=(1-p_t)^2 ≈ 0) and concentrate gradient signal on hard tokens that inflate BPB most, making each TTT step more efficient per chunk.
103	092	8	000/014/030/045/054/064/082/092/103	opt	discard	1.076644	+0.000247	Extend warmdown_frac from 0.72→0.76: with min_lr=0.15 floor both schedules reach the floor at ~533s, but the shallower linear slope gives the EMA more time accumulating near-converged weights, better matching the hard-task WSD regime where longer decay fractions are optimal.
104	092	8	000/014/030/045/054/064/082/092/104	loss	discard	1.082974	+0.006577	Revert exp_094's catastrophic per_token.clamp(max=5.0) and replace with F.cross_entropy label_smoothing=0.01: at vocab=8192 the clamp silenced all gradients at init (ln(8192)≈9>>5), and ε=0.01 micro-smoothing may marginally improve post-GPTQ calibration without measurable gradient distortion.
105	092	8	000/014/030/045/054/064/082/092/105	reg	discard	1.077090	+0.000693	Split Muon WD within attention block by functional role: Q/K routing matrices get muon_wd_qk=0.075 (lower, needs more optimization freedom), V/O content matrices get muon_wd_vo=0.110 (higher, functions like MLP projection); analogous to the successful attn/MLP WD split (exp_013) but applied within attn itself.
106	092	8	000/014/030/045/054/064/082/092/106	arch	eval_budget_overrun	1.079394		Peri-LN (ICLR 2025, arxiv 2502.02732): add a parameter-free RMSNorm to each sublayer's OUTPUT before the residual add — sandwich-style y = x + scale * RMSNorm(Module(RMSNorm(x))) — bounding per-sublayer contribution magnitude in both sequential (layers 0-6) and parallel-residual (layers 7-10) modes.
107	092	8	000/014/030/045/054/064/082/092/107	meta	discard	1.077492	+0.001095	Raise scalar_lr 0.02→0.03 (50% bump) on the AdamW group containing the bifurcated q_gain[H,2] (exp_030's biggest +Δ), attn_scale/mlp_scale, resid_mix, and skip_gates — an entirely untouched meta knob currently identical to matrix_lr=0.022, while modern muP/normalized-transformer recipes give scalar gains materially higher LR than matrices because they are few-parameter and need fast convergence in our undertrained 600s regime.
108	092	8	000/014/030/045/054/064/082/092/108	quant	size_blocked	1.075575		Split GPTQ clip sigmas: attention layers (c_q/c_k/c_v/proj) use attn_clip_sigmas=10.0 vs uniform 12.85, giving a finer int6 quantization grid for attn weights (few outliers beyond 10σ) while MLP layers keep 12.85 to preserve their wider-tail outliers.
109	092	8	000/014/030/045/054/064/082/092/109	curr	keep	1.074752	-0.001645	Dynamic small→large batch schedule: use half-size batch (393k tokens) for the pre-warmdown phase (0–28% of training), then switch to full batch (786k tokens) at warmdown start; pre-compile both shapes during warmup to avoid mid-training recompile, yielding ~25% more optimizer steps early when critical batch size is small.
115	109	9	000/014/030/045/054/064/082/092/109/115	curr	crash			Three-phase batch schedule (quarter→half→full): add phase-0 with quarter-batch (196k tokens, 12 seqs/GPU) for the first 10% of training (0–60s), then phase-1 half-batch (28%) and full-batch (28–100%) as before; pre-compile the quarter-batch graph during warmup so no mid-training recompile overhead.
120	109	9	000/014/030/045/054/064/082/092/109/120	curr	crash			Three-phase batch schedule (quarter→half→full) v2: phase-0 quarter-batch (196k tokens) for first 10% of training, phase-1 half-batch (393k) for 10–28%, phase-2 full-batch (786k) from 28%; quarter-batch graph compiles naturally at step 0 (all 8 GPUs simultaneously, no NCCL risk) removing the 4th warmup pass that caused v1 crash.
122	109	9	000/014/030/045/054/064/082/092/109/122	opt	discard	1.074945	+0.000193	Raise AdamW β₂ from 0.95→0.99 at warmdown start for tok_emb and scalar optimizer groups: stable second-moment estimates let the LR schedule—not gradient magnitude fluctuations—control step size during warmdown (arxiv 2508.01483: consistent improvements with higher β₂ during WSD cooldown).
124	109	9	000/014/030/045/054/064/082/092/109/124	reg	discard	1.077178	+0.002426	Give skip_weights and skip_gates their own AdamW param group with weight_decay=0.0 (freed from adam_wd=0.02): WD was decaying these critical skip-connection parameters by ~80% over training (scalar_lr×adam_wd per step over ~4000 steps ≈ e^-1.6 factor), forcing the optimizer to constantly fight WD just to maintain useful skip magnitudes.
125	109	9	000/014/030/045/054/064/082/092/109/125	meta	discard	1.078438	+0.003686	Lower muon_momentum_warmup_start 0.92 to 0.85 (canonical Modded-NanoGPT value): untouched in 116 trials despite peak and fraction being tuned; lower start means first ~10% of training has Muon updates 50% closer to on-policy gradient (1-0.85=0.15 vs 1-0.92=0.08), giving better basin selection in the highly-plastic 600s undertrained regime, then ramps to preserved peak 0.99 over the same 0.33 fraction.
126	109	9	000/014/030/045/054/064/082/092/109/126	curr	crash			Extend half-batch phase from 28% to 38% of training: keep 2-phase schedule (half→full) but with transition at 38% instead of 28%, giving 10% more of training (60s) with more optimizer steps while LR is still at 88% of peak.
127	109	9	000/014/030/045/054/064/082/092/109/127	loss	discard	1.077136	+0.002384	Add PaLM-style z-loss (1e-4 * mean(logsumexp(logits)^2)) to the CE loss: penalizes the log-partition function magnitude, keeping logit scale well-conditioned and reducing the effective weight singular-value range needed — improving GPTQ int6 quantization fidelity.
128	109	9	000/014/030/045/054/064/082/092/109/128	arch	eval_budget_overrun	1.081711		Switch MLP activation from LeakyReLU(slope=0.5).square() to ReLU.square() (PrimerEZ / Haziza 2025 srelu): zero the negative tail entirely instead of leaking 0.25·z², inducing activation sparsity that may regularize the undertrained MLP. One-character edit (negative_slope 0.5→0.0 equivalent); identical shapes / dtypes / compile-graph topology / param count, so eval budget is unaffected.
129	109	9	000/014/030/045/054/064/082/092/109/129	eval	eval_budget_overrun	1.094911		Tighten TTT gradient clip from 1.0 to 0.5: motivated by the LaCT paper (arXiv:2505.23884) finding that sequential gradient accumulation in TTT causes magnitude explosion; halving the clip norm reduces per-step parameter drift, preventing overfitting to each chunk while matching the tighter 0.3 clip used during training.
130	109	9	000/014/030/045/054/064/082/092/109/130	quant	keep	1.074702	-0.000050	Loss-weighted GPTQ Hessian calibration: two-pass approach computes per-batch CE loss then re-accumulates Hessian with each batch weighted by its normalized loss, biasing GPTQ error compensation toward sequences where the model is most uncertain (highest BPB contribution).
140	130	10	000/014/030/045/054/064/082/092/109/130/140	quant	discard	1.074992	+0.000290	Combined frequency+loss Hessian weighting: extend exp_130's loss-weighted calibration by also scaling activations for the top-100 most-frequent tokens by sqrt(2), so the Hessian simultaneously emphasizes high-uncertainty batches (loss weight) and frequent tokens (freq weight), two complementary orthogonal signals for GPTQ error compensation.
141	130	10	000/014/030/045/054/064/082/092/109/130/141	tok	discard	1.076029	+0.001327	Add within-word BPE position embeddings: zero-init nn.Embedding(8, 512) injected after input RMSNorm using a causal cummax scan over SP8192 word-start flags (persistent=False LUT, not in artifact), giving the model explicit intra-word token position without future leakage.
