exp_id	parent_exp	depth	path	specialist	status	val_bpb	delta_vs_best	hypothesis
142	130	10	000/014/030/045/054/064/082/092/109/130/142	meta	discard	1.078510	+0.003808	Raise tied_embed_lr 0.03→0.04 (an axis untouched in 135 trials): with tied embeddings the tok_emb param receives output-projection (softmax-side) gradients which dominate the input-embedding gradients — currently the tied_embed_lr/matrix_lr ratio of 1.36 is closer to μP-style than to the √d≈22.6 ratio recommended by arxiv 2506.15025 for large-vocab models, so a +33% bump samples the theoretically-favored direction while staying small-radius (still 15× below the untied default of 0.6).
143	130	10	000/014/030/045/054/064/082/092/109/130/143	opt	size_blocked	1.075118		Implement Muon-VS (Variance-Adaptive Muon, arxiv 2601.14603): add per-element variance scaling of the Nesterov momentum before Newton-Schulz orthogonalization using the existing muon_beta2=0.95 EMA buffer, dampening high-variance gradient directions and amplifying low-variance ones for more efficient orthogonal updates.
144	130	10	000/014/030/045/054/064/082/092/109/130/144	curr	discard	1.136397	+0.061695	Hard-token loss weighting: replace uniform CE mean with per-token loss-proportional weights (w = per_tok / mean_per_tok, detached), computing mean(per_tok²)/mean(per_tok) — upweights hard tokens ~proportionally to their difficulty, concentrating gradient on positions where the model errs most.
145	130	10	000/014/030/045/054/064/082/092/109/130/145	ttt	eval_budget_overrun	1.093126		Fuse per-parameter TTT gradient AllReduce (150+ individual NCCL calls) into a single float32 flat-buffer AllReduce per step to eliminate kernel-launch overhead (~15ms/step → ~14s saved), then use the freed eval budget to add a 4th TTT epoch (ttt_epochs 3→4, +33% adaptation per chunk at ~1ms cost).
146	130	10	000/014/030/045/054/064/082/092/109/130/146	arch	discard	1.075878	+0.001176	Add per-head sigmoid output gate on attention (NeurIPS 2025 Best Paper, arXiv:2505.06708): apply gate=sigmoid(α·||y||₂ + β) per head with α=0/β=+4 init (transparent at step-0) between SDPA(+XSA) and proj, introducing non-linearity on the low-rank softmax mapping plus output-magnitude-dependent sparse gating to mitigate attention-sink at near-zero param/byte cost (176 scalars total).
147	130	10	000/014/030/045/054/064/082/092/109/130/147	reg	discard	1.075182	+0.000480	Set scalar_wd=0.0 (down from adam_wd=0.02) for optimizer_scalar: attn_scale, mlp_scale, resid_mix, and q_gain are initialized at non-zero target values (1.0, 1.0, [1.0,0], 5.25) yet WD constantly pulls them toward zero, creating optimization friction that forces gradients to fight the WD force rather than learning the optimal scale.
148	130	10	000/014/030/045/054/064/082/092/109/130/148	eval	discard	1.075168	+0.000466	Replace cumulative NLL running-average reference in TTT adaptive LR with EMA (decay=0.95, α=0.05): compares each chunk's difficulty to a ~20-chunk local window instead of all prior chunks, making the cosine LR scaling more responsive to FineWeb's domain-shift structure.
149	130	10	000/014/030/045/054/064/082/092/109/130/149	quant	discard	1.075240	+0.000538	Reduce GPTQ block_size 128→64 and damp_factor 0.01→0.005: finer inter-block error propagation plus less Hessian over-regularization should improve quantization fidelity without changing artifact size.
150	130	10	000/014/030/045/054/064/082/092/109/130/150	loss	discard	1.075435	+0.000733	MiLe Loss (arXiv 2310.19531): replace static BPE-rank weighting with dynamic entropy-weighted CE — weight_i = sqrt(1 + H(p_i)) / mean, where H(p_i) is Shannon entropy of model's prediction at each position; early training is near-uniform (undertrained model → high entropy everywhere), warmdown increasingly down-weights confident easy tokens and focuses gradient on remaining hard tokens.
151	130	10	000/014/030/045/054/064/082/092/109/130/151	meta	eval_budget_overrun	1.097398		Raise ttt_momentum 0.9→0.93 (untouched scalar axis in 142 trials): three prior trials (exp_031, exp_091, exp_138) all reset the cross-chunk SGD momentum buffer and all regressed +0.0005-0.0009, establishing that cross-chunk velocity carryover is beneficial; raising β to 0.93 extends velocity timescale 10→14 inner steps, amplifying the same beneficial smoothing without zeroing it.
152	130	10	000/014/030/045/054/064/082/092/109/130/152	tok	discard	1.075703	+0.001001	Add per-dimension SmearAlpha: zero-init [model_dim=512] parameter that additively injects the previous position's normalized embedding into the current embedding (`x += smear_alpha * x_prev`), giving the model cheap causal bigram context in the input layer at zero initial cost (identity at init, ≤200 compressed bytes).
153	130	10	000/014/030/045/054/064/082/092/109/130/153	opt	discard	1.075339	+0.000637	Apply gradient clipping only to AdamW param groups (embed+scalar) instead of all parameters: Muon's Newton-Schulz orthogonalization already normalizes update matrices to unit spectral norm, so the global pre-NS clip was distorting gradient directions entering the momentum buffer; removing the clip for Muon lets NS capture the true gradient distribution.
154	130	10	000/014/030/045/054/064/082/092/109/130/154	ttt	discard	1.075204	+0.000502	Fuse per-parameter TTT gradient AllReduce (150+ NCCL calls) into a single float32 flat-buffer AllReduce per step; revert ttt_epochs to 3 after exp_145 showed 4 epochs overruns budget by ~3.5s.
155	130	10	000/014/030/045/054/064/082/092/109/130/155	curr	discard	1.136494	+0.061792	Add mid-warmdown shard reshuffle at frac=0.55: the 72%-long warmdown runs on a single fixed shard permutation set at frac=0.28; a second reshuffle midway through (frac=0.55, LR still at 62% of peak) gives fresh data orderings for the second half of warmdown, improving data diversity during convergence.
156	130	10	000/014/030/045/054/064/082/092/109/130/156	arch	discard	1.075266	+0.000564	Bifurcated K-gain [num_kv_heads=4, 2] mirroring exp_030's Q-gain win on the K side: split K into RoPE/NoPE channels and apply per-kv-head learnable scale (init=1.0, step-0 identical) so each kv-head can independently sharpen the RoPE vs NoPE contribution to logits — a DOF that q_gain[H,2] cannot express because Q-side scaling is finer-grained per-q-head but identical across the 2 q-heads sharing each kv-head.
157	130	10	000/014/030/045/054/064/082/092/109/130/157	reg	keep	1.074207	-0.000495	Lower embed_wd from 0.085 to 0.05: in the severely undertrained 10-minute regime with tiny embed init (std=0.005) and low tied_embed_lr=0.03, the current WD over-constrains the embedding, preventing it from learning distinctive token representations; reducing WD by ~41% lets embeddings grow more expressive while logit_softcap=30.0 prevents overconfidence.
164	157	11	000/014/030/045/054/064/082/092/109/130/157/164	reg	discard	1.082518	+0.008311	Lower embed_wd further from 0.05 to 0.0: exp_157 confirmed lower embed WD improves val_bpb; with WD=0 the embedding is governed purely by gradient signal (dominated by output projection), consistent with scalar_wd=0.0 already working fine; the output projection gradient is strong enough to self-regularize without explicit WD shrinkage.
168	157	11	000/014/030/045/054/064/082/092/109/130/157/168	eval	discard	1.074608	+0.000401	Double TTT chunk size from 32K to 64K tokens: same total TTT compute (half as many gradient steps, each with 2× the sequences per rank), but more coherent per-chunk gradient signal and half the chunk-level AllReduce overhead. Hypothesis: fewer but larger-batch gradient steps improve TTT convergence vs noisier 16-seq steps at 32K.
169	157	11	000/014/030/045/054/064/082/092/109/130/157/169	meta	discard	1.076420	+0.002213	Raise AdamW BETA1 from 0.9 to 0.95 — the only major AdamW hyperparameter untouched in 161 trials. The KellerJordan/modded-nanogpt 320-experiment sweep at d20 found x0_beta1=0.96 optimal vs the legacy 0.9 default; we adopt a conservative 0.95 step toward that finding. Mechanism: longer momentum half-life (10→20 steps) better averages the asymmetric gradient pattern on tied tok_emb (sparse rare-token input grads + dense output-projection grads), and smooths the bifurcated q_gain[H,2] / scalar group whose per-batch gradients fluctuate with token mix; the recently-kept embed_wd reduction (0.085→0.05, exp_157) reduced one source of effective regularization on tok_emb, so additional momentum-side smoothing fills the gap without raising the LR axis itself.
170	157	11	000/014/030/045/054/064/082/092/109/130/157/170	quant	size_blocked	1.066262		Replace fixed sigma-based row scale (12.85*std/63) with per-row MSE-optimal percentile selection: try 5 clip percentiles [0.999, 0.9995, 0.9999, 0.99999, 1.0] per row and pick the one minimizing reconstruction MSE, giving ~4x finer quantization grid for the bulk of weights vs current near-no-clipping approach.
171	157	11	000/014/030/045/054/064/082/092/109/130/157/171	tok	crash			Add per-dimension causal bigram mixing (bigram_mix=[model_dim=512], zero-init): shifts embeddings right-by-1 and element-wise mixes the previous token's embedding into the current before RMSNorm, enriching x0 with bigram context that propagates through all 4 decoder layers via resid_mix injection — near-zero artifact cost (~1KB passthrough float16).
172	157	11	000/014/030/045/054/064/082/092/109/130/157/172	loss	discard	1.077376	+0.003169	Replace failed TOP hinge loss with z-loss (α=1e-4 × mean(log²Σexp(logits))): removes exp_161's harmful auxiliary and adds PaLM/T5-style partition-function regularization that sharpens predictions throughout training without any scheduling.
173	157	11	000/014/030/045/054/064/082/092/109/130/157/173	reg	discard	1.083402	+0.009195	Stochastic depth with linear depth scaling (max_rate=0.1): layer i drops its full residual delta with prob i/10 × 0.1, forcing each layer to independently develop useful representations rather than co-adapting with neighbors; scaled by 1/keep_prob to preserve expected residual magnitude during training.
174	157	11	000/014/030/045/054/064/082/092/109/130/157/174	curr	discard	1.074228	+0.000021	Quarter-batch phase 1 (196k tokens, 12 seqs/GPU) for 0–28% of training: same 2-shape compilation pattern as exp_109 (no 3-shape crash risk), but delivers 4× more optimizer steps at peak LR vs full batch instead of 2×, maximizing exploration before warmdown convergence.
176	157	11	000/014/030/045/054/064/082/092/109/130/157/176	opt	keep	1.073142	-0.001065	Muon momentum cooldown 0.99→0.95 after warmup: once the momentum warmup completes at 33% of training, linearly decay Muon momentum from 0.99 to 0.95 over the remaining 67%, reducing momentum inertia during the convergence phase so NS-orthogonalized updates track local gradients more precisely during warmdown.
184	176	12	000/014/030/045/054/064/082/092/109/130/157/176/184	opt	discard	1.074140	+0.000998	Muon momentum cooldown 0.99→0.90 (deeper): extend exp_176's winning cooldown endpoint from 0.95 to 0.90, reducing Muon's effective window from ~20 to ~10 steps by end of training for even more precise gradient tracking during late warmdown convergence.
185	176	12	000/014/030/045/054/064/082/092/109/130/157/176/185	meta	discard	1.075725	+0.002583	Raise AdamW BETA2 from 0.95 to 0.98 — untouched in 179 trials (only beta1 tested at exp_169, adam_eps at exp_135). Current beta1=beta2=0.95 collapses m and v EMA half-lives to ~14 steps, defeating Adam's variance-adaptation purpose; restoring m << v separation (v half-life ~35 steps) gives more stable per-row effective LR on tied tok_emb (8192×512) and on the AdamW scalar group (q_gain[H,2], attn_scale, mlp_scale, resid_mix, skip_gates) especially across the 72% warmdown. Backed by the Fantastic Pretraining Optimizers paper (arxiv 2509.02046) using beta2=0.98 as 130M baseline.
186	176	12	000/014/030/045/054/064/082/092/109/130/157/176/186	arch	eval_budget_overrun	1.073352		V-RMSNorm symmetric to existing Q/K norm (HybridNorm 2503.04598, 2025): add F.rms_norm to V after c_v projection so QKV are all unit-norm per head. Parameter-free, single extra rms_norm over Hkv=4 vs Q's Hk=8.
187	176	12	000/014/030/045/054/064/082/092/109/130/157/176/187	tok	discard	1.073312	+0.000170	Add learnable output_shift [model_dim=512] zero-init, applied to x before the logit projection: F.linear(x+shift, W) = raw_logits + W@shift, giving a per-token logit bias via the embedding rows at only 512 params (2KB) to learn frequency priors explicitly without the 32KB cost of [vocab_size] bias.
191	176	12	000/014/030/045/054/064/082/092/109/130/157/176/191	eval	discard	1.716202	+0.643060	Raise ttt_lr from 0.005 to 0.008: with AdamW(beta1=0) the effective per-step update is ~lr×sign(gradient), so total weight movement per chunk = 3 steps × lr; at 0.005 the model moves only 1.5% of typical weight magnitude, likely underfitting the adaptation budget — increasing to 0.008 gives 2.4% movement while keeping max effective LR (with nll_scale=2.0 and cosine=1.0) at 0.016, still conservative.
193	176	12	000/014/030/045/054/064/082/092/109/130/157/176/193	opt	discard	1.073718	+0.000576	Delay Muon momentum cooldown start from frac=0.33 to frac=0.70: hold momentum at peak 0.99 during the majority of warmdown (33-70%), then do a faster 0.99→0.95 cooldown only in the final 30%, letting high momentum escape poor basins despite declining LR before switching to precise gradient tracking at convergence.
194	176	12	000/014/030/045/054/064/082/092/109/130/157/176/194	reg	discard	1.073655	+0.000513	Lower muon_wd_mlp from 0.115 to 0.095 to equalize MLP and attention weight decay: in the 10-minute undertrained regime MLP is capacity-constrained by time not overfitting, and its 5.2x shrinkage-to-LR ratio vs attn's 4.3x unnecessarily limits MLP expressiveness; also isolating the WD split that was conflated with ttt_epochs change in exp_013.
195	176	12	000/014/030/045/054/064/082/092/109/130/157/176/195	loss	discard	1.123512	+0.050370	Byte-weighted CE training loss: weight each token's NLL by its actual encoded byte count (base_bytes + leading_space from SP LUTs), normalized per batch — directly aligning the training CE objective with BPB = sum(NLL_t)/sum(bytes_t), so the optimizer prioritizes multi-byte subwords (like ' the'=4B, 'tion'=4B) over single-byte tokens (',','a') proportionally to their BPB contribution.
196	176	12	000/014/030/045/054/064/082/092/109/130/157/176/196	meta	discard	1.073947	+0.000805	Raise muon_momentum_warmup_start 0.92→0.95: untouched higher-side bracket of an axis where exp_125 already showed lower (0.85) hurts. With current batch curriculum (half-size phase 1, frac 0–0.28) the small-batch noisy gradient phase coincides exactly with the lowest Muon momentum during warmup ramp — raising the start narrows ramp range from 0.92→0.99 (7pp) to 0.95→0.99 (3pp), increasing gradient averaging during the noisier small-batch phase without delaying the warmup peak; cooldown logic (start=warmup-end at frac=0.33, end=0.95) is unchanged so late-training dynamics are identical.
197	176	12	000/014/030/045/054/064/082/092/109/130/157/176/197	tok	discard	1.073881	+0.000739	Replace additive output_shift (exp_187, +0.000170 BPB penalty) with multiplicative output_scale [model_dim=512] ones-init: x_scaled = x * output_scale before the tied embedding projection, giving a learned per-dimension diagonal reweighting of logit similarities that decouples which embedding dimensions matter for prediction vs. input lookup — exp_089 tried this technique but hit eval_budget_overrun without producing a valid bpb; now retried on the current (eval-stable) codebase.
198	176	12	000/014/030/045/054/064/082/092/109/130/157/176/198	arch	size_blocked	1.071377		test
199	176	12	000/014/030/045/054/064/082/092/109/130/157/176/199	curr	eval_budget_overrun	1.099951		Mask first 64 positions from training loss to align gradient with stride-64 sliding-window eval: positions 0–63 per sequence have no prior context (cold-start) while every evaluated token (after chunk 0) has ≥64 tokens of context; slicing logits/targets at [:, 64:] is a static shape change compile-safe.
177	157	11	000/014/030/045/054/064/082/092/109/130/157/177	arch	eval_budget_overrun	1.076976		RWKV-V5+ token shift on attention input: per-channel learnable lerp between RMSNormed activations and their 1-step causal shift, applied in every Block. mu init=0 → step-0 identical; gives each layer absolute prev-token info as a structural complement to RoPE's relative-position bias on Q/K, and looped layers 3-5 apply the shift 3× per forward on an evolving residual to expand effective receptive field at no extra compute.
178	157	11	000/014/030/045/054/064/082/092/109/130/157/178	tok	discard	1.075296	+0.002154	Add per-dimension causal bigram mixing (bigram_mix=[512], zero-init): uses F.pad to shift embeddings right-by-1, then adds bigram_mix.to(dtype) * prev before RMSNorm, enriching x0 with bigram context that propagates through all decoder layers via resid_mix — ~1KB artifact cost.
179	157	11	000/014/030/045/054/064/082/092/109/130/157/179	meta	discard	1.076099	+0.002957	Lower enable_looping_at 0.35→0.28 to align loop activation with the batch-switch transition: an UNTOUCHED meta axis in 170 trials. Currently the 7% gap (0.28–0.35) trains a "full-batch + no-looping" graph that is NEVER used at eval (eval uses looped graph 3), so those steps train a config the model is never deployed in. Aligning eliminates the wasteful intermediate phase, giving 7% more wallclock (~42s) to eval-config training. Both transitions now happen on the same step but graph 3 (full-batch+looping) is already precompiled in warmup so there is zero recompile cost. Mechanically supported by Sparse Growing Transformer (arxiv 2603.23998) "progressively extends recurrence" framing — the deep variant gets more time to converge in the regime it will be evaluated in.
180	157	11	000/014/030/045/054/064/082/092/109/130/157/180	eval	discard	1.549940	+0.476798	Switch TTT optimizer from SGD+momentum to AdamW(betas=(0.0,0.9), weight_decay=0): beta1=0 eliminates stale cross-chunk momentum while beta2=0.9 builds per-parameter variance estimates across chunks, giving SignSGD-like normalization in early chunk steps — handles heterogeneous quantization error across layers better than flat SGD LR.
181	157	11	000/014/030/045/054/064/082/092/109/130/157/181	loss	discard	1.084269	+0.011127	Remove exp_172's harmful z-loss and add label smoothing ε=0.02: z-loss at 1e-4 penalizes the log-partition function regardless of correctness (exp_127, exp_172 both hurt), while label_smoothing=0.02 only softens the hard-target gradient by 2% — a clean test from exp_157's baseline since exp_104's ε=0.01 result was confounded by simultaneously reverting a catastrophic per-token clamp.
182	157	11	000/014/030/045/054/064/082/092/109/130/157/182	quant	size_blocked	1.067220		MSE-optimal percentile scale selection (exp_170 approach) for all layers, plus int5 for MLP down-projection layers: keeps the ~0.008 BPB quality gain from finer quantization grids on attention/mlp-fc (int6-percentile) while switching mlp.proj to int5-percentile (still 2.5× finer than original sigma=12.85 scheme) to reduce brotli artifact size and clear the 16 MB cap.
183	157	11	000/014/030/045/054/064/082/092/109/130/157/183	reg	discard	1.084735	+0.011593	Split zero-init output projections (attn.proj + mlp.proj) into a dedicated Muon group with muon_wd_proj=0.05, down from 0.095/0.115: zero-init params must grow from zero during training and high WD continuously resists that growth — same mechanism as exp_157's embed_wd reduction for tiny-init embeddings.
188	157	11	000/014/030/045/054/064/082/092/109/130/157/188	curr	discard	1.073911	+0.000769	Stratified shard sampling: replace proportional-remaining shard selection with round-robin via shuffled shard permutation each batch step, guaranteeing all shards contribute equally to every batch (vs proportional which statistically skips ~12% of shards per step with 12 shards and 24 seqs).
189	157	11	000/014/030/045/054/064/082/092/109/130/157/189	ttt	discard	1.074228	+0.001086	Add SLOT-style logit-bias correction to TTT scoring: a [vocab_size=8192] float32 bias is zero-initialized, analytically updated each chunk via the CE gradient (model_pred_freq - target_freq, LR=0.5) using already-computed forward-pass logits (no extra backward), then applied at scoring of subsequent chunks — captures token-frequency distribution shift complementary to weight-level TTT adaptation.
190	157	11	000/014/030/045/054/064/082/092/109/130/157/190	quant	size_blocked	1.078024		Int4+percentile for all matrix layers: use MSE-optimal percentile scale selection (exp_170 approach) with int4 quantization (clip_range=7, values in [-7,7]) instead of int6+sigma. Int4+percentile step size ≈ 2.5σ/7 = 0.36σ is marginally finer than int6+sigma (12.85σ/31 = 0.41σ), so quality should match or beat baseline, while 15 distinct values vs 63 allows brotli to compress the artifact back under 16 MB.
192	157	11	000/014/030/045/054/064/082/092/109/130/157/192	quant	crash			Combined freq+loss GPTQ Hessian weighting: multiply existing per-token loss weights (exp_130) by per-token frequency weights sqrt(freq[x_t]/mean_freq), biasing Hessian accumulation toward tokens that are both uncertain (high loss) AND frequent (high BPB impact), targeting the intersection of the two previously separate gains.
200	157	11	000/014/030/045/054/064/082/092/109/130/157/200	quant	discard	1.077172	+0.004030	Combined freq+loss GPTQ Hessian weighting: multiply existing per-token loss weights by per-token frequency weights sqrt(freq[x_t]/mean_freq) — fix GPU→CPU bug from exp_192 crash, same mathematical intent: bias Hessian toward tokens that are both uncertain (high loss) AND frequent (high BPB impact).
